[I 2024-09-26 16:24:42,400] Trial 11 finished with values: [0.0, 0.959497786390856, 0.3, 0.0, 1.0458733950970363, 0.2, 1.0, 1.0841927515178462, 0.5555555555555556] and parameters: {'gamma': 78.32061053416975, 'sigma': 10.504299916916024, 'delta': 7.248270737295978, 'mean_degree': 0.49092887777137817, 'res_sz': 13, 'window': 0.23502760119330066, 'spect_rad': 0.11121452926512312, 'ridge_alpha': 4.3856910510564986e-07}. 
[I 2024-09-26 16:24:55,208] Trial 12 finished with values: [0.0, 0.9946540102101206, 0.2, 1.0, 1.0920881314387936, 0.2, 1.0, 1.0953867642431512, 0.3333333333333333] and parameters: {'gamma': 171.36782296089817, 'sigma': 28.647762628704527, 'delta': 50.05893736152195, 'mean_degree': 2.6648095643353793, 'res_sz': 23, 'window': 0.03901717132012625, 'spect_rad': 0.029197118662205552, 'ridge_alpha': 4.3534723440422294e-05}. 
[I 2024-09-26 16:25:08,221] Trial 13 finished with values: [1.0, 2000018428.7740085, 0.0, 0.0, 840035761.5771269, 1.0, 0.0, 869782052.3900497, 0.7777777777777778] and parameters: {'gamma': 468.86960388034703, 'sigma': 33.02331973680249, 'delta': 62.69790051332268, 'mean_degree': 0.3647833795002674, 'res_sz': 93, 'window': 1.8327612871351564, 'spect_rad': 0.023862534196293382, 'ridge_alpha': 0.0003438188058750107}. 
[I 2024-09-26 16:25:18,950] Trial 14 finished with values: [1.0, 1.0664748144558507, 0.2, 1.0, 1.1501922660207395, 0.3, 0.0, 1.1152542322985535, 0.4444444444444444] and parameters: {'gamma': 274.78972298012155, 'sigma': 16.13658887205436, 'delta': 71.43528883328484, 'mean_degree': 4.145797641998811, 'res_sz': 76, 'window': 0.12138386338335616, 'spect_rad': 0.0310656718956604, 'ridge_alpha': 17.06389385763546}. 
/nas/longleaf/home/djpassey/.local/lib/python3.9/site-packages/interfere/methods/reservoir_computer.py:378: RuntimeWarning: invalid value encountered in add
  self.Rhat_ += states.T @ states
/nas/longleaf/home/djpassey/.local/lib/python3.9/site-packages/interfere/methods/reservoir_computer.py:378: RuntimeWarning: overflow encountered in add
  self.Rhat_ += states.T @ states
/nas/longleaf/home/djpassey/.local/lib/python3.9/site-packages/interfere/methods/reservoir_computer.py:378: RuntimeWarning: invalid value encountered in matmul
  self.Rhat_ += states.T @ states
/nas/longleaf/home/djpassey/.local/lib/python3.9/site-packages/interfere/methods/reservoir_computer.py:379: RuntimeWarning: invalid value encountered in matmul
  self.Yhat_ += Ui[:-1, :].T @ states
[I 2024-09-26 16:25:25,783] Trial 15 finished with values: [0.0, 2688689064.100812, 0.0, 0.0, 2969974917.171208, 0.0, 0.0, 3075143936.824981, 0.0] and parameters: {'gamma': 82.3512088254131, 'sigma': 86.30019016598011, 'delta': 75.67258735864093, 'mean_degree': 2.3077234740816355, 'res_sz': 64, 'window': 7.2125187309605785, 'spect_rad': 8.398599915106034, 'ridge_alpha': 1.3019297602087939e-08}. 
[I 2024-09-26 16:25:30,374] Trial 16 finished with values: [0.0, 2688689064.100812, 0.0, 0.0, 2969974917.171208, 0.0, 0.0, 3075143936.824981, 0.0] and parameters: {'gamma': 307.9002287102461, 'sigma': 44.16576052351794, 'delta': 41.49462162819117, 'mean_degree': 2.8351673552760395, 'res_sz': 40, 'window': 86.03686916901121, 'spect_rad': 1.383074198583061, 'ridge_alpha': 0.026245498351613248}. 
 lsoda--  at t (=r1), too much accuracy requested    
       for precision of machine..  see tolsf (=r2)   
      in above,  r1 =  0.7500000000000D+01   r2 =                  NaN
 lsoda--  at t (=r1), too much accuracy requested    
       for precision of machine..  see tolsf (=r2)   
      in above,  r1 =  0.7500000000000D+01   r2 =                  NaN
 lsoda--  at t (=r1), too much accuracy requested    
       for precision of machine..  see tolsf (=r2)   
      in above,  r1 =  0.5000000000000D-01   r2 =                  NaN
 lsoda--  at t (=r1), too much accuracy requested    
       for precision of machine..  see tolsf (=r2)   
      in above,  r1 =  0.7500000000000D+01   r2 =                  NaN
 lsoda--  at t (=r1), too much accuracy requested    
       for precision of machine..  see tolsf (=r2)   
      in above,  r1 =  0.1500000000000D+03   r2 =                  NaN
 lsoda--  at t (=r1), too much accuracy requested    
       for precision of machine..  see tolsf (=r2)   
      in above,  r1 =  0.1000000000000D+01   r2 =                  NaN
 lsoda--  at t (=r1), too much accuracy requested    
       for precision of machine..  see tolsf (=r2)   
      in above,  r1 =  0.1500000000000D+03   r2 =                  NaN
 lsoda--  at t (=r1), too much accuracy requested    
       for precision of machine..  see tolsf (=r2)   
      in above,  r1 =  0.1500000000000D+03   r2 =                  NaN
 lsoda--  at t (=r1), too much accuracy requested    
       for precision of machine..  see tolsf (=r2)   
      in above,  r1 =  0.1000000000000D+01   r2 =                  NaN
 lsoda--  at t (=r1), too much accuracy requested    
       for precision of machine..  see tolsf (=r2)   
      in above,  r1 =  0.1500000000000D+03   r2 =                  NaN
 lsoda--  at t (=r1), too much accuracy requested    
       for precision of machine..  see tolsf (=r2)   
      in above,  r1 =  0.1500000000000D+03   r2 =                  NaN
 lsoda--  at t (=r1), too much accuracy requested    
       for precision of machine..  see tolsf (=r2)   
      in above,  r1 =  0.1000000000000D+01   r2 =                  NaN
 lsoda--  at t (=r1), too much accuracy requested    
       for precision of machine..  see tolsf (=r2)   
      in above,  r1 =  0.1500000000000D+03   r2 =                  NaN
 lsoda--  at t (=r1), too much accuracy requested    
       for precision of machine..  see tolsf (=r2)   
      in above,  r1 =  0.1000000000000D+01   r2 =                  NaN
 lsoda--  at t (=r1), too much accuracy requested    
       for precision of machine..  see tolsf (=r2)   
      in above,  r1 =  0.1500000000000D+03   r2 =                  NaN
 lsoda--  at t (=r1), too much accuracy requested    
       for precision of machine..  see tolsf (=r2)   
      in above,  r1 =  0.1500000000000D+03   r2 =                  NaN
 lsoda--  at t (=r1), too much accuracy requested    
       for precision of machine..  see tolsf (=r2)   
      in above,  r1 =  0.1000000000000D+01   r2 =                  NaN
 lsoda--  at t (=r1), too much accuracy requested    
       for precision of machine..  see tolsf (=r2)   
      in above,  r1 =  0.1500000000000D+03   r2 =                  NaN
 lsoda--  at t (=r1), too much accuracy requested    
       for precision of machine..  see tolsf (=r2)   
      in above,  r1 =  0.1500000000000D+03   r2 =                  NaN
 lsoda--  at t (=r1), too much accuracy requested    
       for precision of machine..  see tolsf (=r2)   
      in above,  r1 =  0.1000000000000D+01   r2 =                  NaN
 lsoda--  at t (=r1), too much accuracy requested    
       for precision of machine..  see tolsf (=r2)   
      in above,  r1 =  0.1500000000000D+03   r2 =                  NaN
 lsoda--  at t (=r1), too much accuracy requested    
       for precision of machine..  see tolsf (=r2)   
      in above,  r1 =  0.1500000000000D+03   r2 =                  NaN
 lsoda--  at t (=r1), too much accuracy requested    
       for precision of machine..  see tolsf (=r2)   
      in above,  r1 =  0.1000000000000D+01   r2 =                  NaN
[I 2024-09-26 16:25:36,021] Trial 17 finished with values: [0.0, 2688689064.100812, 0.0, 0.0, 2969974917.171208, 0.0, 0.0, 3075143936.824981, 0.0] and parameters: {'gamma': 439.7677267167563, 'sigma': 96.0578799663622, 'delta': 52.8897743231394, 'mean_degree': 0.7582645236795612, 'res_sz': 100, 'window': 22.09547130384648, 'spect_rad': 0.05540781943921615, 'ridge_alpha': 9.165255619228299e-10}. 
[I 2024-09-26 16:25:45,344] Trial 18 finished with values: [1.0, 0.8906932479065025, 0.7, 1.0, 0.9631515608408451, 0.4, 1.0, 1.1262494397260663, 0.4444444444444444] and parameters: {'gamma': 405.63977462375453, 'sigma': 94.33169304079146, 'delta': 31.471708001965965, 'mean_degree': 2.3872705906568363, 'res_sz': 13, 'window': 6.388852429853179, 'spect_rad': 30.785446949955855, 'ridge_alpha': 9.806465107834571e-06}. 
[I 2024-09-26 16:25:57,092] Trial 19 finished with values: [1.0, 1.5311986800106339, 0.0, 1.0, 1.0469550469830498, 0.3, 1.0, 2.488635730337797, 0.2222222222222222] and parameters: {'gamma': 101.88447414565047, 'sigma': 22.47670548263815, 'delta': 33.5563878103842, 'mean_degree': 2.3875673004351374, 'res_sz': 43, 'window': 0.01134365380718588, 'spect_rad': 10.591692301843281, 'ridge_alpha': 2.618622793677171e-09}. 
[I 2024-09-26 16:26:10,566] Trial 20 finished with values: [1.0, 0.9899473521889004, 0.3, 1.0, 1.0443068423506299, 0.3, 1.0, 1.1407951661134166, 0.3333333333333333] and parameters: {'gamma': 198.22327297395947, 'sigma': 9.814037309029109, 'delta': 13.359725379672494, 'mean_degree': 2.704711357367167, 'res_sz': 18, 'window': 4.3503382727627065, 'spect_rad': 0.06772383036566905, 'ridge_alpha': 1.8562596532953278e-09}. 
[I 2024-09-26 16:26:21,289] Trial 21 finished with values: [1.0, 1.1873446032593857, 0.1, 1.0, 1.1449651107634224, 0.1, 0.0, 2.6738709780083885, 0.1111111111111111] and parameters: {'gamma': 278.65854112705466, 'sigma': 58.664894490905475, 'delta': 17.91523304185048, 'mean_degree': 4.974870978880399, 'res_sz': 47, 'window': 0.030305935161003588, 'spect_rad': 0.012154865143135522, 'ridge_alpha': 0.06014915949975286}. 
[I 2024-09-26 16:26:33,242] Trial 22 finished with values: [1.0, 1.2289534056846356, 0.0, 1.0, 1.2230320518381916, 0.1, 1.0, 1.3192224905822223, 0.1111111111111111] and parameters: {'gamma': 61.79131699405437, 'sigma': 87.49081493815652, 'delta': 87.27249193667161, 'mean_degree': 2.9201472419245285, 'res_sz': 36, 'window': 0.008559535254841792, 'spect_rad': 0.16197253031260658, 'ridge_alpha': 1.7788212322526402e-09}. 
[I 2024-09-26 16:26:43,833] Trial 23 finished with values: [1.0, 0.9827717971392351, 0.4, 1.0, 1.1925127892742082, 0.3, 1.0, 1.4127842938968094, 0.2222222222222222] and parameters: {'gamma': 213.8829159988887, 'sigma': 33.570761452128, 'delta': 7.193803564094898, 'mean_degree': 3.051588628863199, 'res_sz': 33, 'window': 0.38614197432816555, 'spect_rad': 0.004255848454199228, 'ridge_alpha': 0.3087494033720316}. 
[I 2024-09-26 16:26:54,127] Trial 24 finished with values: [1.0, 1.6765848041862725, 0.0, 1.0, 6090225.4378004335, 1.0, 1.0, 8179794.638193907, 0.7777777777777778] and parameters: {'gamma': 263.663269144624, 'sigma': 40.67029014218569, 'delta': 36.07295942552189, 'mean_degree': 4.779049429521343, 'res_sz': 54, 'window': 0.006663955908788644, 'spect_rad': 0.020507240931852442, 'ridge_alpha': 0.11842672528617762}. 
[I 2024-09-26 16:27:13,181] A new study created in memory with name: SINDY predicting coupled_logistic_map(sigma=0.15)
[I 2024-09-26 16:27:18,151] Trial 0 finished with values: [3.0, 0.8598095864742544, 1.0, 6.0, 0.867737311813631, 1.0, 3.0, 12.484010896628142, 0.7777777777777778] and parameters: {'optimizer__threshold': 0.4480462940704707, 'optimizer__alpha': 0.4723336926780152, 'discrete_time': True, 'feature_library': 1, 'differentiation_method': 8}. 
[I 2024-09-26 16:27:23,532] Trial 1 finished with values: [3.0, 0.8598095864742544, 1.0, 6.0, 0.867737311813631, 1.0, 3.0, 12.484010896628142, 0.7777777777777778] and parameters: {'optimizer__threshold': 0.017691204265047656, 'optimizer__alpha': 2.6675768660886712e-05, 'discrete_time': True, 'feature_library': 1, 'differentiation_method': 5}. 
/nas/longleaf/home/djpassey/.local/lib/python3.9/site-packages/pysindy/optimizers/stlsq.py:201: UserWarning: Sparsity parameter is too big (0.1) and eliminated all coefficients
  warnings.warn(
/nas/longleaf/home/djpassey/.local/lib/python3.9/site-packages/pysindy/optimizers/stlsq.py:201: UserWarning: Sparsity parameter is too big (0.1) and eliminated all coefficients
  warnings.warn(
/nas/longleaf/home/djpassey/.local/lib/python3.9/site-packages/pysindy/optimizers/stlsq.py:201: UserWarning: Sparsity parameter is too big (0.1) and eliminated all coefficients
  warnings.warn(
/nas/longleaf/home/djpassey/.local/lib/python3.9/site-packages/pysindy/optimizers/stlsq.py:201: UserWarning: Sparsity parameter is too big (0.1) and eliminated all coefficients
  warnings.warn(
/nas/longleaf/home/djpassey/.local/lib/python3.9/site-packages/pysindy/optimizers/stlsq.py:201: UserWarning: Sparsity parameter is too big (0.1) and eliminated all coefficients
  warnings.warn(
/nas/longleaf/home/djpassey/.local/lib/python3.9/site-packages/pysindy/optimizers/stlsq.py:201: UserWarning: Sparsity parameter is too big (0.1) and eliminated all coefficients
  warnings.warn(
/nas/longleaf/home/djpassey/.local/lib/python3.9/site-packages/pysindy/optimizers/stlsq.py:201: UserWarning: Sparsity parameter is too big (0.1) and eliminated all coefficients
  warnings.warn(
/nas/longleaf/home/djpassey/.local/lib/python3.9/site-packages/pysindy/optimizers/stlsq.py:201: UserWarning: Sparsity parameter is too big (0.1) and eliminated all coefficients
  warnings.warn(
/nas/longleaf/home/djpassey/.local/lib/python3.9/site-packages/pysindy/optimizers/stlsq.py:201: UserWarning: Sparsity parameter is too big (0.1) and eliminated all coefficients
  warnings.warn(
/nas/longleaf/home/djpassey/.local/lib/python3.9/site-packages/pysindy/optimizers/stlsq.py:201: UserWarning: Sparsity parameter is too big (0.1) and eliminated all coefficients
  warnings.warn(
/nas/longleaf/home/djpassey/.local/lib/python3.9/site-packages/pysindy/optimizers/stlsq.py:201: UserWarning: Sparsity parameter is too big (0.1) and eliminated all coefficients
  warnings.warn(
/nas/longleaf/home/djpassey/.local/lib/python3.9/site-packages/pysindy/optimizers/stlsq.py:201: UserWarning: Sparsity parameter is too big (0.1) and eliminated all coefficients
  warnings.warn(
/nas/longleaf/home/djpassey/.local/lib/python3.9/site-packages/pysindy/optimizers/stlsq.py:201: UserWarning: Sparsity parameter is too big (0.1) and eliminated all coefficients
  warnings.warn(
/nas/longleaf/home/djpassey/.local/lib/python3.9/site-packages/pysindy/optimizers/stlsq.py:201: UserWarning: Sparsity parameter is too big (0.1) and eliminated all coefficients
  warnings.warn(
/nas/longleaf/home/djpassey/.local/lib/python3.9/site-packages/pysindy/optimizers/stlsq.py:201: UserWarning: Sparsity parameter is too big (0.1) and eliminated all coefficients
  warnings.warn(
/nas/longleaf/home/djpassey/.local/lib/python3.9/site-packages/pysindy/optimizers/stlsq.py:201: UserWarning: Sparsity parameter is too big (0.1) and eliminated all coefficients
  warnings.warn(
/nas/longleaf/home/djpassey/.local/lib/python3.9/site-packages/pysindy/optimizers/stlsq.py:201: UserWarning: Sparsity parameter is too big (0.1) and eliminated all coefficients
  warnings.warn(
/nas/longleaf/home/djpassey/.local/lib/python3.9/site-packages/pysindy/optimizers/stlsq.py:201: UserWarning: Sparsity parameter is too big (0.1) and eliminated all coefficients
  warnings.warn(
/nas/longleaf/home/djpassey/.local/lib/python3.9/site-packages/pysindy/optimizers/stlsq.py:201: UserWarning: Sparsity parameter is too big (0.1) and eliminated all coefficients
  warnings.warn(
/nas/longleaf/home/djpassey/.local/lib/python3.9/site-packages/pysindy/optimizers/stlsq.py:201: UserWarning: Sparsity parameter is too big (0.1) and eliminated all coefficients
  warnings.warn(
/nas/longleaf/home/djpassey/.local/lib/python3.9/site-packages/pysindy/optimizers/stlsq.py:201: UserWarning: Sparsity parameter is too big (0.1) and eliminated all coefficients
  warnings.warn(
/nas/longleaf/home/djpassey/.local/lib/python3.9/site-packages/pysindy/optimizers/stlsq.py:201: UserWarning: Sparsity parameter is too big (0.1) and eliminated all coefficients
  warnings.warn(
/nas/longleaf/home/djpassey/.local/lib/python3.9/site-packages/pysindy/optimizers/stlsq.py:201: UserWarning: Sparsity parameter is too big (0.1) and eliminated all coefficients
  warnings.warn(
/nas/longleaf/home/djpassey/.local/lib/python3.9/site-packages/pysindy/optimizers/stlsq.py:201: UserWarning: Sparsity parameter is too big (0.1) and eliminated all coefficients
  warnings.warn(
/nas/longleaf/home/djpassey/.local/lib/python3.9/site-packages/pysindy/optimizers/stlsq.py:201: UserWarning: Sparsity parameter is too big (0.1) and eliminated all coefficients
  warnings.warn(
/nas/longleaf/home/djpassey/.local/lib/python3.9/site-packages/pysindy/optimizers/stlsq.py:201: UserWarning: Sparsity parameter is too big (0.1) and eliminated all coefficients
  warnings.warn(
/nas/longleaf/home/djpassey/.local/lib/python3.9/site-packages/pysindy/optimizers/stlsq.py:201: UserWarning: Sparsity parameter is too big (0.1) and eliminated all coefficients
  warnings.warn(
/nas/longleaf/home/djpassey/.local/lib/python3.9/site-packages/pysindy/optimizers/stlsq.py:201: UserWarning: Sparsity parameter is too big (0.1) and eliminated all coefficients
  warnings.warn(
/nas/longleaf/home/djpassey/.local/lib/python3.9/site-packages/pysindy/optimizers/stlsq.py:201: UserWarning: Sparsity parameter is too big (0.1) and eliminated all coefficients
  warnings.warn(
/nas/longleaf/home/djpassey/.local/lib/python3.9/site-packages/pysindy/optimizers/stlsq.py:201: UserWarning: Sparsity parameter is too big (0.1) and eliminated all coefficients
  warnings.warn(
/nas/longleaf/home/djpassey/.local/lib/python3.9/site-packages/pysindy/optimizers/stlsq.py:201: UserWarning: Sparsity parameter is too big (0.1) and eliminated all coefficients
  warnings.warn(
/nas/longleaf/home/djpassey/.local/lib/python3.9/site-packages/pysindy/optimizers/stlsq.py:201: UserWarning: Sparsity parameter is too big (0.1) and eliminated all coefficients
  warnings.warn(
/nas/longleaf/home/djpassey/.local/lib/python3.9/site-packages/scipy/stats/_axis_nan_policy.py:551: RuntimeWarning: Precision loss occurred in moment calculation due to catastrophic cancellation. This occurs when the data are nearly identical. Results may be unreliable.
  res = hypotest_fun_out(*samples, axis=axis, **kwds)
[I 2024-09-26 16:27:29,873] Trial 2 finished with values: [1.0, 23.380752941365273, 0.0, 1.0, 3.0024652269349335, 0.1, 1.0, 3.2579736242260084, 0.2222222222222222] and parameters: {'optimizer__threshold': 0.004469993953550312, 'optimizer__alpha': 2.2766679269445214, 'discrete_time': False, 'feature_library': 0, 'differentiation_method': 6}. 
/nas/longleaf/home/djpassey/.local/lib/python3.9/site-packages/scipy/stats/_axis_nan_policy.py:551: RuntimeWarning: Precision loss occurred in moment calculation due to catastrophic cancellation. This occurs when the data are nearly identical. Results may be unreliable.
  res = hypotest_fun_out(*samples, axis=axis, **kwds)
[I 2024-09-26 16:27:36,325] Trial 3 finished with values: [1.0, 2.1301830898438836, 0.0, 1.0, 1.301378491488947, 0.1, 1.0, 6.1621816101423725, 0.0] and parameters: {'optimizer__threshold': 0.0003415791491105608, 'optimizer__alpha': 1.9369852793071098e-05, 'discrete_time': False, 'feature_library': 0, 'differentiation_method': 4}. 
/nas/longleaf/home/djpassey/.local/lib/python3.9/site-packages/scipy/stats/_axis_nan_policy.py:551: RuntimeWarning: Precision loss occurred in moment calculation due to catastrophic cancellation. This occurs when the data are nearly identical. Results may be unreliable.
  res = hypotest_fun_out(*samples, axis=axis, **kwds)
[I 2024-09-26 16:27:42,804] Trial 4 finished with values: [1.0, 1.6255439784093437, 0.1, 1.0, 1.301378491488947, 0.1, 1.0, 8.169522938949425, 0.0] and parameters: {'optimizer__threshold': 3.12086816969434, 'optimizer__alpha': 0.04283029665742219, 'discrete_time': False, 'feature_library': 0, 'differentiation_method': 3}. 
[I 2024-09-26 16:27:48,090] Trial 5 finished with values: [3.0, 0.8598095864742544, 1.0, 6.0, 0.867737311813631, 1.0, 3.0, 12.484010896628142, 0.7777777777777778] and parameters: {'optimizer__threshold': 0.039024675768647356, 'optimizer__alpha': 1.4429359094750638e-05, 'discrete_time': True, 'feature_library': 1, 'differentiation_method': 0}. 
/nas/longleaf/home/djpassey/.local/lib/python3.9/site-packages/scipy/stats/_axis_nan_policy.py:551: RuntimeWarning: Precision loss occurred in moment calculation due to catastrophic cancellation. This occurs when the data are nearly identical. Results may be unreliable.
  res = hypotest_fun_out(*samples, axis=axis, **kwds)
[I 2024-09-26 16:27:54,568] Trial 6 finished with values: [1.0, 2.1301830898438836, 0.0, 1.0, 1.301378491488947, 0.1, 1.0, 6.1621816101423725, 0.0] and parameters: {'optimizer__threshold': 0.0008539855473169624, 'optimizer__alpha': 0.00018954308549311923, 'discrete_time': False, 'feature_library': 0, 'differentiation_method': 4}. 
