[I 2024-09-26 16:27:59,897] Trial 7 finished with values: [3.0, 0.8598095864742544, 1.0, 6.0, 0.867737311813631, 1.0, 3.0, 12.484010896628142, 0.7777777777777778] and parameters: {'optimizer__threshold': 4.8142495158482055e-05, 'optimizer__alpha': 0.0076421285256117405, 'discrete_time': True, 'feature_library': 1, 'differentiation_method': 2}. 
/nas/longleaf/home/djpassey/.local/lib/python3.9/site-packages/pysindy/optimizers/stlsq.py:201: UserWarning: Sparsity parameter is too big (0.1) and eliminated all coefficients
  warnings.warn(
/nas/longleaf/home/djpassey/.local/lib/python3.9/site-packages/pysindy/optimizers/stlsq.py:201: UserWarning: Sparsity parameter is too big (0.1) and eliminated all coefficients
  warnings.warn(
/nas/longleaf/home/djpassey/.local/lib/python3.9/site-packages/pysindy/optimizers/stlsq.py:201: UserWarning: Sparsity parameter is too big (0.1) and eliminated all coefficients
  warnings.warn(
/nas/longleaf/home/djpassey/.local/lib/python3.9/site-packages/pysindy/optimizers/stlsq.py:201: UserWarning: Sparsity parameter is too big (0.1) and eliminated all coefficients
  warnings.warn(
/nas/longleaf/home/djpassey/.local/lib/python3.9/site-packages/pysindy/optimizers/stlsq.py:201: UserWarning: Sparsity parameter is too big (0.1) and eliminated all coefficients
  warnings.warn(
/nas/longleaf/home/djpassey/.local/lib/python3.9/site-packages/pysindy/optimizers/stlsq.py:201: UserWarning: Sparsity parameter is too big (0.1) and eliminated all coefficients
  warnings.warn(
/nas/longleaf/home/djpassey/.local/lib/python3.9/site-packages/scipy/stats/_axis_nan_policy.py:551: RuntimeWarning: Precision loss occurred in moment calculation due to catastrophic cancellation. This occurs when the data are nearly identical. Results may be unreliable.
  res = hypotest_fun_out(*samples, axis=axis, **kwds)
[I 2024-09-26 16:28:05,677] Trial 8 finished with values: [1.0, 6.435147617914444, 0.0, 1.0, 1.8801137282805613, 0.0, 1.0, 1.9525414240604237, 0.1111111111111111] and parameters: {'optimizer__threshold': 0.0001124652863424438, 'optimizer__alpha': 0.1660263389826854, 'discrete_time': False, 'feature_library': 1, 'differentiation_method': 6}. 
[I 2024-09-26 16:28:15,231] Trial 9 finished with values: [1.0, 56.91697918003976, 0.1, 1.0, 23.421691181418183, 0.2, 1.0, 103.66402075445664, 0.2222222222222222] and parameters: {'optimizer__threshold': 0.3289783357532897, 'optimizer__alpha': 1.357693651680319e-05, 'discrete_time': False, 'feature_library': 1, 'differentiation_method': 1}. 
[I 2024-09-26 16:28:25,414] Trial 10 finished with values: [1.0, 73.03591193655829, 0.0, 1.0, 46.668374721713725, 0.2, 1.0, 128.22514539379998, 0.0] and parameters: {'optimizer__threshold': 0.0004504759971257138, 'optimizer__alpha': 0.008569384451811468, 'discrete_time': False, 'feature_library': 1, 'differentiation_method': 3}. 
[I 2024-09-26 16:28:32,026] Trial 11 finished with values: [1.0, 1.621037841421889, 0.0, 1.0, 8.678861729424199, 0.0, 1.0, 6.404880632908003, 0.1111111111111111] and parameters: {'optimizer__threshold': 0.0002680359248811852, 'optimizer__alpha': 0.06840879556525295, 'discrete_time': False, 'feature_library': 0, 'differentiation_method': 2}. 
[I 2024-09-26 16:28:36,804] Trial 12 finished with values: [3.0, 28987.11132399492, 0.0, 4.0, 7065750.561953464, 1.0, 2.0, 392397.9665256111, 0.2222222222222222] and parameters: {'optimizer__threshold': 0.0013501873550177234, 'optimizer__alpha': 0.0062864165426918485, 'discrete_time': True, 'feature_library': 0, 'differentiation_method': 1}. 
[I 2024-09-26 16:28:42,125] Trial 13 finished with values: [3.0, 0.8598095864742544, 1.0, 6.0, 0.867737311813631, 1.0, 3.0, 12.484010896628142, 0.7777777777777778] and parameters: {'optimizer__threshold': 0.07065368510186085, 'optimizer__alpha': 0.009949391079021196, 'discrete_time': True, 'feature_library': 1, 'differentiation_method': 4}. 
/nas/longleaf/home/djpassey/.local/lib/python3.9/site-packages/pysindy/optimizers/stlsq.py:201: UserWarning: Sparsity parameter is too big (0.1) and eliminated all coefficients
  warnings.warn(
/nas/longleaf/home/djpassey/.local/lib/python3.9/site-packages/pysindy/optimizers/stlsq.py:201: UserWarning: Sparsity parameter is too big (0.1) and eliminated all coefficients
  warnings.warn(
/nas/longleaf/home/djpassey/.local/lib/python3.9/site-packages/pysindy/optimizers/stlsq.py:201: UserWarning: Sparsity parameter is too big (0.1) and eliminated all coefficients
  warnings.warn(
/nas/longleaf/home/djpassey/.local/lib/python3.9/site-packages/pysindy/optimizers/stlsq.py:201: UserWarning: Sparsity parameter is too big (0.1) and eliminated all coefficients
  warnings.warn(
/nas/longleaf/home/djpassey/.local/lib/python3.9/site-packages/pysindy/optimizers/stlsq.py:201: UserWarning: Sparsity parameter is too big (0.1) and eliminated all coefficients
  warnings.warn(
/nas/longleaf/home/djpassey/.local/lib/python3.9/site-packages/pysindy/optimizers/stlsq.py:201: UserWarning: Sparsity parameter is too big (0.1) and eliminated all coefficients
  warnings.warn(
/nas/longleaf/home/djpassey/.local/lib/python3.9/site-packages/pysindy/optimizers/stlsq.py:201: UserWarning: Sparsity parameter is too big (0.1) and eliminated all coefficients
  warnings.warn(
/nas/longleaf/home/djpassey/.local/lib/python3.9/site-packages/pysindy/optimizers/stlsq.py:201: UserWarning: Sparsity parameter is too big (0.1) and eliminated all coefficients
  warnings.warn(
/nas/longleaf/home/djpassey/.local/lib/python3.9/site-packages/pysindy/optimizers/stlsq.py:201: UserWarning: Sparsity parameter is too big (0.1) and eliminated all coefficients
  warnings.warn(
/nas/longleaf/home/djpassey/.local/lib/python3.9/site-packages/pysindy/optimizers/stlsq.py:201: UserWarning: Sparsity parameter is too big (0.1) and eliminated all coefficients
  warnings.warn(
/nas/longleaf/home/djpassey/.local/lib/python3.9/site-packages/pysindy/optimizers/stlsq.py:201: UserWarning: Sparsity parameter is too big (0.1) and eliminated all coefficients
  warnings.warn(
/nas/longleaf/home/djpassey/.local/lib/python3.9/site-packages/pysindy/optimizers/stlsq.py:201: UserWarning: Sparsity parameter is too big (0.1) and eliminated all coefficients
  warnings.warn(
/nas/longleaf/home/djpassey/.local/lib/python3.9/site-packages/pysindy/optimizers/stlsq.py:201: UserWarning: Sparsity parameter is too big (0.1) and eliminated all coefficients
  warnings.warn(
/nas/longleaf/home/djpassey/.local/lib/python3.9/site-packages/pysindy/optimizers/stlsq.py:201: UserWarning: Sparsity parameter is too big (0.1) and eliminated all coefficients
  warnings.warn(
/nas/longleaf/home/djpassey/.local/lib/python3.9/site-packages/pysindy/optimizers/stlsq.py:201: UserWarning: Sparsity parameter is too big (0.1) and eliminated all coefficients
  warnings.warn(
/nas/longleaf/home/djpassey/.local/lib/python3.9/site-packages/pysindy/optimizers/stlsq.py:201: UserWarning: Sparsity parameter is too big (0.1) and eliminated all coefficients
  warnings.warn(
/nas/longleaf/home/djpassey/.local/lib/python3.9/site-packages/pysindy/optimizers/stlsq.py:201: UserWarning: Sparsity parameter is too big (0.1) and eliminated all coefficients
  warnings.warn(
/nas/longleaf/home/djpassey/.local/lib/python3.9/site-packages/pysindy/optimizers/stlsq.py:201: UserWarning: Sparsity parameter is too big (0.1) and eliminated all coefficients
  warnings.warn(
/nas/longleaf/home/djpassey/.local/lib/python3.9/site-packages/pysindy/optimizers/stlsq.py:201: UserWarning: Sparsity parameter is too big (0.1) and eliminated all coefficients
  warnings.warn(
/nas/longleaf/home/djpassey/.local/lib/python3.9/site-packages/pysindy/optimizers/stlsq.py:201: UserWarning: Sparsity parameter is too big (0.1) and eliminated all coefficients
  warnings.warn(
/nas/longleaf/home/djpassey/.local/lib/python3.9/site-packages/pysindy/optimizers/stlsq.py:201: UserWarning: Sparsity parameter is too big (0.1) and eliminated all coefficients
  warnings.warn(
/nas/longleaf/home/djpassey/.local/lib/python3.9/site-packages/pysindy/optimizers/stlsq.py:201: UserWarning: Sparsity parameter is too big (0.1) and eliminated all coefficients
  warnings.warn(
/nas/longleaf/home/djpassey/.local/lib/python3.9/site-packages/pysindy/optimizers/stlsq.py:201: UserWarning: Sparsity parameter is too big (0.1) and eliminated all coefficients
  warnings.warn(
/nas/longleaf/home/djpassey/.local/lib/python3.9/site-packages/pysindy/optimizers/stlsq.py:201: UserWarning: Sparsity parameter is too big (0.1) and eliminated all coefficients
  warnings.warn(
/nas/longleaf/home/djpassey/.local/lib/python3.9/site-packages/pysindy/optimizers/stlsq.py:201: UserWarning: Sparsity parameter is too big (0.1) and eliminated all coefficients
  warnings.warn(
/nas/longleaf/home/djpassey/.local/lib/python3.9/site-packages/pysindy/optimizers/stlsq.py:201: UserWarning: Sparsity parameter is too big (0.1) and eliminated all coefficients
  warnings.warn(
/nas/longleaf/home/djpassey/.local/lib/python3.9/site-packages/pysindy/optimizers/stlsq.py:201: UserWarning: Sparsity parameter is too big (0.1) and eliminated all coefficients
  warnings.warn(
/nas/longleaf/home/djpassey/.local/lib/python3.9/site-packages/pysindy/optimizers/stlsq.py:201: UserWarning: Sparsity parameter is too big (0.1) and eliminated all coefficients
  warnings.warn(
/nas/longleaf/home/djpassey/.local/lib/python3.9/site-packages/pysindy/optimizers/stlsq.py:201: UserWarning: Sparsity parameter is too big (0.1) and eliminated all coefficients
  warnings.warn(
/nas/longleaf/home/djpassey/.local/lib/python3.9/site-packages/pysindy/optimizers/stlsq.py:201: UserWarning: Sparsity parameter is too big (0.1) and eliminated all coefficients
  warnings.warn(
/nas/longleaf/home/djpassey/.local/lib/python3.9/site-packages/pysindy/optimizers/stlsq.py:201: UserWarning: Sparsity parameter is too big (0.1) and eliminated all coefficients
  warnings.warn(
/nas/longleaf/home/djpassey/.local/lib/python3.9/site-packages/pysindy/optimizers/stlsq.py:201: UserWarning: Sparsity parameter is too big (0.1) and eliminated all coefficients
  warnings.warn(
/nas/longleaf/home/djpassey/.local/lib/python3.9/site-packages/scipy/stats/_axis_nan_policy.py:551: RuntimeWarning: Precision loss occurred in moment calculation due to catastrophic cancellation. This occurs when the data are nearly identical. Results may be unreliable.
  res = hypotest_fun_out(*samples, axis=axis, **kwds)
[I 2024-09-26 16:28:48,514] Trial 14 finished with values: [1.0, 23.380752941365273, 0.0, 1.0, 3.0024652269349335, 0.1, 1.0, 3.2579736242260084, 0.2222222222222222] and parameters: {'optimizer__threshold': 1.9791991317076527, 'optimizer__alpha': 0.004902797207876387, 'discrete_time': False, 'feature_library': 0, 'differentiation_method': 6}. 
[I 2024-09-26 16:28:53,307] Trial 15 finished with values: [3.0, 28987.11132399492, 0.0, 4.0, 7065750.561953464, 1.0, 2.0, 392397.9665256111, 0.2222222222222222] and parameters: {'optimizer__threshold': 1.1696151188333872, 'optimizer__alpha': 0.09191243517238547, 'discrete_time': True, 'feature_library': 0, 'differentiation_method': 8}. 
[I 2024-09-26 16:28:58,619] Trial 16 finished with values: [3.0, 0.8598095864742544, 1.0, 6.0, 0.867737311813631, 1.0, 3.0, 12.484010896628142, 0.7777777777777778] and parameters: {'optimizer__threshold': 1.3694629534062086, 'optimizer__alpha': 0.049205915032959624, 'discrete_time': True, 'feature_library': 1, 'differentiation_method': 3}. 
[I 2024-09-26 16:29:03,074] Trial 17 finished with values: [3.0, 28987.11132399492, 0.0, 4.0, 7065750.561953464, 1.0, 2.0, 392397.9665256111, 0.2222222222222222] and parameters: {'optimizer__threshold': 3.1962271450627036, 'optimizer__alpha': 0.06921987730198487, 'discrete_time': True, 'feature_library': 0, 'differentiation_method': 2}. 
[I 2024-09-26 16:29:07,948] Trial 18 finished with values: [3.0, 28987.11132399492, 0.0, 4.0, 7065750.561953464, 1.0, 2.0, 392397.9665256111, 0.2222222222222222] and parameters: {'optimizer__threshold': 0.019260695495053156, 'optimizer__alpha': 0.00989541924297601, 'discrete_time': True, 'feature_library': 0, 'differentiation_method': 5}. 
[I 2024-09-26 16:29:12,727] Trial 19 finished with values: [3.0, 28987.11132399492, 0.0, 4.0, 7065750.561953464, 1.0, 2.0, 392397.9665256111, 0.2222222222222222] and parameters: {'optimizer__threshold': 0.9022068740752318, 'optimizer__alpha': 0.2815049709352402, 'discrete_time': True, 'feature_library': 0, 'differentiation_method': 4}. 
[I 2024-09-26 16:29:18,048] Trial 20 finished with values: [3.0, 0.8598095864742544, 1.0, 6.0, 0.867737311813631, 1.0, 3.0, 12.484010896628142, 0.7777777777777778] and parameters: {'optimizer__threshold': 0.014320499724406532, 'optimizer__alpha': 0.008700380213305256, 'discrete_time': True, 'feature_library': 1, 'differentiation_method': 2}. 
[I 2024-09-26 16:29:23,349] Trial 21 finished with values: [3.0, 0.8598095864742544, 1.0, 6.0, 0.867737311813631, 1.0, 3.0, 12.484010896628142, 0.7777777777777778] and parameters: {'optimizer__threshold': 1.2179328070175355, 'optimizer__alpha': 2.9707819247269103, 'discrete_time': True, 'feature_library': 1, 'differentiation_method': 2}. 
[I 2024-09-26 16:29:29,738] Trial 22 finished with values: [1.0, 2.266089349345913, 0.0, 1.0, 6.53237312191293, 0.0, 1.0, 3.7978899043051277, 0.0] and parameters: {'optimizer__threshold': 0.28931811389625967, 'optimizer__alpha': 0.00295351742950299, 'discrete_time': False, 'feature_library': 0, 'differentiation_method': 1}. 
[I 2024-09-26 16:29:34,705] Trial 23 finished with values: [3.0, 0.8598095864742544, 1.0, 6.0, 0.867737311813631, 1.0, 3.0, 12.484010896628142, 0.7777777777777778] and parameters: {'optimizer__threshold': 1.0971266647569782, 'optimizer__alpha': 4.914704279053286, 'discrete_time': True, 'feature_library': 1, 'differentiation_method': 7}. 
[I 2024-09-26 16:29:40,095] Trial 24 finished with values: [3.0, 0.8598095864742544, 1.0, 6.0, 0.867737311813631, 1.0, 3.0, 12.484010896628142, 0.7777777777777778] and parameters: {'optimizer__threshold': 0.004119500388867625, 'optimizer__alpha': 2.8530742396881322e-05, 'discrete_time': True, 'feature_library': 1, 'differentiation_method': 6}. 
[I 2024-09-26 16:29:58,164] A new study created in memory with name: LTSFLinearForecaster predicting Belozyorov3DQuad(sigma=0.15)
[I 2024-09-26 16:30:02,878] Trial 0 finished with values: [2.0, 10.818912690496205, 0.0, 1.0, 9.344057084857571, 0.0, 1.0, 30.378431097690175, 0.5] and parameters: {'seq_len': 5, 'lr': 0.00028783647145008803, 'pred_len': 21, 'num_epochs': 50}. 
[I 2024-09-26 16:30:15,020] Trial 1 finished with values: [5.0, 12.152032501349364, 0.0, 1.0, 10.754145204788852, 0.0, 1.0, 28.799959887414847, 0.5] and parameters: {'seq_len': 3, 'lr': 4.4059586992408754e-05, 'pred_len': 23, 'num_epochs': 300}. 
[I 2024-09-26 16:30:19,218] Trial 2 finished with values: [3.0, 10.941558511692811, 0.0, 2.0, 5.918925475994257, 0.0, 1.0, 25.704319990186445, 0.5] and parameters: {'seq_len': 24, 'lr': 0.00035979337822896027, 'pred_len': 13, 'num_epochs': 50}. 
[I 2024-09-26 16:30:23,894] Trial 3 finished with values: [5.0, 20.948438592930543, 0.0, 1.0, 8.997802783170073, 0.0, 1.0, 36.20654546241859, 0.0] and parameters: {'seq_len': 6, 'lr': 5.8580434355983186e-05, 'pred_len': 1, 'num_epochs': 50}. 
[I 2024-09-26 16:30:35,952] Trial 4 finished with values: [4.0, 268.50492977333033, 0.0, 2.0, 20.029341027102955, 0.0, 3.0, 44.53413819463014, 1.0] and parameters: {'seq_len': 8, 'lr': 0.008738682924428042, 'pred_len': 16, 'num_epochs': 300}. 
[I 2024-09-26 16:30:40,301] Trial 5 finished with values: [5.0, 11.071449354983393, 0.0, 2.0, 7.7682940214707505, 0.0, 3.0, 23.07590750697161, 0.5] and parameters: {'seq_len': 7, 'lr': 0.030040450476080623, 'pred_len': 1, 'num_epochs': 50}. 
[I 2024-09-26 16:30:46,345] Trial 6 finished with values: [4.0, 11.75010948882969, 0.0, 1.0, 10.378391788064954, 0.3333333333333333, 1.0, 30.628041704626106, 0.5] and parameters: {'seq_len': 9, 'lr': 2.3368284211429843e-05, 'pred_len': 7, 'num_epochs': 100}. 
[I 2024-09-26 16:30:51,189] Trial 7 finished with values: [5.0, 11.958297580479694, 0.0, 1.0, 10.513781426291237, 0.0, 1.0, 34.954009529682125, 0.0] and parameters: {'seq_len': 4, 'lr': 0.0003431932161495761, 'pred_len': 9, 'num_epochs': 50}. 
[I 2024-09-26 16:31:03,781] Trial 8 finished with values: [5.0, 11.343008276935745, 0.0, 2.0, 5.564767659503601, 0.0, 2.0, 36.820971613719934, 1.0] and parameters: {'seq_len': 13, 'lr': 0.0171117505874228, 'pred_len': 4, 'num_epochs': 300}. 
[I 2024-09-26 16:31:16,636] Trial 9 finished with values: [5.0, 11.478268300818744, 0.3333333333333333, 2.0, 6.884691270094305, 0.0, 2.0, 23.835473996378298, 0.5] and parameters: {'seq_len': 11, 'lr': 0.0010657154672010635, 'pred_len': 6, 'num_epochs': 300}. 
[I 2024-09-26 16:31:28,683] Trial 10 finished with values: [5.0, 11.588487005504424, 0.3333333333333333, 2.0, 6.306751767106041, 0.0, 2.0, 23.071772035526767, 0.5] and parameters: {'seq_len': 21, 'lr': 0.0007434804609942612, 'pred_len': 5, 'num_epochs': 300}. 
[I 2024-09-26 16:31:39,156] Trial 11 finished with values: [5.0, 13.013994080267372, 0.3333333333333333, 1.0, 6.453669824591111, 0.0, 1.0, 24.821611426104546, 0.0] and parameters: {'seq_len': 22, 'lr': 0.00011160414606947219, 'pred_len': 25, 'num_epochs': 300}. 
[I 2024-09-26 16:31:43,347] Trial 12 finished with values: [5.0, 21.544474353660398, 0.0, 1.0, 5.2633385723148844, 0.0, 1.0, 25.549954013590693, 0.0] and parameters: {'seq_len': 24, 'lr': 2.0028428246477917e-05, 'pred_len': 1, 'num_epochs': 50}. 
[I 2024-09-26 16:31:54,812] Trial 13 finished with values: [5.0, 11.908870625015071, 0.0, 1.0, 5.965534505738628, 0.0, 1.0, 24.139455810790757, 0.0] and parameters: {'seq_len': 18, 'lr': 6.954003436248633e-05, 'pred_len': 22, 'num_epochs': 300}. 
[I 2024-09-26 16:31:58,951] Trial 14 finished with values: [3.0, 11.181503779282252, 0.0, 1.0, 7.029417393838793, 0.0, 1.0, 31.31090116830346, 0.0] and parameters: {'seq_len': 24, 'lr': 1.1827743798339169e-05, 'pred_len': 19, 'num_epochs': 50}. 
[I 2024-09-26 16:32:11,534] Trial 15 finished with values: [5.0, 11.039274854156636, 0.0, 2.0, 7.1624270705196205, 0.0, 2.0, 23.886700458192472, 0.5] and parameters: {'seq_len': 9, 'lr': 0.00025733777621111915, 'pred_len': 12, 'num_epochs': 300}. 
[I 2024-09-26 16:32:16,111] Trial 16 finished with values: [4.0, 11.84371813368985, 0.0, 1.0, 10.023324973216187, 0.0, 1.0, 30.80735264427994, 0.0] and parameters: {'seq_len': 21, 'lr': 1.4475231768768676e-05, 'pred_len': 15, 'num_epochs': 50}. 
[I 2024-09-26 16:32:27,715] Trial 17 finished with values: [5.0, 16.383658016026594, 0.0, 2.0, 8.828086868055147, 0.3333333333333333, 2.0, 12.61468530523055, 0.5] and parameters: {'seq_len': 17, 'lr': 0.003968075640759995, 'pred_len': 21, 'num_epochs': 300}. 
[I 2024-09-26 16:32:39,870] Trial 18 finished with values: [5.0, 11.529077931048118, 0.3333333333333333, 2.0, 6.236161637626092, 0.0, 2.0, 16.262230277183427, 0.5] and parameters: {'seq_len': 19, 'lr': 0.008328832876041001, 'pred_len': 7, 'num_epochs': 300}. 
[I 2024-09-26 16:32:44,341] Trial 19 finished with values: [5.0, 11.389391080448195, 0.0, 2.0, 4.903224738250995, 0.0, 2.0, 101.18672098712045, 1.0] and parameters: {'seq_len': 23, 'lr': 0.011874898864231553, 'pred_len': 23, 'num_epochs': 50}. 
[I 2024-09-26 16:32:48,434] Trial 20 finished with values: [3.0, 10.983061209481203, 0.0, 1.0, 6.233145871719236, 0.0, 1.0, 21.46589522990497, 0.5] and parameters: {'seq_len': 21, 'lr': 0.0005636130166158009, 'pred_len': 22, 'num_epochs': 50}. 
[I 2024-09-26 16:33:00,517] Trial 21 finished with values: [5.0, 11.322883642527279, 0.0, 2.0, 6.64667994401283, 0.0, 2.0, 21.802153973314635, 0.5] and parameters: {'seq_len': 13, 'lr': 0.0022861766394148076, 'pred_len': 10, 'num_epochs': 300}. 
[I 2024-09-26 16:33:07,030] Trial 22 finished with values: [4.0, 10.934063944775268, 0.0, 2.0, 7.356868246391316, 0.0, 3.0, 21.80826111120208, 0.5] and parameters: {'seq_len': 6, 'lr': 0.0030217955552999313, 'pred_len': 4, 'num_epochs': 100}. 
[I 2024-09-26 16:33:18,156] Trial 23 finished with values: [4.0, 3461017.7992250426, 0.0, 2.0, 873.1418894988498, 0.0, 2.0, 1489.165510079125, 1.0] and parameters: {'seq_len': 17, 'lr': 0.017168915290319643, 'pred_len': 24, 'num_epochs': 300}. 
[I 2024-09-26 16:33:24,334] Trial 24 finished with values: [3.0, 10.930460755206024, 0.0, 1.0, 8.080361723951498, 0.0, 2.0, 27.09645583123945, 0.5] and parameters: {'seq_len': 8, 'lr': 0.0003667480113259064, 'pred_len': 4, 'num_epochs': 100}. 
[I 2024-09-26 16:33:39,426] A new study created in memory with name: VAR predicting Belozyorov3DQuad(sigma=0.15)
[I 2024-09-26 16:33:41,090] Trial 0 finished with values: [2.0, 23.403504664381096, 0.0, 7.0, 4.852159114167576, 0.3333333333333333, 1.0, 1361.4998816465643, 1.0] and parameters: {'ic': 'aic', 'maxlags': 1, 'trend': 'ctt'}. 
[I 2024-09-26 16:33:43,081] Trial 1 finished with values: [2.0, 3.721400622498999, 1.0, 5.0, 2.850814973986319, 1.0, 1.0, 185.15716410050348, 1.0] and parameters: {'ic': 'fpe', 'maxlags': 3, 'trend': 'c'}. 
[I 2024-09-26 16:33:44,680] Trial 2 finished with values: [4.0, 10.589929879222979, 0.0, 6.0, 4.763118232019779, 0.3333333333333333, 1.0, 43.96939356340895, 1.0] and parameters: {'ic': 'fpe', 'maxlags': 5, 'trend': 'n'}. 
[I 2024-09-26 16:33:46,288] Trial 3 finished with values: [2.0, 12.157357710533974, 0.0, 4.0, 3.626109723919004, 0.3333333333333333, 1.0, 1114.392952470824, 1.0] and parameters: {'ic': 'fpe', 'maxlags': 5, 'trend': 'ctt'}. 
[I 2024-09-26 16:33:48,207] Trial 4 finished with values: [2.0, 3.9709214735490836, 1.0, 5.0, 3.2737849450254672, 1.0, 1.0, 15.115148425954429, 1.0] and parameters: {'ic': 'fpe', 'maxlags': 2, 'trend': 'c'}. 
[I 2024-09-26 16:33:49,823] Trial 5 finished with values: [2.0, 3.9709214735490836, 1.0, 5.0, 3.2737849450254672, 1.0, 1.0, 15.115148425954429, 1.0] and parameters: {'ic': 'fpe', 'maxlags': 2, 'trend': 'c'}. 
