[I 2024-09-25 16:49:52,250] Trial 22 finished with values: [1.0, 0.9252932914469595, 1.0, 3.0, 0.8473231222147367, 1.0, 1.0, 2.217623543462733, 0.6666666666666666] and parameters: {'h': 12, 'n_pool_kernel_size': [2, 2, 2], 'n_freq_downsample': [24, 12, 1], 'learning_rate': 0.0063765406023187495, 'scaler_type': None, 'max_steps': 1100.0, 'batch_size': 128, 'windows_batch_size': 1024, 'random_seed': 14}. 
SLURM auto-requeueing enabled. Setting signal handlers.
SLURM auto-requeueing enabled. Setting signal handlers.
SLURM auto-requeueing enabled. Setting signal handlers.
SLURM auto-requeueing enabled. Setting signal handlers.
SLURM auto-requeueing enabled. Setting signal handlers.
SLURM auto-requeueing enabled. Setting signal handlers.
SLURM auto-requeueing enabled. Setting signal handlers.
SLURM auto-requeueing enabled. Setting signal handlers.
SLURM auto-requeueing enabled. Setting signal handlers.
SLURM auto-requeueing enabled. Setting signal handlers.
SLURM auto-requeueing enabled. Setting signal handlers.
SLURM auto-requeueing enabled. Setting signal handlers.
SLURM auto-requeueing enabled. Setting signal handlers.
SLURM auto-requeueing enabled. Setting signal handlers.
SLURM auto-requeueing enabled. Setting signal handlers.
SLURM auto-requeueing enabled. Setting signal handlers.
SLURM auto-requeueing enabled. Setting signal handlers.
SLURM auto-requeueing enabled. Setting signal handlers.
SLURM auto-requeueing enabled. Setting signal handlers.
SLURM auto-requeueing enabled. Setting signal handlers.
[I 2024-09-25 16:57:40,986] Trial 23 finished with values: [1.0, 6586.421114234963, 0.0, 1.0, 117.46065205654395, 0.0, 1.0, 940.0772513936912, 0.0] and parameters: {'h': 15, 'n_pool_kernel_size': [2, 2, 1], 'n_freq_downsample': [180, 60, 1], 'learning_rate': 0.07074205171722914, 'scaler_type': 'robust', 'max_steps': 900.0, 'batch_size': 64, 'windows_batch_size': 1024, 'random_seed': 2}. 
SLURM auto-requeueing enabled. Setting signal handlers.
SLURM auto-requeueing enabled. Setting signal handlers.
SLURM auto-requeueing enabled. Setting signal handlers.
SLURM auto-requeueing enabled. Setting signal handlers.
SLURM auto-requeueing enabled. Setting signal handlers.
SLURM auto-requeueing enabled. Setting signal handlers.
SLURM auto-requeueing enabled. Setting signal handlers.
SLURM auto-requeueing enabled. Setting signal handlers.
SLURM auto-requeueing enabled. Setting signal handlers.
SLURM auto-requeueing enabled. Setting signal handlers.
SLURM auto-requeueing enabled. Setting signal handlers.
SLURM auto-requeueing enabled. Setting signal handlers.
SLURM auto-requeueing enabled. Setting signal handlers.
SLURM auto-requeueing enabled. Setting signal handlers.
SLURM auto-requeueing enabled. Setting signal handlers.
SLURM auto-requeueing enabled. Setting signal handlers.
SLURM auto-requeueing enabled. Setting signal handlers.
SLURM auto-requeueing enabled. Setting signal handlers.
SLURM auto-requeueing enabled. Setting signal handlers.
SLURM auto-requeueing enabled. Setting signal handlers.
SLURM auto-requeueing enabled. Setting signal handlers.
SLURM auto-requeueing enabled. Setting signal handlers.
SLURM auto-requeueing enabled. Setting signal handlers.
SLURM auto-requeueing enabled. Setting signal handlers.
SLURM auto-requeueing enabled. Setting signal handlers.
SLURM auto-requeueing enabled. Setting signal handlers.
SLURM auto-requeueing enabled. Setting signal handlers.
SLURM auto-requeueing enabled. Setting signal handlers.
SLURM auto-requeueing enabled. Setting signal handlers.
SLURM auto-requeueing enabled. Setting signal handlers.
SLURM auto-requeueing enabled. Setting signal handlers.
SLURM auto-requeueing enabled. Setting signal handlers.
SLURM auto-requeueing enabled. Setting signal handlers.
SLURM auto-requeueing enabled. Setting signal handlers.
SLURM auto-requeueing enabled. Setting signal handlers.
SLURM auto-requeueing enabled. Setting signal handlers.
SLURM auto-requeueing enabled. Setting signal handlers.
SLURM auto-requeueing enabled. Setting signal handlers.
SLURM auto-requeueing enabled. Setting signal handlers.
SLURM auto-requeueing enabled. Setting signal handlers.
SLURM auto-requeueing enabled. Setting signal handlers.
SLURM auto-requeueing enabled. Setting signal handlers.
SLURM auto-requeueing enabled. Setting signal handlers.
SLURM auto-requeueing enabled. Setting signal handlers.
SLURM auto-requeueing enabled. Setting signal handlers.
[I 2024-09-25 17:00:18,372] Trial 24 finished with values: [1.0, 1.216636075955061, 0.2, 1.0, 0.9558602259272275, 0.2, 1.0, 2.392518882638451, 0.1111111111111111] and parameters: {'h': 6, 'n_pool_kernel_size': [16, 8, 1], 'n_freq_downsample': [1, 1, 1], 'learning_rate': 0.0006292838696947627, 'scaler_type': 'standard', 'max_steps': 1100.0, 'batch_size': 32, 'windows_batch_size': 128, 'random_seed': 18}. 
[I 2024-09-25 17:00:21,896] A new study created in memory with name: ResComp predicting coupled_logistic_map(sigma=0.00)
/nas/longleaf/home/djpassey/.local/lib/python3.9/site-packages/scipy/integrate/_odepack_py.py:248: ODEintWarning: Excess work done on this call (perhaps wrong Dfun type). Run with full_output = 1 to get quantitative information.
  warnings.warn(warning_msg, ODEintWarning)
[I 2024-09-25 17:00:35,588] Trial 0 finished with values: [1.0, 1.6297233645345672, 0.1, 1.0, 1.159434113546719, 0.2, 1.0, 2.4088191555310434, 0.2222222222222222] and parameters: {'gamma': 312.3004780692954, 'sigma': 87.19370436190957, 'delta': 19.753567421483424, 'mean_degree': 0.6262731217915922, 'res_sz': 62, 'window': 1.5811700808803153, 'spect_rad': 0.00548124669983968, 'ridge_alpha': 0.0004118302801972119}. 
[I 2024-09-25 17:00:48,266] Trial 1 finished with values: [1.0, 1.0331464772786876, 0.0, 1.0, 1.006741655817336, 0.3, 1.0, 2.1412062493229613, 0.2222222222222222] and parameters: {'gamma': 188.13266685238847, 'sigma': 94.23597766739015, 'delta': 99.68936364507456, 'mean_degree': 3.1551371233531706, 'res_sz': 13, 'window': 0.5360357366750507, 'spect_rad': 2.4136049340853383, 'ridge_alpha': 0.6439507182378419}. 
[I 2024-09-25 17:00:59,120] Trial 2 finished with values: [1.0, 1.518580843969287, 0.0, 1.0, 1.1226460222651298, 0.1, 2.0, 2.2161818854611792, 0.3333333333333333] and parameters: {'gamma': 258.8512546074204, 'sigma': 62.976466238356544, 'delta': 14.056625854912527, 'mean_degree': 3.0945540606618613, 'res_sz': 48, 'window': 0.6183615869234182, 'spect_rad': 0.4140827527298722, 'ridge_alpha': 9.62817068671494e-07}. 
[I 2024-09-25 17:01:09,294] Trial 3 finished with values: [1.0, 19.646796625352607, 0.0, 1.0, 20.181643927795797, 0.0, 1.0, 2.7136002757918756, 0.2222222222222222] and parameters: {'gamma': 431.8508023659448, 'sigma': 2.93601261756857, 'delta': 18.533264016048076, 'mean_degree': 1.1009031419581514, 'res_sz': 36, 'window': 0.39126261816267427, 'spect_rad': 0.0183398986465883, 'ridge_alpha': 8.642831336486599e-05}. 
[I 2024-09-25 17:01:20,425] Trial 4 finished with values: [1.0, 2.4238566008927744, 0.0, 7.0, 0.9228821209556508, 0.2, 2.0, 20.337710249603415, 0.2222222222222222] and parameters: {'gamma': 218.28408330707543, 'sigma': 32.94525016444799, 'delta': 13.47922644143166, 'mean_degree': 4.28577715180809, 'res_sz': 95, 'window': 0.004523162244907406, 'spect_rad': 15.231230023105258, 'ridge_alpha': 4.495818384197719e-05}. 
[I 2024-09-25 17:01:31,382] Trial 5 finished with values: [1.0, 2.4190501253726513, 0.0, 2.0, 1.0085009659871862, 0.1, 1.0, 2.221127254761771, 0.1111111111111111] and parameters: {'gamma': 112.4962723742921, 'sigma': 69.33400691922546, 'delta': 14.427726871708533, 'mean_degree': 0.32802645243223655, 'res_sz': 89, 'window': 0.09847883058456579, 'spect_rad': 0.558771505500183, 'ridge_alpha': 15.61324267483606}. 
[I 2024-09-25 17:01:44,500] Trial 6 finished with values: [1.0, 1.3103603879975632, 0.1, 1.0, 0.9509803330974855, 0.1, 1.0, 1.9507509312817062, 0.6666666666666666] and parameters: {'gamma': 122.44720814862717, 'sigma': 40.16839844895687, 'delta': 95.4269107611444, 'mean_degree': 4.958182857271212, 'res_sz': 23, 'window': 0.046327825393089245, 'spect_rad': 0.002183410575249459, 'ridge_alpha': 0.001299992169657233}. 
[I 2024-09-25 17:01:55,359] Trial 7 finished with values: [1.0, 3779.4055789142553, 1.0, 2.0, 353081961.6530236, 1.0, 1.0, 2.179160918746421, 0.0] and parameters: {'gamma': 449.88172344436816, 'sigma': 55.76683797488238, 'delta': 77.8787805599913, 'mean_degree': 2.8795903987896643, 'res_sz': 37, 'window': 0.008320608969746556, 'spect_rad': 27.253141489237084, 'ridge_alpha': 3.7663495010934413e-07}. 
[I 2024-09-25 17:02:06,554] Trial 8 finished with values: [1.0, 1.6304366527714291, 0.1, 26.0, 0.83578871941107, 0.4, 0.0, 17.464695742588003, 0.1111111111111111] and parameters: {'gamma': 347.83047739141864, 'sigma': 55.81018106704621, 'delta': 97.2643652470776, 'mean_degree': 4.915956145325395, 'res_sz': 32, 'window': 0.007201460766252663, 'spect_rad': 0.02699176262054568, 'ridge_alpha': 3.367764916730129e-08}. 
[I 2024-09-25 17:02:20,243] Trial 9 finished with values: [1.0, 3187087425.9989805, 0.0, 1.0, 3325414834.402416, 0.0, 1.0, 9.60487986961866, 0.1111111111111111] and parameters: {'gamma': 328.73853111175504, 'sigma': 1.9610799288055867, 'delta': 37.73175209747247, 'mean_degree': 0.5310604083285587, 'res_sz': 82, 'window': 1.3480880450857742, 'spect_rad': 29.008578229449768, 'ridge_alpha': 0.0020839229774385197}. 
[I 2024-09-25 17:02:31,136] Trial 10 finished with values: [1.0, 1.0677166045422328, 0.0, 2.0, 1.0874490594351827, 0.0, 1.0, 2.233988697227045, 0.4444444444444444] and parameters: {'gamma': 413.27340567530905, 'sigma': 25.605478488764337, 'delta': 71.39765843691207, 'mean_degree': 1.5209129676005781, 'res_sz': 93, 'window': 0.11956913496599329, 'spect_rad': 0.0031687231383518127, 'ridge_alpha': 2.0426403273291633}. 
[I 2024-09-25 17:02:41,878] Trial 11 finished with values: [1.0, 1.6377784511011644, 0.0, 2.0, 725665381.6572361, 1.0, 0.0, 1010090658.2364728, 0.6666666666666666] and parameters: {'gamma': 202.27065225980024, 'sigma': 75.39727547592896, 'delta': 90.14574393428478, 'mean_degree': 3.787024277787511, 'res_sz': 98, 'window': 0.017624353617627236, 'spect_rad': 1.0573423410697695, 'ridge_alpha': 2.546234595858821e-05}. 
/nas/longleaf/home/djpassey/.local/lib/python3.9/site-packages/interfere/methods/reservoir_computer.py:480: RuntimeWarning: invalid value encountered in matmul
  pred = self.W_out_ @ states.T
[I 2024-09-25 17:02:50,891] Trial 12 finished with values: [1.0, 3187087425.996866, 0.0, 1.0, 27.96245163592643, 0.0, 1.0, 2.347097969954575, 0.2222222222222222] and parameters: {'gamma': 36.17781418249372, 'sigma': 9.01473113526346, 'delta': 20.692165003247503, 'mean_degree': 3.408964992936064, 'res_sz': 65, 'window': 0.06807037293266843, 'spect_rad': 0.08097885286241646, 'ridge_alpha': 2.399955818181253e-05}. 
[I 2024-09-25 17:03:04,424] Trial 13 finished with values: [1.0, 3212686933.0385323, 0.0, 1.0, 3204449915.6983957, 0.0, 1.0, 4460418650.791906, 0.0] and parameters: {'gamma': 27.93275319637383, 'sigma': 87.97064576590907, 'delta': 17.108500614673034, 'mean_degree': 0.8929961586185902, 'res_sz': 76, 'window': 1.1072612855353245, 'spect_rad': 30.206212436812738, 'ridge_alpha': 1.0991502461753543e-05}. 
[I 2024-09-25 17:03:14,109] Trial 14 finished with values: [0.0, 2.4248895394245773, 0.0, 0.0, 2.5237917814005923, 0.0, 0.0, 2.7466717121883635, 0.3333333333333333] and parameters: {'gamma': 498.210884620201, 'sigma': 67.00769715704553, 'delta': 1.6785617162829563, 'mean_degree': 1.716088945669113, 'res_sz': 92, 'window': 3.574419935828156, 'spect_rad': 0.08019207687507204, 'ridge_alpha': 3.4323118908521795e-10}. 
[I 2024-09-25 17:03:27,703] Trial 15 finished with values: [1.0, 1.6304682045459569, 0.1, 2.0, 1.0384328101697944, 0.2, 1.0, 2.046823055144828, 0.4444444444444444] and parameters: {'gamma': 172.4618125503407, 'sigma': 83.9835168419411, 'delta': 55.24102597346753, 'mean_degree': 0.4974165664272847, 'res_sz': 28, 'window': 0.23017326086487197, 'spect_rad': 0.3263079420031925, 'ridge_alpha': 7.947872355686692e-10}. 
[I 2024-09-25 17:03:41,466] Trial 16 finished with values: [1.0, 2918769530.7511134, 0.0, 1.0, 0.9380050567929381, 0.2, 0.0, 2.463379244936309, 0.1111111111111111] and parameters: {'gamma': 126.24264035250448, 'sigma': 75.81293214973452, 'delta': 92.96868369678417, 'mean_degree': 0.9286105373904754, 'res_sz': 37, 'window': 0.009541516201604115, 'spect_rad': 0.06517539275139338, 'ridge_alpha': 2.9012825244079283e-06}. 
[I 2024-09-25 17:03:52,370] Trial 17 finished with values: [1.0, 7.653613324743267, 0.2, 2.0, 3403670596.0831404, 0.0, 1.0, 1.9724514801026403, 0.2222222222222222] and parameters: {'gamma': 235.24901608115837, 'sigma': 61.666657788590896, 'delta': 66.8953729889282, 'mean_degree': 1.6585409947516998, 'res_sz': 89, 'window': 0.7171081232172503, 'spect_rad': 1.2928883693288407, 'ridge_alpha': 29.71997386456299}. 
/nas/longleaf/home/djpassey/.local/lib/python3.9/site-packages/interfere/methods/reservoir_computer.py:378: RuntimeWarning: overflow encountered in matmul
  self.Rhat_ += states.T @ states
/nas/longleaf/home/djpassey/.local/lib/python3.9/site-packages/scipy/integrate/_odepack_py.py:248: ODEintWarning: Excess accuracy requested (tolerances too small). Run with full_output = 1 to get quantitative information.
  warnings.warn(warning_msg, ODEintWarning)
/nas/longleaf/home/djpassey/.local/lib/python3.9/site-packages/scipy/stats/_axis_nan_policy.py:551: RuntimeWarning: Precision loss occurred in moment calculation due to catastrophic cancellation. This occurs when the data are nearly identical. Results may be unreliable.
  res = hypotest_fun_out(*samples, axis=axis, **kwds)
[I 2024-09-25 17:03:58,418] Trial 18 finished with values: [0.0, 3505328822.583711, 0.0, 0.0, 3628325046.62378, 0.0, 0.0, 5050429600.94325, 0.0] and parameters: {'gamma': 332.1681562004783, 'sigma': 57.22188981641103, 'delta': 31.384227954470195, 'mean_degree': 2.4797078076591395, 'res_sz': 50, 'window': 16.473887547984724, 'spect_rad': 45.72074521083565, 'ridge_alpha': 4.64584803183289}. 
[I 2024-09-25 17:04:11,715] Trial 19 finished with values: [1.0, 0.8438921784763083, 0.5, 2.0, 0.9390917399836559, 0.1, 1.0, 2.118705696171742, 0.2222222222222222] and parameters: {'gamma': 389.9330232279275, 'sigma': 75.77405620979562, 'delta': 21.248562134146905, 'mean_degree': 3.6590428557821797, 'res_sz': 20, 'window': 0.017157267375210967, 'spect_rad': 0.36544855635358725, 'ridge_alpha': 13.04865700825163}. 
[I 2024-09-25 17:04:22,624] Trial 20 finished with values: [1.0, 3148297898.526217, 0.0, 2.0, 1.0332626645762737, 0.1, 0.0, 3.8917912365299454, 0.3333333333333333] and parameters: {'gamma': 499.18431734315834, 'sigma': 79.87656045126228, 'delta': 95.6172834998638, 'mean_degree': 4.150088767784317, 'res_sz': 69, 'window': 2.1116461973346077, 'spect_rad': 0.7780317302427809, 'ridge_alpha': 0.8099674477821055}. 
[I 2024-09-25 17:04:30,627] Trial 21 finished with values: [0.0, 3505328822.583711, 0.0, 0.0, 3628325046.62378, 0.0, 0.0, 5050429600.94325, 0.0] and parameters: {'gamma': 150.7190757580023, 'sigma': 34.561640522325106, 'delta': 15.54823477705536, 'mean_degree': 0.44973658885979284, 'res_sz': 83, 'window': 4.974302559789351, 'spect_rad': 4.9705500653635495, 'ridge_alpha': 7.706611584103819e-05}. 
[I 2024-09-25 17:04:41,332] Trial 22 finished with values: [1.0, 1.6307465153501852, 0.1, 1.0, 1.0582520478139128, 0.2, 1.0, 2.276167673338795, 0.2222222222222222] and parameters: {'gamma': 271.2404931147435, 'sigma': 52.795327139003604, 'delta': 26.711982885872192, 'mean_degree': 3.9475667986320038, 'res_sz': 51, 'window': 2.902346921848937, 'spect_rad': 0.027262337083722162, 'ridge_alpha': 0.001765966114908643}. 
[I 2024-09-25 17:04:48,648] Trial 23 finished with values: [0.0, 3095822591.8888826, 0.0, 0.0, 3245272579.489555, 0.0, 0.0, 5050429600.94325, 0.0] and parameters: {'gamma': 72.50442545498326, 'sigma': 84.72937496035111, 'delta': 68.19723283999649, 'mean_degree': 1.9957953678686298, 'res_sz': 60, 'window': 7.074861710881836, 'spect_rad': 0.9617825991135927, 'ridge_alpha': 0.00017396384603053072}. 
/nas/longleaf/home/djpassey/.local/lib/python3.9/site-packages/interfere/methods/reservoir_computer.py:378: RuntimeWarning: invalid value encountered in matmul
  self.Rhat_ += states.T @ states
/nas/longleaf/home/djpassey/.local/lib/python3.9/site-packages/interfere/methods/reservoir_computer.py:378: RuntimeWarning: invalid value encountered in add
  self.Rhat_ += states.T @ states
[I 2024-09-25 17:04:54,129] Trial 24 finished with values: [0.0, 3505328822.583711, 0.0, 0.0, 3628325046.62378, 0.0, 0.0, 5050429600.94325, 0.0] and parameters: {'gamma': 444.63017151979943, 'sigma': 89.97023301154965, 'delta': 74.82630755824893, 'mean_degree': 2.3705233445707288, 'res_sz': 82, 'window': 42.957449545140896, 'spect_rad': 86.11454350616975, 'ridge_alpha': 10.911272730144491}. 
[I 2024-09-25 17:04:59,069] A new study created in memory with name: SINDY predicting coupled_logistic_map(sigma=0.00)
[I 2024-09-25 17:05:08,305] Trial 0 finished with values: [1.0, 87.52650748464013, 0.0, 1.0, 36.990652945205085, 0.1, 1.0, 96.15429171173842, 0.2222222222222222] and parameters: {'optimizer__threshold': 1.6089281394133497, 'optimizer__alpha': 0.0033551558362929636, 'discrete_time': False, 'feature_library': 1, 'differentiation_method': 0}. 
[I 2024-09-25 17:05:13,885] Trial 1 finished with values: [2.0, 1.1059732796530453, 1.0, 10.0, 0.6656580497573625, 1.0, 2.0, 7.113567562666472, 0.5555555555555556] and parameters: {'optimizer__threshold': 0.017698298191160238, 'optimizer__alpha': 0.13512609005581408, 'discrete_time': True, 'feature_library': 1, 'differentiation_method': 0}. 
[I 2024-09-25 17:05:19,447] Trial 2 finished with values: [2.0, 1.1059732796530453, 1.0, 10.0, 0.6656580497573625, 1.0, 2.0, 7.113567562666472, 0.5555555555555556] and parameters: {'optimizer__threshold': 1.7521300759781934e-05, 'optimizer__alpha': 1.2679315367486456e-05, 'discrete_time': True, 'feature_library': 1, 'differentiation_method': 5}. 
[I 2024-09-25 17:05:30,265] Trial 3 finished with values: [1.0, 58.36143684969872, 0.1, 1.0, 49.57403202519095, 0.0, 1.0, 145.6108737304128, 0.3333333333333333] and parameters: {'optimizer__threshold': 0.03871863090301594, 'optimizer__alpha': 0.16230123087192994, 'discrete_time': False, 'feature_library': 1, 'differentiation_method': 4}. 
[I 2024-09-25 17:05:36,236] Trial 4 finished with values: [10.0, 0.7006840436317091, 0.6, 49.0, 0.47044621562922095, 1.0, 5.0, 1.5377273763970356, 0.8888888888888888] and parameters: {'optimizer__threshold': 0.045110556876540635, 'optimizer__alpha': 3.504899848203852, 'discrete_time': True, 'feature_library': 0, 'differentiation_method': 1}. 
[I 2024-09-25 17:05:47,784] Trial 5 finished with values: [1.0, 75.81450451383385, 0.2, 1.0, 47.933718254906736, 0.2, 1.0, 203.41026162285823, 0.2222222222222222] and parameters: {'optimizer__threshold': 0.008078251013997765, 'optimizer__alpha': 1.0219118401013847, 'discrete_time': False, 'feature_library': 1, 'differentiation_method': 3}. 
[I 2024-09-25 17:05:58,898] Trial 6 finished with values: [1.0, 112.66251156877338, 0.0, 1.0, 55.09474969499913, 0.1, 1.0, 178.4886017678997, 0.3333333333333333] and parameters: {'optimizer__threshold': 0.0016371938424176889, 'optimizer__alpha': 0.006180196737446829, 'discrete_time': False, 'feature_library': 1, 'differentiation_method': 2}. 
/nas/longleaf/home/djpassey/.local/lib/python3.9/site-packages/pysindy/optimizers/stlsq.py:201: UserWarning: Sparsity parameter is too big (0.1) and eliminated all coefficients
  warnings.warn(
/nas/longleaf/home/djpassey/.local/lib/python3.9/site-packages/pysindy/optimizers/stlsq.py:201: UserWarning: Sparsity parameter is too big (0.1) and eliminated all coefficients
  warnings.warn(
/nas/longleaf/home/djpassey/.local/lib/python3.9/site-packages/pysindy/optimizers/stlsq.py:201: UserWarning: Sparsity parameter is too big (0.1) and eliminated all coefficients
  warnings.warn(
/nas/longleaf/home/djpassey/.local/lib/python3.9/site-packages/pysindy/optimizers/stlsq.py:201: UserWarning: Sparsity parameter is too big (0.1) and eliminated all coefficients
  warnings.warn(
/nas/longleaf/home/djpassey/.local/lib/python3.9/site-packages/pysindy/optimizers/stlsq.py:201: UserWarning: Sparsity parameter is too big (0.1) and eliminated all coefficients
  warnings.warn(
/nas/longleaf/home/djpassey/.local/lib/python3.9/site-packages/pysindy/optimizers/stlsq.py:201: UserWarning: Sparsity parameter is too big (0.1) and eliminated all coefficients
  warnings.warn(
/nas/longleaf/home/djpassey/.local/lib/python3.9/site-packages/scipy/stats/_axis_nan_policy.py:551: RuntimeWarning: Precision loss occurred in moment calculation due to catastrophic cancellation. This occurs when the data are nearly identical. Results may be unreliable.
  res = hypotest_fun_out(*samples, axis=axis, **kwds)
[I 2024-09-25 17:06:05,675] Trial 7 finished with values: [1.0, 112.45801868733126, 0.0, 1.0, 48.44357725054909, 0.0, 1.0, 72.71784237825217, 0.3333333333333333] and parameters: {'optimizer__threshold': 0.9552209569008298, 'optimizer__alpha': 3.782311412790308, 'discrete_time': False, 'feature_library': 1, 'differentiation_method': 5}. 
[I 2024-09-25 17:06:11,297] Trial 8 finished with values: [2.0, 1.1059732796530453, 1.0, 10.0, 0.6656580497573625, 1.0, 2.0, 7.113567562666472, 0.5555555555555556] and parameters: {'optimizer__threshold': 0.01413480486610603, 'optimizer__alpha': 1.0536428346337872e-05, 'discrete_time': True, 'feature_library': 1, 'differentiation_method': 6}. 
[I 2024-09-25 17:06:22,503] Trial 9 finished with values: [1.0, 112.66251156877338, 0.0, 1.0, 55.09474969499913, 0.1, 1.0, 178.4886017678997, 0.3333333333333333] and parameters: {'optimizer__threshold': 2.060525454354643e-05, 'optimizer__alpha': 5.307274501683517e-05, 'discrete_time': False, 'feature_library': 1, 'differentiation_method': 2}. 
