[I 2024-09-26 03:35:47,926] Trial 23 finished with values: [4.0, 14.701739517112381, 0.0, 3.0, 9.331135051715002, 0.0, 2.0, 25.49639855387615, 0.5] and parameters: {'h': 7, 'n_pool_kernel_size': [16, 8, 1], 'n_freq_downsample': [180, 60, 1], 'learning_rate': 0.0027938600350061243, 'scaler_type': None, 'max_steps': 1300.0, 'batch_size': 256, 'windows_batch_size': 1024, 'random_seed': 7}. 
SLURM auto-requeueing enabled. Setting signal handlers.
SLURM auto-requeueing enabled. Setting signal handlers.
SLURM auto-requeueing enabled. Setting signal handlers.
SLURM auto-requeueing enabled. Setting signal handlers.
SLURM auto-requeueing enabled. Setting signal handlers.
SLURM auto-requeueing enabled. Setting signal handlers.
SLURM auto-requeueing enabled. Setting signal handlers.
SLURM auto-requeueing enabled. Setting signal handlers.
SLURM auto-requeueing enabled. Setting signal handlers.
SLURM auto-requeueing enabled. Setting signal handlers.
SLURM auto-requeueing enabled. Setting signal handlers.
SLURM auto-requeueing enabled. Setting signal handlers.
SLURM auto-requeueing enabled. Setting signal handlers.
SLURM auto-requeueing enabled. Setting signal handlers.
SLURM auto-requeueing enabled. Setting signal handlers.
SLURM auto-requeueing enabled. Setting signal handlers.
SLURM auto-requeueing enabled. Setting signal handlers.
SLURM auto-requeueing enabled. Setting signal handlers.
SLURM auto-requeueing enabled. Setting signal handlers.
SLURM auto-requeueing enabled. Setting signal handlers.
SLURM auto-requeueing enabled. Setting signal handlers.
SLURM auto-requeueing enabled. Setting signal handlers.
[I 2024-09-26 03:40:47,952] Trial 24 finished with values: [5.0, 12.811602454213961, 0.0, 5.0, 5.878799617930041, 0.0, 2.0, 23.634482135124962, 0.0] and parameters: {'h': 13, 'n_pool_kernel_size': [16, 8, 1], 'n_freq_downsample': [168, 24, 1], 'learning_rate': 0.007169995050160776, 'scaler_type': None, 'max_steps': 1000.0, 'batch_size': 256, 'windows_batch_size': 512, 'random_seed': 10}. 
[I 2024-09-26 03:40:55,707] A new study created in memory with name: ResComp predicting Belozyorov3DQuad(sigma=0.05)
/nas/longleaf/home/djpassey/.local/lib/python3.9/site-packages/scipy/integrate/_odepack_py.py:248: ODEintWarning: Excess work done on this call (perhaps wrong Dfun type). Run with full_output = 1 to get quantitative information.
  warnings.warn(warning_msg, ODEintWarning)
[I 2024-09-26 03:40:58,988] Trial 0 finished with values: [1.0, 18426880.946468625, 1.0, 0.0, 11.809390549196518, 0.0, 0.0, 147.94721443684713, 0.0] and parameters: {'gamma': 87.84871308207005, 'sigma': 9.367358069291273, 'delta': 70.3461281300935, 'mean_degree': 0.19294936010168345, 'res_sz': 40, 'window': 0.00857671680617555, 'spect_rad': 16.736869436092718, 'ridge_alpha': 1.1055716762299987e-06}. 
/nas/longleaf/home/djpassey/.local/lib/python3.9/site-packages/interfere/methods/reservoir_computer.py:480: RuntimeWarning: invalid value encountered in matmul
  pred = self.W_out_ @ states.T
/nas/longleaf/home/djpassey/.local/lib/python3.9/site-packages/interfere/methods/reservoir_computer.py:378: RuntimeWarning: invalid value encountered in matmul
  self.Rhat_ += states.T @ states
/nas/longleaf/home/djpassey/.local/lib/python3.9/site-packages/interfere/methods/reservoir_computer.py:379: RuntimeWarning: invalid value encountered in matmul
  self.Yhat_ += Ui[:-1, :].T @ states
/nas/longleaf/home/djpassey/.local/lib/python3.9/site-packages/scipy/integrate/_odepack_py.py:248: ODEintWarning: Excess accuracy requested (tolerances too small). Run with full_output = 1 to get quantitative information.
  warnings.warn(warning_msg, ODEintWarning)
/nas/longleaf/home/djpassey/.local/lib/python3.9/site-packages/scipy/stats/_axis_nan_policy.py:551: RuntimeWarning: Precision loss occurred in moment calculation due to catastrophic cancellation. This occurs when the data are nearly identical. Results may be unreliable.
  res = hypotest_fun_out(*samples, axis=axis, **kwds)
[I 2024-09-26 03:41:02,085] Trial 1 finished with values: [1.0, 4419675662.065312, 0.0, 0.0, 4.249036485688118, 0.0, 0.0, 13376446480.200302, 1.0] and parameters: {'gamma': 265.3514794876307, 'sigma': 44.621627674202664, 'delta': 56.978263501922555, 'mean_degree': 1.8537253976280914, 'res_sz': 82, 'window': 27.04057073943338, 'spect_rad': 0.03337754373022172, 'ridge_alpha': 0.8781271998660405}. 
[I 2024-09-26 03:41:05,671] Trial 2 finished with values: [0.0, 17.192568876131553, 0.0, 0.0, 4.7246960255966, 0.0, 2.0, 23.980935589131107, 0.0] and parameters: {'gamma': 115.07317729791471, 'sigma': 69.70523751000216, 'delta': 25.653187825922828, 'mean_degree': 4.3512852210790385, 'res_sz': 53, 'window': 2.799849770082047, 'spect_rad': 0.38729934092679474, 'ridge_alpha': 10.626072484883837}. 
[I 2024-09-26 03:41:09,060] Trial 3 finished with values: [0.0, 21636.95930927132, 0.6666666666666666, 1.0, 5273665651.3859, 0.0, 0.0, 11920833531.209019, 1.0] and parameters: {'gamma': 93.24228310539463, 'sigma': 7.082771748310851, 'delta': 63.95524336028594, 'mean_degree': 2.226551840856485, 'res_sz': 42, 'window': 1.2366256181436923, 'spect_rad': 67.69115520202496, 'ridge_alpha': 71.3535588900136}. 
[I 2024-09-26 03:41:12,884] Trial 4 finished with values: [1.0, 25.598203527724625, 0.0, 0.0, 5.587349408279027, 0.6666666666666666, 0.0, 14.807269172460813, 1.0] and parameters: {'gamma': 233.4187883904567, 'sigma': 75.47903827613399, 'delta': 70.33308760262712, 'mean_degree': 4.276646669881615, 'res_sz': 35, 'window': 96.70403817590366, 'spect_rad': 0.08977633004742687, 'ridge_alpha': 0.000673005200803523}. 
/nas/longleaf/home/djpassey/.local/lib/python3.9/site-packages/interfere/methods/reservoir_computer.py:378: RuntimeWarning: overflow encountered in matmul
  self.Rhat_ += states.T @ states
/nas/longleaf/home/djpassey/.local/lib/python3.9/site-packages/interfere/methods/reservoir_computer.py:379: RuntimeWarning: overflow encountered in matmul
  self.Yhat_ += Ui[:-1, :].T @ states
[I 2024-09-26 03:41:14,947] Trial 5 finished with values: [0.0, 5583057523.872383, 0.0, 0.0, 6130203566.482813, 0.0, 0.0, 13376446480.200302, 1.0] and parameters: {'gamma': 338.9898475972978, 'sigma': 94.79634783163804, 'delta': 60.36110921611346, 'mean_degree': 2.3115077177152967, 'res_sz': 62, 'window': 81.31125184045963, 'spect_rad': 0.001050755706267026, 'ridge_alpha': 0.24150737409386658}. 
[I 2024-09-26 03:41:18,629] Trial 6 finished with values: [1.0, 281.4298278274195, 0.0, 1.0, 4.735373936914345, 0.6666666666666666, 0.0, 5507.6262839140945, 0.0] and parameters: {'gamma': 91.62372888094558, 'sigma': 27.23206472687537, 'delta': 62.26081486269815, 'mean_degree': 0.14649054035772308, 'res_sz': 64, 'window': 0.0010665628365531601, 'spect_rad': 31.451290202004554, 'ridge_alpha': 7.830901406798207e-08}. 
[I 2024-09-26 03:41:21,456] Trial 7 finished with values: [1.0, 13.073430149189905, 0.0, 0.0, 4.794452255214925, 1.0, 0.0, 15.496508998601817, 0.5] and parameters: {'gamma': 135.8970895589969, 'sigma': 60.49217926743443, 'delta': 30.17889984365172, 'mean_degree': 0.6129959321413694, 'res_sz': 19, 'window': 7.614451779328616, 'spect_rad': 0.06613535671844763, 'ridge_alpha': 7.298888502652796e-07}. 
[I 2024-09-26 03:41:24,428] Trial 8 finished with values: [1.0, 9.61480694502213, 0.3333333333333333, 7.0, 4.059242438217516, 0.0, 0.0, 18626.276421124065, 1.0] and parameters: {'gamma': 50.097783253835715, 'sigma': 20.405084494036764, 'delta': 55.16189213666856, 'mean_degree': 1.3435226988341276, 'res_sz': 71, 'window': 0.0015938145992166603, 'spect_rad': 0.04213743856738175, 'ridge_alpha': 3.215897010755874e-08}. 
[I 2024-09-26 03:41:26,779] Trial 9 finished with values: [1.0, 6.557738083757111, 0.6666666666666666, 0.0, 5.0136277620815335, 0.6666666666666666, 0.0, 14.001082383149761, 1.0] and parameters: {'gamma': 101.23925277488752, 'sigma': 70.48527478302061, 'delta': 73.76524290013789, 'mean_degree': 3.6795976716686765, 'res_sz': 14, 'window': 26.519248793107124, 'spect_rad': 4.278968831679541, 'ridge_alpha': 1.5492751568926254e-07}. 
[I 2024-09-26 03:41:29,575] Trial 10 finished with values: [1.0, 21.984466651262203, 0.0, 5.0, 4.100828871529373, 0.3333333333333333, 0.0, 17.216065161478372, 0.5] and parameters: {'gamma': 143.2289008099059, 'sigma': 75.76898058985688, 'delta': 19.471381192145206, 'mean_degree': 2.646816428673555, 'res_sz': 27, 'window': 0.04994220396529667, 'spect_rad': 0.018219246866430987, 'ridge_alpha': 0.1460144358867056}. 
[I 2024-09-26 03:41:33,146] Trial 11 finished with values: [0.0, 23.29830223907684, 0.0, 0.0, 8.610441587197764, 0.3333333333333333, 1.0, 19.05904051966634, 0.0] and parameters: {'gamma': 205.13729018196548, 'sigma': 16.82758255952969, 'delta': 90.95510402890389, 'mean_degree': 3.1222956428212476, 'res_sz': 40, 'window': 0.5981965496254301, 'spect_rad': 5.3066020050534135, 'ridge_alpha': 6.844251481512771}. 
[I 2024-09-26 03:41:35,961] Trial 12 finished with values: [2.0, 23.348192079647898, 0.0, 4.0, 10.538640628188118, 0.3333333333333333, 0.0, 330.2140316597803, 0.0] and parameters: {'gamma': 34.32601627792033, 'sigma': 1.6078230207321662, 'delta': 82.11073297815723, 'mean_degree': 3.494852118358262, 'res_sz': 79, 'window': 1.5183721311617149, 'spect_rad': 0.012635142106422049, 'ridge_alpha': 0.00023148300754364932}. 
[I 2024-09-26 03:41:40,481] Trial 13 finished with values: [2.0, 51809.87589631421, 1.0, 1.0, 8.476060537017545, 0.0, 0.0, 130.12091398135703, 0.0] and parameters: {'gamma': 338.32343881090827, 'sigma': 46.54898743204955, 'delta': 69.83885630198083, 'mean_degree': 3.9729927863899266, 'res_sz': 63, 'window': 0.012734034048905643, 'spect_rad': 14.9631791451216, 'ridge_alpha': 1.5181840003633706e-09}. 
[I 2024-09-26 03:41:44,462] Trial 14 finished with values: [1.0, 25.30146565829324, 0.0, 1.0, 4.777433275414096, 0.6666666666666666, 0.0, 17.535192243580877, 0.5] and parameters: {'gamma': 231.5806331088449, 'sigma': 96.9476997734557, 'delta': 76.32644397586057, 'mean_degree': 2.833617737666412, 'res_sz': 41, 'window': 3.459180575991297, 'spect_rad': 0.001405741508067613, 'ridge_alpha': 0.14887995694701334}. 
[I 2024-09-26 03:41:48,184] Trial 15 finished with values: [1.0, 9.515945171926809, 0.0, 7.0, 4.091080502012916, 0.0, 0.0, 13.612159308106845, 1.0] and parameters: {'gamma': 341.7930671176492, 'sigma': 83.6668989920864, 'delta': 16.263283463068316, 'mean_degree': 0.3771007465065329, 'res_sz': 30, 'window': 32.28015749902597, 'spect_rad': 1.4700732492691635, 'ridge_alpha': 8.911954458155616e-09}. 
[I 2024-09-26 03:41:52,120] Trial 16 finished with values: [0.0, 14.232859460496714, 0.0, 1.0, 4.777382756727621, 0.6666666666666666, 2.0, 23.524143964139295, 0.0] and parameters: {'gamma': 132.8644717812717, 'sigma': 86.96757198259776, 'delta': 1.3277186353670354, 'mean_degree': 3.6292084287762068, 'res_sz': 68, 'window': 70.30121013235087, 'spect_rad': 0.3263526684927028, 'ridge_alpha': 53.97848649336199}. 
[I 2024-09-26 03:41:55,393] Trial 17 finished with values: [1.0, 2293.6354881509315, 0.0, 2.0, 4.51162283177872, 1.0, 0.0, 13.095868609560974, 1.0] and parameters: {'gamma': 379.18416003498896, 'sigma': 28.485967840326353, 'delta': 33.19397233884782, 'mean_degree': 2.5802173907381376, 'res_sz': 35, 'window': 56.768878756343106, 'spect_rad': 0.002305969599237012, 'ridge_alpha': 1.6645214462451962e-07}. 
/nas/longleaf/home/djpassey/.local/lib/python3.9/site-packages/interfere/methods/reservoir_computer.py:480: RuntimeWarning: overflow encountered in matmul
  pred = self.W_out_ @ states.T
[I 2024-09-26 03:41:58,822] Trial 18 finished with values: [1.0, 5545712238.266842, 0.0, 0.0, 5.790721284896235, 0.3333333333333333, 0.0, 13.530999870632915, 0.5] and parameters: {'gamma': 398.506722524575, 'sigma': 91.25122049053839, 'delta': 17.94762268714479, 'mean_degree': 2.123004204837672, 'res_sz': 48, 'window': 0.0010432764478896907, 'spect_rad': 1.0922619723061968, 'ridge_alpha': 6.22020768035535e-08}. 
[I 2024-09-26 03:42:01,111] Trial 19 finished with values: [1.0, 4909705783.956974, 0.0, 0.0, 896.7843804955755, 1.0, 0.0, 192.48313711695872, 0.0] and parameters: {'gamma': 109.41451619852617, 'sigma': 2.539201527566718, 'delta': 81.08630071774891, 'mean_degree': 4.355658741123228, 'res_sz': 62, 'window': 2.0652130820902648, 'spect_rad': 97.05124463821278, 'ridge_alpha': 6.3308215681856365e-06}. 
[I 2024-09-26 03:42:05,498] Trial 20 finished with values: [1.0, 5296553424.8785715, 0.0, 0.0, 6.811331191674716, 0.0, 0.0, 1615.651351108691, 0.0] and parameters: {'gamma': 224.2246312620865, 'sigma': 26.899020889660374, 'delta': 34.799164260099204, 'mean_degree': 0.3878597157943372, 'res_sz': 90, 'window': 48.28590148791176, 'spect_rad': 0.14876987923370774, 'ridge_alpha': 7.1213107802682926e-09}. 
[I 2024-09-26 03:42:08,396] Trial 21 finished with values: [1.0, 13.425205898831809, 0.0, 5.0, 4.1133109426500445, 0.3333333333333333, 0.0, 18.035240796494932, 0.5] and parameters: {'gamma': 446.6891924970139, 'sigma': 98.76945516506055, 'delta': 32.33872492664975, 'mean_degree': 4.270749027401339, 'res_sz': 19, 'window': 0.0027151020220125494, 'spect_rad': 0.001254054664658213, 'ridge_alpha': 9.164544552331808e-06}. 
[I 2024-09-26 03:42:11,020] Trial 22 finished with values: [5.0, 13.345233489136406, 0.0, 0.0, 5.4089652036203395, 0.3333333333333333, 0.0, 10.015191291603516, 1.0] and parameters: {'gamma': 64.84117610765367, 'sigma': 84.21064943454748, 'delta': 28.697060700582067, 'mean_degree': 2.9426816517348064, 'res_sz': 35, 'window': 0.2696702019728067, 'spect_rad': 0.42723294077456747, 'ridge_alpha': 2.104097897996048e-06}. 
[I 2024-09-26 03:42:16,131] Trial 23 finished with values: [2.0, 4051725536.2081456, 0.0, 2.0, 4.58259815776736, 0.3333333333333333, 0.0, 520.6469147618833, 0.0] and parameters: {'gamma': 243.29832889248092, 'sigma': 87.28229142105494, 'delta': 53.16655990106718, 'mean_degree': 4.458934090542132, 'res_sz': 97, 'window': 0.17353251867124753, 'spect_rad': 0.00958311821274015, 'ridge_alpha': 2.461703432439092e-09}. 
[I 2024-09-26 03:42:19,533] Trial 24 finished with values: [1.0, 28.69740534288689, 0.0, 0.0, 8.338361756602286, 0.0, 0.0, 24.459603512616347, 0.5] and parameters: {'gamma': 212.13232807570103, 'sigma': 2.2207640978440364, 'delta': 49.794379760669365, 'mean_degree': 4.832341934386848, 'res_sz': 54, 'window': 0.17310956474570474, 'spect_rad': 3.0519125220140633, 'ridge_alpha': 10.496787036526555}. 
[I 2024-09-26 03:42:27,088] A new study created in memory with name: SINDY predicting Belozyorov3DQuad(sigma=0.05)
[I 2024-09-26 03:42:28,869] Trial 0 finished with values: [5.0, 8.0111390702494, 0.0, 6.0, 7.679947411813757, 0.0, 2.0, 32.08475493887923, 0.5] and parameters: {'optimizer__threshold': 0.7543956272578806, 'optimizer__alpha': 0.00035627377716786516, 'discrete_time': True, 'feature_library': 0, 'differentiation_method': 1}. 
[I 2024-09-26 03:42:31,168] Trial 1 finished with values: [4.0, 5.599692103357645, 1.0, 19.0, 4.531669881490467, 1.0, 5.0, 20.989638595068964, 1.0] and parameters: {'optimizer__threshold': 0.00012654024968329682, 'optimizer__alpha': 0.13367775618825317, 'discrete_time': False, 'feature_library': 0, 'differentiation_method': 2}. 
[I 2024-09-26 03:42:32,990] Trial 2 finished with values: [4.0, 8.231552671808965, 0.3333333333333333, 19.0, 7.439307386091533, 0.0, 2.0, 25.60609351521704, 0.0] and parameters: {'optimizer__threshold': 0.0002844032206944446, 'optimizer__alpha': 0.0034411905909849227, 'discrete_time': False, 'feature_library': 1, 'differentiation_method': 8}. 
[I 2024-09-26 03:42:35,190] Trial 3 finished with values: [2.0, 7.819691434968125, 0.3333333333333333, 16.0, 7.1013310864967245, 0.6666666666666666, 2.0, 28.407089852472403, 0.0] and parameters: {'optimizer__threshold': 0.03766456572278728, 'optimizer__alpha': 2.7128969031396658e-05, 'discrete_time': False, 'feature_library': 0, 'differentiation_method': 8}. 
[I 2024-09-26 03:42:37,004] Trial 4 finished with values: [1.0, 16.26274537346262, 0.3333333333333333, 4.0, 15.83890392975883, 0.6666666666666666, 1.0, 25.61496511634493, 0.5] and parameters: {'optimizer__threshold': 0.00010821617275993672, 'optimizer__alpha': 0.046516328796005056, 'discrete_time': True, 'feature_library': 1, 'differentiation_method': 7}. 
[I 2024-09-26 03:42:38,785] Trial 5 finished with values: [5.0, 8.0111390702494, 0.0, 6.0, 7.679947411813757, 0.0, 2.0, 32.08475493887923, 0.5] and parameters: {'optimizer__threshold': 0.019529246858269445, 'optimizer__alpha': 0.004639980433214481, 'discrete_time': True, 'feature_library': 0, 'differentiation_method': 1}. 
[I 2024-09-26 03:42:40,928] Trial 6 finished with values: [1.0, 16.26274537346262, 0.3333333333333333, 4.0, 15.83890392975883, 0.6666666666666666, 1.0, 25.61496511634493, 0.5] and parameters: {'optimizer__threshold': 0.0029474824737579734, 'optimizer__alpha': 0.053044601572093286, 'discrete_time': True, 'feature_library': 1, 'differentiation_method': 7}. 
[I 2024-09-26 03:42:43,147] Trial 7 finished with values: [4.0, 5.900615525359928, 1.0, 21.0, 4.896286141690692, 1.0, 6.0, 22.272945516184155, 1.0] and parameters: {'optimizer__threshold': 3.4700557792732374, 'optimizer__alpha': 0.019430350014758777, 'discrete_time': False, 'feature_library': 0, 'differentiation_method': 0}. 
[I 2024-09-26 03:42:44,911] Trial 8 finished with values: [5.0, 8.0111390702494, 0.0, 6.0, 7.679947411813757, 0.0, 2.0, 32.08475493887923, 0.5] and parameters: {'optimizer__threshold': 0.0002796393273716313, 'optimizer__alpha': 1.9689913594529835e-05, 'discrete_time': True, 'feature_library': 0, 'differentiation_method': 5}. 
[I 2024-09-26 03:42:47,436] Trial 9 finished with values: [5.0, 10.981808364559617, 0.6666666666666666, 26.0, 8.57962269505144, 1.0, 9.0, 19.460885527166713, 1.0] and parameters: {'optimizer__threshold': 0.003620352114886615, 'optimizer__alpha': 2.5110236098185688e-05, 'discrete_time': False, 'feature_library': 0, 'differentiation_method': 5}. 
[I 2024-09-26 03:42:49,208] Trial 10 finished with values: [5.0, 8.0111390702494, 0.0, 6.0, 7.679947411813757, 0.0, 2.0, 32.08475493887923, 0.5] and parameters: {'optimizer__threshold': 5.8004327061137656e-05, 'optimizer__alpha': 0.35406759092046, 'discrete_time': True, 'feature_library': 0, 'differentiation_method': 6}. 
[I 2024-09-26 03:42:51,054] Trial 11 finished with values: [4.0, 8.231552671808965, 0.3333333333333333, 19.0, 7.439307386091533, 0.0, 2.0, 25.60609351521704, 0.0] and parameters: {'optimizer__threshold': 1.1011766037179475e-05, 'optimizer__alpha': 7.731419821614701e-05, 'discrete_time': False, 'feature_library': 1, 'differentiation_method': 8}. 
[I 2024-09-26 03:42:52,924] Trial 12 finished with values: [2.0, 7.819691434968125, 0.3333333333333333, 16.0, 7.1013310864967245, 0.6666666666666666, 2.0, 28.407089852472403, 0.0] and parameters: {'optimizer__threshold': 0.000237891586102948, 'optimizer__alpha': 0.0021883819461013883, 'discrete_time': False, 'feature_library': 0, 'differentiation_method': 8}. 
[I 2024-09-26 03:42:55,204] Trial 13 finished with values: [2.0, 21.35748352244862, 0.3333333333333333, 8.0, 6.088194466790444, 0.3333333333333333, 3.0, 290.8501321835778, 0.5] and parameters: {'optimizer__threshold': 0.02876865137133693, 'optimizer__alpha': 0.6972045528126587, 'discrete_time': False, 'feature_library': 1, 'differentiation_method': 0}. 
[I 2024-09-26 03:42:57,139] Trial 14 finished with values: [2.0, 21.124472979181956, 0.3333333333333333, 7.0, 6.0668011722652295, 0.6666666666666666, 2.0, 319.443858358386, 0.5] and parameters: {'optimizer__threshold': 0.0011049595225170348, 'optimizer__alpha': 2.2963823205956066e-05, 'discrete_time': False, 'feature_library': 1, 'differentiation_method': 1}. 
[I 2024-09-26 03:42:59,068] Trial 15 finished with values: [2.0, 21.779912473380374, 0.3333333333333333, 8.0, 6.15891050737998, 0.3333333333333333, 3.0, 346.0245367524764, 0.5] and parameters: {'optimizer__threshold': 1.5853703447778725e-05, 'optimizer__alpha': 0.009501868228095029, 'discrete_time': False, 'feature_library': 1, 'differentiation_method': 4}. 
[I 2024-09-26 03:43:01,183] Trial 16 finished with values: [4.0, 8.231552671808965, 0.3333333333333333, 19.0, 7.439307386091533, 0.0, 2.0, 25.60609351521704, 0.0] and parameters: {'optimizer__threshold': 2.179927641584298e-05, 'optimizer__alpha': 3.7559383617507054e-05, 'discrete_time': False, 'feature_library': 1, 'differentiation_method': 8}. 
[I 2024-09-26 03:43:03,248] Trial 17 finished with values: [2.0, 21.952697415937568, 0.6666666666666666, 10.0, 6.16612767219114, 0.0, 2.0, 215.40569627756764, 0.5] and parameters: {'optimizer__threshold': 1.2094597616052023, 'optimizer__alpha': 0.021931352330799125, 'discrete_time': False, 'feature_library': 1, 'differentiation_method': 5}. 
[I 2024-09-26 03:43:05,007] Trial 18 finished with values: [5.0, 8.0111390702494, 0.0, 6.0, 7.679947411813757, 0.0, 2.0, 32.08475493887923, 0.5] and parameters: {'optimizer__threshold': 0.005055919190931179, 'optimizer__alpha': 1.549820119865828e-05, 'discrete_time': True, 'feature_library': 0, 'differentiation_method': 8}. 
[I 2024-09-26 03:43:07,297] Trial 19 finished with values: [4.0, 5.599692103357645, 1.0, 19.0, 4.531669881490467, 1.0, 5.0, 20.989638595068964, 1.0] and parameters: {'optimizer__threshold': 0.004207444336208691, 'optimizer__alpha': 0.038063219928085125, 'discrete_time': False, 'feature_library': 0, 'differentiation_method': 2}. 
[I 2024-09-26 03:43:09,431] Trial 20 finished with values: [1.0, 16.26274537346262, 0.3333333333333333, 4.0, 15.83890392975883, 0.6666666666666666, 1.0, 25.61496511634493, 0.5] and parameters: {'optimizer__threshold': 2.9805227413109985, 'optimizer__alpha': 0.00034167901154503295, 'discrete_time': True, 'feature_library': 1, 'differentiation_method': 4}. 
