[I 2024-09-26 18:48:51,208] Trial 4 finished with values: [1.0, 25.379756465046352, 0.0, 5.0, 6.0999893622515655, 0.3333333333333333, 1.0, 8.87031960414838, 1.0] and parameters: {'gamma': 153.45820423321655, 'sigma': 81.18307436286351, 'delta': 49.05960762504754, 'mean_degree': 3.6423155866641466, 'res_sz': 69, 'window': 0.0022439054756677843, 'spect_rad': 0.0016309603401779796, 'ridge_alpha': 0.01729357781659469}. 
[I 2024-09-26 18:48:53,936] Trial 5 finished with values: [5.0, 12.729312441489329, 0.0, 5.0, 6.141930644689208, 0.6666666666666666, 0.0, 139.72317147512302, 0.0] and parameters: {'gamma': 9.226866558686206, 'sigma': 13.077256272204293, 'delta': 79.4805976099109, 'mean_degree': 0.22749444378614117, 'res_sz': 45, 'window': 0.21537605255560305, 'spect_rad': 0.016057819495749557, 'ridge_alpha': 2.5646162152680575e-07}. 
[I 2024-09-26 18:48:58,919] Trial 6 finished with values: [1.0, 17.304564231355688, 0.0, 9.0, 6.281911196851577, 0.0, 0.0, 8.883218772534791, 1.0] and parameters: {'gamma': 437.14112636055523, 'sigma': 65.24386957444823, 'delta': 40.889960648792275, 'mean_degree': 3.5555629299855, 'res_sz': 47, 'window': 2.2321115502629003, 'spect_rad': 0.12775642396328896, 'ridge_alpha': 3.6549874445170254e-06}. 
[I 2024-09-26 18:49:04,554] Trial 7 finished with values: [1.0, 5066823608.928687, 0.0, 1.0, 10342213.874784224, 1.0, 0.0, 37081104.63565654, 0.5] and parameters: {'gamma': 95.61217235487655, 'sigma': 57.76743668576844, 'delta': 93.61008416164759, 'mean_degree': 4.360873587777761, 'res_sz': 84, 'window': 0.011514161815768774, 'spect_rad': 62.01806695287648, 'ridge_alpha': 7.463941504245615e-07}. 
[I 2024-09-26 18:49:07,379] Trial 8 finished with values: [1.0, 25.13774283258042, 0.0, 6.0, 6.109748735030302, 0.6666666666666666, 0.0, 15.12794519397668, 0.0] and parameters: {'gamma': 461.7570973647158, 'sigma': 64.39196932847706, 'delta': 3.915577300001291, 'mean_degree': 3.788818903204868, 'res_sz': 23, 'window': 0.07791454070981634, 'spect_rad': 0.21694759844180095, 'ridge_alpha': 0.0031406641668694467}. 
[I 2024-09-26 18:49:12,362] Trial 9 finished with values: [1.0, 12.458427571460613, 0.0, 0.0, 6.294847877336442, 0.6666666666666666, 0.0, 17.04056133099176, 1.0] and parameters: {'gamma': 483.7365737747036, 'sigma': 78.65292369876836, 'delta': 97.21240114955526, 'mean_degree': 4.112408844546174, 'res_sz': 44, 'window': 0.010096542141149628, 'spect_rad': 72.50533561249819, 'ridge_alpha': 3.9410006002524524e-05}. 
[I 2024-09-26 18:49:15,698] Trial 10 finished with values: [1.0, 20.073265536952317, 0.3333333333333333, 1.0, 6.8748450125241325, 0.3333333333333333, 0.0, 87.33974115973137, 0.0] and parameters: {'gamma': 265.8146528025417, 'sigma': 2.6221714355919534, 'delta': 45.030271555814096, 'mean_degree': 3.2582807139472902, 'res_sz': 57, 'window': 1.209669767957293, 'spect_rad': 0.04161871419713376, 'ridge_alpha': 7.892287964231031e-06}. 
[I 2024-09-26 18:49:17,804] Trial 11 finished with values: [4.0, 12.38406181081204, 0.0, 0.0, 11.862017657190755, 0.0, 0.0, 2176.5996667369373, 0.5] and parameters: {'gamma': 28.96573483359805, 'sigma': 77.5500430815947, 'delta': 55.34434322678664, 'mean_degree': 1.0397947459218746, 'res_sz': 83, 'window': 35.53830389849178, 'spect_rad': 69.12862406608804, 'ridge_alpha': 1.537944451898978e-07}. 
[I 2024-09-26 18:49:20,611] Trial 12 finished with values: [1.0, 31.81367174342111, 0.3333333333333333, 0.0, 8.044855827298225, 0.6666666666666666, 0.0, 26.517137839695742, 0.5] and parameters: {'gamma': 51.79019684183415, 'sigma': 25.807687901781588, 'delta': 28.808035327470613, 'mean_degree': 1.422615434949679, 'res_sz': 71, 'window': 0.001638906206743036, 'spect_rad': 0.2763993432949672, 'ridge_alpha': 0.01258505187927675}. 
[I 2024-09-26 18:49:25,141] Trial 13 finished with values: [1.0, 1058231725.8212984, 1.0, 1.0, 6.8193584777542045, 0.3333333333333333, 0.0, 10.937757214999348, 0.5] and parameters: {'gamma': 176.20478006514463, 'sigma': 80.05217235186183, 'delta': 25.166954055954957, 'mean_degree': 4.056970704411999, 'res_sz': 81, 'window': 0.013511231998663744, 'spect_rad': 61.07446547086911, 'ridge_alpha': 9.194235337052918e-08}. 
[I 2024-09-26 18:49:30,118] Trial 14 finished with values: [1.0, 7.913514689028945, 0.0, 10.0, 6.125550515114302, 0.0, 0.0, 10.737372212489388, 1.0] and parameters: {'gamma': 385.11090425942155, 'sigma': 65.06464296019546, 'delta': 56.69359762172804, 'mean_degree': 2.3324719941637677, 'res_sz': 68, 'window': 1.5259976177740695, 'spect_rad': 0.20880469901079635, 'ridge_alpha': 0.19943503074638547}. 
[I 2024-09-26 18:49:33,762] Trial 15 finished with values: [1.0, 12.385202458644802, 0.0, 0.0, 7.878578081069472, 0.3333333333333333, 0.0, 10.043103607598322, 0.5] and parameters: {'gamma': 31.27238634687243, 'sigma': 45.60793008916675, 'delta': 31.215212037225804, 'mean_degree': 1.3146634580578151, 'res_sz': 25, 'window': 0.030116383468343867, 'spect_rad': 53.54676557941256, 'ridge_alpha': 4.309236976887975e-08}. 
[I 2024-09-26 18:49:37,925] Trial 16 finished with values: [1.0, 16.953468456338953, 0.0, 2.0, 6.316691758124152, 0.6666666666666666, 0.0, 16.122404995771337, 0.0] and parameters: {'gamma': 393.23870898227403, 'sigma': 48.40265665304645, 'delta': 25.480641587518328, 'mean_degree': 4.151570784776692, 'res_sz': 65, 'window': 0.8353477102877491, 'spect_rad': 0.0014741855534850313, 'ridge_alpha': 2.530721642480149e-08}. 
[I 2024-09-26 18:49:41,036] Trial 17 finished with values: [0.0, 20.002948740186152, 0.0, 5.0, 6.273269405824226, 0.6666666666666666, 0.0, 7.7302460980209995, 1.0] and parameters: {'gamma': 174.61973837688166, 'sigma': 86.0779688506878, 'delta': 57.88601326737498, 'mean_degree': 0.5378684271271159, 'res_sz': 11, 'window': 0.3948060102804526, 'spect_rad': 25.57790165932464, 'ridge_alpha': 3.152625829840983e-09}. 
[I 2024-09-26 18:49:44,348] Trial 18 finished with values: [1.0, 24.36855432412516, 0.0, 9.0, 6.064283482535315, 0.0, 0.0, 9.880336580153363, 1.0] and parameters: {'gamma': 157.81002123595718, 'sigma': 50.759800911043854, 'delta': 22.803036533615135, 'mean_degree': 4.77144659007729, 'res_sz': 92, 'window': 0.0019716649415729135, 'spect_rad': 10.93167154317141, 'ridge_alpha': 0.00010061089909392271}. 
[I 2024-09-26 18:49:47,599] Trial 19 finished with values: [4.0, 12.384061810813986, 0.0, 0.0, 11.862017657188918, 0.0, 0.0, 14.885268174451006, 1.0] and parameters: {'gamma': 356.71302856474875, 'sigma': 61.441872803709664, 'delta': 34.17886336182375, 'mean_degree': 0.8223095099134282, 'res_sz': 83, 'window': 31.028649008739304, 'spect_rad': 0.0010988482391195854, 'ridge_alpha': 2.4443123741396328e-06}. 
[I 2024-09-26 18:49:50,559] Trial 20 finished with values: [1.0, 7.372632760386189, 0.0, 11.0, 6.165280117491979, 0.0, 0.0, 12.906523556151143, 0.5] and parameters: {'gamma': 78.23957974290752, 'sigma': 35.46666860527842, 'delta': 59.70493317973681, 'mean_degree': 0.9542190922102913, 'res_sz': 26, 'window': 65.77894547069168, 'spect_rad': 4.861513026098342, 'ridge_alpha': 9.23931346363393e-09}. 
[I 2024-09-26 18:49:54,060] Trial 21 finished with values: [1.0, 29.291106170230016, 0.0, 1.0, 7.099975161077558, 0.0, 0.0, 13.848851937879965, 0.5] and parameters: {'gamma': 294.3355429615407, 'sigma': 54.298514556556306, 'delta': 28.720770092502786, 'mean_degree': 4.608991193070511, 'res_sz': 64, 'window': 0.06239846447515292, 'spect_rad': 0.21180771447700938, 'ridge_alpha': 0.0006514303781300721}. 
[I 2024-09-26 18:49:59,359] Trial 22 finished with values: [1.0, 4467942798.994136, 0.0, 1.0, 6.607084030691312, 0.3333333333333333, 0.0, 26.796612448019694, 0.5] and parameters: {'gamma': 456.7527557313043, 'sigma': 39.76036068473903, 'delta': 88.87019968029458, 'mean_degree': 1.5377623815932042, 'res_sz': 42, 'window': 0.05566117783188695, 'spect_rad': 37.90583709912516, 'ridge_alpha': 0.015484359401230958}. 
[I 2024-09-26 18:50:02,526] Trial 23 finished with values: [1.0, 22.31519585203062, 0.0, 10.0, 6.167005089720221, 0.0, 0.0, 9.695364454377573, 1.0] and parameters: {'gamma': 261.9779638563607, 'sigma': 27.853037318932127, 'delta': 64.23972110141472, 'mean_degree': 3.8798325302846597, 'res_sz': 17, 'window': 28.52666392663848, 'spect_rad': 1.839576632369567, 'ridge_alpha': 1.1413947503487701e-08}. 
[I 2024-09-26 18:50:05,861] Trial 24 finished with values: [1.0, 22.297137476532807, 0.0, 1.0, 6.388361706353666, 0.0, 0.0, 20.854512216532036, 0.5] and parameters: {'gamma': 472.8892546316067, 'sigma': 18.36532860655032, 'delta': 47.444316089832256, 'mean_degree': 0.38395906182018147, 'res_sz': 17, 'window': 0.006252867662490057, 'spect_rad': 7.3323512379532385, 'ridge_alpha': 0.01958753779996557}. 
[I 2024-09-26 18:50:20,238] A new study created in memory with name: SINDY predicting Belozyorov3DQuad(sigma=0.15)
[I 2024-09-26 18:50:21,947] Trial 0 finished with values: [2.0, 5.526056613493064, 0.0, 3.0, 2.4939836757861413, 0.3333333333333333, 2.0, 21.111154473426765, 0.0] and parameters: {'optimizer__threshold': 0.0031793719021811226, 'optimizer__alpha': 0.0025957097562953166, 'discrete_time': False, 'feature_library': 0, 'differentiation_method': 8}. 
[I 2024-09-26 18:50:23,820] Trial 1 finished with values: [2.0, 18.74683618819846, 0.6666666666666666, 3.0, 2.2615345491300203, 0.3333333333333333, 5.0, 134.36834867807596, 0.5] and parameters: {'optimizer__threshold': 0.025854896027245652, 'optimizer__alpha': 0.0009720021714009704, 'discrete_time': False, 'feature_library': 1, 'differentiation_method': 0}. 
[I 2024-09-26 18:50:25,881] Trial 2 finished with values: [6.0, 3.390765297510905, 1.0, 19.0, 1.8789229537707692, 0.6666666666666666, 5.0, 16.81315650570255, 1.0] and parameters: {'optimizer__threshold': 0.00014559236153401214, 'optimizer__alpha': 0.000404231338758481, 'discrete_time': False, 'feature_library': 0, 'differentiation_method': 0}. 
[I 2024-09-26 18:50:27,866] Trial 3 finished with values: [1.0, 6.8241738753958305, 1.0, 3.0, 5.708307544498907, 0.6666666666666666, 1.0, 11.591846598435446, 1.0] and parameters: {'optimizer__threshold': 0.0335290658314884, 'optimizer__alpha': 0.7370534082778025, 'discrete_time': True, 'feature_library': 1, 'differentiation_method': 6}. 
[I 2024-09-26 18:50:29,804] Trial 4 finished with values: [2.0, 19.35389713770035, 0.6666666666666666, 3.0, 2.370556510702419, 0.6666666666666666, 6.0, 94.55568843901945, 0.5] and parameters: {'optimizer__threshold': 0.0006977366753711346, 'optimizer__alpha': 0.01360195148446531, 'discrete_time': False, 'feature_library': 1, 'differentiation_method': 5}. 
[I 2024-09-26 18:50:31,454] Trial 5 finished with values: [1.0, 6.8241738753958305, 1.0, 3.0, 5.708307544498907, 0.6666666666666666, 1.0, 11.591846598435446, 1.0] and parameters: {'optimizer__threshold': 0.3417301356728712, 'optimizer__alpha': 1.7819038525750356e-05, 'discrete_time': True, 'feature_library': 1, 'differentiation_method': 3}. 
[I 2024-09-26 18:50:33,097] Trial 6 finished with values: [1.0, 6.8241738753958305, 1.0, 3.0, 5.708307544498907, 0.6666666666666666, 1.0, 11.591846598435446, 1.0] and parameters: {'optimizer__threshold': 4.709316411440003, 'optimizer__alpha': 0.0007768667243812268, 'discrete_time': True, 'feature_library': 1, 'differentiation_method': 8}. 
[I 2024-09-26 18:50:35,071] Trial 7 finished with values: [4.0, 6.47443192105143, 0.0, 3.0, 5.7302360338660785, 0.3333333333333333, 2.0, 33.013024738717114, 0.5] and parameters: {'optimizer__threshold': 0.005281329157419229, 'optimizer__alpha': 0.0015846231230494201, 'discrete_time': True, 'feature_library': 0, 'differentiation_method': 2}. 
[I 2024-09-26 18:50:36,743] Trial 8 finished with values: [4.0, 6.47443192105143, 0.0, 3.0, 5.7302360338660785, 0.3333333333333333, 2.0, 33.013024738717114, 0.5] and parameters: {'optimizer__threshold': 5.6389017372697924e-05, 'optimizer__alpha': 0.0552276671510452, 'discrete_time': True, 'feature_library': 0, 'differentiation_method': 6}. 
[I 2024-09-26 18:50:38,404] Trial 9 finished with values: [4.0, 6.47443192105143, 0.0, 3.0, 5.7302360338660785, 0.3333333333333333, 2.0, 33.013024738717114, 0.5] and parameters: {'optimizer__threshold': 6.0244460565836704e-05, 'optimizer__alpha': 0.10012723228722051, 'discrete_time': True, 'feature_library': 0, 'differentiation_method': 7}. 
[I 2024-09-26 18:50:40,765] Trial 10 finished with values: [6.0, 3.390765297510905, 1.0, 19.0, 1.8789229537707692, 0.6666666666666666, 5.0, 16.81315650570255, 1.0] and parameters: {'optimizer__threshold': 0.00033333769297628856, 'optimizer__alpha': 0.41815197698224593, 'discrete_time': False, 'feature_library': 0, 'differentiation_method': 0}. 
[I 2024-09-26 18:50:42,645] Trial 11 finished with values: [2.0, 18.74683618819846, 0.6666666666666666, 3.0, 2.2615345491300203, 0.3333333333333333, 5.0, 134.36834867807596, 0.5] and parameters: {'optimizer__threshold': 0.017075037798337887, 'optimizer__alpha': 0.00889864039796914, 'discrete_time': False, 'feature_library': 1, 'differentiation_method': 0}. 
[I 2024-09-26 18:50:44,745] Trial 12 finished with values: [5.0, 3.5541264528632905, 1.0, 16.0, 2.8173379022410847, 0.6666666666666666, 5.0, 18.555564162391434, 1.0] and parameters: {'optimizer__threshold': 0.0033950674612961266, 'optimizer__alpha': 0.0010393099340221894, 'discrete_time': False, 'feature_library': 0, 'differentiation_method': 2}. 
[I 2024-09-26 18:50:46,805] Trial 13 finished with values: [4.0, 3.039622268404921, 1.0, 16.0, 2.540080914017076, 0.6666666666666666, 5.0, 17.23751429237128, 1.0] and parameters: {'optimizer__threshold': 0.007992640669367333, 'optimizer__alpha': 0.12465947613643644, 'discrete_time': False, 'feature_library': 0, 'differentiation_method': 4}. 
[I 2024-09-26 18:50:48,770] Trial 14 finished with values: [1.0, 6.8241738753958305, 1.0, 3.0, 5.708307544498907, 0.6666666666666666, 1.0, 11.591846598435446, 1.0] and parameters: {'optimizer__threshold': 6.430504751451534e-05, 'optimizer__alpha': 0.1594147082443651, 'discrete_time': True, 'feature_library': 1, 'differentiation_method': 6}. 
[I 2024-09-26 18:50:50,413] Trial 15 finished with values: [1.0, 6.8241738753958305, 1.0, 3.0, 5.708307544498907, 0.6666666666666666, 1.0, 11.591846598435446, 1.0] and parameters: {'optimizer__threshold': 3.270093095715517, 'optimizer__alpha': 0.45707378050841935, 'discrete_time': True, 'feature_library': 1, 'differentiation_method': 4}. 
[I 2024-09-26 18:50:52,479] Trial 16 finished with values: [5.0, 3.1846158956504103, 1.0, 16.0, 2.620285348290703, 0.6666666666666666, 5.0, 19.12279014734852, 1.0] and parameters: {'optimizer__threshold': 0.04627749911620423, 'optimizer__alpha': 0.009616426570776052, 'discrete_time': False, 'feature_library': 0, 'differentiation_method': 3}. 
[I 2024-09-26 18:50:54,135] Trial 17 finished with values: [4.0, 6.47443192105143, 0.0, 3.0, 5.7302360338660785, 0.3333333333333333, 2.0, 33.013024738717114, 0.5] and parameters: {'optimizer__threshold': 1.4608460486366546, 'optimizer__alpha': 1.7183908490950155, 'discrete_time': True, 'feature_library': 0, 'differentiation_method': 5}. 
[I 2024-09-26 18:50:56,383] Trial 18 finished with values: [2.0, 19.35389713770035, 0.6666666666666666, 3.0, 2.370556510702419, 0.6666666666666666, 6.0, 94.55568843901945, 0.5] and parameters: {'optimizer__threshold': 0.02257325596875096, 'optimizer__alpha': 0.007215749249899233, 'discrete_time': False, 'feature_library': 1, 'differentiation_method': 5}. 
[I 2024-09-26 18:50:58,041] Trial 19 finished with values: [4.0, 6.47443192105143, 0.0, 3.0, 5.7302360338660785, 0.3333333333333333, 2.0, 33.013024738717114, 0.5] and parameters: {'optimizer__threshold': 0.12325468740493743, 'optimizer__alpha': 0.0007120288541872206, 'discrete_time': True, 'feature_library': 0, 'differentiation_method': 1}. 
[I 2024-09-26 18:50:59,908] Trial 20 finished with values: [2.0, 17.99535057649548, 0.3333333333333333, 3.0, 2.37780621676252, 0.3333333333333333, 4.0, 157.74060392528415, 0.5] and parameters: {'optimizer__threshold': 0.024726784862856205, 'optimizer__alpha': 0.1441244765610961, 'discrete_time': False, 'feature_library': 1, 'differentiation_method': 2}. 
[I 2024-09-26 18:51:01,829] Trial 21 finished with values: [1.0, 6.8241738753958305, 1.0, 3.0, 5.708307544498907, 0.6666666666666666, 1.0, 11.591846598435446, 1.0] and parameters: {'optimizer__threshold': 0.0018824104261333237, 'optimizer__alpha': 5.581856474497936e-05, 'discrete_time': True, 'feature_library': 1, 'differentiation_method': 0}. 
[I 2024-09-26 18:51:03,487] Trial 22 finished with values: [4.0, 6.47443192105143, 0.0, 3.0, 5.7302360338660785, 0.3333333333333333, 2.0, 33.013024738717114, 0.5] and parameters: {'optimizer__threshold': 0.00023385304551899904, 'optimizer__alpha': 0.012591326645069354, 'discrete_time': True, 'feature_library': 0, 'differentiation_method': 8}. 
[I 2024-09-26 18:51:05,143] Trial 23 finished with values: [4.0, 6.47443192105143, 0.0, 3.0, 5.7302360338660785, 0.3333333333333333, 2.0, 33.013024738717114, 0.5] and parameters: {'optimizer__threshold': 1.4294540530039389e-05, 'optimizer__alpha': 0.0002148716305142856, 'discrete_time': True, 'feature_library': 0, 'differentiation_method': 0}. 
[I 2024-09-26 18:51:07,003] Trial 24 finished with values: [2.0, 18.00011093366852, 0.3333333333333333, 3.0, 2.369714879611916, 0.3333333333333333, 5.0, 139.35419380358488, 0.5] and parameters: {'optimizer__threshold': 0.00032623799213997754, 'optimizer__alpha': 0.0006453833279533691, 'discrete_time': False, 'feature_library': 1, 'differentiation_method': 3}. 
[I 2024-09-26 18:51:25,682] A new study created in memory with name: LTSFLinearForecaster predicting coupled_logistic_map(sigma=0.20)
[I 2024-09-26 18:51:33,426] Trial 0 finished with values: [1.0, 1.8761656770149169, 0.0, 1.0, 1.1497734323673576, 0.1, 1.0, 1.0511730743640568, 0.3333333333333333] and parameters: {'seq_len': 10, 'lr': 0.0012779993891697552, 'pred_len': 6, 'num_epochs': 50}. 
[I 2024-09-26 18:51:49,081] Trial 1 finished with values: [1.0, 0.8743847048972209, 0.9, 1.0, 0.8915610257159124, 0.8, 1.0, 1.5922759790810963, 0.2222222222222222] and parameters: {'seq_len': 8, 'lr': 0.00015141924235551835, 'pred_len': 10, 'num_epochs': 300}. 
[I 2024-09-26 18:52:03,938] Trial 2 finished with values: [1.0, 0.8703811515474831, 1.0, 1.0, 0.8836976336105551, 1.0, 1.0, 1.0000154896018982, 0.7777777777777778] and parameters: {'seq_len': 18, 'lr': 0.0063042880664864335, 'pred_len': 13, 'num_epochs': 300}. 
[I 2024-09-26 18:52:11,531] Trial 3 finished with values: [1.0, 1.6576036900543272, 0.0, 1.0, 0.992108647204397, 0.2, 1.0, 0.9966931141906284, 0.7777777777777778] and parameters: {'seq_len': 15, 'lr': 0.001331489781532703, 'pred_len': 8, 'num_epochs': 50}. 
[I 2024-09-26 18:52:27,243] Trial 4 finished with values: [1.0, 0.8688308079050906, 1.0, 1.0, 0.874497291066382, 1.0, 3.0, 1.0051738848460487, 0.7777777777777778] and parameters: {'seq_len': 4, 'lr': 0.006109850631391006, 'pred_len': 18, 'num_epochs': 300}. 
[I 2024-09-26 18:52:42,857] Trial 5 finished with values: [1.0, 0.8691704912144675, 1.0, 1.0, 0.8790071340736173, 1.0, 1.0, 1.0016460698162164, 0.7777777777777778] and parameters: {'seq_len': 14, 'lr': 0.0011787478049581153, 'pred_len': 1, 'num_epochs': 300}. 
[I 2024-09-26 18:52:50,645] Trial 6 finished with values: [1.0, 0.8698477651906386, 1.0, 1.0, 0.8804468794790713, 1.0, 1.0, 1.1217846316475524, 0.2222222222222222] and parameters: {'seq_len': 1, 'lr': 0.0009916516829751125, 'pred_len': 10, 'num_epochs': 50}. 
[I 2024-09-26 18:53:07,034] Trial 7 finished with values: [1.0, 0.879732667080621, 0.6, 1.0, 0.8982039551790696, 0.8, 1.0, 0.9957015885732444, 0.5555555555555556] and parameters: {'seq_len': 8, 'lr': 0.04335088431499359, 'pred_len': 2, 'num_epochs': 300}. 
[I 2024-09-26 18:53:16,193] Trial 8 finished with values: [1.0, 0.8695070786485836, 1.0, 1.0, 0.8796663677162987, 1.0, 1.0, 0.9945828208985246, 0.5555555555555556] and parameters: {'seq_len': 6, 'lr': 0.0004526998843390365, 'pred_len': 1, 'num_epochs': 100}. 
[I 2024-09-26 18:53:25,354] Trial 9 finished with values: [1.0, 0.8848690984342952, 0.5, 1.0, 0.8958336534177509, 0.8, 1.0, 0.9982595481620885, 0.6666666666666666] and parameters: {'seq_len': 23, 'lr': 0.005840670735795995, 'pred_len': 1, 'num_epochs': 100}. 
[I 2024-09-26 18:53:34,562] Trial 10 finished with values: [1.0, 0.8757741694023973, 1.0, 1.0, 0.8803064610161356, 1.0, 1.0, 0.9963414041990124, 0.7777777777777778] and parameters: {'seq_len': 16, 'lr': 0.0009582634093708982, 'pred_len': 9, 'num_epochs': 100}. 
[I 2024-09-26 18:53:42,291] Trial 11 finished with values: [1.0, 0.8685058263015704, 1.0, 1.0, 0.8777388719962996, 1.0, 1.0, 0.9912794489024774, 0.7777777777777778] and parameters: {'seq_len': 9, 'lr': 0.0011993874248604338, 'pred_len': 20, 'num_epochs': 50}. 
[I 2024-09-26 18:53:49,899] Trial 12 finished with values: [1.0, 1.390058018854523, 0.0, 3.0, 0.9752024996534017, 0.1, 1.0, 0.9980794500950396, 0.7777777777777778] and parameters: {'seq_len': 16, 'lr': 0.0009107712720643638, 'pred_len': 17, 'num_epochs': 50}. 
[I 2024-09-26 18:53:58,780] Trial 13 finished with values: [1.0, 1.2167488625562752, 0.0, 1.0, 1.303421918013373, 0.0, 1.0, 5.583259329896453, 0.2222222222222222] and parameters: {'seq_len': 5, 'lr': 1.9432701032406593e-05, 'pred_len': 23, 'num_epochs': 100}. 
[I 2024-09-26 18:54:06,574] Trial 14 finished with values: [1.0, 0.8868875917863579, 0.5, 1.0, 0.9190389400389164, 0.4, 1.0, 1.3371566544193298, 0.2222222222222222] and parameters: {'seq_len': 5, 'lr': 0.001022892834840911, 'pred_len': 2, 'num_epochs': 50}. 
[I 2024-09-26 18:54:21,390] Trial 15 finished with values: [1.0, 0.875473486898495, 0.9, 1.0, 0.8928375427912157, 0.9, 1.0, 1.0003908354468274, 0.7777777777777778] and parameters: {'seq_len': 22, 'lr': 0.030039411199841375, 'pred_len': 15, 'num_epochs': 300}. 
