[I 2024-09-26 00:38:38,697] Trial 17 finished with values: [4.0, 11.805770780378648, 0.0, 8.0, 8.490831669165289, 0.0, 3.0, 26.50257872731736, 0.5] and parameters: {'seq_len': 18, 'lr': 0.0009747567687055395, 'pred_len': 6, 'num_epochs': 100}. 
[I 2024-09-26 00:38:43,313] Trial 18 finished with values: [2.0, 11.705653097965522, 0.0, 3.0, 8.690664098194077, 0.0, 2.0, 30.008196761570364, 0.5] and parameters: {'seq_len': 16, 'lr': 0.0002497251662409865, 'pred_len': 6, 'num_epochs': 50}. 
[I 2024-09-26 00:38:56,916] Trial 19 finished with values: [4.0, 12.096196211910028, 0.0, 10.0, 9.143065653240267, 0.3333333333333333, 2.0, 29.69721035142595, 0.5] and parameters: {'seq_len': 13, 'lr': 0.012436703600540376, 'pred_len': 1, 'num_epochs': 300}. 
[I 2024-09-26 00:39:01,318] Trial 20 finished with values: [3.0, 14.963241006611424, 0.3333333333333333, 1.0, 15.013363677141033, 0.0, 1.0, 47.578405490984046, 0.0] and parameters: {'seq_len': 11, 'lr': 1.538077549798796e-05, 'pred_len': 25, 'num_epochs': 50}. 
[I 2024-09-26 00:39:14,466] Trial 21 finished with values: [4.0, 11.826070749404783, 0.0, 8.0, 8.483562307358435, 0.0, 3.0, 24.373084185441844, 0.5] and parameters: {'seq_len': 3, 'lr': 0.0007072798358142925, 'pred_len': 19, 'num_epochs': 300}. 
[I 2024-09-26 00:39:19,201] Trial 22 finished with values: [4.0, 12.210587875186935, 0.0, 3.0, 12.36854204846094, 0.3333333333333333, 1.0, 54.58456463269465, 0.0] and parameters: {'seq_len': 24, 'lr': 0.054395768973992176, 'pred_len': 18, 'num_epochs': 50}. 
[I 2024-09-26 00:39:32,264] Trial 23 finished with values: [4.0, 11.759744466768812, 0.0, 9.0, 8.898112300366583, 0.0, 2.0, 26.86804431934824, 0.5] and parameters: {'seq_len': 8, 'lr': 0.0012585211282382259, 'pred_len': 9, 'num_epochs': 300}. 
[I 2024-09-26 00:39:36,664] Trial 24 finished with values: [4.0, 13.843073148486377, 0.0, 1.0, 13.414131129883309, 0.3333333333333333, 1.0, 45.185223114880586, 0.0] and parameters: {'seq_len': 20, 'lr': 3.8939630347119615e-05, 'pred_len': 13, 'num_epochs': 50}. 
[I 2024-09-26 00:39:44,176] A new study created in memory with name: VAR predicting Belozyorov3DQuad(sigma=0.05)
[I 2024-09-26 00:39:45,767] Trial 0 finished with values: [3.0, 6.188838274622707, 0.6666666666666666, 7.0, 6.783890402797512, 0.6666666666666666, 6.0, 20.05453305309055, 1.0] and parameters: {'ic': 'fpe', 'maxlags': 2, 'trend': 'ct'}. 
[I 2024-09-26 00:39:47,673] Trial 1 finished with values: [4.0, 34.25185953222557, 0.0, 6.0, 6.8014782933125435, 0.0, 8.0, 653.2028053142495, 1.0] and parameters: {'ic': 'aic', 'maxlags': 1, 'trend': 'ctt'}. 
[I 2024-09-26 00:39:49,247] Trial 2 finished with values: [5.0, 13.426717315027696, 0.0, 10.0, 8.352200205198628, 0.0, 4.0, 325.25192903895453, 1.0] and parameters: {'ic': 'aic', 'maxlags': 1, 'trend': 'n'}. 
[I 2024-09-26 00:39:50,828] Trial 3 finished with values: [5.0, 12.891650032540657, 0.0, 15.0, 10.064916446420591, 0.0, 4.0, 30.606327187834403, 0.5] and parameters: {'ic': 'aic', 'maxlags': 4, 'trend': 'n'}. 
[I 2024-09-26 00:39:52,741] Trial 4 finished with values: [2.0, 6.235563463076762, 1.0, 9.0, 5.5230500758814705, 1.0, 5.0, 276.6306258586199, 1.0] and parameters: {'ic': 'aic', 'maxlags': 3, 'trend': 'c'}. 
[I 2024-09-26 00:39:54,328] Trial 5 finished with values: [5.0, 13.147661650300856, 0.0, 6.0, 13.376017310994053, 0.0, 3.0, 44.648283110413864, 0.0] and parameters: {'ic': 'fpe', 'maxlags': 2, 'trend': 'n'}. 
[I 2024-09-26 00:39:55,956] Trial 6 finished with values: [2.0, 20.064732810530973, 0.0, 8.0, 6.123836234196043, 0.3333333333333333, 6.0, 222.23911424093964, 1.0] and parameters: {'ic': 'aic', 'maxlags': 4, 'trend': 'ctt'}. 
[I 2024-09-26 00:39:57,856] Trial 7 finished with values: [5.0, 12.891650032540657, 0.0, 15.0, 10.064916446420591, 0.0, 4.0, 30.606327187834403, 0.5] and parameters: {'ic': 'fpe', 'maxlags': 4, 'trend': 'n'}. 
[I 2024-09-26 00:39:59,444] Trial 8 finished with values: [4.0, 7.384002570312733, 1.0, 6.0, 5.822056943916926, 1.0, 8.0, 318.88950049569854, 1.0] and parameters: {'ic': 'fpe', 'maxlags': 1, 'trend': 'c'}. 
[I 2024-09-26 00:40:01,013] Trial 9 finished with values: [5.0, 12.891650032540657, 0.0, 15.0, 10.064916446420591, 0.0, 4.0, 30.606327187834403, 0.5] and parameters: {'ic': 'fpe', 'maxlags': 4, 'trend': 'n'}. 
[I 2024-09-26 00:40:02,620] Trial 10 finished with values: [2.0, 20.59380657956641, 0.0, 9.0, 6.028551410751116, 0.0, 9.0, 904.2153339770471, 1.0] and parameters: {'ic': 'fpe', 'maxlags': 3, 'trend': 'ctt'}. 
[I 2024-09-26 00:40:04,575] Trial 11 finished with values: [5.0, 12.891650032540657, 0.0, 15.0, 10.064916446420591, 0.0, 4.0, 30.606327187834403, 0.5] and parameters: {'ic': 'aic', 'maxlags': 4, 'trend': 'n'}. 
[I 2024-09-26 00:40:06,188] Trial 12 finished with values: [5.0, 13.147661650300856, 0.0, 6.0, 13.376017310994053, 0.0, 3.0, 44.648283110413864, 0.0] and parameters: {'ic': 'fpe', 'maxlags': 2, 'trend': 'n'}. 
[I 2024-09-26 00:40:07,783] Trial 13 finished with values: [3.0, 6.188838274622707, 0.6666666666666666, 7.0, 6.783890402797512, 0.6666666666666666, 6.0, 20.05453305309055, 1.0] and parameters: {'ic': 'fpe', 'maxlags': 2, 'trend': 'ct'}. 
[I 2024-09-26 00:40:09,704] Trial 14 finished with values: [3.0, 6.188838274622707, 0.6666666666666666, 7.0, 6.783890402797512, 0.6666666666666666, 6.0, 20.05453305309055, 1.0] and parameters: {'ic': 'aic', 'maxlags': 2, 'trend': 'ct'}. 
[I 2024-09-26 00:40:11,256] Trial 15 finished with values: [2.0, 6.505639640456266, 1.0, 9.0, 5.90833071461775, 1.0, 5.0, 86.27330412358288, 1.0] and parameters: {'ic': 'fpe', 'maxlags': 4, 'trend': 'c'}. 
[I 2024-09-26 00:40:12,859] Trial 16 finished with values: [2.0, 20.064732810530973, 0.0, 8.0, 6.123836234196043, 0.3333333333333333, 6.0, 222.23911424093964, 1.0] and parameters: {'ic': 'fpe', 'maxlags': 4, 'trend': 'ctt'}. 
[I 2024-09-26 00:40:14,447] Trial 17 finished with values: [5.0, 13.426717315027696, 0.0, 10.0, 8.352200205198628, 0.0, 4.0, 325.25192903895453, 1.0] and parameters: {'ic': 'aic', 'maxlags': 1, 'trend': 'n'}. 
[I 2024-09-26 00:40:16,407] Trial 18 finished with values: [5.0, 12.891650032540657, 0.0, 15.0, 10.064916446420591, 0.0, 4.0, 17.93813438248974, 0.5] and parameters: {'ic': 'fpe', 'maxlags': 5, 'trend': 'n'}. 
[I 2024-09-26 00:40:17,993] Trial 19 finished with values: [2.0, 6.505639640456266, 1.0, 9.0, 5.90833071461775, 1.0, 6.0, 336.7040084659872, 1.0] and parameters: {'ic': 'aic', 'maxlags': 5, 'trend': 'c'}. 
[I 2024-09-26 00:40:19,565] Trial 20 finished with values: [3.0, 6.188838274622707, 0.6666666666666666, 7.0, 6.783890402797512, 0.6666666666666666, 6.0, 20.05453305309055, 1.0] and parameters: {'ic': 'fpe', 'maxlags': 2, 'trend': 'ct'}. 
[I 2024-09-26 00:40:21,151] Trial 21 finished with values: [2.0, 7.645669337594556, 0.0, 5.0, 6.904958813229641, 0.3333333333333333, 8.0, 697.8863286376269, 1.0] and parameters: {'ic': 'fpe', 'maxlags': 5, 'trend': 'ct'}. 
[I 2024-09-26 00:40:23,052] Trial 22 finished with values: [2.0, 5.9899490463646075, 1.0, 7.0, 6.5217642984084, 1.0, 4.0, 8.375034611134318, 1.0] and parameters: {'ic': 'fpe', 'maxlags': 2, 'trend': 'c'}. 
[I 2024-09-26 00:40:24,658] Trial 23 finished with values: [3.0, 6.6131167309720285, 0.3333333333333333, 10.0, 6.148848946744591, 0.6666666666666666, 8.0, 571.1637395041506, 1.0] and parameters: {'ic': 'fpe', 'maxlags': 3, 'trend': 'ct'}. 
[I 2024-09-26 00:40:26,232] Trial 24 finished with values: [4.0, 7.384002570312733, 1.0, 6.0, 5.822056943916926, 1.0, 8.0, 318.88950049569854, 1.0] and parameters: {'ic': 'aic', 'maxlags': 1, 'trend': 'c'}. 
[I 2024-09-26 00:40:33,462] A new study created in memory with name: LSTM predicting Belozyorov3DQuad(sigma=0.05)
SLURM auto-requeueing enabled. Setting signal handlers.
SLURM auto-requeueing enabled. Setting signal handlers.
SLURM auto-requeueing enabled. Setting signal handlers.
SLURM auto-requeueing enabled. Setting signal handlers.
SLURM auto-requeueing enabled. Setting signal handlers.
SLURM auto-requeueing enabled. Setting signal handlers.
SLURM auto-requeueing enabled. Setting signal handlers.
SLURM auto-requeueing enabled. Setting signal handlers.
SLURM auto-requeueing enabled. Setting signal handlers.
SLURM auto-requeueing enabled. Setting signal handlers.
SLURM auto-requeueing enabled. Setting signal handlers.
SLURM auto-requeueing enabled. Setting signal handlers.
SLURM auto-requeueing enabled. Setting signal handlers.
SLURM auto-requeueing enabled. Setting signal handlers.
SLURM auto-requeueing enabled. Setting signal handlers.
SLURM auto-requeueing enabled. Setting signal handlers.
SLURM auto-requeueing enabled. Setting signal handlers.
SLURM auto-requeueing enabled. Setting signal handlers.
SLURM auto-requeueing enabled. Setting signal handlers.
SLURM auto-requeueing enabled. Setting signal handlers.
SLURM auto-requeueing enabled. Setting signal handlers.
SLURM auto-requeueing enabled. Setting signal handlers.
SLURM auto-requeueing enabled. Setting signal handlers.
SLURM auto-requeueing enabled. Setting signal handlers.
SLURM auto-requeueing enabled. Setting signal handlers.
SLURM auto-requeueing enabled. Setting signal handlers.
[I 2024-09-26 00:41:12,255] Trial 0 finished with values: [4.0, 13.10430476831082, 0.0, 13.0, 4.6187751007519555, 0.6666666666666666, 1.0, 34.67781488030931, 0.0] and parameters: {'h': 11, 'encoder_hidden_size': 100, 'encoder_n_layers': 3, 'context_size': 50, 'decoder_hidden_size': 128, 'learning_rate': 0.0004386279011755984, 'max_steps': 500, 'batch_size': 32, 'random_seed': 8}. 
SLURM auto-requeueing enabled. Setting signal handlers.
SLURM auto-requeueing enabled. Setting signal handlers.
SLURM auto-requeueing enabled. Setting signal handlers.
SLURM auto-requeueing enabled. Setting signal handlers.
SLURM auto-requeueing enabled. Setting signal handlers.
SLURM auto-requeueing enabled. Setting signal handlers.
SLURM auto-requeueing enabled. Setting signal handlers.
SLURM auto-requeueing enabled. Setting signal handlers.
SLURM auto-requeueing enabled. Setting signal handlers.
SLURM auto-requeueing enabled. Setting signal handlers.
SLURM auto-requeueing enabled. Setting signal handlers.
SLURM auto-requeueing enabled. Setting signal handlers.
SLURM auto-requeueing enabled. Setting signal handlers.
SLURM auto-requeueing enabled. Setting signal handlers.
SLURM auto-requeueing enabled. Setting signal handlers.
SLURM auto-requeueing enabled. Setting signal handlers.
SLURM auto-requeueing enabled. Setting signal handlers.
SLURM auto-requeueing enabled. Setting signal handlers.
SLURM auto-requeueing enabled. Setting signal handlers.
SLURM auto-requeueing enabled. Setting signal handlers.
SLURM auto-requeueing enabled. Setting signal handlers.
SLURM auto-requeueing enabled. Setting signal handlers.
SLURM auto-requeueing enabled. Setting signal handlers.
SLURM auto-requeueing enabled. Setting signal handlers.
SLURM auto-requeueing enabled. Setting signal handlers.
SLURM auto-requeueing enabled. Setting signal handlers.
SLURM auto-requeueing enabled. Setting signal handlers.
SLURM auto-requeueing enabled. Setting signal handlers.
SLURM auto-requeueing enabled. Setting signal handlers.
SLURM auto-requeueing enabled. Setting signal handlers.
SLURM auto-requeueing enabled. Setting signal handlers.
SLURM auto-requeueing enabled. Setting signal handlers.
SLURM auto-requeueing enabled. Setting signal handlers.
SLURM auto-requeueing enabled. Setting signal handlers.
SLURM auto-requeueing enabled. Setting signal handlers.
SLURM auto-requeueing enabled. Setting signal handlers.
SLURM auto-requeueing enabled. Setting signal handlers.
SLURM auto-requeueing enabled. Setting signal handlers.
SLURM auto-requeueing enabled. Setting signal handlers.
SLURM auto-requeueing enabled. Setting signal handlers.
SLURM auto-requeueing enabled. Setting signal handlers.
SLURM auto-requeueing enabled. Setting signal handlers.
SLURM auto-requeueing enabled. Setting signal handlers.
SLURM auto-requeueing enabled. Setting signal handlers.
SLURM auto-requeueing enabled. Setting signal handlers.
SLURM auto-requeueing enabled. Setting signal handlers.
SLURM auto-requeueing enabled. Setting signal handlers.
SLURM auto-requeueing enabled. Setting signal handlers.
SLURM auto-requeueing enabled. Setting signal handlers.
SLURM auto-requeueing enabled. Setting signal handlers.
SLURM auto-requeueing enabled. Setting signal handlers.
SLURM auto-requeueing enabled. Setting signal handlers.
SLURM auto-requeueing enabled. Setting signal handlers.
SLURM auto-requeueing enabled. Setting signal handlers.
SLURM auto-requeueing enabled. Setting signal handlers.
SLURM auto-requeueing enabled. Setting signal handlers.
SLURM auto-requeueing enabled. Setting signal handlers.
SLURM auto-requeueing enabled. Setting signal handlers.
SLURM auto-requeueing enabled. Setting signal handlers.
SLURM auto-requeueing enabled. Setting signal handlers.
SLURM auto-requeueing enabled. Setting signal handlers.
SLURM auto-requeueing enabled. Setting signal handlers.
SLURM auto-requeueing enabled. Setting signal handlers.
SLURM auto-requeueing enabled. Setting signal handlers.
SLURM auto-requeueing enabled. Setting signal handlers.
SLURM auto-requeueing enabled. Setting signal handlers.
SLURM auto-requeueing enabled. Setting signal handlers.
SLURM auto-requeueing enabled. Setting signal handlers.
SLURM auto-requeueing enabled. Setting signal handlers.
SLURM auto-requeueing enabled. Setting signal handlers.
SLURM auto-requeueing enabled. Setting signal handlers.
SLURM auto-requeueing enabled. Setting signal handlers.
SLURM auto-requeueing enabled. Setting signal handlers.
SLURM auto-requeueing enabled. Setting signal handlers.
SLURM auto-requeueing enabled. Setting signal handlers.
SLURM auto-requeueing enabled. Setting signal handlers.
SLURM auto-requeueing enabled. Setting signal handlers.
SLURM auto-requeueing enabled. Setting signal handlers.
SLURM auto-requeueing enabled. Setting signal handlers.
SLURM auto-requeueing enabled. Setting signal handlers.
SLURM auto-requeueing enabled. Setting signal handlers.
SLURM auto-requeueing enabled. Setting signal handlers.
SLURM auto-requeueing enabled. Setting signal handlers.
SLURM auto-requeueing enabled. Setting signal handlers.
SLURM auto-requeueing enabled. Setting signal handlers.
SLURM auto-requeueing enabled. Setting signal handlers.
[I 2024-09-26 00:57:20,266] Trial 1 finished with values: [5.0, 13.226631026246016, 0.0, 1.0, 4.550914382491698, 0.6666666666666666, 1.0, 40.01931007614376, 0.0] and parameters: {'h': 3, 'encoder_hidden_size': 300, 'encoder_n_layers': 4, 'context_size': 10, 'decoder_hidden_size': 128, 'learning_rate': 0.02712159677393731, 'max_steps': 500, 'batch_size': 16, 'random_seed': 10}. 
SLURM auto-requeueing enabled. Setting signal handlers.
SLURM auto-requeueing enabled. Setting signal handlers.
SLURM auto-requeueing enabled. Setting signal handlers.
SLURM auto-requeueing enabled. Setting signal handlers.
SLURM auto-requeueing enabled. Setting signal handlers.
SLURM auto-requeueing enabled. Setting signal handlers.
SLURM auto-requeueing enabled. Setting signal handlers.
SLURM auto-requeueing enabled. Setting signal handlers.
SLURM auto-requeueing enabled. Setting signal handlers.
SLURM auto-requeueing enabled. Setting signal handlers.
SLURM auto-requeueing enabled. Setting signal handlers.
SLURM auto-requeueing enabled. Setting signal handlers.
SLURM auto-requeueing enabled. Setting signal handlers.
SLURM auto-requeueing enabled. Setting signal handlers.
SLURM auto-requeueing enabled. Setting signal handlers.
SLURM auto-requeueing enabled. Setting signal handlers.
SLURM auto-requeueing enabled. Setting signal handlers.
SLURM auto-requeueing enabled. Setting signal handlers.
SLURM auto-requeueing enabled. Setting signal handlers.
SLURM auto-requeueing enabled. Setting signal handlers.
SLURM auto-requeueing enabled. Setting signal handlers.
[I 2024-09-26 00:58:14,909] Trial 2 finished with values: [5.0, 13.208045629052892, 0.0, 17.0, 4.5035155659567865, 1.0, 1.0, 30.5117686693133, 0.0] and parameters: {'h': 14, 'encoder_hidden_size': 200, 'encoder_n_layers': 1, 'context_size': 5, 'decoder_hidden_size': 64, 'learning_rate': 0.014742192373852738, 'max_steps': 1000, 'batch_size': 16, 'random_seed': 14}. 
SLURM auto-requeueing enabled. Setting signal handlers.
SLURM auto-requeueing enabled. Setting signal handlers.
SLURM auto-requeueing enabled. Setting signal handlers.
SLURM auto-requeueing enabled. Setting signal handlers.
SLURM auto-requeueing enabled. Setting signal handlers.
SLURM auto-requeueing enabled. Setting signal handlers.
SLURM auto-requeueing enabled. Setting signal handlers.
SLURM auto-requeueing enabled. Setting signal handlers.
SLURM auto-requeueing enabled. Setting signal handlers.
SLURM auto-requeueing enabled. Setting signal handlers.
SLURM auto-requeueing enabled. Setting signal handlers.
SLURM auto-requeueing enabled. Setting signal handlers.
SLURM auto-requeueing enabled. Setting signal handlers.
SLURM auto-requeueing enabled. Setting signal handlers.
SLURM auto-requeueing enabled. Setting signal handlers.
SLURM auto-requeueing enabled. Setting signal handlers.
SLURM auto-requeueing enabled. Setting signal handlers.
SLURM auto-requeueing enabled. Setting signal handlers.
SLURM auto-requeueing enabled. Setting signal handlers.
SLURM auto-requeueing enabled. Setting signal handlers.
SLURM auto-requeueing enabled. Setting signal handlers.
SLURM auto-requeueing enabled. Setting signal handlers.
SLURM auto-requeueing enabled. Setting signal handlers.
SLURM auto-requeueing enabled. Setting signal handlers.
SLURM auto-requeueing enabled. Setting signal handlers.
SLURM auto-requeueing enabled. Setting signal handlers.
SLURM auto-requeueing enabled. Setting signal handlers.
SLURM auto-requeueing enabled. Setting signal handlers.
SLURM auto-requeueing enabled. Setting signal handlers.
SLURM auto-requeueing enabled. Setting signal handlers.
SLURM auto-requeueing enabled. Setting signal handlers.
SLURM auto-requeueing enabled. Setting signal handlers.
SLURM auto-requeueing enabled. Setting signal handlers.
SLURM auto-requeueing enabled. Setting signal handlers.
SLURM auto-requeueing enabled. Setting signal handlers.
SLURM auto-requeueing enabled. Setting signal handlers.
SLURM auto-requeueing enabled. Setting signal handlers.
SLURM auto-requeueing enabled. Setting signal handlers.
SLURM auto-requeueing enabled. Setting signal handlers.
SLURM auto-requeueing enabled. Setting signal handlers.
SLURM auto-requeueing enabled. Setting signal handlers.
SLURM auto-requeueing enabled. Setting signal handlers.
SLURM auto-requeueing enabled. Setting signal handlers.
SLURM auto-requeueing enabled. Setting signal handlers.
SLURM auto-requeueing enabled. Setting signal handlers.
SLURM auto-requeueing enabled. Setting signal handlers.
SLURM auto-requeueing enabled. Setting signal handlers.
SLURM auto-requeueing enabled. Setting signal handlers.
SLURM auto-requeueing enabled. Setting signal handlers.
SLURM auto-requeueing enabled. Setting signal handlers.
SLURM auto-requeueing enabled. Setting signal handlers.
SLURM auto-requeueing enabled. Setting signal handlers.
SLURM auto-requeueing enabled. Setting signal handlers.
SLURM auto-requeueing enabled. Setting signal handlers.
SLURM auto-requeueing enabled. Setting signal handlers.
SLURM auto-requeueing enabled. Setting signal handlers.
SLURM auto-requeueing enabled. Setting signal handlers.
SLURM auto-requeueing enabled. Setting signal handlers.
SLURM auto-requeueing enabled. Setting signal handlers.
SLURM auto-requeueing enabled. Setting signal handlers.
SLURM auto-requeueing enabled. Setting signal handlers.
SLURM auto-requeueing enabled. Setting signal handlers.
SLURM auto-requeueing enabled. Setting signal handlers.
SLURM auto-requeueing enabled. Setting signal handlers.
SLURM auto-requeueing enabled. Setting signal handlers.
SLURM auto-requeueing enabled. Setting signal handlers.
[I 2024-09-26 00:58:37,525] Trial 3 finished with values: [5.0, 13.224468863188271, 0.0, 17.0, 5.394690183822129, 0.6666666666666666, 2.0, 25.020289739384193, 0.0] and parameters: {'h': 4, 'encoder_hidden_size': 50, 'encoder_n_layers': 2, 'context_size': 50, 'decoder_hidden_size': 128, 'learning_rate': 0.0001452246335983781, 'max_steps': 500, 'batch_size': 32, 'random_seed': 14}. 
SLURM auto-requeueing enabled. Setting signal handlers.
SLURM auto-requeueing enabled. Setting signal handlers.
SLURM auto-requeueing enabled. Setting signal handlers.
SLURM auto-requeueing enabled. Setting signal handlers.
SLURM auto-requeueing enabled. Setting signal handlers.
SLURM auto-requeueing enabled. Setting signal handlers.
SLURM auto-requeueing enabled. Setting signal handlers.
SLURM auto-requeueing enabled. Setting signal handlers.
SLURM auto-requeueing enabled. Setting signal handlers.
SLURM auto-requeueing enabled. Setting signal handlers.
SLURM auto-requeueing enabled. Setting signal handlers.
SLURM auto-requeueing enabled. Setting signal handlers.
SLURM auto-requeueing enabled. Setting signal handlers.
SLURM auto-requeueing enabled. Setting signal handlers.
SLURM auto-requeueing enabled. Setting signal handlers.
SLURM auto-requeueing enabled. Setting signal handlers.
SLURM auto-requeueing enabled. Setting signal handlers.
SLURM auto-requeueing enabled. Setting signal handlers.
SLURM auto-requeueing enabled. Setting signal handlers.
SLURM auto-requeueing enabled. Setting signal handlers.
SLURM auto-requeueing enabled. Setting signal handlers.
SLURM auto-requeueing enabled. Setting signal handlers.
SLURM auto-requeueing enabled. Setting signal handlers.
SLURM auto-requeueing enabled. Setting signal handlers.
SLURM auto-requeueing enabled. Setting signal handlers.
SLURM auto-requeueing enabled. Setting signal handlers.
SLURM auto-requeueing enabled. Setting signal handlers.
