[I 2024-09-26 00:16:43,369] Trial 22 finished with values: [1.0, 1.2713852146176956, 0.1, 1.0, 0.9067829148469525, 0.2, 1.0, 1.7994806570077928, 0.1111111111111111] and parameters: {'h': 2, 'n_pool_kernel_size': [16, 8, 1], 'n_freq_downsample': [1, 1, 1], 'learning_rate': 0.0004590784620847119, 'scaler_type': 'standard', 'max_steps': 800.0, 'batch_size': 128, 'windows_batch_size': 256, 'random_seed': 3}. 
SLURM auto-requeueing enabled. Setting signal handlers.
SLURM auto-requeueing enabled. Setting signal handlers.
SLURM auto-requeueing enabled. Setting signal handlers.
SLURM auto-requeueing enabled. Setting signal handlers.
SLURM auto-requeueing enabled. Setting signal handlers.
SLURM auto-requeueing enabled. Setting signal handlers.
SLURM auto-requeueing enabled. Setting signal handlers.
SLURM auto-requeueing enabled. Setting signal handlers.
SLURM auto-requeueing enabled. Setting signal handlers.
SLURM auto-requeueing enabled. Setting signal handlers.
SLURM auto-requeueing enabled. Setting signal handlers.
SLURM auto-requeueing enabled. Setting signal handlers.
SLURM auto-requeueing enabled. Setting signal handlers.
SLURM auto-requeueing enabled. Setting signal handlers.
SLURM auto-requeueing enabled. Setting signal handlers.
SLURM auto-requeueing enabled. Setting signal handlers.
SLURM auto-requeueing enabled. Setting signal handlers.
SLURM auto-requeueing enabled. Setting signal handlers.
SLURM auto-requeueing enabled. Setting signal handlers.
SLURM auto-requeueing enabled. Setting signal handlers.
SLURM auto-requeueing enabled. Setting signal handlers.
SLURM auto-requeueing enabled. Setting signal handlers.
SLURM auto-requeueing enabled. Setting signal handlers.
SLURM auto-requeueing enabled. Setting signal handlers.
SLURM auto-requeueing enabled. Setting signal handlers.
SLURM auto-requeueing enabled. Setting signal handlers.
SLURM auto-requeueing enabled. Setting signal handlers.
SLURM auto-requeueing enabled. Setting signal handlers.
SLURM auto-requeueing enabled. Setting signal handlers.
SLURM auto-requeueing enabled. Setting signal handlers.
SLURM auto-requeueing enabled. Setting signal handlers.
SLURM auto-requeueing enabled. Setting signal handlers.
SLURM auto-requeueing enabled. Setting signal handlers.
SLURM auto-requeueing enabled. Setting signal handlers.
SLURM auto-requeueing enabled. Setting signal handlers.
SLURM auto-requeueing enabled. Setting signal handlers.
SLURM auto-requeueing enabled. Setting signal handlers.
SLURM auto-requeueing enabled. Setting signal handlers.
SLURM auto-requeueing enabled. Setting signal handlers.
SLURM auto-requeueing enabled. Setting signal handlers.
SLURM auto-requeueing enabled. Setting signal handlers.
SLURM auto-requeueing enabled. Setting signal handlers.
SLURM auto-requeueing enabled. Setting signal handlers.
SLURM auto-requeueing enabled. Setting signal handlers.
SLURM auto-requeueing enabled. Setting signal handlers.
SLURM auto-requeueing enabled. Setting signal handlers.
SLURM auto-requeueing enabled. Setting signal handlers.
SLURM auto-requeueing enabled. Setting signal handlers.
SLURM auto-requeueing enabled. Setting signal handlers.
SLURM auto-requeueing enabled. Setting signal handlers.
SLURM auto-requeueing enabled. Setting signal handlers.
SLURM auto-requeueing enabled. Setting signal handlers.
SLURM auto-requeueing enabled. Setting signal handlers.
SLURM auto-requeueing enabled. Setting signal handlers.
SLURM auto-requeueing enabled. Setting signal handlers.
SLURM auto-requeueing enabled. Setting signal handlers.
SLURM auto-requeueing enabled. Setting signal handlers.
SLURM auto-requeueing enabled. Setting signal handlers.
SLURM auto-requeueing enabled. Setting signal handlers.
SLURM auto-requeueing enabled. Setting signal handlers.
SLURM auto-requeueing enabled. Setting signal handlers.
SLURM auto-requeueing enabled. Setting signal handlers.
SLURM auto-requeueing enabled. Setting signal handlers.
SLURM auto-requeueing enabled. Setting signal handlers.
SLURM auto-requeueing enabled. Setting signal handlers.
SLURM auto-requeueing enabled. Setting signal handlers.
SLURM auto-requeueing enabled. Setting signal handlers.
SLURM auto-requeueing enabled. Setting signal handlers.
SLURM auto-requeueing enabled. Setting signal handlers.
SLURM auto-requeueing enabled. Setting signal handlers.
SLURM auto-requeueing enabled. Setting signal handlers.
SLURM auto-requeueing enabled. Setting signal handlers.
SLURM auto-requeueing enabled. Setting signal handlers.
SLURM auto-requeueing enabled. Setting signal handlers.
SLURM auto-requeueing enabled. Setting signal handlers.
SLURM auto-requeueing enabled. Setting signal handlers.
SLURM auto-requeueing enabled. Setting signal handlers.
SLURM auto-requeueing enabled. Setting signal handlers.
SLURM auto-requeueing enabled. Setting signal handlers.
SLURM auto-requeueing enabled. Setting signal handlers.
SLURM auto-requeueing enabled. Setting signal handlers.
SLURM auto-requeueing enabled. Setting signal handlers.
SLURM auto-requeueing enabled. Setting signal handlers.
SLURM auto-requeueing enabled. Setting signal handlers.
SLURM auto-requeueing enabled. Setting signal handlers.
SLURM auto-requeueing enabled. Setting signal handlers.
SLURM auto-requeueing enabled. Setting signal handlers.
SLURM auto-requeueing enabled. Setting signal handlers.
SLURM auto-requeueing enabled. Setting signal handlers.
SLURM auto-requeueing enabled. Setting signal handlers.
SLURM auto-requeueing enabled. Setting signal handlers.
SLURM auto-requeueing enabled. Setting signal handlers.
SLURM auto-requeueing enabled. Setting signal handlers.
SLURM auto-requeueing enabled. Setting signal handlers.
SLURM auto-requeueing enabled. Setting signal handlers.
SLURM auto-requeueing enabled. Setting signal handlers.
SLURM auto-requeueing enabled. Setting signal handlers.
SLURM auto-requeueing enabled. Setting signal handlers.
SLURM auto-requeueing enabled. Setting signal handlers.
SLURM auto-requeueing enabled. Setting signal handlers.
SLURM auto-requeueing enabled. Setting signal handlers.
SLURM auto-requeueing enabled. Setting signal handlers.
SLURM auto-requeueing enabled. Setting signal handlers.
SLURM auto-requeueing enabled. Setting signal handlers.
SLURM auto-requeueing enabled. Setting signal handlers.
SLURM auto-requeueing enabled. Setting signal handlers.
SLURM auto-requeueing enabled. Setting signal handlers.
SLURM auto-requeueing enabled. Setting signal handlers.
SLURM auto-requeueing enabled. Setting signal handlers.
SLURM auto-requeueing enabled. Setting signal handlers.
SLURM auto-requeueing enabled. Setting signal handlers.
SLURM auto-requeueing enabled. Setting signal handlers.
SLURM auto-requeueing enabled. Setting signal handlers.
SLURM auto-requeueing enabled. Setting signal handlers.
SLURM auto-requeueing enabled. Setting signal handlers.
SLURM auto-requeueing enabled. Setting signal handlers.
SLURM auto-requeueing enabled. Setting signal handlers.
SLURM auto-requeueing enabled. Setting signal handlers.
SLURM auto-requeueing enabled. Setting signal handlers.
SLURM auto-requeueing enabled. Setting signal handlers.
SLURM auto-requeueing enabled. Setting signal handlers.
SLURM auto-requeueing enabled. Setting signal handlers.
SLURM auto-requeueing enabled. Setting signal handlers.
SLURM auto-requeueing enabled. Setting signal handlers.
SLURM auto-requeueing enabled. Setting signal handlers.
SLURM auto-requeueing enabled. Setting signal handlers.
SLURM auto-requeueing enabled. Setting signal handlers.
[I 2024-09-26 00:20:50,119] Trial 23 finished with values: [1.0, 1.267894454977244, 0.1, 1.0, 0.9061761866307256, 0.2, 1.0, 1178.8478626925862, 0.1111111111111111] and parameters: {'h': 2, 'n_pool_kernel_size': [8, 4, 1], 'n_freq_downsample': [40, 20, 1], 'learning_rate': 0.0031725696158825117, 'scaler_type': 'standard', 'max_steps': 800.0, 'batch_size': 256, 'windows_batch_size': 512, 'random_seed': 2}. 
SLURM auto-requeueing enabled. Setting signal handlers.
SLURM auto-requeueing enabled. Setting signal handlers.
SLURM auto-requeueing enabled. Setting signal handlers.
SLURM auto-requeueing enabled. Setting signal handlers.
SLURM auto-requeueing enabled. Setting signal handlers.
SLURM auto-requeueing enabled. Setting signal handlers.
SLURM auto-requeueing enabled. Setting signal handlers.
SLURM auto-requeueing enabled. Setting signal handlers.
SLURM auto-requeueing enabled. Setting signal handlers.
SLURM auto-requeueing enabled. Setting signal handlers.
SLURM auto-requeueing enabled. Setting signal handlers.
SLURM auto-requeueing enabled. Setting signal handlers.
SLURM auto-requeueing enabled. Setting signal handlers.
SLURM auto-requeueing enabled. Setting signal handlers.
SLURM auto-requeueing enabled. Setting signal handlers.
SLURM auto-requeueing enabled. Setting signal handlers.
SLURM auto-requeueing enabled. Setting signal handlers.
SLURM auto-requeueing enabled. Setting signal handlers.
SLURM auto-requeueing enabled. Setting signal handlers.
SLURM auto-requeueing enabled. Setting signal handlers.
SLURM auto-requeueing enabled. Setting signal handlers.
SLURM auto-requeueing enabled. Setting signal handlers.
SLURM auto-requeueing enabled. Setting signal handlers.
SLURM auto-requeueing enabled. Setting signal handlers.
SLURM auto-requeueing enabled. Setting signal handlers.
SLURM auto-requeueing enabled. Setting signal handlers.
SLURM auto-requeueing enabled. Setting signal handlers.
SLURM auto-requeueing enabled. Setting signal handlers.
SLURM auto-requeueing enabled. Setting signal handlers.
SLURM auto-requeueing enabled. Setting signal handlers.
SLURM auto-requeueing enabled. Setting signal handlers.
SLURM auto-requeueing enabled. Setting signal handlers.
SLURM auto-requeueing enabled. Setting signal handlers.
SLURM auto-requeueing enabled. Setting signal handlers.
SLURM auto-requeueing enabled. Setting signal handlers.
SLURM auto-requeueing enabled. Setting signal handlers.
SLURM auto-requeueing enabled. Setting signal handlers.
SLURM auto-requeueing enabled. Setting signal handlers.
SLURM auto-requeueing enabled. Setting signal handlers.
SLURM auto-requeueing enabled. Setting signal handlers.
SLURM auto-requeueing enabled. Setting signal handlers.
SLURM auto-requeueing enabled. Setting signal handlers.
SLURM auto-requeueing enabled. Setting signal handlers.
SLURM auto-requeueing enabled. Setting signal handlers.
SLURM auto-requeueing enabled. Setting signal handlers.
SLURM auto-requeueing enabled. Setting signal handlers.
SLURM auto-requeueing enabled. Setting signal handlers.
SLURM auto-requeueing enabled. Setting signal handlers.
SLURM auto-requeueing enabled. Setting signal handlers.
SLURM auto-requeueing enabled. Setting signal handlers.
SLURM auto-requeueing enabled. Setting signal handlers.
SLURM auto-requeueing enabled. Setting signal handlers.
SLURM auto-requeueing enabled. Setting signal handlers.
SLURM auto-requeueing enabled. Setting signal handlers.
SLURM auto-requeueing enabled. Setting signal handlers.
SLURM auto-requeueing enabled. Setting signal handlers.
SLURM auto-requeueing enabled. Setting signal handlers.
SLURM auto-requeueing enabled. Setting signal handlers.
SLURM auto-requeueing enabled. Setting signal handlers.
SLURM auto-requeueing enabled. Setting signal handlers.
SLURM auto-requeueing enabled. Setting signal handlers.
SLURM auto-requeueing enabled. Setting signal handlers.
SLURM auto-requeueing enabled. Setting signal handlers.
SLURM auto-requeueing enabled. Setting signal handlers.
SLURM auto-requeueing enabled. Setting signal handlers.
SLURM auto-requeueing enabled. Setting signal handlers.
SLURM auto-requeueing enabled. Setting signal handlers.
SLURM auto-requeueing enabled. Setting signal handlers.
SLURM auto-requeueing enabled. Setting signal handlers.
SLURM auto-requeueing enabled. Setting signal handlers.
SLURM auto-requeueing enabled. Setting signal handlers.
SLURM auto-requeueing enabled. Setting signal handlers.
SLURM auto-requeueing enabled. Setting signal handlers.
SLURM auto-requeueing enabled. Setting signal handlers.
SLURM auto-requeueing enabled. Setting signal handlers.
SLURM auto-requeueing enabled. Setting signal handlers.
SLURM auto-requeueing enabled. Setting signal handlers.
SLURM auto-requeueing enabled. Setting signal handlers.
SLURM auto-requeueing enabled. Setting signal handlers.
SLURM auto-requeueing enabled. Setting signal handlers.
SLURM auto-requeueing enabled. Setting signal handlers.
SLURM auto-requeueing enabled. Setting signal handlers.
SLURM auto-requeueing enabled. Setting signal handlers.
SLURM auto-requeueing enabled. Setting signal handlers.
SLURM auto-requeueing enabled. Setting signal handlers.
SLURM auto-requeueing enabled. Setting signal handlers.
[I 2024-09-26 00:29:32,094] Trial 24 finished with values: [1.0, 66.23471239631256, 0.2, 1.0, 41.72008107236623, 0.1, 1.0, 3764475382.152549, 0.0] and parameters: {'h': 3, 'n_pool_kernel_size': [8, 4, 1], 'n_freq_downsample': [60, 8, 1], 'learning_rate': 0.020513190832249558, 'scaler_type': 'robust', 'max_steps': 1000.0, 'batch_size': 64, 'windows_batch_size': 1024, 'random_seed': 4}. 
[I 2024-09-26 00:29:38,758] A new study created in memory with name: ResComp predicting coupled_logistic_map(sigma=0.05)
/nas/longleaf/home/djpassey/.local/lib/python3.9/site-packages/scipy/integrate/_odepack_py.py:248: ODEintWarning: Excess work done on this call (perhaps wrong Dfun type). Run with full_output = 1 to get quantitative information.
  warnings.warn(warning_msg, ODEintWarning)
/nas/longleaf/home/djpassey/.local/lib/python3.9/site-packages/interfere/methods/reservoir_computer.py:480: RuntimeWarning: overflow encountered in matmul
  pred = self.W_out_ @ states.T
/nas/longleaf/home/djpassey/.local/lib/python3.9/site-packages/interfere/methods/reservoir_computer.py:480: RuntimeWarning: invalid value encountered in matmul
  pred = self.W_out_ @ states.T
[I 2024-09-26 00:29:49,554] Trial 0 finished with values: [1.0, 3780164974.612195, 0.0, 2.0, 1946906389.6699421, 0.0, 1.0, 1.4601221296443367, 0.6666666666666666] and parameters: {'gamma': 13.15479016919311, 'sigma': 10.449086105004996, 'delta': 60.1224599455949, 'mean_degree': 2.637574247972842, 'res_sz': 46, 'window': 0.0025868720321197834, 'spect_rad': 28.244571422956636, 'ridge_alpha': 9.825676181628925e-05}. 
[I 2024-09-26 00:30:00,342] Trial 1 finished with values: [1.0, 2726624035.17236, 0.0, 2.0, 2020400243.2651353, 0.0, 1.0, 2154436486.0976534, 0.0] and parameters: {'gamma': 118.18401891398157, 'sigma': 89.34669503344402, 'delta': 47.39872224103718, 'mean_degree': 4.753463333661775, 'res_sz': 100, 'window': 0.0038930087656135763, 'spect_rad': 0.0013927461220092122, 'ridge_alpha': 8.499027826994703e-08}. 
[I 2024-09-26 00:30:07,498] Trial 2 finished with values: [0.0, 7.2454245400382495, 0.1, 0.0, 2353695054.2998056, 0.0, 1.0, 1.791413022603097, 0.3333333333333333] and parameters: {'gamma': 484.39214100312745, 'sigma': 3.9316735733359547, 'delta': 79.89712381490455, 'mean_degree': 3.176264566027683, 'res_sz': 54, 'window': 7.6347508674678215, 'spect_rad': 0.01683012175530547, 'ridge_alpha': 0.0003022847265202192}. 
[I 2024-09-26 00:30:19,706] Trial 3 finished with values: [1.0, 1.2235734946126269, 0.4, 1.0, 0.895368089187301, 0.6, 1.0, 1.614582683541361, 0.0] and parameters: {'gamma': 480.6467561666258, 'sigma': 70.51897784612264, 'delta': 37.350097887149175, 'mean_degree': 1.504156423135435, 'res_sz': 14, 'window': 0.10015754157937488, 'spect_rad': 13.579229467319708, 'ridge_alpha': 0.5994647317551356}. 
[I 2024-09-26 00:30:30,801] Trial 4 finished with values: [1.0, 2.6336796084756844, 0.0, 1.0, 1.270158736796081, 0.3, 2.0, 735.7736530653924, 0.1111111111111111] and parameters: {'gamma': 278.6147416632955, 'sigma': 72.9321063140306, 'delta': 52.30341150719329, 'mean_degree': 1.641263409326043, 'res_sz': 86, 'window': 0.01360366879084818, 'spect_rad': 43.260826203742816, 'ridge_alpha': 2.8333248816403226e-08}. 
/nas/longleaf/home/djpassey/.local/lib/python3.9/site-packages/interfere/methods/reservoir_computer.py:378: RuntimeWarning: overflow encountered in matmul
  self.Rhat_ += states.T @ states
/nas/longleaf/home/djpassey/.local/lib/python3.9/site-packages/scipy/integrate/_odepack_py.py:248: ODEintWarning: Excess accuracy requested (tolerances too small). Run with full_output = 1 to get quantitative information.
  warnings.warn(warning_msg, ODEintWarning)
/nas/longleaf/home/djpassey/.local/lib/python3.9/site-packages/scipy/stats/_axis_nan_policy.py:551: RuntimeWarning: Precision loss occurred in moment calculation due to catastrophic cancellation. This occurs when the data are nearly identical. Results may be unreliable.
  res = hypotest_fun_out(*samples, axis=axis, **kwds)
[I 2024-09-26 00:30:36,758] Trial 5 finished with values: [0.0, 3805620918.638311, 0.0, 0.0, 3818197566.1329203, 0.0, 0.0, 4071502255.5588346, 0.0] and parameters: {'gamma': 239.78775893995265, 'sigma': 39.09608552035887, 'delta': 28.679413548306627, 'mean_degree': 2.3148837519250223, 'res_sz': 88, 'window': 15.714961086993878, 'spect_rad': 8.406654633900384, 'ridge_alpha': 1.2190758497675142e-05}. 
[I 2024-09-26 00:30:48,081] Trial 6 finished with values: [1.0, 9263.539101474606, 0.0, 1.0, 0.9354578100189561, 0.1, 1.0, 1.6775433088985776, 0.5555555555555556] and parameters: {'gamma': 369.4216914325201, 'sigma': 39.48755416856316, 'delta': 58.7677141156614, 'mean_degree': 0.9078223082566198, 'res_sz': 31, 'window': 0.01420948470764644, 'spect_rad': 0.3497697386399532, 'ridge_alpha': 4.5736288309347234e-10}. 
[I 2024-09-26 00:30:54,064] Trial 7 finished with values: [0.0, 3805620918.638311, 0.0, 0.0, 3818197566.1329203, 0.0, 0.0, 4071502255.5588346, 0.0] and parameters: {'gamma': 190.26873797985172, 'sigma': 3.9349390259059596, 'delta': 93.17544819241466, 'mean_degree': 0.976253806659139, 'res_sz': 34, 'window': 74.47172689589163, 'spect_rad': 13.282128503677395, 'ridge_alpha': 2.7050313922160754e-08}. 
[I 2024-09-26 00:31:05,884] Trial 8 finished with values: [0.0, 1.1495934053665864, 0.0, 1.0, 0.987499086830631, 0.2, 1.0, 1.660943535524853, 0.4444444444444444] and parameters: {'gamma': 167.4930063140178, 'sigma': 11.498728493026928, 'delta': 3.3208764414623655, 'mean_degree': 4.70619384156415, 'res_sz': 16, 'window': 0.002136944662337043, 'spect_rad': 0.0010377634632361898, 'ridge_alpha': 0.241608053568283}. 
[I 2024-09-26 00:31:17,273] Trial 9 finished with values: [1.0, 1.766111746855065, 0.1, 1.0, 0.9916229819749964, 0.2, 1.0, 1.7791151263731908, 0.1111111111111111] and parameters: {'gamma': 198.3777640561845, 'sigma': 48.995633928990436, 'delta': 21.0645717974734, 'mean_degree': 0.536941961972142, 'res_sz': 59, 'window': 0.8947232794168947, 'spect_rad': 0.11166972702193102, 'ridge_alpha': 0.11138106375114436}. 
[I 2024-09-26 00:31:28,273] Trial 10 finished with values: [1.0, 3780164974.612195, 0.0, 1.0, 2.597616139439846, 0.0, 1.0, 2.2640707472163686, 0.4444444444444444] and parameters: {'gamma': 124.30082596717098, 'sigma': 57.51655502020227, 'delta': 36.1847860862111, 'mean_degree': 4.628498286653576, 'res_sz': 98, 'window': 0.6821897949721799, 'spect_rad': 48.2344607062542, 'ridge_alpha': 0.008260986733497592}. 
[I 2024-09-26 00:31:35,944] Trial 11 finished with values: [1.0, 1203451251.6246216, 0.0, 1.0, 0.9423404902528845, 0.1, 1.0, 1.9661975657548683, 0.1111111111111111] and parameters: {'gamma': 375.76325400287743, 'sigma': 39.34645052737961, 'delta': 45.20031918719064, 'mean_degree': 1.9518238234032086, 'res_sz': 32, 'window': 4.0398262976735415, 'spect_rad': 8.16713179595434, 'ridge_alpha': 0.06103632940334588}. 
[I 2024-09-26 00:31:49,736] Trial 12 finished with values: [1.0, 3780164974.612195, 0.0, 1.0, 1.278888015542408, 0.0, 1.0, 218.71322777612232, 0.3333333333333333] and parameters: {'gamma': 156.8975818483132, 'sigma': 66.48475801509908, 'delta': 39.602386728675555, 'mean_degree': 3.4397958758744953, 'res_sz': 51, 'window': 1.6423425314705817, 'spect_rad': 65.1799357728457, 'ridge_alpha': 5.003502964222195e-07}. 
[I 2024-09-26 00:31:55,645] Trial 13 finished with values: [1.0, 3780164974.612195, 0.0, 1.0, 935263577.3644153, 1.0, 1.0, 997310301.1472981, 0.5555555555555556] and parameters: {'gamma': 64.05255940475499, 'sigma': 86.34405506064505, 'delta': 75.0278403196614, 'mean_degree': 0.2034966149270964, 'res_sz': 91, 'window': 19.557863156718803, 'spect_rad': 4.835771467294788, 'ridge_alpha': 4.8453793659283874e-08}. 
[I 2024-09-26 00:32:08,048] Trial 14 finished with values: [1.0, 1.4613168075711906, 0.3, 1.0, 0.9575778510800668, 0.4, 1.0, 1.7589125310197111, 0.2222222222222222] and parameters: {'gamma': 114.40093945852466, 'sigma': 63.574143467342026, 'delta': 7.046251627691044, 'mean_degree': 3.8319650763772475, 'res_sz': 55, 'window': 0.012170929324033615, 'spect_rad': 3.8481132641520457, 'ridge_alpha': 0.1367489624340575}. 
[I 2024-09-26 00:32:20,443] Trial 15 finished with values: [1.0, 1.8206123617097019, 0.1, 1.0, 1.0529014697790076, 0.3, 1.0, 1.6604366244141142, 0.3333333333333333] and parameters: {'gamma': 37.190700246685786, 'sigma': 59.431444841201504, 'delta': 69.80832461647013, 'mean_degree': 1.644970017769761, 'res_sz': 40, 'window': 0.03389048503106355, 'spect_rad': 0.002779127867167969, 'ridge_alpha': 3.8586863167642215e-07}. 
[I 2024-09-26 00:32:31,601] Trial 16 finished with values: [1.0, 3780164974.612195, 0.0, 1.0, 1.0533472890090791, 0.1, 1.0, 1.6577122064754652, 0.4444444444444444] and parameters: {'gamma': 91.48360756435669, 'sigma': 26.29604673526352, 'delta': 0.7887459034767006, 'mean_degree': 0.9538034118202219, 'res_sz': 51, 'window': 0.006081567267698746, 'spect_rad': 13.636638876260339, 'ridge_alpha': 1.2303597426484488e-06}. 
