[I 2024-09-26 07:37:03,371] Trial 22 finished with values: [2.0, 11.514994707391525, 0.0, 1.0, 6.283197730118974, 0.0, 2.0, 27.698886450301714, 0.0] and parameters: {'seq_len': 15, 'lr': 0.0008492906452751507, 'pred_len': 20, 'num_epochs': 50}. 
[I 2024-09-26 07:37:15,773] Trial 23 finished with values: [4.0, 13.200993890165691, 0.0, 3.0, 5.115891669522593, 0.0, 3.0, 14.5536293743051, 0.5] and parameters: {'seq_len': 8, 'lr': 0.004488878684185129, 'pred_len': 7, 'num_epochs': 300}. 
[I 2024-09-26 07:37:21,971] Trial 24 finished with values: [3.0, 11.289894434135581, 0.0, 4.0, 8.396364629004497, 0.0, 4.0, 20.705525728240374, 0.5] and parameters: {'seq_len': 5, 'lr': 0.0028951612231065344, 'pred_len': 19, 'num_epochs': 100}. 
[I 2024-09-26 07:37:33,786] A new study created in memory with name: VAR predicting Belozyorov3DQuad(sigma=0.10)
[I 2024-09-26 07:37:35,345] Trial 0 finished with values: [2.0, 5.288061146475459, 1.0, 4.0, 6.017427730055144, 1.0, 2.0, 498.0991478928152, 1.0] and parameters: {'ic': 'aic', 'maxlags': 5, 'trend': 'c'}. 
[I 2024-09-26 07:37:36,897] Trial 1 finished with values: [2.0, 5.6893442534876, 0.3333333333333333, 5.0, 5.815482491476502, 0.6666666666666666, 3.0, 1462.9951195933327, 1.0] and parameters: {'ic': 'aic', 'maxlags': 3, 'trend': 'ct'}. 
[I 2024-09-26 07:37:38,444] Trial 2 finished with values: [2.0, 5.421722094721058, 1.0, 4.0, 6.416360370971353, 1.0, 3.0, 48.595696210182105, 1.0] and parameters: {'ic': 'aic', 'maxlags': 2, 'trend': 'c'}. 
[I 2024-09-26 07:37:40,325] Trial 3 finished with values: [2.0, 6.4437946218672275, 0.0, 5.0, 5.987115966051668, 0.6666666666666666, 2.0, 466.1020399620974, 1.0] and parameters: {'ic': 'fpe', 'maxlags': 4, 'trend': 'ct'}. 
[I 2024-09-26 07:37:41,868] Trial 4 finished with values: [2.0, 15.869886544879185, 0.0, 6.0, 7.051701728461153, 0.0, 3.0, 3877.912111344151, 1.0] and parameters: {'ic': 'fpe', 'maxlags': 3, 'trend': 'ctt'}. 
[I 2024-09-26 07:37:43,374] Trial 5 finished with values: [3.0, 12.307843246872338, 0.0, 7.0, 8.023054274592894, 0.0, 2.0, 1119.8518467183894, 1.0] and parameters: {'ic': 'aic', 'maxlags': 1, 'trend': 'ct'}. 
[I 2024-09-26 07:37:44,929] Trial 6 finished with values: [2.0, 5.288061146475459, 1.0, 4.0, 6.017427730055144, 1.0, 2.0, 498.0991478928152, 1.0] and parameters: {'ic': 'aic', 'maxlags': 5, 'trend': 'c'}. 
[I 2024-09-26 07:37:46,811] Trial 7 finished with values: [4.0, 13.144594319690688, 0.0, 11.0, 8.120354420198598, 0.0, 4.0, 1293.3650404561176, 1.0] and parameters: {'ic': 'fpe', 'maxlags': 1, 'trend': 'n'}. 
[I 2024-09-26 07:37:48,354] Trial 8 finished with values: [5.0, 12.88646174332843, 0.0, 5.0, 12.782344445048954, 0.0, 4.0, 21.216207834943404, 0.5] and parameters: {'ic': 'fpe', 'maxlags': 2, 'trend': 'n'}. 
[I 2024-09-26 07:37:49,892] Trial 9 finished with values: [3.0, 12.648586292120086, 0.0, 8.0, 7.78668756879519, 0.0, 4.0, 77.23008435753728, 1.0] and parameters: {'ic': 'aic', 'maxlags': 5, 'trend': 'n'}. 
[I 2024-09-26 07:37:51,756] Trial 10 finished with values: [2.0, 5.288061146475459, 1.0, 4.0, 6.017427730055144, 1.0, 2.0, 498.0991478928152, 1.0] and parameters: {'ic': 'aic', 'maxlags': 5, 'trend': 'c'}. 
[I 2024-09-26 07:37:53,280] Trial 11 finished with values: [3.0, 12.307843246872338, 0.0, 7.0, 8.023054274592894, 0.0, 2.0, 1119.8518467183894, 1.0] and parameters: {'ic': 'fpe', 'maxlags': 1, 'trend': 'ct'}. 
[I 2024-09-26 07:37:54,857] Trial 12 finished with values: [2.0, 5.352898508905798, 1.0, 5.0, 5.922629687320727, 1.0, 2.0, 882.7842064462285, 1.0] and parameters: {'ic': 'aic', 'maxlags': 5, 'trend': 'ct'}. 
[I 2024-09-26 07:37:56,698] Trial 13 finished with values: [3.0, 6.68321834618263, 1.0, 5.0, 5.286807485299622, 1.0, 2.0, 581.2541770277934, 1.0] and parameters: {'ic': 'aic', 'maxlags': 1, 'trend': 'c'}. 
[I 2024-09-26 07:37:58,229] Trial 14 finished with values: [2.0, 15.786083316421086, 0.0, 5.0, 8.673848418008026, 0.0, 3.0, 80.7950523060063, 1.0] and parameters: {'ic': 'fpe', 'maxlags': 2, 'trend': 'ctt'}. 
[I 2024-09-26 07:37:59,790] Trial 15 finished with values: [2.0, 19.82393598166471, 0.0, 5.0, 8.246922492170276, 0.0, 2.0, 1256.9032378598613, 1.0] and parameters: {'ic': 'aic', 'maxlags': 4, 'trend': 'ctt'}. 
[I 2024-09-26 07:38:01,329] Trial 16 finished with values: [2.0, 5.421722094721058, 1.0, 4.0, 6.416360370971353, 1.0, 3.0, 48.595696210182105, 1.0] and parameters: {'ic': 'fpe', 'maxlags': 2, 'trend': 'c'}. 
[I 2024-09-26 07:38:03,211] Trial 17 finished with values: [2.0, 5.6893442534876, 0.3333333333333333, 5.0, 5.815482491476502, 0.6666666666666666, 3.0, 1462.9951195933327, 1.0] and parameters: {'ic': 'fpe', 'maxlags': 3, 'trend': 'ct'}. 
[I 2024-09-26 07:38:04,755] Trial 18 finished with values: [2.0, 5.414613565314157, 1.0, 4.0, 5.684229198479645, 1.0, 3.0, 722.0138169916135, 1.0] and parameters: {'ic': 'aic', 'maxlags': 3, 'trend': 'c'}. 
[I 2024-09-26 07:38:06,263] Trial 19 finished with values: [5.0, 13.402613860195954, 0.0, 17.0, 11.923858915366278, 0.0, 4.0, 306.00585578886586, 1.0] and parameters: {'ic': 'fpe', 'maxlags': 3, 'trend': 'n'}. 
[I 2024-09-26 07:38:07,807] Trial 20 finished with values: [2.0, 5.421722094721058, 1.0, 4.0, 6.416360370971353, 1.0, 3.0, 48.595696210182105, 1.0] and parameters: {'ic': 'fpe', 'maxlags': 2, 'trend': 'c'}. 
[I 2024-09-26 07:38:09,676] Trial 21 finished with values: [3.0, 12.307843246872338, 0.0, 7.0, 8.023054274592894, 0.0, 2.0, 1119.8518467183894, 1.0] and parameters: {'ic': 'aic', 'maxlags': 1, 'trend': 'ct'}. 
[I 2024-09-26 07:38:11,214] Trial 22 finished with values: [2.0, 5.421722094721058, 1.0, 4.0, 6.416360370971353, 1.0, 3.0, 48.595696210182105, 1.0] and parameters: {'ic': 'aic', 'maxlags': 2, 'trend': 'c'}. 
[I 2024-09-26 07:38:12,753] Trial 23 finished with values: [5.0, 12.88646174332843, 0.0, 5.0, 12.782344445048954, 0.0, 4.0, 21.216207834943404, 0.5] and parameters: {'ic': 'aic', 'maxlags': 2, 'trend': 'n'}. 
[I 2024-09-26 07:38:14,621] Trial 24 finished with values: [2.0, 5.352898508905798, 1.0, 5.0, 5.922629687320727, 1.0, 2.0, 882.7842064462285, 1.0] and parameters: {'ic': 'fpe', 'maxlags': 5, 'trend': 'ct'}. 
[I 2024-09-26 07:38:25,413] A new study created in memory with name: LSTM predicting Belozyorov3DQuad(sigma=0.10)
SLURM auto-requeueing enabled. Setting signal handlers.
SLURM auto-requeueing enabled. Setting signal handlers.
SLURM auto-requeueing enabled. Setting signal handlers.
SLURM auto-requeueing enabled. Setting signal handlers.
SLURM auto-requeueing enabled. Setting signal handlers.
SLURM auto-requeueing enabled. Setting signal handlers.
SLURM auto-requeueing enabled. Setting signal handlers.
SLURM auto-requeueing enabled. Setting signal handlers.
SLURM auto-requeueing enabled. Setting signal handlers.
SLURM auto-requeueing enabled. Setting signal handlers.
SLURM auto-requeueing enabled. Setting signal handlers.
SLURM auto-requeueing enabled. Setting signal handlers.
SLURM auto-requeueing enabled. Setting signal handlers.
SLURM auto-requeueing enabled. Setting signal handlers.
SLURM auto-requeueing enabled. Setting signal handlers.
SLURM auto-requeueing enabled. Setting signal handlers.
SLURM auto-requeueing enabled. Setting signal handlers.
SLURM auto-requeueing enabled. Setting signal handlers.
SLURM auto-requeueing enabled. Setting signal handlers.
SLURM auto-requeueing enabled. Setting signal handlers.
[I 2024-09-26 07:40:09,001] Trial 0 finished with values: [5.0, 12.453368182591579, 0.0, 4.0, 3.6475763844800193, 1.0, 1.0, 28.47376520752014, 0.0] and parameters: {'h': 15, 'encoder_hidden_size': 300, 'encoder_n_layers': 2, 'context_size': 50, 'decoder_hidden_size': 128, 'learning_rate': 0.00014076339662691325, 'max_steps': 500, 'batch_size': 32, 'random_seed': 17}. 
SLURM auto-requeueing enabled. Setting signal handlers.
SLURM auto-requeueing enabled. Setting signal handlers.
SLURM auto-requeueing enabled. Setting signal handlers.
SLURM auto-requeueing enabled. Setting signal handlers.
SLURM auto-requeueing enabled. Setting signal handlers.
SLURM auto-requeueing enabled. Setting signal handlers.
SLURM auto-requeueing enabled. Setting signal handlers.
SLURM auto-requeueing enabled. Setting signal handlers.
SLURM auto-requeueing enabled. Setting signal handlers.
SLURM auto-requeueing enabled. Setting signal handlers.
SLURM auto-requeueing enabled. Setting signal handlers.
SLURM auto-requeueing enabled. Setting signal handlers.
SLURM auto-requeueing enabled. Setting signal handlers.
SLURM auto-requeueing enabled. Setting signal handlers.
SLURM auto-requeueing enabled. Setting signal handlers.
SLURM auto-requeueing enabled. Setting signal handlers.
SLURM auto-requeueing enabled. Setting signal handlers.
SLURM auto-requeueing enabled. Setting signal handlers.
SLURM auto-requeueing enabled. Setting signal handlers.
SLURM auto-requeueing enabled. Setting signal handlers.
SLURM auto-requeueing enabled. Setting signal handlers.
SLURM auto-requeueing enabled. Setting signal handlers.
SLURM auto-requeueing enabled. Setting signal handlers.
SLURM auto-requeueing enabled. Setting signal handlers.
SLURM auto-requeueing enabled. Setting signal handlers.
SLURM auto-requeueing enabled. Setting signal handlers.
SLURM auto-requeueing enabled. Setting signal handlers.
SLURM auto-requeueing enabled. Setting signal handlers.
SLURM auto-requeueing enabled. Setting signal handlers.
SLURM auto-requeueing enabled. Setting signal handlers.
SLURM auto-requeueing enabled. Setting signal handlers.
SLURM auto-requeueing enabled. Setting signal handlers.
SLURM auto-requeueing enabled. Setting signal handlers.
SLURM auto-requeueing enabled. Setting signal handlers.
SLURM auto-requeueing enabled. Setting signal handlers.
[I 2024-09-26 07:41:42,193] Trial 1 finished with values: [5.0, 12.330314443600052, 0.0, 11.0, 2.924746126364065, 1.0, 1.0, 26.54959178143198, 0.0] and parameters: {'h': 8, 'encoder_hidden_size': 300, 'encoder_n_layers': 2, 'context_size': 5, 'decoder_hidden_size': 256, 'learning_rate': 0.0004895891678759699, 'max_steps': 500, 'batch_size': 32, 'random_seed': 2}. 
SLURM auto-requeueing enabled. Setting signal handlers.
SLURM auto-requeueing enabled. Setting signal handlers.
SLURM auto-requeueing enabled. Setting signal handlers.
SLURM auto-requeueing enabled. Setting signal handlers.
SLURM auto-requeueing enabled. Setting signal handlers.
SLURM auto-requeueing enabled. Setting signal handlers.
SLURM auto-requeueing enabled. Setting signal handlers.
SLURM auto-requeueing enabled. Setting signal handlers.
SLURM auto-requeueing enabled. Setting signal handlers.
SLURM auto-requeueing enabled. Setting signal handlers.
SLURM auto-requeueing enabled. Setting signal handlers.
SLURM auto-requeueing enabled. Setting signal handlers.
SLURM auto-requeueing enabled. Setting signal handlers.
SLURM auto-requeueing enabled. Setting signal handlers.
SLURM auto-requeueing enabled. Setting signal handlers.
SLURM auto-requeueing enabled. Setting signal handlers.
SLURM auto-requeueing enabled. Setting signal handlers.
SLURM auto-requeueing enabled. Setting signal handlers.
SLURM auto-requeueing enabled. Setting signal handlers.
SLURM auto-requeueing enabled. Setting signal handlers.
SLURM auto-requeueing enabled. Setting signal handlers.
[I 2024-09-26 07:45:21,263] Trial 2 finished with values: [4.0, 12.449301340417, 0.0, 11.0, 3.938478854079963, 1.0, 1.0, 26.673090325103267, 0.0] and parameters: {'h': 14, 'encoder_hidden_size': 200, 'encoder_n_layers': 4, 'context_size': 50, 'decoder_hidden_size': 256, 'learning_rate': 0.00019022473568976655, 'max_steps': 1000, 'batch_size': 32, 'random_seed': 1}. 
SLURM auto-requeueing enabled. Setting signal handlers.
SLURM auto-requeueing enabled. Setting signal handlers.
SLURM auto-requeueing enabled. Setting signal handlers.
SLURM auto-requeueing enabled. Setting signal handlers.
SLURM auto-requeueing enabled. Setting signal handlers.
SLURM auto-requeueing enabled. Setting signal handlers.
SLURM auto-requeueing enabled. Setting signal handlers.
SLURM auto-requeueing enabled. Setting signal handlers.
SLURM auto-requeueing enabled. Setting signal handlers.
SLURM auto-requeueing enabled. Setting signal handlers.
SLURM auto-requeueing enabled. Setting signal handlers.
SLURM auto-requeueing enabled. Setting signal handlers.
SLURM auto-requeueing enabled. Setting signal handlers.
SLURM auto-requeueing enabled. Setting signal handlers.
SLURM auto-requeueing enabled. Setting signal handlers.
SLURM auto-requeueing enabled. Setting signal handlers.
SLURM auto-requeueing enabled. Setting signal handlers.
SLURM auto-requeueing enabled. Setting signal handlers.
SLURM auto-requeueing enabled. Setting signal handlers.
SLURM auto-requeueing enabled. Setting signal handlers.
SLURM auto-requeueing enabled. Setting signal handlers.
SLURM auto-requeueing enabled. Setting signal handlers.
SLURM auto-requeueing enabled. Setting signal handlers.
SLURM auto-requeueing enabled. Setting signal handlers.
SLURM auto-requeueing enabled. Setting signal handlers.
SLURM auto-requeueing enabled. Setting signal handlers.
SLURM auto-requeueing enabled. Setting signal handlers.
SLURM auto-requeueing enabled. Setting signal handlers.
SLURM auto-requeueing enabled. Setting signal handlers.
SLURM auto-requeueing enabled. Setting signal handlers.
SLURM auto-requeueing enabled. Setting signal handlers.
SLURM auto-requeueing enabled. Setting signal handlers.
SLURM auto-requeueing enabled. Setting signal handlers.
SLURM auto-requeueing enabled. Setting signal handlers.
SLURM auto-requeueing enabled. Setting signal handlers.
SLURM auto-requeueing enabled. Setting signal handlers.
SLURM auto-requeueing enabled. Setting signal handlers.
SLURM auto-requeueing enabled. Setting signal handlers.
SLURM auto-requeueing enabled. Setting signal handlers.
SLURM auto-requeueing enabled. Setting signal handlers.
SLURM auto-requeueing enabled. Setting signal handlers.
SLURM auto-requeueing enabled. Setting signal handlers.
SLURM auto-requeueing enabled. Setting signal handlers.
SLURM auto-requeueing enabled. Setting signal handlers.
SLURM auto-requeueing enabled. Setting signal handlers.
SLURM auto-requeueing enabled. Setting signal handlers.
SLURM auto-requeueing enabled. Setting signal handlers.
SLURM auto-requeueing enabled. Setting signal handlers.
SLURM auto-requeueing enabled. Setting signal handlers.
SLURM auto-requeueing enabled. Setting signal handlers.
SLURM auto-requeueing enabled. Setting signal handlers.
SLURM auto-requeueing enabled. Setting signal handlers.
SLURM auto-requeueing enabled. Setting signal handlers.
SLURM auto-requeueing enabled. Setting signal handlers.
SLURM auto-requeueing enabled. Setting signal handlers.
SLURM auto-requeueing enabled. Setting signal handlers.
SLURM auto-requeueing enabled. Setting signal handlers.
SLURM auto-requeueing enabled. Setting signal handlers.
SLURM auto-requeueing enabled. Setting signal handlers.
SLURM auto-requeueing enabled. Setting signal handlers.
SLURM auto-requeueing enabled. Setting signal handlers.
SLURM auto-requeueing enabled. Setting signal handlers.
SLURM auto-requeueing enabled. Setting signal handlers.
SLURM auto-requeueing enabled. Setting signal handlers.
SLURM auto-requeueing enabled. Setting signal handlers.
SLURM auto-requeueing enabled. Setting signal handlers.
SLURM auto-requeueing enabled. Setting signal handlers.
SLURM auto-requeueing enabled. Setting signal handlers.
SLURM auto-requeueing enabled. Setting signal handlers.
SLURM auto-requeueing enabled. Setting signal handlers.
SLURM auto-requeueing enabled. Setting signal handlers.
SLURM auto-requeueing enabled. Setting signal handlers.
SLURM auto-requeueing enabled. Setting signal handlers.
SLURM auto-requeueing enabled. Setting signal handlers.
SLURM auto-requeueing enabled. Setting signal handlers.
SLURM auto-requeueing enabled. Setting signal handlers.
SLURM auto-requeueing enabled. Setting signal handlers.
SLURM auto-requeueing enabled. Setting signal handlers.
SLURM auto-requeueing enabled. Setting signal handlers.
SLURM auto-requeueing enabled. Setting signal handlers.
SLURM auto-requeueing enabled. Setting signal handlers.
SLURM auto-requeueing enabled. Setting signal handlers.
SLURM auto-requeueing enabled. Setting signal handlers.
SLURM auto-requeueing enabled. Setting signal handlers.
SLURM auto-requeueing enabled. Setting signal handlers.
SLURM auto-requeueing enabled. Setting signal handlers.
SLURM auto-requeueing enabled. Setting signal handlers.
SLURM auto-requeueing enabled. Setting signal handlers.
SLURM auto-requeueing enabled. Setting signal handlers.
SLURM auto-requeueing enabled. Setting signal handlers.
SLURM auto-requeueing enabled. Setting signal handlers.
SLURM auto-requeueing enabled. Setting signal handlers.
SLURM auto-requeueing enabled. Setting signal handlers.
SLURM auto-requeueing enabled. Setting signal handlers.
SLURM auto-requeueing enabled. Setting signal handlers.
SLURM auto-requeueing enabled. Setting signal handlers.
SLURM auto-requeueing enabled. Setting signal handlers.
SLURM auto-requeueing enabled. Setting signal handlers.
SLURM auto-requeueing enabled. Setting signal handlers.
SLURM auto-requeueing enabled. Setting signal handlers.
SLURM auto-requeueing enabled. Setting signal handlers.
SLURM auto-requeueing enabled. Setting signal handlers.
SLURM auto-requeueing enabled. Setting signal handlers.
SLURM auto-requeueing enabled. Setting signal handlers.
SLURM auto-requeueing enabled. Setting signal handlers.
SLURM auto-requeueing enabled. Setting signal handlers.
SLURM auto-requeueing enabled. Setting signal handlers.
SLURM auto-requeueing enabled. Setting signal handlers.
SLURM auto-requeueing enabled. Setting signal handlers.
SLURM auto-requeueing enabled. Setting signal handlers.
SLURM auto-requeueing enabled. Setting signal handlers.
SLURM auto-requeueing enabled. Setting signal handlers.
SLURM auto-requeueing enabled. Setting signal handlers.
SLURM auto-requeueing enabled. Setting signal handlers.
SLURM auto-requeueing enabled. Setting signal handlers.
SLURM auto-requeueing enabled. Setting signal handlers.
SLURM auto-requeueing enabled. Setting signal handlers.
SLURM auto-requeueing enabled. Setting signal handlers.
SLURM auto-requeueing enabled. Setting signal handlers.
SLURM auto-requeueing enabled. Setting signal handlers.
SLURM auto-requeueing enabled. Setting signal handlers.
SLURM auto-requeueing enabled. Setting signal handlers.
SLURM auto-requeueing enabled. Setting signal handlers.
SLURM auto-requeueing enabled. Setting signal handlers.
SLURM auto-requeueing enabled. Setting signal handlers.
SLURM auto-requeueing enabled. Setting signal handlers.
SLURM auto-requeueing enabled. Setting signal handlers.
[I 2024-09-26 07:46:21,956] Trial 3 finished with values: [4.0, 12.562339390854516, 0.0, 17.0, 7.467469268420638, 1.0, 2.0, 28.227973602794535, 0.0] and parameters: {'h': 2, 'encoder_hidden_size': 200, 'encoder_n_layers': 2, 'context_size': 5, 'decoder_hidden_size': 512, 'learning_rate': 0.016132841505407114, 'max_steps': 500, 'batch_size': 16, 'random_seed': 12}. 
SLURM auto-requeueing enabled. Setting signal handlers.
SLURM auto-requeueing enabled. Setting signal handlers.
SLURM auto-requeueing enabled. Setting signal handlers.
SLURM auto-requeueing enabled. Setting signal handlers.
SLURM auto-requeueing enabled. Setting signal handlers.
SLURM auto-requeueing enabled. Setting signal handlers.
SLURM auto-requeueing enabled. Setting signal handlers.
SLURM auto-requeueing enabled. Setting signal handlers.
SLURM auto-requeueing enabled. Setting signal handlers.
SLURM auto-requeueing enabled. Setting signal handlers.
SLURM auto-requeueing enabled. Setting signal handlers.
SLURM auto-requeueing enabled. Setting signal handlers.
SLURM auto-requeueing enabled. Setting signal handlers.
SLURM auto-requeueing enabled. Setting signal handlers.
SLURM auto-requeueing enabled. Setting signal handlers.
SLURM auto-requeueing enabled. Setting signal handlers.
SLURM auto-requeueing enabled. Setting signal handlers.
SLURM auto-requeueing enabled. Setting signal handlers.
SLURM auto-requeueing enabled. Setting signal handlers.
SLURM auto-requeueing enabled. Setting signal handlers.
SLURM auto-requeueing enabled. Setting signal handlers.
SLURM auto-requeueing enabled. Setting signal handlers.
SLURM auto-requeueing enabled. Setting signal handlers.
SLURM auto-requeueing enabled. Setting signal handlers.
SLURM auto-requeueing enabled. Setting signal handlers.
SLURM auto-requeueing enabled. Setting signal handlers.
