[I 2024-09-26 18:54:37,875] Trial 16 finished with values: [1.0, 0.9042917660347498, 0.2, 1.0, 0.9419529940168411, 0.2, 1.0, 0.9922784808809769, 0.7777777777777778] and parameters: {'seq_len': 4, 'lr': 0.00021715954274256882, 'pred_len': 5, 'num_epochs': 300}. 
[I 2024-09-26 18:54:45,148] Trial 17 finished with values: [1.0, 0.888285756117949, 0.5, 1.0, 0.9232672795980001, 0.5, 1.0, 1.0137472025346193, 0.4444444444444444] and parameters: {'seq_len': 25, 'lr': 0.011277978792311107, 'pred_len': 18, 'num_epochs': 50}. 
[I 2024-09-26 18:54:54,475] Trial 18 finished with values: [4.0, 0.8684338589303904, 1.0, 1.0, 0.8746609188747748, 1.0, 1.0, 1.0069537429856918, 0.7777777777777778] and parameters: {'seq_len': 3, 'lr': 0.00828582808149769, 'pred_len': 25, 'num_epochs': 100}. 
[I 2024-09-26 18:55:01,730] Trial 19 finished with values: [1.0, 2.573970782962079, 0.0, 1.0, 1.8160569401003952, 0.0, 1.0, 1.4329581363516053, 0.2222222222222222] and parameters: {'seq_len': 24, 'lr': 4.093909617964465e-05, 'pred_len': 7, 'num_epochs': 50}. 
[I 2024-09-26 18:55:10,832] Trial 20 finished with values: [1.0, 0.9095855928664729, 0.9, 1.0, 0.9343096081730464, 1.0, 1.0, 1.0632289247705853, 0.7777777777777778] and parameters: {'seq_len': 20, 'lr': 0.00012078737726309268, 'pred_len': 18, 'num_epochs': 100}. 
[I 2024-09-26 18:55:26,129] Trial 21 finished with values: [1.0, 0.8737479240624945, 0.9, 1.0, 0.8883465875781325, 0.9, 1.0, 0.997545563396666, 0.7777777777777778] and parameters: {'seq_len': 7, 'lr': 0.07596475652804116, 'pred_len': 19, 'num_epochs': 300}. 
[I 2024-09-26 18:55:41,938] Trial 22 finished with values: [1.0, 0.8913613973786998, 0.5, 1.0, 0.9167016826535127, 0.4, 1.0, 1.004400203192891, 0.3333333333333333] and parameters: {'seq_len': 9, 'lr': 0.019382750326671253, 'pred_len': 11, 'num_epochs': 300}. 
[I 2024-09-26 18:55:50,944] Trial 23 finished with values: [1.0, 1.5721276337559493, 0.0, 1.0, 1.744136590327406, 0.0, 1.0, 1.2972055921220644, 0.2222222222222222] and parameters: {'seq_len': 20, 'lr': 2.2207454728765753e-05, 'pred_len': 2, 'num_epochs': 100}. 
[I 2024-09-26 18:55:58,659] Trial 24 finished with values: [1.0, 0.9196574558347386, 0.2, 1.0, 0.9120851520111567, 0.7, 1.0, 0.9905789164231423, 0.6666666666666666] and parameters: {'seq_len': 15, 'lr': 0.0016417422812172232, 'pred_len': 14, 'num_epochs': 50}. 
[I 2024-09-26 18:56:19,309] A new study created in memory with name: VAR predicting coupled_logistic_map(sigma=0.20)
[W 2024-09-26 18:56:19,339] Trial 0 failed with parameters: {'ic': 'fpe', 'maxlags': 1, 'trend': 'ctt'} because of the following error: The value nan is not acceptable.
[W 2024-09-26 18:56:19,339] Trial 0 failed with value [nan, nan, nan, nan, nan, nan, nan, nan, nan].
[W 2024-09-26 18:56:19,351] Trial 1 failed with parameters: {'ic': 'fpe', 'maxlags': 3, 'trend': 'n'} because of the following error: The value nan is not acceptable.
[W 2024-09-26 18:56:19,351] Trial 1 failed with value [nan, nan, nan, nan, nan, nan, nan, nan, nan].
[W 2024-09-26 18:56:19,357] Trial 2 failed with parameters: {'ic': 'aic', 'maxlags': 3, 'trend': 'ctt'} because of the following error: The value nan is not acceptable.
[W 2024-09-26 18:56:19,358] Trial 2 failed with value [nan, nan, nan, nan, nan, nan, nan, nan, nan].
[W 2024-09-26 18:56:19,363] Trial 3 failed with parameters: {'ic': 'aic', 'maxlags': 2, 'trend': 'ct'} because of the following error: The value nan is not acceptable.
[W 2024-09-26 18:56:19,363] Trial 3 failed with value [nan, nan, nan, nan, nan, nan, nan, nan, nan].
[W 2024-09-26 18:56:19,367] Trial 4 failed with parameters: {'ic': 'fpe', 'maxlags': 1, 'trend': 'c'} because of the following error: The value nan is not acceptable.
[W 2024-09-26 18:56:19,367] Trial 4 failed with value [nan, nan, nan, nan, nan, nan, nan, nan, nan].
[W 2024-09-26 18:56:19,372] Trial 5 failed with parameters: {'ic': 'fpe', 'maxlags': 2, 'trend': 'ctt'} because of the following error: The value nan is not acceptable.
[W 2024-09-26 18:56:19,372] Trial 5 failed with value [nan, nan, nan, nan, nan, nan, nan, nan, nan].
[W 2024-09-26 18:56:19,379] Trial 6 failed with parameters: {'ic': 'aic', 'maxlags': 4, 'trend': 'ctt'} because of the following error: The value nan is not acceptable.
[W 2024-09-26 18:56:19,379] Trial 6 failed with value [nan, nan, nan, nan, nan, nan, nan, nan, nan].
[W 2024-09-26 18:56:19,384] Trial 7 failed with parameters: {'ic': 'fpe', 'maxlags': 2, 'trend': 'n'} because of the following error: The value nan is not acceptable.
[W 2024-09-26 18:56:19,384] Trial 7 failed with value [nan, nan, nan, nan, nan, nan, nan, nan, nan].
[W 2024-09-26 18:56:19,390] Trial 8 failed with parameters: {'ic': 'aic', 'maxlags': 3, 'trend': 'ct'} because of the following error: The value nan is not acceptable.
[W 2024-09-26 18:56:19,390] Trial 8 failed with value [nan, nan, nan, nan, nan, nan, nan, nan, nan].
[W 2024-09-26 18:56:19,395] Trial 9 failed with parameters: {'ic': 'aic', 'maxlags': 2, 'trend': 'n'} because of the following error: The value nan is not acceptable.
[W 2024-09-26 18:56:19,395] Trial 9 failed with value [nan, nan, nan, nan, nan, nan, nan, nan, nan].
[W 2024-09-26 18:56:19,410] Trial 10 failed with parameters: {'ic': 'aic', 'maxlags': 5, 'trend': 'ctt'} because of the following error: The value nan is not acceptable.
[W 2024-09-26 18:56:19,410] Trial 10 failed with value [nan, nan, nan, nan, nan, nan, nan, nan, nan].
[W 2024-09-26 18:56:19,415] Trial 11 failed with parameters: {'ic': 'fpe', 'maxlags': 2, 'trend': 'ct'} because of the following error: The value nan is not acceptable.
[W 2024-09-26 18:56:19,415] Trial 11 failed with value [nan, nan, nan, nan, nan, nan, nan, nan, nan].
[W 2024-09-26 18:56:19,424] Trial 12 failed with parameters: {'ic': 'aic', 'maxlags': 5, 'trend': 'ct'} because of the following error: The value nan is not acceptable.
[W 2024-09-26 18:56:19,424] Trial 12 failed with value [nan, nan, nan, nan, nan, nan, nan, nan, nan].
[W 2024-09-26 18:56:19,433] Trial 13 failed with parameters: {'ic': 'fpe', 'maxlags': 5, 'trend': 'ct'} because of the following error: The value nan is not acceptable.
[W 2024-09-26 18:56:19,433] Trial 13 failed with value [nan, nan, nan, nan, nan, nan, nan, nan, nan].
[W 2024-09-26 18:56:19,440] Trial 14 failed with parameters: {'ic': 'fpe', 'maxlags': 4, 'trend': 'n'} because of the following error: The value nan is not acceptable.
[W 2024-09-26 18:56:19,440] Trial 14 failed with value [nan, nan, nan, nan, nan, nan, nan, nan, nan].
[W 2024-09-26 18:56:19,449] Trial 15 failed with parameters: {'ic': 'fpe', 'maxlags': 5, 'trend': 'n'} because of the following error: The value nan is not acceptable.
[W 2024-09-26 18:56:19,449] Trial 15 failed with value [nan, nan, nan, nan, nan, nan, nan, nan, nan].
[W 2024-09-26 18:56:19,456] Trial 16 failed with parameters: {'ic': 'aic', 'maxlags': 4, 'trend': 'ct'} because of the following error: The value nan is not acceptable.
[W 2024-09-26 18:56:19,456] Trial 16 failed with value [nan, nan, nan, nan, nan, nan, nan, nan, nan].
[W 2024-09-26 18:56:19,465] Trial 17 failed with parameters: {'ic': 'aic', 'maxlags': 5, 'trend': 'c'} because of the following error: The value nan is not acceptable.
[W 2024-09-26 18:56:19,465] Trial 17 failed with value [nan, nan, nan, nan, nan, nan, nan, nan, nan].
[W 2024-09-26 18:56:19,470] Trial 18 failed with parameters: {'ic': 'aic', 'maxlags': 2, 'trend': 'ctt'} because of the following error: The value nan is not acceptable.
[W 2024-09-26 18:56:19,471] Trial 18 failed with value [nan, nan, nan, nan, nan, nan, nan, nan, nan].
[W 2024-09-26 18:56:19,475] Trial 19 failed with parameters: {'ic': 'fpe', 'maxlags': 1, 'trend': 'ct'} because of the following error: The value nan is not acceptable.
[W 2024-09-26 18:56:19,475] Trial 19 failed with value [nan, nan, nan, nan, nan, nan, nan, nan, nan].
[W 2024-09-26 18:56:19,484] Trial 20 failed with parameters: {'ic': 'aic', 'maxlags': 5, 'trend': 'ctt'} because of the following error: The value nan is not acceptable.
[W 2024-09-26 18:56:19,484] Trial 20 failed with value [nan, nan, nan, nan, nan, nan, nan, nan, nan].
[W 2024-09-26 18:56:19,490] Trial 21 failed with parameters: {'ic': 'fpe', 'maxlags': 3, 'trend': 'ctt'} because of the following error: The value nan is not acceptable.
[W 2024-09-26 18:56:19,490] Trial 21 failed with value [nan, nan, nan, nan, nan, nan, nan, nan, nan].
[W 2024-09-26 18:56:19,496] Trial 22 failed with parameters: {'ic': 'aic', 'maxlags': 3, 'trend': 'ct'} because of the following error: The value nan is not acceptable.
[W 2024-09-26 18:56:19,496] Trial 22 failed with value [nan, nan, nan, nan, nan, nan, nan, nan, nan].
[W 2024-09-26 18:56:19,505] Trial 23 failed with parameters: {'ic': 'aic', 'maxlags': 5, 'trend': 'c'} because of the following error: The value nan is not acceptable.
[W 2024-09-26 18:56:19,505] Trial 23 failed with value [nan, nan, nan, nan, nan, nan, nan, nan, nan].
[W 2024-09-26 18:56:19,509] Trial 24 failed with parameters: {'ic': 'fpe', 'maxlags': 1, 'trend': 'ctt'} because of the following error: The value nan is not acceptable.
[W 2024-09-26 18:56:19,509] Trial 24 failed with value [nan, nan, nan, nan, nan, nan, nan, nan, nan].
[I 2024-09-26 18:56:32,612] A new study created in memory with name: LSTM predicting coupled_logistic_map(sigma=0.20)
SLURM auto-requeueing enabled. Setting signal handlers.
SLURM auto-requeueing enabled. Setting signal handlers.
SLURM auto-requeueing enabled. Setting signal handlers.
SLURM auto-requeueing enabled. Setting signal handlers.
SLURM auto-requeueing enabled. Setting signal handlers.
SLURM auto-requeueing enabled. Setting signal handlers.
SLURM auto-requeueing enabled. Setting signal handlers.
SLURM auto-requeueing enabled. Setting signal handlers.
SLURM auto-requeueing enabled. Setting signal handlers.
SLURM auto-requeueing enabled. Setting signal handlers.
SLURM auto-requeueing enabled. Setting signal handlers.
SLURM auto-requeueing enabled. Setting signal handlers.
SLURM auto-requeueing enabled. Setting signal handlers.
SLURM auto-requeueing enabled. Setting signal handlers.
SLURM auto-requeueing enabled. Setting signal handlers.
SLURM auto-requeueing enabled. Setting signal handlers.
SLURM auto-requeueing enabled. Setting signal handlers.
SLURM auto-requeueing enabled. Setting signal handlers.
SLURM auto-requeueing enabled. Setting signal handlers.
SLURM auto-requeueing enabled. Setting signal handlers.
SLURM auto-requeueing enabled. Setting signal handlers.
SLURM auto-requeueing enabled. Setting signal handlers.
SLURM auto-requeueing enabled. Setting signal handlers.
SLURM auto-requeueing enabled. Setting signal handlers.
SLURM auto-requeueing enabled. Setting signal handlers.
SLURM auto-requeueing enabled. Setting signal handlers.
SLURM auto-requeueing enabled. Setting signal handlers.
SLURM auto-requeueing enabled. Setting signal handlers.
SLURM auto-requeueing enabled. Setting signal handlers.
SLURM auto-requeueing enabled. Setting signal handlers.
SLURM auto-requeueing enabled. Setting signal handlers.
[I 2024-09-26 19:13:35,759] Trial 0 finished with values: [1.0, 1.1034956350956673, 0.1, 1.0, 1.327591771627093, 0.9, 1.0, 1.5920719235461345, 0.6666666666666666] and parameters: {'h': 9, 'encoder_hidden_size': 300, 'encoder_n_layers': 4, 'context_size': 5, 'decoder_hidden_size': 512, 'learning_rate': 0.00035269113978430054, 'max_steps': 1000, 'batch_size': 32, 'random_seed': 3}. 
SLURM auto-requeueing enabled. Setting signal handlers.
SLURM auto-requeueing enabled. Setting signal handlers.
SLURM auto-requeueing enabled. Setting signal handlers.
SLURM auto-requeueing enabled. Setting signal handlers.
SLURM auto-requeueing enabled. Setting signal handlers.
SLURM auto-requeueing enabled. Setting signal handlers.
SLURM auto-requeueing enabled. Setting signal handlers.
SLURM auto-requeueing enabled. Setting signal handlers.
SLURM auto-requeueing enabled. Setting signal handlers.
SLURM auto-requeueing enabled. Setting signal handlers.
SLURM auto-requeueing enabled. Setting signal handlers.
SLURM auto-requeueing enabled. Setting signal handlers.
SLURM auto-requeueing enabled. Setting signal handlers.
SLURM auto-requeueing enabled. Setting signal handlers.
SLURM auto-requeueing enabled. Setting signal handlers.
SLURM auto-requeueing enabled. Setting signal handlers.
SLURM auto-requeueing enabled. Setting signal handlers.
SLURM auto-requeueing enabled. Setting signal handlers.
SLURM auto-requeueing enabled. Setting signal handlers.
SLURM auto-requeueing enabled. Setting signal handlers.
[I 2024-09-26 19:17:24,103] Trial 1 finished with values: [1.0, 1.685543575509883, 0.0, 1.0, 1.0162867546418686, 0.4, 2.0, 1.3605610358925673, 0.6666666666666666] and parameters: {'h': 16, 'encoder_hidden_size': 50, 'encoder_n_layers': 4, 'context_size': 10, 'decoder_hidden_size': 512, 'learning_rate': 0.0003553181803615266, 'max_steps': 500, 'batch_size': 16, 'random_seed': 2}. 
SLURM auto-requeueing enabled. Setting signal handlers.
SLURM auto-requeueing enabled. Setting signal handlers.
SLURM auto-requeueing enabled. Setting signal handlers.
SLURM auto-requeueing enabled. Setting signal handlers.
SLURM auto-requeueing enabled. Setting signal handlers.
SLURM auto-requeueing enabled. Setting signal handlers.
SLURM auto-requeueing enabled. Setting signal handlers.
SLURM auto-requeueing enabled. Setting signal handlers.
SLURM auto-requeueing enabled. Setting signal handlers.
SLURM auto-requeueing enabled. Setting signal handlers.
SLURM auto-requeueing enabled. Setting signal handlers.
SLURM auto-requeueing enabled. Setting signal handlers.
SLURM auto-requeueing enabled. Setting signal handlers.
SLURM auto-requeueing enabled. Setting signal handlers.
SLURM auto-requeueing enabled. Setting signal handlers.
SLURM auto-requeueing enabled. Setting signal handlers.
SLURM auto-requeueing enabled. Setting signal handlers.
SLURM auto-requeueing enabled. Setting signal handlers.
SLURM auto-requeueing enabled. Setting signal handlers.
SLURM auto-requeueing enabled. Setting signal handlers.
SLURM auto-requeueing enabled. Setting signal handlers.
[I 2024-09-26 19:18:35,317] Trial 2 finished with values: [1.0, 1.6798020311285582, 0.0, 1.0, 1.1733609964271892, 1.0, 1.0, 1.6155135421292903, 0.7777777777777778] and parameters: {'h': 14, 'encoder_hidden_size': 100, 'encoder_n_layers': 1, 'context_size': 10, 'decoder_hidden_size': 256, 'learning_rate': 0.007219853067053141, 'max_steps': 500, 'batch_size': 16, 'random_seed': 11}. 
SLURM auto-requeueing enabled. Setting signal handlers.
SLURM auto-requeueing enabled. Setting signal handlers.
SLURM auto-requeueing enabled. Setting signal handlers.
SLURM auto-requeueing enabled. Setting signal handlers.
SLURM auto-requeueing enabled. Setting signal handlers.
SLURM auto-requeueing enabled. Setting signal handlers.
SLURM auto-requeueing enabled. Setting signal handlers.
SLURM auto-requeueing enabled. Setting signal handlers.
SLURM auto-requeueing enabled. Setting signal handlers.
SLURM auto-requeueing enabled. Setting signal handlers.
SLURM auto-requeueing enabled. Setting signal handlers.
SLURM auto-requeueing enabled. Setting signal handlers.
SLURM auto-requeueing enabled. Setting signal handlers.
SLURM auto-requeueing enabled. Setting signal handlers.
SLURM auto-requeueing enabled. Setting signal handlers.
SLURM auto-requeueing enabled. Setting signal handlers.
SLURM auto-requeueing enabled. Setting signal handlers.
SLURM auto-requeueing enabled. Setting signal handlers.
SLURM auto-requeueing enabled. Setting signal handlers.
SLURM auto-requeueing enabled. Setting signal handlers.
SLURM auto-requeueing enabled. Setting signal handlers.
SLURM auto-requeueing enabled. Setting signal handlers.
SLURM auto-requeueing enabled. Setting signal handlers.
SLURM auto-requeueing enabled. Setting signal handlers.
SLURM auto-requeueing enabled. Setting signal handlers.
SLURM auto-requeueing enabled. Setting signal handlers.
SLURM auto-requeueing enabled. Setting signal handlers.
SLURM auto-requeueing enabled. Setting signal handlers.
SLURM auto-requeueing enabled. Setting signal handlers.
SLURM auto-requeueing enabled. Setting signal handlers.
SLURM auto-requeueing enabled. Setting signal handlers.
SLURM auto-requeueing enabled. Setting signal handlers.
SLURM auto-requeueing enabled. Setting signal handlers.
SLURM auto-requeueing enabled. Setting signal handlers.
SLURM auto-requeueing enabled. Setting signal handlers.
SLURM auto-requeueing enabled. Setting signal handlers.
SLURM auto-requeueing enabled. Setting signal handlers.
SLURM auto-requeueing enabled. Setting signal handlers.
[I 2024-09-26 19:20:33,356] Trial 3 finished with values: [1.0, 1.575638073993688, 0.0, 1.0, 1.0191398114046835, 0.9, 1.0, 1.4117858794972726, 0.4444444444444444] and parameters: {'h': 7, 'encoder_hidden_size': 300, 'encoder_n_layers': 1, 'context_size': 10, 'decoder_hidden_size': 256, 'learning_rate': 0.0006162056224379641, 'max_steps': 500, 'batch_size': 32, 'random_seed': 3}. 
SLURM auto-requeueing enabled. Setting signal handlers.
SLURM auto-requeueing enabled. Setting signal handlers.
SLURM auto-requeueing enabled. Setting signal handlers.
SLURM auto-requeueing enabled. Setting signal handlers.
SLURM auto-requeueing enabled. Setting signal handlers.
SLURM auto-requeueing enabled. Setting signal handlers.
SLURM auto-requeueing enabled. Setting signal handlers.
SLURM auto-requeueing enabled. Setting signal handlers.
SLURM auto-requeueing enabled. Setting signal handlers.
SLURM auto-requeueing enabled. Setting signal handlers.
SLURM auto-requeueing enabled. Setting signal handlers.
SLURM auto-requeueing enabled. Setting signal handlers.
SLURM auto-requeueing enabled. Setting signal handlers.
SLURM auto-requeueing enabled. Setting signal handlers.
SLURM auto-requeueing enabled. Setting signal handlers.
SLURM auto-requeueing enabled. Setting signal handlers.
SLURM auto-requeueing enabled. Setting signal handlers.
SLURM auto-requeueing enabled. Setting signal handlers.
SLURM auto-requeueing enabled. Setting signal handlers.
SLURM auto-requeueing enabled. Setting signal handlers.
SLURM auto-requeueing enabled. Setting signal handlers.
SLURM auto-requeueing enabled. Setting signal handlers.
SLURM auto-requeueing enabled. Setting signal handlers.
SLURM auto-requeueing enabled. Setting signal handlers.
SLURM auto-requeueing enabled. Setting signal handlers.
SLURM auto-requeueing enabled. Setting signal handlers.
SLURM auto-requeueing enabled. Setting signal handlers.
SLURM auto-requeueing enabled. Setting signal handlers.
SLURM auto-requeueing enabled. Setting signal handlers.
SLURM auto-requeueing enabled. Setting signal handlers.
SLURM auto-requeueing enabled. Setting signal handlers.
SLURM auto-requeueing enabled. Setting signal handlers.
SLURM auto-requeueing enabled. Setting signal handlers.
SLURM auto-requeueing enabled. Setting signal handlers.
SLURM auto-requeueing enabled. Setting signal handlers.
[I 2024-09-26 19:29:04,199] Trial 4 finished with values: [1.0, 1.1130817430123496, 0.1, 1.0, 1.0474502459890445, 0.8, 1.0, 1.2266359088413679, 0.5555555555555556] and parameters: {'h': 8, 'encoder_hidden_size': 300, 'encoder_n_layers': 4, 'context_size': 5, 'decoder_hidden_size': 256, 'learning_rate': 0.0003346472736043102, 'max_steps': 500, 'batch_size': 16, 'random_seed': 18}. 
SLURM auto-requeueing enabled. Setting signal handlers.
SLURM auto-requeueing enabled. Setting signal handlers.
SLURM auto-requeueing enabled. Setting signal handlers.
SLURM auto-requeueing enabled. Setting signal handlers.
SLURM auto-requeueing enabled. Setting signal handlers.
SLURM auto-requeueing enabled. Setting signal handlers.
SLURM auto-requeueing enabled. Setting signal handlers.
SLURM auto-requeueing enabled. Setting signal handlers.
SLURM auto-requeueing enabled. Setting signal handlers.
SLURM auto-requeueing enabled. Setting signal handlers.
SLURM auto-requeueing enabled. Setting signal handlers.
SLURM auto-requeueing enabled. Setting signal handlers.
SLURM auto-requeueing enabled. Setting signal handlers.
SLURM auto-requeueing enabled. Setting signal handlers.
SLURM auto-requeueing enabled. Setting signal handlers.
SLURM auto-requeueing enabled. Setting signal handlers.
SLURM auto-requeueing enabled. Setting signal handlers.
SLURM auto-requeueing enabled. Setting signal handlers.
SLURM auto-requeueing enabled. Setting signal handlers.
SLURM auto-requeueing enabled. Setting signal handlers.
SLURM auto-requeueing enabled. Setting signal handlers.
SLURM auto-requeueing enabled. Setting signal handlers.
SLURM auto-requeueing enabled. Setting signal handlers.
SLURM auto-requeueing enabled. Setting signal handlers.
SLURM auto-requeueing enabled. Setting signal handlers.
SLURM auto-requeueing enabled. Setting signal handlers.
SLURM auto-requeueing enabled. Setting signal handlers.
SLURM auto-requeueing enabled. Setting signal handlers.
SLURM auto-requeueing enabled. Setting signal handlers.
SLURM auto-requeueing enabled. Setting signal handlers.
SLURM auto-requeueing enabled. Setting signal handlers.
SLURM auto-requeueing enabled. Setting signal handlers.
SLURM auto-requeueing enabled. Setting signal handlers.
SLURM auto-requeueing enabled. Setting signal handlers.
SLURM auto-requeueing enabled. Setting signal handlers.
SLURM auto-requeueing enabled. Setting signal handlers.
SLURM auto-requeueing enabled. Setting signal handlers.
SLURM auto-requeueing enabled. Setting signal handlers.
SLURM auto-requeueing enabled. Setting signal handlers.
SLURM auto-requeueing enabled. Setting signal handlers.
SLURM auto-requeueing enabled. Setting signal handlers.
SLURM auto-requeueing enabled. Setting signal handlers.
SLURM auto-requeueing enabled. Setting signal handlers.
SLURM auto-requeueing enabled. Setting signal handlers.
SLURM auto-requeueing enabled. Setting signal handlers.
