[I 2024-09-26 11:10:08,531] Trial 9 finished with values: [1.0, 15.012915342104787, 0.3333333333333333, 5.0, 13.143184180650557, 0.6666666666666666, 1.0, 18.508520603580703, 0.5] and parameters: {'optimizer__threshold': 1.3510223837707185e-05, 'optimizer__alpha': 0.0014957389590923703, 'discrete_time': True, 'feature_library': 1, 'differentiation_method': 4}. 
[I 2024-09-26 11:10:10,499] Trial 10 finished with values: [1.0, 15.012915342104787, 0.3333333333333333, 5.0, 13.143184180650557, 0.6666666666666666, 1.0, 18.508520603580703, 0.5] and parameters: {'optimizer__threshold': 0.02155168310500367, 'optimizer__alpha': 0.002679387019089249, 'discrete_time': True, 'feature_library': 1, 'differentiation_method': 1}. 
[I 2024-09-26 11:10:12,644] Trial 11 finished with values: [4.0, 5.778289738941433, 1.0, 14.0, 8.180312692068451, 1.0, 5.0, 21.72576387857099, 1.0] and parameters: {'optimizer__threshold': 0.1936600731782034, 'optimizer__alpha': 2.3994086199430518, 'discrete_time': False, 'feature_library': 0, 'differentiation_method': 4}. 
[I 2024-09-26 11:10:14,783] Trial 12 finished with values: [4.0, 5.552452858585155, 1.0, 16.0, 8.025254587758276, 1.0, 6.0, 19.677345085684998, 1.0] and parameters: {'optimizer__threshold': 0.04341921686195329, 'optimizer__alpha': 0.039661533729484104, 'discrete_time': False, 'feature_library': 0, 'differentiation_method': 0}. 
[I 2024-09-26 11:10:16,470] Trial 13 finished with values: [6.0, 7.645054232149743, 0.0, 4.0, 7.477084514790928, 0.0, 2.0, 27.33741466035377, 0.5] and parameters: {'optimizer__threshold': 0.40540395255910194, 'optimizer__alpha': 0.0045164716066851286, 'discrete_time': True, 'feature_library': 0, 'differentiation_method': 6}. 
[I 2024-09-26 11:10:18,467] Trial 14 finished with values: [6.0, 7.645054232149743, 0.0, 4.0, 7.477084514790928, 0.0, 2.0, 27.33741466035377, 0.5] and parameters: {'optimizer__threshold': 0.12785062860185728, 'optimizer__alpha': 1.4097623140245823, 'discrete_time': True, 'feature_library': 0, 'differentiation_method': 1}. 
[I 2024-09-26 11:10:20,247] Trial 15 finished with values: [2.0, 21.81626554784482, 0.3333333333333333, 11.0, 6.074001853601366, 0.3333333333333333, 2.0, 131.63937855173558, 0.5] and parameters: {'optimizer__threshold': 0.00029481763313388116, 'optimizer__alpha': 0.0841375654794719, 'discrete_time': False, 'feature_library': 1, 'differentiation_method': 4}. 
[I 2024-09-26 11:10:21,932] Trial 16 finished with values: [1.0, 15.012915342104787, 0.3333333333333333, 5.0, 13.143184180650557, 0.6666666666666666, 1.0, 18.508520603580703, 0.5] and parameters: {'optimizer__threshold': 7.091560186160379e-05, 'optimizer__alpha': 5.604898461853978e-05, 'discrete_time': True, 'feature_library': 1, 'differentiation_method': 2}. 
[I 2024-09-26 11:10:23,597] Trial 17 finished with values: [6.0, 7.645054232149743, 0.0, 4.0, 7.477084514790928, 0.0, 2.0, 27.33741466035377, 0.5] and parameters: {'optimizer__threshold': 0.000813245979523964, 'optimizer__alpha': 2.6560459980785436, 'discrete_time': True, 'feature_library': 0, 'differentiation_method': 8}. 
[I 2024-09-26 11:10:25,754] Trial 18 finished with values: [2.0, 21.02816059611848, 0.3333333333333333, 8.0, 5.964502964357718, 0.3333333333333333, 2.0, 168.84077140145845, 0.5] and parameters: {'optimizer__threshold': 0.00021511386063513468, 'optimizer__alpha': 4.7350157025566316e-05, 'discrete_time': False, 'feature_library': 1, 'differentiation_method': 2}. 
[I 2024-09-26 11:10:27,430] Trial 19 finished with values: [1.0, 15.012915342104787, 0.3333333333333333, 5.0, 13.143184180650557, 0.6666666666666666, 1.0, 18.508520603580703, 0.5] and parameters: {'optimizer__threshold': 0.0009760425348529727, 'optimizer__alpha': 0.07158588776420216, 'discrete_time': True, 'feature_library': 1, 'differentiation_method': 1}. 
[I 2024-09-26 11:10:29,102] Trial 20 finished with values: [6.0, 7.645054232149743, 0.0, 4.0, 7.477084514790928, 0.0, 2.0, 27.33741466035377, 0.5] and parameters: {'optimizer__threshold': 0.4569418999724664, 'optimizer__alpha': 0.0012941265329857498, 'discrete_time': True, 'feature_library': 0, 'differentiation_method': 5}. 
[I 2024-09-26 11:10:31,561] Trial 21 finished with values: [6.0, 4.44341896505394, 1.0, 21.0, 6.0282801420964, 1.0, 5.0, 21.503317601581116, 1.0] and parameters: {'optimizer__threshold': 4.051368912644624, 'optimizer__alpha': 0.027380340168903925, 'discrete_time': False, 'feature_library': 0, 'differentiation_method': 3}. 
[I 2024-09-26 11:10:33,226] Trial 22 finished with values: [1.0, 15.012915342104787, 0.3333333333333333, 5.0, 13.143184180650557, 0.6666666666666666, 1.0, 18.508520603580703, 0.5] and parameters: {'optimizer__threshold': 0.2576336560066372, 'optimizer__alpha': 0.0021046681249787084, 'discrete_time': True, 'feature_library': 1, 'differentiation_method': 6}. 
[I 2024-09-26 11:10:35,371] Trial 23 finished with values: [4.0, 5.778289738941433, 1.0, 14.0, 8.180312692068451, 1.0, 5.0, 21.72576387857099, 1.0] and parameters: {'optimizer__threshold': 0.0001187512184651594, 'optimizer__alpha': 1.8864099010355129, 'discrete_time': False, 'feature_library': 0, 'differentiation_method': 4}. 
[I 2024-09-26 11:10:37,159] Trial 24 finished with values: [2.0, 7.995940072027339, 0.0, 19.0, 7.200763669005799, 0.3333333333333333, 2.0, 25.824794278456686, 0.0] and parameters: {'optimizer__threshold': 0.0002243473094229818, 'optimizer__alpha': 0.00024324707804138887, 'discrete_time': False, 'feature_library': 0, 'differentiation_method': 8}. 
[I 2024-09-26 11:10:47,678] A new study created in memory with name: LTSFLinearForecaster predicting coupled_logistic_map(sigma=0.15)
[I 2024-09-26 11:11:03,957] Trial 0 finished with values: [1.0, 0.8516621520342421, 1.0, 3.0, 0.920519869660924, 1.0, 1.0, 1.0894874303050046, 0.7777777777777778] and parameters: {'seq_len': 4, 'lr': 0.009867393607836679, 'pred_len': 17, 'num_epochs': 300}. 
[I 2024-09-26 11:11:19,332] Trial 1 finished with values: [1.0, 2.544670878347869, 0.0, 1.0, 2.63239043454826, 0.0, 1.0, 2.405027813928002, 0.2222222222222222] and parameters: {'seq_len': 2, 'lr': 2.6220058645808516e-05, 'pred_len': 25, 'num_epochs': 300}. 
[I 2024-09-26 11:11:34,589] Trial 2 finished with values: [1.0, 0.8516463800588097, 1.0, 3.0, 0.9200286349611774, 1.0, 1.0, 1.0893442726640967, 0.7777777777777778] and parameters: {'seq_len': 11, 'lr': 0.007478022752113199, 'pred_len': 24, 'num_epochs': 300}. 
[I 2024-09-26 11:11:42,812] Trial 3 finished with values: [1.0, 1.3658049189750423, 0.0, 2.0, 0.9421566495405371, 0.5, 1.0, 1.0693729547074473, 0.6666666666666666] and parameters: {'seq_len': 18, 'lr': 0.0013821438198984893, 'pred_len': 11, 'num_epochs': 50}. 
[I 2024-09-26 11:11:52,334] Trial 4 finished with values: [1.0, 0.8573618121859349, 0.9, 3.0, 0.922337980777884, 1.0, 1.0, 2.55342018886332, 0.2222222222222222] and parameters: {'seq_len': 2, 'lr': 6.215978555806616e-05, 'pred_len': 2, 'num_epochs': 100}. 
[I 2024-09-26 11:12:00,315] Trial 5 finished with values: [1.0, 0.8538757156402516, 1.0, 2.0, 0.920093242166464, 1.0, 1.0, 1.0969919267030046, 0.7777777777777778] and parameters: {'seq_len': 15, 'lr': 0.007882929844118083, 'pred_len': 24, 'num_epochs': 50}. 
[I 2024-09-26 11:12:09,715] Trial 6 finished with values: [1.0, 4.047872536853023, 0.0, 2.0, 1.1350998052068206, 0.4, 1.0, 1.098446720723188, 0.7777777777777778] and parameters: {'seq_len': 18, 'lr': 7.673715359160935e-05, 'pred_len': 20, 'num_epochs': 100}. 
[I 2024-09-26 11:12:19,305] Trial 7 finished with values: [1.0, 0.8522168778369955, 1.0, 3.0, 0.9215631130430038, 1.0, 1.0, 1.1020549917355793, 0.7777777777777778] and parameters: {'seq_len': 14, 'lr': 0.010006608693701605, 'pred_len': 1, 'num_epochs': 100}. 
[I 2024-09-26 11:12:35,441] Trial 8 finished with values: [1.0, 0.8575071664654549, 1.0, 2.0, 0.922142363991335, 1.0, 1.0, 1.0876271697917643, 0.7777777777777778] and parameters: {'seq_len': 17, 'lr': 0.0004007586364255791, 'pred_len': 2, 'num_epochs': 300}. 
[I 2024-09-26 11:12:51,356] Trial 9 finished with values: [1.0, 0.8523908047767095, 1.0, 3.0, 0.9226434635099586, 1.0, 1.0, 1.0977735421143862, 0.7777777777777778] and parameters: {'seq_len': 9, 'lr': 0.03535706443982855, 'pred_len': 20, 'num_epochs': 300}. 
[I 2024-09-26 11:13:06,812] Trial 10 finished with values: [1.0, 0.8536846589204408, 1.0, 3.0, 0.9236366508775368, 1.0, 1.0, 1.0994598591146247, 0.7777777777777778] and parameters: {'seq_len': 15, 'lr': 0.03370045505388958, 'pred_len': 9, 'num_epochs': 300}. 
[I 2024-09-26 11:13:15,054] Trial 11 finished with values: [1.0, 0.8549886172286937, 1.0, 3.0, 0.9254453755136967, 0.9, 1.0, 1.101165011621898, 0.7777777777777778] and parameters: {'seq_len': 9, 'lr': 0.05717250403177481, 'pred_len': 5, 'num_epochs': 50}. 
[I 2024-09-26 11:13:31,322] Trial 12 finished with values: [1.0, 1.0836809059640893, 0.0, 1.0, 1.1529657599242156, 0.0, 1.0, 1.0912596304621591, 0.2222222222222222] and parameters: {'seq_len': 12, 'lr': 2.2970945775125177e-05, 'pred_len': 9, 'num_epochs': 300}. 
[I 2024-09-26 11:13:40,828] Trial 13 finished with values: [1.0, 0.8540378077116844, 1.0, 3.0, 0.919934747878134, 1.0, 1.0, 1.0876245167411498, 0.7777777777777778] and parameters: {'seq_len': 19, 'lr': 0.0021769537170866857, 'pred_len': 7, 'num_epochs': 100}. 
[I 2024-09-26 11:13:48,611] Trial 14 finished with values: [1.0, 2.03289671357495, 0.0, 1.0, 2.2487388163365543, 0.0, 1.0, 2.0286142623915913, 0.2222222222222222] and parameters: {'seq_len': 15, 'lr': 1.6866909858990563e-05, 'pred_len': 6, 'num_epochs': 50}. 
[I 2024-09-26 11:14:04,181] Trial 15 finished with values: [1.0, 0.9986495147836305, 0.0, 1.0, 0.9606417713451995, 0.6, 2.0, 1.0828028103646568, 0.5555555555555556] and parameters: {'seq_len': 18, 'lr': 8.733445351874613e-05, 'pred_len': 13, 'num_epochs': 300}. 
[I 2024-09-26 11:14:13,588] Trial 16 finished with values: [1.0, 0.8544968338010901, 1.0, 3.0, 0.9252160308354825, 1.0, 1.0, 1.115662580147487, 0.7777777777777778] and parameters: {'seq_len': 10, 'lr': 0.03189899818447053, 'pred_len': 5, 'num_epochs': 100}. 
[I 2024-09-26 11:14:21,532] Trial 17 finished with values: [1.0, 2.4844917870352803, 0.0, 1.0, 2.577245683694678, 0.0, 1.0, 1.2034521017941169, 0.2222222222222222] and parameters: {'seq_len': 4, 'lr': 2.1467743863382064e-05, 'pred_len': 16, 'num_epochs': 50}. 
[I 2024-09-26 11:14:37,744] Trial 18 finished with values: [1.0, 0.851856124819021, 1.0, 3.0, 0.9203096036794526, 1.0, 1.0, 1.0925619580186976, 0.7777777777777778] and parameters: {'seq_len': 10, 'lr': 0.0035516161446616542, 'pred_len': 8, 'num_epochs': 300}. 
[I 2024-09-26 11:14:53,530] Trial 19 finished with values: [1.0, 0.8523678718390231, 1.0, 3.0, 0.9214185004247656, 1.0, 1.0, 1.1023412888263935, 0.7777777777777778] and parameters: {'seq_len': 15, 'lr': 0.022146862964144788, 'pred_len': 12, 'num_epochs': 300}. 
[I 2024-09-26 11:15:09,090] Trial 20 finished with values: [1.0, 0.9240341085523565, 0.2, 1.0, 0.9293456811080415, 0.9, 1.0, 1.0987934674764714, 0.6666666666666666] and parameters: {'seq_len': 24, 'lr': 6.927507297500919e-05, 'pred_len': 2, 'num_epochs': 300}. 
[I 2024-09-26 11:15:23,808] Trial 21 finished with values: [1.0, 0.9481028308622876, 0.0, 4.0, 0.9302166114442878, 0.9, 1.0, 1.0901821139231138, 0.7777777777777778] and parameters: {'seq_len': 24, 'lr': 0.00016267800777971592, 'pred_len': 22, 'num_epochs': 300}. 
[I 2024-09-26 11:15:33,869] Trial 22 finished with values: [1.0, 0.8532845302075277, 1.0, 3.0, 0.9235198945234993, 1.0, 1.0, 1.1420378626898355, 0.6666666666666666] and parameters: {'seq_len': 8, 'lr': 0.07105128540128905, 'pred_len': 3, 'num_epochs': 100}. 
[I 2024-09-26 11:15:41,653] Trial 23 finished with values: [1.0, 0.8818469691833632, 0.5, 1.0, 0.941703094278372, 0.6, 1.0, 1.11000204313362, 0.2222222222222222] and parameters: {'seq_len': 11, 'lr': 8.54368798625523e-05, 'pred_len': 5, 'num_epochs': 50}. 
[I 2024-09-26 11:15:51,323] Trial 24 finished with values: [1.0, 0.949607405190669, 0.0, 1.0, 0.9537569091607352, 0.5, 1.0, 1.0718333598229481, 0.5555555555555556] and parameters: {'seq_len': 11, 'lr': 0.0001392057285896066, 'pred_len': 17, 'num_epochs': 100}. 
[I 2024-09-26 11:16:04,177] A new study created in memory with name: VAR predicting coupled_logistic_map(sigma=0.15)
[W 2024-09-26 11:16:04,195] Trial 0 failed with parameters: {'ic': 'aic', 'maxlags': 3, 'trend': 'ctt'} because of the following error: The value nan is not acceptable.
[W 2024-09-26 11:16:04,195] Trial 0 failed with value [nan, nan, nan, nan, nan, nan, nan, nan, nan].
[W 2024-09-26 11:16:04,205] Trial 1 failed with parameters: {'ic': 'fpe', 'maxlags': 4, 'trend': 'n'} because of the following error: The value nan is not acceptable.
[W 2024-09-26 11:16:04,205] Trial 1 failed with value [nan, nan, nan, nan, nan, nan, nan, nan, nan].
[W 2024-09-26 11:16:04,212] Trial 2 failed with parameters: {'ic': 'fpe', 'maxlags': 3, 'trend': 'ctt'} because of the following error: The value nan is not acceptable.
[W 2024-09-26 11:16:04,212] Trial 2 failed with value [nan, nan, nan, nan, nan, nan, nan, nan, nan].
[W 2024-09-26 11:16:04,216] Trial 3 failed with parameters: {'ic': 'aic', 'maxlags': 1, 'trend': 'c'} because of the following error: The value nan is not acceptable.
[W 2024-09-26 11:16:04,216] Trial 3 failed with value [nan, nan, nan, nan, nan, nan, nan, nan, nan].
[W 2024-09-26 11:16:04,221] Trial 4 failed with parameters: {'ic': 'aic', 'maxlags': 2, 'trend': 'ct'} because of the following error: The value nan is not acceptable.
[W 2024-09-26 11:16:04,221] Trial 4 failed with value [nan, nan, nan, nan, nan, nan, nan, nan, nan].
[W 2024-09-26 11:16:04,230] Trial 5 failed with parameters: {'ic': 'aic', 'maxlags': 5, 'trend': 'ct'} because of the following error: The value nan is not acceptable.
[W 2024-09-26 11:16:04,230] Trial 5 failed with value [nan, nan, nan, nan, nan, nan, nan, nan, nan].
[W 2024-09-26 11:16:04,236] Trial 6 failed with parameters: {'ic': 'aic', 'maxlags': 3, 'trend': 'ct'} because of the following error: The value nan is not acceptable.
[W 2024-09-26 11:16:04,236] Trial 6 failed with value [nan, nan, nan, nan, nan, nan, nan, nan, nan].
[W 2024-09-26 11:16:04,242] Trial 7 failed with parameters: {'ic': 'fpe', 'maxlags': 3, 'trend': 'c'} because of the following error: The value nan is not acceptable.
[W 2024-09-26 11:16:04,242] Trial 7 failed with value [nan, nan, nan, nan, nan, nan, nan, nan, nan].
[W 2024-09-26 11:16:04,246] Trial 8 failed with parameters: {'ic': 'aic', 'maxlags': 1, 'trend': 'c'} because of the following error: The value nan is not acceptable.
[W 2024-09-26 11:16:04,247] Trial 8 failed with value [nan, nan, nan, nan, nan, nan, nan, nan, nan].
[W 2024-09-26 11:16:04,253] Trial 9 failed with parameters: {'ic': 'fpe', 'maxlags': 3, 'trend': 'ct'} because of the following error: The value nan is not acceptable.
[W 2024-09-26 11:16:04,253] Trial 9 failed with value [nan, nan, nan, nan, nan, nan, nan, nan, nan].
[W 2024-09-26 11:16:04,260] Trial 10 failed with parameters: {'ic': 'fpe', 'maxlags': 4, 'trend': 'ctt'} because of the following error: The value nan is not acceptable.
[W 2024-09-26 11:16:04,261] Trial 10 failed with value [nan, nan, nan, nan, nan, nan, nan, nan, nan].
[W 2024-09-26 11:16:04,268] Trial 11 failed with parameters: {'ic': 'fpe', 'maxlags': 4, 'trend': 'c'} because of the following error: The value nan is not acceptable.
[W 2024-09-26 11:16:04,268] Trial 11 failed with value [nan, nan, nan, nan, nan, nan, nan, nan, nan].
[W 2024-09-26 11:16:04,277] Trial 12 failed with parameters: {'ic': 'aic', 'maxlags': 5, 'trend': 'n'} because of the following error: The value nan is not acceptable.
[W 2024-09-26 11:16:04,277] Trial 12 failed with value [nan, nan, nan, nan, nan, nan, nan, nan, nan].
[W 2024-09-26 11:16:04,286] Trial 13 failed with parameters: {'ic': 'fpe', 'maxlags': 5, 'trend': 'n'} because of the following error: The value nan is not acceptable.
[W 2024-09-26 11:16:04,286] Trial 13 failed with value [nan, nan, nan, nan, nan, nan, nan, nan, nan].
[W 2024-09-26 11:16:04,292] Trial 14 failed with parameters: {'ic': 'fpe', 'maxlags': 3, 'trend': 'c'} because of the following error: The value nan is not acceptable.
[W 2024-09-26 11:16:04,292] Trial 14 failed with value [nan, nan, nan, nan, nan, nan, nan, nan, nan].
[W 2024-09-26 11:16:04,299] Trial 15 failed with parameters: {'ic': 'fpe', 'maxlags': 4, 'trend': 'c'} because of the following error: The value nan is not acceptable.
[W 2024-09-26 11:16:04,300] Trial 15 failed with value [nan, nan, nan, nan, nan, nan, nan, nan, nan].
[W 2024-09-26 11:16:04,303] Trial 16 failed with parameters: {'ic': 'aic', 'maxlags': 1, 'trend': 'n'} because of the following error: The value nan is not acceptable.
[W 2024-09-26 11:16:04,304] Trial 16 failed with value [nan, nan, nan, nan, nan, nan, nan, nan, nan].
[W 2024-09-26 11:16:04,312] Trial 17 failed with parameters: {'ic': 'fpe', 'maxlags': 5, 'trend': 'ctt'} because of the following error: The value nan is not acceptable.
[W 2024-09-26 11:16:04,313] Trial 17 failed with value [nan, nan, nan, nan, nan, nan, nan, nan, nan].
[W 2024-09-26 11:16:04,319] Trial 18 failed with parameters: {'ic': 'aic', 'maxlags': 3, 'trend': 'c'} because of the following error: The value nan is not acceptable.
[W 2024-09-26 11:16:04,319] Trial 18 failed with value [nan, nan, nan, nan, nan, nan, nan, nan, nan].
[W 2024-09-26 11:16:04,323] Trial 19 failed with parameters: {'ic': 'fpe', 'maxlags': 1, 'trend': 'c'} because of the following error: The value nan is not acceptable.
[W 2024-09-26 11:16:04,323] Trial 19 failed with value [nan, nan, nan, nan, nan, nan, nan, nan, nan].
[W 2024-09-26 11:16:04,330] Trial 20 failed with parameters: {'ic': 'aic', 'maxlags': 3, 'trend': 'ct'} because of the following error: The value nan is not acceptable.
[W 2024-09-26 11:16:04,330] Trial 20 failed with value [nan, nan, nan, nan, nan, nan, nan, nan, nan].
[W 2024-09-26 11:16:04,337] Trial 21 failed with parameters: {'ic': 'fpe', 'maxlags': 4, 'trend': 'c'} because of the following error: The value nan is not acceptable.
[W 2024-09-26 11:16:04,338] Trial 21 failed with value [nan, nan, nan, nan, nan, nan, nan, nan, nan].
[W 2024-09-26 11:16:04,344] Trial 22 failed with parameters: {'ic': 'aic', 'maxlags': 3, 'trend': 'ctt'} because of the following error: The value nan is not acceptable.
[W 2024-09-26 11:16:04,344] Trial 22 failed with value [nan, nan, nan, nan, nan, nan, nan, nan, nan].
[W 2024-09-26 11:16:04,348] Trial 23 failed with parameters: {'ic': 'aic', 'maxlags': 1, 'trend': 'c'} because of the following error: The value nan is not acceptable.
[W 2024-09-26 11:16:04,348] Trial 23 failed with value [nan, nan, nan, nan, nan, nan, nan, nan, nan].
[W 2024-09-26 11:16:04,352] Trial 24 failed with parameters: {'ic': 'aic', 'maxlags': 1, 'trend': 'ctt'} because of the following error: The value nan is not acceptable.
[W 2024-09-26 11:16:04,352] Trial 24 failed with value [nan, nan, nan, nan, nan, nan, nan, nan, nan].
[I 2024-09-26 11:16:16,766] A new study created in memory with name: LSTM predicting coupled_logistic_map(sigma=0.15)
SLURM auto-requeueing enabled. Setting signal handlers.
SLURM auto-requeueing enabled. Setting signal handlers.
SLURM auto-requeueing enabled. Setting signal handlers.
SLURM auto-requeueing enabled. Setting signal handlers.
SLURM auto-requeueing enabled. Setting signal handlers.
SLURM auto-requeueing enabled. Setting signal handlers.
SLURM auto-requeueing enabled. Setting signal handlers.
SLURM auto-requeueing enabled. Setting signal handlers.
SLURM auto-requeueing enabled. Setting signal handlers.
SLURM auto-requeueing enabled. Setting signal handlers.
SLURM auto-requeueing enabled. Setting signal handlers.
SLURM auto-requeueing enabled. Setting signal handlers.
SLURM auto-requeueing enabled. Setting signal handlers.
SLURM auto-requeueing enabled. Setting signal handlers.
SLURM auto-requeueing enabled. Setting signal handlers.
SLURM auto-requeueing enabled. Setting signal handlers.
SLURM auto-requeueing enabled. Setting signal handlers.
SLURM auto-requeueing enabled. Setting signal handlers.
SLURM auto-requeueing enabled. Setting signal handlers.
SLURM auto-requeueing enabled. Setting signal handlers.
