[I 2024-09-26 07:31:17,908] Trial 24 finished with values: [1.0, 1.0690768349670774, 0.3, 1.0, 0.94582002538452, 0.2, 1.0, 1.2552783412251016, 0.5555555555555556] and parameters: {'gamma': 56.35140663061045, 'sigma': 27.51958176550699, 'delta': 47.63070262968491, 'mean_degree': 1.967117542064263, 'res_sz': 41, 'window': 0.00782152260643215, 'spect_rad': 1.453242558973651, 'ridge_alpha': 44.17163877216779}. 
[I 2024-09-26 07:31:29,212] A new study created in memory with name: SINDY predicting coupled_logistic_map(sigma=0.10)
[I 2024-09-26 07:31:34,452] Trial 0 finished with values: [4.0, 0.8228189313747729, 0.9, 2.0, 0.8410794399560597, 1.0, 2.0, 12.664557522066849, 0.7777777777777778] and parameters: {'optimizer__threshold': 0.0014882496085708633, 'optimizer__alpha': 1.6730388771884498e-05, 'discrete_time': True, 'feature_library': 1, 'differentiation_method': 2}. 
[I 2024-09-26 07:31:39,509] Trial 1 finished with values: [3.0, 1066994.8407137631, 0.0, 3.0, 1.0246729755771218, 0.8, 2.0, 1.3706361530254165, 0.6666666666666666] and parameters: {'optimizer__threshold': 2.400508037362316e-05, 'optimizer__alpha': 0.05673975018309715, 'discrete_time': True, 'feature_library': 0, 'differentiation_method': 2}. 
[I 2024-09-26 07:31:44,755] Trial 2 finished with values: [4.0, 0.8228189313747729, 0.9, 2.0, 0.8410794399560597, 1.0, 2.0, 12.664557522066849, 0.7777777777777778] and parameters: {'optimizer__threshold': 0.00018853689564055272, 'optimizer__alpha': 0.00010051266280465663, 'discrete_time': True, 'feature_library': 1, 'differentiation_method': 8}. 
/nas/longleaf/home/djpassey/.local/lib/python3.9/site-packages/pysindy/optimizers/stlsq.py:201: UserWarning: Sparsity parameter is too big (0.1) and eliminated all coefficients
  warnings.warn(
/nas/longleaf/home/djpassey/.local/lib/python3.9/site-packages/pysindy/optimizers/stlsq.py:201: UserWarning: Sparsity parameter is too big (0.1) and eliminated all coefficients
  warnings.warn(
/nas/longleaf/home/djpassey/.local/lib/python3.9/site-packages/scipy/stats/_axis_nan_policy.py:551: RuntimeWarning: Precision loss occurred in moment calculation due to catastrophic cancellation. This occurs when the data are nearly identical. Results may be unreliable.
  res = hypotest_fun_out(*samples, axis=axis, **kwds)
[I 2024-09-26 07:31:50,550] Trial 3 finished with values: [1.0, 0.9128266940836358, 0.3, 1.0, 12.679599472807729, 0.1, 1.0, 2.7462778155722933, 0.4444444444444444] and parameters: {'optimizer__threshold': 1.227705173707982, 'optimizer__alpha': 0.0006242272236267267, 'discrete_time': False, 'feature_library': 1, 'differentiation_method': 7}. 
[I 2024-09-26 07:31:55,862] Trial 4 finished with values: [4.0, 0.8228189313747729, 0.9, 2.0, 0.8410794399560597, 1.0, 2.0, 12.664557522066849, 0.7777777777777778] and parameters: {'optimizer__threshold': 0.0112997046445875, 'optimizer__alpha': 0.0001826419142848417, 'discrete_time': True, 'feature_library': 1, 'differentiation_method': 5}. 
[I 2024-09-26 07:32:02,122] Trial 5 finished with values: [1.0, 7.335419670884244, 0.0, 1.0, 4.970006215215473, 0.0, 1.0, 4.888629896706599, 0.1111111111111111] and parameters: {'optimizer__threshold': 0.0006241989752631217, 'optimizer__alpha': 0.004719894763198757, 'discrete_time': False, 'feature_library': 0, 'differentiation_method': 4}. 
[I 2024-09-26 07:32:10,359] Trial 6 finished with values: [1.0, 73.30928376845239, 0.0, 2.0, 54.56579892008813, 0.0, 1.0, 116.05502942312073, 0.1111111111111111] and parameters: {'optimizer__threshold': 3.7352671234388852, 'optimizer__alpha': 0.0012255029818142242, 'discrete_time': False, 'feature_library': 1, 'differentiation_method': 0}. 
/nas/longleaf/home/djpassey/.local/lib/python3.9/site-packages/pysindy/optimizers/stlsq.py:201: UserWarning: Sparsity parameter is too big (0.1) and eliminated all coefficients
  warnings.warn(
/nas/longleaf/home/djpassey/.local/lib/python3.9/site-packages/pysindy/optimizers/stlsq.py:201: UserWarning: Sparsity parameter is too big (0.1) and eliminated all coefficients
  warnings.warn(
/nas/longleaf/home/djpassey/.local/lib/python3.9/site-packages/pysindy/optimizers/stlsq.py:201: UserWarning: Sparsity parameter is too big (0.1) and eliminated all coefficients
  warnings.warn(
/nas/longleaf/home/djpassey/.local/lib/python3.9/site-packages/pysindy/optimizers/stlsq.py:201: UserWarning: Sparsity parameter is too big (0.1) and eliminated all coefficients
  warnings.warn(
/nas/longleaf/home/djpassey/.local/lib/python3.9/site-packages/pysindy/optimizers/stlsq.py:201: UserWarning: Sparsity parameter is too big (0.1) and eliminated all coefficients
  warnings.warn(
/nas/longleaf/home/djpassey/.local/lib/python3.9/site-packages/pysindy/optimizers/stlsq.py:201: UserWarning: Sparsity parameter is too big (0.1) and eliminated all coefficients
  warnings.warn(
/nas/longleaf/home/djpassey/.local/lib/python3.9/site-packages/pysindy/optimizers/stlsq.py:201: UserWarning: Sparsity parameter is too big (0.1) and eliminated all coefficients
  warnings.warn(
/nas/longleaf/home/djpassey/.local/lib/python3.9/site-packages/pysindy/optimizers/stlsq.py:201: UserWarning: Sparsity parameter is too big (0.1) and eliminated all coefficients
  warnings.warn(
/nas/longleaf/home/djpassey/.local/lib/python3.9/site-packages/scipy/stats/_axis_nan_policy.py:551: RuntimeWarning: Precision loss occurred in moment calculation due to catastrophic cancellation. This occurs when the data are nearly identical. Results may be unreliable.
  res = hypotest_fun_out(*samples, axis=axis, **kwds)
[I 2024-09-26 07:32:16,628] Trial 7 finished with values: [1.0, 58.5645622467608, 0.0, 1.0, 30.1774615492637, 0.0, 1.0, 10.986804701767309, 0.2222222222222222] and parameters: {'optimizer__threshold': 0.0001598661675110861, 'optimizer__alpha': 0.00037010972613706555, 'discrete_time': False, 'feature_library': 1, 'differentiation_method': 8}. 
[I 2024-09-26 07:32:21,718] Trial 8 finished with values: [3.0, 1066994.8407137631, 0.0, 3.0, 1.0246729755771218, 0.8, 2.0, 1.3706361530254165, 0.6666666666666666] and parameters: {'optimizer__threshold': 0.000168085937725478, 'optimizer__alpha': 0.002907308856788271, 'discrete_time': True, 'feature_library': 0, 'differentiation_method': 5}. 
[I 2024-09-26 07:32:26,747] Trial 9 finished with values: [3.0, 1066994.8407137631, 0.0, 3.0, 1.0246729755771218, 0.8, 2.0, 1.3706361530254165, 0.6666666666666666] and parameters: {'optimizer__threshold': 0.6977800336448785, 'optimizer__alpha': 0.5710231438685028, 'discrete_time': True, 'feature_library': 0, 'differentiation_method': 3}. 
[I 2024-09-26 07:32:31,811] Trial 10 finished with values: [3.0, 1066994.8407137631, 0.0, 3.0, 1.0246729755771218, 0.8, 2.0, 1.3706361530254165, 0.6666666666666666] and parameters: {'optimizer__threshold': 3.714868285776815, 'optimizer__alpha': 0.34174861917142774, 'discrete_time': True, 'feature_library': 0, 'differentiation_method': 8}. 
[I 2024-09-26 07:32:37,739] Trial 11 finished with values: [1.0, 7.335419670884244, 0.0, 1.0, 4.970006215215473, 0.0, 1.0, 4.888629896706599, 0.1111111111111111] and parameters: {'optimizer__threshold': 0.34058634156278556, 'optimizer__alpha': 2.052792901196675e-05, 'discrete_time': False, 'feature_library': 0, 'differentiation_method': 4}. 
/nas/longleaf/home/djpassey/.local/lib/python3.9/site-packages/pysindy/optimizers/stlsq.py:201: UserWarning: Sparsity parameter is too big (0.1) and eliminated all coefficients
  warnings.warn(
/nas/longleaf/home/djpassey/.local/lib/python3.9/site-packages/pysindy/optimizers/stlsq.py:201: UserWarning: Sparsity parameter is too big (0.1) and eliminated all coefficients
  warnings.warn(
/nas/longleaf/home/djpassey/.local/lib/python3.9/site-packages/scipy/stats/_axis_nan_policy.py:551: RuntimeWarning: Precision loss occurred in moment calculation due to catastrophic cancellation. This occurs when the data are nearly identical. Results may be unreliable.
  res = hypotest_fun_out(*samples, axis=axis, **kwds)
[I 2024-09-26 07:32:43,961] Trial 12 finished with values: [1.0, 0.9128266940836358, 0.3, 1.0, 12.679599472807729, 0.1, 1.0, 2.7462778155722933, 0.4444444444444444] and parameters: {'optimizer__threshold': 8.495241700485511e-05, 'optimizer__alpha': 0.03560048332067776, 'discrete_time': False, 'feature_library': 1, 'differentiation_method': 7}. 
[I 2024-09-26 07:32:49,005] Trial 13 finished with values: [3.0, 1066994.8407137631, 0.0, 3.0, 1.0246729755771218, 0.8, 2.0, 1.3706361530254165, 0.6666666666666666] and parameters: {'optimizer__threshold': 0.012732345738040435, 'optimizer__alpha': 0.11135259419552354, 'discrete_time': True, 'feature_library': 0, 'differentiation_method': 0}. 
/nas/longleaf/home/djpassey/.local/lib/python3.9/site-packages/pysindy/optimizers/stlsq.py:201: UserWarning: Sparsity parameter is too big (0.1) and eliminated all coefficients
  warnings.warn(
/nas/longleaf/home/djpassey/.local/lib/python3.9/site-packages/pysindy/optimizers/stlsq.py:201: UserWarning: Sparsity parameter is too big (0.1) and eliminated all coefficients
  warnings.warn(
/nas/longleaf/home/djpassey/.local/lib/python3.9/site-packages/pysindy/optimizers/stlsq.py:201: UserWarning: Sparsity parameter is too big (0.1) and eliminated all coefficients
  warnings.warn(
/nas/longleaf/home/djpassey/.local/lib/python3.9/site-packages/pysindy/optimizers/stlsq.py:201: UserWarning: Sparsity parameter is too big (0.1) and eliminated all coefficients
  warnings.warn(
/nas/longleaf/home/djpassey/.local/lib/python3.9/site-packages/pysindy/optimizers/stlsq.py:201: UserWarning: Sparsity parameter is too big (0.1) and eliminated all coefficients
  warnings.warn(
/nas/longleaf/home/djpassey/.local/lib/python3.9/site-packages/pysindy/optimizers/stlsq.py:201: UserWarning: Sparsity parameter is too big (0.1) and eliminated all coefficients
  warnings.warn(
/nas/longleaf/home/djpassey/.local/lib/python3.9/site-packages/pysindy/optimizers/stlsq.py:201: UserWarning: Sparsity parameter is too big (0.1) and eliminated all coefficients
  warnings.warn(
/nas/longleaf/home/djpassey/.local/lib/python3.9/site-packages/pysindy/optimizers/stlsq.py:201: UserWarning: Sparsity parameter is too big (0.1) and eliminated all coefficients
  warnings.warn(
/nas/longleaf/home/djpassey/.local/lib/python3.9/site-packages/scipy/stats/_axis_nan_policy.py:551: RuntimeWarning: Precision loss occurred in moment calculation due to catastrophic cancellation. This occurs when the data are nearly identical. Results may be unreliable.
  res = hypotest_fun_out(*samples, axis=axis, **kwds)
[I 2024-09-26 07:32:55,255] Trial 14 finished with values: [1.0, 58.5645622467608, 0.0, 1.0, 30.1774615492637, 0.0, 1.0, 10.986804701767309, 0.2222222222222222] and parameters: {'optimizer__threshold': 0.07574917451390481, 'optimizer__alpha': 0.00011251436874371715, 'discrete_time': False, 'feature_library': 1, 'differentiation_method': 8}. 
[I 2024-09-26 07:33:02,258] Trial 15 finished with values: [1.0, 5.57476945527454, 0.0, 1.0, 2.7830242637331835, 0.1, 1.0, 16.149399059194355, 0.1111111111111111] and parameters: {'optimizer__threshold': 0.07197161734785892, 'optimizer__alpha': 1.2737761724534546e-05, 'discrete_time': False, 'feature_library': 0, 'differentiation_method': 7}. 
[I 2024-09-26 07:33:07,316] Trial 16 finished with values: [3.0, 1066994.8407137631, 0.0, 3.0, 1.0246729755771218, 0.8, 2.0, 1.3706361530254165, 0.6666666666666666] and parameters: {'optimizer__threshold': 1.1621474458034542, 'optimizer__alpha': 0.0801007848738065, 'discrete_time': True, 'feature_library': 0, 'differentiation_method': 6}. 
[I 2024-09-26 07:33:13,548] Trial 17 finished with values: [1.0, 7.335419670884244, 0.0, 1.0, 4.970006215215473, 0.0, 1.0, 4.888629896706599, 0.1111111111111111] and parameters: {'optimizer__threshold': 0.010467630995921306, 'optimizer__alpha': 3.4211140664504684e-05, 'discrete_time': False, 'feature_library': 0, 'differentiation_method': 4}. 
[I 2024-09-26 07:33:23,095] Trial 18 finished with values: [1.0, 52.97662832238534, 0.1, 2.0, 43.095285934730214, 0.0, 1.0, 134.93229007259188, 0.3333333333333333] and parameters: {'optimizer__threshold': 0.454857629710623, 'optimizer__alpha': 1.911866182560514, 'discrete_time': False, 'feature_library': 1, 'differentiation_method': 1}. 
/nas/longleaf/home/djpassey/.local/lib/python3.9/site-packages/pysindy/optimizers/stlsq.py:201: UserWarning: Sparsity parameter is too big (0.1) and eliminated all coefficients
  warnings.warn(
/nas/longleaf/home/djpassey/.local/lib/python3.9/site-packages/pysindy/optimizers/stlsq.py:201: UserWarning: Sparsity parameter is too big (0.1) and eliminated all coefficients
  warnings.warn(
/nas/longleaf/home/djpassey/.local/lib/python3.9/site-packages/pysindy/optimizers/stlsq.py:201: UserWarning: Sparsity parameter is too big (0.1) and eliminated all coefficients
  warnings.warn(
/nas/longleaf/home/djpassey/.local/lib/python3.9/site-packages/pysindy/optimizers/stlsq.py:201: UserWarning: Sparsity parameter is too big (0.1) and eliminated all coefficients
  warnings.warn(
/nas/longleaf/home/djpassey/.local/lib/python3.9/site-packages/pysindy/optimizers/stlsq.py:201: UserWarning: Sparsity parameter is too big (0.1) and eliminated all coefficients
  warnings.warn(
/nas/longleaf/home/djpassey/.local/lib/python3.9/site-packages/pysindy/optimizers/stlsq.py:201: UserWarning: Sparsity parameter is too big (0.1) and eliminated all coefficients
  warnings.warn(
/nas/longleaf/home/djpassey/.local/lib/python3.9/site-packages/pysindy/optimizers/stlsq.py:201: UserWarning: Sparsity parameter is too big (0.1) and eliminated all coefficients
  warnings.warn(
/nas/longleaf/home/djpassey/.local/lib/python3.9/site-packages/pysindy/optimizers/stlsq.py:201: UserWarning: Sparsity parameter is too big (0.1) and eliminated all coefficients
  warnings.warn(
/nas/longleaf/home/djpassey/.local/lib/python3.9/site-packages/scipy/stats/_axis_nan_policy.py:551: RuntimeWarning: Precision loss occurred in moment calculation due to catastrophic cancellation. This occurs when the data are nearly identical. Results may be unreliable.
  res = hypotest_fun_out(*samples, axis=axis, **kwds)
[I 2024-09-26 07:33:28,828] Trial 19 finished with values: [1.0, 5.5931274004648985, 0.0, 1.0, 4.990248392473045, 0.1, 1.0, 3.507876673174573, 0.2222222222222222] and parameters: {'optimizer__threshold': 2.245456576654154, 'optimizer__alpha': 1.6533830860247913, 'discrete_time': False, 'feature_library': 1, 'differentiation_method': 5}. 
[I 2024-09-26 07:33:34,787] Trial 20 finished with values: [1.0, 7.335419670884244, 0.0, 1.0, 4.970006215215473, 0.0, 1.0, 4.888629896706599, 0.1111111111111111] and parameters: {'optimizer__threshold': 0.0018891172158572306, 'optimizer__alpha': 0.3805539430408273, 'discrete_time': False, 'feature_library': 0, 'differentiation_method': 4}. 
[I 2024-09-26 07:33:40,007] Trial 21 finished with values: [3.0, 1066994.8407137631, 0.0, 3.0, 1.0246729755771218, 0.8, 2.0, 1.3706361530254165, 0.6666666666666666] and parameters: {'optimizer__threshold': 0.6785554130660131, 'optimizer__alpha': 1.011887483623386, 'discrete_time': True, 'feature_library': 0, 'differentiation_method': 2}. 
[I 2024-09-26 07:33:45,130] Trial 22 finished with values: [3.0, 1066994.8407137631, 0.0, 3.0, 1.0246729755771218, 0.8, 2.0, 1.3706361530254165, 0.6666666666666666] and parameters: {'optimizer__threshold': 0.0332847389180914, 'optimizer__alpha': 2.3105452241050086e-05, 'discrete_time': True, 'feature_library': 0, 'differentiation_method': 6}. 
[I 2024-09-26 07:33:52,141] Trial 23 finished with values: [1.0, 6.789152458981082, 0.0, 1.0, 11.134615138976534, 0.1, 1.0, 35.71720970942477, 0.2222222222222222] and parameters: {'optimizer__threshold': 0.003083195092381908, 'optimizer__alpha': 2.0883640068605858e-05, 'discrete_time': False, 'feature_library': 0, 'differentiation_method': 8}. 
[I 2024-09-26 07:33:58,558] Trial 24 finished with values: [1.0, 7.335419670884244, 0.0, 1.0, 4.970006215215473, 0.0, 1.0, 4.888629896706599, 0.1111111111111111] and parameters: {'optimizer__threshold': 1.624209192519451e-05, 'optimizer__alpha': 0.15230687696306483, 'discrete_time': False, 'feature_library': 0, 'differentiation_method': 4}. 
[I 2024-09-26 07:34:13,764] A new study created in memory with name: LTSFLinearForecaster predicting Belozyorov3DQuad(sigma=0.10)
[I 2024-09-26 07:34:19,968] Trial 0 finished with values: [4.0, 12.064463566015371, 0.3333333333333333, 3.0, 6.09040310933033, 0.0, 3.0, 22.755416892577504, 0.5] and parameters: {'seq_len': 18, 'lr': 0.001217474972036449, 'pred_len': 15, 'num_epochs': 100}. 
[I 2024-09-26 07:34:26,101] Trial 1 finished with values: [4.0, 11.93366315897955, 0.3333333333333333, 4.0, 6.543386619673781, 0.0, 3.0, 23.188366424339314, 0.5] and parameters: {'seq_len': 14, 'lr': 0.0014395361695346, 'pred_len': 11, 'num_epochs': 100}. 
[I 2024-09-26 07:34:39,595] Trial 2 finished with values: [4.0, 20.113271025942538, 0.0, 3.0, 10.992186109430907, 0.0, 3.0, 22.523558977502372, 0.5] and parameters: {'seq_len': 6, 'lr': 6.441310387242957e-05, 'pred_len': 5, 'num_epochs': 300}. 
[I 2024-09-26 07:34:44,512] Trial 3 finished with values: [4.0, 12.475815212721532, 0.0, 1.0, 11.551923414435521, 0.0, 1.0, 36.44274053054144, 0.0] and parameters: {'seq_len': 3, 'lr': 4.680610623924924e-05, 'pred_len': 8, 'num_epochs': 50}. 
[I 2024-09-26 07:34:50,573] Trial 4 finished with values: [4.0, 11.886596868407091, 0.3333333333333333, 3.0, 7.114752170458594, 0.0, 1.0, 35.28872369383736, 0.0] and parameters: {'seq_len': 7, 'lr': 9.055739046859018e-05, 'pred_len': 12, 'num_epochs': 100}. 
[I 2024-09-26 07:35:04,164] Trial 5 finished with values: [4.0, 11.611429727945195, 0.0, 3.0, 4.738072566693447, 0.3333333333333333, 3.0, 28.63073565184246, 0.0] and parameters: {'seq_len': 9, 'lr': 0.007028280464556853, 'pred_len': 3, 'num_epochs': 300}. 
[I 2024-09-26 07:35:15,745] Trial 6 finished with values: [4.0, 1755554930.0277417, 0.0, 1.0, 2680.754523341815, 1.0, 3.0, 19.243887177854933, 0.5] and parameters: {'seq_len': 15, 'lr': 0.07860892579766915, 'pred_len': 19, 'num_epochs': 300}. 
[I 2024-09-26 07:35:21,916] Trial 7 finished with values: [3.0, 12.07419648148996, 0.0, 4.0, 8.296474550146286, 0.0, 4.0, 22.610386149022297, 0.5] and parameters: {'seq_len': 3, 'lr': 0.03451108924176466, 'pred_len': 8, 'num_epochs': 100}. 
[I 2024-09-26 07:35:26,686] Trial 8 finished with values: [3.0, 12.062700729725726, 0.3333333333333333, 1.0, 11.105139887132168, 0.3333333333333333, 2.0, 46.97388543939751, 0.0] and parameters: {'seq_len': 2, 'lr': 0.0003135657720541455, 'pred_len': 12, 'num_epochs': 50}. 
[I 2024-09-26 07:35:30,897] Trial 9 finished with values: [3.0, 11.764703419329484, 0.0, 1.0, 6.41171312128876, 0.3333333333333333, 1.0, 30.964606624302913, 0.0] and parameters: {'seq_len': 25, 'lr': 5.5337375143892434e-05, 'pred_len': 8, 'num_epochs': 50}. 
[I 2024-09-26 07:35:36,403] Trial 10 finished with values: [3.0, 11.482958078676607, 0.0, 4.0, 7.853764433461405, 0.0, 2.0, 21.506644518766684, 0.0] and parameters: {'seq_len': 23, 'lr': 0.00020665230211468192, 'pred_len': 19, 'num_epochs': 100}. 
[I 2024-09-26 07:35:48,438] Trial 11 finished with values: [4.0, 12.079402335093109, 0.3333333333333333, 4.0, 6.9104914643787705, 0.0, 3.0, 23.331217210914932, 0.5] and parameters: {'seq_len': 15, 'lr': 0.05216846340113534, 'pred_len': 15, 'num_epochs': 300}. 
[I 2024-09-26 07:35:54,807] Trial 12 finished with values: [3.0, 11.3012640039942, 0.0, 4.0, 7.410487107552813, 0.0, 3.0, 23.344757040096457, 0.5] and parameters: {'seq_len': 8, 'lr': 0.0007640688528134353, 'pred_len': 7, 'num_epochs': 100}. 
[I 2024-09-26 07:36:06,799] Trial 13 finished with values: [3.0, 11.581923967752322, 0.0, 3.0, 6.460261963978541, 0.3333333333333333, 2.0, 41.52629488097877, 0.0] and parameters: {'seq_len': 17, 'lr': 3.5954139683331764e-05, 'pred_len': 7, 'num_epochs': 300}. 
[I 2024-09-26 07:36:17,782] Trial 14 finished with values: [3.0, 641424.418399833, 0.0, 1.0, 631.0544525038144, 0.0, 1.0, 274712361.98947746, 0.0] and parameters: {'seq_len': 17, 'lr': 0.08907883934260845, 'pred_len': 23, 'num_epochs': 300}. 
[I 2024-09-26 07:36:22,221] Trial 15 finished with values: [3.0, 23006560.905281287, 0.0, 1.0, 2113.75556559572, 0.0, 1.0, 43.66171472436185, 0.0] and parameters: {'seq_len': 17, 'lr': 0.07510282887247564, 'pred_len': 24, 'num_epochs': 50}. 
[I 2024-09-26 07:36:26,496] Trial 16 finished with values: [4.0, 12.090167501642092, 0.3333333333333333, 5.0, 7.371592847497877, 0.0, 3.0, 24.709592405865887, 0.0] and parameters: {'seq_len': 13, 'lr': 0.07229543798576218, 'pred_len': 11, 'num_epochs': 50}. 
[I 2024-09-26 07:36:30,962] Trial 17 finished with values: [4.0, 11.356204057060046, 0.0, 4.0, 7.091387033166821, 0.0, 3.0, 21.877929260534874, 0.5] and parameters: {'seq_len': 2, 'lr': 0.013741025124758137, 'pred_len': 11, 'num_epochs': 50}. 
[I 2024-09-26 07:36:35,402] Trial 18 finished with values: [4.0, 79782.50528703573, 0.0, 1.0, 371.95248475956964, 0.0, 1.0, 329.53721360388704, 1.0] and parameters: {'seq_len': 21, 'lr': 0.018657775148404363, 'pred_len': 20, 'num_epochs': 50}. 
[I 2024-09-26 07:36:41,063] Trial 19 finished with values: [2.0, 11.831143430478036, 0.3333333333333333, 1.0, 10.627108409620302, 0.3333333333333333, 3.0, 26.761587554605043, 0.0] and parameters: {'seq_len': 13, 'lr': 2.1846288420627957e-05, 'pred_len': 18, 'num_epochs': 100}. 
[I 2024-09-26 07:36:53,071] Trial 20 finished with values: [4.0, 12.288831947770323, 0.0, 3.0, 7.076833222456093, 0.0, 1.0, 32.727771141106615, 0.0] and parameters: {'seq_len': 15, 'lr': 2.3784570113364153e-05, 'pred_len': 13, 'num_epochs': 300}. 
[I 2024-09-26 07:36:59,198] Trial 21 finished with values: [4.0, 12.007419080992959, 0.3333333333333333, 5.0, 7.525495803630455, 0.0, 3.0, 22.515528135540205, 0.5] and parameters: {'seq_len': 12, 'lr': 0.035563507965262094, 'pred_len': 18, 'num_epochs': 100}. 
