[I 2024-09-26 20:17:12,645] Trial 21 finished with values: [1.0, 1.1290427488295849, 0.2, 1.0, 1.106576433290066, 0.9, 1.0, 1.321739972751202, 0.6666666666666666] and parameters: {'h': 3, 'encoder_hidden_size': 200, 'encoder_n_layers': 1, 'context_size': 5, 'decoder_hidden_size': 512, 'learning_rate': 0.008835615764205926, 'max_steps': 500, 'batch_size': 16, 'random_seed': 1}. 
SLURM auto-requeueing enabled. Setting signal handlers.
SLURM auto-requeueing enabled. Setting signal handlers.
SLURM auto-requeueing enabled. Setting signal handlers.
SLURM auto-requeueing enabled. Setting signal handlers.
SLURM auto-requeueing enabled. Setting signal handlers.
SLURM auto-requeueing enabled. Setting signal handlers.
SLURM auto-requeueing enabled. Setting signal handlers.
SLURM auto-requeueing enabled. Setting signal handlers.
SLURM auto-requeueing enabled. Setting signal handlers.
SLURM auto-requeueing enabled. Setting signal handlers.
SLURM auto-requeueing enabled. Setting signal handlers.
SLURM auto-requeueing enabled. Setting signal handlers.
SLURM auto-requeueing enabled. Setting signal handlers.
SLURM auto-requeueing enabled. Setting signal handlers.
SLURM auto-requeueing enabled. Setting signal handlers.
SLURM auto-requeueing enabled. Setting signal handlers.
SLURM auto-requeueing enabled. Setting signal handlers.
SLURM auto-requeueing enabled. Setting signal handlers.
SLURM auto-requeueing enabled. Setting signal handlers.
SLURM auto-requeueing enabled. Setting signal handlers.
SLURM auto-requeueing enabled. Setting signal handlers.
SLURM auto-requeueing enabled. Setting signal handlers.
SLURM auto-requeueing enabled. Setting signal handlers.
SLURM auto-requeueing enabled. Setting signal handlers.
SLURM auto-requeueing enabled. Setting signal handlers.
SLURM auto-requeueing enabled. Setting signal handlers.
SLURM auto-requeueing enabled. Setting signal handlers.
SLURM auto-requeueing enabled. Setting signal handlers.
SLURM auto-requeueing enabled. Setting signal handlers.
SLURM auto-requeueing enabled. Setting signal handlers.
SLURM auto-requeueing enabled. Setting signal handlers.
SLURM auto-requeueing enabled. Setting signal handlers.
SLURM auto-requeueing enabled. Setting signal handlers.
SLURM auto-requeueing enabled. Setting signal handlers.
SLURM auto-requeueing enabled. Setting signal handlers.
SLURM auto-requeueing enabled. Setting signal handlers.
SLURM auto-requeueing enabled. Setting signal handlers.
SLURM auto-requeueing enabled. Setting signal handlers.
SLURM auto-requeueing enabled. Setting signal handlers.
SLURM auto-requeueing enabled. Setting signal handlers.
SLURM auto-requeueing enabled. Setting signal handlers.
SLURM auto-requeueing enabled. Setting signal handlers.
SLURM auto-requeueing enabled. Setting signal handlers.
SLURM auto-requeueing enabled. Setting signal handlers.
SLURM auto-requeueing enabled. Setting signal handlers.
SLURM auto-requeueing enabled. Setting signal handlers.
SLURM auto-requeueing enabled. Setting signal handlers.
SLURM auto-requeueing enabled. Setting signal handlers.
SLURM auto-requeueing enabled. Setting signal handlers.
SLURM auto-requeueing enabled. Setting signal handlers.
SLURM auto-requeueing enabled. Setting signal handlers.
SLURM auto-requeueing enabled. Setting signal handlers.
SLURM auto-requeueing enabled. Setting signal handlers.
SLURM auto-requeueing enabled. Setting signal handlers.
SLURM auto-requeueing enabled. Setting signal handlers.
SLURM auto-requeueing enabled. Setting signal handlers.
SLURM auto-requeueing enabled. Setting signal handlers.
SLURM auto-requeueing enabled. Setting signal handlers.
SLURM auto-requeueing enabled. Setting signal handlers.
SLURM auto-requeueing enabled. Setting signal handlers.
SLURM auto-requeueing enabled. Setting signal handlers.
SLURM auto-requeueing enabled. Setting signal handlers.
SLURM auto-requeueing enabled. Setting signal handlers.
SLURM auto-requeueing enabled. Setting signal handlers.
SLURM auto-requeueing enabled. Setting signal handlers.
SLURM auto-requeueing enabled. Setting signal handlers.
SLURM auto-requeueing enabled. Setting signal handlers.
SLURM auto-requeueing enabled. Setting signal handlers.
SLURM auto-requeueing enabled. Setting signal handlers.
SLURM auto-requeueing enabled. Setting signal handlers.
SLURM auto-requeueing enabled. Setting signal handlers.
SLURM auto-requeueing enabled. Setting signal handlers.
SLURM auto-requeueing enabled. Setting signal handlers.
SLURM auto-requeueing enabled. Setting signal handlers.
SLURM auto-requeueing enabled. Setting signal handlers.
SLURM auto-requeueing enabled. Setting signal handlers.
SLURM auto-requeueing enabled. Setting signal handlers.
SLURM auto-requeueing enabled. Setting signal handlers.
SLURM auto-requeueing enabled. Setting signal handlers.
SLURM auto-requeueing enabled. Setting signal handlers.
SLURM auto-requeueing enabled. Setting signal handlers.
SLURM auto-requeueing enabled. Setting signal handlers.
SLURM auto-requeueing enabled. Setting signal handlers.
SLURM auto-requeueing enabled. Setting signal handlers.
SLURM auto-requeueing enabled. Setting signal handlers.
SLURM auto-requeueing enabled. Setting signal handlers.
SLURM auto-requeueing enabled. Setting signal handlers.
SLURM auto-requeueing enabled. Setting signal handlers.
SLURM auto-requeueing enabled. Setting signal handlers.
SLURM auto-requeueing enabled. Setting signal handlers.
SLURM auto-requeueing enabled. Setting signal handlers.
SLURM auto-requeueing enabled. Setting signal handlers.
SLURM auto-requeueing enabled. Setting signal handlers.
SLURM auto-requeueing enabled. Setting signal handlers.
SLURM auto-requeueing enabled. Setting signal handlers.
SLURM auto-requeueing enabled. Setting signal handlers.
SLURM auto-requeueing enabled. Setting signal handlers.
SLURM auto-requeueing enabled. Setting signal handlers.
SLURM auto-requeueing enabled. Setting signal handlers.
SLURM auto-requeueing enabled. Setting signal handlers.
SLURM auto-requeueing enabled. Setting signal handlers.
SLURM auto-requeueing enabled. Setting signal handlers.
SLURM auto-requeueing enabled. Setting signal handlers.
SLURM auto-requeueing enabled. Setting signal handlers.
SLURM auto-requeueing enabled. Setting signal handlers.
SLURM auto-requeueing enabled. Setting signal handlers.
SLURM auto-requeueing enabled. Setting signal handlers.
SLURM auto-requeueing enabled. Setting signal handlers.
SLURM auto-requeueing enabled. Setting signal handlers.
SLURM auto-requeueing enabled. Setting signal handlers.
SLURM auto-requeueing enabled. Setting signal handlers.
SLURM auto-requeueing enabled. Setting signal handlers.
SLURM auto-requeueing enabled. Setting signal handlers.
SLURM auto-requeueing enabled. Setting signal handlers.
SLURM auto-requeueing enabled. Setting signal handlers.
SLURM auto-requeueing enabled. Setting signal handlers.
SLURM auto-requeueing enabled. Setting signal handlers.
SLURM auto-requeueing enabled. Setting signal handlers.
SLURM auto-requeueing enabled. Setting signal handlers.
SLURM auto-requeueing enabled. Setting signal handlers.
SLURM auto-requeueing enabled. Setting signal handlers.
SLURM auto-requeueing enabled. Setting signal handlers.
SLURM auto-requeueing enabled. Setting signal handlers.
SLURM auto-requeueing enabled. Setting signal handlers.
SLURM auto-requeueing enabled. Setting signal handlers.
SLURM auto-requeueing enabled. Setting signal handlers.
SLURM auto-requeueing enabled. Setting signal handlers.
[I 2024-09-26 20:18:23,656] Trial 22 finished with values: [1.0, 1.6240710880804945, 0.0, 1.0, 1.200148768843523, 1.0, 1.0, 1.596209622007847, 0.6666666666666666] and parameters: {'h': 2, 'encoder_hidden_size': 50, 'encoder_n_layers': 3, 'context_size': 50, 'decoder_hidden_size': 128, 'learning_rate': 0.0017347604753282454, 'max_steps': 1000, 'batch_size': 16, 'random_seed': 17}. 
SLURM auto-requeueing enabled. Setting signal handlers.
SLURM auto-requeueing enabled. Setting signal handlers.
SLURM auto-requeueing enabled. Setting signal handlers.
SLURM auto-requeueing enabled. Setting signal handlers.
SLURM auto-requeueing enabled. Setting signal handlers.
SLURM auto-requeueing enabled. Setting signal handlers.
SLURM auto-requeueing enabled. Setting signal handlers.
SLURM auto-requeueing enabled. Setting signal handlers.
SLURM auto-requeueing enabled. Setting signal handlers.
SLURM auto-requeueing enabled. Setting signal handlers.
SLURM auto-requeueing enabled. Setting signal handlers.
SLURM auto-requeueing enabled. Setting signal handlers.
SLURM auto-requeueing enabled. Setting signal handlers.
SLURM auto-requeueing enabled. Setting signal handlers.
SLURM auto-requeueing enabled. Setting signal handlers.
SLURM auto-requeueing enabled. Setting signal handlers.
SLURM auto-requeueing enabled. Setting signal handlers.
SLURM auto-requeueing enabled. Setting signal handlers.
SLURM auto-requeueing enabled. Setting signal handlers.
SLURM auto-requeueing enabled. Setting signal handlers.
SLURM auto-requeueing enabled. Setting signal handlers.
SLURM auto-requeueing enabled. Setting signal handlers.
SLURM auto-requeueing enabled. Setting signal handlers.
SLURM auto-requeueing enabled. Setting signal handlers.
SLURM auto-requeueing enabled. Setting signal handlers.
SLURM auto-requeueing enabled. Setting signal handlers.
SLURM auto-requeueing enabled. Setting signal handlers.
SLURM auto-requeueing enabled. Setting signal handlers.
SLURM auto-requeueing enabled. Setting signal handlers.
SLURM auto-requeueing enabled. Setting signal handlers.
SLURM auto-requeueing enabled. Setting signal handlers.
SLURM auto-requeueing enabled. Setting signal handlers.
SLURM auto-requeueing enabled. Setting signal handlers.
SLURM auto-requeueing enabled. Setting signal handlers.
SLURM auto-requeueing enabled. Setting signal handlers.
SLURM auto-requeueing enabled. Setting signal handlers.
SLURM auto-requeueing enabled. Setting signal handlers.
SLURM auto-requeueing enabled. Setting signal handlers.
SLURM auto-requeueing enabled. Setting signal handlers.
SLURM auto-requeueing enabled. Setting signal handlers.
SLURM auto-requeueing enabled. Setting signal handlers.
SLURM auto-requeueing enabled. Setting signal handlers.
SLURM auto-requeueing enabled. Setting signal handlers.
SLURM auto-requeueing enabled. Setting signal handlers.
SLURM auto-requeueing enabled. Setting signal handlers.
[I 2024-09-26 20:20:11,680] Trial 23 finished with values: [1.0, 1.074095007118449, 0.2, 1.0, 1.224204046754926, 0.9, 1.0, 1.5113383686154913, 0.7777777777777778] and parameters: {'h': 6, 'encoder_hidden_size': 50, 'encoder_n_layers': 3, 'context_size': 5, 'decoder_hidden_size': 512, 'learning_rate': 0.0022027623005452983, 'max_steps': 1000, 'batch_size': 32, 'random_seed': 1}. 
SLURM auto-requeueing enabled. Setting signal handlers.
SLURM auto-requeueing enabled. Setting signal handlers.
SLURM auto-requeueing enabled. Setting signal handlers.
SLURM auto-requeueing enabled. Setting signal handlers.
SLURM auto-requeueing enabled. Setting signal handlers.
SLURM auto-requeueing enabled. Setting signal handlers.
SLURM auto-requeueing enabled. Setting signal handlers.
SLURM auto-requeueing enabled. Setting signal handlers.
SLURM auto-requeueing enabled. Setting signal handlers.
SLURM auto-requeueing enabled. Setting signal handlers.
SLURM auto-requeueing enabled. Setting signal handlers.
SLURM auto-requeueing enabled. Setting signal handlers.
SLURM auto-requeueing enabled. Setting signal handlers.
SLURM auto-requeueing enabled. Setting signal handlers.
SLURM auto-requeueing enabled. Setting signal handlers.
SLURM auto-requeueing enabled. Setting signal handlers.
SLURM auto-requeueing enabled. Setting signal handlers.
SLURM auto-requeueing enabled. Setting signal handlers.
SLURM auto-requeueing enabled. Setting signal handlers.
SLURM auto-requeueing enabled. Setting signal handlers.
SLURM auto-requeueing enabled. Setting signal handlers.
SLURM auto-requeueing enabled. Setting signal handlers.
SLURM auto-requeueing enabled. Setting signal handlers.
SLURM auto-requeueing enabled. Setting signal handlers.
SLURM auto-requeueing enabled. Setting signal handlers.
SLURM auto-requeueing enabled. Setting signal handlers.
SLURM auto-requeueing enabled. Setting signal handlers.
[I 2024-09-26 20:21:37,795] Trial 24 finished with values: [1.0, 1.4378885371871235, 0.0, 1.0, 1.0057465662337388, 0.8, 1.0, 1.1114412758517136, 0.4444444444444444] and parameters: {'h': 10, 'encoder_hidden_size': 100, 'encoder_n_layers': 4, 'context_size': 10, 'decoder_hidden_size': 64, 'learning_rate': 0.0001023854792687314, 'max_steps': 500, 'batch_size': 32, 'random_seed': 4}. 
[I 2024-09-26 20:22:00,197] A new study created in memory with name: NHITS predicting coupled_logistic_map(sigma=0.20)
SLURM auto-requeueing enabled. Setting signal handlers.
SLURM auto-requeueing enabled. Setting signal handlers.
SLURM auto-requeueing enabled. Setting signal handlers.
SLURM auto-requeueing enabled. Setting signal handlers.
SLURM auto-requeueing enabled. Setting signal handlers.
SLURM auto-requeueing enabled. Setting signal handlers.
SLURM auto-requeueing enabled. Setting signal handlers.
SLURM auto-requeueing enabled. Setting signal handlers.
SLURM auto-requeueing enabled. Setting signal handlers.
SLURM auto-requeueing enabled. Setting signal handlers.
SLURM auto-requeueing enabled. Setting signal handlers.
SLURM auto-requeueing enabled. Setting signal handlers.
SLURM auto-requeueing enabled. Setting signal handlers.
SLURM auto-requeueing enabled. Setting signal handlers.
SLURM auto-requeueing enabled. Setting signal handlers.
SLURM auto-requeueing enabled. Setting signal handlers.
SLURM auto-requeueing enabled. Setting signal handlers.
SLURM auto-requeueing enabled. Setting signal handlers.
SLURM auto-requeueing enabled. Setting signal handlers.
SLURM auto-requeueing enabled. Setting signal handlers.
