[I 2024-09-26 10:54:50,773] Trial 21 finished with values: [5.0, 12.834149030474384, 0.0, 2.0, 9.44803395662932, 0.6666666666666666, 2.0, 26.926533940586417, 0.5] and parameters: {'h': 10, 'n_pool_kernel_size': [16, 8, 1], 'n_freq_downsample': [24, 12, 1], 'learning_rate': 0.0004119669011692373, 'scaler_type': None, 'max_steps': 1300.0, 'batch_size': 32, 'windows_batch_size': 1024, 'random_seed': 18}. 
SLURM auto-requeueing enabled. Setting signal handlers.
SLURM auto-requeueing enabled. Setting signal handlers.
SLURM auto-requeueing enabled. Setting signal handlers.
SLURM auto-requeueing enabled. Setting signal handlers.
SLURM auto-requeueing enabled. Setting signal handlers.
SLURM auto-requeueing enabled. Setting signal handlers.
SLURM auto-requeueing enabled. Setting signal handlers.
SLURM auto-requeueing enabled. Setting signal handlers.
SLURM auto-requeueing enabled. Setting signal handlers.
SLURM auto-requeueing enabled. Setting signal handlers.
SLURM auto-requeueing enabled. Setting signal handlers.
SLURM auto-requeueing enabled. Setting signal handlers.
SLURM auto-requeueing enabled. Setting signal handlers.
SLURM auto-requeueing enabled. Setting signal handlers.
SLURM auto-requeueing enabled. Setting signal handlers.
SLURM auto-requeueing enabled. Setting signal handlers.
SLURM auto-requeueing enabled. Setting signal handlers.
SLURM auto-requeueing enabled. Setting signal handlers.
SLURM auto-requeueing enabled. Setting signal handlers.
SLURM auto-requeueing enabled. Setting signal handlers.
SLURM auto-requeueing enabled. Setting signal handlers.
SLURM auto-requeueing enabled. Setting signal handlers.
SLURM auto-requeueing enabled. Setting signal handlers.
SLURM auto-requeueing enabled. Setting signal handlers.
SLURM auto-requeueing enabled. Setting signal handlers.
SLURM auto-requeueing enabled. Setting signal handlers.
SLURM auto-requeueing enabled. Setting signal handlers.
[I 2024-09-26 10:56:42,261] Trial 22 finished with values: [5.0, 13.855737881177273, 0.3333333333333333, 20.0, 8.514734945283307, 0.3333333333333333, 2.0, 36.79524308528673, 1.0] and parameters: {'h': 10, 'n_pool_kernel_size': [16, 8, 1], 'n_freq_downsample': [40, 20, 1], 'learning_rate': 0.006652704207771862, 'scaler_type': None, 'max_steps': 900.0, 'batch_size': 64, 'windows_batch_size': 128, 'random_seed': 20}. 
SLURM auto-requeueing enabled. Setting signal handlers.
SLURM auto-requeueing enabled. Setting signal handlers.
SLURM auto-requeueing enabled. Setting signal handlers.
SLURM auto-requeueing enabled. Setting signal handlers.
SLURM auto-requeueing enabled. Setting signal handlers.
SLURM auto-requeueing enabled. Setting signal handlers.
SLURM auto-requeueing enabled. Setting signal handlers.
SLURM auto-requeueing enabled. Setting signal handlers.
SLURM auto-requeueing enabled. Setting signal handlers.
SLURM auto-requeueing enabled. Setting signal handlers.
SLURM auto-requeueing enabled. Setting signal handlers.
SLURM auto-requeueing enabled. Setting signal handlers.
SLURM auto-requeueing enabled. Setting signal handlers.
SLURM auto-requeueing enabled. Setting signal handlers.
SLURM auto-requeueing enabled. Setting signal handlers.
SLURM auto-requeueing enabled. Setting signal handlers.
SLURM auto-requeueing enabled. Setting signal handlers.
SLURM auto-requeueing enabled. Setting signal handlers.
SLURM auto-requeueing enabled. Setting signal handlers.
SLURM auto-requeueing enabled. Setting signal handlers.
SLURM auto-requeueing enabled. Setting signal handlers.
SLURM auto-requeueing enabled. Setting signal handlers.
SLURM auto-requeueing enabled. Setting signal handlers.
SLURM auto-requeueing enabled. Setting signal handlers.
SLURM auto-requeueing enabled. Setting signal handlers.
SLURM auto-requeueing enabled. Setting signal handlers.
SLURM auto-requeueing enabled. Setting signal handlers.
SLURM auto-requeueing enabled. Setting signal handlers.
SLURM auto-requeueing enabled. Setting signal handlers.
SLURM auto-requeueing enabled. Setting signal handlers.
SLURM auto-requeueing enabled. Setting signal handlers.
SLURM auto-requeueing enabled. Setting signal handlers.
SLURM auto-requeueing enabled. Setting signal handlers.
SLURM auto-requeueing enabled. Setting signal handlers.
SLURM auto-requeueing enabled. Setting signal handlers.
[I 2024-09-26 11:03:16,295] Trial 23 finished with values: [1.0, 33.43818215629082, 0.0, 7.0, 6.333421877076173, 0.3333333333333333, 2.0, 35.787793296560295, 0.0] and parameters: {'h': 8, 'n_pool_kernel_size': [16, 8, 1], 'n_freq_downsample': [40, 20, 1], 'learning_rate': 0.0017986594274451086, 'scaler_type': 'standard', 'max_steps': 800.0, 'batch_size': 32, 'windows_batch_size': 1024, 'random_seed': 3}. 
SLURM auto-requeueing enabled. Setting signal handlers.
SLURM auto-requeueing enabled. Setting signal handlers.
SLURM auto-requeueing enabled. Setting signal handlers.
SLURM auto-requeueing enabled. Setting signal handlers.
SLURM auto-requeueing enabled. Setting signal handlers.
SLURM auto-requeueing enabled. Setting signal handlers.
SLURM auto-requeueing enabled. Setting signal handlers.
SLURM auto-requeueing enabled. Setting signal handlers.
SLURM auto-requeueing enabled. Setting signal handlers.
SLURM auto-requeueing enabled. Setting signal handlers.
SLURM auto-requeueing enabled. Setting signal handlers.
SLURM auto-requeueing enabled. Setting signal handlers.
SLURM auto-requeueing enabled. Setting signal handlers.
SLURM auto-requeueing enabled. Setting signal handlers.
SLURM auto-requeueing enabled. Setting signal handlers.
SLURM auto-requeueing enabled. Setting signal handlers.
SLURM auto-requeueing enabled. Setting signal handlers.
SLURM auto-requeueing enabled. Setting signal handlers.
SLURM auto-requeueing enabled. Setting signal handlers.
SLURM auto-requeueing enabled. Setting signal handlers.
SLURM auto-requeueing enabled. Setting signal handlers.
SLURM auto-requeueing enabled. Setting signal handlers.
SLURM auto-requeueing enabled. Setting signal handlers.
SLURM auto-requeueing enabled. Setting signal handlers.
SLURM auto-requeueing enabled. Setting signal handlers.
SLURM auto-requeueing enabled. Setting signal handlers.
SLURM auto-requeueing enabled. Setting signal handlers.
SLURM auto-requeueing enabled. Setting signal handlers.
SLURM auto-requeueing enabled. Setting signal handlers.
SLURM auto-requeueing enabled. Setting signal handlers.
SLURM auto-requeueing enabled. Setting signal handlers.
SLURM auto-requeueing enabled. Setting signal handlers.
SLURM auto-requeueing enabled. Setting signal handlers.
SLURM auto-requeueing enabled. Setting signal handlers.
SLURM auto-requeueing enabled. Setting signal handlers.
SLURM auto-requeueing enabled. Setting signal handlers.
SLURM auto-requeueing enabled. Setting signal handlers.
SLURM auto-requeueing enabled. Setting signal handlers.
SLURM auto-requeueing enabled. Setting signal handlers.
SLURM auto-requeueing enabled. Setting signal handlers.
SLURM auto-requeueing enabled. Setting signal handlers.
SLURM auto-requeueing enabled. Setting signal handlers.
SLURM auto-requeueing enabled. Setting signal handlers.
SLURM auto-requeueing enabled. Setting signal handlers.
SLURM auto-requeueing enabled. Setting signal handlers.
[I 2024-09-26 11:08:04,568] Trial 24 finished with values: [1.0, 10501860.857584877, 0.0, 7.0, 6.216101088162706, 0.3333333333333333, 1.0, 2071491909.6219249, 0.0] and parameters: {'h': 6, 'n_pool_kernel_size': [4, 4, 4], 'n_freq_downsample': [1, 1, 1], 'learning_rate': 0.03298021838068847, 'scaler_type': 'robust', 'max_steps': 1500.0, 'batch_size': 256, 'windows_batch_size': 256, 'random_seed': 1}. 
[I 2024-09-26 11:08:14,625] A new study created in memory with name: ResComp predicting Belozyorov3DQuad(sigma=0.10)
/nas/longleaf/home/djpassey/.local/lib/python3.9/site-packages/scipy/integrate/_odepack_py.py:248: ODEintWarning: Excess work done on this call (perhaps wrong Dfun type). Run with full_output = 1 to get quantitative information.
  warnings.warn(warning_msg, ODEintWarning)
[I 2024-09-26 11:08:16,832] Trial 0 finished with values: [2.0, 5068774530.309108, 0.0, 0.0, 11.276144940795357, 0.0, 0.0, 228.99401557784384, 0.0] and parameters: {'gamma': 272.38071004702306, 'sigma': 57.45023509707017, 'delta': 53.33501187435467, 'mean_degree': 2.0907063611646, 'res_sz': 96, 'window': 21.059207087150863, 'spect_rad': 19.440144171510696, 'ridge_alpha': 0.0005801773360130562}. 
[I 2024-09-26 11:08:19,720] Trial 1 finished with values: [1.0, 27.961948197345556, 0.0, 0.0, 3.7276609176846445, 0.0, 0.0, 10.636649186224062, 0.5] and parameters: {'gamma': 113.77731397787798, 'sigma': 23.36064874785937, 'delta': 55.55811273807083, 'mean_degree': 1.4246112954455212, 'res_sz': 68, 'window': 0.03504634455030552, 'spect_rad': 0.001537675241815729, 'ridge_alpha': 1.5405918274373558}. 
[I 2024-09-26 11:08:21,846] Trial 2 finished with values: [0.0, 29.229008109294114, 0.0, 0.0, 5.7563973462513705, 0.0, 0.0, 10.666526926107197, 0.5] and parameters: {'gamma': 51.92890364016876, 'sigma': 3.5069474449086924, 'delta': 12.237169185034515, 'mean_degree': 3.8528925946332375, 'res_sz': 12, 'window': 0.07316615602936263, 'spect_rad': 0.014361739413271391, 'ridge_alpha': 0.010457270112735437}. 
[I 2024-09-26 11:08:25,624] Trial 3 finished with values: [1.0, 30.49864726597725, 0.0, 3.0, 4.4063288160884255, 0.3333333333333333, 0.0, 14.810212205211867, 0.5] and parameters: {'gamma': 392.041329519486, 'sigma': 27.912531050587525, 'delta': 54.77738248808528, 'mean_degree': 1.550043438764691, 'res_sz': 30, 'window': 0.20841300029452456, 'spect_rad': 2.420556425801228, 'ridge_alpha': 0.001459347866529126}. 
[I 2024-09-26 11:08:29,040] Trial 4 finished with values: [2.0, 1338488091.5774424, 0.3333333333333333, 0.0, 3.6131119396099063, 0.6666666666666666, 0.0, 15.612038268312396, 0.5] and parameters: {'gamma': 260.2734797085976, 'sigma': 12.444150674040282, 'delta': 72.3528910652113, 'mean_degree': 1.996672379104924, 'res_sz': 37, 'window': 35.7491383798691, 'spect_rad': 0.29443721183860627, 'ridge_alpha': 0.00016709936124140236}. 
/nas/longleaf/home/djpassey/.local/lib/python3.9/site-packages/interfere/methods/reservoir_computer.py:480: RuntimeWarning: overflow encountered in matmul
  pred = self.W_out_ @ states.T
/nas/longleaf/home/djpassey/.local/lib/python3.9/site-packages/interfere/methods/reservoir_computer.py:480: RuntimeWarning: invalid value encountered in matmul
  pred = self.W_out_ @ states.T
[I 2024-09-26 11:08:32,292] Trial 5 finished with values: [2.0, 5432801100.860772, 0.0, 0.0, 4.041378442846028, 0.0, 0.0, 2327.677085123503, 0.0] and parameters: {'gamma': 85.77100641384048, 'sigma': 32.83905259678786, 'delta': 55.865857247923365, 'mean_degree': 1.0046843159146441, 'res_sz': 70, 'window': 0.0025742062823191983, 'spect_rad': 4.046457193325998, 'ridge_alpha': 5.072708233230486e-08}. 
[I 2024-09-26 11:08:36,238] Trial 6 finished with values: [2.0, 5332011963.419432, 0.0, 0.0, 4.422182201100789, 0.6666666666666666, 0.0, 10.876944118412156, 1.0] and parameters: {'gamma': 333.75521069704575, 'sigma': 49.650870952376906, 'delta': 55.444661356788764, 'mean_degree': 4.729534009012055, 'res_sz': 46, 'window': 24.31712732207288, 'spect_rad': 0.005134746972274704, 'ridge_alpha': 0.0003408565296214797}. 
[I 2024-09-26 11:08:40,693] Trial 7 finished with values: [1.0, 25.470208495793795, 0.0, 0.0, 3.6423842767541035, 0.0, 0.0, 13.347456484098794, 0.5] and parameters: {'gamma': 415.79934507237095, 'sigma': 55.920389448654, 'delta': 75.87553797145051, 'mean_degree': 0.5328275002902741, 'res_sz': 38, 'window': 2.1257292661005254, 'spect_rad': 0.7257507837299642, 'ridge_alpha': 1.6271268501102111e-10}. 
[I 2024-09-26 11:08:42,859] Trial 8 finished with values: [1.0, 7.986667471079037, 0.0, 0.0, 4.535608732650097, 1.0, 0.0, 23.804561554089982, 1.0] and parameters: {'gamma': 133.67974957171725, 'sigma': 73.08612345451965, 'delta': 82.96158000758628, 'mean_degree': 3.562356474373791, 'res_sz': 32, 'window': 3.704073827123639, 'spect_rad': 0.0013995227558415621, 'ridge_alpha': 0.00030388973229344887}. 
[I 2024-09-26 11:08:47,825] Trial 9 finished with values: [1.0, 5395689726.898464, 0.0, 0.0, 4.6189716389317015, 0.6666666666666666, 1.0, 116.23088715956385, 1.0] and parameters: {'gamma': 434.65476263072884, 'sigma': 58.46719801739201, 'delta': 89.26330232559131, 'mean_degree': 1.7868473907060247, 'res_sz': 56, 'window': 0.012593217608506905, 'spect_rad': 35.57725414061599, 'ridge_alpha': 0.0012824386722814802}. 
[I 2024-09-26 11:08:51,438] Trial 10 finished with values: [3.0, 12.761543415489653, 0.0, 0.0, 11.27841998209354, 0.0, 0.0, 9.924146447722004, 1.0] and parameters: {'gamma': 358.7380650781136, 'sigma': 96.00838357360887, 'delta': 56.41464169470497, 'mean_degree': 2.061027196686436, 'res_sz': 51, 'window': 30.586831308933878, 'spect_rad': 0.5479667022062035, 'ridge_alpha': 11.854394853039851}. 
[I 2024-09-26 11:08:55,340] Trial 11 finished with values: [1.0, 24.23736729973732, 0.0, 0.0, 3.6191792944148093, 0.0, 0.0, 26.662688394044896, 0.0] and parameters: {'gamma': 410.1291208676772, 'sigma': 77.75418842625548, 'delta': 36.19061257399995, 'mean_degree': 3.826607118679395, 'res_sz': 83, 'window': 0.0010781813632117884, 'spect_rad': 5.471948911757468, 'ridge_alpha': 0.370211950239897}. 
[I 2024-09-26 11:08:57,731] Trial 12 finished with values: [1.0, 14.45777296003669, 0.0, 0.0, 3.8184470419700447, 0.0, 0.0, 20.358171971962108, 0.0] and parameters: {'gamma': 133.77990241418635, 'sigma': 79.31028344068767, 'delta': 31.3769518918978, 'mean_degree': 3.5579373649623682, 'res_sz': 12, 'window': 0.1749262493299753, 'spect_rad': 0.00592512067021916, 'ridge_alpha': 2.9579053570598665e-06}. 
[I 2024-09-26 11:09:00,543] Trial 13 finished with values: [0.0, 25.466864985146664, 0.0, 0.0, 7.2437978425286635, 0.0, 3.0, 21.927558512986714, 0.0] and parameters: {'gamma': 226.61634365731857, 'sigma': 7.766932476669162, 'delta': 99.88455955496866, 'mean_degree': 4.338640036351875, 'res_sz': 54, 'window': 0.023191529605392055, 'spect_rad': 0.03852985450539653, 'ridge_alpha': 53.55897480514267}. 
[I 2024-09-26 11:09:03,845] Trial 14 finished with values: [1.0, 5366245104.249767, 0.0, 2.0, 3.565738051854287, 0.0, 1.0, 25.445830828836627, 1.0] and parameters: {'gamma': 120.66118167333886, 'sigma': 15.082043365058075, 'delta': 1.3067011627926175, 'mean_degree': 0.43287026625075087, 'res_sz': 80, 'window': 0.39264724786029837, 'spect_rad': 0.10017865573125426, 'ridge_alpha': 6.207299651353543e-09}. 
[I 2024-09-26 11:09:05,869] Trial 15 finished with values: [1.0, 18.81890100386786, 0.0, 0.0, 9.583105294835615, 0.3333333333333333, 0.0, 30.950050459667825, 0.0] and parameters: {'gamma': 320.0521539666428, 'sigma': 98.7195547041339, 'delta': 96.23853462230312, 'mean_degree': 3.961858354868423, 'res_sz': 99, 'window': 25.870475771270787, 'spect_rad': 0.03931809690730046, 'ridge_alpha': 0.03648366586942813}. 
[I 2024-09-26 11:09:09,421] Trial 16 finished with values: [0.0, 24.365889833035546, 0.0, 0.0, 4.595350812710077, 0.6666666666666666, 0.0, 12.193782648306493, 1.0] and parameters: {'gamma': 327.7162347327305, 'sigma': 51.240906857495176, 'delta': 26.81858650023341, 'mean_degree': 3.2472976405811207, 'res_sz': 65, 'window': 0.12833460907513097, 'spect_rad': 1.5641239127153506, 'ridge_alpha': 84.51853435010031}. 
[I 2024-09-26 11:09:12,314] Trial 17 finished with values: [0.0, 23.83328507996814, 0.0, 0.0, 4.211331289776628, 1.0, 0.0, 16.162514577565787, 0.5] and parameters: {'gamma': 207.7422093177143, 'sigma': 13.450626497167434, 'delta': 49.91257870811422, 'mean_degree': 1.0398992028654979, 'res_sz': 21, 'window': 2.076034083155155, 'spect_rad': 1.8763311093428188, 'ridge_alpha': 86.95613398263963}. 
[I 2024-09-26 11:09:16,754] Trial 18 finished with values: [0.0, 6.622256682607184, 0.3333333333333333, 0.0, 5.6031207176755204, 0.3333333333333333, 0.0, 14.049660376942269, 0.5] and parameters: {'gamma': 376.87172203889145, 'sigma': 17.18299040516308, 'delta': 38.25618949638229, 'mean_degree': 1.5075372327622878, 'res_sz': 44, 'window': 3.9491956658993277, 'spect_rad': 5.481199753227366, 'ridge_alpha': 7.549891374464931}. 
[I 2024-09-26 11:09:20,041] Trial 19 finished with values: [0.0, 22.666050072234206, 0.0, 0.0, 3.6948101251372796, 1.0, 0.0, 14.637661949091497, 0.0] and parameters: {'gamma': 439.5814077077889, 'sigma': 42.84502618708542, 'delta': 51.4337345836488, 'mean_degree': 2.5986245958480207, 'res_sz': 25, 'window': 0.06611671100862816, 'spect_rad': 8.13450823730425, 'ridge_alpha': 92.15499596190688}. 
[I 2024-09-26 11:09:23,342] Trial 20 finished with values: [1.0, 360.37530442967335, 0.0, 0.0, 4.519692559477635, 1.0, 0.0, 10.880905624298004, 1.0] and parameters: {'gamma': 407.28231156046496, 'sigma': 64.88308420498106, 'delta': 47.26280628027873, 'mean_degree': 2.7827672924015823, 'res_sz': 22, 'window': 1.3101491312308924, 'spect_rad': 3.690827651468771, 'ridge_alpha': 5.282680800933662e-10}. 
[I 2024-09-26 11:09:27,385] Trial 21 finished with values: [1.0, 37.46403505712381, 0.0, 0.0, 3.9022931727883248, 0.3333333333333333, 0.0, 2017.1228535863102, 1.0] and parameters: {'gamma': 244.92851399651911, 'sigma': 58.80109933049524, 'delta': 21.83329722933153, 'mean_degree': 4.132083761688709, 'res_sz': 76, 'window': 0.08733026736980617, 'spect_rad': 23.509442725807766, 'ridge_alpha': 1.247273803347593e-05}. 
[I 2024-09-26 11:09:30,284] Trial 22 finished with values: [1.0, 6.4755452954101065, 0.0, 6.0, 3.6928616032509773, 0.0, 1.0, 25.85911867269582, 0.0] and parameters: {'gamma': 215.72878891929398, 'sigma': 16.927287700935388, 'delta': 55.70629845157908, 'mean_degree': 1.8280791835790526, 'res_sz': 55, 'window': 0.07635871235409807, 'spect_rad': 0.014102276570587609, 'ridge_alpha': 0.00039597176030214596}. 
[I 2024-09-26 11:09:33,566] Trial 23 finished with values: [1.0, 717130675.6255561, 1.0, 0.0, 4.467446855382643, 0.3333333333333333, 0.0, 11.436618765899636, 0.5] and parameters: {'gamma': 303.76649043955274, 'sigma': 49.492068055281734, 'delta': 29.576376900189494, 'mean_degree': 0.4270365869297935, 'res_sz': 86, 'window': 0.004837120491196534, 'spect_rad': 0.5609017583667703, 'ridge_alpha': 0.0003840245718182969}. 
[I 2024-09-26 11:09:36,325] Trial 24 finished with values: [1.0, 11.598307895839909, 0.3333333333333333, 1.0, 9.809594377469848, 0.3333333333333333, 0.0, 25.308584055931664, 0.0] and parameters: {'gamma': 472.8811995445799, 'sigma': 2.3012183599237503, 'delta': 60.62195938523966, 'mean_degree': 3.0031034688297003, 'res_sz': 22, 'window': 0.047325188047422806, 'spect_rad': 0.020848144975262595, 'ridge_alpha': 0.1958911095228767}. 
[I 2024-09-26 11:09:49,921] A new study created in memory with name: SINDY predicting Belozyorov3DQuad(sigma=0.10)
[I 2024-09-26 11:09:52,419] Trial 0 finished with values: [4.0, 5.552452858585155, 1.0, 16.0, 8.025254587758276, 1.0, 6.0, 19.677345085684998, 1.0] and parameters: {'optimizer__threshold': 0.03251183561987783, 'optimizer__alpha': 1.1161241529069228e-05, 'discrete_time': False, 'feature_library': 0, 'differentiation_method': 0}. 
[I 2024-09-26 11:09:54,329] Trial 1 finished with values: [2.0, 21.081581685195452, 0.3333333333333333, 8.0, 5.960436186660707, 0.3333333333333333, 2.0, 162.290168478125, 0.5] and parameters: {'optimizer__threshold': 4.495528399910973, 'optimizer__alpha': 4.541135625584268e-05, 'discrete_time': False, 'feature_library': 1, 'differentiation_method': 6}. 
[I 2024-09-26 11:09:56,027] Trial 2 finished with values: [6.0, 7.645054232149743, 0.0, 4.0, 7.477084514790928, 0.0, 2.0, 27.33741466035377, 0.5] and parameters: {'optimizer__threshold': 0.0025305383048422874, 'optimizer__alpha': 0.19004415566441887, 'discrete_time': True, 'feature_library': 0, 'differentiation_method': 3}. 
[I 2024-09-26 11:09:58,143] Trial 3 finished with values: [2.0, 21.09252713180019, 0.3333333333333333, 8.0, 5.960241539436632, 0.3333333333333333, 2.0, 162.27544510364984, 0.5] and parameters: {'optimizer__threshold': 0.14594832535948551, 'optimizer__alpha': 0.03745220054072765, 'discrete_time': False, 'feature_library': 1, 'differentiation_method': 1}. 
[I 2024-09-26 11:09:59,803] Trial 4 finished with values: [6.0, 7.645054232149743, 0.0, 4.0, 7.477084514790928, 0.0, 2.0, 27.33741466035377, 0.5] and parameters: {'optimizer__threshold': 0.0003131899568880768, 'optimizer__alpha': 0.012913095848829985, 'discrete_time': True, 'feature_library': 0, 'differentiation_method': 1}. 
[I 2024-09-26 11:10:01,492] Trial 5 finished with values: [6.0, 7.645054232149743, 0.0, 4.0, 7.477084514790928, 0.0, 2.0, 27.33741466035377, 0.5] and parameters: {'optimizer__threshold': 0.7321857781711917, 'optimizer__alpha': 0.007002997111732046, 'discrete_time': True, 'feature_library': 0, 'differentiation_method': 1}. 
[I 2024-09-26 11:10:03,169] Trial 6 finished with values: [1.0, 15.012915342104787, 0.3333333333333333, 5.0, 13.143184180650557, 0.6666666666666666, 1.0, 18.508520603580703, 0.5] and parameters: {'optimizer__threshold': 1.583419698984487, 'optimizer__alpha': 0.43845621254044786, 'discrete_time': True, 'feature_library': 1, 'differentiation_method': 7}. 
[I 2024-09-26 11:10:05,165] Trial 7 finished with values: [1.0, 15.012915342104787, 0.3333333333333333, 5.0, 13.143184180650557, 0.6666666666666666, 1.0, 18.508520603580703, 0.5] and parameters: {'optimizer__threshold': 0.02556892706068319, 'optimizer__alpha': 0.7650799715957575, 'discrete_time': True, 'feature_library': 1, 'differentiation_method': 5}. 
[I 2024-09-26 11:10:06,842] Trial 8 finished with values: [6.0, 7.645054232149743, 0.0, 4.0, 7.477084514790928, 0.0, 2.0, 27.33741466035377, 0.5] and parameters: {'optimizer__threshold': 0.5480778566083497, 'optimizer__alpha': 2.8826076336937603e-05, 'discrete_time': True, 'feature_library': 0, 'differentiation_method': 1}. 
