[I 2024-09-26 03:43:11,204] Trial 21 finished with values: [1.0, 16.26274537346262, 0.3333333333333333, 4.0, 15.83890392975883, 0.6666666666666666, 1.0, 25.61496511634493, 0.5] and parameters: {'optimizer__threshold': 0.6164826807979815, 'optimizer__alpha': 0.04640322756809661, 'discrete_time': True, 'feature_library': 1, 'differentiation_method': 7}. 
[I 2024-09-26 03:43:13,003] Trial 22 finished with values: [1.0, 16.26274537346262, 0.3333333333333333, 4.0, 15.83890392975883, 0.6666666666666666, 1.0, 25.61496511634493, 0.5] and parameters: {'optimizer__threshold': 3.7473983777513653, 'optimizer__alpha': 0.0006138997197930239, 'discrete_time': True, 'feature_library': 1, 'differentiation_method': 1}. 
[I 2024-09-26 03:43:14,766] Trial 23 finished with values: [5.0, 8.0111390702494, 0.0, 6.0, 7.679947411813757, 0.0, 2.0, 32.08475493887923, 0.5] and parameters: {'optimizer__threshold': 0.7587894190224399, 'optimizer__alpha': 0.03432719480731945, 'discrete_time': True, 'feature_library': 0, 'differentiation_method': 5}. 
[I 2024-09-26 03:43:16,883] Trial 24 finished with values: [5.0, 8.0111390702494, 0.0, 6.0, 7.679947411813757, 0.0, 2.0, 32.08475493887923, 0.5] and parameters: {'optimizer__threshold': 0.10569164511126317, 'optimizer__alpha': 0.00032554643084549385, 'discrete_time': True, 'feature_library': 0, 'differentiation_method': 5}. 
[I 2024-09-26 03:43:24,499] A new study created in memory with name: LTSFLinearForecaster predicting coupled_logistic_map(sigma=0.10)
[I 2024-09-26 03:43:34,643] Trial 0 finished with values: [3.0, 0.8519714137251541, 0.9, 2.0, 0.8283727398254284, 1.0, 1.0, 1.2217725860283069, 0.7777777777777778] and parameters: {'seq_len': 10, 'lr': 0.0008441416698415113, 'pred_len': 18, 'num_epochs': 100}. 
[I 2024-09-26 03:43:53,093] Trial 1 finished with values: [1.0, 0.8713957183538212, 0.4, 3.0, 0.8566725195679002, 0.6, 1.0, 3.7929602626719614, 0.2222222222222222] and parameters: {'seq_len': 3, 'lr': 2.652898370196677e-05, 'pred_len': 10, 'num_epochs': 300}. 
[I 2024-09-26 03:44:11,087] Trial 2 finished with values: [1.0, 0.8512294365427006, 0.9, 1.0, 0.8273352024362642, 1.0, 1.0, 1.2333390690208732, 0.7777777777777778] and parameters: {'seq_len': 10, 'lr': 0.0011845348443077495, 'pred_len': 6, 'num_epochs': 300}. 
[I 2024-09-26 03:44:27,799] Trial 3 finished with values: [1.0, 0.8608487818206261, 0.9, 2.0, 0.8263495193110131, 1.0, 1.0, 1.2172578331006774, 0.7777777777777778] and parameters: {'seq_len': 10, 'lr': 0.0004109657821550639, 'pred_len': 22, 'num_epochs': 300}. 
[I 2024-09-26 03:44:37,563] Trial 4 finished with values: [1.0, 0.8675027589998189, 0.8, 1.0, 0.8303903640371856, 0.6, 1.0, 1.3179500337380579, 0.4444444444444444] and parameters: {'seq_len': 13, 'lr': 0.031052374936503434, 'pred_len': 19, 'num_epochs': 100}. 
[I 2024-09-26 03:44:47,749] Trial 5 finished with values: [1.0, 2.003998359845032, 0.0, 2.0, 0.8657859949836736, 0.7, 1.0, 1.2355986094353657, 0.7777777777777778] and parameters: {'seq_len': 17, 'lr': 0.0004869341930615475, 'pred_len': 8, 'num_epochs': 100}. 
[I 2024-09-26 03:44:56,153] Trial 6 finished with values: [1.0, 9.037007514193967, 0.0, 1.0, 1.0604346002099267, 0.3, 2.0, 2.236825778112514, 0.2222222222222222] and parameters: {'seq_len': 17, 'lr': 4.8445791978237136e-05, 'pred_len': 13, 'num_epochs': 50}. 
[I 2024-09-26 03:45:12,167] Trial 7 finished with values: [3.0, 0.8540482074460822, 0.9, 1.0, 0.8306872352126354, 1.0, 1.0, 1.2314723782296395, 0.7777777777777778] and parameters: {'seq_len': 23, 'lr': 0.0016677557405856088, 'pred_len': 9, 'num_epochs': 300}. 
[I 2024-09-26 03:45:29,233] Trial 8 finished with values: [1.0, 0.8659790945738235, 0.8, 1.0, 0.8293886308463013, 0.7, 1.0, 1.3051045099295253, 0.5555555555555556] and parameters: {'seq_len': 11, 'lr': 0.02133778702855798, 'pred_len': 12, 'num_epochs': 300}. 
[I 2024-09-26 03:45:39,420] Trial 9 finished with values: [1.0, 0.8513638761988389, 0.9, 2.0, 0.8279393194699072, 1.0, 1.0, 1.237423502659158, 0.7777777777777778] and parameters: {'seq_len': 4, 'lr': 0.00041489892153938535, 'pred_len': 20, 'num_epochs': 100}. 
[I 2024-09-26 03:45:49,777] Trial 10 finished with values: [1.0, 0.8781059458100348, 0.4, 2.0, 0.8398057148786665, 0.9, 1.0, 1.2313348070745305, 0.7777777777777778] and parameters: {'seq_len': 9, 'lr': 0.0012353526823836224, 'pred_len': 2, 'num_epochs': 100}. 
[I 2024-09-26 03:46:06,507] Trial 11 finished with values: [1.0, 0.8651145259065633, 0.9, 1.0, 0.8301526398671296, 0.7, 1.0, 1.3089224206935075, 0.4444444444444444] and parameters: {'seq_len': 18, 'lr': 0.019596154657499303, 'pred_len': 13, 'num_epochs': 300}. 
[I 2024-09-26 03:46:16,652] Trial 12 finished with values: [2.0, 0.8943786997976746, 0.1, 3.0, 0.8842306835943351, 0.2, 1.0, 1.1937284394693861, 0.4444444444444444] and parameters: {'seq_len': 3, 'lr': 0.000864880573022022, 'pred_len': 8, 'num_epochs': 100}. 
[I 2024-09-26 03:46:25,265] Trial 13 finished with values: [3.0, 0.8538460355723478, 0.9, 1.0, 0.8276737456494587, 1.0, 1.0, 1.2446035544942724, 0.7777777777777778] and parameters: {'seq_len': 6, 'lr': 0.0006431548978578182, 'pred_len': 16, 'num_epochs': 50}. 
[I 2024-09-26 03:46:42,273] Trial 14 finished with values: [3.0, 0.853111371043427, 0.9, 2.0, 0.8261577711244343, 1.0, 1.0, 1.2209966247608603, 0.7777777777777778] and parameters: {'seq_len': 15, 'lr': 0.0007371311620714286, 'pred_len': 8, 'num_epochs': 300}. 
[I 2024-09-26 03:46:50,952] Trial 15 finished with values: [1.0, 0.936099048603026, 0.1, 2.0, 0.8296715659908254, 0.9, 1.0, 1.221851264390641, 0.6666666666666666] and parameters: {'seq_len': 17, 'lr': 0.001232277776021727, 'pred_len': 14, 'num_epochs': 50}. 
[I 2024-09-26 03:47:07,256] Trial 16 finished with values: [1.0, 1.0343581040250616, 0.0, 2.0, 0.8363940809630835, 0.8, 1.0, 1.2227035706872247, 0.7777777777777778] and parameters: {'seq_len': 17, 'lr': 0.0002055404928142214, 'pred_len': 15, 'num_epochs': 300}. 
[I 2024-09-26 03:47:15,819] Trial 17 finished with values: [1.0, 3.44211169233008, 0.0, 1.0, 2.0250901923268114, 0.0, 1.0, 1.2230391931100555, 0.7777777777777778] and parameters: {'seq_len': 3, 'lr': 0.0008104111689695345, 'pred_len': 3, 'num_epochs': 50}. 
[I 2024-09-26 03:47:24,063] Trial 18 finished with values: [1.0, 2.1004775545141112, 0.0, 1.0, 1.9075166710765994, 0.0, 1.0, 1.3737509190259185, 0.2222222222222222] and parameters: {'seq_len': 16, 'lr': 5.061284289974716e-05, 'pred_len': 24, 'num_epochs': 50}. 
[I 2024-09-26 03:47:40,545] Trial 19 finished with values: [1.0, 0.8551834063277223, 0.9, 1.0, 0.839709219398428, 1.0, 1.0, 1.211288785739368, 0.7777777777777778] and parameters: {'seq_len': 21, 'lr': 0.004433616572420732, 'pred_len': 12, 'num_epochs': 300}. 
[I 2024-09-26 03:47:51,041] Trial 20 finished with values: [1.0, 0.8508860824452784, 0.9, 1.0, 0.8282434760324467, 1.0, 1.0, 1.234473543239118, 0.7777777777777778] and parameters: {'seq_len': 3, 'lr': 0.004811018685940306, 'pred_len': 13, 'num_epochs': 100}. 
[I 2024-09-26 03:48:07,852] Trial 21 finished with values: [3.0, 0.852214814719562, 0.9, 2.0, 0.8291245145270482, 1.0, 1.0, 1.2245233945764427, 0.7777777777777778] and parameters: {'seq_len': 17, 'lr': 0.00596266648405188, 'pred_len': 21, 'num_epochs': 300}. 
[I 2024-09-26 03:48:15,882] Trial 22 finished with values: [3.0, 0.8577678006625535, 0.9, 1.0, 0.8293625750931608, 0.9, 1.0, 1.2656200251223468, 0.6666666666666666] and parameters: {'seq_len': 24, 'lr': 0.017525515271156197, 'pred_len': 13, 'num_epochs': 50}. 
[I 2024-09-26 03:48:24,502] Trial 23 finished with values: [1.0, 0.8538849659872112, 0.9, 3.0, 0.8341628256504885, 1.0, 1.0, 1.2078476706221921, 0.3333333333333333] and parameters: {'seq_len': 5, 'lr': 0.0010838435860165293, 'pred_len': 18, 'num_epochs': 50}. 
[I 2024-09-26 03:48:34,894] Trial 24 finished with values: [1.0, 0.8517277714533231, 0.9, 1.0, 0.8296220762578768, 1.0, 1.0, 1.2198202966484972, 0.7777777777777778] and parameters: {'seq_len': 12, 'lr': 0.06818272695522538, 'pred_len': 6, 'num_epochs': 100}. 
[I 2024-09-26 03:48:47,189] A new study created in memory with name: VAR predicting coupled_logistic_map(sigma=0.10)
[I 2024-09-26 03:48:52,593] Trial 0 finished with values: [1.0, 0.833203865716491, 1.0, 2.0, 0.8207684846912761, 1.0, 1.0, 1.2087068020414202, 0.7777777777777778] and parameters: {'ic': 'aic', 'maxlags': 3, 'trend': 'c'}. 
[I 2024-09-26 03:48:57,987] Trial 1 finished with values: [1.0, 0.833203865716491, 1.0, 2.0, 0.8207684846912761, 1.0, 1.0, 1.2087068020414202, 0.7777777777777778] and parameters: {'ic': 'aic', 'maxlags': 3, 'trend': 'c'}. 
[I 2024-09-26 03:49:03,409] Trial 2 finished with values: [1.0, 1.716725632521767, 0.0, 2.0, 1.157207867006179, 0.0, 1.0, 1.4698265113111153, 0.0] and parameters: {'ic': 'aic', 'maxlags': 2, 'trend': 'n'}. 
[I 2024-09-26 03:49:08,849] Trial 3 finished with values: [1.0, 0.833203865716491, 1.0, 2.0, 0.8207684846912761, 1.0, 1.0, 1.2087068020414202, 0.7777777777777778] and parameters: {'ic': 'aic', 'maxlags': 2, 'trend': 'c'}. 
[I 2024-09-26 03:49:14,335] Trial 4 finished with values: [1.0, 1.716725632521767, 0.0, 2.0, 1.157207867006179, 0.0, 1.0, 1.4698265113111153, 0.0] and parameters: {'ic': 'aic', 'maxlags': 3, 'trend': 'n'}. 
[I 2024-09-26 03:49:19,753] Trial 5 finished with values: [1.0, 1.716725632521767, 0.0, 2.0, 1.157207867006179, 0.0, 1.0, 1.4698265113111153, 0.0] and parameters: {'ic': 'aic', 'maxlags': 1, 'trend': 'n'}. 
[I 2024-09-26 03:49:25,222] Trial 6 finished with values: [1.0, 0.833203865716491, 1.0, 2.0, 0.8207684846912761, 1.0, 1.0, 1.2087068020414202, 0.7777777777777778] and parameters: {'ic': 'fpe', 'maxlags': 5, 'trend': 'c'}. 
[I 2024-09-26 03:49:30,654] Trial 7 finished with values: [1.0, 0.833203865716491, 1.0, 2.0, 0.8207684846912761, 1.0, 1.0, 1.2087068020414202, 0.7777777777777778] and parameters: {'ic': 'fpe', 'maxlags': 3, 'trend': 'c'}. 
[I 2024-09-26 03:49:36,113] Trial 8 finished with values: [1.0, 0.833203865716491, 1.0, 2.0, 0.8207684846912761, 1.0, 1.0, 1.2087068020414202, 0.7777777777777778] and parameters: {'ic': 'fpe', 'maxlags': 3, 'trend': 'c'}. 
[I 2024-09-26 03:49:41,535] Trial 9 finished with values: [1.0, 1.4055727480701083, 0.0, 2.0, 0.8880207603287669, 0.4, 1.0, 1.2120202879411064, 0.4444444444444444] and parameters: {'ic': 'aic', 'maxlags': 4, 'trend': 'ctt'}. 
[I 2024-09-26 03:49:46,983] Trial 10 finished with values: [1.0, 0.833203865716491, 1.0, 2.0, 0.8207684846912761, 1.0, 1.0, 1.2087068020414202, 0.7777777777777778] and parameters: {'ic': 'fpe', 'maxlags': 5, 'trend': 'c'}. 
[I 2024-09-26 03:49:52,459] Trial 11 finished with values: [1.0, 0.8491224251078398, 0.8, 2.0, 0.8329518005683834, 0.9, 1.0, 1.209391190227226, 0.6666666666666666] and parameters: {'ic': 'fpe', 'maxlags': 5, 'trend': 'ct'}. 
[I 2024-09-26 03:49:57,933] Trial 12 finished with values: [1.0, 1.716725632521767, 0.0, 2.0, 1.157207867006179, 0.0, 1.0, 1.4698265113111153, 0.0] and parameters: {'ic': 'aic', 'maxlags': 4, 'trend': 'n'}. 
[I 2024-09-26 03:50:03,363] Trial 13 finished with values: [1.0, 0.833203865716491, 1.0, 2.0, 0.8207684846912761, 1.0, 1.0, 1.2087068020414202, 0.7777777777777778] and parameters: {'ic': 'fpe', 'maxlags': 3, 'trend': 'c'}. 
[I 2024-09-26 03:50:08,810] Trial 14 finished with values: [1.0, 1.716725632521767, 0.0, 2.0, 1.157207867006179, 0.0, 1.0, 1.4698265113111153, 0.0] and parameters: {'ic': 'fpe', 'maxlags': 2, 'trend': 'n'}. 
[I 2024-09-26 03:50:14,255] Trial 15 finished with values: [1.0, 0.8491224251078398, 0.8, 2.0, 0.8329518005683834, 0.9, 1.0, 1.209391190227226, 0.6666666666666666] and parameters: {'ic': 'aic', 'maxlags': 2, 'trend': 'ct'}. 
[I 2024-09-26 03:50:19,701] Trial 16 finished with values: [1.0, 0.833203865716491, 1.0, 2.0, 0.8207684846912761, 1.0, 1.0, 1.2087068020414202, 0.7777777777777778] and parameters: {'ic': 'fpe', 'maxlags': 4, 'trend': 'c'}. 
[I 2024-09-26 03:50:25,063] Trial 17 finished with values: [1.0, 1.4055727480701083, 0.0, 2.0, 0.8880207603287669, 0.4, 1.0, 1.2120202879411064, 0.4444444444444444] and parameters: {'ic': 'fpe', 'maxlags': 3, 'trend': 'ctt'}. 
[I 2024-09-26 03:50:30,456] Trial 18 finished with values: [1.0, 0.833203865716491, 1.0, 2.0, 0.8207684846912761, 1.0, 1.0, 1.2087068020414202, 0.7777777777777778] and parameters: {'ic': 'fpe', 'maxlags': 5, 'trend': 'c'}. 
[I 2024-09-26 03:50:35,850] Trial 19 finished with values: [1.0, 1.4055727480701083, 0.0, 2.0, 0.8880207603287669, 0.4, 1.0, 1.2120202879411064, 0.4444444444444444] and parameters: {'ic': 'fpe', 'maxlags': 3, 'trend': 'ctt'}. 
[I 2024-09-26 03:50:41,305] Trial 20 finished with values: [1.0, 0.833203865716491, 1.0, 2.0, 0.8207684846912761, 1.0, 1.0, 1.2087068020414202, 0.7777777777777778] and parameters: {'ic': 'fpe', 'maxlags': 2, 'trend': 'c'}. 
[I 2024-09-26 03:50:46,468] Trial 21 finished with values: [1.0, 1.716725632521767, 0.0, 2.0, 1.157207867006179, 0.0, 1.0, 1.4698265113111153, 0.0] and parameters: {'ic': 'fpe', 'maxlags': 5, 'trend': 'n'}. 
[I 2024-09-26 03:50:52,173] Trial 22 finished with values: [1.0, 0.833203865716491, 1.0, 2.0, 0.8207684846912761, 1.0, 1.0, 1.2087068020414202, 0.7777777777777778] and parameters: {'ic': 'aic', 'maxlags': 3, 'trend': 'c'}. 
[I 2024-09-26 03:50:57,797] Trial 23 finished with values: [1.0, 0.8491224251078398, 0.8, 2.0, 0.8329518005683834, 0.9, 1.0, 1.209391190227226, 0.6666666666666666] and parameters: {'ic': 'fpe', 'maxlags': 5, 'trend': 'ct'}. 
[I 2024-09-26 03:51:03,387] Trial 24 finished with values: [1.0, 0.8491224251078398, 0.8, 2.0, 0.8329518005683834, 0.9, 1.0, 1.209391190227226, 0.6666666666666666] and parameters: {'ic': 'fpe', 'maxlags': 1, 'trend': 'ct'}. 
[I 2024-09-26 03:51:13,053] A new study created in memory with name: LSTM predicting coupled_logistic_map(sigma=0.10)
SLURM auto-requeueing enabled. Setting signal handlers.
SLURM auto-requeueing enabled. Setting signal handlers.
SLURM auto-requeueing enabled. Setting signal handlers.
SLURM auto-requeueing enabled. Setting signal handlers.
SLURM auto-requeueing enabled. Setting signal handlers.
SLURM auto-requeueing enabled. Setting signal handlers.
SLURM auto-requeueing enabled. Setting signal handlers.
SLURM auto-requeueing enabled. Setting signal handlers.
SLURM auto-requeueing enabled. Setting signal handlers.
SLURM auto-requeueing enabled. Setting signal handlers.
SLURM auto-requeueing enabled. Setting signal handlers.
SLURM auto-requeueing enabled. Setting signal handlers.
SLURM auto-requeueing enabled. Setting signal handlers.
SLURM auto-requeueing enabled. Setting signal handlers.
SLURM auto-requeueing enabled. Setting signal handlers.
SLURM auto-requeueing enabled. Setting signal handlers.
SLURM auto-requeueing enabled. Setting signal handlers.
SLURM auto-requeueing enabled. Setting signal handlers.
SLURM auto-requeueing enabled. Setting signal handlers.
SLURM auto-requeueing enabled. Setting signal handlers.
SLURM auto-requeueing enabled. Setting signal handlers.
SLURM auto-requeueing enabled. Setting signal handlers.
SLURM auto-requeueing enabled. Setting signal handlers.
SLURM auto-requeueing enabled. Setting signal handlers.
SLURM auto-requeueing enabled. Setting signal handlers.
SLURM auto-requeueing enabled. Setting signal handlers.
SLURM auto-requeueing enabled. Setting signal handlers.
SLURM auto-requeueing enabled. Setting signal handlers.
SLURM auto-requeueing enabled. Setting signal handlers.
SLURM auto-requeueing enabled. Setting signal handlers.
SLURM auto-requeueing enabled. Setting signal handlers.
SLURM auto-requeueing enabled. Setting signal handlers.
SLURM auto-requeueing enabled. Setting signal handlers.
SLURM auto-requeueing enabled. Setting signal handlers.
SLURM auto-requeueing enabled. Setting signal handlers.
SLURM auto-requeueing enabled. Setting signal handlers.
SLURM auto-requeueing enabled. Setting signal handlers.
SLURM auto-requeueing enabled. Setting signal handlers.
SLURM auto-requeueing enabled. Setting signal handlers.
SLURM auto-requeueing enabled. Setting signal handlers.
SLURM auto-requeueing enabled. Setting signal handlers.
SLURM auto-requeueing enabled. Setting signal handlers.
SLURM auto-requeueing enabled. Setting signal handlers.
SLURM auto-requeueing enabled. Setting signal handlers.
SLURM auto-requeueing enabled. Setting signal handlers.
SLURM auto-requeueing enabled. Setting signal handlers.
SLURM auto-requeueing enabled. Setting signal handlers.
SLURM auto-requeueing enabled. Setting signal handlers.
SLURM auto-requeueing enabled. Setting signal handlers.
SLURM auto-requeueing enabled. Setting signal handlers.
SLURM auto-requeueing enabled. Setting signal handlers.
SLURM auto-requeueing enabled. Setting signal handlers.
SLURM auto-requeueing enabled. Setting signal handlers.
SLURM auto-requeueing enabled. Setting signal handlers.
SLURM auto-requeueing enabled. Setting signal handlers.
SLURM auto-requeueing enabled. Setting signal handlers.
SLURM auto-requeueing enabled. Setting signal handlers.
SLURM auto-requeueing enabled. Setting signal handlers.
SLURM auto-requeueing enabled. Setting signal handlers.
SLURM auto-requeueing enabled. Setting signal handlers.
SLURM auto-requeueing enabled. Setting signal handlers.
SLURM auto-requeueing enabled. Setting signal handlers.
SLURM auto-requeueing enabled. Setting signal handlers.
SLURM auto-requeueing enabled. Setting signal handlers.
SLURM auto-requeueing enabled. Setting signal handlers.
SLURM auto-requeueing enabled. Setting signal handlers.
SLURM auto-requeueing enabled. Setting signal handlers.
SLURM auto-requeueing enabled. Setting signal handlers.
SLURM auto-requeueing enabled. Setting signal handlers.
SLURM auto-requeueing enabled. Setting signal handlers.
SLURM auto-requeueing enabled. Setting signal handlers.
SLURM auto-requeueing enabled. Setting signal handlers.
SLURM auto-requeueing enabled. Setting signal handlers.
SLURM auto-requeueing enabled. Setting signal handlers.
SLURM auto-requeueing enabled. Setting signal handlers.
SLURM auto-requeueing enabled. Setting signal handlers.
SLURM auto-requeueing enabled. Setting signal handlers.
SLURM auto-requeueing enabled. Setting signal handlers.
SLURM auto-requeueing enabled. Setting signal handlers.
SLURM auto-requeueing enabled. Setting signal handlers.
SLURM auto-requeueing enabled. Setting signal handlers.
SLURM auto-requeueing enabled. Setting signal handlers.
SLURM auto-requeueing enabled. Setting signal handlers.
SLURM auto-requeueing enabled. Setting signal handlers.
SLURM auto-requeueing enabled. Setting signal handlers.
SLURM auto-requeueing enabled. Setting signal handlers.
[I 2024-09-26 03:52:52,910] Trial 0 finished with values: [1.0, 2.1291232751827343, 0.0, 1.0, 1.1863291068163344, 0.8, 1.0, 1.5861889608769015, 0.7777777777777778] and parameters: {'h': 3, 'encoder_hidden_size': 100, 'encoder_n_layers': 4, 'context_size': 50, 'decoder_hidden_size': 64, 'learning_rate': 0.0019378036103195478, 'max_steps': 500, 'batch_size': 32, 'random_seed': 3}. 
SLURM auto-requeueing enabled. Setting signal handlers.
SLURM auto-requeueing enabled. Setting signal handlers.
SLURM auto-requeueing enabled. Setting signal handlers.
SLURM auto-requeueing enabled. Setting signal handlers.
SLURM auto-requeueing enabled. Setting signal handlers.
SLURM auto-requeueing enabled. Setting signal handlers.
SLURM auto-requeueing enabled. Setting signal handlers.
SLURM auto-requeueing enabled. Setting signal handlers.
SLURM auto-requeueing enabled. Setting signal handlers.
SLURM auto-requeueing enabled. Setting signal handlers.
SLURM auto-requeueing enabled. Setting signal handlers.
SLURM auto-requeueing enabled. Setting signal handlers.
SLURM auto-requeueing enabled. Setting signal handlers.
SLURM auto-requeueing enabled. Setting signal handlers.
SLURM auto-requeueing enabled. Setting signal handlers.
SLURM auto-requeueing enabled. Setting signal handlers.
SLURM auto-requeueing enabled. Setting signal handlers.
SLURM auto-requeueing enabled. Setting signal handlers.
SLURM auto-requeueing enabled. Setting signal handlers.
SLURM auto-requeueing enabled. Setting signal handlers.
SLURM auto-requeueing enabled. Setting signal handlers.
SLURM auto-requeueing enabled. Setting signal handlers.
SLURM auto-requeueing enabled. Setting signal handlers.
SLURM auto-requeueing enabled. Setting signal handlers.
SLURM auto-requeueing enabled. Setting signal handlers.
SLURM auto-requeueing enabled. Setting signal handlers.
SLURM auto-requeueing enabled. Setting signal handlers.
