[I 2024-09-25 10:12:52,143] A new study created in memory with name: LTSFLinearForecaster predicting coupled_logistic_map(sigma=0.00)
[I 2024-09-25 10:13:01,227] Trial 0 finished with values: [1.0, 4.954944104554902, 0.0, 3.0, 2.46840994656774, 0.0, 1.0, 3.5630166534035848, 0.3333333333333333] and parameters: {'seq_len': 16, 'lr': 2.2786931841081252e-05, 'pred_len': 5, 'num_epochs': 50}. 
[I 2024-09-25 10:13:19,779] Trial 1 finished with values: [1.0, 0.7713165748685094, 1.0, 50.0, 0.7722131170717113, 1.0, 1.0, 2.0685381207333573, 0.6666666666666666] and parameters: {'seq_len': 1, 'lr': 0.04147865240850369, 'pred_len': 16, 'num_epochs': 300}. 
[I 2024-09-25 10:13:39,791] Trial 2 finished with values: [1.0, 0.7825328379906307, 1.0, 50.0, 0.7573412456601977, 1.0, 1.0, 2.0516746903783014, 0.6666666666666666] and parameters: {'seq_len': 3, 'lr': 0.008365497455088716, 'pred_len': 8, 'num_epochs': 300}. 
[I 2024-09-25 10:13:49,017] Trial 3 finished with values: [1.0, 0.7758411175089897, 1.0, 50.0, 0.7730863675310707, 1.0, 2.0, 2.0387171843890157, 0.6666666666666666] and parameters: {'seq_len': 7, 'lr': 0.0016691510838543625, 'pred_len': 22, 'num_epochs': 50}. 
[I 2024-09-25 10:13:58,210] Trial 4 finished with values: [1.0, 1.3844312164797248, 0.0, 50.0, 0.6181320110045468, 1.0, 1.0, 2.017330980282055, 0.6666666666666666] and parameters: {'seq_len': 24, 'lr': 0.0006746399545160823, 'pred_len': 6, 'num_epochs': 50}. 
[I 2024-09-25 10:14:17,517] Trial 5 finished with values: [1.0, 0.786370620433672, 1.0, 50.0, 0.6892519146327291, 1.0, 2.0, 2.045268237657595, 0.6666666666666666] and parameters: {'seq_len': 9, 'lr': 0.0039060048954651086, 'pred_len': 16, 'num_epochs': 300}. 
[I 2024-09-25 10:14:28,720] Trial 6 finished with values: [1.0, 0.8552678742522029, 0.5, 50.0, 0.5770260068680271, 1.0, 2.0, 1.9833840162707133, 0.6666666666666666] and parameters: {'seq_len': 13, 'lr': 0.00312304393450938, 'pred_len': 17, 'num_epochs': 100}. 
[I 2024-09-25 10:14:37,896] Trial 7 finished with values: [1.0, 0.8376582089144714, 0.2, 4.0, 0.8431766883241997, 1.0, 2.0, 2.0944058173387003, 0.4444444444444444] and parameters: {'seq_len': 20, 'lr': 0.00046951175757385915, 'pred_len': 9, 'num_epochs': 50}. 
[I 2024-09-25 10:14:56,141] Trial 8 finished with values: [2.0, 0.8095006607549053, 0.7, 50.0, 0.4630983904688657, 1.0, 2.0, 1.9316444141075246, 0.6666666666666666] and parameters: {'seq_len': 24, 'lr': 0.0448622437911837, 'pred_len': 15, 'num_epochs': 300}. 
[I 2024-09-25 10:15:05,677] Trial 9 finished with values: [1.0, 0.8024600863231581, 1.0, 50.0, 0.6909334853934912, 1.0, 2.0, 2.0148613252142478, 0.6666666666666666] and parameters: {'seq_len': 9, 'lr': 0.06415359867193778, 'pred_len': 5, 'num_epochs': 50}. 
[I 2024-09-25 10:15:16,885] Trial 10 finished with values: [1.0, 0.853563211644312, 0.2, 50.0, 0.46587913766460665, 1.0, 2.0, 1.9779439370052534, 0.6666666666666666] and parameters: {'seq_len': 21, 'lr': 0.02806483283249948, 'pred_len': 12, 'num_epochs': 100}. 
[I 2024-09-25 10:15:26,007] Trial 11 finished with values: [1.0, 0.8593155583761786, 0.0, 50.0, 0.7852184990034199, 1.0, 2.0, 2.049527985543629, 0.6666666666666666] and parameters: {'seq_len': 8, 'lr': 0.0011382084141733106, 'pred_len': 21, 'num_epochs': 50}. 
[I 2024-09-25 10:15:46,392] Trial 12 finished with values: [2.0, 0.7854604356334267, 1.0, 50.0, 0.7967728839529539, 1.0, 1.0, 1.866260729055873, 0.3333333333333333] and parameters: {'seq_len': 5, 'lr': 3.643519248831204e-05, 'pred_len': 9, 'num_epochs': 300}. 
[I 2024-09-25 10:15:55,860] Trial 13 finished with values: [1.0, 0.7865642765629443, 1.0, 50.0, 0.7761538868724344, 1.0, 2.0, 2.0155456092130173, 0.6666666666666666] and parameters: {'seq_len': 12, 'lr': 0.0014977273221394348, 'pred_len': 2, 'num_epochs': 50}. 
[I 2024-09-25 10:16:07,099] Trial 14 finished with values: [2.0, 0.8072165364772015, 1.0, 50.0, 0.4837373145145566, 1.0, 2.0, 1.962834566156127, 0.6666666666666666] and parameters: {'seq_len': 17, 'lr': 0.02511085436620964, 'pred_len': 24, 'num_epochs': 100}. 
[I 2024-09-25 10:16:17,704] Trial 15 finished with values: [1.0, 2.5261768065208106, 0.0, 1.0, 2.5177616661424476, 0.0, 1.0, 4.030965768041309, 0.3333333333333333] and parameters: {'seq_len': 12, 'lr': 1.052676698386578e-05, 'pred_len': 23, 'num_epochs': 100}. 
[I 2024-09-25 10:16:38,192] Trial 16 finished with values: [1.0, 0.7805291867181114, 1.0, 50.0, 0.7847145888580843, 1.0, 1.0, 2.0302967441822033, 0.6666666666666666] and parameters: {'seq_len': 2, 'lr': 0.00015469120084784466, 'pred_len': 10, 'num_epochs': 300}. 
[I 2024-09-25 10:16:49,702] Trial 17 finished with values: [1.0, 0.7974163458042053, 1.0, 50.0, 0.7690748596535069, 1.0, 2.0, 2.0362142035873103, 0.6666666666666666] and parameters: {'seq_len': 7, 'lr': 0.005070660006370118, 'pred_len': 9, 'num_epochs': 100}. 
[I 2024-09-25 10:17:09,191] Trial 18 finished with values: [1.0, 1.1103537058766835, 0.0, 6.0, 1.1071204229104756, 0.0, 1.0, 1.8465980888917863, 0.3333333333333333] and parameters: {'seq_len': 9, 'lr': 2.9719259037044294e-05, 'pred_len': 11, 'num_epochs': 300}. 
[I 2024-09-25 10:17:27,909] Trial 19 finished with values: [2.0, 0.8134296880462794, 1.0, 50.0, 0.4812203065192154, 1.0, 2.0, 1.9786349035440103, 0.6666666666666666] and parameters: {'seq_len': 17, 'lr': 0.004533688580704214, 'pred_len': 10, 'num_epochs': 300}. 
[I 2024-09-25 10:17:39,324] Trial 20 finished with values: [1.0, 0.7932829512771484, 0.6, 50.0, 0.7770572202151508, 1.0, 1.0, 2.424038562567354, 0.3333333333333333] and parameters: {'seq_len': 5, 'lr': 0.00011093835110271696, 'pred_len': 4, 'num_epochs': 100}. 
[I 2024-09-25 10:17:49,843] Trial 21 finished with values: [1.0, 0.8167590593036433, 1.0, 50.0, 0.5079404469544608, 1.0, 2.0, 2.0172077623218825, 0.6666666666666666] and parameters: {'seq_len': 16, 'lr': 0.020758967583194524, 'pred_len': 25, 'num_epochs': 100}. 
[I 2024-09-25 10:18:09,566] Trial 22 finished with values: [1.0, 0.9391636392047417, 0.0, 50.0, 0.504783799508683, 1.0, 2.0, 1.9890090752178027, 0.6666666666666666] and parameters: {'seq_len': 19, 'lr': 0.00011754437118462163, 'pred_len': 10, 'num_epochs': 300}. 
[I 2024-09-25 10:18:20,686] Trial 23 finished with values: [1.0, 4.381909765587495, 0.0, 50.0, 0.47429143461290546, 1.0, 2.0, 1.9969629904351494, 0.6666666666666666] and parameters: {'seq_len': 20, 'lr': 0.0015877726292816074, 'pred_len': 10, 'num_epochs': 100}. 
[I 2024-09-25 10:18:30,162] Trial 24 finished with values: [1.0, 0.8280375265174038, 1.0, 50.0, 0.4745644005690559, 1.0, 2.0, 1.9606577209723557, 0.6666666666666666] and parameters: {'seq_len': 18, 'lr': 0.016933271118350832, 'pred_len': 5, 'num_epochs': 50}. 
[I 2024-09-25 10:18:32,186] A new study created in memory with name: VAR predicting coupled_logistic_map(sigma=0.00)
[I 2024-09-25 10:18:37,482] Trial 0 finished with values: [1.0, 1.0235244763038034, 1.0, 50.0, 0.4744179937875513, 1.0, 1.0, 1.9298619893718727, 0.6666666666666666] and parameters: {'ic': 'aic', 'maxlags': 4, 'trend': 'c'}. 
[I 2024-09-25 10:18:43,161] Trial 1 finished with values: [1.0, 1.0459063153970591, 1.0, 50.0, 0.48538364044625987, 1.0, 1.0, 1.9281956286288142, 0.5555555555555556] and parameters: {'ic': 'aic', 'maxlags': 4, 'trend': 'ct'}. 
[I 2024-09-25 10:18:48,643] Trial 2 finished with values: [1.0, 0.8683575581864649, 0.5, 50.0, 0.7049092648843172, 0.8, 1.0, 2.010515192878227, 0.3333333333333333] and parameters: {'ic': 'aic', 'maxlags': 1, 'trend': 'ctt'}. 
[I 2024-09-25 10:18:54,145] Trial 3 finished with values: [1.0, 1.1386067673173683, 0.7, 50.0, 0.470815834252607, 1.0, 1.0, 1.9678286869645676, 0.6666666666666666] and parameters: {'ic': 'fpe', 'maxlags': 5, 'trend': 'ctt'}. 
[I 2024-09-25 10:18:59,757] Trial 4 finished with values: [1.0, 1.224114708682155, 0.0, 50.0, 0.4752816984993008, 1.0, 1.0, 2.5031589816033186, 0.0] and parameters: {'ic': 'aic', 'maxlags': 4, 'trend': 'n'}. 
[I 2024-09-25 10:19:05,342] Trial 5 finished with values: [1.0, 1.4010592503597912, 0.0, 50.0, 0.6222046457200171, 1.0, 1.0, 3.0268044409340424, 0.0] and parameters: {'ic': 'fpe', 'maxlags': 2, 'trend': 'n'}. 
[I 2024-09-25 10:19:10,839] Trial 6 finished with values: [1.0, 0.7788912951556055, 0.8, 50.0, 0.6904140950553812, 1.0, 1.0, 1.9897638210530109, 0.4444444444444444] and parameters: {'ic': 'aic', 'maxlags': 1, 'trend': 'ct'}. 
[I 2024-09-25 10:19:16,442] Trial 7 finished with values: [1.0, 1.1386067673173683, 0.7, 50.0, 0.470815834252607, 1.0, 1.0, 1.9678286869645676, 0.6666666666666666] and parameters: {'ic': 'aic', 'maxlags': 5, 'trend': 'ctt'}. 
[I 2024-09-25 10:19:22,050] Trial 8 finished with values: [1.0, 1.0637748919875212, 0.7, 50.0, 0.4869442199790402, 1.0, 1.0, 1.9678286869645676, 0.6666666666666666] and parameters: {'ic': 'fpe', 'maxlags': 4, 'trend': 'ctt'}. 
[I 2024-09-25 10:19:27,707] Trial 9 finished with values: [1.0, 1.0235244763038034, 1.0, 50.0, 0.4744179937875513, 1.0, 1.0, 1.9298619893718727, 0.6666666666666666] and parameters: {'ic': 'aic', 'maxlags': 3, 'trend': 'c'}. 
[I 2024-09-25 10:19:33,392] Trial 10 finished with values: [1.0, 1.4010592503597912, 0.0, 50.0, 0.6222046457200171, 1.0, 1.0, 3.0268044409340424, 0.0] and parameters: {'ic': 'aic', 'maxlags': 2, 'trend': 'n'}. 
[I 2024-09-25 10:19:39,008] Trial 11 finished with values: [1.0, 0.8009111429674243, 0.9, 50.0, 0.6158297794885385, 1.0, 1.0, 1.9351876914738417, 0.5555555555555556] and parameters: {'ic': 'aic', 'maxlags': 2, 'trend': 'ct'}. 
[I 2024-09-25 10:19:44,714] Trial 12 finished with values: [1.0, 1.224114708682155, 0.0, 50.0, 0.4752816984993008, 1.0, 1.0, 2.5031589816033186, 0.0] and parameters: {'ic': 'aic', 'maxlags': 4, 'trend': 'n'}. 
[I 2024-09-25 10:19:50,370] Trial 13 finished with values: [1.0, 0.8009111429674243, 0.9, 50.0, 0.6158297794885385, 1.0, 1.0, 1.9351876914738417, 0.5555555555555556] and parameters: {'ic': 'aic', 'maxlags': 2, 'trend': 'ct'}. 
[I 2024-09-25 10:19:55,993] Trial 14 finished with values: [1.0, 0.8003838272341289, 1.0, 50.0, 0.6123649164627882, 1.0, 1.0, 1.9376873177650995, 0.6666666666666666] and parameters: {'ic': 'aic', 'maxlags': 2, 'trend': 'c'}. 
[I 2024-09-25 10:20:01,580] Trial 15 finished with values: [1.0, 0.7788912951556055, 0.8, 50.0, 0.6904140950553812, 1.0, 1.0, 1.9897638210530109, 0.4444444444444444] and parameters: {'ic': 'fpe', 'maxlags': 1, 'trend': 'ct'}. 
[I 2024-09-25 10:20:07,157] Trial 16 finished with values: [1.0, 1.0459063153970591, 1.0, 50.0, 0.48538364044625987, 1.0, 1.0, 1.9281956286288142, 0.5555555555555556] and parameters: {'ic': 'aic', 'maxlags': 4, 'trend': 'ct'}. 
[I 2024-09-25 10:20:12,768] Trial 17 finished with values: [1.0, 0.7788912951556055, 0.8, 50.0, 0.6904140950553812, 1.0, 1.0, 1.9897638210530109, 0.4444444444444444] and parameters: {'ic': 'aic', 'maxlags': 1, 'trend': 'ct'}. 
[I 2024-09-25 10:20:18,036] Trial 18 finished with values: [1.0, 1.0637748919875212, 0.7, 50.0, 0.4869442199790402, 1.0, 1.0, 1.9678286869645676, 0.6666666666666666] and parameters: {'ic': 'fpe', 'maxlags': 3, 'trend': 'ctt'}. 
[I 2024-09-25 10:20:23,865] Trial 19 finished with values: [1.0, 0.8310605991675379, 0.5, 50.0, 0.6167850155026773, 1.0, 1.0, 1.956102602750597, 0.5555555555555556] and parameters: {'ic': 'fpe', 'maxlags': 2, 'trend': 'ctt'}. 
[I 2024-09-25 10:20:29,576] Trial 20 finished with values: [1.0, 1.1150122023349873, 1.0, 50.0, 0.4692872855259085, 1.0, 1.0, 1.9281956286288142, 0.5555555555555556] and parameters: {'ic': 'aic', 'maxlags': 5, 'trend': 'ct'}. 
[I 2024-09-25 10:20:35,160] Trial 21 finished with values: [1.0, 0.8683575581864649, 0.5, 50.0, 0.7049092648843172, 0.8, 1.0, 2.010515192878227, 0.3333333333333333] and parameters: {'ic': 'fpe', 'maxlags': 1, 'trend': 'ctt'}. 
[I 2024-09-25 10:20:40,865] Trial 22 finished with values: [1.0, 0.8009111429674243, 0.9, 50.0, 0.6158297794885385, 1.0, 1.0, 1.9351876914738417, 0.5555555555555556] and parameters: {'ic': 'fpe', 'maxlags': 2, 'trend': 'ct'}. 
[I 2024-09-25 10:20:46,579] Trial 23 finished with values: [1.0, 0.8683575581864649, 0.5, 50.0, 0.7049092648843172, 0.8, 1.0, 2.010515192878227, 0.3333333333333333] and parameters: {'ic': 'fpe', 'maxlags': 1, 'trend': 'ctt'}. 
[I 2024-09-25 10:20:52,450] Trial 24 finished with values: [1.0, 1.224114708682155, 0.0, 50.0, 0.4752816984993008, 1.0, 1.0, 2.5031589816033186, 0.0] and parameters: {'ic': 'aic', 'maxlags': 4, 'trend': 'n'}. 
[I 2024-09-25 10:20:55,148] A new study created in memory with name: LSTM predicting coupled_logistic_map(sigma=0.00)
[rank: 0] Seed set to 13
SLURM auto-requeueing enabled. Setting signal handlers.
SLURM auto-requeueing enabled. Setting signal handlers.
SLURM auto-requeueing enabled. Setting signal handlers.
SLURM auto-requeueing enabled. Setting signal handlers.
SLURM auto-requeueing enabled. Setting signal handlers.
SLURM auto-requeueing enabled. Setting signal handlers.
SLURM auto-requeueing enabled. Setting signal handlers.
SLURM auto-requeueing enabled. Setting signal handlers.
SLURM auto-requeueing enabled. Setting signal handlers.
SLURM auto-requeueing enabled. Setting signal handlers.
SLURM auto-requeueing enabled. Setting signal handlers.
SLURM auto-requeueing enabled. Setting signal handlers.
SLURM auto-requeueing enabled. Setting signal handlers.
SLURM auto-requeueing enabled. Setting signal handlers.
SLURM auto-requeueing enabled. Setting signal handlers.
SLURM auto-requeueing enabled. Setting signal handlers.
SLURM auto-requeueing enabled. Setting signal handlers.
SLURM auto-requeueing enabled. Setting signal handlers.
SLURM auto-requeueing enabled. Setting signal handlers.
SLURM auto-requeueing enabled. Setting signal handlers.
SLURM auto-requeueing enabled. Setting signal handlers.
SLURM auto-requeueing enabled. Setting signal handlers.
SLURM auto-requeueing enabled. Setting signal handlers.
SLURM auto-requeueing enabled. Setting signal handlers.
SLURM auto-requeueing enabled. Setting signal handlers.
SLURM auto-requeueing enabled. Setting signal handlers.
SLURM auto-requeueing enabled. Setting signal handlers.
SLURM auto-requeueing enabled. Setting signal handlers.
SLURM auto-requeueing enabled. Setting signal handlers.
SLURM auto-requeueing enabled. Setting signal handlers.
SLURM auto-requeueing enabled. Setting signal handlers.
SLURM auto-requeueing enabled. Setting signal handlers.
SLURM auto-requeueing enabled. Setting signal handlers.
SLURM auto-requeueing enabled. Setting signal handlers.
SLURM auto-requeueing enabled. Setting signal handlers.
SLURM auto-requeueing enabled. Setting signal handlers.
SLURM auto-requeueing enabled. Setting signal handlers.
SLURM auto-requeueing enabled. Setting signal handlers.
[I 2024-09-25 10:24:32,627] Trial 0 finished with values: [1.0, 2.62495202654613, 0.0, 11.0, 0.568672490189744, 1.0, 2.0, 1.783677230069135, 0.8888888888888888] and parameters: {'h': 7, 'encoder_hidden_size': 200, 'encoder_n_layers': 3, 'context_size': 10, 'decoder_hidden_size': 512, 'learning_rate': 0.005708363023330958, 'max_steps': 500, 'batch_size': 32, 'random_seed': 13}. 
SLURM auto-requeueing enabled. Setting signal handlers.
SLURM auto-requeueing enabled. Setting signal handlers.
SLURM auto-requeueing enabled. Setting signal handlers.
SLURM auto-requeueing enabled. Setting signal handlers.
SLURM auto-requeueing enabled. Setting signal handlers.
SLURM auto-requeueing enabled. Setting signal handlers.
SLURM auto-requeueing enabled. Setting signal handlers.
SLURM auto-requeueing enabled. Setting signal handlers.
SLURM auto-requeueing enabled. Setting signal handlers.
SLURM auto-requeueing enabled. Setting signal handlers.
SLURM auto-requeueing enabled. Setting signal handlers.
SLURM auto-requeueing enabled. Setting signal handlers.
SLURM auto-requeueing enabled. Setting signal handlers.
SLURM auto-requeueing enabled. Setting signal handlers.
SLURM auto-requeueing enabled. Setting signal handlers.
SLURM auto-requeueing enabled. Setting signal handlers.
SLURM auto-requeueing enabled. Setting signal handlers.
SLURM auto-requeueing enabled. Setting signal handlers.
SLURM auto-requeueing enabled. Setting signal handlers.
SLURM auto-requeueing enabled. Setting signal handlers.
[I 2024-09-25 10:38:01,595] Trial 1 finished with values: [1.0, 2.400803014808952, 0.0, 50.0, 0.8028541283391807, 0.1, 1.0, 2.1786626572717065, 0.0] and parameters: {'h': 16, 'encoder_hidden_size': 300, 'encoder_n_layers': 1, 'context_size': 50, 'decoder_hidden_size': 512, 'learning_rate': 0.08351263214189125, 'max_steps': 500, 'batch_size': 16, 'random_seed': 18}. 
SLURM auto-requeueing enabled. Setting signal handlers.
SLURM auto-requeueing enabled. Setting signal handlers.
SLURM auto-requeueing enabled. Setting signal handlers.
SLURM auto-requeueing enabled. Setting signal handlers.
SLURM auto-requeueing enabled. Setting signal handlers.
SLURM auto-requeueing enabled. Setting signal handlers.
SLURM auto-requeueing enabled. Setting signal handlers.
SLURM auto-requeueing enabled. Setting signal handlers.
SLURM auto-requeueing enabled. Setting signal handlers.
SLURM auto-requeueing enabled. Setting signal handlers.
SLURM auto-requeueing enabled. Setting signal handlers.
SLURM auto-requeueing enabled. Setting signal handlers.
SLURM auto-requeueing enabled. Setting signal handlers.
SLURM auto-requeueing enabled. Setting signal handlers.
SLURM auto-requeueing enabled. Setting signal handlers.
SLURM auto-requeueing enabled. Setting signal handlers.
SLURM auto-requeueing enabled. Setting signal handlers.
SLURM auto-requeueing enabled. Setting signal handlers.
SLURM auto-requeueing enabled. Setting signal handlers.
SLURM auto-requeueing enabled. Setting signal handlers.
SLURM auto-requeueing enabled. Setting signal handlers.
SLURM auto-requeueing enabled. Setting signal handlers.
SLURM auto-requeueing enabled. Setting signal handlers.
SLURM auto-requeueing enabled. Setting signal handlers.
SLURM auto-requeueing enabled. Setting signal handlers.
SLURM auto-requeueing enabled. Setting signal handlers.
