[I 2024-09-25 17:06:29,545] Trial 10 finished with values: [1.0, 1.9114505593710371, 0.0, 1.0, 2.107275330646135, 0.0, 1.0, 3.248095552700337, 0.1111111111111111] and parameters: {'optimizer__threshold': 0.0003109072861033632, 'optimizer__alpha': 0.045735194119042484, 'discrete_time': False, 'feature_library': 0, 'differentiation_method': 2}. 
/nas/longleaf/home/djpassey/.local/lib/python3.9/site-packages/pysindy/optimizers/stlsq.py:201: UserWarning: Sparsity parameter is too big (0.1) and eliminated all coefficients
  warnings.warn(
/nas/longleaf/home/djpassey/.local/lib/python3.9/site-packages/pysindy/optimizers/stlsq.py:201: UserWarning: Sparsity parameter is too big (0.1) and eliminated all coefficients
  warnings.warn(
/nas/longleaf/home/djpassey/.local/lib/python3.9/site-packages/pysindy/optimizers/stlsq.py:201: UserWarning: Sparsity parameter is too big (0.1) and eliminated all coefficients
  warnings.warn(
/nas/longleaf/home/djpassey/.local/lib/python3.9/site-packages/pysindy/optimizers/stlsq.py:201: UserWarning: Sparsity parameter is too big (0.1) and eliminated all coefficients
  warnings.warn(
/nas/longleaf/home/djpassey/.local/lib/python3.9/site-packages/scipy/stats/_axis_nan_policy.py:551: RuntimeWarning: Precision loss occurred in moment calculation due to catastrophic cancellation. This occurs when the data are nearly identical. Results may be unreliable.
  res = hypotest_fun_out(*samples, axis=axis, **kwds)
[I 2024-09-25 17:06:36,631] Trial 11 finished with values: [1.0, 195.4557739758285, 0.0, 1.0, 47.61809314992072, 0.0, 1.0, 44.536109730097735, 0.3333333333333333] and parameters: {'optimizer__threshold': 0.012952124990222991, 'optimizer__alpha': 0.005969947409243028, 'discrete_time': False, 'feature_library': 1, 'differentiation_method': 6}. 
[I 2024-09-25 17:06:42,198] Trial 12 finished with values: [2.0, 1.1059732796530453, 1.0, 10.0, 0.6656580497573625, 1.0, 2.0, 7.113567562666472, 0.5555555555555556] and parameters: {'optimizer__threshold': 0.020162724962474603, 'optimizer__alpha': 3.9178936447640044e-05, 'discrete_time': True, 'feature_library': 1, 'differentiation_method': 0}. 
/nas/longleaf/home/djpassey/.local/lib/python3.9/site-packages/pysindy/optimizers/stlsq.py:201: UserWarning: Sparsity parameter is too big (0.1) and eliminated all coefficients
  warnings.warn(
/nas/longleaf/home/djpassey/.local/lib/python3.9/site-packages/pysindy/optimizers/stlsq.py:201: UserWarning: Sparsity parameter is too big (0.1) and eliminated all coefficients
  warnings.warn(
/nas/longleaf/home/djpassey/.local/lib/python3.9/site-packages/pysindy/optimizers/stlsq.py:201: UserWarning: Sparsity parameter is too big (0.1) and eliminated all coefficients
  warnings.warn(
/nas/longleaf/home/djpassey/.local/lib/python3.9/site-packages/pysindy/optimizers/stlsq.py:201: UserWarning: Sparsity parameter is too big (0.1) and eliminated all coefficients
  warnings.warn(
/nas/longleaf/home/djpassey/.local/lib/python3.9/site-packages/pysindy/optimizers/stlsq.py:201: UserWarning: Sparsity parameter is too big (0.1) and eliminated all coefficients
  warnings.warn(
/nas/longleaf/home/djpassey/.local/lib/python3.9/site-packages/pysindy/optimizers/stlsq.py:201: UserWarning: Sparsity parameter is too big (0.1) and eliminated all coefficients
  warnings.warn(
/nas/longleaf/home/djpassey/.local/lib/python3.9/site-packages/pysindy/optimizers/stlsq.py:201: UserWarning: Sparsity parameter is too big (0.1) and eliminated all coefficients
  warnings.warn(
/nas/longleaf/home/djpassey/.local/lib/python3.9/site-packages/scipy/stats/_axis_nan_policy.py:551: RuntimeWarning: Precision loss occurred in moment calculation due to catastrophic cancellation. This occurs when the data are nearly identical. Results may be unreliable.
  res = hypotest_fun_out(*samples, axis=axis, **kwds)
[I 2024-09-25 17:06:48,885] Trial 13 finished with values: [1.0, 29.247304979712126, 0.0, 1.0, 3.385461341644824, 0.1, 1.0, 19.07591434275906, 0.2222222222222222] and parameters: {'optimizer__threshold': 0.6344930147381198, 'optimizer__alpha': 0.00030238441104276227, 'discrete_time': False, 'feature_library': 0, 'differentiation_method': 6}. 
[I 2024-09-25 17:06:54,571] Trial 14 finished with values: [2.0, 1.1059732796530453, 1.0, 10.0, 0.6656580497573625, 1.0, 2.0, 7.113567562666472, 0.5555555555555556] and parameters: {'optimizer__threshold': 0.0007349630796194205, 'optimizer__alpha': 0.0349978273265624, 'discrete_time': True, 'feature_library': 1, 'differentiation_method': 3}. 
[I 2024-09-25 17:07:00,140] Trial 15 finished with values: [2.0, 1.1059732796530453, 1.0, 10.0, 0.6656580497573625, 1.0, 2.0, 7.113567562666472, 0.5555555555555556] and parameters: {'optimizer__threshold': 6.828009562143693e-05, 'optimizer__alpha': 0.11313973000613245, 'discrete_time': True, 'feature_library': 1, 'differentiation_method': 1}. 
[I 2024-09-25 17:07:05,947] Trial 16 finished with values: [10.0, 0.7006840436317091, 0.6, 49.0, 0.47044621562922095, 1.0, 5.0, 1.5377273763970356, 0.8888888888888888] and parameters: {'optimizer__threshold': 0.0036265032263982735, 'optimizer__alpha': 0.003770210897143937, 'discrete_time': True, 'feature_library': 0, 'differentiation_method': 4}. 
[I 2024-09-25 17:07:11,479] Trial 17 finished with values: [2.0, 1.1059732796530453, 1.0, 10.0, 0.6656580497573625, 1.0, 2.0, 7.113567562666472, 0.5555555555555556] and parameters: {'optimizer__threshold': 0.023182888803054146, 'optimizer__alpha': 0.10816259726079581, 'discrete_time': True, 'feature_library': 1, 'differentiation_method': 7}. 
[I 2024-09-25 17:07:17,363] Trial 18 finished with values: [10.0, 0.7006840436317091, 0.6, 49.0, 0.47044621562922095, 1.0, 5.0, 1.5377273763970356, 0.8888888888888888] and parameters: {'optimizer__threshold': 0.012340045947235053, 'optimizer__alpha': 2.0608617984095436e-05, 'discrete_time': True, 'feature_library': 0, 'differentiation_method': 8}. 
[I 2024-09-25 17:07:23,258] Trial 19 finished with values: [10.0, 0.7006840436317091, 0.6, 49.0, 0.47044621562922095, 1.0, 5.0, 1.5377273763970356, 0.8888888888888888] and parameters: {'optimizer__threshold': 0.001093156996489542, 'optimizer__alpha': 4.382628551118272, 'discrete_time': True, 'feature_library': 0, 'differentiation_method': 3}. 
[I 2024-09-25 17:07:34,626] Trial 20 finished with values: [1.0, 112.66251156877338, 0.0, 1.0, 55.09474969499913, 0.1, 1.0, 178.4886017678997, 0.3333333333333333] and parameters: {'optimizer__threshold': 0.00403980360962656, 'optimizer__alpha': 0.0008185569088971122, 'discrete_time': False, 'feature_library': 1, 'differentiation_method': 2}. 
[I 2024-09-25 17:07:46,458] Trial 21 finished with values: [1.0, 75.81450451383385, 0.2, 1.0, 47.933718254906736, 0.2, 1.0, 203.41026162285823, 0.2222222222222222] and parameters: {'optimizer__threshold': 1.306369101982804e-05, 'optimizer__alpha': 0.0031183867276121566, 'discrete_time': False, 'feature_library': 1, 'differentiation_method': 3}. 
[I 2024-09-25 17:07:51,735] Trial 22 finished with values: [2.0, 1.1059732796530453, 1.0, 10.0, 0.6656580497573625, 1.0, 2.0, 7.113567562666472, 0.5555555555555556] and parameters: {'optimizer__threshold': 1.1395135572493544, 'optimizer__alpha': 0.0007586336869596604, 'discrete_time': True, 'feature_library': 1, 'differentiation_method': 1}. 
/nas/longleaf/home/djpassey/.local/lib/python3.9/site-packages/pysindy/optimizers/stlsq.py:201: UserWarning: Sparsity parameter is too big (0.1) and eliminated all coefficients
  warnings.warn(
/nas/longleaf/home/djpassey/.local/lib/python3.9/site-packages/pysindy/optimizers/stlsq.py:201: UserWarning: Sparsity parameter is too big (0.1) and eliminated all coefficients
  warnings.warn(
/nas/longleaf/home/djpassey/.local/lib/python3.9/site-packages/scipy/stats/_axis_nan_policy.py:551: RuntimeWarning: Precision loss occurred in moment calculation due to catastrophic cancellation. This occurs when the data are nearly identical. Results may be unreliable.
  res = hypotest_fun_out(*samples, axis=axis, **kwds)
[I 2024-09-25 17:08:00,412] Trial 23 finished with values: [2.0, 152.97508517830283, 0.0, 1.0, 46.402259038333625, 0.1, 1.0, 124.6129315374169, 0.0] and parameters: {'optimizer__threshold': 0.012864734868592907, 'optimizer__alpha': 0.34458449639093236, 'discrete_time': False, 'feature_library': 1, 'differentiation_method': 7}. 
[I 2024-09-25 17:08:06,264] Trial 24 finished with values: [10.0, 0.7006840436317091, 0.6, 49.0, 0.47044621562922095, 1.0, 5.0, 1.5377273763970356, 0.8888888888888888] and parameters: {'optimizer__threshold': 0.01602515906238282, 'optimizer__alpha': 2.694682809627656, 'discrete_time': True, 'feature_library': 0, 'differentiation_method': 5}. 
[I 2024-09-25 17:08:11,709] A new study created in memory with name: LTSFLinearForecaster predicting Belozyorov3DQuad(sigma=0.00)
[I 2024-09-25 17:08:26,890] Trial 0 finished with values: [3.0, 17.228449489319186, 0.0, 1.0, 15.414139302948374, 0.0, 1.0, 152.99426885173145, 0.0] and parameters: {'seq_len': 3, 'lr': 1.5401191005834952e-05, 'pred_len': 14, 'num_epochs': 300}. 
[I 2024-09-25 17:08:33,256] Trial 1 finished with values: [3.0, 3922014534.583694, 0.0, 1.0, 19847207.64680453, 0.0, 2.0, 59.426129017408975, 0.5] and parameters: {'seq_len': 24, 'lr': 0.030608064802488916, 'pred_len': 18, 'num_epochs': 100}. 
[I 2024-09-25 17:08:46,808] Trial 2 finished with values: [4.0, 11.74095459686541, 0.0, 10.0, 8.393383575679971, 0.0, 2.0, 17.972223199595543, 1.0] and parameters: {'seq_len': 24, 'lr': 0.0014482372737364645, 'pred_len': 2, 'num_epochs': 300}. 
[I 2024-09-25 17:09:01,353] Trial 3 finished with values: [3.0, 11.880986876731566, 0.0, 1.0, 7.6086524069768044, 0.3333333333333333, 3.0, 66.47634641525131, 0.5] and parameters: {'seq_len': 17, 'lr': 4.075249050846692e-05, 'pred_len': 8, 'num_epochs': 300}. 
[I 2024-09-25 17:09:15,982] Trial 4 finished with values: [4.0, 6182.075225263585, 0.0, 2.0, 170.4925105175559, 0.0, 1.0, 689.7034097480534, 1.0] and parameters: {'seq_len': 11, 'lr': 0.008464222091870031, 'pred_len': 8, 'num_epochs': 300}. 
[I 2024-09-25 17:09:20,978] Trial 5 finished with values: [2.0, 12.039913706887726, 0.0, 1.0, 11.47620143064279, 0.0, 1.0, 81.56378380701875, 0.5] and parameters: {'seq_len': 3, 'lr': 4.2838149597595513e-05, 'pred_len': 12, 'num_epochs': 50}. 
[I 2024-09-25 17:09:36,295] Trial 6 finished with values: [3.0, 16.653755147674755, 0.3333333333333333, 6.0, 12.04180774793171, 0.0, 2.0, 52.804313532200105, 0.5] and parameters: {'seq_len': 3, 'lr': 0.006491869266810502, 'pred_len': 14, 'num_epochs': 300}. 
[I 2024-09-25 17:09:51,566] Trial 7 finished with values: [2.0, 11.905005790762164, 0.0, 2.0, 11.11606253897175, 0.0, 1.0, 82.18985781126865, 0.0] and parameters: {'seq_len': 8, 'lr': 4.39861431942799e-05, 'pred_len': 7, 'num_epochs': 300}. 
[I 2024-09-25 17:09:58,411] Trial 8 finished with values: [4.0, 11.89095738234934, 0.0, 4.0, 9.295221803137812, 0.0, 2.0, 47.47624888993525, 0.5] and parameters: {'seq_len': 21, 'lr': 0.021210128762533705, 'pred_len': 11, 'num_epochs': 100}. 
[I 2024-09-25 17:10:06,160] Trial 9 finished with values: [3.0, 5658014.40209442, 0.0, 2.0, 914.4942928945292, 0.0, 2.0, 7410.687751480306, 1.0] and parameters: {'seq_len': 2, 'lr': 0.04309349364077474, 'pred_len': 5, 'num_epochs': 100}. 
[I 2024-09-25 17:10:20,980] Trial 10 finished with values: [3.0, 11.811281456393694, 0.0, 1.0, 7.811570516527181, 0.3333333333333333, 2.0, 53.95183459907195, 0.0] and parameters: {'seq_len': 16, 'lr': 2.6018720806743158e-05, 'pred_len': 7, 'num_epochs': 300}. 
[I 2024-09-25 17:10:25,977] Trial 11 finished with values: [4.0, 12.327959796488333, 0.3333333333333333, 25.0, 7.50377391874172, 0.0, 1.0, 37.78102222236492, 0.0] and parameters: {'seq_len': 15, 'lr': 0.00012506057300873402, 'pred_len': 18, 'num_epochs': 50}. 
[I 2024-09-25 17:10:39,798] Trial 12 finished with values: [4.0, 13.484923231824652, 0.3333333333333333, 33.0, 7.66481666910473, 0.3333333333333333, 3.0, 59.67933389224155, 0.0] and parameters: {'seq_len': 17, 'lr': 0.0001333228027439005, 'pred_len': 24, 'num_epochs': 300}. 
[I 2024-09-25 17:10:44,897] Trial 13 finished with values: [4.0, 18.062448536991713, 0.0, 1.0, 8.186125219466609, 0.3333333333333333, 2.0, 49.30115789130389, 0.5] and parameters: {'seq_len': 8, 'lr': 0.00026581894085330495, 'pred_len': 4, 'num_epochs': 50}. 
[I 2024-09-25 17:10:51,671] Trial 14 finished with values: [4.0, 27.916254991372, 0.3333333333333333, 4.0, 22.318297633816865, 0.0, 3.0, 22.189434027714977, 1.0] and parameters: {'seq_len': 23, 'lr': 0.007515613081531862, 'pred_len': 1, 'num_epochs': 100}. 
[I 2024-09-25 17:10:58,595] Trial 15 finished with values: [5.0, 12.283060618877885, 0.3333333333333333, 26.0, 7.361755256303517, 0.0, 2.0, 17.409833506401828, 1.0] and parameters: {'seq_len': 20, 'lr': 0.003750099347893337, 'pred_len': 24, 'num_epochs': 100}. 
[I 2024-09-25 17:11:05,804] Trial 16 finished with values: [3.0, 611.1477504873282, 0.0, 3.0, 47.19346788135895, 0.0, 1.0, 84.02624507961349, 0.0] and parameters: {'seq_len': 2, 'lr': 0.00018939317828009579, 'pred_len': 25, 'num_epochs': 100}. 
[I 2024-09-25 17:11:12,893] Trial 17 finished with values: [3.0, 11.683727796841646, 0.0, 10.0, 7.861334748998949, 0.0, 1.0, 76.6018388030249, 0.0] and parameters: {'seq_len': 11, 'lr': 0.00015806724543692959, 'pred_len': 15, 'num_epochs': 100}. 
[I 2024-09-25 17:11:19,930] Trial 18 finished with values: [4.0, 11.832050155780097, 0.0, 4.0, 8.761884315360811, 0.0, 2.0, 62.92125215075424, 0.5] and parameters: {'seq_len': 22, 'lr': 0.005161306606828181, 'pred_len': 11, 'num_epochs': 100}. 
[I 2024-09-25 17:11:26,525] Trial 19 finished with values: [5.0, 12.920626662340759, 0.0, 1.0, 13.229600702370522, 0.0, 1.0, 86.90127966717674, 0.0] and parameters: {'seq_len': 20, 'lr': 2.6749936958210756e-05, 'pred_len': 15, 'num_epochs': 100}. 
[I 2024-09-25 17:11:40,846] Trial 20 finished with values: [3.0, 11.646591065830743, 0.0, 14.0, 7.683202032779062, 0.0, 1.0, 54.855239140190044, 0.0] and parameters: {'seq_len': 14, 'lr': 0.00015162613508063694, 'pred_len': 14, 'num_epochs': 300}. 
[I 2024-09-25 17:11:45,557] Trial 21 finished with values: [3.0, 11.846597363811297, 0.0, 1.0, 7.805311140629677, 0.0, 1.0, 55.762899866238065, 0.0] and parameters: {'seq_len': 21, 'lr': 8.831513027152676e-05, 'pred_len': 24, 'num_epochs': 50}. 
[I 2024-09-25 17:11:53,088] Trial 22 finished with values: [4.0, 11.550816862538229, 0.0, 9.0, 8.152226685689026, 0.0, 2.0, 47.286705304167185, 0.5] and parameters: {'seq_len': 8, 'lr': 0.0027305475578996885, 'pred_len': 4, 'num_epochs': 100}. 
[I 2024-09-25 17:12:07,428] Trial 23 finished with values: [5.0, 12.959323057280288, 0.0, 24.0, 7.312591353572339, 0.6666666666666666, 1.0, 42.15195771248576, 0.5] and parameters: {'seq_len': 22, 'lr': 0.00010961690546953723, 'pred_len': 5, 'num_epochs': 300}. 
[I 2024-09-25 17:12:22,133] Trial 24 finished with values: [4.0, 11.597829081987745, 0.0, 12.0, 7.8633313653734245, 0.0, 2.0, 57.32933060883604, 0.5] and parameters: {'seq_len': 3, 'lr': 0.0018647884365851598, 'pred_len': 24, 'num_epochs': 300}. 
[I 2024-09-25 17:12:27,171] A new study created in memory with name: VAR predicting Belozyorov3DQuad(sigma=0.00)
[I 2024-09-25 17:12:29,274] Trial 0 finished with values: [5.0, 13.008838772087655, 0.0, 10.0, 7.301184956380719, 1.0, 1.0, 10400.689220135924, 1.0] and parameters: {'ic': 'fpe', 'maxlags': 1, 'trend': 'n'}. 
[I 2024-09-25 17:12:30,940] Trial 1 finished with values: [5.0, 12.022095036809418, 0.0, 4.0, 8.808266483227612, 0.3333333333333333, 9.0, 85.3044179550438, 0.5] and parameters: {'ic': 'aic', 'maxlags': 2, 'trend': 'n'}. 
[I 2024-09-25 17:12:32,584] Trial 2 finished with values: [3.0, 59.53747257224091, 0.3333333333333333, 5.0, 19.4642804507263, 0.3333333333333333, 1.0, 5516.798624395827, 1.0] and parameters: {'ic': 'fpe', 'maxlags': 1, 'trend': 'ctt'}. 
[I 2024-09-25 17:12:34,596] Trial 3 finished with values: [7.0, 6.729897091938348, 0.3333333333333333, 7.0, 7.081205305115228, 0.0, 2.0, 1367.6995249560043, 1.0] and parameters: {'ic': 'fpe', 'maxlags': 3, 'trend': 'ct'}. 
[I 2024-09-25 17:12:36,281] Trial 4 finished with values: [6.0, 13.333606922956116, 0.0, 19.0, 8.54094727549844, 0.3333333333333333, 2.0, 1354.3517136725445, 1.0] and parameters: {'ic': 'aic', 'maxlags': 3, 'trend': 'ctt'}. 
[I 2024-09-25 17:12:37,971] Trial 5 finished with values: [2.0, 6.384242176889765, 1.0, 24.0, 6.206417382946546, 0.3333333333333333, 2.0, 614.4767670304291, 1.0] and parameters: {'ic': 'aic', 'maxlags': 4, 'trend': 'ct'}. 
[I 2024-09-25 17:12:40,037] Trial 6 finished with values: [1.0, 13.25030265487983, 0.0, 6.0, 8.162759457182233, 0.3333333333333333, 2.0, 136.4974065435998, 0.5] and parameters: {'ic': 'aic', 'maxlags': 5, 'trend': 'n'}. 
[I 2024-09-25 17:12:41,809] Trial 7 finished with values: [4.0, 7.92016615643194, 1.0, 9.0, 7.926912785632493, 0.6666666666666666, 1.0, 3724.364201437982, 1.0] and parameters: {'ic': 'aic', 'maxlags': 1, 'trend': 'c'}. 
[I 2024-09-25 17:12:43,527] Trial 8 finished with values: [1.0, 7.75183305626707, 1.0, 6.0, 7.091586865677699, 0.6666666666666666, 2.0, 912.6542065812536, 1.0] and parameters: {'ic': 'fpe', 'maxlags': 5, 'trend': 'ct'}. 
[I 2024-09-25 17:12:45,242] Trial 9 finished with values: [5.0, 13.008838772087655, 0.0, 10.0, 7.301184956380719, 1.0, 1.0, 10400.689220135924, 1.0] and parameters: {'ic': 'fpe', 'maxlags': 1, 'trend': 'n'}. 
[I 2024-09-25 17:12:47,331] Trial 10 finished with values: [3.0, 23.703069511234006, 0.0, 5.0, 11.63123016296307, 0.6666666666666666, 2.0, 316.34799763994357, 1.0] and parameters: {'ic': 'fpe', 'maxlags': 2, 'trend': 'ctt'}. 
[I 2024-09-25 17:12:49,069] Trial 11 finished with values: [7.0, 6.408549706833444, 1.0, 6.0, 7.377141195660654, 1.0, 2.0, 852.2531636627227, 1.0] and parameters: {'ic': 'fpe', 'maxlags': 3, 'trend': 'c'}. 
[I 2024-09-25 17:12:50,765] Trial 12 finished with values: [2.0, 14.45436705090032, 0.0, 10.0, 7.027533054607836, 0.3333333333333333, 2.0, 105.7683003140645, 1.0] and parameters: {'ic': 'aic', 'maxlags': 4, 'trend': 'n'}. 
[I 2024-09-25 17:12:52,813] Trial 13 finished with values: [1.0, 7.75183305626707, 1.0, 6.0, 7.091586865677699, 0.6666666666666666, 2.0, 912.6542065812536, 1.0] and parameters: {'ic': 'fpe', 'maxlags': 5, 'trend': 'ct'}. 
[I 2024-09-25 17:12:54,532] Trial 14 finished with values: [3.0, 6.955783703698279, 1.0, 4.0, 7.966755580640017, 1.0, 2.0, 276.0374892471588, 1.0] and parameters: {'ic': 'fpe', 'maxlags': 2, 'trend': 'c'}. 
[I 2024-09-25 17:12:56,212] Trial 15 finished with values: [3.0, 59.53747257224091, 0.3333333333333333, 5.0, 19.4642804507263, 0.3333333333333333, 1.0, 5516.798624395827, 1.0] and parameters: {'ic': 'aic', 'maxlags': 1, 'trend': 'ctt'}. 
[I 2024-09-25 17:12:57,935] Trial 16 finished with values: [3.0, 6.955783703698279, 1.0, 4.0, 7.966755580640017, 1.0, 2.0, 276.0374892471588, 1.0] and parameters: {'ic': 'fpe', 'maxlags': 2, 'trend': 'c'}. 
[I 2024-09-25 17:13:00,022] Trial 17 finished with values: [1.0, 7.75183305626707, 1.0, 6.0, 7.091586865677699, 0.6666666666666666, 2.0, 912.6542065812536, 1.0] and parameters: {'ic': 'fpe', 'maxlags': 5, 'trend': 'ct'}. 
[I 2024-09-25 17:13:01,782] Trial 18 finished with values: [4.0, 7.92016615643194, 1.0, 9.0, 7.926912785632493, 0.6666666666666666, 1.0, 3724.364201437982, 1.0] and parameters: {'ic': 'aic', 'maxlags': 1, 'trend': 'c'}. 
[I 2024-09-25 17:13:03,526] Trial 19 finished with values: [1.0, 13.25030265487983, 0.0, 6.0, 8.162759457182233, 0.3333333333333333, 2.0, 136.4974065435998, 0.5] and parameters: {'ic': 'aic', 'maxlags': 5, 'trend': 'n'}. 
[I 2024-09-25 17:13:05,580] Trial 20 finished with values: [1.0, 7.731820228569565, 1.0, 6.0, 6.958186799618386, 1.0, 2.0, 735.6966091992978, 1.0] and parameters: {'ic': 'fpe', 'maxlags': 5, 'trend': 'c'}. 
[I 2024-09-25 17:13:07,275] Trial 21 finished with values: [4.0, 10.286366793503378, 0.3333333333333333, 19.0, 6.908960843500286, 0.6666666666666666, 1.0, 5147.49913912931, 1.0] and parameters: {'ic': 'fpe', 'maxlags': 1, 'trend': 'ct'}. 
[I 2024-09-25 17:13:09,016] Trial 22 finished with values: [2.0, 6.431731655602223, 1.0, 9.0, 6.290254971364516, 1.0, 2.0, 503.2675650256344, 1.0] and parameters: {'ic': 'fpe', 'maxlags': 4, 'trend': 'c'}. 
[I 2024-09-25 17:13:11,050] Trial 23 finished with values: [3.0, 11.83761072563694, 0.0, 6.0, 8.574961526133619, 0.3333333333333333, 2.0, 824.9671327472, 0.0] and parameters: {'ic': 'fpe', 'maxlags': 3, 'trend': 'n'}. 
