[I 2024-09-26 16:33:51,451] Trial 6 finished with values: [2.0, 5.453854828418051, 0.0, 5.0, 3.81230128900465, 0.0, 1.0, 1258.5790655425571, 1.0] and parameters: {'ic': 'aic', 'maxlags': 3, 'trend': 'ct'}. 
[I 2024-09-26 16:33:53,032] Trial 7 finished with values: [4.0, 11.297901629143524, 0.0, 7.0, 6.415156443110313, 0.0, 1.0, 83.2738612983226, 1.0] and parameters: {'ic': 'aic', 'maxlags': 3, 'trend': 'n'}. 
[I 2024-09-26 16:33:54,965] Trial 8 finished with values: [2.0, 13.9804901439203, 0.0, 5.0, 3.814542440054184, 0.3333333333333333, 1.0, 3615.46697548165, 1.0] and parameters: {'ic': 'fpe', 'maxlags': 4, 'trend': 'ctt'}. 
[I 2024-09-26 16:33:56,589] Trial 9 finished with values: [4.0, 11.96247647735765, 0.0, 2.0, 5.305795042797898, 0.0, 2.0, 188.44969385078053, 1.0] and parameters: {'ic': 'aic', 'maxlags': 1, 'trend': 'n'}. 
[I 2024-09-26 16:33:58,202] Trial 10 finished with values: [4.0, 11.96247647735765, 0.0, 2.0, 5.305795042797898, 0.0, 2.0, 188.44969385078053, 1.0] and parameters: {'ic': 'fpe', 'maxlags': 1, 'trend': 'n'}. 
[I 2024-09-26 16:34:00,129] Trial 11 finished with values: [2.0, 4.047439373967625, 1.0, 4.0, 3.0727189807581796, 1.0, 1.0, 171.97219739742877, 1.0] and parameters: {'ic': 'aic', 'maxlags': 5, 'trend': 'ct'}. 
[I 2024-09-26 16:34:01,706] Trial 12 finished with values: [2.0, 10.244034324644266, 0.3333333333333333, 6.0, 3.533433364238728, 0.3333333333333333, 1.0, 26.872840751822295, 1.0] and parameters: {'ic': 'aic', 'maxlags': 2, 'trend': 'ctt'}. 
[I 2024-09-26 16:34:03,315] Trial 13 finished with values: [4.0, 11.96247647735765, 0.0, 2.0, 5.305795042797898, 0.0, 2.0, 188.44969385078053, 1.0] and parameters: {'ic': 'fpe', 'maxlags': 1, 'trend': 'n'}. 
[I 2024-09-26 16:34:04,920] Trial 14 finished with values: [4.0, 10.764788542223993, 0.0, 7.0, 5.694447152535749, 0.0, 1.0, 135.65471108529113, 1.0] and parameters: {'ic': 'fpe', 'maxlags': 4, 'trend': 'n'}. 
[I 2024-09-26 16:34:06,844] Trial 15 finished with values: [4.0, 11.913839427013205, 0.0, 11.0, 9.080539472040208, 0.0, 3.0, 32.47717212197772, 0.0] and parameters: {'ic': 'fpe', 'maxlags': 2, 'trend': 'n'}. 
[I 2024-09-26 16:34:08,449] Trial 16 finished with values: [4.0, 11.96247647735765, 0.0, 2.0, 5.305795042797898, 0.0, 2.0, 188.44969385078053, 1.0] and parameters: {'ic': 'aic', 'maxlags': 1, 'trend': 'n'}. 
[I 2024-09-26 16:34:10,045] Trial 17 finished with values: [2.0, 4.814041745233088, 0.0, 4.0, 3.4097172851844273, 0.3333333333333333, 1.0, 315.27228225182785, 1.0] and parameters: {'ic': 'aic', 'maxlags': 4, 'trend': 'ct'}. 
[I 2024-09-26 16:34:11,955] Trial 18 finished with values: [2.0, 4.814041745233088, 0.0, 4.0, 3.4097172851844273, 0.3333333333333333, 1.0, 315.27228225182785, 1.0] and parameters: {'ic': 'fpe', 'maxlags': 4, 'trend': 'ct'}. 
[I 2024-09-26 16:34:13,579] Trial 19 finished with values: [2.0, 5.453854828418051, 0.0, 5.0, 3.81230128900465, 0.0, 1.0, 1258.5790655425571, 1.0] and parameters: {'ic': 'aic', 'maxlags': 3, 'trend': 'ct'}. 
[I 2024-09-26 16:34:15,204] Trial 20 finished with values: [2.0, 4.047439373967625, 1.0, 4.0, 3.0727189807581796, 1.0, 1.0, 171.97219739742877, 1.0] and parameters: {'ic': 'fpe', 'maxlags': 5, 'trend': 'ct'}. 
[I 2024-09-26 16:34:16,782] Trial 21 finished with values: [2.0, 10.244034324644266, 0.3333333333333333, 6.0, 3.533433364238728, 0.3333333333333333, 1.0, 26.872840751822295, 1.0] and parameters: {'ic': 'aic', 'maxlags': 2, 'trend': 'ctt'}. 
[I 2024-09-26 16:34:18,743] Trial 22 finished with values: [2.0, 3.836223658841035, 1.0, 4.0, 2.914026973466215, 1.0, 1.0, 62.581972861193854, 1.0] and parameters: {'ic': 'fpe', 'maxlags': 5, 'trend': 'c'}. 
[I 2024-09-26 16:34:20,351] Trial 23 finished with values: [2.0, 5.403960768095863, 1.0, 7.0, 2.792848652619879, 1.0, 1.0, 218.63508932637112, 1.0] and parameters: {'ic': 'fpe', 'maxlags': 1, 'trend': 'c'}. 
[I 2024-09-26 16:34:21,976] Trial 24 finished with values: [2.0, 4.047439373967625, 1.0, 4.0, 3.0727189807581796, 1.0, 1.0, 171.97219739742877, 1.0] and parameters: {'ic': 'fpe', 'maxlags': 5, 'trend': 'ct'}. 
[I 2024-09-26 16:34:37,809] A new study created in memory with name: LSTM predicting Belozyorov3DQuad(sigma=0.15)
SLURM auto-requeueing enabled. Setting signal handlers.
SLURM auto-requeueing enabled. Setting signal handlers.
SLURM auto-requeueing enabled. Setting signal handlers.
SLURM auto-requeueing enabled. Setting signal handlers.
SLURM auto-requeueing enabled. Setting signal handlers.
SLURM auto-requeueing enabled. Setting signal handlers.
SLURM auto-requeueing enabled. Setting signal handlers.
SLURM auto-requeueing enabled. Setting signal handlers.
SLURM auto-requeueing enabled. Setting signal handlers.
SLURM auto-requeueing enabled. Setting signal handlers.
SLURM auto-requeueing enabled. Setting signal handlers.
SLURM auto-requeueing enabled. Setting signal handlers.
SLURM auto-requeueing enabled. Setting signal handlers.
SLURM auto-requeueing enabled. Setting signal handlers.
SLURM auto-requeueing enabled. Setting signal handlers.
SLURM auto-requeueing enabled. Setting signal handlers.
SLURM auto-requeueing enabled. Setting signal handlers.
SLURM auto-requeueing enabled. Setting signal handlers.
SLURM auto-requeueing enabled. Setting signal handlers.
SLURM auto-requeueing enabled. Setting signal handlers.
[I 2024-09-26 16:46:06,527] Trial 0 finished with values: [4.0, 12.207618383806755, 0.0, 1.0, 5.621409748631085, 0.6666666666666666, 1.0, 33.46166630024153, 0.0] and parameters: {'h': 16, 'encoder_hidden_size': 200, 'encoder_n_layers': 4, 'context_size': 5, 'decoder_hidden_size': 512, 'learning_rate': 0.06134846253860898, 'max_steps': 500, 'batch_size': 16, 'random_seed': 1}. 
SLURM auto-requeueing enabled. Setting signal handlers.
SLURM auto-requeueing enabled. Setting signal handlers.
SLURM auto-requeueing enabled. Setting signal handlers.
SLURM auto-requeueing enabled. Setting signal handlers.
SLURM auto-requeueing enabled. Setting signal handlers.
SLURM auto-requeueing enabled. Setting signal handlers.
SLURM auto-requeueing enabled. Setting signal handlers.
SLURM auto-requeueing enabled. Setting signal handlers.
SLURM auto-requeueing enabled. Setting signal handlers.
SLURM auto-requeueing enabled. Setting signal handlers.
SLURM auto-requeueing enabled. Setting signal handlers.
SLURM auto-requeueing enabled. Setting signal handlers.
SLURM auto-requeueing enabled. Setting signal handlers.
SLURM auto-requeueing enabled. Setting signal handlers.
SLURM auto-requeueing enabled. Setting signal handlers.
SLURM auto-requeueing enabled. Setting signal handlers.
SLURM auto-requeueing enabled. Setting signal handlers.
SLURM auto-requeueing enabled. Setting signal handlers.
SLURM auto-requeueing enabled. Setting signal handlers.
SLURM auto-requeueing enabled. Setting signal handlers.
SLURM auto-requeueing enabled. Setting signal handlers.
SLURM auto-requeueing enabled. Setting signal handlers.
SLURM auto-requeueing enabled. Setting signal handlers.
SLURM auto-requeueing enabled. Setting signal handlers.
SLURM auto-requeueing enabled. Setting signal handlers.
SLURM auto-requeueing enabled. Setting signal handlers.
SLURM auto-requeueing enabled. Setting signal handlers.
SLURM auto-requeueing enabled. Setting signal handlers.
SLURM auto-requeueing enabled. Setting signal handlers.
SLURM auto-requeueing enabled. Setting signal handlers.
SLURM auto-requeueing enabled. Setting signal handlers.
[I 2024-09-26 16:46:50,257] Trial 1 finished with values: [4.0, 12.305739385141448, 0.0, 16.0, 3.839248512199928, 1.0, 1.0, 26.02066019758182, 0.0] and parameters: {'h': 9, 'encoder_hidden_size': 100, 'encoder_n_layers': 2, 'context_size': 50, 'decoder_hidden_size': 512, 'learning_rate': 0.0004966000755064771, 'max_steps': 500, 'batch_size': 32, 'random_seed': 13}. 
SLURM auto-requeueing enabled. Setting signal handlers.
SLURM auto-requeueing enabled. Setting signal handlers.
SLURM auto-requeueing enabled. Setting signal handlers.
SLURM auto-requeueing enabled. Setting signal handlers.
SLURM auto-requeueing enabled. Setting signal handlers.
SLURM auto-requeueing enabled. Setting signal handlers.
SLURM auto-requeueing enabled. Setting signal handlers.
SLURM auto-requeueing enabled. Setting signal handlers.
SLURM auto-requeueing enabled. Setting signal handlers.
SLURM auto-requeueing enabled. Setting signal handlers.
SLURM auto-requeueing enabled. Setting signal handlers.
SLURM auto-requeueing enabled. Setting signal handlers.
SLURM auto-requeueing enabled. Setting signal handlers.
SLURM auto-requeueing enabled. Setting signal handlers.
SLURM auto-requeueing enabled. Setting signal handlers.
SLURM auto-requeueing enabled. Setting signal handlers.
SLURM auto-requeueing enabled. Setting signal handlers.
SLURM auto-requeueing enabled. Setting signal handlers.
SLURM auto-requeueing enabled. Setting signal handlers.
SLURM auto-requeueing enabled. Setting signal handlers.
SLURM auto-requeueing enabled. Setting signal handlers.
SLURM auto-requeueing enabled. Setting signal handlers.
SLURM auto-requeueing enabled. Setting signal handlers.
SLURM auto-requeueing enabled. Setting signal handlers.
SLURM auto-requeueing enabled. Setting signal handlers.
SLURM auto-requeueing enabled. Setting signal handlers.
SLURM auto-requeueing enabled. Setting signal handlers.
SLURM auto-requeueing enabled. Setting signal handlers.
SLURM auto-requeueing enabled. Setting signal handlers.
SLURM auto-requeueing enabled. Setting signal handlers.
SLURM auto-requeueing enabled. Setting signal handlers.
SLURM auto-requeueing enabled. Setting signal handlers.
SLURM auto-requeueing enabled. Setting signal handlers.
SLURM auto-requeueing enabled. Setting signal handlers.
SLURM auto-requeueing enabled. Setting signal handlers.
SLURM auto-requeueing enabled. Setting signal handlers.
SLURM auto-requeueing enabled. Setting signal handlers.
SLURM auto-requeueing enabled. Setting signal handlers.
[I 2024-09-26 16:47:15,993] Trial 2 finished with values: [5.0, 12.095624808603912, 0.0, 9.0, 5.438935286659513, 1.0, 1.0, 25.89943623499004, 0.0] and parameters: {'h': 7, 'encoder_hidden_size': 100, 'encoder_n_layers': 2, 'context_size': 5, 'decoder_hidden_size': 128, 'learning_rate': 0.004308095457879819, 'max_steps': 500, 'batch_size': 16, 'random_seed': 19}. 
SLURM auto-requeueing enabled. Setting signal handlers.
SLURM auto-requeueing enabled. Setting signal handlers.
SLURM auto-requeueing enabled. Setting signal handlers.
SLURM auto-requeueing enabled. Setting signal handlers.
SLURM auto-requeueing enabled. Setting signal handlers.
SLURM auto-requeueing enabled. Setting signal handlers.
SLURM auto-requeueing enabled. Setting signal handlers.
SLURM auto-requeueing enabled. Setting signal handlers.
SLURM auto-requeueing enabled. Setting signal handlers.
SLURM auto-requeueing enabled. Setting signal handlers.
SLURM auto-requeueing enabled. Setting signal handlers.
SLURM auto-requeueing enabled. Setting signal handlers.
SLURM auto-requeueing enabled. Setting signal handlers.
SLURM auto-requeueing enabled. Setting signal handlers.
SLURM auto-requeueing enabled. Setting signal handlers.
SLURM auto-requeueing enabled. Setting signal handlers.
SLURM auto-requeueing enabled. Setting signal handlers.
SLURM auto-requeueing enabled. Setting signal handlers.
SLURM auto-requeueing enabled. Setting signal handlers.
SLURM auto-requeueing enabled. Setting signal handlers.
[I 2024-09-26 16:49:41,394] Trial 3 finished with values: [3.0, 12.109348960581219, 0.0, 15.0, 4.351868391102609, 1.0, 1.0, 22.17827704443001, 0.0] and parameters: {'h': 16, 'encoder_hidden_size': 200, 'encoder_n_layers': 3, 'context_size': 5, 'decoder_hidden_size': 128, 'learning_rate': 0.0003265760225699312, 'max_steps': 1000, 'batch_size': 16, 'random_seed': 17}. 
SLURM auto-requeueing enabled. Setting signal handlers.
SLURM auto-requeueing enabled. Setting signal handlers.
SLURM auto-requeueing enabled. Setting signal handlers.
SLURM auto-requeueing enabled. Setting signal handlers.
SLURM auto-requeueing enabled. Setting signal handlers.
SLURM auto-requeueing enabled. Setting signal handlers.
SLURM auto-requeueing enabled. Setting signal handlers.
SLURM auto-requeueing enabled. Setting signal handlers.
SLURM auto-requeueing enabled. Setting signal handlers.
SLURM auto-requeueing enabled. Setting signal handlers.
SLURM auto-requeueing enabled. Setting signal handlers.
SLURM auto-requeueing enabled. Setting signal handlers.
SLURM auto-requeueing enabled. Setting signal handlers.
SLURM auto-requeueing enabled. Setting signal handlers.
SLURM auto-requeueing enabled. Setting signal handlers.
SLURM auto-requeueing enabled. Setting signal handlers.
SLURM auto-requeueing enabled. Setting signal handlers.
SLURM auto-requeueing enabled. Setting signal handlers.
SLURM auto-requeueing enabled. Setting signal handlers.
SLURM auto-requeueing enabled. Setting signal handlers.
[I 2024-09-26 16:50:06,733] Trial 4 finished with values: [1.0, 12.22769711192106, 0.0, 17.0, 4.536278338801473, 1.0, 1.0, 25.62795235123679, 0.0] and parameters: {'h': 16, 'encoder_hidden_size': 50, 'encoder_n_layers': 4, 'context_size': 10, 'decoder_hidden_size': 128, 'learning_rate': 0.0024478294479538085, 'max_steps': 500, 'batch_size': 16, 'random_seed': 11}. 
SLURM auto-requeueing enabled. Setting signal handlers.
SLURM auto-requeueing enabled. Setting signal handlers.
SLURM auto-requeueing enabled. Setting signal handlers.
SLURM auto-requeueing enabled. Setting signal handlers.
SLURM auto-requeueing enabled. Setting signal handlers.
SLURM auto-requeueing enabled. Setting signal handlers.
SLURM auto-requeueing enabled. Setting signal handlers.
SLURM auto-requeueing enabled. Setting signal handlers.
SLURM auto-requeueing enabled. Setting signal handlers.
SLURM auto-requeueing enabled. Setting signal handlers.
SLURM auto-requeueing enabled. Setting signal handlers.
SLURM auto-requeueing enabled. Setting signal handlers.
SLURM auto-requeueing enabled. Setting signal handlers.
SLURM auto-requeueing enabled. Setting signal handlers.
SLURM auto-requeueing enabled. Setting signal handlers.
SLURM auto-requeueing enabled. Setting signal handlers.
SLURM auto-requeueing enabled. Setting signal handlers.
SLURM auto-requeueing enabled. Setting signal handlers.
SLURM auto-requeueing enabled. Setting signal handlers.
SLURM auto-requeueing enabled. Setting signal handlers.
SLURM auto-requeueing enabled. Setting signal handlers.
SLURM auto-requeueing enabled. Setting signal handlers.
SLURM auto-requeueing enabled. Setting signal handlers.
SLURM auto-requeueing enabled. Setting signal handlers.
SLURM auto-requeueing enabled. Setting signal handlers.
SLURM auto-requeueing enabled. Setting signal handlers.
SLURM auto-requeueing enabled. Setting signal handlers.
SLURM auto-requeueing enabled. Setting signal handlers.
SLURM auto-requeueing enabled. Setting signal handlers.
SLURM auto-requeueing enabled. Setting signal handlers.
SLURM auto-requeueing enabled. Setting signal handlers.
SLURM auto-requeueing enabled. Setting signal handlers.
SLURM auto-requeueing enabled. Setting signal handlers.
SLURM auto-requeueing enabled. Setting signal handlers.
SLURM auto-requeueing enabled. Setting signal handlers.
SLURM auto-requeueing enabled. Setting signal handlers.
SLURM auto-requeueing enabled. Setting signal handlers.
SLURM auto-requeueing enabled. Setting signal handlers.
[I 2024-09-26 16:50:36,684] Trial 5 finished with values: [4.0, 12.291665295679236, 0.0, 20.0, 4.126262226273219, 1.0, 1.0, 28.25912340291642, 0.0] and parameters: {'h': 7, 'encoder_hidden_size': 50, 'encoder_n_layers': 4, 'context_size': 50, 'decoder_hidden_size': 256, 'learning_rate': 0.0001943414527920147, 'max_steps': 500, 'batch_size': 32, 'random_seed': 8}. 
SLURM auto-requeueing enabled. Setting signal handlers.
SLURM auto-requeueing enabled. Setting signal handlers.
SLURM auto-requeueing enabled. Setting signal handlers.
SLURM auto-requeueing enabled. Setting signal handlers.
SLURM auto-requeueing enabled. Setting signal handlers.
SLURM auto-requeueing enabled. Setting signal handlers.
SLURM auto-requeueing enabled. Setting signal handlers.
SLURM auto-requeueing enabled. Setting signal handlers.
SLURM auto-requeueing enabled. Setting signal handlers.
SLURM auto-requeueing enabled. Setting signal handlers.
SLURM auto-requeueing enabled. Setting signal handlers.
SLURM auto-requeueing enabled. Setting signal handlers.
SLURM auto-requeueing enabled. Setting signal handlers.
SLURM auto-requeueing enabled. Setting signal handlers.
SLURM auto-requeueing enabled. Setting signal handlers.
SLURM auto-requeueing enabled. Setting signal handlers.
SLURM auto-requeueing enabled. Setting signal handlers.
SLURM auto-requeueing enabled. Setting signal handlers.
SLURM auto-requeueing enabled. Setting signal handlers.
SLURM auto-requeueing enabled. Setting signal handlers.
SLURM auto-requeueing enabled. Setting signal handlers.
SLURM auto-requeueing enabled. Setting signal handlers.
SLURM auto-requeueing enabled. Setting signal handlers.
SLURM auto-requeueing enabled. Setting signal handlers.
SLURM auto-requeueing enabled. Setting signal handlers.
SLURM auto-requeueing enabled. Setting signal handlers.
SLURM auto-requeueing enabled. Setting signal handlers.
SLURM auto-requeueing enabled. Setting signal handlers.
SLURM auto-requeueing enabled. Setting signal handlers.
SLURM auto-requeueing enabled. Setting signal handlers.
SLURM auto-requeueing enabled. Setting signal handlers.
SLURM auto-requeueing enabled. Setting signal handlers.
SLURM auto-requeueing enabled. Setting signal handlers.
SLURM auto-requeueing enabled. Setting signal handlers.
SLURM auto-requeueing enabled. Setting signal handlers.
SLURM auto-requeueing enabled. Setting signal handlers.
SLURM auto-requeueing enabled. Setting signal handlers.
SLURM auto-requeueing enabled. Setting signal handlers.
[I 2024-09-26 16:51:28,043] Trial 6 finished with values: [5.0, 12.293886790676638, 0.0, 15.0, 6.1852814980662, 1.0, 2.0, 27.715397645771187, 0.0] and parameters: {'h': 7, 'encoder_hidden_size': 300, 'encoder_n_layers': 1, 'context_size': 50, 'decoder_hidden_size': 128, 'learning_rate': 0.0012255204314049616, 'max_steps': 500, 'batch_size': 32, 'random_seed': 5}. 
SLURM auto-requeueing enabled. Setting signal handlers.
SLURM auto-requeueing enabled. Setting signal handlers.
SLURM auto-requeueing enabled. Setting signal handlers.
SLURM auto-requeueing enabled. Setting signal handlers.
SLURM auto-requeueing enabled. Setting signal handlers.
SLURM auto-requeueing enabled. Setting signal handlers.
SLURM auto-requeueing enabled. Setting signal handlers.
SLURM auto-requeueing enabled. Setting signal handlers.
SLURM auto-requeueing enabled. Setting signal handlers.
SLURM auto-requeueing enabled. Setting signal handlers.
SLURM auto-requeueing enabled. Setting signal handlers.
SLURM auto-requeueing enabled. Setting signal handlers.
SLURM auto-requeueing enabled. Setting signal handlers.
SLURM auto-requeueing enabled. Setting signal handlers.
SLURM auto-requeueing enabled. Setting signal handlers.
SLURM auto-requeueing enabled. Setting signal handlers.
SLURM auto-requeueing enabled. Setting signal handlers.
SLURM auto-requeueing enabled. Setting signal handlers.
SLURM auto-requeueing enabled. Setting signal handlers.
SLURM auto-requeueing enabled. Setting signal handlers.
SLURM auto-requeueing enabled. Setting signal handlers.
SLURM auto-requeueing enabled. Setting signal handlers.
SLURM auto-requeueing enabled. Setting signal handlers.
SLURM auto-requeueing enabled. Setting signal handlers.
SLURM auto-requeueing enabled. Setting signal handlers.
SLURM auto-requeueing enabled. Setting signal handlers.
SLURM auto-requeueing enabled. Setting signal handlers.
SLURM auto-requeueing enabled. Setting signal handlers.
SLURM auto-requeueing enabled. Setting signal handlers.
SLURM auto-requeueing enabled. Setting signal handlers.
SLURM auto-requeueing enabled. Setting signal handlers.
SLURM auto-requeueing enabled. Setting signal handlers.
SLURM auto-requeueing enabled. Setting signal handlers.
SLURM auto-requeueing enabled. Setting signal handlers.
SLURM auto-requeueing enabled. Setting signal handlers.
SLURM auto-requeueing enabled. Setting signal handlers.
SLURM auto-requeueing enabled. Setting signal handlers.
SLURM auto-requeueing enabled. Setting signal handlers.
SLURM auto-requeueing enabled. Setting signal handlers.
SLURM auto-requeueing enabled. Setting signal handlers.
SLURM auto-requeueing enabled. Setting signal handlers.
SLURM auto-requeueing enabled. Setting signal handlers.
SLURM auto-requeueing enabled. Setting signal handlers.
SLURM auto-requeueing enabled. Setting signal handlers.
SLURM auto-requeueing enabled. Setting signal handlers.
SLURM auto-requeueing enabled. Setting signal handlers.
SLURM auto-requeueing enabled. Setting signal handlers.
SLURM auto-requeueing enabled. Setting signal handlers.
SLURM auto-requeueing enabled. Setting signal handlers.
SLURM auto-requeueing enabled. Setting signal handlers.
SLURM auto-requeueing enabled. Setting signal handlers.
SLURM auto-requeueing enabled. Setting signal handlers.
