[I 2024-09-26 07:11:34,477] Trial 22 finished with values: [1.0, 1.1118400528405203, 0.1, 1.0, 0.9120236428108908, 0.2, 1.0, 1.4927747853762454, 0.1111111111111111] and parameters: {'h': 3, 'n_pool_kernel_size': [1, 1, 1], 'n_freq_downsample': [180, 60, 1], 'learning_rate': 0.0003528696031503741, 'scaler_type': 'standard', 'max_steps': 500.0, 'batch_size': 256, 'windows_batch_size': 1024, 'random_seed': 2}. 
SLURM auto-requeueing enabled. Setting signal handlers.
SLURM auto-requeueing enabled. Setting signal handlers.
SLURM auto-requeueing enabled. Setting signal handlers.
SLURM auto-requeueing enabled. Setting signal handlers.
SLURM auto-requeueing enabled. Setting signal handlers.
SLURM auto-requeueing enabled. Setting signal handlers.
SLURM auto-requeueing enabled. Setting signal handlers.
SLURM auto-requeueing enabled. Setting signal handlers.
SLURM auto-requeueing enabled. Setting signal handlers.
SLURM auto-requeueing enabled. Setting signal handlers.
SLURM auto-requeueing enabled. Setting signal handlers.
SLURM auto-requeueing enabled. Setting signal handlers.
SLURM auto-requeueing enabled. Setting signal handlers.
SLURM auto-requeueing enabled. Setting signal handlers.
SLURM auto-requeueing enabled. Setting signal handlers.
SLURM auto-requeueing enabled. Setting signal handlers.
SLURM auto-requeueing enabled. Setting signal handlers.
SLURM auto-requeueing enabled. Setting signal handlers.
SLURM auto-requeueing enabled. Setting signal handlers.
SLURM auto-requeueing enabled. Setting signal handlers.
SLURM auto-requeueing enabled. Setting signal handlers.
SLURM auto-requeueing enabled. Setting signal handlers.
SLURM auto-requeueing enabled. Setting signal handlers.
SLURM auto-requeueing enabled. Setting signal handlers.
SLURM auto-requeueing enabled. Setting signal handlers.
SLURM auto-requeueing enabled. Setting signal handlers.
SLURM auto-requeueing enabled. Setting signal handlers.
SLURM auto-requeueing enabled. Setting signal handlers.
SLURM auto-requeueing enabled. Setting signal handlers.
SLURM auto-requeueing enabled. Setting signal handlers.
SLURM auto-requeueing enabled. Setting signal handlers.
SLURM auto-requeueing enabled. Setting signal handlers.
SLURM auto-requeueing enabled. Setting signal handlers.
SLURM auto-requeueing enabled. Setting signal handlers.
SLURM auto-requeueing enabled. Setting signal handlers.
SLURM auto-requeueing enabled. Setting signal handlers.
SLURM auto-requeueing enabled. Setting signal handlers.
SLURM auto-requeueing enabled. Setting signal handlers.
SLURM auto-requeueing enabled. Setting signal handlers.
SLURM auto-requeueing enabled. Setting signal handlers.
SLURM auto-requeueing enabled. Setting signal handlers.
SLURM auto-requeueing enabled. Setting signal handlers.
SLURM auto-requeueing enabled. Setting signal handlers.
SLURM auto-requeueing enabled. Setting signal handlers.
SLURM auto-requeueing enabled. Setting signal handlers.
SLURM auto-requeueing enabled. Setting signal handlers.
SLURM auto-requeueing enabled. Setting signal handlers.
SLURM auto-requeueing enabled. Setting signal handlers.
SLURM auto-requeueing enabled. Setting signal handlers.
SLURM auto-requeueing enabled. Setting signal handlers.
SLURM auto-requeueing enabled. Setting signal handlers.
SLURM auto-requeueing enabled. Setting signal handlers.
SLURM auto-requeueing enabled. Setting signal handlers.
SLURM auto-requeueing enabled. Setting signal handlers.
SLURM auto-requeueing enabled. Setting signal handlers.
SLURM auto-requeueing enabled. Setting signal handlers.
SLURM auto-requeueing enabled. Setting signal handlers.
SLURM auto-requeueing enabled. Setting signal handlers.
SLURM auto-requeueing enabled. Setting signal handlers.
SLURM auto-requeueing enabled. Setting signal handlers.
SLURM auto-requeueing enabled. Setting signal handlers.
SLURM auto-requeueing enabled. Setting signal handlers.
SLURM auto-requeueing enabled. Setting signal handlers.
SLURM auto-requeueing enabled. Setting signal handlers.
SLURM auto-requeueing enabled. Setting signal handlers.
SLURM auto-requeueing enabled. Setting signal handlers.
SLURM auto-requeueing enabled. Setting signal handlers.
SLURM auto-requeueing enabled. Setting signal handlers.
SLURM auto-requeueing enabled. Setting signal handlers.
SLURM auto-requeueing enabled. Setting signal handlers.
SLURM auto-requeueing enabled. Setting signal handlers.
SLURM auto-requeueing enabled. Setting signal handlers.
SLURM auto-requeueing enabled. Setting signal handlers.
SLURM auto-requeueing enabled. Setting signal handlers.
SLURM auto-requeueing enabled. Setting signal handlers.
SLURM auto-requeueing enabled. Setting signal handlers.
SLURM auto-requeueing enabled. Setting signal handlers.
SLURM auto-requeueing enabled. Setting signal handlers.
SLURM auto-requeueing enabled. Setting signal handlers.
SLURM auto-requeueing enabled. Setting signal handlers.
SLURM auto-requeueing enabled. Setting signal handlers.
SLURM auto-requeueing enabled. Setting signal handlers.
SLURM auto-requeueing enabled. Setting signal handlers.
SLURM auto-requeueing enabled. Setting signal handlers.
SLURM auto-requeueing enabled. Setting signal handlers.
SLURM auto-requeueing enabled. Setting signal handlers.
SLURM auto-requeueing enabled. Setting signal handlers.
SLURM auto-requeueing enabled. Setting signal handlers.
SLURM auto-requeueing enabled. Setting signal handlers.
SLURM auto-requeueing enabled. Setting signal handlers.
SLURM auto-requeueing enabled. Setting signal handlers.
SLURM auto-requeueing enabled. Setting signal handlers.
SLURM auto-requeueing enabled. Setting signal handlers.
SLURM auto-requeueing enabled. Setting signal handlers.
SLURM auto-requeueing enabled. Setting signal handlers.
SLURM auto-requeueing enabled. Setting signal handlers.
SLURM auto-requeueing enabled. Setting signal handlers.
SLURM auto-requeueing enabled. Setting signal handlers.
SLURM auto-requeueing enabled. Setting signal handlers.
SLURM auto-requeueing enabled. Setting signal handlers.
SLURM auto-requeueing enabled. Setting signal handlers.
SLURM auto-requeueing enabled. Setting signal handlers.
SLURM auto-requeueing enabled. Setting signal handlers.
SLURM auto-requeueing enabled. Setting signal handlers.
SLURM auto-requeueing enabled. Setting signal handlers.
SLURM auto-requeueing enabled. Setting signal handlers.
SLURM auto-requeueing enabled. Setting signal handlers.
SLURM auto-requeueing enabled. Setting signal handlers.
SLURM auto-requeueing enabled. Setting signal handlers.
SLURM auto-requeueing enabled. Setting signal handlers.
SLURM auto-requeueing enabled. Setting signal handlers.
SLURM auto-requeueing enabled. Setting signal handlers.
SLURM auto-requeueing enabled. Setting signal handlers.
SLURM auto-requeueing enabled. Setting signal handlers.
SLURM auto-requeueing enabled. Setting signal handlers.
SLURM auto-requeueing enabled. Setting signal handlers.
SLURM auto-requeueing enabled. Setting signal handlers.
SLURM auto-requeueing enabled. Setting signal handlers.
SLURM auto-requeueing enabled. Setting signal handlers.
SLURM auto-requeueing enabled. Setting signal handlers.
SLURM auto-requeueing enabled. Setting signal handlers.
SLURM auto-requeueing enabled. Setting signal handlers.
SLURM auto-requeueing enabled. Setting signal handlers.
SLURM auto-requeueing enabled. Setting signal handlers.
SLURM auto-requeueing enabled. Setting signal handlers.
SLURM auto-requeueing enabled. Setting signal handlers.
SLURM auto-requeueing enabled. Setting signal handlers.
[I 2024-09-26 07:17:13,794] Trial 23 finished with values: [1.0, 0.973644947186567, 0.7, 1.0, 0.8664830008215322, 0.9, 1.0, 1.667783980722577, 0.8888888888888888] and parameters: {'h': 2, 'n_pool_kernel_size': [2, 2, 1], 'n_freq_downsample': [1, 1, 1], 'learning_rate': 0.006404494169737934, 'scaler_type': None, 'max_steps': 1100.0, 'batch_size': 256, 'windows_batch_size': 512, 'random_seed': 4}. 
SLURM auto-requeueing enabled. Setting signal handlers.
SLURM auto-requeueing enabled. Setting signal handlers.
SLURM auto-requeueing enabled. Setting signal handlers.
SLURM auto-requeueing enabled. Setting signal handlers.
SLURM auto-requeueing enabled. Setting signal handlers.
SLURM auto-requeueing enabled. Setting signal handlers.
SLURM auto-requeueing enabled. Setting signal handlers.
SLURM auto-requeueing enabled. Setting signal handlers.
SLURM auto-requeueing enabled. Setting signal handlers.
SLURM auto-requeueing enabled. Setting signal handlers.
SLURM auto-requeueing enabled. Setting signal handlers.
SLURM auto-requeueing enabled. Setting signal handlers.
SLURM auto-requeueing enabled. Setting signal handlers.
SLURM auto-requeueing enabled. Setting signal handlers.
SLURM auto-requeueing enabled. Setting signal handlers.
SLURM auto-requeueing enabled. Setting signal handlers.
SLURM auto-requeueing enabled. Setting signal handlers.
SLURM auto-requeueing enabled. Setting signal handlers.
SLURM auto-requeueing enabled. Setting signal handlers.
SLURM auto-requeueing enabled. Setting signal handlers.
SLURM auto-requeueing enabled. Setting signal handlers.
SLURM auto-requeueing enabled. Setting signal handlers.
SLURM auto-requeueing enabled. Setting signal handlers.
SLURM auto-requeueing enabled. Setting signal handlers.
SLURM auto-requeueing enabled. Setting signal handlers.
[I 2024-09-26 07:26:42,041] Trial 24 finished with values: [1.0, 1.2706308576866878, 0.1, 1.0, 0.9149963837486027, 0.2, 1.0, 3.1705474620289436, 0.1111111111111111] and parameters: {'h': 12, 'n_pool_kernel_size': [4, 4, 4], 'n_freq_downsample': [40, 20, 1], 'learning_rate': 0.0012063787456991723, 'scaler_type': 'robust', 'max_steps': 1100.0, 'batch_size': 32, 'windows_batch_size': 1024, 'random_seed': 16}. 
[I 2024-09-26 07:26:54,303] A new study created in memory with name: ResComp predicting coupled_logistic_map(sigma=0.10)
/nas/longleaf/home/djpassey/.local/lib/python3.9/site-packages/scipy/integrate/_odepack_py.py:248: ODEintWarning: Excess work done on this call (perhaps wrong Dfun type). Run with full_output = 1 to get quantitative information.
  warnings.warn(warning_msg, ODEintWarning)
/nas/longleaf/home/djpassey/.local/lib/python3.9/site-packages/interfere/methods/reservoir_computer.py:378: RuntimeWarning: overflow encountered in matmul
  self.Rhat_ += states.T @ states
/nas/longleaf/home/djpassey/.local/lib/python3.9/site-packages/scipy/integrate/_odepack_py.py:248: ODEintWarning: Excess accuracy requested (tolerances too small). Run with full_output = 1 to get quantitative information.
  warnings.warn(warning_msg, ODEintWarning)
/nas/longleaf/home/djpassey/.local/lib/python3.9/site-packages/scipy/stats/_axis_nan_policy.py:551: RuntimeWarning: Precision loss occurred in moment calculation due to catastrophic cancellation. This occurs when the data are nearly identical. Results may be unreliable.
  res = hypotest_fun_out(*samples, axis=axis, **kwds)
[I 2024-09-26 07:27:02,688] Trial 0 finished with values: [0.0, 3082259373.528738, 0.0, 0.0, 2853036471.1375813, 0.0, 0.0, 3533733938.977523, 0.1111111111111111] and parameters: {'gamma': 165.96074952234702, 'sigma': 37.182066866800845, 'delta': 39.48570989141348, 'mean_degree': 3.956902004798726, 'res_sz': 12, 'window': 57.84519148289606, 'spect_rad': 7.92400957731237, 'ridge_alpha': 9.799809584713297e-07}. 
[I 2024-09-26 07:27:15,584] Trial 1 finished with values: [1.0, 33.76115371659174, 0.7, 1.0, 0.9411435662269183, 0.5, 1.0, 1.4704370545543233, 0.2222222222222222] and parameters: {'gamma': 390.61207953843973, 'sigma': 26.922645347908922, 'delta': 96.95172366667535, 'mean_degree': 3.6162045038509603, 'res_sz': 31, 'window': 1.175839707674512, 'spect_rad': 0.11719110898523684, 'ridge_alpha': 5.415051641063738e-09}. 
[I 2024-09-26 07:27:25,941] Trial 2 finished with values: [1.0, 1.1250884288131264, 0.4, 1.0, 1.0388099336254186, 0.4, 1.0, 1.3251065332776122, 0.4444444444444444] and parameters: {'gamma': 279.6898688207942, 'sigma': 6.853917603769542, 'delta': 21.64373344686827, 'mean_degree': 2.5950646267840307, 'res_sz': 53, 'window': 0.01506506429987033, 'spect_rad': 0.0017758909700003765, 'ridge_alpha': 26.498916826465553}. 
[I 2024-09-26 07:27:35,877] Trial 3 finished with values: [4.0, 0.8799353318536324, 0.5, 2.0, 0.8590066009855235, 0.5, 0.0, 1.2728399935065844, 0.4444444444444444] and parameters: {'gamma': 384.8895224766523, 'sigma': 4.359750054181432, 'delta': 95.74808153151446, 'mean_degree': 3.9077420583587696, 'res_sz': 10, 'window': 0.0015999417993372439, 'spect_rad': 7.314244916018979, 'ridge_alpha': 4.588341139481848e-10}. 
[I 2024-09-26 07:27:47,150] Trial 4 finished with values: [1.0, 2.0379754099252434, 0.0, 1.0, 902209349.6769817, 1.0, 0.0, 1117464789.193375, 0.5555555555555556] and parameters: {'gamma': 76.64202954623667, 'sigma': 70.98427803552889, 'delta': 32.74204024225569, 'mean_degree': 4.355260991395308, 'res_sz': 93, 'window': 0.0020499191171974187, 'spect_rad': 0.0016507255562264538, 'ridge_alpha': 2.6004107918890792e-09}. 
[I 2024-09-26 07:27:58,785] Trial 5 finished with values: [1.0, 1.1224143119645458, 0.3, 1.0, 0.925343064183088, 0.3, 1.0, 1.7350408609141927, 0.1111111111111111] and parameters: {'gamma': 342.2672869798763, 'sigma': 99.08702498647226, 'delta': 55.891616942168945, 'mean_degree': 4.818475828203805, 'res_sz': 54, 'window': 0.0015240761367282735, 'spect_rad': 0.0017175935346450811, 'ridge_alpha': 1.6332881521282201e-07}. 
/nas/longleaf/home/djpassey/.local/lib/python3.9/site-packages/interfere/methods/reservoir_computer.py:480: RuntimeWarning: overflow encountered in matmul
  pred = self.W_out_ @ states.T
/nas/longleaf/home/djpassey/.local/lib/python3.9/site-packages/interfere/methods/reservoir_computer.py:480: RuntimeWarning: invalid value encountered in matmul
  pred = self.W_out_ @ states.T
[I 2024-09-26 07:28:09,288] Trial 6 finished with values: [1.0, 2366631464.2675185, 0.0, 0.0, 806960574.3292278, 1.0, 0.0, 999490892.425561, 0.5555555555555556] and parameters: {'gamma': 384.59766653252916, 'sigma': 42.711906633493875, 'delta': 57.101643558815596, 'mean_degree': 0.18980571087682716, 'res_sz': 92, 'window': 0.01208776533743566, 'spect_rad': 0.005050080092666649, 'ridge_alpha': 2.741055539680181e-08}. 
[I 2024-09-26 07:28:19,605] Trial 7 finished with values: [1.0, 2478616974.6121416, 0.0, 1.0, 267.7081563037766, 0.1, 0.0, 632.1263284712793, 0.4444444444444444] and parameters: {'gamma': 289.17861302048317, 'sigma': 57.17985094523888, 'delta': 65.99238820920154, 'mean_degree': 4.4737618172257205, 'res_sz': 80, 'window': 0.05496844584563906, 'spect_rad': 3.1611285356915966, 'ridge_alpha': 1.9696396727959745e-07}. 
[I 2024-09-26 07:28:29,746] Trial 8 finished with values: [1.0, 1.3955088843681451, 0.0, 1.0, 1.0312089705634988, 0.0, 0.0, 1.4556083917882827, 0.2222222222222222] and parameters: {'gamma': 329.6358985483629, 'sigma': 47.319575272067134, 'delta': 78.40151271003093, 'mean_degree': 4.154190880225953, 'res_sz': 24, 'window': 0.2085471514323378, 'spect_rad': 0.1227903067338201, 'ridge_alpha': 2.718101626148723e-10}. 
[I 2024-09-26 07:28:34,853] Trial 9 finished with values: [0.0, 3082259373.528738, 0.0, 0.0, 2853036471.1375813, 0.0, 0.0, 3533733938.977523, 0.1111111111111111] and parameters: {'gamma': 480.76471949192467, 'sigma': 98.56867257537286, 'delta': 58.01491629533481, 'mean_degree': 0.6217439517182924, 'res_sz': 20, 'window': 52.65306019254835, 'spect_rad': 0.01319071586991388, 'ridge_alpha': 4.910543996733648e-07}. 
[I 2024-09-26 07:28:48,360] Trial 10 finished with values: [0.0, 1.331259297382481, 0.2, 2.0, 0.9842480464731292, 0.3, 1.0, 1.442230781688147, 0.1111111111111111] and parameters: {'gamma': 325.4624596102181, 'sigma': 68.31313808571446, 'delta': 51.1996749859652, 'mean_degree': 3.478144194305356, 'res_sz': 30, 'window': 1.1734840018439014, 'spect_rad': 0.4412606127799633, 'ridge_alpha': 0.1929477850864217}. 
[I 2024-09-26 07:28:58,776] Trial 11 finished with values: [2.0, 2722177771.502239, 0.0, 1.0, 2.932683758561648, 0.2, 0.0, 15.203467606537782, 0.2222222222222222] and parameters: {'gamma': 182.6689754081611, 'sigma': 54.86515953501655, 'delta': 87.9710870628705, 'mean_degree': 2.885627891653825, 'res_sz': 66, 'window': 2.572041250140973, 'spect_rad': 94.67285704131154, 'ridge_alpha': 0.0011453000531630893}. 
/nas/longleaf/home/djpassey/.local/lib/python3.9/site-packages/interfere/methods/reservoir_computer.py:378: RuntimeWarning: invalid value encountered in add
  self.Rhat_ += states.T @ states
[I 2024-09-26 07:29:05,168] Trial 12 finished with values: [0.0, 3082259373.528738, 0.0, 0.0, 2853036471.1375813, 0.0, 2.0, 865584503.7624418, 0.5555555555555556] and parameters: {'gamma': 221.2800219490825, 'sigma': 31.054052927658603, 'delta': 88.48180400616525, 'mean_degree': 2.5779926212692357, 'res_sz': 95, 'window': 9.186663266692081, 'spect_rad': 75.2294426778101, 'ridge_alpha': 7.96045773562021e-06}. 
[I 2024-09-26 07:29:15,509] Trial 13 finished with values: [1.0, 3061642022.5749707, 0.0, 1.0, 1.4923117278367046, 0.3, 0.0, 1.4547256670289233, 0.3333333333333333] and parameters: {'gamma': 167.59915576110518, 'sigma': 37.70865137215232, 'delta': 92.23426487623648, 'mean_degree': 2.239030978279093, 'res_sz': 55, 'window': 0.1094873966843583, 'spect_rad': 6.477328770276496, 'ridge_alpha': 3.331610049609846e-08}. 
[I 2024-09-26 07:29:26,003] Trial 14 finished with values: [1.0, 1.4085437635633986, 0.1, 1.0, 1.0318828567651754, 0.1, 1.0, 1.35377551944542, 0.2222222222222222] and parameters: {'gamma': 346.0338840758405, 'sigma': 35.69324078704249, 'delta': 72.54210572835741, 'mean_degree': 0.4751972846184277, 'res_sz': 70, 'window': 0.26028339283696866, 'spect_rad': 2.5437033336150314, 'ridge_alpha': 12.409693592814683}. 
[I 2024-09-26 07:29:38,863] Trial 15 finished with values: [1.0, 1.520215629785859, 0.2, 1.0, 0.9515754761448787, 0.2, 1.0, 1.3574529288581418, 0.1111111111111111] and parameters: {'gamma': 165.35910322741674, 'sigma': 88.88989450922007, 'delta': 52.810968362309424, 'mean_degree': 2.991613258039025, 'res_sz': 22, 'window': 0.6323737664553282, 'spect_rad': 0.041669580427143416, 'ridge_alpha': 0.03926126011662856}. 
[I 2024-09-26 07:29:50,701] Trial 16 finished with values: [1.0, 1.2147230266916096, 0.1, 1.0, 1.0536631800287153, 0.4, 0.0, 1.298535634310004, 0.3333333333333333] and parameters: {'gamma': 147.78737772455366, 'sigma': 11.96960493470186, 'delta': 73.49598155493426, 'mean_degree': 1.2219248269220822, 'res_sz': 18, 'window': 0.35094487127907564, 'spect_rad': 0.18476963104636426, 'ridge_alpha': 4.542976678118587e-05}. 
[I 2024-09-26 07:30:00,778] Trial 17 finished with values: [1.0, 640990263.7943159, 0.4, 0.0, 0.991649379959179, 0.4, 1.0, 1.4315446156714275, 0.1111111111111111] and parameters: {'gamma': 301.7539166794812, 'sigma': 40.18148863719, 'delta': 45.025928787322506, 'mean_degree': 0.5775161046695001, 'res_sz': 51, 'window': 0.9729718446454136, 'spect_rad': 0.0919124592303443, 'ridge_alpha': 6.176324869943652e-08}. 
[I 2024-09-26 07:30:11,142] Trial 18 finished with values: [1.0, 270837055.9883666, 1.0, 1.0, 1.0394879382720308, 0.1, 1.0, 1.4684851836576347, 0.2222222222222222] and parameters: {'gamma': 306.14100181254724, 'sigma': 68.04332158933414, 'delta': 89.03205516791542, 'mean_degree': 2.5437129538218755, 'res_sz': 38, 'window': 0.09601376999733469, 'spect_rad': 0.0012030106198302158, 'ridge_alpha': 1.83925700171123e-05}. 
[I 2024-09-26 07:30:18,871] Trial 19 finished with values: [1.0, 1.1418033657223694, 0.1, 0.0, 0.8976920502200024, 0.7, 1.0, 1.5696447159378333, 0.1111111111111111] and parameters: {'gamma': 191.98612540364041, 'sigma': 96.02825366199296, 'delta': 32.46566380175814, 'mean_degree': 0.7503582592733944, 'res_sz': 20, 'window': 10.576117545804365, 'spect_rad': 4.577891281719689, 'ridge_alpha': 0.07388913240429264}. 
[I 2024-09-26 07:30:28,431] Trial 20 finished with values: [1.0, 3061642022.5749707, 0.0, 1.0, 403480287.1551536, 1.0, 0.0, 499745446.24773705, 0.5555555555555556] and parameters: {'gamma': 340.1615443519891, 'sigma': 14.915791234830355, 'delta': 6.670201969454882, 'mean_degree': 3.2871818165207554, 'res_sz': 57, 'window': 0.01572531379434911, 'spect_rad': 0.0020515344212919595, 'ridge_alpha': 0.0020050505253349214}. 
[I 2024-09-26 07:30:40,250] Trial 21 finished with values: [1.0, 7233432.741546083, 1.0, 0.0, 1.0780862353271352, 0.2, 1.0, 1.2857079729055236, 0.3333333333333333] and parameters: {'gamma': 143.8278661079958, 'sigma': 8.780550572661282, 'delta': 23.90980998519818, 'mean_degree': 2.216147261862862, 'res_sz': 23, 'window': 0.008383667552436478, 'spect_rad': 6.357614390137387, 'ridge_alpha': 0.08848327481380372}. 
[I 2024-09-26 07:30:52,745] Trial 22 finished with values: [1.0, 2.0537551690585034, 0.2, 1.0, 1.1741077037122833, 0.0, 1.0, 1.5068906497449561, 0.2222222222222222] and parameters: {'gamma': 30.428762422111216, 'sigma': 52.2666131724934, 'delta': 0.07410916191723539, 'mean_degree': 2.8538933228399523, 'res_sz': 39, 'window': 0.0011918261992380007, 'spect_rad': 0.0019259288532296561, 'ridge_alpha': 1.0506900210801456e-05}. 
[I 2024-09-26 07:31:05,855] Trial 23 finished with values: [1.0, 1.471153496089063, 0.3, 1.0, 1.0158109011494016, 0.2, 1.0, 1.3352715341252126, 0.3333333333333333] and parameters: {'gamma': 64.31516436908336, 'sigma': 92.89620763184094, 'delta': 19.326073245332747, 'mean_degree': 1.5167480276229854, 'res_sz': 53, 'window': 1.706112030686527, 'spect_rad': 9.167306309820312, 'ridge_alpha': 3.8005956269742716}. 
