[I 2024-09-25 19:34:12,232] Trial 16 finished with values: [3.0, 21.78978544817035, 0.3333333333333333, 20.0, 6.547393576730344, 0.6666666666666666, 1.0, 414.2791856820188, 1.0] and parameters: {'optimizer__threshold': 0.0011180858668982845, 'optimizer__alpha': 0.00011769216205239145, 'discrete_time': False, 'feature_library': 1, 'differentiation_method': 3}. 
[I 2024-09-25 19:34:14,045] Trial 17 finished with values: [1.0, 11.811971668637398, 1.0, 5.0, 8.436789881649572, 0.0, 1.0, 46.304789704554764, 1.0] and parameters: {'optimizer__threshold': 2.004127640452949, 'optimizer__alpha': 0.0001758090247667123, 'discrete_time': True, 'feature_library': 1, 'differentiation_method': 0}. 
[I 2024-09-25 19:34:16,179] Trial 18 finished with values: [1.0, 11.811971668637398, 1.0, 5.0, 8.436789881649572, 0.0, 1.0, 46.304789704554764, 1.0] and parameters: {'optimizer__threshold': 0.0003838496245406871, 'optimizer__alpha': 5.721528816242691e-05, 'discrete_time': True, 'feature_library': 1, 'differentiation_method': 2}. 
[I 2024-09-25 19:34:18,074] Trial 19 finished with values: [3.0, 11.472723708871143, 0.6666666666666666, 7.0, 6.852724549415535, 0.3333333333333333, 2.0, 61.4593652713932, 1.0] and parameters: {'optimizer__threshold': 0.1813203622645289, 'optimizer__alpha': 0.0011032928016917812, 'discrete_time': False, 'feature_library': 1, 'differentiation_method': 8}. 
[I 2024-09-25 19:34:19,876] Trial 20 finished with values: [1.0, 11.811971668637398, 1.0, 5.0, 8.436789881649572, 0.0, 1.0, 46.304789704554764, 1.0] and parameters: {'optimizer__threshold': 0.002772930690936307, 'optimizer__alpha': 4.699439989752641e-05, 'discrete_time': True, 'feature_library': 1, 'differentiation_method': 6}. 
[I 2024-09-25 19:34:21,688] Trial 21 finished with values: [5.0, 8.159635305400597, 0.3333333333333333, 4.0, 8.570825460921112, 0.6666666666666666, 2.0, 36.04379809344782, 0.5] and parameters: {'optimizer__threshold': 3.6886874845355404, 'optimizer__alpha': 4.331950773177936, 'discrete_time': True, 'feature_library': 0, 'differentiation_method': 0}. 
[I 2024-09-25 19:34:24,344] Trial 22 finished with values: [8.0, 7.1258319057183614, 0.6666666666666666, 33.0, 7.91955370029148, 1.0, 4.0, 42.57428633467139, 1.0] and parameters: {'optimizer__threshold': 0.00606425775478129, 'optimizer__alpha': 0.022493720533813346, 'discrete_time': False, 'feature_library': 0, 'differentiation_method': 0}. 
[I 2024-09-25 19:34:26,173] Trial 23 finished with values: [5.0, 8.159635305400597, 0.3333333333333333, 4.0, 8.570825460921112, 0.6666666666666666, 2.0, 36.04379809344782, 0.5] and parameters: {'optimizer__threshold': 0.9660257192054005, 'optimizer__alpha': 0.016969360497305675, 'discrete_time': True, 'feature_library': 0, 'differentiation_method': 6}. 
[I 2024-09-25 19:34:28,005] Trial 24 finished with values: [5.0, 8.159635305400597, 0.3333333333333333, 4.0, 8.570825460921112, 0.6666666666666666, 2.0, 36.04379809344782, 0.5] and parameters: {'optimizer__threshold': 0.001736833336214429, 'optimizer__alpha': 0.0009247427803444309, 'discrete_time': True, 'feature_library': 0, 'differentiation_method': 1}. 
[I 2024-09-25 19:34:38,031] A new study created in memory with name: LTSFLinearForecaster predicting coupled_logistic_map(sigma=0.05)
[I 2024-09-25 19:34:46,729] Trial 0 finished with values: [2.0, 0.8273989766911702, 0.8, 11.0, 0.832224374969482, 0.6, 1.0, 1.5906972537286226, 0.5555555555555556] and parameters: {'seq_len': 10, 'lr': 0.07780098149799547, 'pred_len': 11, 'num_epochs': 50}. 
[I 2024-09-25 19:34:56,745] Trial 1 finished with values: [1.0, 1.2618166953777246, 0.0, 6.0, 0.9091223587612607, 0.9, 1.0, 1.6001743647015017, 0.4444444444444444] and parameters: {'seq_len': 25, 'lr': 0.0015431719835932239, 'pred_len': 21, 'num_epochs': 100}. 
[I 2024-09-25 19:35:15,205] Trial 2 finished with values: [1.0, 0.8127631777532377, 0.9, 17.0, 0.8167553513765021, 0.9, 1.0, 1.5383165196377948, 0.5555555555555556] and parameters: {'seq_len': 4, 'lr': 0.005829933653716896, 'pred_len': 9, 'num_epochs': 300}. 
[I 2024-09-25 19:35:24,011] Trial 3 finished with values: [1.0, 0.8161725585947173, 1.0, 21.0, 0.8246055271225595, 1.0, 1.0, 1.470377685642212, 0.6666666666666666] and parameters: {'seq_len': 3, 'lr': 0.013487274992995266, 'pred_len': 2, 'num_epochs': 50}. 
[I 2024-09-25 19:35:41,322] Trial 4 finished with values: [1.0, 2.0331520945892443, 0.0, 4.0, 1.011720769709415, 0.8, 1.0, 1.5799729255905928, 0.5555555555555556] and parameters: {'seq_len': 18, 'lr': 0.0001368402226199559, 'pred_len': 13, 'num_epochs': 300}. 
[I 2024-09-25 19:35:57,572] Trial 5 finished with values: [2.0, 0.8245818547919561, 1.0, 17.0, 0.826953677215445, 1.0, 1.0, 1.5275730840756374, 0.6666666666666666] and parameters: {'seq_len': 24, 'lr': 0.002036876004058157, 'pred_len': 21, 'num_epochs': 300}. 
[I 2024-09-25 19:36:06,479] Trial 6 finished with values: [1.0, 1.1805324436034499, 0.0, 5.0, 0.9146576714101071, 0.8, 1.0, 1.8543687662275887, 0.4444444444444444] and parameters: {'seq_len': 23, 'lr': 0.0004891759334404773, 'pred_len': 6, 'num_epochs': 50}. 
[I 2024-09-25 19:36:16,261] Trial 7 finished with values: [4.0, 1.0618427840500226, 0.0, 1.0, 1.1254038743010215, 0.0, 1.0, 3.6018038704421813, 0.3333333333333333] and parameters: {'seq_len': 1, 'lr': 0.0005648907373800721, 'pred_len': 20, 'num_epochs': 100}. 
[I 2024-09-25 19:36:33,678] Trial 8 finished with values: [1.0, 0.8138106304545797, 0.9, 13.0, 0.8190568713984531, 0.9, 1.0, 1.5266212580628808, 0.5555555555555556] and parameters: {'seq_len': 15, 'lr': 0.007342617674688435, 'pred_len': 12, 'num_epochs': 300}. 
[I 2024-09-25 19:36:52,012] Trial 9 finished with values: [1.0, 0.8278874746400343, 0.6, 1.0, 0.8425237728709137, 0.6, 1.0, 1.5276859503134779, 0.5555555555555556] and parameters: {'seq_len': 1, 'lr': 6.865893100444234e-05, 'pred_len': 7, 'num_epochs': 300}. 
[I 2024-09-25 19:37:08,374] Trial 10 finished with values: [1.0, 0.8122161135979081, 0.9, 17.0, 0.8153488405922782, 0.9, 1.0, 1.542164682569154, 0.5555555555555556] and parameters: {'seq_len': 19, 'lr': 0.02144822776081124, 'pred_len': 21, 'num_epochs': 300}. 
[I 2024-09-25 19:37:18,607] Trial 11 finished with values: [1.0, 1.0666050111594587, 0.0, 6.0, 0.8782708077680154, 0.9, 1.0, 1.7395187478446725, 0.5555555555555556] and parameters: {'seq_len': 25, 'lr': 0.0004181769966385902, 'pred_len': 23, 'num_epochs': 100}. 
[I 2024-09-25 19:37:34,513] Trial 12 finished with values: [1.0, 0.8166027040244639, 0.9, 17.0, 0.8221756535042306, 1.0, 1.0, 1.4865315240011765, 0.6666666666666666] and parameters: {'seq_len': 20, 'lr': 0.029006463540801303, 'pred_len': 24, 'num_epochs': 300}. 
[I 2024-09-25 19:37:43,505] Trial 13 finished with values: [1.0, 0.8848443953452599, 0.9, 3.0, 0.9255803983750871, 1.0, 1.0, 1.7762813200342213, 0.3333333333333333] and parameters: {'seq_len': 10, 'lr': 0.00017117122484276072, 'pred_len': 23, 'num_epochs': 50}. 
[I 2024-09-25 19:37:51,783] Trial 14 finished with values: [2.0, 0.8335231840855282, 0.6, 2.0, 0.8795660241569859, 0.8, 1.0, 1.5374377715035044, 0.6666666666666666] and parameters: {'seq_len': 7, 'lr': 0.0010226648011651379, 'pred_len': 24, 'num_epochs': 50}. 
[I 2024-09-25 19:38:00,346] Trial 15 finished with values: [1.0, 3.355821812808457, 0.0, 1.0, 3.288136211625005, 0.0, 1.0, 1.511605808590606, 0.6666666666666666] and parameters: {'seq_len': 9, 'lr': 0.00011144343729997998, 'pred_len': 8, 'num_epochs': 50}. 
[I 2024-09-25 19:38:10,414] Trial 16 finished with values: [1.0, 1.0144585969501632, 0.1, 7.0, 0.935905350211967, 0.9, 1.0, 1.6127469123147886, 0.4444444444444444] and parameters: {'seq_len': 21, 'lr': 4.691449392844391e-05, 'pred_len': 14, 'num_epochs': 100}. 
[I 2024-09-25 19:38:18,958] Trial 17 finished with values: [1.0, 4.81875768636868, 0.8, 1.0, 1.5508786032137702, 0.4, 1.0, 204.2318330929126, 0.3333333333333333] and parameters: {'seq_len': 3, 'lr': 0.00027157544651785375, 'pred_len': 8, 'num_epochs': 50}. 
[I 2024-09-25 19:38:36,718] Trial 18 finished with values: [2.0, 0.8218099394247569, 1.0, 7.0, 0.8336623844811504, 1.0, 1.0, 1.7168104968539701, 0.3333333333333333] and parameters: {'seq_len': 17, 'lr': 0.0004245904772822413, 'pred_len': 2, 'num_epochs': 300}. 
[I 2024-09-25 19:38:45,262] Trial 19 finished with values: [1.0, 2.597874656429781, 0.0, 1.0, 2.0847828839165596, 0.0, 1.0, 3.036358106835849, 0.3333333333333333] and parameters: {'seq_len': 5, 'lr': 5.6679309812729186e-05, 'pred_len': 11, 'num_epochs': 50}. 
[I 2024-09-25 19:38:55,458] Trial 20 finished with values: [1.0, 5.273146285363932, 0.0, 1.0, 1.7575479269758374, 0.0, 1.0, 1.5777325113488763, 0.3333333333333333] and parameters: {'seq_len': 23, 'lr': 2.5865263282964377e-05, 'pred_len': 15, 'num_epochs': 100}. 
[I 2024-09-25 19:39:12,565] Trial 21 finished with values: [3.0, 0.8128991376717319, 0.9, 17.0, 0.8213827189558153, 1.0, 1.0, 1.5372862089062846, 0.6666666666666666] and parameters: {'seq_len': 12, 'lr': 0.002728392063952212, 'pred_len': 25, 'num_epochs': 300}. 
[I 2024-09-25 19:39:23,270] Trial 22 finished with values: [1.0, 0.8428534456410002, 0.1, 7.0, 0.8712951934037046, 0.2, 1.0, 1.5020158162247248, 0.6666666666666666] and parameters: {'seq_len': 3, 'lr': 0.001216991339896181, 'pred_len': 1, 'num_epochs': 100}. 
[I 2024-09-25 19:39:33,205] Trial 23 finished with values: [1.0, 49.2833980003479, 0.0, 2.0, 2.001844141262697, 0.2, 1.0, 1.6805394345499665, 0.3333333333333333] and parameters: {'seq_len': 17, 'lr': 9.826561397759383e-05, 'pred_len': 22, 'num_epochs': 100}. 
[I 2024-09-25 19:39:41,619] Trial 24 finished with values: [1.0, 0.8707008431189845, 0.1, 6.0, 0.8413352545880153, 1.0, 1.0, 1.5053685220142987, 0.6666666666666666] and parameters: {'seq_len': 25, 'lr': 0.002853507798884675, 'pred_len': 16, 'num_epochs': 50}. 
[I 2024-09-25 19:39:48,103] A new study created in memory with name: VAR predicting coupled_logistic_map(sigma=0.05)
[I 2024-09-25 19:39:53,563] Trial 0 finished with values: [1.0, 2.1252187662090916, 0.0, 10.0, 1.2922857641604497, 0.0, 1.0, 2.5377231264408704, 0.0] and parameters: {'ic': 'aic', 'maxlags': 3, 'trend': 'n'}. 
[I 2024-09-25 19:39:58,979] Trial 1 finished with values: [1.0, 0.8988508261006583, 0.2, 10.0, 0.8130378847986001, 0.5, 1.0, 1.4911166981285138, 0.4444444444444444] and parameters: {'ic': 'aic', 'maxlags': 3, 'trend': 'ct'}. 
[I 2024-09-25 19:40:04,391] Trial 2 finished with values: [1.0, 2.1252187662090916, 0.0, 10.0, 1.2922857641604497, 0.0, 1.0, 2.5377231264408704, 0.0] and parameters: {'ic': 'aic', 'maxlags': 3, 'trend': 'n'}. 
[I 2024-09-25 19:40:09,808] Trial 3 finished with values: [1.0, 0.8988508261006583, 0.2, 10.0, 0.8130378847986001, 0.5, 1.0, 1.4911166981285138, 0.4444444444444444] and parameters: {'ic': 'fpe', 'maxlags': 3, 'trend': 'ct'}. 
[I 2024-09-25 19:40:15,220] Trial 4 finished with values: [1.0, 0.8266023209516014, 1.0, 10.0, 0.7973116325402828, 1.0, 1.0, 1.5717802909509848, 0.6666666666666666] and parameters: {'ic': 'aic', 'maxlags': 2, 'trend': 'c'}. 
[I 2024-09-25 19:40:20,652] Trial 5 finished with values: [1.0, 2.1252187662090916, 0.0, 10.0, 1.2922857641604497, 0.0, 1.0, 2.5377231264408704, 0.0] and parameters: {'ic': 'fpe', 'maxlags': 3, 'trend': 'n'}. 
[I 2024-09-25 19:40:26,086] Trial 6 finished with values: [1.0, 0.8266023209516014, 1.0, 10.0, 0.7973116325402828, 1.0, 1.0, 1.5717802909509848, 0.6666666666666666] and parameters: {'ic': 'aic', 'maxlags': 2, 'trend': 'c'}. 
[I 2024-09-25 19:40:31,499] Trial 7 finished with values: [1.0, 0.8988508261006583, 0.2, 10.0, 0.8130378847986001, 0.5, 1.0, 1.4911166981285138, 0.4444444444444444] and parameters: {'ic': 'fpe', 'maxlags': 1, 'trend': 'ct'}. 
[I 2024-09-25 19:40:36,907] Trial 8 finished with values: [1.0, 2.1252187662090916, 0.0, 10.0, 1.2922857641604497, 0.0, 1.0, 2.5377231264408704, 0.0] and parameters: {'ic': 'aic', 'maxlags': 4, 'trend': 'n'}. 
[I 2024-09-25 19:40:42,291] Trial 9 finished with values: [1.0, 0.8988508261006583, 0.2, 10.0, 0.8130378847986001, 0.5, 1.0, 1.4911166981285138, 0.4444444444444444] and parameters: {'ic': 'fpe', 'maxlags': 3, 'trend': 'ct'}. 
[I 2024-09-25 19:40:47,730] Trial 10 finished with values: [1.0, 2.1252187662090916, 0.0, 10.0, 1.2922857641604497, 0.0, 1.0, 2.5377231264408704, 0.0] and parameters: {'ic': 'fpe', 'maxlags': 2, 'trend': 'n'}. 
[I 2024-09-25 19:40:53,148] Trial 11 finished with values: [1.0, 0.8988508261006583, 0.2, 10.0, 0.8130378847986001, 0.5, 1.0, 1.4911166981285138, 0.4444444444444444] and parameters: {'ic': 'fpe', 'maxlags': 4, 'trend': 'ct'}. 
[I 2024-09-25 19:40:58,572] Trial 12 finished with values: [1.0, 0.8266023209516014, 1.0, 10.0, 0.7973116325402828, 1.0, 1.0, 1.5717802909509848, 0.6666666666666666] and parameters: {'ic': 'fpe', 'maxlags': 4, 'trend': 'c'}. 
[I 2024-09-25 19:41:03,608] Trial 13 finished with values: [1.0, 0.8988508261006583, 0.2, 10.0, 0.8130378847986001, 0.5, 1.0, 1.4911166981285138, 0.4444444444444444] and parameters: {'ic': 'fpe', 'maxlags': 3, 'trend': 'ct'}. 
[I 2024-09-25 19:41:09,203] Trial 14 finished with values: [1.0, 0.8266023209516014, 1.0, 10.0, 0.7973116325402828, 1.0, 1.0, 1.5717802909509848, 0.6666666666666666] and parameters: {'ic': 'fpe', 'maxlags': 3, 'trend': 'c'}. 
[I 2024-09-25 19:41:14,536] Trial 15 finished with values: [1.0, 2.1252187662090916, 0.0, 10.0, 1.2922857641604497, 0.0, 1.0, 2.5377231264408704, 0.0] and parameters: {'ic': 'fpe', 'maxlags': 5, 'trend': 'n'}. 
[I 2024-09-25 19:41:19,814] Trial 16 finished with values: [1.0, 0.8988508261006583, 0.2, 10.0, 0.8130378847986001, 0.5, 1.0, 1.4911166981285138, 0.4444444444444444] and parameters: {'ic': 'aic', 'maxlags': 5, 'trend': 'ct'}. 
[I 2024-09-25 19:41:25,221] Trial 17 finished with values: [1.0, 1.154846807432697, 0.1, 10.0, 0.8286775237695483, 0.5, 1.0, 1.4952798582203397, 0.4444444444444444] and parameters: {'ic': 'aic', 'maxlags': 5, 'trend': 'ctt'}. 
[I 2024-09-25 19:41:30,689] Trial 18 finished with values: [1.0, 2.1252187662090916, 0.0, 10.0, 1.2922857641604497, 0.0, 1.0, 2.5377231264408704, 0.0] and parameters: {'ic': 'fpe', 'maxlags': 5, 'trend': 'n'}. 
[I 2024-09-25 19:41:36,148] Trial 19 finished with values: [1.0, 2.1252187662090916, 0.0, 10.0, 1.2922857641604497, 0.0, 1.0, 2.5377231264408704, 0.0] and parameters: {'ic': 'aic', 'maxlags': 4, 'trend': 'n'}. 
[I 2024-09-25 19:41:41,590] Trial 20 finished with values: [1.0, 0.8988508261006583, 0.2, 10.0, 0.8130378847986001, 0.5, 1.0, 1.4911166981285138, 0.4444444444444444] and parameters: {'ic': 'aic', 'maxlags': 2, 'trend': 'ct'}. 
[I 2024-09-25 19:41:47,013] Trial 21 finished with values: [1.0, 0.8266023209516014, 1.0, 10.0, 0.7973116325402828, 1.0, 1.0, 1.5717802909509848, 0.6666666666666666] and parameters: {'ic': 'fpe', 'maxlags': 3, 'trend': 'c'}. 
[I 2024-09-25 19:41:52,447] Trial 22 finished with values: [1.0, 2.1252187662090916, 0.0, 10.0, 1.2922857641604497, 0.0, 1.0, 2.5377231264408704, 0.0] and parameters: {'ic': 'fpe', 'maxlags': 3, 'trend': 'n'}. 
[I 2024-09-25 19:41:57,850] Trial 23 finished with values: [1.0, 1.154846807432697, 0.1, 10.0, 0.8286775237695483, 0.5, 1.0, 1.4952798582203397, 0.4444444444444444] and parameters: {'ic': 'fpe', 'maxlags': 2, 'trend': 'ctt'}. 
[I 2024-09-25 19:42:03,253] Trial 24 finished with values: [1.0, 0.8266023209516014, 1.0, 10.0, 0.7973116325402828, 1.0, 1.0, 1.5717802909509848, 0.6666666666666666] and parameters: {'ic': 'fpe', 'maxlags': 1, 'trend': 'c'}. 
[I 2024-09-25 19:42:09,676] A new study created in memory with name: LSTM predicting coupled_logistic_map(sigma=0.05)
SLURM auto-requeueing enabled. Setting signal handlers.
SLURM auto-requeueing enabled. Setting signal handlers.
SLURM auto-requeueing enabled. Setting signal handlers.
SLURM auto-requeueing enabled. Setting signal handlers.
SLURM auto-requeueing enabled. Setting signal handlers.
SLURM auto-requeueing enabled. Setting signal handlers.
SLURM auto-requeueing enabled. Setting signal handlers.
SLURM auto-requeueing enabled. Setting signal handlers.
SLURM auto-requeueing enabled. Setting signal handlers.
SLURM auto-requeueing enabled. Setting signal handlers.
SLURM auto-requeueing enabled. Setting signal handlers.
SLURM auto-requeueing enabled. Setting signal handlers.
SLURM auto-requeueing enabled. Setting signal handlers.
SLURM auto-requeueing enabled. Setting signal handlers.
SLURM auto-requeueing enabled. Setting signal handlers.
SLURM auto-requeueing enabled. Setting signal handlers.
SLURM auto-requeueing enabled. Setting signal handlers.
SLURM auto-requeueing enabled. Setting signal handlers.
SLURM auto-requeueing enabled. Setting signal handlers.
SLURM auto-requeueing enabled. Setting signal handlers.
SLURM auto-requeueing enabled. Setting signal handlers.
SLURM auto-requeueing enabled. Setting signal handlers.
SLURM auto-requeueing enabled. Setting signal handlers.
SLURM auto-requeueing enabled. Setting signal handlers.
SLURM auto-requeueing enabled. Setting signal handlers.
SLURM auto-requeueing enabled. Setting signal handlers.
SLURM auto-requeueing enabled. Setting signal handlers.
SLURM auto-requeueing enabled. Setting signal handlers.
SLURM auto-requeueing enabled. Setting signal handlers.
SLURM auto-requeueing enabled. Setting signal handlers.
SLURM auto-requeueing enabled. Setting signal handlers.
SLURM auto-requeueing enabled. Setting signal handlers.
SLURM auto-requeueing enabled. Setting signal handlers.
SLURM auto-requeueing enabled. Setting signal handlers.
SLURM auto-requeueing enabled. Setting signal handlers.
SLURM auto-requeueing enabled. Setting signal handlers.
SLURM auto-requeueing enabled. Setting signal handlers.
SLURM auto-requeueing enabled. Setting signal handlers.
SLURM auto-requeueing enabled. Setting signal handlers.
SLURM auto-requeueing enabled. Setting signal handlers.
SLURM auto-requeueing enabled. Setting signal handlers.
SLURM auto-requeueing enabled. Setting signal handlers.
SLURM auto-requeueing enabled. Setting signal handlers.
SLURM auto-requeueing enabled. Setting signal handlers.
SLURM auto-requeueing enabled. Setting signal handlers.
SLURM auto-requeueing enabled. Setting signal handlers.
SLURM auto-requeueing enabled. Setting signal handlers.
SLURM auto-requeueing enabled. Setting signal handlers.
SLURM auto-requeueing enabled. Setting signal handlers.
SLURM auto-requeueing enabled. Setting signal handlers.
SLURM auto-requeueing enabled. Setting signal handlers.
SLURM auto-requeueing enabled. Setting signal handlers.
