[I 2024-09-26 00:32:42,123] Trial 17 finished with values: [1.0, 2708861194.4405756, 0.0, 3.0, 0.9184259731842329, 0.3, 1.0, 1.7712635124106102, 0.4444444444444444] and parameters: {'gamma': 479.36014022130917, 'sigma': 37.61818257190257, 'delta': 60.73282335646222, 'mean_degree': 4.964554535870377, 'res_sz': 57, 'window': 0.10237728665929477, 'spect_rad': 2.3575887886593963, 'ridge_alpha': 1.2479421288305646e-09}. 
[I 2024-09-26 00:32:50,453] Trial 18 finished with values: [1.0, 0.8752510595471835, 0.5, 1.0, 0.901843528682823, 0.7, 1.0, 1.682172751106958, 0.3333333333333333] and parameters: {'gamma': 15.012350780270504, 'sigma': 32.569084372265415, 'delta': 33.31980038127854, 'mean_degree': 0.2539456320253468, 'res_sz': 33, 'window': 1.7833062957907357, 'spect_rad': 0.036865501656223265, 'ridge_alpha': 80.51326709212934}. 
[I 2024-09-26 00:33:01,516] Trial 19 finished with values: [1.0, 6702.698913400855, 0.0, 1.0, 0.9723631916676154, 0.4, 1.0, 1.835822705091308, 0.2222222222222222] and parameters: {'gamma': 342.2676534679951, 'sigma': 60.12669654494643, 'delta': 5.147223963647006, 'mean_degree': 0.3878613075057904, 'res_sz': 44, 'window': 0.002609150413380477, 'spect_rad': 2.6483348481727997, 'ridge_alpha': 1.311167048846946e-10}. 
[I 2024-09-26 00:33:12,644] Trial 20 finished with values: [1.0, 2.0567084638555744, 0.0, 1.0, 1.0999977610150755, 0.1, 1.0, 1.6618005483635363, 0.2222222222222222] and parameters: {'gamma': 209.7212857953514, 'sigma': 40.280582373727896, 'delta': 68.69604971880842, 'mean_degree': 0.6558490384414072, 'res_sz': 54, 'window': 0.15874151554412605, 'spect_rad': 4.884220044644187, 'ridge_alpha': 1.5850459201128953e-08}. 
/nas/longleaf/home/djpassey/.local/lib/python3.9/site-packages/interfere/methods/reservoir_computer.py:378: RuntimeWarning: overflow encountered in add
  self.Rhat_ += states.T @ states
/nas/longleaf/home/djpassey/.local/lib/python3.9/site-packages/interfere/methods/reservoir_computer.py:378: RuntimeWarning: invalid value encountered in add
  self.Rhat_ += states.T @ states
 lsoda--  at t (=r1), too much accuracy requested    
       for precision of machine..  see tolsf (=r2)   
      in above,  r1 =  0.1500000000000D+03   r2 =                  NaN
 lsoda--  at t (=r1), too much accuracy requested    
       for precision of machine..  see tolsf (=r2)   
      in above,  r1 =  0.1000000000000D+01   r2 =                  NaN
 lsoda--  at t (=r1), too much accuracy requested    
       for precision of machine..  see tolsf (=r2)   
      in above,  r1 =  0.1500000000000D+03   r2 =                  NaN
 lsoda--  at t (=r1), too much accuracy requested    
       for precision of machine..  see tolsf (=r2)   
      in above,  r1 =  0.1500000000000D+03   r2 =                  NaN
 lsoda--  at t (=r1), too much accuracy requested    
       for precision of machine..  see tolsf (=r2)   
      in above,  r1 =  0.1000000000000D+01   r2 =                  NaN
 lsoda--  at t (=r1), too much accuracy requested    
       for precision of machine..  see tolsf (=r2)   
      in above,  r1 =  0.1500000000000D+03   r2 =                  NaN
 lsoda--  at t (=r1), too much accuracy requested    
       for precision of machine..  see tolsf (=r2)   
      in above,  r1 =  0.1500000000000D+03   r2 =                  NaN
 lsoda--  at t (=r1), too much accuracy requested    
       for precision of machine..  see tolsf (=r2)   
      in above,  r1 =  0.1500000000000D+03   r2 =                  NaN
 lsoda--  at t (=r1), too much accuracy requested    
       for precision of machine..  see tolsf (=r2)   
      in above,  r1 =  0.1000000000000D+01   r2 =                  NaN
 lsoda--  at t (=r1), too much accuracy requested    
       for precision of machine..  see tolsf (=r2)   
      in above,  r1 =  0.1500000000000D+03   r2 =                  NaN
 lsoda--  at t (=r1), too much accuracy requested    
       for precision of machine..  see tolsf (=r2)   
      in above,  r1 =  0.7500000000000D+01   r2 =                  NaN
 lsoda--  at t (=r1), too much accuracy requested    
       for precision of machine..  see tolsf (=r2)   
      in above,  r1 =  0.5000000000000D-01   r2 =                  NaN
 lsoda--  at t (=r1), too much accuracy requested    
       for precision of machine..  see tolsf (=r2)   
      in above,  r1 =  0.7500000000000D+01   r2 =                  NaN
 lsoda--  at t (=r1), too much accuracy requested    
       for precision of machine..  see tolsf (=r2)   
      in above,  r1 =  0.5000000000000D-01   r2 =                  NaN
 lsoda--  at t (=r1), too much accuracy requested    
       for precision of machine..  see tolsf (=r2)   
      in above,  r1 =  0.1500000000000D+03   r2 =                  NaN
 lsoda--  at t (=r1), too much accuracy requested    
       for precision of machine..  see tolsf (=r2)   
      in above,  r1 =  0.1000000000000D+01   r2 =                  NaN
 lsoda--  at t (=r1), too much accuracy requested    
       for precision of machine..  see tolsf (=r2)   
      in above,  r1 =  0.1500000000000D+03   r2 =                  NaN
 lsoda--  at t (=r1), too much accuracy requested    
       for precision of machine..  see tolsf (=r2)   
      in above,  r1 =  0.1500000000000D+03   r2 =                  NaN
 lsoda--  at t (=r1), too much accuracy requested    
       for precision of machine..  see tolsf (=r2)   
      in above,  r1 =  0.1000000000000D+01   r2 =                  NaN
 lsoda--  at t (=r1), too much accuracy requested    
       for precision of machine..  see tolsf (=r2)   
      in above,  r1 =  0.1500000000000D+03   r2 =                  NaN
 lsoda--  at t (=r1), too much accuracy requested    
       for precision of machine..  see tolsf (=r2)   
      in above,  r1 =  0.1500000000000D+03   r2 =                  NaN
 lsoda--  at t (=r1), too much accuracy requested    
       for precision of machine..  see tolsf (=r2)   
      in above,  r1 =  0.1000000000000D+01   r2 =                  NaN
 lsoda--  at t (=r1), too much accuracy requested    
       for precision of machine..  see tolsf (=r2)   
      in above,  r1 =  0.1500000000000D+03   r2 =                  NaN
[I 2024-09-26 00:33:19,933] Trial 21 finished with values: [0.0, 3805620918.638311, 0.0, 0.0, 3818197566.1329203, 0.0, 0.0, 4071502255.5588346, 0.0] and parameters: {'gamma': 37.63607907518925, 'sigma': 51.6008094532367, 'delta': 57.72685830247276, 'mean_degree': 4.618156290870797, 'res_sz': 92, 'window': 8.959536844287763, 'spect_rad': 24.471633691855292, 'ridge_alpha': 0.5775977506451295}. 
[I 2024-09-26 00:33:32,257] Trial 22 finished with values: [1.0, 2.6640279172001176, 0.0, 1.0, 0.9400538901201515, 0.4, 1.0, 1.5463427510822485, 0.3333333333333333] and parameters: {'gamma': 406.1026220286016, 'sigma': 53.7804432756745, 'delta': 86.69405905761337, 'mean_degree': 4.932068516593859, 'res_sz': 23, 'window': 0.06136750087279186, 'spect_rad': 0.0011086372355208578, 'ridge_alpha': 0.00025294293171705765}. 
[I 2024-09-26 00:33:44,694] Trial 23 finished with values: [1.0, 6652415.949831495, 1.0, 1.0, 0.9305132161880494, 0.2, 1.0, 1.5641892681158314, 0.2222222222222222] and parameters: {'gamma': 111.88976983597898, 'sigma': 69.36532488739122, 'delta': 46.88538664233512, 'mean_degree': 3.2528497722212086, 'res_sz': 39, 'window': 0.044843860268654216, 'spect_rad': 0.0890792004659756, 'ridge_alpha': 0.003920803502871407}. 
[I 2024-09-26 00:33:55,383] Trial 24 finished with values: [1.0, 694808140.8173683, 1.0, 3.0, 1.1959175141439675, 0.1, 1.0, 1.875094277391747, 0.0] and parameters: {'gamma': 200.7800984496304, 'sigma': 66.35757184613676, 'delta': 31.708563231273686, 'mean_degree': 2.29295500458656, 'res_sz': 92, 'window': 0.006787353030142556, 'spect_rad': 1.6935637029870616, 'ridge_alpha': 1.929695609091717e-10}. 
[I 2024-09-26 00:34:03,693] A new study created in memory with name: SINDY predicting coupled_logistic_map(sigma=0.05)
/nas/longleaf/home/djpassey/.local/lib/python3.9/site-packages/scipy/stats/_axis_nan_policy.py:551: RuntimeWarning: Precision loss occurred in moment calculation due to catastrophic cancellation. This occurs when the data are nearly identical. Results may be unreliable.
  res = hypotest_fun_out(*samples, axis=axis, **kwds)
[I 2024-09-26 00:34:10,350] Trial 0 finished with values: [1.0, 1.3472965986606222, 0.2, 1.0, 1.1089104829264131, 0.2, 1.0, 2.238247700551154, 0.1111111111111111] and parameters: {'optimizer__threshold': 2.7018519382727413, 'optimizer__alpha': 0.05429006592565306, 'discrete_time': False, 'feature_library': 0, 'differentiation_method': 3}. 
[I 2024-09-26 00:34:15,828] Trial 1 finished with values: [4.0, 190666.97015335463, 0.0, 5.0, 0.9761614799521159, 0.9, 6.0, 1.462443004733552, 0.7777777777777778] and parameters: {'optimizer__threshold': 4.752146465178802e-05, 'optimizer__alpha': 1.949494287499889e-05, 'discrete_time': True, 'feature_library': 0, 'differentiation_method': 1}. 
/nas/longleaf/home/djpassey/.local/lib/python3.9/site-packages/scipy/stats/_axis_nan_policy.py:551: RuntimeWarning: Precision loss occurred in moment calculation due to catastrophic cancellation. This occurs when the data are nearly identical. Results may be unreliable.
  res = hypotest_fun_out(*samples, axis=axis, **kwds)
[I 2024-09-26 00:34:22,086] Trial 2 finished with values: [1.0, 1.390478542043646, 0.2, 1.0, 1.1089104829264131, 0.2, 1.0, 2.238247700551154, 0.1111111111111111] and parameters: {'optimizer__threshold': 1.2283599370987213, 'optimizer__alpha': 1.4296939952548833, 'discrete_time': False, 'feature_library': 0, 'differentiation_method': 4}. 
[I 2024-09-26 00:34:27,566] Trial 3 finished with values: [2.0, 1.0350203269397595, 1.0, 6.0, 0.9709137163678011, 1.0, 3.0, 19.878433645084755, 0.5555555555555556] and parameters: {'optimizer__threshold': 0.0012267903096111314, 'optimizer__alpha': 0.4380380628740204, 'discrete_time': True, 'feature_library': 1, 'differentiation_method': 3}. 
[I 2024-09-26 00:34:33,227] Trial 4 finished with values: [4.0, 190666.97015335463, 0.0, 5.0, 0.9761614799521159, 0.9, 6.0, 1.462443004733552, 0.7777777777777778] and parameters: {'optimizer__threshold': 0.00016950900719763654, 'optimizer__alpha': 0.004171045165622349, 'discrete_time': True, 'feature_library': 0, 'differentiation_method': 7}. 
[I 2024-09-26 00:34:39,534] Trial 5 finished with values: [1.0, 2.2270767504490663, 0.1, 1.0, 4.529613625663259, 0.0, 1.0, 2.6654548806853717, 0.3333333333333333] and parameters: {'optimizer__threshold': 0.0018284571761352203, 'optimizer__alpha': 0.09672774245544276, 'discrete_time': False, 'feature_library': 0, 'differentiation_method': 0}. 
[I 2024-09-26 00:34:45,058] Trial 6 finished with values: [4.0, 190666.97015335463, 0.0, 5.0, 0.9761614799521159, 0.9, 6.0, 1.462443004733552, 0.7777777777777778] and parameters: {'optimizer__threshold': 0.05134501063708254, 'optimizer__alpha': 7.278734986782667e-05, 'discrete_time': True, 'feature_library': 0, 'differentiation_method': 1}. 
[I 2024-09-26 00:34:51,509] Trial 7 finished with values: [1.0, 1.5510866549268596, 0.1, 1.0, 4.068121809384147, 0.0, 1.0, 11.482216854674888, 0.3333333333333333] and parameters: {'optimizer__threshold': 0.000260261461666185, 'optimizer__alpha': 0.002487510216647322, 'discrete_time': False, 'feature_library': 0, 'differentiation_method': 1}. 
[I 2024-09-26 00:34:57,015] Trial 8 finished with values: [2.0, 1.0350203269397595, 1.0, 6.0, 0.9709137163678011, 1.0, 3.0, 19.878433645084755, 0.5555555555555556] and parameters: {'optimizer__threshold': 0.0026709469143717866, 'optimizer__alpha': 0.02038067701220642, 'discrete_time': True, 'feature_library': 1, 'differentiation_method': 3}. 
[I 2024-09-26 00:35:04,059] Trial 9 finished with values: [3.0, 3.04210711559857, 0.0, 1.0, 2.231175325755418, 0.0, 1.0, 4.094674527776234, 0.2222222222222222] and parameters: {'optimizer__threshold': 1.7120977744760056e-05, 'optimizer__alpha': 0.00027646335799014617, 'discrete_time': False, 'feature_library': 0, 'differentiation_method': 7}. 
[I 2024-09-26 00:35:09,468] Trial 10 finished with values: [4.0, 190666.97015335463, 0.0, 5.0, 0.9761614799521159, 0.9, 6.0, 1.462443004733552, 0.7777777777777778] and parameters: {'optimizer__threshold': 1.2406685772820908e-05, 'optimizer__alpha': 0.025925258030382183, 'discrete_time': True, 'feature_library': 0, 'differentiation_method': 2}. 
[I 2024-09-26 00:35:14,882] Trial 11 finished with values: [4.0, 190666.97015335463, 0.0, 5.0, 0.9761614799521159, 0.9, 6.0, 1.462443004733552, 0.7777777777777778] and parameters: {'optimizer__threshold': 0.15770451246983513, 'optimizer__alpha': 0.00012977495783212807, 'discrete_time': True, 'feature_library': 0, 'differentiation_method': 0}. 
[I 2024-09-26 00:35:20,312] Trial 12 finished with values: [4.0, 190666.97015335463, 0.0, 5.0, 0.9761614799521159, 0.9, 6.0, 1.462443004733552, 0.7777777777777778] and parameters: {'optimizer__threshold': 0.002025527740325804, 'optimizer__alpha': 0.005992634986510768, 'discrete_time': True, 'feature_library': 0, 'differentiation_method': 4}. 
[I 2024-09-26 00:35:25,778] Trial 13 finished with values: [4.0, 190666.97015335463, 0.0, 5.0, 0.9761614799521159, 0.9, 6.0, 1.462443004733552, 0.7777777777777778] and parameters: {'optimizer__threshold': 0.06921150499972817, 'optimizer__alpha': 3.35367939414425e-05, 'discrete_time': True, 'feature_library': 0, 'differentiation_method': 5}. 
[I 2024-09-26 00:35:31,881] Trial 14 finished with values: [1.0, 2.2270767504490663, 0.1, 1.0, 4.529613625663259, 0.0, 1.0, 2.6654548806853717, 0.3333333333333333] and parameters: {'optimizer__threshold': 0.0002596620976536032, 'optimizer__alpha': 0.001684041262007368, 'discrete_time': False, 'feature_library': 0, 'differentiation_method': 0}. 
/nas/longleaf/home/djpassey/.local/lib/python3.9/site-packages/scipy/stats/_axis_nan_policy.py:551: RuntimeWarning: Precision loss occurred in moment calculation due to catastrophic cancellation. This occurs when the data are nearly identical. Results may be unreliable.
  res = hypotest_fun_out(*samples, axis=axis, **kwds)
[I 2024-09-26 00:35:38,602] Trial 15 finished with values: [1.0, 1.390478542043646, 0.2, 1.0, 1.1089104829264131, 0.2, 1.0, 2.238247700551154, 0.1111111111111111] and parameters: {'optimizer__threshold': 0.00018444722094473518, 'optimizer__alpha': 0.004869650433375087, 'discrete_time': False, 'feature_library': 0, 'differentiation_method': 4}. 
[I 2024-09-26 00:35:45,109] Trial 16 finished with values: [1.0, 2.0117049724551697, 0.0, 1.0, 5.125712360611876, 0.0, 1.0, 5.304678582064452, 0.4444444444444444] and parameters: {'optimizer__threshold': 1.9876278899970082e-05, 'optimizer__alpha': 2.1996331117926555, 'discrete_time': False, 'feature_library': 0, 'differentiation_method': 2}. 
[I 2024-09-26 00:35:50,581] Trial 17 finished with values: [4.0, 190666.97015335463, 0.0, 5.0, 0.9761614799521159, 0.9, 6.0, 1.462443004733552, 0.7777777777777778] and parameters: {'optimizer__threshold': 0.002394059108863744, 'optimizer__alpha': 0.0031375976952759312, 'discrete_time': True, 'feature_library': 0, 'differentiation_method': 3}. 
[I 2024-09-26 00:35:55,943] Trial 18 finished with values: [2.0, 1.0350203269397595, 1.0, 6.0, 0.9709137163678011, 1.0, 3.0, 19.878433645084755, 0.5555555555555556] and parameters: {'optimizer__threshold': 0.1262482394711238, 'optimizer__alpha': 6.645602047572744e-05, 'discrete_time': True, 'feature_library': 1, 'differentiation_method': 0}. 
[I 2024-09-26 00:36:01,299] Trial 19 finished with values: [2.0, 1.0350203269397595, 1.0, 6.0, 0.9709137163678011, 1.0, 3.0, 19.878433645084755, 0.5555555555555556] and parameters: {'optimizer__threshold': 0.4886907509885283, 'optimizer__alpha': 0.006063529101089555, 'discrete_time': True, 'feature_library': 1, 'differentiation_method': 7}. 
[I 2024-09-26 00:36:06,675] Trial 20 finished with values: [4.0, 190666.97015335463, 0.0, 5.0, 0.9761614799521159, 0.9, 6.0, 1.462443004733552, 0.7777777777777778] and parameters: {'optimizer__threshold': 3.999734729906931, 'optimizer__alpha': 4.943571237986518, 'discrete_time': True, 'feature_library': 0, 'differentiation_method': 5}. 
[I 2024-09-26 00:36:13,089] Trial 21 finished with values: [1.0, 2.2270767504490663, 0.1, 1.0, 4.529613625663259, 0.0, 1.0, 2.6654548806853717, 0.3333333333333333] and parameters: {'optimizer__threshold': 0.09036038678403649, 'optimizer__alpha': 1.259788636913245e-05, 'discrete_time': False, 'feature_library': 0, 'differentiation_method': 0}. 
[I 2024-09-26 00:36:19,830] Trial 22 finished with values: [1.0, 36.017649454363905, 0.1, 1.0, 18.24925842957668, 0.1, 1.0, 21.283782690787902, 0.1111111111111111] and parameters: {'optimizer__threshold': 0.08815578487035851, 'optimizer__alpha': 0.005812381632630145, 'discrete_time': False, 'feature_library': 1, 'differentiation_method': 7}. 
[I 2024-09-26 00:36:25,596] Trial 23 finished with values: [2.0, 1.0350203269397595, 1.0, 6.0, 0.9709137163678011, 1.0, 3.0, 19.878433645084755, 0.5555555555555556] and parameters: {'optimizer__threshold': 4.9267226305456675e-05, 'optimizer__alpha': 0.03546198349571274, 'discrete_time': True, 'feature_library': 1, 'differentiation_method': 5}. 
[I 2024-09-26 00:36:33,811] Trial 24 finished with values: [1.0, 71.64367133015446, 0.1, 1.0, 23.021532662032456, 0.4, 1.0, 107.61118935619606, 0.3333333333333333] and parameters: {'optimizer__threshold': 0.0019128811581434653, 'optimizer__alpha': 9.75881816509439e-05, 'discrete_time': False, 'feature_library': 1, 'differentiation_method': 0}. 
[I 2024-09-26 00:36:43,795] A new study created in memory with name: LTSFLinearForecaster predicting Belozyorov3DQuad(sigma=0.05)
[I 2024-09-26 00:36:48,837] Trial 0 finished with values: [3.0, 12.548001681977272, 0.3333333333333333, 1.0, 13.752627998125618, 0.3333333333333333, 1.0, 47.67680274792852, 0.0] and parameters: {'seq_len': 6, 'lr': 0.0003173940138413661, 'pred_len': 24, 'num_epochs': 50}. 
[I 2024-09-26 00:36:53,397] Trial 1 finished with values: [4.0, 12.046708951634038, 0.0, 6.0, 7.631273254005584, 0.0, 2.0, 26.976572199941504, 0.5] and parameters: {'seq_len': 23, 'lr': 0.0026429512478588616, 'pred_len': 4, 'num_epochs': 50}. 
[I 2024-09-26 00:36:59,578] Trial 2 finished with values: [4.0, 14608.03552314409, 0.0, 2.0, 140.31788672863357, 0.0, 2.0, 52.525119152577666, 1.0] and parameters: {'seq_len': 10, 'lr': 0.015064252915240448, 'pred_len': 18, 'num_epochs': 100}. 
[I 2024-09-26 00:37:04,398] Trial 3 finished with values: [4.0, 11.78674208553994, 0.0, 8.0, 8.610773589672336, 0.0, 2.0, 30.81064524221269, 0.5] and parameters: {'seq_len': 6, 'lr': 0.029978796386119125, 'pred_len': 17, 'num_epochs': 50}. 
[I 2024-09-26 00:37:10,707] Trial 4 finished with values: [4.0, 12.05041871814314, 0.0, 10.0, 9.098952923133597, 0.0, 2.0, 29.107423325236123, 0.5] and parameters: {'seq_len': 14, 'lr': 0.06792163097936507, 'pred_len': 3, 'num_epochs': 100}. 
[I 2024-09-26 00:37:15,272] Trial 5 finished with values: [1.0, 12.489718924362787, 0.3333333333333333, 1.0, 12.343276732032885, 0.3333333333333333, 1.0, 45.384406260180846, 0.0] and parameters: {'seq_len': 7, 'lr': 1.3385636510151908e-05, 'pred_len': 23, 'num_epochs': 50}. 
[I 2024-09-26 00:37:28,917] Trial 6 finished with values: [3.0, 4982.111067310605, 0.0, 3.0, 72.98144572647992, 0.0, 2.0, 76.01822308142617, 1.0] and parameters: {'seq_len': 4, 'lr': 0.02156892434415539, 'pred_len': 14, 'num_epochs': 300}. 
[I 2024-09-26 00:37:33,579] Trial 7 finished with values: [3.0, 12.208667330507904, 0.0, 4.0, 9.489016084723065, 0.0, 2.0, 34.88608078782617, 0.5] and parameters: {'seq_len': 1, 'lr': 0.0003653722382540034, 'pred_len': 2, 'num_epochs': 50}. 
[I 2024-09-26 00:37:37,889] Trial 8 finished with values: [4.0, 11.869994936592684, 0.0, 7.0, 7.532425251950261, 0.0, 2.0, 41.539836993162126, 0.5] and parameters: {'seq_len': 15, 'lr': 0.05742654830762304, 'pred_len': 25, 'num_epochs': 50}. 
[I 2024-09-26 00:37:42,361] Trial 9 finished with values: [3.0, 11.83270839185502, 0.0, 4.0, 8.522182940066282, 0.0, 2.0, 37.5077824792785, 0.0] and parameters: {'seq_len': 17, 'lr': 0.0001793023794883839, 'pred_len': 2, 'num_epochs': 50}. 
[I 2024-09-26 00:37:48,912] Trial 10 finished with values: [5.0, 12.32993623117238, 0.3333333333333333, 14.0, 9.547699288085317, 0.3333333333333333, 2.0, 47.40531586188597, 1.0] and parameters: {'seq_len': 17, 'lr': 0.025288327049005983, 'pred_len': 10, 'num_epochs': 100}. 
[I 2024-09-26 00:37:54,859] Trial 11 finished with values: [4.0, 12.097357875364304, 0.0, 8.0, 8.235967896221084, 0.0, 2.0, 34.377144158605276, 0.0] and parameters: {'seq_len': 16, 'lr': 0.00011499664886817777, 'pred_len': 18, 'num_epochs': 100}. 
[I 2024-09-26 00:38:06,525] Trial 12 finished with values: [5.0, 13.244918317940607, 0.0, 16.0, 10.325942566020512, 0.3333333333333333, 1.0, 26.16994450709208, 0.5] and parameters: {'seq_len': 19, 'lr': 1.9178874161682756e-05, 'pred_len': 21, 'num_epochs': 300}. 
[I 2024-09-26 00:38:11,225] Trial 13 finished with values: [5.0, 601.6446575109858, 0.0, 1.0, 74.65978339999589, 0.0, 2.0, 23.259739029621212, 0.5] and parameters: {'seq_len': 21, 'lr': 0.01297632652045745, 'pred_len': 14, 'num_epochs': 50}. 
[I 2024-09-26 00:38:15,586] Trial 14 finished with values: [4.0, 13.512246509465418, 0.0, 1.0, 13.263080959158133, 0.0, 1.0, 44.62368101646763, 0.0] and parameters: {'seq_len': 23, 'lr': 1.638424610358362e-05, 'pred_len': 15, 'num_epochs': 50}. 
[I 2024-09-26 00:38:20,002] Trial 15 finished with values: [3.0, 12.002305847571, 0.0, 1.0, 7.69624976717798, 0.0, 3.0, 26.88671063162999, 0.5] and parameters: {'seq_len': 14, 'lr': 0.00039002477184380734, 'pred_len': 22, 'num_epochs': 50}. 
[I 2024-09-26 00:38:32,550] Trial 16 finished with values: [4.0, 14.285883901720352, 0.3333333333333333, 3.0, 12.41190119742735, 0.3333333333333333, 1.0, 26.27795602756584, 0.5] and parameters: {'seq_len': 12, 'lr': 2.4019337873107396e-05, 'pred_len': 25, 'num_epochs': 300}. 
