[I 2024-09-26 22:01:45,248] Trial 23 finished with values: [1.0, 1.0569321926149495, 0.2, 1.0, 1.010004756127123, 0.1, 1.0, 1.243626843331016, 0.1111111111111111] and parameters: {'h': 9, 'n_pool_kernel_size': [16, 8, 1], 'n_freq_downsample': [40, 20, 1], 'learning_rate': 0.001351829042030424, 'scaler_type': 'standard', 'max_steps': 500.0, 'batch_size': 32, 'windows_batch_size': 128, 'random_seed': 18}. 
SLURM auto-requeueing enabled. Setting signal handlers.
SLURM auto-requeueing enabled. Setting signal handlers.
SLURM auto-requeueing enabled. Setting signal handlers.
SLURM auto-requeueing enabled. Setting signal handlers.
SLURM auto-requeueing enabled. Setting signal handlers.
SLURM auto-requeueing enabled. Setting signal handlers.
SLURM auto-requeueing enabled. Setting signal handlers.
SLURM auto-requeueing enabled. Setting signal handlers.
SLURM auto-requeueing enabled. Setting signal handlers.
SLURM auto-requeueing enabled. Setting signal handlers.
SLURM auto-requeueing enabled. Setting signal handlers.
SLURM auto-requeueing enabled. Setting signal handlers.
SLURM auto-requeueing enabled. Setting signal handlers.
SLURM auto-requeueing enabled. Setting signal handlers.
SLURM auto-requeueing enabled. Setting signal handlers.
SLURM auto-requeueing enabled. Setting signal handlers.
SLURM auto-requeueing enabled. Setting signal handlers.
SLURM auto-requeueing enabled. Setting signal handlers.
SLURM auto-requeueing enabled. Setting signal handlers.
SLURM auto-requeueing enabled. Setting signal handlers.
SLURM auto-requeueing enabled. Setting signal handlers.
SLURM auto-requeueing enabled. Setting signal handlers.
SLURM auto-requeueing enabled. Setting signal handlers.
SLURM auto-requeueing enabled. Setting signal handlers.
SLURM auto-requeueing enabled. Setting signal handlers.
SLURM auto-requeueing enabled. Setting signal handlers.
SLURM auto-requeueing enabled. Setting signal handlers.
SLURM auto-requeueing enabled. Setting signal handlers.
SLURM auto-requeueing enabled. Setting signal handlers.
SLURM auto-requeueing enabled. Setting signal handlers.
SLURM auto-requeueing enabled. Setting signal handlers.
SLURM auto-requeueing enabled. Setting signal handlers.
SLURM auto-requeueing enabled. Setting signal handlers.
SLURM auto-requeueing enabled. Setting signal handlers.
SLURM auto-requeueing enabled. Setting signal handlers.
SLURM auto-requeueing enabled. Setting signal handlers.
SLURM auto-requeueing enabled. Setting signal handlers.
SLURM auto-requeueing enabled. Setting signal handlers.
SLURM auto-requeueing enabled. Setting signal handlers.
SLURM auto-requeueing enabled. Setting signal handlers.
SLURM auto-requeueing enabled. Setting signal handlers.
SLURM auto-requeueing enabled. Setting signal handlers.
SLURM auto-requeueing enabled. Setting signal handlers.
SLURM auto-requeueing enabled. Setting signal handlers.
SLURM auto-requeueing enabled. Setting signal handlers.
SLURM auto-requeueing enabled. Setting signal handlers.
SLURM auto-requeueing enabled. Setting signal handlers.
SLURM auto-requeueing enabled. Setting signal handlers.
SLURM auto-requeueing enabled. Setting signal handlers.
SLURM auto-requeueing enabled. Setting signal handlers.
SLURM auto-requeueing enabled. Setting signal handlers.
SLURM auto-requeueing enabled. Setting signal handlers.
[I 2024-09-26 22:10:50,772] Trial 24 finished with values: [1.0, 444.18186267148445, 0.3, 1.0, 82.82652868905812, 0.0, 1.0, 2385374212.1932487, 0.0] and parameters: {'h': 5, 'n_pool_kernel_size': [4, 4, 4], 'n_freq_downsample': [24, 12, 1], 'learning_rate': 0.07442569734056742, 'scaler_type': 'robust', 'max_steps': 1100.0, 'batch_size': 32, 'windows_batch_size': 1024, 'random_seed': 5}. 
[I 2024-09-26 22:11:11,954] A new study created in memory with name: ResComp predicting coupled_logistic_map(sigma=0.20)
/nas/longleaf/home/djpassey/.local/lib/python3.9/site-packages/scipy/integrate/_odepack_py.py:248: ODEintWarning: Excess work done on this call (perhaps wrong Dfun type). Run with full_output = 1 to get quantitative information.
  warnings.warn(warning_msg, ODEintWarning)
[I 2024-09-26 22:11:22,221] Trial 0 finished with values: [1.0, 301319400.6353205, 1.0, 1.0, 0.9321330640976002, 0.1, 1.0, 1.1470646115401977, 0.2222222222222222] and parameters: {'gamma': 96.55538403352173, 'sigma': 15.76752876706708, 'delta': 69.72168296370911, 'mean_degree': 0.28915412151145836, 'res_sz': 46, 'window': 0.018229369341020103, 'spect_rad': 82.29011007354511, 'ridge_alpha': 0.012403669632218083}. 
[I 2024-09-26 22:11:34,504] Trial 1 finished with values: [1.0, 1.2230886715468448, 0.1, 1.0, 1.197842037355888, 0.1, 1.0, 1.1863871546312779, 0.2222222222222222] and parameters: {'gamma': 138.38661802097715, 'sigma': 35.470356841870064, 'delta': 22.442634135804884, 'mean_degree': 1.1584772624849125, 'res_sz': 46, 'window': 1.481089179833982, 'spect_rad': 1.0650035560034832, 'ridge_alpha': 2.3288921921356955}. 
/nas/longleaf/home/djpassey/.local/lib/python3.9/site-packages/interfere/methods/reservoir_computer.py:480: RuntimeWarning: invalid value encountered in matmul
  pred = self.W_out_ @ states.T
[I 2024-09-26 22:11:47,396] Trial 2 finished with values: [1.0, 1998726787.9515855, 0.0, 0.0, 1.6012333308893167, 0.0, 0.0, 1.5667344648400463, 0.3333333333333333] and parameters: {'gamma': 390.87562029753144, 'sigma': 54.76957973097852, 'delta': 86.9033350671804, 'mean_degree': 4.4432302758954805, 'res_sz': 87, 'window': 1.1469841164637289, 'spect_rad': 0.6342527965061059, 'ridge_alpha': 0.00031490237725328546}. 
[I 2024-09-26 22:11:59,566] Trial 3 finished with values: [1.0, 213064991.50826046, 1.0, 1.0, 1671887933.5757732, 0.0, 1.0, 1.2900921834597725, 0.2222222222222222] and parameters: {'gamma': 115.0384122019802, 'sigma': 24.618452489167712, 'delta': 87.56874533802983, 'mean_degree': 2.9541476149470896, 'res_sz': 53, 'window': 0.06211762391040923, 'spect_rad': 0.0038115890521482967, 'ridge_alpha': 0.06910020291512951}. 
[I 2024-09-26 22:12:09,555] Trial 4 finished with values: [1.0, 1782940938.6306224, 0.0, 1.0, 361.1346003033983, 1.0, 1.0, 34700.090675371175, 0.6666666666666666] and parameters: {'gamma': 484.9633852289783, 'sigma': 91.1519285575166, 'delta': 68.00254869556547, 'mean_degree': 2.4244588261276734, 'res_sz': 56, 'window': 0.285499077363614, 'spect_rad': 0.0336243723718871, 'ridge_alpha': 3.195474286668168e-07}. 
[I 2024-09-26 22:12:20,134] Trial 5 finished with values: [1.0, 1.6259409479077933, 0.0, 1.0, 1.5370092729646836, 0.0, 1.0, 1.1012916622433044, 0.5555555555555556] and parameters: {'gamma': 303.32449229944734, 'sigma': 9.823535664930903, 'delta': 45.32455642082671, 'mean_degree': 0.9629680730089324, 'res_sz': 19, 'window': 0.19682764833848354, 'spect_rad': 58.907629499016, 'ridge_alpha': 3.397014549706652e-08}. 
[I 2024-09-26 22:12:32,467] Trial 6 finished with values: [1.0, 1.1765691698833352, 0.1, 1.0, 1.1198314564149348, 0.0, 1.0, 1.139746245409505, 0.3333333333333333] and parameters: {'gamma': 151.0279429867088, 'sigma': 16.690115130670236, 'delta': 94.31468291103502, 'mean_degree': 1.740586398672522, 'res_sz': 25, 'window': 0.0063171581839715826, 'spect_rad': 0.002782547265231932, 'ridge_alpha': 0.013741072413756656}. 
/nas/longleaf/home/djpassey/.local/lib/python3.9/site-packages/scipy/integrate/_odepack_py.py:248: ODEintWarning: Excess accuracy requested (tolerances too small). Run with full_output = 1 to get quantitative information.
  warnings.warn(warning_msg, ODEintWarning)
/nas/longleaf/home/djpassey/.local/lib/python3.9/site-packages/interfere/methods/reservoir_computer.py:378: RuntimeWarning: overflow encountered in matmul
  self.Rhat_ += states.T @ states
/nas/longleaf/home/djpassey/.local/lib/python3.9/site-packages/scipy/stats/_axis_nan_policy.py:551: RuntimeWarning: Precision loss occurred in moment calculation due to catastrophic cancellation. This occurs when the data are nearly identical. Results may be unreliable.
  res = hypotest_fun_out(*samples, axis=axis, **kwds)
[I 2024-09-26 22:12:38,919] Trial 7 finished with values: [0.0, 2609502556.061226, 0.0, 0.0, 2520465894.211873, 0.0, 0.0, 2798121898.64249, 0.0] and parameters: {'gamma': 151.7057281264934, 'sigma': 24.855574371347483, 'delta': 70.76913708351036, 'mean_degree': 2.060563355972572, 'res_sz': 67, 'window': 8.980957011857166, 'spect_rad': 2.995380237231401, 'ridge_alpha': 0.20015852742420823}. 
[I 2024-09-26 22:12:48,088] Trial 8 finished with values: [1.0, 30025660.344433106, 1.0, 0.0, 142.54939600544643, 0.0, 1.0, 7.099522976361284, 0.3333333333333333] and parameters: {'gamma': 421.7452936799556, 'sigma': 19.483688757104886, 'delta': 18.490356098957893, 'mean_degree': 4.256964795644996, 'res_sz': 42, 'window': 0.004945759116022717, 'spect_rad': 0.03767294876266364, 'ridge_alpha': 1.0175292995573069e-05}. 
[I 2024-09-26 22:12:59,811] Trial 9 finished with values: [1.0, 1.0735613526761016, 0.2, 1.0, 1.016458837123716, 0.2, 1.0, 1.1336390039780437, 0.3333333333333333] and parameters: {'gamma': 456.52702037986296, 'sigma': 85.40398785102157, 'delta': 33.929486191161395, 'mean_degree': 3.1564389570148323, 'res_sz': 19, 'window': 0.2135370891699747, 'spect_rad': 44.09268025879998, 'ridge_alpha': 1.1135657083911958e-10}. 
/nas/longleaf/home/djpassey/.local/lib/python3.9/site-packages/interfere/methods/reservoir_computer.py:480: RuntimeWarning: overflow encountered in matmul
  pred = self.W_out_ @ states.T
[I 2024-09-26 22:13:10,419] Trial 10 finished with values: [1.0, 2054724367.3736732, 0.0, 1.0, 1.8124693384020907, 0.0, 0.0, 7.9153990914982995, 0.6666666666666666] and parameters: {'gamma': 56.15480864913431, 'sigma': 66.98205484381324, 'delta': 69.62906235332879, 'mean_degree': 4.498688737572779, 'res_sz': 83, 'window': 0.00966356022584635, 'spect_rad': 0.09204356208934014, 'ridge_alpha': 9.824339917401406e-10}. 
[I 2024-09-26 22:13:20,128] Trial 11 finished with values: [1.0, 1.1885119919178384, 0.1, 1.0, 1.051891496697557, 0.1, 2.0, 1.2455610203428946, 0.2222222222222222] and parameters: {'gamma': 36.349284546380495, 'sigma': 14.490878716013961, 'delta': 4.643005511946039, 'mean_degree': 0.6189228339051435, 'res_sz': 40, 'window': 0.02389921723536741, 'spect_rad': 0.015584262277739916, 'ridge_alpha': 0.2366758225905616}. 
[I 2024-09-26 22:13:29,869] Trial 12 finished with values: [1.0, 2010051109.6682904, 0.0, 0.0, 1892.6348313188016, 0.1, 1.0, 1.199101753755863, 0.3333333333333333] and parameters: {'gamma': 297.29071959975516, 'sigma': 17.287721558578962, 'delta': 72.69558652523355, 'mean_degree': 2.216530405375552, 'res_sz': 86, 'window': 0.010348122728096761, 'spect_rad': 0.23468491853713247, 'ridge_alpha': 8.373800112170333e-09}. 
[I 2024-09-26 22:13:42,242] Trial 13 finished with values: [1.0, 1.1586837977889313, 0.1, 0.0, 1.2692145350324502, 0.2, 1.0, 1.1702807252877192, 0.4444444444444444] and parameters: {'gamma': 109.04207602847522, 'sigma': 30.76858874081481, 'delta': 77.55198330937698, 'mean_degree': 1.4613348331155502, 'res_sz': 27, 'window': 0.1333328365584129, 'spect_rad': 0.0010945339476371415, 'ridge_alpha': 0.01162557305094344}. 
[I 2024-09-26 22:13:54,648] Trial 14 finished with values: [1.0, 1.2272220541698737, 0.1, 1.0, 0.9869781046365139, 0.3, 1.0, 1.1445543671223157, 0.2222222222222222] and parameters: {'gamma': 79.56822581390183, 'sigma': 29.296786954681068, 'delta': 48.928212587661235, 'mean_degree': 4.398690302416729, 'res_sz': 63, 'window': 1.0017996526800943, 'spect_rad': 0.0017597274467828882, 'ridge_alpha': 22.30344251123616}. 
[I 2024-09-26 22:14:04,813] Trial 15 finished with values: [1.0, 0.9549274959208538, 0.2, 1.0, 0.9293740795363837, 0.2, 1.0, 1.1244664402249993, 0.4444444444444444] and parameters: {'gamma': 23.714014195293252, 'sigma': 3.3161904517680623, 'delta': 40.13964071813419, 'mean_degree': 4.698065012847147, 'res_sz': 67, 'window': 2.1241758433313715, 'spect_rad': 15.350157468950062, 'ridge_alpha': 0.864990296456164}. 
[I 2024-09-26 22:14:14,681] Trial 16 finished with values: [1.0, 2010051109.6682904, 0.0, 1.0, 0.9337624946980587, 0.3, 1.0, 1.1988311917590657, 0.0] and parameters: {'gamma': 230.72525526828667, 'sigma': 66.7151931518614, 'delta': 52.78821860297442, 'mean_degree': 3.518799826754798, 'res_sz': 86, 'window': 0.9240941353197806, 'spect_rad': 0.04502275239042028, 'ridge_alpha': 77.0665454243868}. 
[I 2024-09-26 22:14:25,463] Trial 17 finished with values: [1.0, 1.2493980278525805, 0.0, 1.0, 1.1048359729531976, 0.0, 0.0, 1.3428284284478302, 0.2222222222222222] and parameters: {'gamma': 161.78148061291435, 'sigma': 95.35433584057685, 'delta': 40.6449061810988, 'mean_degree': 0.29992398665113096, 'res_sz': 40, 'window': 0.012157739710009552, 'spect_rad': 7.701912279988418, 'ridge_alpha': 11.684237241172974}. 
[I 2024-09-26 22:14:33,139] Trial 18 finished with values: [0.0, 1.046318506605128, 0.1, 0.0, 1.0522603808101305, 0.1, 2.0, 1.0712872005367378, 0.6666666666666666] and parameters: {'gamma': 319.28891264506785, 'sigma': 8.899979457663774, 'delta': 44.89496557175422, 'mean_degree': 2.334934029175328, 'res_sz': 14, 'window': 8.085980357294893, 'spect_rad': 1.6695794896275322, 'ridge_alpha': 4.898236282167396}. 
[I 2024-09-26 22:14:45,355] Trial 19 finished with values: [0.0, 0.9661490519336164, 0.2, 0.0, 0.9571628235973091, 0.2, 1.0, 1.2791463790534692, 0.3333333333333333] and parameters: {'gamma': 87.9655388811205, 'sigma': 94.84840159589332, 'delta': 53.27091797669913, 'mean_degree': 3.765159992998937, 'res_sz': 14, 'window': 0.0037989658381621804, 'spect_rad': 3.434697991905288, 'ridge_alpha': 0.03105307640626077}. 
[I 2024-09-26 22:14:50,296] Trial 20 finished with values: [1.0, 1929385557.4343572, 0.0, 0.0, 3.3636471119634423, 0.0, 0.0, 3.232867136172841, 0.7777777777777778] and parameters: {'gamma': 136.08973280247466, 'sigma': 45.88685790672109, 'delta': 59.938646299619194, 'mean_degree': 0.14140301459143803, 'res_sz': 94, 'window': 47.86593316866053, 'spect_rad': 10.569650267522174, 'ridge_alpha': 0.017137207408668472}. 
[I 2024-09-26 22:15:00,672] Trial 21 finished with values: [1.0, 2592047493.5603285, 0.0, 1.0, 1.5236847679179346, 0.0, 1.0, 1.4951657361992203, 0.3333333333333333] and parameters: {'gamma': 317.016802904853, 'sigma': 74.39952763117269, 'delta': 19.977726334494573, 'mean_degree': 2.6606745710946798, 'res_sz': 55, 'window': 0.059274459652947566, 'spect_rad': 50.88842705129355, 'ridge_alpha': 15.071329361852209}. 
[I 2024-09-26 22:15:10,527] Trial 22 finished with values: [1.0, 1893763067.9235964, 0.0, 0.0, 1235397892.8398368, 0.0, 1.0, 1478701431.0950298, 0.0] and parameters: {'gamma': 449.7091062892292, 'sigma': 17.963116696839098, 'delta': 73.39531311116592, 'mean_degree': 1.9448112397349167, 'res_sz': 97, 'window': 0.4112860078214992, 'spect_rad': 0.1528540635358166, 'ridge_alpha': 4.784588517617605e-10}. 
[I 2024-09-26 22:15:19,694] Trial 23 finished with values: [0.0, 2609502556.061226, 0.0, 0.0, 2520465894.211873, 0.0, 0.0, 2798121898.64249, 0.0] and parameters: {'gamma': 10.596205910988818, 'sigma': 94.46875662161804, 'delta': 63.26669780818293, 'mean_degree': 4.292304502032705, 'res_sz': 91, 'window': 3.4632134422060523, 'spect_rad': 0.00685995186906853, 'ridge_alpha': 0.12063668301305655}. 
[I 2024-09-26 22:15:30,063] Trial 24 finished with values: [1.0, 1.3009173600013781, 0.0, 1.0, 2138686230.6471229, 0.0, 1.0, 1.2693824590739406, 0.0] and parameters: {'gamma': 134.4858488947347, 'sigma': 94.09385800386745, 'delta': 95.71768445057725, 'mean_degree': 2.6298326563800423, 'res_sz': 37, 'window': 0.009602182512184441, 'spect_rad': 5.086186371930871, 'ridge_alpha': 0.12773268991926762}. 
/var/spool/slurmd/job49527283/slurm_script: line 7: 14747 Killed                  python /nas/longleaf/home/djpassey/interfere_experiments/experiments/exp6/main.py
slurmstepd: error: Detected 1 oom_kill event in StepId=49527283.batch. Some of the step tasks have been OOM Killed.
