[I 2024-09-25 19:21:28,748] Trial 22 finished with values: [1.0, 2171398.571781088, 0.0, 3.0, 7.723311498129678, 0.6666666666666666, 1.0, 1171.0823385039637, 0.0] and parameters: {'h': 10, 'n_pool_kernel_size': [2, 2, 1], 'n_freq_downsample': [180, 60, 1], 'learning_rate': 0.034953525230261, 'scaler_type': 'robust', 'max_steps': 700.0, 'batch_size': 256, 'windows_batch_size': 512, 'random_seed': 19}. 
SLURM auto-requeueing enabled. Setting signal handlers.
SLURM auto-requeueing enabled. Setting signal handlers.
SLURM auto-requeueing enabled. Setting signal handlers.
SLURM auto-requeueing enabled. Setting signal handlers.
SLURM auto-requeueing enabled. Setting signal handlers.
SLURM auto-requeueing enabled. Setting signal handlers.
SLURM auto-requeueing enabled. Setting signal handlers.
SLURM auto-requeueing enabled. Setting signal handlers.
SLURM auto-requeueing enabled. Setting signal handlers.
SLURM auto-requeueing enabled. Setting signal handlers.
SLURM auto-requeueing enabled. Setting signal handlers.
SLURM auto-requeueing enabled. Setting signal handlers.
SLURM auto-requeueing enabled. Setting signal handlers.
SLURM auto-requeueing enabled. Setting signal handlers.
SLURM auto-requeueing enabled. Setting signal handlers.
SLURM auto-requeueing enabled. Setting signal handlers.
SLURM auto-requeueing enabled. Setting signal handlers.
SLURM auto-requeueing enabled. Setting signal handlers.
SLURM auto-requeueing enabled. Setting signal handlers.
SLURM auto-requeueing enabled. Setting signal handlers.
SLURM auto-requeueing enabled. Setting signal handlers.
[I 2024-09-25 19:27:26,234] Trial 23 finished with values: [1.0, 2151572.0668893475, 0.0, 23.0, 6.711707116392999, 0.3333333333333333, 2.0, 1264.8743107930816, 0.0] and parameters: {'h': 14, 'n_pool_kernel_size': [2, 2, 2], 'n_freq_downsample': [1, 1, 1], 'learning_rate': 0.0005970492134311942, 'scaler_type': 'standard', 'max_steps': 1200.0, 'batch_size': 32, 'windows_batch_size': 512, 'random_seed': 19}. 
SLURM auto-requeueing enabled. Setting signal handlers.
SLURM auto-requeueing enabled. Setting signal handlers.
SLURM auto-requeueing enabled. Setting signal handlers.
SLURM auto-requeueing enabled. Setting signal handlers.
SLURM auto-requeueing enabled. Setting signal handlers.
SLURM auto-requeueing enabled. Setting signal handlers.
SLURM auto-requeueing enabled. Setting signal handlers.
SLURM auto-requeueing enabled. Setting signal handlers.
SLURM auto-requeueing enabled. Setting signal handlers.
SLURM auto-requeueing enabled. Setting signal handlers.
SLURM auto-requeueing enabled. Setting signal handlers.
SLURM auto-requeueing enabled. Setting signal handlers.
SLURM auto-requeueing enabled. Setting signal handlers.
SLURM auto-requeueing enabled. Setting signal handlers.
SLURM auto-requeueing enabled. Setting signal handlers.
SLURM auto-requeueing enabled. Setting signal handlers.
SLURM auto-requeueing enabled. Setting signal handlers.
SLURM auto-requeueing enabled. Setting signal handlers.
SLURM auto-requeueing enabled. Setting signal handlers.
SLURM auto-requeueing enabled. Setting signal handlers.
SLURM auto-requeueing enabled. Setting signal handlers.
SLURM auto-requeueing enabled. Setting signal handlers.
SLURM auto-requeueing enabled. Setting signal handlers.
SLURM auto-requeueing enabled. Setting signal handlers.
SLURM auto-requeueing enabled. Setting signal handlers.
[I 2024-09-25 19:32:03,310] Trial 24 finished with values: [1.0, 14.988323183971486, 0.3333333333333333, 13.0, 7.407765855368521, 0.6666666666666666, 1.0, 22.30542659724791, 1.0] and parameters: {'h': 12, 'n_pool_kernel_size': [4, 4, 4], 'n_freq_downsample': [24, 12, 1], 'learning_rate': 0.016639823216571432, 'scaler_type': 'standard', 'max_steps': 1400.0, 'batch_size': 32, 'windows_batch_size': 256, 'random_seed': 2}. 
[I 2024-09-25 19:32:07,755] A new study created in memory with name: ResComp predicting Belozyorov3DQuad(sigma=0.00)
[I 2024-09-25 19:32:10,739] Trial 0 finished with values: [5.0, 13.046959699112593, 0.0, 3.0, 9.259326451399447, 0.0, 0.0, 51.29947553648031, 0.5] and parameters: {'gamma': 166.7326479747684, 'sigma': 40.8284754887518, 'delta': 68.69181082489936, 'mean_degree': 1.407893255969938, 'res_sz': 45, 'window': 0.0010126778239903833, 'spect_rad': 1.5068611273891488, 'ridge_alpha': 4.995793184316466e-06}. 
[I 2024-09-25 19:32:14,273] Trial 1 finished with values: [5.0, 13.042061230316044, 0.0, 0.0, 7.479247033127612, 0.6666666666666666, 0.0, 17.35341958978481, 1.0] and parameters: {'gamma': 196.5917981936803, 'sigma': 48.372044607883446, 'delta': 77.04749413728057, 'mean_degree': 1.4233366119884483, 'res_sz': 42, 'window': 0.6052397915042215, 'spect_rad': 0.019218938962355603, 'ridge_alpha': 1.0880090029837081e-06}. 
/nas/longleaf/home/djpassey/.local/lib/python3.9/site-packages/scipy/stats/_axis_nan_policy.py:551: RuntimeWarning: Precision loss occurred in moment calculation due to catastrophic cancellation. This occurs when the data are nearly identical. Results may be unreliable.
  res = hypotest_fun_out(*samples, axis=axis, **kwds)
[I 2024-09-25 19:32:17,412] Trial 2 finished with values: [1.0, 16.926450904540815, 0.3333333333333333, 0.0, 7.578966578153635, 0.6666666666666666, 0.0, 41.47570746945318, 0.0] and parameters: {'gamma': 477.17416054874514, 'sigma': 23.88616282593769, 'delta': 34.834610984319546, 'mean_degree': 0.6567383059113978, 'res_sz': 12, 'window': 25.064619897396494, 'spect_rad': 0.41809844107413724, 'ridge_alpha': 0.011169286020559}. 
/nas/longleaf/home/djpassey/.local/lib/python3.9/site-packages/scipy/integrate/_odepack_py.py:248: ODEintWarning: Excess work done on this call (perhaps wrong Dfun type). Run with full_output = 1 to get quantitative information.
  warnings.warn(warning_msg, ODEintWarning)
/nas/longleaf/home/djpassey/.local/lib/python3.9/site-packages/interfere/methods/reservoir_computer.py:480: RuntimeWarning: overflow encountered in matmul
  pred = self.W_out_ @ states.T
/nas/longleaf/home/djpassey/.local/lib/python3.9/site-packages/interfere/methods/reservoir_computer.py:480: RuntimeWarning: invalid value encountered in matmul
  pred = self.W_out_ @ states.T
[I 2024-09-25 19:32:20,642] Trial 3 finished with values: [2.0, 4963125473.802762, 0.0, 0.0, 11.809054092480189, 0.0, 0.0, 17.19639920812804, 1.0] and parameters: {'gamma': 130.0505213888271, 'sigma': 71.25572419580128, 'delta': 83.65507231224096, 'mean_degree': 4.379499281577758, 'res_sz': 69, 'window': 0.005797576867609572, 'spect_rad': 0.009930746430290082, 'ridge_alpha': 0.0020019715704031305}. 
[I 2024-09-25 19:32:23,893] Trial 4 finished with values: [1.0, 30.165901474762336, 0.0, 0.0, 6.993075136949148, 0.6666666666666666, 0.0, 15.017472211122302, 1.0] and parameters: {'gamma': 110.57303829688102, 'sigma': 50.70881963164959, 'delta': 15.217801057596043, 'mean_degree': 4.114350679239063, 'res_sz': 70, 'window': 28.066881045922187, 'spect_rad': 0.2326565704506958, 'ridge_alpha': 0.014903559749018813}. 
[I 2024-09-25 19:32:27,966] Trial 5 finished with values: [1.0, 20.353253224214864, 0.0, 7.0, 8.220735871443363, 0.3333333333333333, 0.0, 15.74060415172253, 1.0] and parameters: {'gamma': 147.10376307414558, 'sigma': 72.8774027709724, 'delta': 19.389605850778775, 'mean_degree': 3.4880672361886416, 'res_sz': 98, 'window': 0.3349098887361463, 'spect_rad': 0.008294721692431287, 'ridge_alpha': 0.038862835046376415}. 
[I 2024-09-25 19:32:30,833] Trial 6 finished with values: [0.0, 25.06624592190523, 0.0, 0.0, 6.865674376518197, 0.6666666666666666, 0.0, 22.85697455156693, 1.0] and parameters: {'gamma': 200.84476625192056, 'sigma': 57.92893092744622, 'delta': 45.64734312606094, 'mean_degree': 3.068164391400075, 'res_sz': 29, 'window': 0.039969943031090756, 'spect_rad': 0.9107102699607814, 'ridge_alpha': 78.9157328609298}. 
[I 2024-09-25 19:32:33,872] Trial 7 finished with values: [1.0, 7.17239467476907, 0.6666666666666666, 0.0, 6.955654801529343, 0.6666666666666666, 0.0, 14.659278362101038, 1.0] and parameters: {'gamma': 473.3360315100381, 'sigma': 68.15979480623848, 'delta': 80.1704495213186, 'mean_degree': 3.2421981387320806, 'res_sz': 36, 'window': 83.00902575096725, 'spect_rad': 0.022348942442365325, 'ridge_alpha': 2.780154200794378e-06}. 
/nas/longleaf/home/djpassey/.local/lib/python3.9/site-packages/interfere/methods/reservoir_computer.py:378: RuntimeWarning: overflow encountered in matmul
  self.Rhat_ += states.T @ states
/nas/longleaf/home/djpassey/.local/lib/python3.9/site-packages/interfere/methods/reservoir_computer.py:378: RuntimeWarning: invalid value encountered in matmul
  self.Rhat_ += states.T @ states
/nas/longleaf/home/djpassey/.local/lib/python3.9/site-packages/interfere/methods/reservoir_computer.py:379: RuntimeWarning: invalid value encountered in matmul
  self.Yhat_ += Ui[:-1, :].T @ states
/nas/longleaf/home/djpassey/.local/lib/python3.9/site-packages/scipy/integrate/_odepack_py.py:248: ODEintWarning: Excess accuracy requested (tolerances too small). Run with full_output = 1 to get quantitative information.
  warnings.warn(warning_msg, ODEintWarning)
[I 2024-09-25 19:32:36,698] Trial 8 finished with values: [0.0, 5525965882.379226, 0.0, 0.0, 6412558089.423308, 0.0, 0.0, 15.939806566044147, 1.0] and parameters: {'gamma': 217.0076628551988, 'sigma': 93.15233606705624, 'delta': 11.896375442319766, 'mean_degree': 0.9868809539174344, 'res_sz': 77, 'window': 57.83818312527993, 'spect_rad': 0.579857907563794, 'ridge_alpha': 8.561214263652814e-07}. 
[I 2024-09-25 19:32:40,099] Trial 9 finished with values: [0.0, 32.68278013856087, 0.0, 0.0, 7.4299205031178275, 0.6666666666666666, 2.0, 29.980159973474823, 0.5] and parameters: {'gamma': 77.39021621348009, 'sigma': 61.081166334568486, 'delta': 6.488781058258173, 'mean_degree': 3.3698980094534488, 'res_sz': 89, 'window': 0.0025802285158646825, 'spect_rad': 0.212104685923795, 'ridge_alpha': 12.617480080540764}. 
[I 2024-09-25 19:32:43,477] Trial 10 finished with values: [1.0, 28.149917996107966, 0.0, 4.0, 8.817615305386676, 0.0, 0.0, 18.577929507571174, 1.0] and parameters: {'gamma': 437.0231884450574, 'sigma': 73.25794954768395, 'delta': 85.59670249813817, 'mean_degree': 1.5000934224423719, 'res_sz': 17, 'window': 0.08212259107630841, 'spect_rad': 24.13825332263594, 'ridge_alpha': 1.8207923686779915e-06}. 
[I 2024-09-25 19:32:46,150] Trial 11 finished with values: [0.0, 27.801337920077145, 0.0, 0.0, 7.201947530699129, 0.6666666666666666, 0.0, 14.906883470400873, 1.0] and parameters: {'gamma': 228.65069186745126, 'sigma': 13.477116181034052, 'delta': 48.047225137698575, 'mean_degree': 0.4904084095899952, 'res_sz': 13, 'window': 3.5538908903853677, 'spect_rad': 0.15463208618116134, 'ridge_alpha': 0.00020578204672070172}. 
[I 2024-09-25 19:32:49,457] Trial 12 finished with values: [4.0, 12.769178443285037, 0.0, 0.0, 12.449741607254651, 0.0, 0.0, 16.092304777116833, 1.0] and parameters: {'gamma': 235.66967777300718, 'sigma': 64.9322043734443, 'delta': 9.885632958793106, 'mean_degree': 4.132787084922617, 'res_sz': 74, 'window': 19.051831264048086, 'spect_rad': 0.3069044375471281, 'ridge_alpha': 0.36291306755651753}. 
/nas/longleaf/home/djpassey/.local/lib/python3.9/site-packages/interfere/methods/reservoir_computer.py:379: RuntimeWarning: overflow encountered in matmul
  self.Yhat_ += Ui[:-1, :].T @ states
[I 2024-09-25 19:32:52,558] Trial 13 finished with values: [0.0, 5525965882.379226, 0.0, 0.0, 6412558089.423308, 0.0, 0.0, 14.648528246926327, 1.0] and parameters: {'gamma': 403.54935031940164, 'sigma': 96.6526016468797, 'delta': 31.319714568850245, 'mean_degree': 1.2241862403812802, 'res_sz': 60, 'window': 13.198396713061944, 'spect_rad': 0.12576413208914752, 'ridge_alpha': 6.449704465635303}. 
[I 2024-09-25 19:32:54,985] Trial 14 finished with values: [1.0, 20.227716530895144, 0.0, 0.0, 7.302344990784119, 1.0, 1.0, 21.503176615567348, 1.0] and parameters: {'gamma': 155.784292306507, 'sigma': 69.65397491279909, 'delta': 95.86500275278961, 'mean_degree': 1.9784458734207941, 'res_sz': 12, 'window': 6.927222710212593, 'spect_rad': 0.2382300179088187, 'ridge_alpha': 4.133414407715597e-07}. 
[I 2024-09-25 19:32:58,131] Trial 15 finished with values: [4.0, 13.393907093658164, 0.3333333333333333, 0.0, 10.627566904001291, 0.0, 0.0, 16.380873027963876, 1.0] and parameters: {'gamma': 391.01770927518896, 'sigma': 45.71776429326447, 'delta': 56.29655323773428, 'mean_degree': 1.4930178264301481, 'res_sz': 30, 'window': 0.0039045989424961094, 'spect_rad': 0.06241184720839699, 'ridge_alpha': 0.09296280614576775}. 
[I 2024-09-25 19:33:01,773] Trial 16 finished with values: [4.0, 13.63447853072833, 0.3333333333333333, 0.0, 11.348553860619528, 0.0, 0.0, 14.895272091620859, 1.0] and parameters: {'gamma': 291.62660794260864, 'sigma': 50.620774066740616, 'delta': 15.352343144256414, 'mean_degree': 3.9769237381697735, 'res_sz': 47, 'window': 0.4321389891881512, 'spect_rad': 0.5586421309424784, 'ridge_alpha': 1.7176437512347843e-05}. 
[I 2024-09-25 19:33:04,613] Trial 17 finished with values: [1.0, 31.04020158528694, 0.0, 0.0, 7.625282677998973, 0.3333333333333333, 0.0, 25.99399658584661, 1.0] and parameters: {'gamma': 425.5699541680771, 'sigma': 25.63963561405839, 'delta': 6.4113141777239635, 'mean_degree': 2.0320566148263817, 'res_sz': 28, 'window': 1.7099099263880415, 'spect_rad': 0.014268003627651115, 'ridge_alpha': 1.2083772325861948e-07}. 
[I 2024-09-25 19:33:08,819] Trial 18 finished with values: [1.0, 17.081329761962966, 0.0, 5.0, 8.60376114464863, 0.3333333333333333, 0.0, 498.2295843470728, 0.0] and parameters: {'gamma': 355.5921602444357, 'sigma': 25.598480318535216, 'delta': 50.8313203816572, 'mean_degree': 0.48177816687726605, 'res_sz': 70, 'window': 14.579082812745208, 'spect_rad': 0.029188158093842093, 'ridge_alpha': 3.4786584624415194e-06}. 
[I 2024-09-25 19:33:14,273] Trial 19 finished with values: [1.0, 5319489672.362536, 0.0, 0.0, 7.428033557559446, 0.6666666666666666, 0.0, 17.53309779478461, 1.0] and parameters: {'gamma': 288.1589392532606, 'sigma': 67.49567721426196, 'delta': 61.42695929986099, 'mean_degree': 3.6417257887500845, 'res_sz': 91, 'window': 0.2829003608317744, 'spect_rad': 46.32023673715255, 'ridge_alpha': 5.633218717637975e-10}. 
[I 2024-09-25 19:33:17,725] Trial 20 finished with values: [1.0, 28.61996191481505, 0.0, 0.0, 12.28527766240198, 0.0, 0.0, 16.621973979670866, 1.0] and parameters: {'gamma': 179.22332294959372, 'sigma': 72.56807976650161, 'delta': 10.211493257824902, 'mean_degree': 4.706635121669523, 'res_sz': 53, 'window': 4.774507241709212, 'spect_rad': 0.519356722729538, 'ridge_alpha': 4.7880257426570656e-05}. 
[I 2024-09-25 19:33:20,997] Trial 21 finished with values: [1.0, 29.956031397480324, 0.0, 3.0, 9.208130655042817, 0.0, 0.0, 21.83600580611134, 1.0] and parameters: {'gamma': 185.7913371011818, 'sigma': 46.0020315942251, 'delta': 70.85957646519147, 'mean_degree': 2.012482001055928, 'res_sz': 36, 'window': 15.512467243659406, 'spect_rad': 0.003546295822425335, 'ridge_alpha': 0.027433831541562897}. 
[I 2024-09-25 19:33:24,176] Trial 22 finished with values: [5.0, 13.034385135416581, 0.0, 0.0, 7.3355119377062135, 0.6666666666666666, 0.0, 13.32459669222255, 1.0] and parameters: {'gamma': 201.5782604826473, 'sigma': 70.18867048675109, 'delta': 22.24655036151006, 'mean_degree': 0.5116222514188429, 'res_sz': 25, 'window': 6.162334946619247, 'spect_rad': 0.008811577022264327, 'ridge_alpha': 3.094094567160871e-08}. 
[I 2024-09-25 19:33:27,443] Trial 23 finished with values: [1.0, 21.469202320435592, 0.0, 8.0, 8.090530098295648, 0.3333333333333333, 0.0, 43.38847385785246, 1.0] and parameters: {'gamma': 110.02869293151403, 'sigma': 61.89168565787972, 'delta': 99.41431184200671, 'mean_degree': 2.4562443003860306, 'res_sz': 50, 'window': 0.015128978940826016, 'spect_rad': 0.005430376469401313, 'ridge_alpha': 0.9974965243732267}. 
[I 2024-09-25 19:33:31,658] Trial 24 finished with values: [0.0, 28.83349973612962, 0.0, 9.0, 7.875442282972934, 0.0, 1.0, 14.011744882425749, 1.0] and parameters: {'gamma': 370.75364016087883, 'sigma': 72.21239661022912, 'delta': 40.16607923465439, 'mean_degree': 0.7633273168051804, 'res_sz': 21, 'window': 0.024113059827665727, 'spect_rad': 73.14890136126836, 'ridge_alpha': 0.455935119380365}. 
[I 2024-09-25 19:33:36,397] A new study created in memory with name: SINDY predicting Belozyorov3DQuad(sigma=0.00)
[I 2024-09-25 19:33:38,244] Trial 0 finished with values: [1.0, 11.811971668637398, 1.0, 5.0, 8.436789881649572, 0.0, 1.0, 46.304789704554764, 1.0] and parameters: {'optimizer__threshold': 4.3728323621301054e-05, 'optimizer__alpha': 0.0012008899491673375, 'discrete_time': True, 'feature_library': 1, 'differentiation_method': 2}. 
[I 2024-09-25 19:33:40,478] Trial 1 finished with values: [3.0, 9.21907398576071, 0.0, 8.0, 7.061600057470296, 0.6666666666666666, 2.0, 58.84016313685302, 0.5] and parameters: {'optimizer__threshold': 0.00025617578843513633, 'optimizer__alpha': 0.375943503363963, 'discrete_time': False, 'feature_library': 0, 'differentiation_method': 8}. 
[I 2024-09-25 19:33:42,891] Trial 2 finished with values: [7.0, 6.213319451952543, 0.6666666666666666, 32.0, 7.60872465625899, 1.0, 3.0, 43.42686568800901, 1.0] and parameters: {'optimizer__threshold': 2.111924131095546, 'optimizer__alpha': 0.00021529828288239844, 'discrete_time': False, 'feature_library': 0, 'differentiation_method': 6}. 
[I 2024-09-25 19:33:44,711] Trial 3 finished with values: [1.0, 11.811971668637398, 1.0, 5.0, 8.436789881649572, 0.0, 1.0, 46.304789704554764, 1.0] and parameters: {'optimizer__threshold': 3.856090136392062e-05, 'optimizer__alpha': 0.15683008749170121, 'discrete_time': True, 'feature_library': 1, 'differentiation_method': 1}. 
[I 2024-09-25 19:33:46,541] Trial 4 finished with values: [5.0, 8.159635305400597, 0.3333333333333333, 4.0, 8.570825460921112, 0.6666666666666666, 2.0, 36.04379809344782, 0.5] and parameters: {'optimizer__threshold': 0.06184235779202217, 'optimizer__alpha': 0.02988593145252714, 'discrete_time': True, 'feature_library': 0, 'differentiation_method': 6}. 
[I 2024-09-25 19:33:48,730] Trial 5 finished with values: [5.0, 8.159635305400597, 0.3333333333333333, 4.0, 8.570825460921112, 0.6666666666666666, 2.0, 36.04379809344782, 0.5] and parameters: {'optimizer__threshold': 0.7298692284996039, 'optimizer__alpha': 0.2663009847926485, 'discrete_time': True, 'feature_library': 0, 'differentiation_method': 1}. 
[I 2024-09-25 19:33:51,043] Trial 6 finished with values: [7.0, 5.4698564886470376, 1.0, 33.0, 7.412778566450582, 1.0, 3.0, 43.051765838389976, 1.0] and parameters: {'optimizer__threshold': 0.7889029549762058, 'optimizer__alpha': 1.2311354064546334e-05, 'discrete_time': False, 'feature_library': 0, 'differentiation_method': 2}. 
[I 2024-09-25 19:33:53,399] Trial 7 finished with values: [7.0, 7.606598379572443, 0.0, 21.0, 9.57532704802095, 1.0, 3.0, 47.02060646416075, 1.0] and parameters: {'optimizer__threshold': 0.03526929047570483, 'optimizer__alpha': 0.0026423110625728033, 'discrete_time': False, 'feature_library': 0, 'differentiation_method': 4}. 
[I 2024-09-25 19:33:56,098] Trial 8 finished with values: [7.0, 7.606598379572443, 0.0, 21.0, 9.57532704802095, 1.0, 3.0, 47.02060646416075, 1.0] and parameters: {'optimizer__threshold': 0.08229064847823524, 'optimizer__alpha': 0.01492644168226153, 'discrete_time': False, 'feature_library': 0, 'differentiation_method': 4}. 
[I 2024-09-25 19:33:57,919] Trial 9 finished with values: [1.0, 11.811971668637398, 1.0, 5.0, 8.436789881649572, 0.0, 1.0, 46.304789704554764, 1.0] and parameters: {'optimizer__threshold': 0.0005377972806778884, 'optimizer__alpha': 2.1468021585154604, 'discrete_time': True, 'feature_library': 1, 'differentiation_method': 6}. 
[I 2024-09-25 19:33:59,746] Trial 10 finished with values: [1.0, 11.811971668637398, 1.0, 5.0, 8.436789881649572, 0.0, 1.0, 46.304789704554764, 1.0] and parameters: {'optimizer__threshold': 3.055200964239997, 'optimizer__alpha': 0.003220691897401255, 'discrete_time': True, 'feature_library': 1, 'differentiation_method': 1}. 
[I 2024-09-25 19:34:02,060] Trial 11 finished with values: [9.0, 6.714009350308873, 1.0, 33.0, 7.446686354693696, 1.0, 3.0, 46.83053666497415, 1.0] and parameters: {'optimizer__threshold': 2.3514304648465236, 'optimizer__alpha': 2.962632871505153, 'discrete_time': False, 'feature_library': 0, 'differentiation_method': 3}. 
[I 2024-09-25 19:34:04,361] Trial 12 finished with values: [3.0, 21.748810626078658, 0.3333333333333333, 20.0, 6.556783653922892, 0.6666666666666666, 1.0, 390.4794374771271, 1.0] and parameters: {'optimizer__threshold': 2.3426716103528764, 'optimizer__alpha': 0.001373205527401482, 'discrete_time': False, 'feature_library': 1, 'differentiation_method': 2}. 
[I 2024-09-25 19:34:06,182] Trial 13 finished with values: [1.0, 11.811971668637398, 1.0, 5.0, 8.436789881649572, 0.0, 1.0, 46.304789704554764, 1.0] and parameters: {'optimizer__threshold': 0.060343634413487154, 'optimizer__alpha': 0.001593673923883271, 'discrete_time': True, 'feature_library': 1, 'differentiation_method': 4}. 
[I 2024-09-25 19:34:08,017] Trial 14 finished with values: [5.0, 8.159635305400597, 0.3333333333333333, 4.0, 8.570825460921112, 0.6666666666666666, 2.0, 36.04379809344782, 0.5] and parameters: {'optimizer__threshold': 0.018982390615045468, 'optimizer__alpha': 0.0014561465586850153, 'discrete_time': True, 'feature_library': 0, 'differentiation_method': 5}. 
[I 2024-09-25 19:34:10,309] Trial 15 finished with values: [3.0, 21.61382366427948, 0.3333333333333333, 20.0, 6.5678078433519165, 0.6666666666666666, 1.0, 405.103526740908, 1.0] and parameters: {'optimizer__threshold': 0.0001385128985470639, 'optimizer__alpha': 1.4436244285403516e-05, 'discrete_time': False, 'feature_library': 1, 'differentiation_method': 0}. 
