[I 2024-09-26 16:02:27,699] Trial 19 finished with values: [1.0, 7871.456555634992, 0.5, 2.0, 14.02115759136475, 0.9, 1.0, 1.498588436916148, 0.2222222222222222] and parameters: {'h': 10, 'n_pool_kernel_size': [2, 2, 2], 'n_freq_downsample': [1, 1, 1], 'learning_rate': 0.03337114527636707, 'scaler_type': 'robust', 'max_steps': 500.0, 'batch_size': 256, 'windows_batch_size': 256, 'random_seed': 14}. 
SLURM auto-requeueing enabled. Setting signal handlers.
SLURM auto-requeueing enabled. Setting signal handlers.
SLURM auto-requeueing enabled. Setting signal handlers.
SLURM auto-requeueing enabled. Setting signal handlers.
SLURM auto-requeueing enabled. Setting signal handlers.
SLURM auto-requeueing enabled. Setting signal handlers.
SLURM auto-requeueing enabled. Setting signal handlers.
SLURM auto-requeueing enabled. Setting signal handlers.
SLURM auto-requeueing enabled. Setting signal handlers.
SLURM auto-requeueing enabled. Setting signal handlers.
SLURM auto-requeueing enabled. Setting signal handlers.
SLURM auto-requeueing enabled. Setting signal handlers.
SLURM auto-requeueing enabled. Setting signal handlers.
SLURM auto-requeueing enabled. Setting signal handlers.
SLURM auto-requeueing enabled. Setting signal handlers.
SLURM auto-requeueing enabled. Setting signal handlers.
SLURM auto-requeueing enabled. Setting signal handlers.
SLURM auto-requeueing enabled. Setting signal handlers.
SLURM auto-requeueing enabled. Setting signal handlers.
SLURM auto-requeueing enabled. Setting signal handlers.
SLURM auto-requeueing enabled. Setting signal handlers.
SLURM auto-requeueing enabled. Setting signal handlers.
SLURM auto-requeueing enabled. Setting signal handlers.
SLURM auto-requeueing enabled. Setting signal handlers.
SLURM auto-requeueing enabled. Setting signal handlers.
SLURM auto-requeueing enabled. Setting signal handlers.
SLURM auto-requeueing enabled. Setting signal handlers.
SLURM auto-requeueing enabled. Setting signal handlers.
SLURM auto-requeueing enabled. Setting signal handlers.
SLURM auto-requeueing enabled. Setting signal handlers.
SLURM auto-requeueing enabled. Setting signal handlers.
SLURM auto-requeueing enabled. Setting signal handlers.
SLURM auto-requeueing enabled. Setting signal handlers.
SLURM auto-requeueing enabled. Setting signal handlers.
SLURM auto-requeueing enabled. Setting signal handlers.
SLURM auto-requeueing enabled. Setting signal handlers.
SLURM auto-requeueing enabled. Setting signal handlers.
SLURM auto-requeueing enabled. Setting signal handlers.
SLURM auto-requeueing enabled. Setting signal handlers.
SLURM auto-requeueing enabled. Setting signal handlers.
SLURM auto-requeueing enabled. Setting signal handlers.
SLURM auto-requeueing enabled. Setting signal handlers.
SLURM auto-requeueing enabled. Setting signal handlers.
SLURM auto-requeueing enabled. Setting signal handlers.
SLURM auto-requeueing enabled. Setting signal handlers.
SLURM auto-requeueing enabled. Setting signal handlers.
SLURM auto-requeueing enabled. Setting signal handlers.
SLURM auto-requeueing enabled. Setting signal handlers.
SLURM auto-requeueing enabled. Setting signal handlers.
SLURM auto-requeueing enabled. Setting signal handlers.
SLURM auto-requeueing enabled. Setting signal handlers.
SLURM auto-requeueing enabled. Setting signal handlers.
SLURM auto-requeueing enabled. Setting signal handlers.
SLURM auto-requeueing enabled. Setting signal handlers.
SLURM auto-requeueing enabled. Setting signal handlers.
SLURM auto-requeueing enabled. Setting signal handlers.
SLURM auto-requeueing enabled. Setting signal handlers.
SLURM auto-requeueing enabled. Setting signal handlers.
SLURM auto-requeueing enabled. Setting signal handlers.
SLURM auto-requeueing enabled. Setting signal handlers.
SLURM auto-requeueing enabled. Setting signal handlers.
SLURM auto-requeueing enabled. Setting signal handlers.
SLURM auto-requeueing enabled. Setting signal handlers.
SLURM auto-requeueing enabled. Setting signal handlers.
SLURM auto-requeueing enabled. Setting signal handlers.
SLURM auto-requeueing enabled. Setting signal handlers.
[I 2024-09-26 16:07:04,727] Trial 20 finished with values: [1.0, 2.315549171939346, 0.0, 2.0, 1.2245936990625315, 0.0, 2.0, 1.2946397445758935, 0.2222222222222222] and parameters: {'h': 4, 'n_pool_kernel_size': [2, 2, 1], 'n_freq_downsample': [168, 24, 1], 'learning_rate': 0.004469824668282529, 'scaler_type': 'robust', 'max_steps': 1400.0, 'batch_size': 32, 'windows_batch_size': 256, 'random_seed': 17}. 
SLURM auto-requeueing enabled. Setting signal handlers.
SLURM auto-requeueing enabled. Setting signal handlers.
SLURM auto-requeueing enabled. Setting signal handlers.
SLURM auto-requeueing enabled. Setting signal handlers.
SLURM auto-requeueing enabled. Setting signal handlers.
SLURM auto-requeueing enabled. Setting signal handlers.
SLURM auto-requeueing enabled. Setting signal handlers.
SLURM auto-requeueing enabled. Setting signal handlers.
SLURM auto-requeueing enabled. Setting signal handlers.
SLURM auto-requeueing enabled. Setting signal handlers.
SLURM auto-requeueing enabled. Setting signal handlers.
SLURM auto-requeueing enabled. Setting signal handlers.
SLURM auto-requeueing enabled. Setting signal handlers.
SLURM auto-requeueing enabled. Setting signal handlers.
SLURM auto-requeueing enabled. Setting signal handlers.
SLURM auto-requeueing enabled. Setting signal handlers.
SLURM auto-requeueing enabled. Setting signal handlers.
SLURM auto-requeueing enabled. Setting signal handlers.
SLURM auto-requeueing enabled. Setting signal handlers.
SLURM auto-requeueing enabled. Setting signal handlers.
SLURM auto-requeueing enabled. Setting signal handlers.
SLURM auto-requeueing enabled. Setting signal handlers.
SLURM auto-requeueing enabled. Setting signal handlers.
SLURM auto-requeueing enabled. Setting signal handlers.
SLURM auto-requeueing enabled. Setting signal handlers.
SLURM auto-requeueing enabled. Setting signal handlers.
SLURM auto-requeueing enabled. Setting signal handlers.
SLURM auto-requeueing enabled. Setting signal handlers.
SLURM auto-requeueing enabled. Setting signal handlers.
SLURM auto-requeueing enabled. Setting signal handlers.
SLURM auto-requeueing enabled. Setting signal handlers.
SLURM auto-requeueing enabled. Setting signal handlers.
SLURM auto-requeueing enabled. Setting signal handlers.
SLURM auto-requeueing enabled. Setting signal handlers.
SLURM auto-requeueing enabled. Setting signal handlers.
SLURM auto-requeueing enabled. Setting signal handlers.
SLURM auto-requeueing enabled. Setting signal handlers.
SLURM auto-requeueing enabled. Setting signal handlers.
SLURM auto-requeueing enabled. Setting signal handlers.
SLURM auto-requeueing enabled. Setting signal handlers.
SLURM auto-requeueing enabled. Setting signal handlers.
SLURM auto-requeueing enabled. Setting signal handlers.
SLURM auto-requeueing enabled. Setting signal handlers.
SLURM auto-requeueing enabled. Setting signal handlers.
SLURM auto-requeueing enabled. Setting signal handlers.
[I 2024-09-26 16:09:10,398] Trial 21 finished with values: [1.0, 0.8955911547902041, 0.9, 3.0, 0.8672296971245671, 0.8, 1.0, 1.1244478881319833, 0.7777777777777778] and parameters: {'h': 6, 'n_pool_kernel_size': [1, 1, 1], 'n_freq_downsample': [24, 12, 1], 'learning_rate': 0.00013697236936332057, 'scaler_type': None, 'max_steps': 700.0, 'batch_size': 64, 'windows_batch_size': 256, 'random_seed': 20}. 
SLURM auto-requeueing enabled. Setting signal handlers.
SLURM auto-requeueing enabled. Setting signal handlers.
SLURM auto-requeueing enabled. Setting signal handlers.
SLURM auto-requeueing enabled. Setting signal handlers.
SLURM auto-requeueing enabled. Setting signal handlers.
SLURM auto-requeueing enabled. Setting signal handlers.
SLURM auto-requeueing enabled. Setting signal handlers.
SLURM auto-requeueing enabled. Setting signal handlers.
SLURM auto-requeueing enabled. Setting signal handlers.
SLURM auto-requeueing enabled. Setting signal handlers.
SLURM auto-requeueing enabled. Setting signal handlers.
SLURM auto-requeueing enabled. Setting signal handlers.
SLURM auto-requeueing enabled. Setting signal handlers.
SLURM auto-requeueing enabled. Setting signal handlers.
SLURM auto-requeueing enabled. Setting signal handlers.
SLURM auto-requeueing enabled. Setting signal handlers.
SLURM auto-requeueing enabled. Setting signal handlers.
SLURM auto-requeueing enabled. Setting signal handlers.
SLURM auto-requeueing enabled. Setting signal handlers.
SLURM auto-requeueing enabled. Setting signal handlers.
SLURM auto-requeueing enabled. Setting signal handlers.
SLURM auto-requeueing enabled. Setting signal handlers.
SLURM auto-requeueing enabled. Setting signal handlers.
SLURM auto-requeueing enabled. Setting signal handlers.
SLURM auto-requeueing enabled. Setting signal handlers.
SLURM auto-requeueing enabled. Setting signal handlers.
[I 2024-09-26 16:11:58,341] Trial 22 finished with values: [1.0, 1.680432335128314, 0.2, 2.0, 1.0311691839312158, 0.3, 2.0, 1.2908415084183493, 0.0] and parameters: {'h': 11, 'n_pool_kernel_size': [2, 2, 2], 'n_freq_downsample': [40, 20, 1], 'learning_rate': 0.007058141689787387, 'scaler_type': 'standard', 'max_steps': 900.0, 'batch_size': 32, 'windows_batch_size': 256, 'random_seed': 15}. 
SLURM auto-requeueing enabled. Setting signal handlers.
SLURM auto-requeueing enabled. Setting signal handlers.
SLURM auto-requeueing enabled. Setting signal handlers.
SLURM auto-requeueing enabled. Setting signal handlers.
SLURM auto-requeueing enabled. Setting signal handlers.
SLURM auto-requeueing enabled. Setting signal handlers.
SLURM auto-requeueing enabled. Setting signal handlers.
SLURM auto-requeueing enabled. Setting signal handlers.
SLURM auto-requeueing enabled. Setting signal handlers.
SLURM auto-requeueing enabled. Setting signal handlers.
SLURM auto-requeueing enabled. Setting signal handlers.
SLURM auto-requeueing enabled. Setting signal handlers.
SLURM auto-requeueing enabled. Setting signal handlers.
SLURM auto-requeueing enabled. Setting signal handlers.
SLURM auto-requeueing enabled. Setting signal handlers.
SLURM auto-requeueing enabled. Setting signal handlers.
SLURM auto-requeueing enabled. Setting signal handlers.
SLURM auto-requeueing enabled. Setting signal handlers.
SLURM auto-requeueing enabled. Setting signal handlers.
SLURM auto-requeueing enabled. Setting signal handlers.
SLURM auto-requeueing enabled. Setting signal handlers.
SLURM auto-requeueing enabled. Setting signal handlers.
SLURM auto-requeueing enabled. Setting signal handlers.
SLURM auto-requeueing enabled. Setting signal handlers.
SLURM auto-requeueing enabled. Setting signal handlers.
SLURM auto-requeueing enabled. Setting signal handlers.
SLURM auto-requeueing enabled. Setting signal handlers.
SLURM auto-requeueing enabled. Setting signal handlers.
SLURM auto-requeueing enabled. Setting signal handlers.
SLURM auto-requeueing enabled. Setting signal handlers.
SLURM auto-requeueing enabled. Setting signal handlers.
[I 2024-09-26 16:16:52,053] Trial 23 finished with values: [1.0, 1.1594276160096133, 0.1, 2.0, 1.0036250377105713, 0.3, 2.0, 1.3098646837923829, 0.3333333333333333] and parameters: {'h': 9, 'n_pool_kernel_size': [2, 2, 2], 'n_freq_downsample': [40, 20, 1], 'learning_rate': 0.004114890660020516, 'scaler_type': 'standard', 'max_steps': 1500.0, 'batch_size': 256, 'windows_batch_size': 256, 'random_seed': 1}. 
SLURM auto-requeueing enabled. Setting signal handlers.
SLURM auto-requeueing enabled. Setting signal handlers.
SLURM auto-requeueing enabled. Setting signal handlers.
SLURM auto-requeueing enabled. Setting signal handlers.
SLURM auto-requeueing enabled. Setting signal handlers.
SLURM auto-requeueing enabled. Setting signal handlers.
SLURM auto-requeueing enabled. Setting signal handlers.
SLURM auto-requeueing enabled. Setting signal handlers.
SLURM auto-requeueing enabled. Setting signal handlers.
SLURM auto-requeueing enabled. Setting signal handlers.
SLURM auto-requeueing enabled. Setting signal handlers.
SLURM auto-requeueing enabled. Setting signal handlers.
SLURM auto-requeueing enabled. Setting signal handlers.
SLURM auto-requeueing enabled. Setting signal handlers.
SLURM auto-requeueing enabled. Setting signal handlers.
SLURM auto-requeueing enabled. Setting signal handlers.
SLURM auto-requeueing enabled. Setting signal handlers.
SLURM auto-requeueing enabled. Setting signal handlers.
SLURM auto-requeueing enabled. Setting signal handlers.
SLURM auto-requeueing enabled. Setting signal handlers.
SLURM auto-requeueing enabled. Setting signal handlers.
SLURM auto-requeueing enabled. Setting signal handlers.
SLURM auto-requeueing enabled. Setting signal handlers.
SLURM auto-requeueing enabled. Setting signal handlers.
SLURM auto-requeueing enabled. Setting signal handlers.
SLURM auto-requeueing enabled. Setting signal handlers.
SLURM auto-requeueing enabled. Setting signal handlers.
SLURM auto-requeueing enabled. Setting signal handlers.
SLURM auto-requeueing enabled. Setting signal handlers.
SLURM auto-requeueing enabled. Setting signal handlers.
SLURM auto-requeueing enabled. Setting signal handlers.
SLURM auto-requeueing enabled. Setting signal handlers.
SLURM auto-requeueing enabled. Setting signal handlers.
SLURM auto-requeueing enabled. Setting signal handlers.
SLURM auto-requeueing enabled. Setting signal handlers.
SLURM auto-requeueing enabled. Setting signal handlers.
SLURM auto-requeueing enabled. Setting signal handlers.
SLURM auto-requeueing enabled. Setting signal handlers.
SLURM auto-requeueing enabled. Setting signal handlers.
SLURM auto-requeueing enabled. Setting signal handlers.
SLURM auto-requeueing enabled. Setting signal handlers.
SLURM auto-requeueing enabled. Setting signal handlers.
SLURM auto-requeueing enabled. Setting signal handlers.
SLURM auto-requeueing enabled. Setting signal handlers.
SLURM auto-requeueing enabled. Setting signal handlers.
SLURM auto-requeueing enabled. Setting signal handlers.
SLURM auto-requeueing enabled. Setting signal handlers.
SLURM auto-requeueing enabled. Setting signal handlers.
SLURM auto-requeueing enabled. Setting signal handlers.
SLURM auto-requeueing enabled. Setting signal handlers.
SLURM auto-requeueing enabled. Setting signal handlers.
SLURM auto-requeueing enabled. Setting signal handlers.
SLURM auto-requeueing enabled. Setting signal handlers.
SLURM auto-requeueing enabled. Setting signal handlers.
SLURM auto-requeueing enabled. Setting signal handlers.
SLURM auto-requeueing enabled. Setting signal handlers.
SLURM auto-requeueing enabled. Setting signal handlers.
SLURM auto-requeueing enabled. Setting signal handlers.
SLURM auto-requeueing enabled. Setting signal handlers.
SLURM auto-requeueing enabled. Setting signal handlers.
SLURM auto-requeueing enabled. Setting signal handlers.
SLURM auto-requeueing enabled. Setting signal handlers.
SLURM auto-requeueing enabled. Setting signal handlers.
SLURM auto-requeueing enabled. Setting signal handlers.
SLURM auto-requeueing enabled. Setting signal handlers.
SLURM auto-requeueing enabled. Setting signal handlers.
[I 2024-09-26 16:22:29,954] Trial 24 finished with values: [1.0, 2.830425217826697, 0.0, 2.0, 1.1630031136502272, 0.1, 2.0, 120.182014911565, 0.6666666666666666] and parameters: {'h': 4, 'n_pool_kernel_size': [4, 4, 4], 'n_freq_downsample': [180, 60, 1], 'learning_rate': 0.001089685767256121, 'scaler_type': 'robust', 'max_steps': 1100.0, 'batch_size': 128, 'windows_batch_size': 512, 'random_seed': 10}. 
[I 2024-09-26 16:22:41,935] A new study created in memory with name: ResComp predicting coupled_logistic_map(sigma=0.15)
/nas/longleaf/home/djpassey/.local/lib/python3.9/site-packages/scipy/integrate/_odepack_py.py:248: ODEintWarning: Excess work done on this call (perhaps wrong Dfun type). Run with full_output = 1 to get quantitative information.
  warnings.warn(warning_msg, ODEintWarning)
/nas/longleaf/home/djpassey/.local/lib/python3.9/site-packages/interfere/methods/reservoir_computer.py:480: RuntimeWarning: overflow encountered in matmul
  pred = self.W_out_ @ states.T
/nas/longleaf/home/djpassey/.local/lib/python3.9/site-packages/interfere/methods/reservoir_computer.py:480: RuntimeWarning: invalid value encountered in matmul
  pred = self.W_out_ @ states.T
[I 2024-09-26 16:22:52,328] Trial 0 finished with values: [1.0, 2082649593.66401, 0.0, 0.0, 2909969238.3669915, 0.0, 1.0, 3013013412.348803, 0.0] and parameters: {'gamma': 157.21828036339033, 'sigma': 98.69970008025881, 'delta': 3.0271255945453013, 'mean_degree': 3.421094756829863, 'res_sz': 85, 'window': 0.007661320340685808, 'spect_rad': 6.099384490698078, 'ridge_alpha': 3.4093201631925907e-09}. 
[I 2024-09-26 16:23:05,686] Trial 1 finished with values: [1.0, 2464224231.274481, 0.0, 1.0, 2699.9796320513415, 0.0, 1.0, 1.8388952606918754, 0.0] and parameters: {'gamma': 472.85201718922815, 'sigma': 73.66130383682524, 'delta': 83.87398580278449, 'mean_degree': 3.506285177044599, 'res_sz': 61, 'window': 1.0955455436960626, 'spect_rad': 0.0010364944966896276, 'ridge_alpha': 5.447530663951906e-09}. 
[I 2024-09-26 16:23:17,468] Trial 2 finished with values: [1.0, 1.280362654177832, 0.2, 1.0, 1.1897309437545076, 0.1, 1.0, 1.3225994138313515, 0.3333333333333333] and parameters: {'gamma': 116.70254643933605, 'sigma': 11.816910626999318, 'delta': 1.1281250757653052, 'mean_degree': 0.5818377450410357, 'res_sz': 31, 'window': 0.33450597675324284, 'spect_rad': 0.005159016007291467, 'ridge_alpha': 0.13450310899085233}. 
[I 2024-09-26 16:23:25,847] Trial 3 finished with values: [1.0, 0.9704387191698923, 0.5, 0.0, 1.1002195055202757, 0.1, 1.0, 1.2009242629403856, 0.2222222222222222] and parameters: {'gamma': 330.17155908933483, 'sigma': 72.39001475288904, 'delta': 53.58313978466651, 'mean_degree': 0.21528384353644342, 'res_sz': 20, 'window': 6.4342368125951666, 'spect_rad': 12.526914495029235, 'ridge_alpha': 0.14726281063423574}. 
[I 2024-09-26 16:23:36,271] Trial 4 finished with values: [1.0, 2249518663.6910777, 0.0, 0.0, 420017880.7121668, 1.0, 0.0, 434891026.20756716, 0.7777777777777778] and parameters: {'gamma': 418.4905526075074, 'sigma': 85.30514472272515, 'delta': 6.672838468048342, 'mean_degree': 0.6466910335644216, 'res_sz': 75, 'window': 0.0021714432984178402, 'spect_rad': 0.8299502815917356, 'ridge_alpha': 0.0004216885115087362}. 
/nas/longleaf/home/djpassey/.local/lib/python3.9/site-packages/interfere/methods/reservoir_computer.py:378: RuntimeWarning: overflow encountered in matmul
  self.Rhat_ += states.T @ states
/nas/longleaf/home/djpassey/.local/lib/python3.9/site-packages/scipy/integrate/_odepack_py.py:248: ODEintWarning: Excess accuracy requested (tolerances too small). Run with full_output = 1 to get quantitative information.
  warnings.warn(warning_msg, ODEintWarning)
/nas/longleaf/home/djpassey/.local/lib/python3.9/site-packages/scipy/stats/_axis_nan_policy.py:551: RuntimeWarning: Precision loss occurred in moment calculation due to catastrophic cancellation. This occurs when the data are nearly identical. Results may be unreliable.
  res = hypotest_fun_out(*samples, axis=axis, **kwds)
[I 2024-09-26 16:23:43,400] Trial 5 finished with values: [0.0, 2688689064.100812, 0.0, 0.0, 2969974917.171208, 0.0, 0.0, 3075143936.824981, 0.0] and parameters: {'gamma': 181.85149835554046, 'sigma': 88.32823079986117, 'delta': 91.80770020306697, 'mean_degree': 2.556728906019906, 'res_sz': 44, 'window': 6.414398917471882, 'spect_rad': 26.827688835382073, 'ridge_alpha': 4.0956637062247355e-10}. 
[I 2024-09-26 16:23:50,361] Trial 6 finished with values: [1.0, 2333641680.3151674, 0.0, 0.0, 2.031630887198863, 0.0, 0.0, 2.3859011251054336, 0.3333333333333333] and parameters: {'gamma': 187.37817325814993, 'sigma': 90.34732812856508, 'delta': 64.6935598521064, 'mean_degree': 2.5145874201796525, 'res_sz': 68, 'window': 7.061069124927115, 'spect_rad': 35.32860757906381, 'ridge_alpha': 2.927749310565108e-10}. 
[I 2024-09-26 16:24:00,341] Trial 7 finished with values: [1.0, 39.24690518590988, 1.0, 0.0, 24765282.989723794, 1.0, 0.0, 22772909.40875692, 0.7777777777777778] and parameters: {'gamma': 243.1542595801227, 'sigma': 56.562193293470564, 'delta': 61.97000765777889, 'mean_degree': 4.072848523460932, 'res_sz': 76, 'window': 0.0011310499511386057, 'spect_rad': 24.012922001116724, 'ridge_alpha': 0.0037237762693980332}. 
[I 2024-09-26 16:24:10,956] Trial 8 finished with values: [1.0, 2000018428.7776773, 0.0, 0.0, 2909969238.3669915, 0.0, 1.0, 3013013412.348803, 0.0] and parameters: {'gamma': 340.35626072467545, 'sigma': 56.709768261158054, 'delta': 37.94296398048278, 'mean_degree': 2.745646664164519, 'res_sz': 92, 'window': 0.0017575461866091591, 'spect_rad': 7.6977799537698495, 'ridge_alpha': 2.8525289187093605e-07}. 
[I 2024-09-26 16:24:22,407] Trial 9 finished with values: [1.0, 1.6747230383320872, 0.0, 1.0, 1.8913612199497307, 0.0, 1.0, 1.0868723507662927, 0.6666666666666666] and parameters: {'gamma': 255.80300614521036, 'sigma': 8.022745674932814, 'delta': 83.73871526380651, 'mean_degree': 2.6465933183466297, 'res_sz': 34, 'window': 0.004123073148749504, 'spect_rad': 0.0028911434415085794, 'ridge_alpha': 12.397064691691046}. 
[I 2024-09-26 16:24:32,915] Trial 10 finished with values: [1.0, 1.2819961957279338, 0.1, 0.0, 2909969238.3669915, 0.0, 1.0, 1.695770067648825, 0.1111111111111111] and parameters: {'gamma': 402.9281014387979, 'sigma': 40.092578416519984, 'delta': 31.091332395004788, 'mean_degree': 0.11291163192556908, 'res_sz': 62, 'window': 0.024418598965050158, 'spect_rad': 13.185946499380583, 'ridge_alpha': 0.0009408953404327544}. 
