[I 2024-09-25 06:43:29,051] Trial 3 finished with values: [150.0, 0.9540134566951736, 0.8, 50.0, 0.9003232636445783, 0.8, 1.0, 119202.33117653248, 0.0] and parameters: {'optimizer__threshold': 0.0009528011120624714, 'optimizer__alpha': 0.0014040756363602656, 'discrete_time': True, 'feature_library': 0, 'differentiation_method': 4}. 
/nas/longleaf/home/djpassey/.local/lib/python3.9/site-packages/pysindy/optimizers/stlsq.py:201: UserWarning: Sparsity parameter is too big (0.1) and eliminated all coefficients
  warnings.warn(
/nas/longleaf/home/djpassey/.local/lib/python3.9/site-packages/pysindy/optimizers/stlsq.py:201: UserWarning: Sparsity parameter is too big (0.1) and eliminated all coefficients
  warnings.warn(
/nas/longleaf/home/djpassey/.local/lib/python3.9/site-packages/pysindy/optimizers/stlsq.py:201: UserWarning: Sparsity parameter is too big (0.1) and eliminated all coefficients
  warnings.warn(
/nas/longleaf/home/djpassey/.local/lib/python3.9/site-packages/pysindy/optimizers/stlsq.py:201: UserWarning: Sparsity parameter is too big (0.1) and eliminated all coefficients
  warnings.warn(
/nas/longleaf/home/djpassey/.local/lib/python3.9/site-packages/pysindy/optimizers/stlsq.py:201: UserWarning: Sparsity parameter is too big (0.1) and eliminated all coefficients
  warnings.warn(
/nas/longleaf/home/djpassey/.local/lib/python3.9/site-packages/pysindy/optimizers/stlsq.py:201: UserWarning: Sparsity parameter is too big (0.1) and eliminated all coefficients
  warnings.warn(
/nas/longleaf/home/djpassey/.local/lib/python3.9/site-packages/pysindy/optimizers/stlsq.py:201: UserWarning: Sparsity parameter is too big (0.1) and eliminated all coefficients
  warnings.warn(
/nas/longleaf/home/djpassey/.local/lib/python3.9/site-packages/pysindy/optimizers/stlsq.py:201: UserWarning: Sparsity parameter is too big (0.1) and eliminated all coefficients
  warnings.warn(
/nas/longleaf/home/djpassey/.local/lib/python3.9/site-packages/pysindy/optimizers/stlsq.py:201: UserWarning: Sparsity parameter is too big (0.1) and eliminated all coefficients
  warnings.warn(
/nas/longleaf/home/djpassey/.local/lib/python3.9/site-packages/pysindy/optimizers/stlsq.py:201: UserWarning: Sparsity parameter is too big (0.1) and eliminated all coefficients
  warnings.warn(
/nas/longleaf/home/djpassey/.local/lib/python3.9/site-packages/pysindy/optimizers/stlsq.py:201: UserWarning: Sparsity parameter is too big (0.1) and eliminated all coefficients
  warnings.warn(
/nas/longleaf/home/djpassey/.local/lib/python3.9/site-packages/pysindy/optimizers/stlsq.py:201: UserWarning: Sparsity parameter is too big (0.1) and eliminated all coefficients
  warnings.warn(
/nas/longleaf/home/djpassey/.local/lib/python3.9/site-packages/pysindy/optimizers/stlsq.py:201: UserWarning: Sparsity parameter is too big (0.1) and eliminated all coefficients
  warnings.warn(
/nas/longleaf/home/djpassey/.local/lib/python3.9/site-packages/pysindy/optimizers/stlsq.py:201: UserWarning: Sparsity parameter is too big (0.1) and eliminated all coefficients
  warnings.warn(
/nas/longleaf/home/djpassey/.local/lib/python3.9/site-packages/pysindy/optimizers/stlsq.py:201: UserWarning: Sparsity parameter is too big (0.1) and eliminated all coefficients
  warnings.warn(
/nas/longleaf/home/djpassey/.local/lib/python3.9/site-packages/pysindy/optimizers/stlsq.py:201: UserWarning: Sparsity parameter is too big (0.1) and eliminated all coefficients
  warnings.warn(
/nas/longleaf/home/djpassey/.local/lib/python3.9/site-packages/pysindy/optimizers/stlsq.py:201: UserWarning: Sparsity parameter is too big (0.1) and eliminated all coefficients
  warnings.warn(
/nas/longleaf/home/djpassey/.local/lib/python3.9/site-packages/pysindy/optimizers/stlsq.py:201: UserWarning: Sparsity parameter is too big (0.1) and eliminated all coefficients
  warnings.warn(
[I 2024-09-25 06:43:44,200] Trial 4 finished with values: [1.0, 158.61578986489448, 0.1, 7.0, 249.1932945384995, 0.0, 1.0, 89.56725147519245, 0.0] and parameters: {'optimizer__threshold': 0.0006182839165131922, 'optimizer__alpha': 0.00010310935268611715, 'discrete_time': False, 'feature_library': 1, 'differentiation_method': 6}. 
[I 2024-09-25 06:43:49,991] Trial 5 finished with values: [150.0, 0.9540134566951736, 0.8, 50.0, 0.9003232636445783, 0.8, 1.0, 119202.33117653248, 0.0] and parameters: {'optimizer__threshold': 3.344324529974181e-05, 'optimizer__alpha': 0.011004606770992157, 'discrete_time': True, 'feature_library': 0, 'differentiation_method': 3}. 
[I 2024-09-25 06:43:57,234] Trial 6 finished with values: [1.0, 3.95575790349691, 0.2, 50.0, 3.6391207767977463, 0.0, 50.0, 1.5902126699070978, 0.0] and parameters: {'optimizer__threshold': 0.9379608873331291, 'optimizer__alpha': 0.022528695512524313, 'discrete_time': False, 'feature_library': 0, 'differentiation_method': 2}. 
[I 2024-09-25 06:44:04,391] Trial 7 finished with values: [1.0, 3.9274911633928915, 0.0, 5.0, 18.802920025786964, 0.2, 50.0, 1.5902126699070978, 0.0] and parameters: {'optimizer__threshold': 4.580545665136869, 'optimizer__alpha': 0.011468014850863238, 'discrete_time': False, 'feature_library': 0, 'differentiation_method': 1}. 
[I 2024-09-25 06:44:11,687] Trial 8 finished with values: [1.0, 3.95575790349691, 0.2, 50.0, 3.6391207767977463, 0.0, 50.0, 1.5902126699070978, 0.0] and parameters: {'optimizer__threshold': 0.14362567887028696, 'optimizer__alpha': 0.026017712929618, 'discrete_time': False, 'feature_library': 0, 'differentiation_method': 2}. 
[I 2024-09-25 06:44:17,285] Trial 9 finished with values: [150.0, 0.9540134566951736, 0.8, 50.0, 0.9003232636445783, 0.8, 1.0, 119202.33117653248, 0.0] and parameters: {'optimizer__threshold': 0.9102804963919761, 'optimizer__alpha': 0.014733028956412158, 'discrete_time': True, 'feature_library': 0, 'differentiation_method': 3}. 
[I 2024-09-25 06:44:23,142] Trial 10 finished with values: [150.0, 0.9688857625476606, 0.9, 50.0, 0.9176724968223033, 0.7, 1.0, 44.86759315052156, 0.1111111111111111] and parameters: {'optimizer__threshold': 0.17829324404238206, 'optimizer__alpha': 0.0003039012923908725, 'discrete_time': True, 'feature_library': 1, 'differentiation_method': 6}. 
[I 2024-09-25 06:44:28,967] Trial 11 finished with values: [150.0, 0.9688857625476606, 0.9, 50.0, 0.9176724968223033, 0.7, 1.0, 44.86759315052156, 0.1111111111111111] and parameters: {'optimizer__threshold': 0.00017200117780489393, 'optimizer__alpha': 1.3135473205341096e-05, 'discrete_time': True, 'feature_library': 1, 'differentiation_method': 5}. 
[I 2024-09-25 06:44:34,829] Trial 12 finished with values: [150.0, 0.9688857625476606, 0.9, 50.0, 0.9176724968223033, 0.7, 1.0, 44.86759315052156, 0.1111111111111111] and parameters: {'optimizer__threshold': 0.09638083718052427, 'optimizer__alpha': 0.17013837626304468, 'discrete_time': True, 'feature_library': 1, 'differentiation_method': 3}. 
/nas/longleaf/home/djpassey/.local/lib/python3.9/site-packages/pysindy/optimizers/stlsq.py:201: UserWarning: Sparsity parameter is too big (0.1) and eliminated all coefficients
  warnings.warn(
/nas/longleaf/home/djpassey/.local/lib/python3.9/site-packages/pysindy/optimizers/stlsq.py:201: UserWarning: Sparsity parameter is too big (0.1) and eliminated all coefficients
  warnings.warn(
/nas/longleaf/home/djpassey/.local/lib/python3.9/site-packages/pysindy/optimizers/stlsq.py:201: UserWarning: Sparsity parameter is too big (0.1) and eliminated all coefficients
  warnings.warn(
/nas/longleaf/home/djpassey/.local/lib/python3.9/site-packages/pysindy/optimizers/stlsq.py:201: UserWarning: Sparsity parameter is too big (0.1) and eliminated all coefficients
  warnings.warn(
/nas/longleaf/home/djpassey/.local/lib/python3.9/site-packages/pysindy/optimizers/stlsq.py:201: UserWarning: Sparsity parameter is too big (0.1) and eliminated all coefficients
  warnings.warn(
/nas/longleaf/home/djpassey/.local/lib/python3.9/site-packages/pysindy/optimizers/stlsq.py:201: UserWarning: Sparsity parameter is too big (0.1) and eliminated all coefficients
  warnings.warn(
/nas/longleaf/home/djpassey/.local/lib/python3.9/site-packages/pysindy/optimizers/stlsq.py:201: UserWarning: Sparsity parameter is too big (0.1) and eliminated all coefficients
  warnings.warn(
/nas/longleaf/home/djpassey/.local/lib/python3.9/site-packages/pysindy/optimizers/stlsq.py:201: UserWarning: Sparsity parameter is too big (0.1) and eliminated all coefficients
  warnings.warn(
[I 2024-09-25 06:44:41,978] Trial 13 finished with values: [1.0, 24.159748894865825, 0.0, 50.0, 2.9499321373091663, 0.0, 50.0, 1.5902126699070978, 0.0] and parameters: {'optimizer__threshold': 0.07088987931033418, 'optimizer__alpha': 0.6736055843056722, 'discrete_time': False, 'feature_library': 0, 'differentiation_method': 3}. 
[I 2024-09-25 06:44:47,845] Trial 14 finished with values: [150.0, 0.9688857625476606, 0.9, 50.0, 0.9176724968223033, 0.7, 1.0, 44.86759315052156, 0.1111111111111111] and parameters: {'optimizer__threshold': 0.1286561846496306, 'optimizer__alpha': 0.05522177297363775, 'discrete_time': True, 'feature_library': 1, 'differentiation_method': 8}. 
/nas/longleaf/home/djpassey/.local/lib/python3.9/site-packages/pysindy/optimizers/stlsq.py:201: UserWarning: Sparsity parameter is too big (0.1) and eliminated all coefficients
  warnings.warn(
/nas/longleaf/home/djpassey/.local/lib/python3.9/site-packages/pysindy/optimizers/stlsq.py:201: UserWarning: Sparsity parameter is too big (0.1) and eliminated all coefficients
  warnings.warn(
/nas/longleaf/home/djpassey/.local/lib/python3.9/site-packages/pysindy/optimizers/stlsq.py:201: UserWarning: Sparsity parameter is too big (0.1) and eliminated all coefficients
  warnings.warn(
/nas/longleaf/home/djpassey/.local/lib/python3.9/site-packages/pysindy/optimizers/stlsq.py:201: UserWarning: Sparsity parameter is too big (0.1) and eliminated all coefficients
  warnings.warn(
/nas/longleaf/home/djpassey/.local/lib/python3.9/site-packages/pysindy/optimizers/stlsq.py:201: UserWarning: Sparsity parameter is too big (0.1) and eliminated all coefficients
  warnings.warn(
/nas/longleaf/home/djpassey/.local/lib/python3.9/site-packages/pysindy/optimizers/stlsq.py:201: UserWarning: Sparsity parameter is too big (0.1) and eliminated all coefficients
  warnings.warn(
/nas/longleaf/home/djpassey/.local/lib/python3.9/site-packages/pysindy/optimizers/stlsq.py:201: UserWarning: Sparsity parameter is too big (0.1) and eliminated all coefficients
  warnings.warn(
/nas/longleaf/home/djpassey/.local/lib/python3.9/site-packages/pysindy/optimizers/stlsq.py:201: UserWarning: Sparsity parameter is too big (0.1) and eliminated all coefficients
  warnings.warn(
/nas/longleaf/home/djpassey/.local/lib/python3.9/site-packages/pysindy/optimizers/stlsq.py:201: UserWarning: Sparsity parameter is too big (0.1) and eliminated all coefficients
  warnings.warn(
/nas/longleaf/home/djpassey/.local/lib/python3.9/site-packages/pysindy/optimizers/stlsq.py:201: UserWarning: Sparsity parameter is too big (0.1) and eliminated all coefficients
  warnings.warn(
/nas/longleaf/home/djpassey/.local/lib/python3.9/site-packages/pysindy/optimizers/stlsq.py:201: UserWarning: Sparsity parameter is too big (0.1) and eliminated all coefficients
  warnings.warn(
[I 2024-09-25 06:44:55,633] Trial 15 finished with values: [12.0, 4.939074263791717, 0.0, 50.0, 3.178998718661182, 0.0, 50.0, 1.5902126699070978, 0.0] and parameters: {'optimizer__threshold': 0.0005016562781338539, 'optimizer__alpha': 0.06692521035798457, 'discrete_time': False, 'feature_library': 0, 'differentiation_method': 7}. 
/nas/longleaf/home/djpassey/.local/lib/python3.9/site-packages/pysindy/optimizers/stlsq.py:201: UserWarning: Sparsity parameter is too big (0.1) and eliminated all coefficients
  warnings.warn(
/nas/longleaf/home/djpassey/.local/lib/python3.9/site-packages/pysindy/optimizers/stlsq.py:201: UserWarning: Sparsity parameter is too big (0.1) and eliminated all coefficients
  warnings.warn(
/nas/longleaf/home/djpassey/.local/lib/python3.9/site-packages/pysindy/optimizers/stlsq.py:201: UserWarning: Sparsity parameter is too big (0.1) and eliminated all coefficients
  warnings.warn(
/nas/longleaf/home/djpassey/.local/lib/python3.9/site-packages/pysindy/optimizers/stlsq.py:201: UserWarning: Sparsity parameter is too big (0.1) and eliminated all coefficients
  warnings.warn(
/nas/longleaf/home/djpassey/.local/lib/python3.9/site-packages/pysindy/optimizers/stlsq.py:201: UserWarning: Sparsity parameter is too big (0.1) and eliminated all coefficients
  warnings.warn(
/nas/longleaf/home/djpassey/.local/lib/python3.9/site-packages/pysindy/optimizers/stlsq.py:201: UserWarning: Sparsity parameter is too big (0.1) and eliminated all coefficients
  warnings.warn(
/nas/longleaf/home/djpassey/.local/lib/python3.9/site-packages/pysindy/optimizers/stlsq.py:201: UserWarning: Sparsity parameter is too big (0.1) and eliminated all coefficients
  warnings.warn(
/nas/longleaf/home/djpassey/.local/lib/python3.9/site-packages/pysindy/optimizers/stlsq.py:201: UserWarning: Sparsity parameter is too big (0.1) and eliminated all coefficients
  warnings.warn(
/nas/longleaf/home/djpassey/.local/lib/python3.9/site-packages/pysindy/optimizers/stlsq.py:201: UserWarning: Sparsity parameter is too big (0.1) and eliminated all coefficients
  warnings.warn(
/nas/longleaf/home/djpassey/.local/lib/python3.9/site-packages/pysindy/optimizers/stlsq.py:201: UserWarning: Sparsity parameter is too big (0.1) and eliminated all coefficients
  warnings.warn(
/nas/longleaf/home/djpassey/.local/lib/python3.9/site-packages/pysindy/optimizers/stlsq.py:201: UserWarning: Sparsity parameter is too big (0.1) and eliminated all coefficients
  warnings.warn(
[I 2024-09-25 06:45:03,440] Trial 16 finished with values: [12.0, 4.939074263791717, 0.0, 50.0, 3.178998718661182, 0.0, 50.0, 1.5902126699070978, 0.0] and parameters: {'optimizer__threshold': 0.01205505366042542, 'optimizer__alpha': 0.35362083241522674, 'discrete_time': False, 'feature_library': 0, 'differentiation_method': 7}. 
[I 2024-09-25 06:45:09,345] Trial 17 finished with values: [150.0, 0.9540134566951736, 0.8, 50.0, 0.9003232636445783, 0.8, 1.0, 119202.33117653248, 0.0] and parameters: {'optimizer__threshold': 3.252022631788004, 'optimizer__alpha': 0.007861160514467665, 'discrete_time': True, 'feature_library': 0, 'differentiation_method': 6}. 
[I 2024-09-25 06:45:15,232] Trial 18 finished with values: [150.0, 0.9540134566951736, 0.8, 50.0, 0.9003232636445783, 0.8, 1.0, 119202.33117653248, 0.0] and parameters: {'optimizer__threshold': 0.5050220091150623, 'optimizer__alpha': 0.04728627798255224, 'discrete_time': True, 'feature_library': 0, 'differentiation_method': 0}. 
[I 2024-09-25 06:45:20,726] Trial 19 finished with values: [150.0, 0.9688857625476606, 0.9, 50.0, 0.9176724968223033, 0.7, 1.0, 44.86759315052156, 0.1111111111111111] and parameters: {'optimizer__threshold': 0.0003381545190462716, 'optimizer__alpha': 0.48252352807437526, 'discrete_time': True, 'feature_library': 1, 'differentiation_method': 8}. 
[I 2024-09-25 06:45:26,516] Trial 20 finished with values: [150.0, 0.9540134566951736, 0.8, 50.0, 0.9003232636445783, 0.8, 1.0, 119202.33117653248, 0.0] and parameters: {'optimizer__threshold': 0.17769194191222948, 'optimizer__alpha': 0.037830648592701945, 'discrete_time': True, 'feature_library': 0, 'differentiation_method': 7}. 
[I 2024-09-25 06:45:32,349] Trial 21 finished with values: [150.0, 0.9688857625476606, 0.9, 50.0, 0.9176724968223033, 0.7, 1.0, 44.86759315052156, 0.1111111111111111] and parameters: {'optimizer__threshold': 0.1834277531215431, 'optimizer__alpha': 0.06901226063090772, 'discrete_time': True, 'feature_library': 1, 'differentiation_method': 7}. 
/nas/longleaf/home/djpassey/.local/lib/python3.9/site-packages/pysindy/optimizers/stlsq.py:201: UserWarning: Sparsity parameter is too big (0.1) and eliminated all coefficients
  warnings.warn(
/nas/longleaf/home/djpassey/.local/lib/python3.9/site-packages/pysindy/optimizers/stlsq.py:201: UserWarning: Sparsity parameter is too big (0.1) and eliminated all coefficients
  warnings.warn(
[I 2024-09-25 06:45:45,108] Trial 22 finished with values: [1.0, 2153.040112690361, 0.0, 5.0, 1466.0691482668472, 0.1, 1.0, 640.8301664340848, 0.1111111111111111] and parameters: {'optimizer__threshold': 0.001960737491613965, 'optimizer__alpha': 9.733225914955099e-05, 'discrete_time': False, 'feature_library': 1, 'differentiation_method': 1}. 
/nas/longleaf/home/djpassey/.local/lib/python3.9/site-packages/pysindy/optimizers/stlsq.py:201: UserWarning: Sparsity parameter is too big (0.1) and eliminated all coefficients
  warnings.warn(
/nas/longleaf/home/djpassey/.local/lib/python3.9/site-packages/pysindy/optimizers/stlsq.py:201: UserWarning: Sparsity parameter is too big (0.1) and eliminated all coefficients
  warnings.warn(
/nas/longleaf/home/djpassey/.local/lib/python3.9/site-packages/pysindy/optimizers/stlsq.py:201: UserWarning: Sparsity parameter is too big (0.1) and eliminated all coefficients
  warnings.warn(
/nas/longleaf/home/djpassey/.local/lib/python3.9/site-packages/pysindy/optimizers/stlsq.py:201: UserWarning: Sparsity parameter is too big (0.1) and eliminated all coefficients
  warnings.warn(
/nas/longleaf/home/djpassey/.local/lib/python3.9/site-packages/pysindy/optimizers/stlsq.py:201: UserWarning: Sparsity parameter is too big (0.1) and eliminated all coefficients
  warnings.warn(
/nas/longleaf/home/djpassey/.local/lib/python3.9/site-packages/pysindy/optimizers/stlsq.py:201: UserWarning: Sparsity parameter is too big (0.1) and eliminated all coefficients
  warnings.warn(
/nas/longleaf/home/djpassey/.local/lib/python3.9/site-packages/pysindy/optimizers/stlsq.py:201: UserWarning: Sparsity parameter is too big (0.1) and eliminated all coefficients
  warnings.warn(
/nas/longleaf/home/djpassey/.local/lib/python3.9/site-packages/pysindy/optimizers/stlsq.py:201: UserWarning: Sparsity parameter is too big (0.1) and eliminated all coefficients
  warnings.warn(
/nas/longleaf/home/djpassey/.local/lib/python3.9/site-packages/pysindy/optimizers/stlsq.py:201: UserWarning: Sparsity parameter is too big (0.1) and eliminated all coefficients
  warnings.warn(
/nas/longleaf/home/djpassey/.local/lib/python3.9/site-packages/pysindy/optimizers/stlsq.py:201: UserWarning: Sparsity parameter is too big (0.1) and eliminated all coefficients
  warnings.warn(
/nas/longleaf/home/djpassey/.local/lib/python3.9/site-packages/pysindy/optimizers/stlsq.py:201: UserWarning: Sparsity parameter is too big (0.1) and eliminated all coefficients
  warnings.warn(
[I 2024-09-25 06:45:52,683] Trial 23 finished with values: [12.0, 4.939074263791717, 0.0, 50.0, 3.178998718661182, 0.0, 50.0, 1.5902126699070978, 0.0] and parameters: {'optimizer__threshold': 0.6796547785879432, 'optimizer__alpha': 0.00019422549833275003, 'discrete_time': False, 'feature_library': 0, 'differentiation_method': 7}. 
