[I 2024-09-24 23:27:21,907] Trial 19 finished with values: [1.0, 3.530794828130755, 0.0, 50.0, 1.4100077051193587, 0.5, 50.0, 3.354861670469593, 0.4444444444444444] and parameters: {'h': 15, 'n_pool_kernel_size': [2, 2, 2], 'n_freq_downsample': [60, 8, 1], 'learning_rate': 0.001448284244514209, 'scaler_type': 'robust', 'max_steps': 900.0, 'batch_size': 32, 'windows_batch_size': 128, 'random_seed': 16}. 
SLURM auto-requeueing enabled. Setting signal handlers.
SLURM auto-requeueing enabled. Setting signal handlers.
SLURM auto-requeueing enabled. Setting signal handlers.
SLURM auto-requeueing enabled. Setting signal handlers.
SLURM auto-requeueing enabled. Setting signal handlers.
SLURM auto-requeueing enabled. Setting signal handlers.
SLURM auto-requeueing enabled. Setting signal handlers.
SLURM auto-requeueing enabled. Setting signal handlers.
SLURM auto-requeueing enabled. Setting signal handlers.
SLURM auto-requeueing enabled. Setting signal handlers.
SLURM auto-requeueing enabled. Setting signal handlers.
SLURM auto-requeueing enabled. Setting signal handlers.
SLURM auto-requeueing enabled. Setting signal handlers.
SLURM auto-requeueing enabled. Setting signal handlers.
SLURM auto-requeueing enabled. Setting signal handlers.
SLURM auto-requeueing enabled. Setting signal handlers.
SLURM auto-requeueing enabled. Setting signal handlers.
SLURM auto-requeueing enabled. Setting signal handlers.
SLURM auto-requeueing enabled. Setting signal handlers.
SLURM auto-requeueing enabled. Setting signal handlers.
SLURM auto-requeueing enabled. Setting signal handlers.
SLURM auto-requeueing enabled. Setting signal handlers.
SLURM auto-requeueing enabled. Setting signal handlers.
SLURM auto-requeueing enabled. Setting signal handlers.
SLURM auto-requeueing enabled. Setting signal handlers.
SLURM auto-requeueing enabled. Setting signal handlers.
SLURM auto-requeueing enabled. Setting signal handlers.
SLURM auto-requeueing enabled. Setting signal handlers.
SLURM auto-requeueing enabled. Setting signal handlers.
SLURM auto-requeueing enabled. Setting signal handlers.
SLURM auto-requeueing enabled. Setting signal handlers.
SLURM auto-requeueing enabled. Setting signal handlers.
SLURM auto-requeueing enabled. Setting signal handlers.
SLURM auto-requeueing enabled. Setting signal handlers.
SLURM auto-requeueing enabled. Setting signal handlers.
SLURM auto-requeueing enabled. Setting signal handlers.
SLURM auto-requeueing enabled. Setting signal handlers.
SLURM auto-requeueing enabled. Setting signal handlers.
SLURM auto-requeueing enabled. Setting signal handlers.
SLURM auto-requeueing enabled. Setting signal handlers.
SLURM auto-requeueing enabled. Setting signal handlers.
SLURM auto-requeueing enabled. Setting signal handlers.
SLURM auto-requeueing enabled. Setting signal handlers.
SLURM auto-requeueing enabled. Setting signal handlers.
SLURM auto-requeueing enabled. Setting signal handlers.
SLURM auto-requeueing enabled. Setting signal handlers.
SLURM auto-requeueing enabled. Setting signal handlers.
SLURM auto-requeueing enabled. Setting signal handlers.
SLURM auto-requeueing enabled. Setting signal handlers.
SLURM auto-requeueing enabled. Setting signal handlers.
SLURM auto-requeueing enabled. Setting signal handlers.
SLURM auto-requeueing enabled. Setting signal handlers.
SLURM auto-requeueing enabled. Setting signal handlers.
SLURM auto-requeueing enabled. Setting signal handlers.
SLURM auto-requeueing enabled. Setting signal handlers.
SLURM auto-requeueing enabled. Setting signal handlers.
SLURM auto-requeueing enabled. Setting signal handlers.
SLURM auto-requeueing enabled. Setting signal handlers.
SLURM auto-requeueing enabled. Setting signal handlers.
SLURM auto-requeueing enabled. Setting signal handlers.
SLURM auto-requeueing enabled. Setting signal handlers.
SLURM auto-requeueing enabled. Setting signal handlers.
SLURM auto-requeueing enabled. Setting signal handlers.
SLURM auto-requeueing enabled. Setting signal handlers.
SLURM auto-requeueing enabled. Setting signal handlers.
SLURM auto-requeueing enabled. Setting signal handlers.
SLURM auto-requeueing enabled. Setting signal handlers.
SLURM auto-requeueing enabled. Setting signal handlers.
SLURM auto-requeueing enabled. Setting signal handlers.
SLURM auto-requeueing enabled. Setting signal handlers.
SLURM auto-requeueing enabled. Setting signal handlers.
SLURM auto-requeueing enabled. Setting signal handlers.
SLURM auto-requeueing enabled. Setting signal handlers.
SLURM auto-requeueing enabled. Setting signal handlers.
SLURM auto-requeueing enabled. Setting signal handlers.
SLURM auto-requeueing enabled. Setting signal handlers.
SLURM auto-requeueing enabled. Setting signal handlers.
SLURM auto-requeueing enabled. Setting signal handlers.
SLURM auto-requeueing enabled. Setting signal handlers.
SLURM auto-requeueing enabled. Setting signal handlers.
SLURM auto-requeueing enabled. Setting signal handlers.
SLURM auto-requeueing enabled. Setting signal handlers.
SLURM auto-requeueing enabled. Setting signal handlers.
SLURM auto-requeueing enabled. Setting signal handlers.
SLURM auto-requeueing enabled. Setting signal handlers.
SLURM auto-requeueing enabled. Setting signal handlers.
SLURM auto-requeueing enabled. Setting signal handlers.
SLURM auto-requeueing enabled. Setting signal handlers.
SLURM auto-requeueing enabled. Setting signal handlers.
SLURM auto-requeueing enabled. Setting signal handlers.
SLURM auto-requeueing enabled. Setting signal handlers.
SLURM auto-requeueing enabled. Setting signal handlers.
SLURM auto-requeueing enabled. Setting signal handlers.
SLURM auto-requeueing enabled. Setting signal handlers.
SLURM auto-requeueing enabled. Setting signal handlers.
SLURM auto-requeueing enabled. Setting signal handlers.
SLURM auto-requeueing enabled. Setting signal handlers.
SLURM auto-requeueing enabled. Setting signal handlers.
SLURM auto-requeueing enabled. Setting signal handlers.
SLURM auto-requeueing enabled. Setting signal handlers.
SLURM auto-requeueing enabled. Setting signal handlers.
SLURM auto-requeueing enabled. Setting signal handlers.
SLURM auto-requeueing enabled. Setting signal handlers.
SLURM auto-requeueing enabled. Setting signal handlers.
SLURM auto-requeueing enabled. Setting signal handlers.
SLURM auto-requeueing enabled. Setting signal handlers.
SLURM auto-requeueing enabled. Setting signal handlers.
SLURM auto-requeueing enabled. Setting signal handlers.
SLURM auto-requeueing enabled. Setting signal handlers.
SLURM auto-requeueing enabled. Setting signal handlers.
SLURM auto-requeueing enabled. Setting signal handlers.
SLURM auto-requeueing enabled. Setting signal handlers.
SLURM auto-requeueing enabled. Setting signal handlers.
SLURM auto-requeueing enabled. Setting signal handlers.
SLURM auto-requeueing enabled. Setting signal handlers.
SLURM auto-requeueing enabled. Setting signal handlers.
SLURM auto-requeueing enabled. Setting signal handlers.
SLURM auto-requeueing enabled. Setting signal handlers.
SLURM auto-requeueing enabled. Setting signal handlers.
SLURM auto-requeueing enabled. Setting signal handlers.
SLURM auto-requeueing enabled. Setting signal handlers.
SLURM auto-requeueing enabled. Setting signal handlers.
SLURM auto-requeueing enabled. Setting signal handlers.
SLURM auto-requeueing enabled. Setting signal handlers.
SLURM auto-requeueing enabled. Setting signal handlers.
SLURM auto-requeueing enabled. Setting signal handlers.
SLURM auto-requeueing enabled. Setting signal handlers.
[I 2024-09-24 23:31:19,082] Trial 20 finished with values: [1.0, 3.0585335274202436, 0.0, 50.0, 1.1801988184551813, 0.6, 20.0, 13.492023676278544, 0.4444444444444444] and parameters: {'h': 2, 'n_pool_kernel_size': [16, 8, 1], 'n_freq_downsample': [1, 1, 1], 'learning_rate': 0.00023631115843303655, 'scaler_type': 'robust', 'max_steps': 1500.0, 'batch_size': 256, 'windows_batch_size': 128, 'random_seed': 17}. 
SLURM auto-requeueing enabled. Setting signal handlers.
SLURM auto-requeueing enabled. Setting signal handlers.
SLURM auto-requeueing enabled. Setting signal handlers.
SLURM auto-requeueing enabled. Setting signal handlers.
SLURM auto-requeueing enabled. Setting signal handlers.
SLURM auto-requeueing enabled. Setting signal handlers.
SLURM auto-requeueing enabled. Setting signal handlers.
SLURM auto-requeueing enabled. Setting signal handlers.
SLURM auto-requeueing enabled. Setting signal handlers.
SLURM auto-requeueing enabled. Setting signal handlers.
SLURM auto-requeueing enabled. Setting signal handlers.
SLURM auto-requeueing enabled. Setting signal handlers.
SLURM auto-requeueing enabled. Setting signal handlers.
SLURM auto-requeueing enabled. Setting signal handlers.
SLURM auto-requeueing enabled. Setting signal handlers.
SLURM auto-requeueing enabled. Setting signal handlers.
SLURM auto-requeueing enabled. Setting signal handlers.
SLURM auto-requeueing enabled. Setting signal handlers.
SLURM auto-requeueing enabled. Setting signal handlers.
SLURM auto-requeueing enabled. Setting signal handlers.
SLURM auto-requeueing enabled. Setting signal handlers.
SLURM auto-requeueing enabled. Setting signal handlers.
SLURM auto-requeueing enabled. Setting signal handlers.
SLURM auto-requeueing enabled. Setting signal handlers.
SLURM auto-requeueing enabled. Setting signal handlers.
SLURM auto-requeueing enabled. Setting signal handlers.
SLURM auto-requeueing enabled. Setting signal handlers.
SLURM auto-requeueing enabled. Setting signal handlers.
SLURM auto-requeueing enabled. Setting signal handlers.
SLURM auto-requeueing enabled. Setting signal handlers.
SLURM auto-requeueing enabled. Setting signal handlers.
SLURM auto-requeueing enabled. Setting signal handlers.
SLURM auto-requeueing enabled. Setting signal handlers.
SLURM auto-requeueing enabled. Setting signal handlers.
SLURM auto-requeueing enabled. Setting signal handlers.
SLURM auto-requeueing enabled. Setting signal handlers.
SLURM auto-requeueing enabled. Setting signal handlers.
SLURM auto-requeueing enabled. Setting signal handlers.
SLURM auto-requeueing enabled. Setting signal handlers.
SLURM auto-requeueing enabled. Setting signal handlers.
SLURM auto-requeueing enabled. Setting signal handlers.
SLURM auto-requeueing enabled. Setting signal handlers.
SLURM auto-requeueing enabled. Setting signal handlers.
SLURM auto-requeueing enabled. Setting signal handlers.
SLURM auto-requeueing enabled. Setting signal handlers.
[I 2024-09-24 23:36:44,273] Trial 21 finished with values: [1.0, 3.2876716879372463, 0.0, 50.0, 1.3450906800060605, 0.6, 25.0, 9.835786230621306, 0.4444444444444444] and parameters: {'h': 6, 'n_pool_kernel_size': [1, 1, 1], 'n_freq_downsample': [24, 12, 1], 'learning_rate': 0.0028185863796498178, 'scaler_type': 'robust', 'max_steps': 1000.0, 'batch_size': 32, 'windows_batch_size': 512, 'random_seed': 10}. 
SLURM auto-requeueing enabled. Setting signal handlers.
SLURM auto-requeueing enabled. Setting signal handlers.
SLURM auto-requeueing enabled. Setting signal handlers.
SLURM auto-requeueing enabled. Setting signal handlers.
SLURM auto-requeueing enabled. Setting signal handlers.
SLURM auto-requeueing enabled. Setting signal handlers.
SLURM auto-requeueing enabled. Setting signal handlers.
SLURM auto-requeueing enabled. Setting signal handlers.
SLURM auto-requeueing enabled. Setting signal handlers.
SLURM auto-requeueing enabled. Setting signal handlers.
SLURM auto-requeueing enabled. Setting signal handlers.
SLURM auto-requeueing enabled. Setting signal handlers.
SLURM auto-requeueing enabled. Setting signal handlers.
SLURM auto-requeueing enabled. Setting signal handlers.
SLURM auto-requeueing enabled. Setting signal handlers.
SLURM auto-requeueing enabled. Setting signal handlers.
SLURM auto-requeueing enabled. Setting signal handlers.
SLURM auto-requeueing enabled. Setting signal handlers.
SLURM auto-requeueing enabled. Setting signal handlers.
SLURM auto-requeueing enabled. Setting signal handlers.
[I 2024-09-24 23:38:23,554] Trial 22 finished with values: [1.0, 7897599507.394686, 0.0, 1.0, 434267768.24100465, 1.0, 1.0, 11172.0139049701, 0.3333333333333333] and parameters: {'h': 16, 'n_pool_kernel_size': [1, 1, 1], 'n_freq_downsample': [40, 20, 1], 'learning_rate': 0.06492499588317963, 'scaler_type': 'robust', 'max_steps': 800.0, 'batch_size': 128, 'windows_batch_size': 128, 'random_seed': 13}. 
SLURM auto-requeueing enabled. Setting signal handlers.
SLURM auto-requeueing enabled. Setting signal handlers.
SLURM auto-requeueing enabled. Setting signal handlers.
SLURM auto-requeueing enabled. Setting signal handlers.
SLURM auto-requeueing enabled. Setting signal handlers.
SLURM auto-requeueing enabled. Setting signal handlers.
SLURM auto-requeueing enabled. Setting signal handlers.
SLURM auto-requeueing enabled. Setting signal handlers.
SLURM auto-requeueing enabled. Setting signal handlers.
SLURM auto-requeueing enabled. Setting signal handlers.
SLURM auto-requeueing enabled. Setting signal handlers.
SLURM auto-requeueing enabled. Setting signal handlers.
SLURM auto-requeueing enabled. Setting signal handlers.
SLURM auto-requeueing enabled. Setting signal handlers.
SLURM auto-requeueing enabled. Setting signal handlers.
SLURM auto-requeueing enabled. Setting signal handlers.
SLURM auto-requeueing enabled. Setting signal handlers.
SLURM auto-requeueing enabled. Setting signal handlers.
SLURM auto-requeueing enabled. Setting signal handlers.
SLURM auto-requeueing enabled. Setting signal handlers.
[I 2024-09-24 23:42:17,559] Trial 23 finished with values: [1.0, 3.9294525995980565, 0.0, 50.0, 1.391080610145162, 0.3, 50.0, 4.028972271922053, 0.3333333333333333] and parameters: {'h': 16, 'n_pool_kernel_size': [1, 1, 1], 'n_freq_downsample': [24, 12, 1], 'learning_rate': 0.004721590102218744, 'scaler_type': 'robust', 'max_steps': 1500.0, 'batch_size': 64, 'windows_batch_size': 128, 'random_seed': 15}. 
SLURM auto-requeueing enabled. Setting signal handlers.
SLURM auto-requeueing enabled. Setting signal handlers.
SLURM auto-requeueing enabled. Setting signal handlers.
SLURM auto-requeueing enabled. Setting signal handlers.
SLURM auto-requeueing enabled. Setting signal handlers.
SLURM auto-requeueing enabled. Setting signal handlers.
SLURM auto-requeueing enabled. Setting signal handlers.
SLURM auto-requeueing enabled. Setting signal handlers.
SLURM auto-requeueing enabled. Setting signal handlers.
SLURM auto-requeueing enabled. Setting signal handlers.
SLURM auto-requeueing enabled. Setting signal handlers.
SLURM auto-requeueing enabled. Setting signal handlers.
SLURM auto-requeueing enabled. Setting signal handlers.
SLURM auto-requeueing enabled. Setting signal handlers.
SLURM auto-requeueing enabled. Setting signal handlers.
SLURM auto-requeueing enabled. Setting signal handlers.
SLURM auto-requeueing enabled. Setting signal handlers.
SLURM auto-requeueing enabled. Setting signal handlers.
SLURM auto-requeueing enabled. Setting signal handlers.
SLURM auto-requeueing enabled. Setting signal handlers.
SLURM auto-requeueing enabled. Setting signal handlers.
[I 2024-09-24 23:46:20,493] Trial 24 finished with values: [1.0, 2.9122489343251527, 0.0, 50.0, 1.3204433213683617, 0.5, 50.0, 3.636349969022005, 0.3333333333333333] and parameters: {'h': 14, 'n_pool_kernel_size': [16, 8, 1], 'n_freq_downsample': [24, 12, 1], 'learning_rate': 0.0022240531252814043, 'scaler_type': 'robust', 'max_steps': 1200.0, 'batch_size': 128, 'windows_batch_size': 256, 'random_seed': 20}. 
[I 2024-09-24 23:46:27,529] A new study created in memory with name: ResComp predicting GenForecast[cml, VAR]
[I 2024-09-24 23:46:41,153] Trial 0 finished with values: [1.0, 124.5414302926896, 0.0, 1.0, 215.1475829051877, 0.0, 50.0, 7.67723672193526, 0.4444444444444444] and parameters: {'gamma': 404.08276087403146, 'sigma': 6.005414233335517, 'delta': 54.4695605636248, 'mean_degree': 0.2125569379665434, 'res_sz': 23, 'window': 1.8600586254329758, 'spect_rad': 0.028745108519502665, 'ridge_alpha': 3.8159890450150455e-05}. 
[I 2024-09-24 23:46:53,970] Trial 1 finished with values: [1.0, 2.684533325011637, 0.1, 50.0, 1.589702408467565, 0.6, 50.0, 3.598898210793304, 0.2222222222222222] and parameters: {'gamma': 450.81076764049106, 'sigma': 62.14046280337283, 'delta': 96.91359300843693, 'mean_degree': 2.9274025415174973, 'res_sz': 35, 'window': 0.0012944348896759973, 'spect_rad': 0.008274839022049245, 'ridge_alpha': 0.1248815562009475}. 
[I 2024-09-24 23:46:59,988] Trial 2 finished with values: [0.0, 10312059115.32181, 0.0, 0.0, 18788283016.3642, 0.0, 0.0, 30630396567.223938, 0.3333333333333333] and parameters: {'gamma': 464.9978737937411, 'sigma': 87.58208365199329, 'delta': 44.055115587138395, 'mean_degree': 4.683003845596023, 'res_sz': 96, 'window': 31.056907995098875, 'spect_rad': 0.8543279486930173, 'ridge_alpha': 1.08811349949493}. 
[I 2024-09-24 23:47:05,761] Trial 3 finished with values: [0.0, 10312059115.32181, 0.0, 0.0, 18788283016.3642, 0.0, 0.0, 30630396567.223938, 0.3333333333333333] and parameters: {'gamma': 449.8331452227004, 'sigma': 43.33381103747193, 'delta': 41.16778202037391, 'mean_degree': 1.6681769820246606, 'res_sz': 93, 'window': 28.23638187383372, 'spect_rad': 7.100220240524647, 'ridge_alpha': 85.75828880029046}. 
[I 2024-09-24 23:47:20,339] Trial 4 finished with values: [1.0, 1.1070349502026804, 0.4, 50.0, 1.2343348203779663, 0.4, 50.0, 6.048608422363684, 0.4444444444444444] and parameters: {'gamma': 222.13241761761302, 'sigma': 80.37397443803452, 'delta': 97.13005197875628, 'mean_degree': 0.42962106089733776, 'res_sz': 56, 'window': 1.1080532684671192, 'spect_rad': 11.961590470679479, 'ridge_alpha': 13.564394227670416}. 
[I 2024-09-24 23:47:28,140] Trial 5 finished with values: [0.0, 10312059115.32181, 0.0, 0.0, 18788283016.3642, 0.0, 0.0, 30630396567.223938, 0.3333333333333333] and parameters: {'gamma': 1.0433662768927046, 'sigma': 32.14199348572377, 'delta': 40.74902967855403, 'mean_degree': 1.449810299795678, 'res_sz': 75, 'window': 61.82780187948505, 'spect_rad': 74.07982518552392, 'ridge_alpha': 3.3562400483104125e-09}. 
[I 2024-09-24 23:47:40,473] Trial 6 finished with values: [1.0, 1.8954700250976149, 0.0, 1.0, 4.5384757140283964, 0.1, 50.0, 2.8775546312724534, 0.4444444444444444] and parameters: {'gamma': 116.99499600181387, 'sigma': 16.694947204189766, 'delta': 12.913011982319462, 'mean_degree': 2.5966007962598345, 'res_sz': 49, 'window': 3.878807017842365, 'spect_rad': 0.009785954398075135, 'ridge_alpha': 0.777504100683113}. 
[I 2024-09-24 23:47:53,693] Trial 7 finished with values: [1.0, 2.727215142169664, 0.0, 1.0, 4.690787702665162, 0.0, 1.0, 13.499664357923827, 0.4444444444444444] and parameters: {'gamma': 489.7004071110382, 'sigma': 26.338566018967086, 'delta': 69.59148431864988, 'mean_degree': 2.7098581972878586, 'res_sz': 15, 'window': 1.2796549960068409, 'spect_rad': 23.329486160864544, 'ridge_alpha': 1.2266201171414484e-09}. 
[I 2024-09-24 23:48:07,511] Trial 8 finished with values: [1.0, 2.089468463291179, 0.0, 50.0, 1.0970026627365166, 1.0, 50.0, 3.97839677234423, 0.1111111111111111] and parameters: {'gamma': 332.14824715071995, 'sigma': 89.7698555200083, 'delta': 11.706241461048576, 'mean_degree': 1.5095408752762196, 'res_sz': 23, 'window': 0.013913160854283848, 'spect_rad': 0.0012456840000402173, 'ridge_alpha': 3.0466598824202504e-09}. 
[I 2024-09-24 23:48:17,109] Trial 9 finished with values: [1.0, 1.4858793051525865, 0.0, 50.0, 1.4549326732221222, 0.8, 50.0, 5.739767648767227, 0.1111111111111111] and parameters: {'gamma': 15.1389436676508, 'sigma': 92.14468591366654, 'delta': 60.78886915055614, 'mean_degree': 1.36056281749685, 'res_sz': 41, 'window': 0.15515671870344855, 'spect_rad': 0.09004409559658468, 'ridge_alpha': 11.689292841471515}. 
[I 2024-09-24 23:48:29,904] Trial 10 finished with values: [1.0, 19313210.55219842, 1.0, 50.0, 2.17213685772024, 0.4, 50.0, 7.175456917606446, 0.5555555555555556] and parameters: {'gamma': 143.05283360573273, 'sigma': 17.086944463018096, 'delta': 95.1262008971257, 'mean_degree': 3.8889979696974604, 'res_sz': 44, 'window': 2.0466693188930662, 'spect_rad': 17.841188199683586, 'ridge_alpha': 0.0012066647660997922}. 
[I 2024-09-24 23:48:45,048] Trial 11 finished with values: [1.0, 9299930003.377726, 0.0, 1.0, 22.31960852436826, 0.1, 1.0, 22.759025299348966, 0.4444444444444444] and parameters: {'gamma': 214.54919960650517, 'sigma': 3.7022220131372636, 'delta': 70.03170829673263, 'mean_degree': 3.237275313379817, 'res_sz': 80, 'window': 0.0663776704665128, 'spect_rad': 0.003204408534681015, 'ridge_alpha': 1.4240248825654101e-09}. 
[I 2024-09-24 23:48:57,764] Trial 12 finished with values: [1.0, 2.709784876912903, 0.1, 50.0, 1.930359207105201, 0.2, 50.0, 4.877823247912669, 0.2222222222222222] and parameters: {'gamma': 79.6423829592312, 'sigma': 79.34427171910396, 'delta': 13.262270048179767, 'mean_degree': 2.943521423631086, 'res_sz': 54, 'window': 0.0014655786107325213, 'spect_rad': 0.018133327605283103, 'ridge_alpha': 0.0009508110318370936}. 
[I 2024-09-24 23:49:09,311] Trial 13 finished with values: [1.0, 2.7103332277735346, 0.1, 50.0, 1.651112587510197, 0.4, 50.0, 2.284133651581733, 0.1111111111111111] and parameters: {'gamma': 122.68029868867141, 'sigma': 77.3899283271186, 'delta': 97.73595310450744, 'mean_degree': 4.8152563227953715, 'res_sz': 13, 'window': 0.01727116659109641, 'spect_rad': 0.0053764495837316855, 'ridge_alpha': 6.718787340381228e-05}. 
[I 2024-09-24 23:49:19,944] Trial 14 finished with values: [0.0, 10312059115.32181, 0.0, 0.0, 18788283016.3642, 0.0, 0.0, 30630396567.223938, 0.3333333333333333] and parameters: {'gamma': 115.35434008311715, 'sigma': 83.59190403400778, 'delta': 63.10175883165521, 'mean_degree': 3.4938536839270373, 'res_sz': 54, 'window': 10.85111627400025, 'spect_rad': 31.999995662761446, 'ridge_alpha': 1.2016644100729068e-10}. 
