[I 2024-09-25 06:36:28,007] Trial 24 finished with values: [1.0, 3.8157825910427685, 0.1, 50.0, 1.1410729745226194, 0.3, 1.0, 6.080667131077901, 0.0] and parameters: {'h': 10, 'n_pool_kernel_size': [2, 2, 1], 'n_freq_downsample': [180, 60, 1], 'learning_rate': 0.001867027101497004, 'scaler_type': 'robust', 'max_steps': 800.0, 'batch_size': 128, 'windows_batch_size': 256, 'random_seed': 10}. 
SLURM auto-requeueing enabled. Setting signal handlers.
SLURM auto-requeueing enabled. Setting signal handlers.
SLURM auto-requeueing enabled. Setting signal handlers.
SLURM auto-requeueing enabled. Setting signal handlers.
SLURM auto-requeueing enabled. Setting signal handlers.
SLURM auto-requeueing enabled. Setting signal handlers.
SLURM auto-requeueing enabled. Setting signal handlers.
SLURM auto-requeueing enabled. Setting signal handlers.
SLURM auto-requeueing enabled. Setting signal handlers.
SLURM auto-requeueing enabled. Setting signal handlers.
SLURM auto-requeueing enabled. Setting signal handlers.
SLURM auto-requeueing enabled. Setting signal handlers.
SLURM auto-requeueing enabled. Setting signal handlers.
SLURM auto-requeueing enabled. Setting signal handlers.
SLURM auto-requeueing enabled. Setting signal handlers.
SLURM auto-requeueing enabled. Setting signal handlers.
SLURM auto-requeueing enabled. Setting signal handlers.
SLURM auto-requeueing enabled. Setting signal handlers.
SLURM auto-requeueing enabled. Setting signal handlers.
SLURM auto-requeueing enabled. Setting signal handlers.
SLURM auto-requeueing enabled. Setting signal handlers.
SLURM auto-requeueing enabled. Setting signal handlers.
SLURM auto-requeueing enabled. Setting signal handlers.
SLURM auto-requeueing enabled. Setting signal handlers.
SLURM auto-requeueing enabled. Setting signal handlers.
SLURM auto-requeueing enabled. Setting signal handlers.
SLURM auto-requeueing enabled. Setting signal handlers.
SLURM auto-requeueing enabled. Setting signal handlers.
SLURM auto-requeueing enabled. Setting signal handlers.
SLURM auto-requeueing enabled. Setting signal handlers.
SLURM auto-requeueing enabled. Setting signal handlers.
SLURM auto-requeueing enabled. Setting signal handlers.
SLURM auto-requeueing enabled. Setting signal handlers.
SLURM auto-requeueing enabled. Setting signal handlers.
SLURM auto-requeueing enabled. Setting signal handlers.
SLURM auto-requeueing enabled. Setting signal handlers.
SLURM auto-requeueing enabled. Setting signal handlers.
SLURM auto-requeueing enabled. Setting signal handlers.
SLURM auto-requeueing enabled. Setting signal handlers.
SLURM auto-requeueing enabled. Setting signal handlers.
SLURM auto-requeueing enabled. Setting signal handlers.
SLURM auto-requeueing enabled. Setting signal handlers.
SLURM auto-requeueing enabled. Setting signal handlers.
SLURM auto-requeueing enabled. Setting signal handlers.
SLURM auto-requeueing enabled. Setting signal handlers.
SLURM auto-requeueing enabled. Setting signal handlers.
SLURM auto-requeueing enabled. Setting signal handlers.
SLURM auto-requeueing enabled. Setting signal handlers.
SLURM auto-requeueing enabled. Setting signal handlers.
SLURM auto-requeueing enabled. Setting signal handlers.
SLURM auto-requeueing enabled. Setting signal handlers.
SLURM auto-requeueing enabled. Setting signal handlers.
SLURM auto-requeueing enabled. Setting signal handlers.
SLURM auto-requeueing enabled. Setting signal handlers.
SLURM auto-requeueing enabled. Setting signal handlers.
SLURM auto-requeueing enabled. Setting signal handlers.
SLURM auto-requeueing enabled. Setting signal handlers.
SLURM auto-requeueing enabled. Setting signal handlers.
SLURM auto-requeueing enabled. Setting signal handlers.
SLURM auto-requeueing enabled. Setting signal handlers.
SLURM auto-requeueing enabled. Setting signal handlers.
SLURM auto-requeueing enabled. Setting signal handlers.
SLURM auto-requeueing enabled. Setting signal handlers.
SLURM auto-requeueing enabled. Setting signal handlers.
SLURM auto-requeueing enabled. Setting signal handlers.
SLURM auto-requeueing enabled. Setting signal handlers.
SLURM auto-requeueing enabled. Setting signal handlers.
SLURM auto-requeueing enabled. Setting signal handlers.
SLURM auto-requeueing enabled. Setting signal handlers.
SLURM auto-requeueing enabled. Setting signal handlers.
SLURM auto-requeueing enabled. Setting signal handlers.
SLURM auto-requeueing enabled. Setting signal handlers.
SLURM auto-requeueing enabled. Setting signal handlers.
SLURM auto-requeueing enabled. Setting signal handlers.
SLURM auto-requeueing enabled. Setting signal handlers.
SLURM auto-requeueing enabled. Setting signal handlers.
SLURM auto-requeueing enabled. Setting signal handlers.
SLURM auto-requeueing enabled. Setting signal handlers.
SLURM auto-requeueing enabled. Setting signal handlers.
SLURM auto-requeueing enabled. Setting signal handlers.
SLURM auto-requeueing enabled. Setting signal handlers.
SLURM auto-requeueing enabled. Setting signal handlers.
SLURM auto-requeueing enabled. Setting signal handlers.
SLURM auto-requeueing enabled. Setting signal handlers.
SLURM auto-requeueing enabled. Setting signal handlers.
SLURM auto-requeueing enabled. Setting signal handlers.
SLURM auto-requeueing enabled. Setting signal handlers.
SLURM auto-requeueing enabled. Setting signal handlers.
SLURM auto-requeueing enabled. Setting signal handlers.
SLURM auto-requeueing enabled. Setting signal handlers.
SLURM auto-requeueing enabled. Setting signal handlers.
SLURM auto-requeueing enabled. Setting signal handlers.
SLURM auto-requeueing enabled. Setting signal handlers.
SLURM auto-requeueing enabled. Setting signal handlers.
SLURM auto-requeueing enabled. Setting signal handlers.
SLURM auto-requeueing enabled. Setting signal handlers.
SLURM auto-requeueing enabled. Setting signal handlers.
SLURM auto-requeueing enabled. Setting signal handlers.
SLURM auto-requeueing enabled. Setting signal handlers.
SLURM auto-requeueing enabled. Setting signal handlers.
SLURM auto-requeueing enabled. Setting signal handlers.
SLURM auto-requeueing enabled. Setting signal handlers.
SLURM auto-requeueing enabled. Setting signal handlers.
SLURM auto-requeueing enabled. Setting signal handlers.
SLURM auto-requeueing enabled. Setting signal handlers.
SLURM auto-requeueing enabled. Setting signal handlers.
SLURM auto-requeueing enabled. Setting signal handlers.
SLURM auto-requeueing enabled. Setting signal handlers.
SLURM auto-requeueing enabled. Setting signal handlers.
SLURM auto-requeueing enabled. Setting signal handlers.
SLURM auto-requeueing enabled. Setting signal handlers.
SLURM auto-requeueing enabled. Setting signal handlers.
SLURM auto-requeueing enabled. Setting signal handlers.
SLURM auto-requeueing enabled. Setting signal handlers.
SLURM auto-requeueing enabled. Setting signal handlers.
SLURM auto-requeueing enabled. Setting signal handlers.
SLURM auto-requeueing enabled. Setting signal handlers.
SLURM auto-requeueing enabled. Setting signal handlers.
SLURM auto-requeueing enabled. Setting signal handlers.
SLURM auto-requeueing enabled. Setting signal handlers.
SLURM auto-requeueing enabled. Setting signal handlers.
SLURM auto-requeueing enabled. Setting signal handlers.
SLURM auto-requeueing enabled. Setting signal handlers.
SLURM auto-requeueing enabled. Setting signal handlers.
SLURM auto-requeueing enabled. Setting signal handlers.
SLURM auto-requeueing enabled. Setting signal handlers.
SLURM auto-requeueing enabled. Setting signal handlers.
SLURM auto-requeueing enabled. Setting signal handlers.
SLURM auto-requeueing enabled. Setting signal handlers.
SLURM auto-requeueing enabled. Setting signal handlers.
SLURM auto-requeueing enabled. Setting signal handlers.
SLURM auto-requeueing enabled. Setting signal handlers.
SLURM auto-requeueing enabled. Setting signal handlers.
SLURM auto-requeueing enabled. Setting signal handlers.
SLURM auto-requeueing enabled. Setting signal handlers.
SLURM auto-requeueing enabled. Setting signal handlers.
SLURM auto-requeueing enabled. Setting signal handlers.
SLURM auto-requeueing enabled. Setting signal handlers.
SLURM auto-requeueing enabled. Setting signal handlers.
SLURM auto-requeueing enabled. Setting signal handlers.
SLURM auto-requeueing enabled. Setting signal handlers.
SLURM auto-requeueing enabled. Setting signal handlers.
SLURM auto-requeueing enabled. Setting signal handlers.
SLURM auto-requeueing enabled. Setting signal handlers.
SLURM auto-requeueing enabled. Setting signal handlers.
SLURM auto-requeueing enabled. Setting signal handlers.
SLURM auto-requeueing enabled. Setting signal handlers.
SLURM auto-requeueing enabled. Setting signal handlers.
SLURM auto-requeueing enabled. Setting signal handlers.
SLURM auto-requeueing enabled. Setting signal handlers.
SLURM auto-requeueing enabled. Setting signal handlers.
SLURM auto-requeueing enabled. Setting signal handlers.
SLURM auto-requeueing enabled. Setting signal handlers.
SLURM auto-requeueing enabled. Setting signal handlers.
SLURM auto-requeueing enabled. Setting signal handlers.
SLURM auto-requeueing enabled. Setting signal handlers.
SLURM auto-requeueing enabled. Setting signal handlers.
SLURM auto-requeueing enabled. Setting signal handlers.
SLURM auto-requeueing enabled. Setting signal handlers.
SLURM auto-requeueing enabled. Setting signal handlers.
SLURM auto-requeueing enabled. Setting signal handlers.
SLURM auto-requeueing enabled. Setting signal handlers.
SLURM auto-requeueing enabled. Setting signal handlers.
SLURM auto-requeueing enabled. Setting signal handlers.
SLURM auto-requeueing enabled. Setting signal handlers.
SLURM auto-requeueing enabled. Setting signal handlers.
SLURM auto-requeueing enabled. Setting signal handlers.
SLURM auto-requeueing enabled. Setting signal handlers.
SLURM auto-requeueing enabled. Setting signal handlers.
SLURM auto-requeueing enabled. Setting signal handlers.
SLURM auto-requeueing enabled. Setting signal handlers.
SLURM auto-requeueing enabled. Setting signal handlers.
SLURM auto-requeueing enabled. Setting signal handlers.
SLURM auto-requeueing enabled. Setting signal handlers.
SLURM auto-requeueing enabled. Setting signal handlers.
SLURM auto-requeueing enabled. Setting signal handlers.
SLURM auto-requeueing enabled. Setting signal handlers.
SLURM auto-requeueing enabled. Setting signal handlers.
SLURM auto-requeueing enabled. Setting signal handlers.
SLURM auto-requeueing enabled. Setting signal handlers.
SLURM auto-requeueing enabled. Setting signal handlers.
SLURM auto-requeueing enabled. Setting signal handlers.
SLURM auto-requeueing enabled. Setting signal handlers.
SLURM auto-requeueing enabled. Setting signal handlers.
SLURM auto-requeueing enabled. Setting signal handlers.
SLURM auto-requeueing enabled. Setting signal handlers.
SLURM auto-requeueing enabled. Setting signal handlers.
SLURM auto-requeueing enabled. Setting signal handlers.
SLURM auto-requeueing enabled. Setting signal handlers.
SLURM auto-requeueing enabled. Setting signal handlers.
SLURM auto-requeueing enabled. Setting signal handlers.
SLURM auto-requeueing enabled. Setting signal handlers.
SLURM auto-requeueing enabled. Setting signal handlers.
SLURM auto-requeueing enabled. Setting signal handlers.
SLURM auto-requeueing enabled. Setting signal handlers.
SLURM auto-requeueing enabled. Setting signal handlers.
SLURM auto-requeueing enabled. Setting signal handlers.
SLURM auto-requeueing enabled. Setting signal handlers.
SLURM auto-requeueing enabled. Setting signal handlers.
SLURM auto-requeueing enabled. Setting signal handlers.
SLURM auto-requeueing enabled. Setting signal handlers.
SLURM auto-requeueing enabled. Setting signal handlers.
SLURM auto-requeueing enabled. Setting signal handlers.
SLURM auto-requeueing enabled. Setting signal handlers.
SLURM auto-requeueing enabled. Setting signal handlers.
SLURM auto-requeueing enabled. Setting signal handlers.
SLURM auto-requeueing enabled. Setting signal handlers.
SLURM auto-requeueing enabled. Setting signal handlers.
SLURM auto-requeueing enabled. Setting signal handlers.
SLURM auto-requeueing enabled. Setting signal handlers.
SLURM auto-requeueing enabled. Setting signal handlers.
SLURM auto-requeueing enabled. Setting signal handlers.
SLURM auto-requeueing enabled. Setting signal handlers.
SLURM auto-requeueing enabled. Setting signal handlers.
SLURM auto-requeueing enabled. Setting signal handlers.
SLURM auto-requeueing enabled. Setting signal handlers.
SLURM auto-requeueing enabled. Setting signal handlers.
SLURM auto-requeueing enabled. Setting signal handlers.
SLURM auto-requeueing enabled. Setting signal handlers.
SLURM auto-requeueing enabled. Setting signal handlers.
SLURM auto-requeueing enabled. Setting signal handlers.
SLURM auto-requeueing enabled. Setting signal handlers.
SLURM auto-requeueing enabled. Setting signal handlers.
SLURM auto-requeueing enabled. Setting signal handlers.
SLURM auto-requeueing enabled. Setting signal handlers.
SLURM auto-requeueing enabled. Setting signal handlers.
SLURM auto-requeueing enabled. Setting signal handlers.
SLURM auto-requeueing enabled. Setting signal handlers.
SLURM auto-requeueing enabled. Setting signal handlers.
SLURM auto-requeueing enabled. Setting signal handlers.
SLURM auto-requeueing enabled. Setting signal handlers.
SLURM auto-requeueing enabled. Setting signal handlers.
SLURM auto-requeueing enabled. Setting signal handlers.
SLURM auto-requeueing enabled. Setting signal handlers.
SLURM auto-requeueing enabled. Setting signal handlers.
SLURM auto-requeueing enabled. Setting signal handlers.
SLURM auto-requeueing enabled. Setting signal handlers.
SLURM auto-requeueing enabled. Setting signal handlers.
SLURM auto-requeueing enabled. Setting signal handlers.
SLURM auto-requeueing enabled. Setting signal handlers.
SLURM auto-requeueing enabled. Setting signal handlers.
SLURM auto-requeueing enabled. Setting signal handlers.
SLURM auto-requeueing enabled. Setting signal handlers.
SLURM auto-requeueing enabled. Setting signal handlers.
SLURM auto-requeueing enabled. Setting signal handlers.
SLURM auto-requeueing enabled. Setting signal handlers.
SLURM auto-requeueing enabled. Setting signal handlers.
[I 2024-09-25 06:37:35,491] A new study created in memory with name: ResComp predicting GenForecast[cml, LSTM]
[I 2024-09-25 06:37:45,358] Trial 0 finished with values: [150.0, 1.3112072088088669, 0.1, 50.0, 1.7035627800415407, 0.4, 0.0, 7.113008278675548, 0.0] and parameters: {'gamma': 11.864883977633014, 'sigma': 54.84745524590075, 'delta': 84.10802028839638, 'mean_degree': 2.812320667760095, 'res_sz': 27, 'window': 13.884942935763881, 'spect_rad': 0.0032281847159978004, 'ridge_alpha': 0.001830823593605648}. 
[I 2024-09-25 06:37:56,947] Trial 1 finished with values: [6.0, 1.246787950355272, 0.2, 50.0, 1.3080912286819921, 0.5, 50.0, 1.480699159020282, 0.3333333333333333] and parameters: {'gamma': 77.40670148955671, 'sigma': 73.69519951178995, 'delta': 44.43346862981434, 'mean_degree': 0.47884712814343455, 'res_sz': 76, 'window': 1.1295908619553179, 'spect_rad': 0.07732363336294563, 'ridge_alpha': 36.0375733275027}. 
[I 2024-09-25 06:38:11,549] Trial 2 finished with values: [1.0, 3.690487469549466, 0.0, 50.0, 1.1044880093574099, 0.5, 0.0, 19816.449821547834, 0.1111111111111111] and parameters: {'gamma': 179.26920053134606, 'sigma': 82.55948567085244, 'delta': 26.927251071642903, 'mean_degree': 2.344454683126605, 'res_sz': 75, 'window': 1.6942156054893491, 'spect_rad': 0.056293793896302735, 'ridge_alpha': 1.580748488235494e-10}. 
[I 2024-09-25 06:38:23,853] Trial 3 finished with values: [1.0, 1.6588544807429129, 0.2, 50.0, 1.309843845681473, 0.2, 1.0, 1265.1394411025367, 0.2222222222222222] and parameters: {'gamma': 254.15748244832474, 'sigma': 74.0851350584819, 'delta': 22.779754691190632, 'mean_degree': 0.3769008982107831, 'res_sz': 71, 'window': 0.27539372981977833, 'spect_rad': 0.0018351951097630166, 'ridge_alpha': 4.3516474026121895e-07}. 
[I 2024-09-25 06:38:35,697] Trial 4 finished with values: [1.0, 199278916.79382285, 1.0, 1.0, 11.538246186435984, 0.2, 50.0, 1.2777509544148862, 0.4444444444444444] and parameters: {'gamma': 406.9161092100296, 'sigma': 2.700885777554378, 'delta': 70.69849575008732, 'mean_degree': 4.146266482581031, 'res_sz': 80, 'window': 0.04560984959325522, 'spect_rad': 0.41765536443486895, 'ridge_alpha': 8.693438885746946e-08}. 
[I 2024-09-25 06:38:48,137] Trial 5 finished with values: [150.0, 1.0083613262032136, 0.9, 50.0, 0.9700577206899726, 0.7, 50.0, 1.0931703258430847, 0.5555555555555556] and parameters: {'gamma': 339.5343842113204, 'sigma': 62.43751674535877, 'delta': 28.95467596846255, 'mean_degree': 2.0983891102384136, 'res_sz': 14, 'window': 4.912671083044735, 'spect_rad': 0.024384270549860875, 'ridge_alpha': 0.0012535024813306562}. 
[I 2024-09-25 06:39:00,176] Trial 6 finished with values: [1.0, 3.6864060252969417, 0.0, 50.0, 1.9936364778150875, 0.2, 0.0, 60594.64846825165, 0.2222222222222222] and parameters: {'gamma': 13.566018996073044, 'sigma': 83.82282003070756, 'delta': 85.96847041582366, 'mean_degree': 4.638898672560329, 'res_sz': 67, 'window': 0.07047076275982268, 'spect_rad': 2.2460128120467715, 'ridge_alpha': 1.7283628408113214e-10}. 
[I 2024-09-25 06:39:15,737] Trial 7 finished with values: [1.0, 2.2144694764424924, 0.0, 50.0, 1.0930943263753148, 0.3, 50.0, 1.5709087623516513, 0.1111111111111111] and parameters: {'gamma': 346.0271981339802, 'sigma': 97.47349520875444, 'delta': 66.14258249695092, 'mean_degree': 0.9947731861861612, 'res_sz': 23, 'window': 1.2936904836514553, 'spect_rad': 14.39304225170127, 'ridge_alpha': 0.0010842932589394075}. 
[I 2024-09-25 06:39:26,117] Trial 8 finished with values: [1.0, 1453333539.9775057, 1.0, 2.0, 33.54519727279452, 0.1, 1.0, 9088.016223279394, 0.2222222222222222] and parameters: {'gamma': 366.6282992683713, 'sigma': 94.54882851601101, 'delta': 8.583520747585615, 'mean_degree': 3.9698788993924987, 'res_sz': 48, 'window': 5.24129571861636, 'spect_rad': 80.91756461304944, 'ridge_alpha': 2.1870282831189836e-09}. 
[I 2024-09-25 06:39:35,846] Trial 9 finished with values: [150.0, 1.0123855188827553, 0.7, 50.0, 0.9531201381671637, 0.6, 50.0, 1.0141828352932016, 0.7777777777777778] and parameters: {'gamma': 281.64424307436025, 'sigma': 76.6547288186724, 'delta': 63.50807037514223, 'mean_degree': 2.2111229632152143, 'res_sz': 15, 'window': 0.013172865493965, 'spect_rad': 95.62779472884291, 'ridge_alpha': 7.757372485060511e-07}. 
[I 2024-09-25 06:39:47,056] Trial 10 finished with values: [0.0, 4.4731157579459655, 0.0, 0.0, 7.213955967918378, 0.0, 50.0, 1.6751244971333805, 0.1111111111111111] and parameters: {'gamma': 294.43694263020666, 'sigma': 54.18513162404396, 'delta': 10.528951288421396, 'mean_degree': 4.985823202853972, 'res_sz': 52, 'window': 3.240890593333951, 'spect_rad': 0.003701626223173297, 'ridge_alpha': 0.0002191114327826811}. 
[I 2024-09-25 06:39:53,277] Trial 11 finished with values: [1.0, 11112.977729336439, 1.0, 0.0, 18.728740927050364, 0.0, 0.0, 16.988205548990955, 0.0] and parameters: {'gamma': 271.961743831331, 'sigma': 46.40979711148246, 'delta': 97.33991731678591, 'mean_degree': 2.490206106785072, 'res_sz': 80, 'window': 95.92852110894167, 'spect_rad': 0.8275872190516637, 'ridge_alpha': 0.0003264733927939669}. 
[I 2024-09-25 06:40:02,186] Trial 12 finished with values: [1.0, 487.70205043540665, 1.0, 1.0, 9.552925942041437, 0.0, 0.0, 11.373310028943923, 0.3333333333333333] and parameters: {'gamma': 458.5339237360382, 'sigma': 51.96301097293645, 'delta': 80.20530235280836, 'mean_degree': 0.15809869749077776, 'res_sz': 76, 'window': 6.5609171872943675, 'spect_rad': 25.893094290861015, 'ridge_alpha': 0.0010875076910209327}. 
[I 2024-09-25 06:40:13,670] Trial 13 finished with values: [1.0, 1.3713606300854928, 0.2, 50.0, 1.5243987961328453, 0.1, 1.0, 5.832454943942637, 0.1111111111111111] and parameters: {'gamma': 139.02783790169119, 'sigma': 24.95781452092389, 'delta': 19.756666038392574, 'mean_degree': 1.1752059203350587, 'res_sz': 42, 'window': 1.395086987254935, 'spect_rad': 0.15672763169074244, 'ridge_alpha': 0.0033183303756090512}. 
[I 2024-09-25 06:40:22,158] Trial 14 finished with values: [0.0, 10753504102.658182, 0.0, 0.0, 17031924425.77347, 0.2, 0.0, 16344065982.736351, 0.2222222222222222] and parameters: {'gamma': 479.11061767833775, 'sigma': 74.78495886122646, 'delta': 81.68225857745438, 'mean_degree': 4.984231019148493, 'res_sz': 44, 'window': 25.87964723273115, 'spect_rad': 7.001450771570575, 'ridge_alpha': 5.660417520935306e-07}. 
[I 2024-09-25 06:40:37,779] Trial 15 finished with values: [1.0, 1.8094992985706295, 0.0, 50.0, 1.4808299921964356, 0.3, 1.0, 995.6908359568828, 0.1111111111111111] and parameters: {'gamma': 142.8467410595041, 'sigma': 82.48575793719738, 'delta': 76.62137226579407, 'mean_degree': 1.7161161852019702, 'res_sz': 41, 'window': 0.9885567636415008, 'spect_rad': 0.0028297877331417017, 'ridge_alpha': 2.348209008562065e-08}. 
[I 2024-09-25 06:40:47,433] Trial 16 finished with values: [150.0, 1.2265669839390316, 0.1, 50.0, 2.131901331678687, 0.1, 0.0, 343.63368774851386, 0.0] and parameters: {'gamma': 39.70525040496399, 'sigma': 19.37953834809842, 'delta': 42.959729542596975, 'mean_degree': 0.9465613566368691, 'res_sz': 68, 'window': 0.0026781605790844407, 'spect_rad': 0.021777108262089784, 'ridge_alpha': 3.6240274351159707e-06}. 
[I 2024-09-25 06:40:57,041] Trial 17 finished with values: [1.0, 1.39445409459555, 0.2, 1.0, 15.162712052533012, 0.0, 1.0, 5.477882865487534, 0.2222222222222222] and parameters: {'gamma': 324.1274011673545, 'sigma': 0.23473786885165607, 'delta': 93.96446044130124, 'mean_degree': 4.7838340598749145, 'res_sz': 36, 'window': 0.3483757714586557, 'spect_rad': 0.004317245869588465, 'ridge_alpha': 0.025132445092204546}. 
