[I 2024-09-24 17:55:53,959] Trial 17 finished with values: [7.0, 23.695989337782805, 0.6, 8.0, 36.87302118024712, 0.0, 2.0, 39.59476103449145, 0.1111111111111111] and parameters: {'optimizer__threshold': 1.4752734905480809e-05, 'optimizer__alpha': 0.0013317609051801658, 'discrete_time': True, 'feature_library': 1, 'differentiation_method': 6}. 
[I 2024-09-24 17:55:59,117] Trial 18 finished with values: [3.0, 979149348.7678843, 0.0, 4.0, 133110.52671766383, 0.3, 2.0, 3721997.9001476252, 0.5555555555555556] and parameters: {'optimizer__threshold': 0.00032757301721371093, 'optimizer__alpha': 4.812649972087819e-05, 'discrete_time': True, 'feature_library': 0, 'differentiation_method': 1}. 
[I 2024-09-24 17:56:05,900] Trial 19 finished with values: [1.0, 2.4106522441540084, 0.1, 2.0, 4.2513539337000195, 0.3, 50.0, 1.1071325095931879, 0.8888888888888888] and parameters: {'optimizer__threshold': 0.0062813086586231085, 'optimizer__alpha': 0.08593256768226847, 'discrete_time': False, 'feature_library': 0, 'differentiation_method': 3}. 
[I 2024-09-24 17:56:12,715] Trial 20 finished with values: [2.0, 36.89205070060567, 0.0, 50.0, 1.6375054250364562, 0.8, 2.0, 58.69551566215685, 0.8888888888888888] and parameters: {'optimizer__threshold': 0.8247534017503597, 'optimizer__alpha': 2.7296901660308297e-05, 'discrete_time': False, 'feature_library': 0, 'differentiation_method': 0}. 
/nas/longleaf/home/djpassey/.local/lib/python3.9/site-packages/pysindy/optimizers/stlsq.py:201: UserWarning: Sparsity parameter is too big (0.1) and eliminated all coefficients
  warnings.warn(
/nas/longleaf/home/djpassey/.local/lib/python3.9/site-packages/pysindy/optimizers/stlsq.py:201: UserWarning: Sparsity parameter is too big (0.1) and eliminated all coefficients
  warnings.warn(
/nas/longleaf/home/djpassey/.local/lib/python3.9/site-packages/pysindy/optimizers/stlsq.py:201: UserWarning: Sparsity parameter is too big (0.1) and eliminated all coefficients
  warnings.warn(
/nas/longleaf/home/djpassey/.local/lib/python3.9/site-packages/pysindy/optimizers/stlsq.py:201: UserWarning: Sparsity parameter is too big (0.1) and eliminated all coefficients
  warnings.warn(
/nas/longleaf/home/djpassey/.local/lib/python3.9/site-packages/pysindy/optimizers/stlsq.py:201: UserWarning: Sparsity parameter is too big (0.1) and eliminated all coefficients
  warnings.warn(
/nas/longleaf/home/djpassey/.local/lib/python3.9/site-packages/pysindy/optimizers/stlsq.py:201: UserWarning: Sparsity parameter is too big (0.1) and eliminated all coefficients
  warnings.warn(
/nas/longleaf/home/djpassey/.local/lib/python3.9/site-packages/pysindy/optimizers/stlsq.py:201: UserWarning: Sparsity parameter is too big (0.1) and eliminated all coefficients
  warnings.warn(
/nas/longleaf/home/djpassey/.local/lib/python3.9/site-packages/pysindy/optimizers/stlsq.py:201: UserWarning: Sparsity parameter is too big (0.1) and eliminated all coefficients
  warnings.warn(
/nas/longleaf/home/djpassey/.local/lib/python3.9/site-packages/pysindy/optimizers/stlsq.py:201: UserWarning: Sparsity parameter is too big (0.1) and eliminated all coefficients
  warnings.warn(
/nas/longleaf/home/djpassey/.local/lib/python3.9/site-packages/pysindy/optimizers/stlsq.py:201: UserWarning: Sparsity parameter is too big (0.1) and eliminated all coefficients
  warnings.warn(
/nas/longleaf/home/djpassey/.local/lib/python3.9/site-packages/pysindy/optimizers/stlsq.py:201: UserWarning: Sparsity parameter is too big (0.1) and eliminated all coefficients
  warnings.warn(
/nas/longleaf/home/djpassey/.local/lib/python3.9/site-packages/pysindy/optimizers/stlsq.py:201: UserWarning: Sparsity parameter is too big (0.1) and eliminated all coefficients
  warnings.warn(
/nas/longleaf/home/djpassey/.local/lib/python3.9/site-packages/pysindy/optimizers/stlsq.py:201: UserWarning: Sparsity parameter is too big (0.1) and eliminated all coefficients
  warnings.warn(
/nas/longleaf/home/djpassey/.local/lib/python3.9/site-packages/pysindy/optimizers/stlsq.py:201: UserWarning: Sparsity parameter is too big (0.1) and eliminated all coefficients
  warnings.warn(
/nas/longleaf/home/djpassey/.local/lib/python3.9/site-packages/pysindy/optimizers/stlsq.py:201: UserWarning: Sparsity parameter is too big (0.1) and eliminated all coefficients
  warnings.warn(
[I 2024-09-24 17:56:19,387] Trial 21 finished with values: [1.0, 71.65053880587436, 0.2, 12.0, 27.21028580802616, 0.8, 4.0, 92.11872227470722, 0.6666666666666666] and parameters: {'optimizer__threshold': 4.038492424445922e-05, 'optimizer__alpha': 1.4598313729878054, 'discrete_time': False, 'feature_library': 1, 'differentiation_method': 6}. 
[I 2024-09-24 17:56:24,517] Trial 22 finished with values: [3.0, 979149348.7678843, 0.0, 4.0, 133110.52671766383, 0.3, 2.0, 3721997.9001476252, 0.5555555555555556] and parameters: {'optimizer__threshold': 8.372629044903236e-05, 'optimizer__alpha': 0.0013712779130633727, 'discrete_time': True, 'feature_library': 0, 'differentiation_method': 3}. 
[I 2024-09-24 17:56:29,567] Trial 23 finished with values: [3.0, 979149348.7678843, 0.0, 4.0, 133110.52671766383, 0.3, 2.0, 3721997.9001476252, 0.5555555555555556] and parameters: {'optimizer__threshold': 4.3208136976276315, 'optimizer__alpha': 0.4970286727583431, 'discrete_time': True, 'feature_library': 0, 'differentiation_method': 1}. 
/nas/longleaf/home/djpassey/.local/lib/python3.9/site-packages/pysindy/optimizers/stlsq.py:201: UserWarning: Sparsity parameter is too big (0.1) and eliminated all coefficients
  warnings.warn(
[I 2024-09-24 17:56:37,628] Trial 24 finished with values: [18.0, 103.90869588282736, 0.0, 22.0, 23.47233751416599, 0.3, 6.0, 6.164013201135055, 0.2222222222222222] and parameters: {'optimizer__threshold': 0.1709022072582144, 'optimizer__alpha': 0.0010854448450820528, 'discrete_time': False, 'feature_library': 1, 'differentiation_method': 8}. 
[I 2024-09-24 17:56:44,002] A new study created in memory with name: LTSFLinearForecaster predicting GenForecast[cml, VAR]
[I 2024-09-24 17:56:53,950] Trial 0 finished with values: [1.0, 4.1777880758378485, 0.0, 13.0, 7.3474819046456625, 0.0, 1.0, 23.31055042908738, 0.4444444444444444] and parameters: {'seq_len': 19, 'lr': 1.8759297027256277e-05, 'pred_len': 25, 'num_epochs': 100}. 
[I 2024-09-24 17:57:09,754] Trial 1 finished with values: [1.0, 5.055277702288187, 0.0, 50.0, 1.7895200910295899, 0.0, 50.0, 2.5390544097537306, 0.2222222222222222] and parameters: {'seq_len': 21, 'lr': 1.628090620068224e-05, 'pred_len': 25, 'num_epochs': 300}. 
[I 2024-09-24 17:57:20,042] Trial 2 finished with values: [1.0, 7.310375749790573, 0.0, 17.0, 8.443923321511997, 0.0, 50.0, 3.4624999732924833, 0.4444444444444444] and parameters: {'seq_len': 9, 'lr': 0.00013486167748674824, 'pred_len': 6, 'num_epochs': 100}. 
[I 2024-09-24 17:57:28,736] Trial 3 finished with values: [1.0, 2.3949427066696733, 0.0, 50.0, 4.067874770068372, 0.0, 1.0, 39.56513231184307, 0.4444444444444444] and parameters: {'seq_len': 2, 'lr': 3.43050682840612e-05, 'pred_len': 3, 'num_epochs': 50}. 
[I 2024-09-24 17:57:47,192] Trial 4 finished with values: [1.0, 1.0548024300515553, 1.0, 50.0, 1.0768697919228636, 1.0, 2.0, 773.2349058187623, 0.4444444444444444] and parameters: {'seq_len': 1, 'lr': 0.00015887325562062143, 'pred_len': 4, 'num_epochs': 300}. 
[I 2024-09-24 17:57:55,604] Trial 5 finished with values: [1.0, 1.1490905716483535, 0.9, 50.0, 1.1406335754327805, 1.0, 50.0, 2.6106571429169936, 0.1111111111111111] and parameters: {'seq_len': 7, 'lr': 0.0009945995911448953, 'pred_len': 17, 'num_epochs': 50}. 
[I 2024-09-24 17:58:05,711] Trial 6 finished with values: [1.0, 6.583935711959281, 0.0, 50.0, 0.16121011499457433, 1.0, 50.0, 2.581806413035917, 0.2222222222222222] and parameters: {'seq_len': 14, 'lr': 0.025648369778303218, 'pred_len': 12, 'num_epochs': 100}. 
[I 2024-09-24 17:58:22,662] Trial 7 finished with values: [1.0, 5.680212800148096, 0.0, 50.0, 0.3192955058353945, 0.7, 50.0, 2.527690698773684, 0.2222222222222222] and parameters: {'seq_len': 18, 'lr': 0.02282887784983383, 'pred_len': 5, 'num_epochs': 300}. 
[I 2024-09-24 17:58:32,511] Trial 8 finished with values: [1.0, 1.3455354675735043, 1.0, 50.0, 0.15306490621413588, 1.0, 50.0, 2.464245792658803, 0.2222222222222222] and parameters: {'seq_len': 15, 'lr': 0.0008334617264420943, 'pred_len': 25, 'num_epochs': 100}. 
[I 2024-09-24 17:58:48,847] Trial 9 finished with values: [1.0, 22.475016429954458, 0.0, 50.0, 1.467637573130793, 0.7, 50.0, 2.6263415241793555, 0.2222222222222222] and parameters: {'seq_len': 16, 'lr': 8.182584927512948e-05, 'pred_len': 16, 'num_epochs': 300}. 
[I 2024-09-24 17:58:57,184] Trial 10 finished with values: [1.0, 10.357663861972723, 0.0, 50.0, 0.5893572984699538, 1.0, 50.0, 2.425260482182224, 0.2222222222222222] and parameters: {'seq_len': 10, 'lr': 0.014558013720081909, 'pred_len': 14, 'num_epochs': 50}. 
[I 2024-09-24 17:59:07,631] Trial 11 finished with values: [1.0, 1.3407204837788502, 0.5, 50.0, 0.37940446336373485, 1.0, 50.0, 2.530564054952104, 0.2222222222222222] and parameters: {'seq_len': 16, 'lr': 0.0010383167845516648, 'pred_len': 5, 'num_epochs': 100}. 
[I 2024-09-24 17:59:24,015] Trial 12 finished with values: [1.0, 199.68243576945082, 0.0, 50.0, 1.0777327133413053, 0.7, 50.0, 2.3989201355554894, 0.2222222222222222] and parameters: {'seq_len': 7, 'lr': 0.0003104413052700845, 'pred_len': 24, 'num_epochs': 300}. 
[I 2024-09-24 17:59:40,594] Trial 13 finished with values: [1.0, 1.4395468984915243, 0.3, 50.0, 0.9995320564150135, 1.0, 50.0, 2.4700653224733036, 0.2222222222222222] and parameters: {'seq_len': 16, 'lr': 6.270101066619298e-05, 'pred_len': 16, 'num_epochs': 300}. 
[I 2024-09-24 17:59:49,057] Trial 14 finished with values: [1.0, 1.5266793232741116, 0.9, 50.0, 0.16913440923311152, 1.0, 50.0, 2.4992377937107366, 0.2222222222222222] and parameters: {'seq_len': 13, 'lr': 0.07776900313845057, 'pred_len': 23, 'num_epochs': 50}. 
[I 2024-09-24 17:59:59,152] Trial 15 finished with values: [1.0, 30.481584703824183, 0.0, 21.0, 10.380238205720214, 0.0, 50.0, 2.476835431627562, 0.2222222222222222] and parameters: {'seq_len': 8, 'lr': 0.00017096579188953905, 'pred_len': 1, 'num_epochs': 100}. 
[I 2024-09-24 18:00:16,588] Trial 16 finished with values: [1.0, 1.9006613860537724, 0.0, 50.0, 1.1736955024900209, 1.0, 50.0, 2.5175707946143784, 0.2222222222222222] and parameters: {'seq_len': 24, 'lr': 2.853407369237278e-05, 'pred_len': 3, 'num_epochs': 300}. 
[I 2024-09-24 18:00:24,971] Trial 17 finished with values: [1.0, 1.251926609632323, 0.3, 50.0, 1.026337440224113, 1.0, 35.0, 4.979125545141905, 0.2222222222222222] and parameters: {'seq_len': 8, 'lr': 0.0004307562860780845, 'pred_len': 17, 'num_epochs': 50}. 
[I 2024-09-24 18:00:42,016] Trial 18 finished with values: [1.0, 1.0981017810276068, 1.0, 50.0, 1.031149150937723, 1.0, 50.0, 2.4326254030070196, 0.2222222222222222] and parameters: {'seq_len': 2, 'lr': 0.003701067541371319, 'pred_len': 21, 'num_epochs': 300}. 
[I 2024-09-24 18:00:52,289] Trial 19 finished with values: [1.0, 2.777401436330713, 0.0, 50.0, 1.2138170311816852, 0.0, 50.0, 2.5429773950625134, 0.2222222222222222] and parameters: {'seq_len': 18, 'lr': 0.0971000179911161, 'pred_len': 7, 'num_epochs': 100}. 
[I 2024-09-24 18:01:00,930] Trial 20 finished with values: [1.0, 1.2901041309461134, 1.0, 50.0, 0.4318493504418366, 1.0, 50.0, 2.4449574206976044, 0.2222222222222222] and parameters: {'seq_len': 9, 'lr': 0.0039202859467952, 'pred_len': 8, 'num_epochs': 50}. 
[I 2024-09-24 18:01:09,435] Trial 21 finished with values: [1.0, 1.719441919666106, 0.0, 50.0, 0.06505106913750243, 1.0, 50.0, 2.5248098772784333, 0.2222222222222222] and parameters: {'seq_len': 22, 'lr': 0.02341470993294444, 'pred_len': 7, 'num_epochs': 50}. 
[I 2024-09-24 18:01:19,843] Trial 22 finished with values: [1.0, 2921.000487637235, 0.0, 14.0, 29.88856639694249, 0.0, 23.0, 15.46613150284529, 0.4444444444444444] and parameters: {'seq_len': 7, 'lr': 0.0001622146750025954, 'pred_len': 1, 'num_epochs': 100}. 
[I 2024-09-24 18:01:28,087] Trial 23 finished with values: [1.0, 3.7708965488642026, 0.0, 50.0, 1.2052446544081135, 0.3, 50.0, 2.730762642682226, 0.4444444444444444] and parameters: {'seq_len': 25, 'lr': 0.00024907616741869874, 'pred_len': 24, 'num_epochs': 50}. 
[I 2024-09-24 18:01:36,645] Trial 24 finished with values: [1.0, 2.1407779961936306, 0.0, 50.0, 0.2017030078121893, 1.0, 50.0, 2.481722169434397, 0.2222222222222222] and parameters: {'seq_len': 13, 'lr': 0.006906472517545663, 'pred_len': 15, 'num_epochs': 50}. 
[I 2024-09-24 18:01:44,255] A new study created in memory with name: VAR predicting GenForecast[cml, VAR]
[I 2024-09-24 18:01:49,695] Trial 0 finished with values: [1.0, 3.5741117035120293, 0.0, 50.0, 8.077225354863172e-05, 1.0, 2.0, 12.373472234909242, 0.3333333333333333] and parameters: {'ic': 'aic', 'maxlags': 4, 'trend': 'n'}. 
[I 2024-09-24 18:01:55,132] Trial 1 finished with values: [1.0, 15.544270220653862, 1.0, 50.0, 4.0322030025353126e-05, 1.0, 2.0, 8.731876898705105, 0.5555555555555556] and parameters: {'ic': 'fpe', 'maxlags': 4, 'trend': 'c'}. 
[I 2024-09-24 18:02:00,448] Trial 2 finished with values: [150.0, 1.1538673814205064e-06, 1.0, 50.0, 6.175174528275946e-13, 1.0, 1.0, 26119724633.725113, 0.3333333333333333] and parameters: {'ic': 'aic', 'maxlags': 5, 'trend': 'ct'}. 
[I 2024-09-24 18:02:05,704] Trial 3 finished with values: [1.0, 1.7341430256024368, 1.0, 50.0, 0.0017439072024311706, 1.0, 2.0, 9203.388899648622, 0.2222222222222222] and parameters: {'ic': 'aic', 'maxlags': 3, 'trend': 'ct'}. 
[I 2024-09-24 18:02:11,087] Trial 4 finished with values: [1.0, 15.50159183183739, 1.0, 50.0, 4.134118475224462e-05, 1.0, 2.0, 8.624322774454123, 0.5555555555555556] and parameters: {'ic': 'aic', 'maxlags': 4, 'trend': 'ct'}. 
[I 2024-09-24 18:02:16,544] Trial 5 finished with values: [1.0, 15.50159183183739, 1.0, 50.0, 4.134118475224462e-05, 1.0, 2.0, 8.624322774454123, 0.5555555555555556] and parameters: {'ic': 'aic', 'maxlags': 4, 'trend': 'ct'}. 
[I 2024-09-24 18:02:21,561] Trial 6 finished with values: [1.0, 5.222316806734647, 1.0, 50.0, 0.2900028347886771, 1.0, 50.0, 5.567220292617393, 0.5555555555555556] and parameters: {'ic': 'aic', 'maxlags': 2, 'trend': 'ct'}. 
[I 2024-09-24 18:02:26,879] Trial 7 finished with values: [1.0, 5.222316806734647, 1.0, 50.0, 0.2900028347886771, 1.0, 50.0, 5.567220292617393, 0.5555555555555556] and parameters: {'ic': 'aic', 'maxlags': 2, 'trend': 'ct'}. 
[I 2024-09-24 18:02:32,289] Trial 8 finished with values: [1.0, 15.544270220653862, 1.0, 50.0, 4.0322030025353126e-05, 1.0, 2.0, 8.731876898705105, 0.5555555555555556] and parameters: {'ic': 'fpe', 'maxlags': 4, 'trend': 'c'}. 
[I 2024-09-24 18:02:37,649] Trial 9 finished with values: [1.0, 5.222316806734647, 1.0, 50.0, 0.2900028347886771, 1.0, 50.0, 5.567220292617393, 0.5555555555555556] and parameters: {'ic': 'aic', 'maxlags': 2, 'trend': 'ct'}. 
[I 2024-09-24 18:02:43,004] Trial 10 finished with values: [1.0, 15.43041310894817, 1.0, 50.0, 5.4677601036973336e-05, 1.0, 2.0, 8.441763045338519, 0.5555555555555556] and parameters: {'ic': 'fpe', 'maxlags': 4, 'trend': 'ctt'}. 
[I 2024-09-24 18:02:48,254] Trial 11 finished with values: [1.0, 5.2188270171100655, 1.0, 50.0, 0.24679824435835673, 1.0, 50.0, 5.593285386373629, 0.5555555555555556] and parameters: {'ic': 'aic', 'maxlags': 2, 'trend': 'ctt'}. 
[I 2024-09-24 18:02:53,323] Trial 12 finished with values: [150.0, 1.2968686730146914e-06, 1.0, 50.0, 5.46752608249075e-14, 1.0, 1.0, 26120676894.121346, 0.3333333333333333] and parameters: {'ic': 'aic', 'maxlags': 5, 'trend': 'c'}. 
[I 2024-09-24 18:02:58,572] Trial 13 finished with values: [1.0, 3.0669926999534196, 0.0, 50.0, 6.154731535985928e-10, 1.0, 1.0, 24782899870.22871, 0.3333333333333333] and parameters: {'ic': 'fpe', 'maxlags': 5, 'trend': 'n'}. 
[I 2024-09-24 18:03:03,900] Trial 14 finished with values: [1.0, 5.240129385959451, 1.0, 50.0, 0.2811251212058858, 1.0, 50.0, 5.534746422219549, 0.5555555555555556] and parameters: {'ic': 'fpe', 'maxlags': 2, 'trend': 'c'}. 
[I 2024-09-24 18:03:09,100] Trial 15 finished with values: [1.0, 1.7341430256024368, 1.0, 50.0, 0.0017439072024311706, 1.0, 2.0, 9203.388899648622, 0.2222222222222222] and parameters: {'ic': 'aic', 'maxlags': 3, 'trend': 'ct'}. 
[I 2024-09-24 18:03:14,624] Trial 16 finished with values: [1.0, 4.225013548033043, 0.0, 50.0, 0.28037609752907233, 1.0, 50.0, 6.485732825669298, 0.2222222222222222] and parameters: {'ic': 'fpe', 'maxlags': 2, 'trend': 'n'}. 
[I 2024-09-24 18:03:20,013] Trial 17 finished with values: [1.0, 3.1034792320235383, 0.0, 50.0, 0.002940070576111087, 1.0, 3.0, 3659.624644902591, 0.2222222222222222] and parameters: {'ic': 'aic', 'maxlags': 3, 'trend': 'n'}. 
[I 2024-09-24 18:03:25,164] Trial 18 finished with values: [150.0, 0.7848790251015041, 0.8, 50.0, 0.666951088589943, 1.0, 7.0, 5.7997432045984505, 0.4444444444444444] and parameters: {'ic': 'aic', 'maxlags': 1, 'trend': 'ctt'}. 
[I 2024-09-24 18:03:30,644] Trial 19 finished with values: [1.0, 3.5741117035120293, 0.0, 50.0, 8.077225354863172e-05, 1.0, 2.0, 12.373472234909242, 0.3333333333333333] and parameters: {'ic': 'fpe', 'maxlags': 4, 'trend': 'n'}. 
[I 2024-09-24 18:03:35,978] Trial 20 finished with values: [1.0, 4.225013548033043, 0.0, 50.0, 0.28037609752907233, 1.0, 50.0, 6.485732825669298, 0.2222222222222222] and parameters: {'ic': 'fpe', 'maxlags': 2, 'trend': 'n'}. 
[I 2024-09-24 18:03:41,127] Trial 21 finished with values: [150.0, 1.2968686730146914e-06, 1.0, 50.0, 5.46752608249075e-14, 1.0, 1.0, 26120676894.121346, 0.3333333333333333] and parameters: {'ic': 'aic', 'maxlags': 5, 'trend': 'c'}. 
[I 2024-09-24 18:03:46,412] Trial 22 finished with values: [1.0, 15.50159183183739, 1.0, 50.0, 4.134118475224462e-05, 1.0, 2.0, 8.624322774454123, 0.5555555555555556] and parameters: {'ic': 'fpe', 'maxlags': 4, 'trend': 'ct'}. 
[I 2024-09-24 18:03:51,867] Trial 23 finished with values: [150.0, 0.7630447619534638, 1.0, 50.0, 0.6672231768414242, 1.0, 7.0, 5.831854922797306, 0.4444444444444444] and parameters: {'ic': 'aic', 'maxlags': 1, 'trend': 'c'}. 
[I 2024-09-24 18:03:57,255] Trial 24 finished with values: [1.0, 5.2188270171100655, 1.0, 50.0, 0.24679824435835673, 1.0, 50.0, 5.593285386373629, 0.5555555555555556] and parameters: {'ic': 'fpe', 'maxlags': 2, 'trend': 'ctt'}. 
[I 2024-09-24 18:04:05,038] A new study created in memory with name: LSTM predicting GenForecast[cml, VAR]
SLURM auto-requeueing enabled. Setting signal handlers.
SLURM auto-requeueing enabled. Setting signal handlers.
SLURM auto-requeueing enabled. Setting signal handlers.
SLURM auto-requeueing enabled. Setting signal handlers.
SLURM auto-requeueing enabled. Setting signal handlers.
SLURM auto-requeueing enabled. Setting signal handlers.
SLURM auto-requeueing enabled. Setting signal handlers.
SLURM auto-requeueing enabled. Setting signal handlers.
SLURM auto-requeueing enabled. Setting signal handlers.
SLURM auto-requeueing enabled. Setting signal handlers.
SLURM auto-requeueing enabled. Setting signal handlers.
SLURM auto-requeueing enabled. Setting signal handlers.
SLURM auto-requeueing enabled. Setting signal handlers.
SLURM auto-requeueing enabled. Setting signal handlers.
SLURM auto-requeueing enabled. Setting signal handlers.
SLURM auto-requeueing enabled. Setting signal handlers.
SLURM auto-requeueing enabled. Setting signal handlers.
SLURM auto-requeueing enabled. Setting signal handlers.
SLURM auto-requeueing enabled. Setting signal handlers.
SLURM auto-requeueing enabled. Setting signal handlers.
SLURM auto-requeueing enabled. Setting signal handlers.
SLURM auto-requeueing enabled. Setting signal handlers.
SLURM auto-requeueing enabled. Setting signal handlers.
SLURM auto-requeueing enabled. Setting signal handlers.
SLURM auto-requeueing enabled. Setting signal handlers.
SLURM auto-requeueing enabled. Setting signal handlers.
SLURM auto-requeueing enabled. Setting signal handlers.
SLURM auto-requeueing enabled. Setting signal handlers.
SLURM auto-requeueing enabled. Setting signal handlers.
SLURM auto-requeueing enabled. Setting signal handlers.
SLURM auto-requeueing enabled. Setting signal handlers.
SLURM auto-requeueing enabled. Setting signal handlers.
SLURM auto-requeueing enabled. Setting signal handlers.
SLURM auto-requeueing enabled. Setting signal handlers.
SLURM auto-requeueing enabled. Setting signal handlers.
SLURM auto-requeueing enabled. Setting signal handlers.
SLURM auto-requeueing enabled. Setting signal handlers.
SLURM auto-requeueing enabled. Setting signal handlers.
SLURM auto-requeueing enabled. Setting signal handlers.
SLURM auto-requeueing enabled. Setting signal handlers.
SLURM auto-requeueing enabled. Setting signal handlers.
SLURM auto-requeueing enabled. Setting signal handlers.
SLURM auto-requeueing enabled. Setting signal handlers.
SLURM auto-requeueing enabled. Setting signal handlers.
SLURM auto-requeueing enabled. Setting signal handlers.
SLURM auto-requeueing enabled. Setting signal handlers.
SLURM auto-requeueing enabled. Setting signal handlers.
SLURM auto-requeueing enabled. Setting signal handlers.
SLURM auto-requeueing enabled. Setting signal handlers.
SLURM auto-requeueing enabled. Setting signal handlers.
SLURM auto-requeueing enabled. Setting signal handlers.
SLURM auto-requeueing enabled. Setting signal handlers.
