[I 2024-09-24 23:49:32,033] Trial 15 finished with values: [1.0, 10033303202.873083, 0.0, 50.0, 2.59493426452436, 0.3, 50.0, 5.816811834234611, 0.4444444444444444] and parameters: {'gamma': 475.5417140623362, 'sigma': 64.64155182729307, 'delta': 23.725292937072215, 'mean_degree': 3.56232812602417, 'res_sz': 100, 'window': 0.0012388577551811096, 'spect_rad': 0.09456972641756194, 'ridge_alpha': 5.5583560495078863e-05}. 
[I 2024-09-24 23:49:43,664] Trial 16 finished with values: [2.0, 1.8626403997273697, 0.1, 50.0, 1.7284468389393417, 0.4, 50.0, 2.9976382432191304, 0.6666666666666666] and parameters: {'gamma': 304.1160846217059, 'sigma': 55.88291648577026, 'delta': 61.38670405304553, 'mean_degree': 1.1833892107113744, 'res_sz': 77, 'window': 0.02679798568081009, 'spect_rad': 0.0011751947389368497, 'ridge_alpha': 40.09175019870157}. 
[I 2024-09-24 23:49:49,147] Trial 17 finished with values: [0.0, 10312059115.32181, 0.0, 0.0, 18788283016.3642, 0.0, 0.0, 30630396567.223938, 0.3333333333333333] and parameters: {'gamma': 347.8184232623231, 'sigma': 19.993894954753323, 'delta': 76.50885475027889, 'mean_degree': 1.6468720482146133, 'res_sz': 68, 'window': 43.138641750304515, 'spect_rad': 8.25153589653794, 'ridge_alpha': 8.926623933783651e-06}. 
[I 2024-09-24 23:49:58,774] Trial 18 finished with values: [1.0, 1.1828039814240845, 0.7, 50.0, 1.4110438345107879, 0.8, 50.0, 4.380605878474465, 0.4444444444444444] and parameters: {'gamma': 46.69312315406736, 'sigma': 88.17280791351384, 'delta': 70.23585165653765, 'mean_degree': 2.4046917560443957, 'res_sz': 19, 'window': 0.13555580789451388, 'spect_rad': 0.004664097373462558, 'ridge_alpha': 16.09779202004735}. 
[I 2024-09-24 23:50:10,947] Trial 19 finished with values: [1.0, 1.479659120260496, 0.3, 50.0, 1.3928028673127464, 0.3, 50.0, 3.117457909581843, 0.1111111111111111] and parameters: {'gamma': 142.87648027159952, 'sigma': 53.65886366029553, 'delta': 50.42202770433627, 'mean_degree': 4.963584090776585, 'res_sz': 19, 'window': 0.04703199969142552, 'spect_rad': 0.005008181782685623, 'ridge_alpha': 4.7292340599747495}. 
 lsoda--  at t (=r1), too much accuracy requested    
       for precision of machine..  see tolsf (=r2)   
      in above,  r1 =  0.1500000000000D+03   r2 =                  NaN
 lsoda--  at t (=r1), too much accuracy requested    
       for precision of machine..  see tolsf (=r2)   
      in above,  r1 =  0.1000000000000D+01   r2 =                  NaN
 lsoda--  at t (=r1), too much accuracy requested    
       for precision of machine..  see tolsf (=r2)   
      in above,  r1 =  0.1500000000000D+03   r2 =                  NaN
 lsoda--  at t (=r1), too much accuracy requested    
       for precision of machine..  see tolsf (=r2)   
      in above,  r1 =  0.1500000000000D+03   r2 =                  NaN
 lsoda--  at t (=r1), too much accuracy requested    
       for precision of machine..  see tolsf (=r2)   
      in above,  r1 =  0.1000000000000D+01   r2 =                  NaN
 lsoda--  at t (=r1), too much accuracy requested    
       for precision of machine..  see tolsf (=r2)   
      in above,  r1 =  0.1500000000000D+03   r2 =                  NaN
 lsoda--  at t (=r1), too much accuracy requested    
       for precision of machine..  see tolsf (=r2)   
      in above,  r1 =  0.1500000000000D+03   r2 =                  NaN
 lsoda--  at t (=r1), too much accuracy requested    
       for precision of machine..  see tolsf (=r2)   
      in above,  r1 =  0.1000000000000D+01   r2 =                  NaN
 lsoda--  at t (=r1), too much accuracy requested    
       for precision of machine..  see tolsf (=r2)   
      in above,  r1 =  0.1500000000000D+03   r2 =                  NaN
 lsoda--  at t (=r1), too much accuracy requested    
       for precision of machine..  see tolsf (=r2)   
      in above,  r1 =  0.1500000000000D+03   r2 =                  NaN
 lsoda--  at t (=r1), too much accuracy requested    
       for precision of machine..  see tolsf (=r2)   
      in above,  r1 =  0.1000000000000D+01   r2 =                  NaN
 lsoda--  at t (=r1), too much accuracy requested    
       for precision of machine..  see tolsf (=r2)   
      in above,  r1 =  0.1500000000000D+03   r2 =                  NaN
 lsoda--  at t (=r1), too much accuracy requested    
       for precision of machine..  see tolsf (=r2)   
      in above,  r1 =  0.1500000000000D+03   r2 =                  NaN
 lsoda--  at t (=r1), too much accuracy requested    
       for precision of machine..  see tolsf (=r2)   
      in above,  r1 =  0.1000000000000D+01   r2 =                  NaN
 lsoda--  at t (=r1), too much accuracy requested    
       for precision of machine..  see tolsf (=r2)   
      in above,  r1 =  0.1500000000000D+03   r2 =                  NaN
 lsoda--  at t (=r1), too much accuracy requested    
       for precision of machine..  see tolsf (=r2)   
      in above,  r1 =  0.1500000000000D+03   r2 =                  NaN
 lsoda--  at t (=r1), too much accuracy requested    
       for precision of machine..  see tolsf (=r2)   
      in above,  r1 =  0.1000000000000D+01   r2 =                  NaN
 lsoda--  at t (=r1), too much accuracy requested    
       for precision of machine..  see tolsf (=r2)   
      in above,  r1 =  0.1500000000000D+03   r2 =                  NaN
 lsoda--  at t (=r1), too much accuracy requested    
       for precision of machine..  see tolsf (=r2)   
      in above,  r1 =  0.1500000000000D+03   r2 =                  NaN
 lsoda--  at t (=r1), too much accuracy requested    
       for precision of machine..  see tolsf (=r2)   
      in above,  r1 =  0.1000000000000D+01   r2 =                  NaN
 lsoda--  at t (=r1), too much accuracy requested    
       for precision of machine..  see tolsf (=r2)   
      in above,  r1 =  0.1500000000000D+03   r2 =                  NaN
 lsoda--  at t (=r1), too much accuracy requested    
       for precision of machine..  see tolsf (=r2)   
      in above,  r1 =  0.1500000000000D+03   r2 =                  NaN
 lsoda--  at t (=r1), too much accuracy requested    
       for precision of machine..  see tolsf (=r2)   
      in above,  r1 =  0.1000000000000D+01   r2 =                  NaN
[I 2024-09-24 23:50:16,287] Trial 20 finished with values: [0.0, 10312059115.32181, 0.0, 0.0, 18788283016.3642, 0.0, 0.0, 30630396567.223938, 0.3333333333333333] and parameters: {'gamma': 50.84077548906491, 'sigma': 29.23219210532687, 'delta': 22.019053557176854, 'mean_degree': 2.2285385258972292, 'res_sz': 60, 'window': 50.762486944705856, 'spect_rad': 62.40931769865801, 'ridge_alpha': 5.604827310580114e-06}. 
[I 2024-09-24 23:50:27,290] Trial 21 finished with values: [1.0, 8586505137.947995, 0.0, 50.0, 1.619486960357356, 0.2, 50.0, 3.638692039786708, 0.4444444444444444] and parameters: {'gamma': 401.3088759065571, 'sigma': 23.24680184714923, 'delta': 52.68031360165053, 'mean_degree': 2.3169677026546536, 'res_sz': 17, 'window': 0.003885879089673724, 'spect_rad': 0.0019504313959978644, 'ridge_alpha': 1.2387819584536617}. 
[I 2024-09-24 23:50:43,365] Trial 22 finished with values: [1.0, 7530863189.058584, 0.0, 50.0, 3.845153633456416, 0.0, 1.0, 8.251043790987582, 0.2222222222222222] and parameters: {'gamma': 321.88545091147085, 'sigma': 60.78181056468164, 'delta': 88.06251518457783, 'mean_degree': 3.5942601145046527, 'res_sz': 96, 'window': 1.3580378441646124, 'spect_rad': 9.05051106165916, 'ridge_alpha': 0.2554255672374037}. 
[I 2024-09-24 23:50:58,375] Trial 23 finished with values: [1.0, 2.709603579382302, 0.1, 50.0, 1.7716185094449415, 0.3, 50.0, 4.089683902158552, 0.3333333333333333] and parameters: {'gamma': 134.2306471395622, 'sigma': 85.02114809404547, 'delta': 19.23456124745628, 'mean_degree': 4.698258312637631, 'res_sz': 84, 'window': 0.12752344551122852, 'spect_rad': 0.22475302650146203, 'ridge_alpha': 0.0013220236544094644}. 
[I 2024-09-24 23:51:13,555] Trial 24 finished with values: [1.0, 60512315.49303853, 1.0, 50.0, 1.5080066734682538, 0.4, 50.0, 3.3732859646656106, 0.5555555555555556] and parameters: {'gamma': 187.39085737481113, 'sigma': 18.364922773087606, 'delta': 97.59034478202123, 'mean_degree': 0.6273590362516683, 'res_sz': 75, 'window': 0.12298347164769492, 'spect_rad': 0.479138876881212, 'ridge_alpha': 2.894664481876128e-07}. 
[I 2024-09-24 23:51:22,094] A new study created in memory with name: SINDY predicting GenForecast[cml, VAR]
[I 2024-09-24 23:51:27,325] Trial 0 finished with values: [9.0, 22.700877511901954, 0.4, 14.0, 31.109323321984856, 0.8, 3.0, 59.3338518362489, 0.5555555555555556] and parameters: {'optimizer__threshold': 0.0037649140900321157, 'optimizer__alpha': 1.4969514007516662, 'discrete_time': True, 'feature_library': 1, 'differentiation_method': 0}. 
[I 2024-09-24 23:51:39,730] Trial 1 finished with values: [2.0, 301.1549858869012, 0.2, 3.0, 255.87338520652108, 0.1, 2.0, 921.0343949789838, 0.2222222222222222] and parameters: {'optimizer__threshold': 0.2843835890961193, 'optimizer__alpha': 0.1697864081212698, 'discrete_time': False, 'feature_library': 1, 'differentiation_method': 1}. 
/nas/longleaf/home/djpassey/.local/lib/python3.9/site-packages/pysindy/optimizers/stlsq.py:201: UserWarning: Sparsity parameter is too big (0.1) and eliminated all coefficients
  warnings.warn(
/nas/longleaf/home/djpassey/.local/lib/python3.9/site-packages/pysindy/optimizers/stlsq.py:201: UserWarning: Sparsity parameter is too big (0.1) and eliminated all coefficients
  warnings.warn(
/nas/longleaf/home/djpassey/.local/lib/python3.9/site-packages/pysindy/optimizers/stlsq.py:201: UserWarning: Sparsity parameter is too big (0.1) and eliminated all coefficients
  warnings.warn(
/nas/longleaf/home/djpassey/.local/lib/python3.9/site-packages/pysindy/optimizers/stlsq.py:201: UserWarning: Sparsity parameter is too big (0.1) and eliminated all coefficients
  warnings.warn(
/nas/longleaf/home/djpassey/.local/lib/python3.9/site-packages/pysindy/optimizers/stlsq.py:201: UserWarning: Sparsity parameter is too big (0.1) and eliminated all coefficients
  warnings.warn(
/nas/longleaf/home/djpassey/.local/lib/python3.9/site-packages/pysindy/optimizers/stlsq.py:201: UserWarning: Sparsity parameter is too big (0.1) and eliminated all coefficients
  warnings.warn(
/nas/longleaf/home/djpassey/.local/lib/python3.9/site-packages/pysindy/optimizers/stlsq.py:201: UserWarning: Sparsity parameter is too big (0.1) and eliminated all coefficients
  warnings.warn(
/nas/longleaf/home/djpassey/.local/lib/python3.9/site-packages/pysindy/optimizers/stlsq.py:201: UserWarning: Sparsity parameter is too big (0.1) and eliminated all coefficients
  warnings.warn(
/nas/longleaf/home/djpassey/.local/lib/python3.9/site-packages/pysindy/optimizers/stlsq.py:201: UserWarning: Sparsity parameter is too big (0.1) and eliminated all coefficients
  warnings.warn(
/nas/longleaf/home/djpassey/.local/lib/python3.9/site-packages/pysindy/optimizers/stlsq.py:201: UserWarning: Sparsity parameter is too big (0.1) and eliminated all coefficients
  warnings.warn(
[I 2024-09-24 23:51:49,529] Trial 2 finished with values: [1.0, 2.709869143143564, 0.1, 50.0, 1.5881394507593287, 0.2, 50.0, 3.5533491905672308, 0.3333333333333333] and parameters: {'optimizer__threshold': 6.453204225747573e-05, 'optimizer__alpha': 4.105044284615715, 'discrete_time': False, 'feature_library': 0, 'differentiation_method': 4}. 
/nas/longleaf/home/djpassey/.local/lib/python3.9/site-packages/pysindy/optimizers/stlsq.py:201: UserWarning: Sparsity parameter is too big (0.1) and eliminated all coefficients
  warnings.warn(
/nas/longleaf/home/djpassey/.local/lib/python3.9/site-packages/pysindy/optimizers/stlsq.py:201: UserWarning: Sparsity parameter is too big (0.1) and eliminated all coefficients
  warnings.warn(
[I 2024-09-24 23:52:01,065] Trial 3 finished with values: [2.0, 1264.0344802624604, 0.0, 4.0, 163.77526195446546, 0.0, 2.0, 1106.4545587094535, 0.2222222222222222] and parameters: {'optimizer__threshold': 0.0019424990813935827, 'optimizer__alpha': 0.001557933542114641, 'discrete_time': False, 'feature_library': 1, 'differentiation_method': 8}. 
[I 2024-09-24 23:52:55,067] Trial 4 finished with values: [1.0, 2.709869143143564, 0.1, 1.0, 34.924022514213966, 0.0, 50.0, 3.5533491905672308, 0.3333333333333333] and parameters: {'optimizer__threshold': 0.0001412040315233416, 'optimizer__alpha': 0.00022118454790570678, 'discrete_time': False, 'feature_library': 1, 'differentiation_method': 3}. 
[I 2024-09-24 23:53:49,143] Trial 5 finished with values: [1.0, 2.709869143143564, 0.1, 1.0, 34.924022514213966, 0.0, 50.0, 3.5533491905672308, 0.3333333333333333] and parameters: {'optimizer__threshold': 0.03276192185090741, 'optimizer__alpha': 5.402834014376062e-05, 'discrete_time': False, 'feature_library': 1, 'differentiation_method': 3}. 
[I 2024-09-24 23:53:54,918] Trial 6 finished with values: [9.0, 22.700877511901954, 0.4, 14.0, 31.109323321984856, 0.8, 3.0, 59.3338518362489, 0.5555555555555556] and parameters: {'optimizer__threshold': 0.0006817673881564634, 'optimizer__alpha': 0.00015769192825659966, 'discrete_time': True, 'feature_library': 1, 'differentiation_method': 0}. 
[I 2024-09-24 23:54:00,288] Trial 7 finished with values: [4.0, 403385.8916533743, 0.0, 16.0, 52103.71159341639, 0.0, 1.0, 540304.7645372198, 0.4444444444444444] and parameters: {'optimizer__threshold': 1.3043167761941625, 'optimizer__alpha': 1.6921318275483763, 'discrete_time': True, 'feature_library': 0, 'differentiation_method': 0}. 
/nas/longleaf/home/djpassey/.local/lib/python3.9/site-packages/pysindy/optimizers/stlsq.py:201: UserWarning: Sparsity parameter is too big (0.1) and eliminated all coefficients
  warnings.warn(
/nas/longleaf/home/djpassey/.local/lib/python3.9/site-packages/pysindy/optimizers/stlsq.py:201: UserWarning: Sparsity parameter is too big (0.1) and eliminated all coefficients
  warnings.warn(
/nas/longleaf/home/djpassey/.local/lib/python3.9/site-packages/pysindy/optimizers/stlsq.py:201: UserWarning: Sparsity parameter is too big (0.1) and eliminated all coefficients
  warnings.warn(
/nas/longleaf/home/djpassey/.local/lib/python3.9/site-packages/pysindy/optimizers/stlsq.py:201: UserWarning: Sparsity parameter is too big (0.1) and eliminated all coefficients
  warnings.warn(
/nas/longleaf/home/djpassey/.local/lib/python3.9/site-packages/pysindy/optimizers/stlsq.py:201: UserWarning: Sparsity parameter is too big (0.1) and eliminated all coefficients
  warnings.warn(
/nas/longleaf/home/djpassey/.local/lib/python3.9/site-packages/pysindy/optimizers/stlsq.py:201: UserWarning: Sparsity parameter is too big (0.1) and eliminated all coefficients
  warnings.warn(
/nas/longleaf/home/djpassey/.local/lib/python3.9/site-packages/pysindy/optimizers/stlsq.py:201: UserWarning: Sparsity parameter is too big (0.1) and eliminated all coefficients
  warnings.warn(
/nas/longleaf/home/djpassey/.local/lib/python3.9/site-packages/pysindy/optimizers/stlsq.py:201: UserWarning: Sparsity parameter is too big (0.1) and eliminated all coefficients
  warnings.warn(
/nas/longleaf/home/djpassey/.local/lib/python3.9/site-packages/pysindy/optimizers/stlsq.py:201: UserWarning: Sparsity parameter is too big (0.1) and eliminated all coefficients
  warnings.warn(
/nas/longleaf/home/djpassey/.local/lib/python3.9/site-packages/pysindy/optimizers/stlsq.py:201: UserWarning: Sparsity parameter is too big (0.1) and eliminated all coefficients
  warnings.warn(
/nas/longleaf/home/djpassey/.local/lib/python3.9/site-packages/pysindy/optimizers/stlsq.py:201: UserWarning: Sparsity parameter is too big (0.1) and eliminated all coefficients
  warnings.warn(
/nas/longleaf/home/djpassey/.local/lib/python3.9/site-packages/pysindy/optimizers/stlsq.py:201: UserWarning: Sparsity parameter is too big (0.1) and eliminated all coefficients
  warnings.warn(
/nas/longleaf/home/djpassey/.local/lib/python3.9/site-packages/pysindy/optimizers/stlsq.py:201: UserWarning: Sparsity parameter is too big (0.1) and eliminated all coefficients
  warnings.warn(
/nas/longleaf/home/djpassey/.local/lib/python3.9/site-packages/pysindy/optimizers/stlsq.py:201: UserWarning: Sparsity parameter is too big (0.1) and eliminated all coefficients
  warnings.warn(
/nas/longleaf/home/djpassey/.local/lib/python3.9/site-packages/pysindy/optimizers/stlsq.py:201: UserWarning: Sparsity parameter is too big (0.1) and eliminated all coefficients
  warnings.warn(
/nas/longleaf/home/djpassey/.local/lib/python3.9/site-packages/pysindy/optimizers/stlsq.py:201: UserWarning: Sparsity parameter is too big (0.1) and eliminated all coefficients
  warnings.warn(
/nas/longleaf/home/djpassey/.local/lib/python3.9/site-packages/pysindy/optimizers/stlsq.py:201: UserWarning: Sparsity parameter is too big (0.1) and eliminated all coefficients
  warnings.warn(
/nas/longleaf/home/djpassey/.local/lib/python3.9/site-packages/pysindy/optimizers/stlsq.py:201: UserWarning: Sparsity parameter is too big (0.1) and eliminated all coefficients
  warnings.warn(
/nas/longleaf/home/djpassey/.local/lib/python3.9/site-packages/pysindy/optimizers/stlsq.py:201: UserWarning: Sparsity parameter is too big (0.1) and eliminated all coefficients
  warnings.warn(
/nas/longleaf/home/djpassey/.local/lib/python3.9/site-packages/pysindy/optimizers/stlsq.py:201: UserWarning: Sparsity parameter is too big (0.1) and eliminated all coefficients
  warnings.warn(
[I 2024-09-24 23:54:07,569] Trial 8 finished with values: [1.0, 3.928703508312741, 0.0, 50.0, 2.0668828426836434, 0.1, 1.0, 7.137981113805432, 0.1111111111111111] and parameters: {'optimizer__threshold': 1.4793664872606287, 'optimizer__alpha': 0.6042426787102575, 'discrete_time': False, 'feature_library': 0, 'differentiation_method': 8}. 
[I 2024-09-24 23:54:21,049] Trial 9 finished with values: [1.0, 617.3658123676037, 0.0, 3.0, 465.7004588236729, 0.1, 2.0, 1743.6830164435964, 0.4444444444444444] and parameters: {'optimizer__threshold': 0.00011834045170277483, 'optimizer__alpha': 0.0017803083757638235, 'discrete_time': False, 'feature_library': 1, 'differentiation_method': 2}. 
[I 2024-09-24 23:54:28,090] Trial 10 finished with values: [2.0, 9.895545555371186, 0.0, 17.0, 37.7279425288604, 0.0, 2.0, 39.46371224612357, 0.4444444444444444] and parameters: {'optimizer__threshold': 0.0019147049186083467, 'optimizer__alpha': 7.698118814179578e-05, 'discrete_time': False, 'feature_library': 0, 'differentiation_method': 0}. 
[I 2024-09-24 23:54:41,637] Trial 11 finished with values: [1.0, 617.3658123676037, 0.0, 3.0, 465.7004588236729, 0.1, 2.0, 1743.6830164435964, 0.4444444444444444] and parameters: {'optimizer__threshold': 0.00029034896695176806, 'optimizer__alpha': 1.1769290090645558e-05, 'discrete_time': False, 'feature_library': 1, 'differentiation_method': 2}. 
[I 2024-09-24 23:55:35,218] Trial 12 finished with values: [1.0, 2.709869143143564, 0.1, 1.0, 34.924022514213966, 0.0, 50.0, 3.5533491905672308, 0.3333333333333333] and parameters: {'optimizer__threshold': 1.1294559253372532e-05, 'optimizer__alpha': 0.05370203160323383, 'discrete_time': False, 'feature_library': 1, 'differentiation_method': 3}. 
[I 2024-09-24 23:55:40,459] Trial 13 finished with values: [4.0, 403385.8916533743, 0.0, 16.0, 52103.71159341639, 0.0, 1.0, 540304.7645372198, 0.4444444444444444] and parameters: {'optimizer__threshold': 0.000860332012923755, 'optimizer__alpha': 0.0016954583105219655, 'discrete_time': True, 'feature_library': 0, 'differentiation_method': 3}. 
[I 2024-09-24 23:55:45,801] Trial 14 finished with values: [4.0, 403385.8916533743, 0.0, 16.0, 52103.71159341639, 0.0, 1.0, 540304.7645372198, 0.4444444444444444] and parameters: {'optimizer__threshold': 0.003745610470709674, 'optimizer__alpha': 0.03169736013103522, 'discrete_time': True, 'feature_library': 0, 'differentiation_method': 1}. 
[I 2024-09-24 23:55:51,312] Trial 15 finished with values: [9.0, 22.700877511901954, 0.4, 14.0, 31.109323321984856, 0.8, 3.0, 59.3338518362489, 0.5555555555555556] and parameters: {'optimizer__threshold': 0.1150279792256728, 'optimizer__alpha': 0.05269989358570275, 'discrete_time': True, 'feature_library': 1, 'differentiation_method': 1}. 
[I 2024-09-24 23:55:57,838] Trial 16 finished with values: [1.0, 3.103932095014467, 0.1, 8.0, 14.685181746247157, 0.0, 2.0, 44.41545033331976, 0.4444444444444444] and parameters: {'optimizer__threshold': 0.009158068186993402, 'optimizer__alpha': 0.00014692204893441307, 'discrete_time': False, 'feature_library': 0, 'differentiation_method': 1}. 
