[I 2024-09-25 12:48:50,450] Trial 13 finished with values: [12.0, 2.9063851957967564, 0.0, 50.0, 0.42197417090615275, 1.0, 3.0, 62925.94156669015, 0.0] and parameters: {'optimizer__threshold': 0.0010471437769422683, 'optimizer__alpha': 0.02344623118003202, 'discrete_time': True, 'feature_library': 0, 'differentiation_method': 4}. 
[I 2024-09-25 12:48:55,661] Trial 14 finished with values: [5.0, 23.376011232926075, 0.1, 8.0, 23.489503617844175, 0.3, 2.0, 22.926280325898365, 0.3333333333333333] and parameters: {'optimizer__threshold': 0.0006969584848823413, 'optimizer__alpha': 0.003699611458483707, 'discrete_time': True, 'feature_library': 1, 'differentiation_method': 6}. 
[I 2024-09-25 12:49:01,100] Trial 15 finished with values: [12.0, 2.9063851957967564, 0.0, 50.0, 0.42197417090615275, 1.0, 3.0, 62925.94156669015, 0.0] and parameters: {'optimizer__threshold': 7.236059664133922e-05, 'optimizer__alpha': 2.1339641076012063e-05, 'discrete_time': True, 'feature_library': 0, 'differentiation_method': 1}. 
[I 2024-09-25 12:49:06,231] Trial 16 finished with values: [12.0, 2.9063851957967564, 0.0, 50.0, 0.42197417090615275, 1.0, 3.0, 62925.94156669015, 0.0] and parameters: {'optimizer__threshold': 0.003348123766035847, 'optimizer__alpha': 0.6968120615128366, 'discrete_time': True, 'feature_library': 0, 'differentiation_method': 3}. 
[I 2024-09-25 12:49:31,849] Trial 17 finished with values: [1.0, 9.030161348697671, 0.2, 2.0, 3.2954786627516106, 0.0, 50.0, 1.2061088317543296, 0.0] and parameters: {'optimizer__threshold': 1.1986080903195057e-05, 'optimizer__alpha': 0.0003528650618085615, 'discrete_time': False, 'feature_library': 0, 'differentiation_method': 2}. 
[I 2024-09-25 12:50:22,788] Trial 18 finished with values: [1.0, 9854.668306114756, 0.0, 2.0, 3092.2197986778096, 0.0, 1.0, 6870.681775951227, 0.0] and parameters: {'optimizer__threshold': 8.550199018670877e-05, 'optimizer__alpha': 2.017191654142186, 'discrete_time': False, 'feature_library': 1, 'differentiation_method': 6}. 
[I 2024-09-25 12:50:27,972] Trial 19 finished with values: [5.0, 23.376011232926075, 0.1, 8.0, 23.489503617844175, 0.3, 2.0, 22.926280325898365, 0.3333333333333333] and parameters: {'optimizer__threshold': 0.8166237311683128, 'optimizer__alpha': 1.1108959000591186e-05, 'discrete_time': True, 'feature_library': 1, 'differentiation_method': 8}. 
[I 2024-09-25 12:50:53,442] Trial 20 finished with values: [1.0, 9.030161348697671, 0.2, 2.0, 3.2954786627516106, 0.0, 50.0, 1.2061088317543296, 0.0] and parameters: {'optimizer__threshold': 0.34656225026202475, 'optimizer__alpha': 0.026794729124633914, 'discrete_time': False, 'feature_library': 0, 'differentiation_method': 2}. 
[I 2024-09-25 12:50:58,921] Trial 21 finished with values: [12.0, 2.9063851957967564, 0.0, 50.0, 0.42197417090615275, 1.0, 3.0, 62925.94156669015, 0.0] and parameters: {'optimizer__threshold': 0.00010809166341700821, 'optimizer__alpha': 8.343863060066364e-05, 'discrete_time': True, 'feature_library': 0, 'differentiation_method': 4}. 
[I 2024-09-25 12:51:22,321] Trial 22 finished with values: [1.0, 1808.7491932470361, 0.0, 1.0, 628.4920489248212, 0.0, 1.0, 2900.33327924822, 0.1111111111111111] and parameters: {'optimizer__threshold': 0.08320315620491461, 'optimizer__alpha': 0.00015423492777637634, 'discrete_time': False, 'feature_library': 1, 'differentiation_method': 4}. 
[I 2024-09-25 12:51:40,947] Trial 23 finished with values: [1.0, 9220.144586049271, 0.1, 2.0, 2191.317888085608, 0.1, 1.0, 664.1805132020983, 0.1111111111111111] and parameters: {'optimizer__threshold': 0.03408614326698134, 'optimizer__alpha': 6.30032887621647e-05, 'discrete_time': False, 'feature_library': 1, 'differentiation_method': 2}. 
[I 2024-09-25 12:52:16,421] Trial 24 finished with values: [1.0, 4612.910736648993, 0.0, 1.0, 1443.3672436880381, 0.0, 1.0, 2528.11064797924, 0.0] and parameters: {'optimizer__threshold': 5.553825676771719e-05, 'optimizer__alpha': 0.001409008634201135, 'discrete_time': False, 'feature_library': 1, 'differentiation_method': 5}. 
[I 2024-09-25 12:52:35,869] A new study created in memory with name: LTSFLinearForecaster predicting GenForecast[cml, ResComp]
[I 2024-09-25 12:52:43,727] Trial 0 finished with values: [1.0, 165.88048005758031, 0.3, 50.0, 193281871895957.28, 0.5, 50.0, 55.2802446431659, 0.0] and parameters: {'seq_len': 11, 'lr': 0.017490907830165905, 'pred_len': 17, 'num_epochs': 50}. 
[I 2024-09-25 12:52:53,195] Trial 1 finished with values: [7.0, 168.85702419656855, 0.0, 50.0, 19535853422478.94, 1.0, 50.0, 55.59073620439499, 0.0] and parameters: {'seq_len': 23, 'lr': 0.002998104471005017, 'pred_len': 5, 'num_epochs': 100}. 
[I 2024-09-25 12:53:02,676] Trial 2 finished with values: [1.0, 377.2763381272392, 0.1, 50.0, 2622754494120949.0, 0.2, 50.0, 59.97181625418129, 0.0] and parameters: {'seq_len': 14, 'lr': 0.00016815538574520023, 'pred_len': 16, 'num_epochs': 100}. 
[I 2024-09-25 12:53:18,857] Trial 3 finished with values: [1.0, 133.77967043650793, 0.0, 50.0, 105229481542434.97, 0.6, 50.0, 55.094901089749804, 0.0] and parameters: {'seq_len': 13, 'lr': 0.0021146212290538064, 'pred_len': 7, 'num_epochs': 300}. 
[I 2024-09-25 12:53:34,305] Trial 4 finished with values: [1.0, 411.9779458256386, 0.0, 4.0, 2.4350351092369264e+16, 0.0, 50.0, 34.559954982214826, 0.7777777777777778] and parameters: {'seq_len': 6, 'lr': 6.961023233230051e-05, 'pred_len': 25, 'num_epochs': 300}. 
[I 2024-09-25 12:53:50,859] Trial 5 finished with values: [2.0, 120.11058040770092, 0.0, 50.0, 11762989086960.533, 1.0, 50.0, 56.45173673342215, 0.2222222222222222] and parameters: {'seq_len': 7, 'lr': 0.002566962870068736, 'pred_len': 12, 'num_epochs': 300}. 
[I 2024-09-25 12:53:58,650] Trial 6 finished with values: [2.0, 178.9005638522134, 0.1, 50.0, 2205858845139856.5, 0.0, 1.0, 272.44686727018177, 0.2222222222222222] and parameters: {'seq_len': 23, 'lr': 1.2633089002217103e-05, 'pred_len': 5, 'num_epochs': 50}. 
[I 2024-09-25 12:54:07,735] Trial 7 finished with values: [1.0, 299.3977609671666, 0.1, 50.0, 12044079524272.178, 1.0, 50.0, 55.64920242647561, 0.0] and parameters: {'seq_len': 21, 'lr': 0.005499359827130505, 'pred_len': 19, 'num_epochs': 100}. 
[I 2024-09-25 12:54:22,489] Trial 8 finished with values: [1.0, 166.6983930466577, 0.0, 50.0, 15196618708391.271, 1.0, 50.0, 56.648996491013065, 0.2222222222222222] and parameters: {'seq_len': 19, 'lr': 0.06838503277852438, 'pred_len': 24, 'num_epochs': 300}. 
[I 2024-09-25 12:54:30,087] Trial 9 finished with values: [1.0, 161.62055876743872, 0.1, 50.0, 6667515338683707.0, 0.0, 29.0, 168.58875686353787, 0.2222222222222222] and parameters: {'seq_len': 16, 'lr': 0.00012746592625673302, 'pred_len': 25, 'num_epochs': 50}. 
[I 2024-09-25 12:54:39,189] Trial 10 finished with values: [1.0, 185.68235423319072, 0.0, 50.0, 44162916039715.86, 0.7, 50.0, 55.96501009938689, 0.0] and parameters: {'seq_len': 22, 'lr': 0.0011471508602533247, 'pred_len': 24, 'num_epochs': 100}. 
[I 2024-09-25 12:54:48,788] Trial 11 finished with values: [3.0, 10283144.229191765, 0.0, 16.0, 9.539733657905445e+16, 0.1, 50.0, 36.57157940261364, 0.4444444444444444] and parameters: {'seq_len': 1, 'lr': 0.001884807424651614, 'pred_len': 19, 'num_epochs': 100}. 
[I 2024-09-25 12:55:04,257] Trial 12 finished with values: [1.0, 130.46646290769326, 0.1, 50.0, 3965897371727612.5, 0.0, 50.0, 49.763813353391534, 0.7777777777777778] and parameters: {'seq_len': 17, 'lr': 0.0671180943110933, 'pred_len': 18, 'num_epochs': 300}. 
[I 2024-09-25 12:55:12,074] Trial 13 finished with values: [150.0, 91.72840431436764, 0.0, 50.0, 87949819370216.61, 0.8, 50.0, 53.703719267453295, 0.5555555555555556] and parameters: {'seq_len': 9, 'lr': 0.05725912174944439, 'pred_len': 14, 'num_epochs': 50}. 
[I 2024-09-25 12:55:19,748] Trial 14 finished with values: [150.0, 100.33204949329419, 0.0, 50.0, 157806356763018.6, 0.6, 47.0, 74.53924254407616, 0.0] and parameters: {'seq_len': 25, 'lr': 0.0008082003524240681, 'pred_len': 15, 'num_epochs': 50}. 
[I 2024-09-25 12:55:27,348] Trial 15 finished with values: [1.0, 101.65442644954325, 0.2, 50.0, 2002597282652313.5, 0.2, 32.0, 85.80798839772096, 0.0] and parameters: {'seq_len': 25, 'lr': 0.0020001743065571464, 'pred_len': 15, 'num_epochs': 50}. 
[I 2024-09-25 12:55:35,144] Trial 16 finished with values: [4.0, 141.63597861698025, 0.0, 50.0, 490328857655894.75, 0.3, 50.0, 52.67020035356526, 0.4444444444444444] and parameters: {'seq_len': 20, 'lr': 0.0003135585664987637, 'pred_len': 16, 'num_epochs': 50}. 
[I 2024-09-25 12:55:43,107] Trial 17 finished with values: [6.0, 313.9847620840271, 0.0, 13.0, 1.7874558141691808e+16, 0.0, 1.0, 275.78305656179896, 0.2222222222222222] and parameters: {'seq_len': 16, 'lr': 4.595247714679963e-05, 'pred_len': 5, 'num_epochs': 50}. 
[I 2024-09-25 12:55:59,087] Trial 18 finished with values: [150.0, 89.50774671577456, 0.0, 50.0, 830565843191851.0, 0.3, 50.0, 52.91939222104543, 0.6666666666666666] and parameters: {'seq_len': 4, 'lr': 0.002497468464697288, 'pred_len': 16, 'num_epochs': 300}. 
[I 2024-09-25 12:56:08,588] Trial 19 finished with values: [150.0, 118.00001292164453, 0.0, 50.0, 156840376410366.0, 0.6, 50.0, 46.069124410972925, 0.4444444444444444] and parameters: {'seq_len': 7, 'lr': 0.004110017113687898, 'pred_len': 2, 'num_epochs': 100}. 
[I 2024-09-25 12:56:16,482] Trial 20 finished with values: [1.0, 78.65057847410819, 0.3, 50.0, 3132058896586246.0, 0.0, 50.0, 36.350332764614336, 0.6666666666666666] and parameters: {'seq_len': 5, 'lr': 0.0029017790608756346, 'pred_len': 12, 'num_epochs': 50}. 
[I 2024-09-25 12:56:25,974] Trial 21 finished with values: [1.0, 161.66808755758325, 0.0, 50.0, 24367475234714.344, 1.0, 35.0, 82.81484550448404, 0.0] and parameters: {'seq_len': 15, 'lr': 0.0014249991849404147, 'pred_len': 14, 'num_epochs': 100}. 
[I 2024-09-25 12:56:42,262] Trial 22 finished with values: [150.0, 76.81671737806586, 0.2, 50.0, 3899986008290055.0, 0.1, 50.0, 84.77791345736964, 0.3333333333333333] and parameters: {'seq_len': 12, 'lr': 2.997132966041824e-05, 'pred_len': 9, 'num_epochs': 300}. 
[I 2024-09-25 12:56:49,970] Trial 23 finished with values: [1.0, 375.7613285246948, 0.0, 13.0, 1.9448094409096108e+16, 0.0, 21.0, 154.46069011587048, 0.2222222222222222] and parameters: {'seq_len': 20, 'lr': 2.7474523785269872e-05, 'pred_len': 22, 'num_epochs': 50}. 
[I 2024-09-25 12:56:57,718] Trial 24 finished with values: [1.0, 162.6696543449569, 0.0, 50.0, 69389074831597.18, 0.6, 50.0, 54.584121144310195, 0.3333333333333333] and parameters: {'seq_len': 17, 'lr': 0.026960083552814557, 'pred_len': 1, 'num_epochs': 50}. 
[I 2024-09-25 12:57:17,884] A new study created in memory with name: VAR predicting GenForecast[cml, ResComp]
[W 2024-09-25 12:57:17,903] Trial 0 failed with parameters: {'ic': 'aic', 'maxlags': 4, 'trend': 'ctt'} because of the following error: The value nan is not acceptable.
[W 2024-09-25 12:57:17,903] Trial 0 failed with value [nan, nan, nan, nan, nan, nan, nan, nan, nan].
[W 2024-09-25 12:57:17,909] Trial 1 failed with parameters: {'ic': 'fpe', 'maxlags': 3, 'trend': 'n'} because of the following error: The value nan is not acceptable.
[W 2024-09-25 12:57:17,910] Trial 1 failed with value [nan, nan, nan, nan, nan, nan, nan, nan, nan].
[W 2024-09-25 12:57:17,914] Trial 2 failed with parameters: {'ic': 'fpe', 'maxlags': 1, 'trend': 'ctt'} because of the following error: The value nan is not acceptable.
[W 2024-09-25 12:57:17,915] Trial 2 failed with value [nan, nan, nan, nan, nan, nan, nan, nan, nan].
[W 2024-09-25 12:57:17,923] Trial 3 failed with parameters: {'ic': 'fpe', 'maxlags': 5, 'trend': 'ctt'} because of the following error: The value nan is not acceptable.
[W 2024-09-25 12:57:17,923] Trial 3 failed with value [nan, nan, nan, nan, nan, nan, nan, nan, nan].
[W 2024-09-25 12:57:17,928] Trial 4 failed with parameters: {'ic': 'fpe', 'maxlags': 1, 'trend': 'c'} because of the following error: The value nan is not acceptable.
[W 2024-09-25 12:57:17,928] Trial 4 failed with value [nan, nan, nan, nan, nan, nan, nan, nan, nan].
[W 2024-09-25 12:57:17,932] Trial 5 failed with parameters: {'ic': 'fpe', 'maxlags': 1, 'trend': 'n'} because of the following error: The value nan is not acceptable.
[W 2024-09-25 12:57:17,932] Trial 5 failed with value [nan, nan, nan, nan, nan, nan, nan, nan, nan].
[W 2024-09-25 12:57:17,938] Trial 6 failed with parameters: {'ic': 'fpe', 'maxlags': 2, 'trend': 'ctt'} because of the following error: The value nan is not acceptable.
[W 2024-09-25 12:57:17,938] Trial 6 failed with value [nan, nan, nan, nan, nan, nan, nan, nan, nan].
[W 2024-09-25 12:57:17,943] Trial 7 failed with parameters: {'ic': 'aic', 'maxlags': 2, 'trend': 'n'} because of the following error: The value nan is not acceptable.
[W 2024-09-25 12:57:17,943] Trial 7 failed with value [nan, nan, nan, nan, nan, nan, nan, nan, nan].
[W 2024-09-25 12:57:17,951] Trial 8 failed with parameters: {'ic': 'aic', 'maxlags': 5, 'trend': 'n'} because of the following error: The value nan is not acceptable.
[W 2024-09-25 12:57:17,951] Trial 8 failed with value [nan, nan, nan, nan, nan, nan, nan, nan, nan].
[W 2024-09-25 12:57:17,957] Trial 9 failed with parameters: {'ic': 'aic', 'maxlags': 3, 'trend': 'n'} because of the following error: The value nan is not acceptable.
[W 2024-09-25 12:57:17,957] Trial 9 failed with value [nan, nan, nan, nan, nan, nan, nan, nan, nan].
[W 2024-09-25 12:57:17,963] Trial 10 failed with parameters: {'ic': 'fpe', 'maxlags': 2, 'trend': 'c'} because of the following error: The value nan is not acceptable.
[W 2024-09-25 12:57:17,963] Trial 10 failed with value [nan, nan, nan, nan, nan, nan, nan, nan, nan].
[W 2024-09-25 12:57:17,972] Trial 11 failed with parameters: {'ic': 'aic', 'maxlags': 5, 'trend': 'ct'} because of the following error: The value nan is not acceptable.
[W 2024-09-25 12:57:17,972] Trial 11 failed with value [nan, nan, nan, nan, nan, nan, nan, nan, nan].
[W 2024-09-25 12:57:17,978] Trial 12 failed with parameters: {'ic': 'fpe', 'maxlags': 3, 'trend': 'ctt'} because of the following error: The value nan is not acceptable.
[W 2024-09-25 12:57:17,978] Trial 12 failed with value [nan, nan, nan, nan, nan, nan, nan, nan, nan].
[W 2024-09-25 12:57:17,987] Trial 13 failed with parameters: {'ic': 'fpe', 'maxlags': 5, 'trend': 'ct'} because of the following error: The value nan is not acceptable.
[W 2024-09-25 12:57:17,987] Trial 13 failed with value [nan, nan, nan, nan, nan, nan, nan, nan, nan].
[W 2024-09-25 12:57:17,994] Trial 14 failed with parameters: {'ic': 'aic', 'maxlags': 4, 'trend': 'ctt'} because of the following error: The value nan is not acceptable.
[W 2024-09-25 12:57:17,994] Trial 14 failed with value [nan, nan, nan, nan, nan, nan, nan, nan, nan].
[W 2024-09-25 12:57:17,999] Trial 15 failed with parameters: {'ic': 'fpe', 'maxlags': 1, 'trend': 'n'} because of the following error: The value nan is not acceptable.
[W 2024-09-25 12:57:17,999] Trial 15 failed with value [nan, nan, nan, nan, nan, nan, nan, nan, nan].
[W 2024-09-25 12:57:18,004] Trial 16 failed with parameters: {'ic': 'fpe', 'maxlags': 2, 'trend': 'n'} because of the following error: The value nan is not acceptable.
[W 2024-09-25 12:57:18,004] Trial 16 failed with value [nan, nan, nan, nan, nan, nan, nan, nan, nan].
[W 2024-09-25 12:57:18,011] Trial 17 failed with parameters: {'ic': 'aic', 'maxlags': 4, 'trend': 'n'} because of the following error: The value nan is not acceptable.
[W 2024-09-25 12:57:18,011] Trial 17 failed with value [nan, nan, nan, nan, nan, nan, nan, nan, nan].
[W 2024-09-25 12:57:18,016] Trial 18 failed with parameters: {'ic': 'aic', 'maxlags': 2, 'trend': 'ct'} because of the following error: The value nan is not acceptable.
[W 2024-09-25 12:57:18,016] Trial 18 failed with value [nan, nan, nan, nan, nan, nan, nan, nan, nan].
[W 2024-09-25 12:57:18,021] Trial 19 failed with parameters: {'ic': 'aic', 'maxlags': 1, 'trend': 'n'} because of the following error: The value nan is not acceptable.
[W 2024-09-25 12:57:18,021] Trial 19 failed with value [nan, nan, nan, nan, nan, nan, nan, nan, nan].
[W 2024-09-25 12:57:18,029] Trial 20 failed with parameters: {'ic': 'fpe', 'maxlags': 5, 'trend': 'n'} because of the following error: The value nan is not acceptable.
[W 2024-09-25 12:57:18,029] Trial 20 failed with value [nan, nan, nan, nan, nan, nan, nan, nan, nan].
[W 2024-09-25 12:57:18,033] Trial 21 failed with parameters: {'ic': 'fpe', 'maxlags': 1, 'trend': 'c'} because of the following error: The value nan is not acceptable.
[W 2024-09-25 12:57:18,033] Trial 21 failed with value [nan, nan, nan, nan, nan, nan, nan, nan, nan].
[W 2024-09-25 12:57:18,041] Trial 22 failed with parameters: {'ic': 'aic', 'maxlags': 5, 'trend': 'c'} because of the following error: The value nan is not acceptable.
[W 2024-09-25 12:57:18,041] Trial 22 failed with value [nan, nan, nan, nan, nan, nan, nan, nan, nan].
[W 2024-09-25 12:57:18,047] Trial 23 failed with parameters: {'ic': 'aic', 'maxlags': 3, 'trend': 'c'} because of the following error: The value nan is not acceptable.
[W 2024-09-25 12:57:18,048] Trial 23 failed with value [nan, nan, nan, nan, nan, nan, nan, nan, nan].
[W 2024-09-25 12:57:18,054] Trial 24 failed with parameters: {'ic': 'aic', 'maxlags': 3, 'trend': 'ct'} because of the following error: The value nan is not acceptable.
[W 2024-09-25 12:57:18,054] Trial 24 failed with value [nan, nan, nan, nan, nan, nan, nan, nan, nan].
[I 2024-09-25 12:57:35,478] A new study created in memory with name: LSTM predicting GenForecast[cml, ResComp]
SLURM auto-requeueing enabled. Setting signal handlers.
SLURM auto-requeueing enabled. Setting signal handlers.
SLURM auto-requeueing enabled. Setting signal handlers.
SLURM auto-requeueing enabled. Setting signal handlers.
SLURM auto-requeueing enabled. Setting signal handlers.
SLURM auto-requeueing enabled. Setting signal handlers.
SLURM auto-requeueing enabled. Setting signal handlers.
SLURM auto-requeueing enabled. Setting signal handlers.
SLURM auto-requeueing enabled. Setting signal handlers.
SLURM auto-requeueing enabled. Setting signal handlers.
SLURM auto-requeueing enabled. Setting signal handlers.
SLURM auto-requeueing enabled. Setting signal handlers.
SLURM auto-requeueing enabled. Setting signal handlers.
SLURM auto-requeueing enabled. Setting signal handlers.
SLURM auto-requeueing enabled. Setting signal handlers.
SLURM auto-requeueing enabled. Setting signal handlers.
SLURM auto-requeueing enabled. Setting signal handlers.
SLURM auto-requeueing enabled. Setting signal handlers.
SLURM auto-requeueing enabled. Setting signal handlers.
SLURM auto-requeueing enabled. Setting signal handlers.
SLURM auto-requeueing enabled. Setting signal handlers.
SLURM auto-requeueing enabled. Setting signal handlers.
[I 2024-09-25 13:12:59,469] Trial 0 finished with values: [150.0, 162.95537097060458, 0.0, 50.0, 122808448722.68152, 1.0, 2.0, 105.48677643809685, 0.2222222222222222] and parameters: {'h': 13, 'encoder_hidden_size': 300, 'encoder_n_layers': 4, 'context_size': 5, 'decoder_hidden_size': 128, 'learning_rate': 0.0001492340972169541, 'max_steps': 1000, 'batch_size': 16, 'random_seed': 14}. 
SLURM auto-requeueing enabled. Setting signal handlers.
SLURM auto-requeueing enabled. Setting signal handlers.
SLURM auto-requeueing enabled. Setting signal handlers.
SLURM auto-requeueing enabled. Setting signal handlers.
SLURM auto-requeueing enabled. Setting signal handlers.
SLURM auto-requeueing enabled. Setting signal handlers.
SLURM auto-requeueing enabled. Setting signal handlers.
SLURM auto-requeueing enabled. Setting signal handlers.
SLURM auto-requeueing enabled. Setting signal handlers.
SLURM auto-requeueing enabled. Setting signal handlers.
SLURM auto-requeueing enabled. Setting signal handlers.
SLURM auto-requeueing enabled. Setting signal handlers.
SLURM auto-requeueing enabled. Setting signal handlers.
SLURM auto-requeueing enabled. Setting signal handlers.
SLURM auto-requeueing enabled. Setting signal handlers.
SLURM auto-requeueing enabled. Setting signal handlers.
SLURM auto-requeueing enabled. Setting signal handlers.
SLURM auto-requeueing enabled. Setting signal handlers.
SLURM auto-requeueing enabled. Setting signal handlers.
SLURM auto-requeueing enabled. Setting signal handlers.
SLURM auto-requeueing enabled. Setting signal handlers.
SLURM auto-requeueing enabled. Setting signal handlers.
SLURM auto-requeueing enabled. Setting signal handlers.
SLURM auto-requeueing enabled. Setting signal handlers.
SLURM auto-requeueing enabled. Setting signal handlers.
SLURM auto-requeueing enabled. Setting signal handlers.
SLURM auto-requeueing enabled. Setting signal handlers.
SLURM auto-requeueing enabled. Setting signal handlers.
SLURM auto-requeueing enabled. Setting signal handlers.
SLURM auto-requeueing enabled. Setting signal handlers.
SLURM auto-requeueing enabled. Setting signal handlers.
SLURM auto-requeueing enabled. Setting signal handlers.
SLURM auto-requeueing enabled. Setting signal handlers.
SLURM auto-requeueing enabled. Setting signal handlers.
SLURM auto-requeueing enabled. Setting signal handlers.
