[I 2024-09-25 16:31:41,087] Trial 22 finished with values: [150.0, 4.6368834595822106e-05, 1.0, 50.0, 459273281.5417814, 1.0, 0.0, 14096.791088118043, 0.3333333333333333] and parameters: {'gamma': 426.8790277654288, 'sigma': 44.50961597475499, 'delta': 95.9997576408666, 'mean_degree': 2.3289077851468445, 'res_sz': 28, 'window': 0.8376449620378122, 'spect_rad': 7.350797586369261, 'ridge_alpha': 1.9551998105370946e-05}. 
[I 2024-09-25 16:31:47,918] Trial 23 finished with values: [150.0, 96.86318907818166, 0.0, 50.0, 236736773545.10214, 1.0, 50.0, 65.53469688542363, 0.2222222222222222] and parameters: {'gamma': 311.967492080527, 'sigma': 89.05230459581064, 'delta': 38.21834021425209, 'mean_degree': 4.811404160952427, 'res_sz': 43, 'window': 0.101027596859263, 'spect_rad': 0.46119271983346205, 'ridge_alpha': 3.5396104056793633e-08}. 
[I 2024-09-25 16:31:53,557] Trial 24 finished with values: [150.0, 23.463871846407336, 0.0, 50.0, 1307545098458454.8, 0.0, 50.0, 108.69571514576504, 0.2222222222222222] and parameters: {'gamma': 190.949734199825, 'sigma': 11.096828093376716, 'delta': 35.3174831917986, 'mean_degree': 1.610892961419091, 'res_sz': 14, 'window': 10.590350973693278, 'spect_rad': 0.015528070966053084, 'ridge_alpha': 2.9125919868927825}. 
[I 2024-09-25 16:32:12,419] A new study created in memory with name: SINDY predicting GenForecast[cml, ResComp]
/nas/longleaf/home/djpassey/.local/lib/python3.9/site-packages/pysindy/optimizers/stlsq.py:191: UserWarning: Sparsity parameter is too big (0.1) and eliminated all coefficients
  warnings.warn(
/nas/longleaf/home/djpassey/.local/lib/python3.9/site-packages/pysindy/optimizers/stlsq.py:191: UserWarning: Sparsity parameter is too big (0.1) and eliminated all coefficients
  warnings.warn(
[I 2024-09-25 16:32:17,407] Trial 0 finished with values: [1.0, 394.2767233822923, 0.0, 1.0, 3.3049493555273748e+16, 0.0, 1.0, 271.3152345533987, 0.2222222222222222] and parameters: {'optimizer__threshold': 0.00024221855915392874, 'optimizer__alpha': 3.2756057105664795, 'discrete_time': True, 'feature_library': 1, 'differentiation_method': 7}. 
/nas/longleaf/home/djpassey/.local/lib/python3.9/site-packages/pysindy/optimizers/stlsq.py:191: UserWarning: Sparsity parameter is too big (0.1) and eliminated all coefficients
  warnings.warn(
/nas/longleaf/home/djpassey/.local/lib/python3.9/site-packages/pysindy/optimizers/stlsq.py:191: UserWarning: Sparsity parameter is too big (0.1) and eliminated all coefficients
  warnings.warn(
[I 2024-09-25 16:32:23,078] Trial 1 finished with values: [1.0, 394.2767233822923, 0.0, 1.0, 3.3049493555273748e+16, 0.0, 1.0, 271.3152345533987, 0.2222222222222222] and parameters: {'optimizer__threshold': 0.111244146063996, 'optimizer__alpha': 2.5849174853230568, 'discrete_time': True, 'feature_library': 0, 'differentiation_method': 3}. 
/nas/longleaf/home/djpassey/.local/lib/python3.9/site-packages/pysindy/optimizers/stlsq.py:201: UserWarning: Sparsity parameter is too big (0.1) and eliminated all coefficients
  warnings.warn(
/nas/longleaf/home/djpassey/.local/lib/python3.9/site-packages/pysindy/optimizers/stlsq.py:201: UserWarning: Sparsity parameter is too big (0.1) and eliminated all coefficients
  warnings.warn(
/nas/longleaf/home/djpassey/.local/lib/python3.9/site-packages/pysindy/optimizers/stlsq.py:201: UserWarning: Sparsity parameter is too big (0.1) and eliminated all coefficients
  warnings.warn(
/nas/longleaf/home/djpassey/.local/lib/python3.9/site-packages/pysindy/optimizers/stlsq.py:201: UserWarning: Sparsity parameter is too big (0.1) and eliminated all coefficients
  warnings.warn(
/nas/longleaf/home/djpassey/.local/lib/python3.9/site-packages/pysindy/optimizers/stlsq.py:201: UserWarning: Sparsity parameter is too big (0.1) and eliminated all coefficients
  warnings.warn(
[I 2024-09-25 16:39:51,932] Trial 2 finished with values: [150.0, 173.11594143424534, 0.0, 50.0, 1.9658571505328128, 1.0, 50.0, 55.37003710145486, 0.0] and parameters: {'optimizer__threshold': 0.20429013217674274, 'optimizer__alpha': 0.00041682285610132055, 'discrete_time': False, 'feature_library': 1, 'differentiation_method': 8}. 
/nas/longleaf/home/djpassey/.local/lib/python3.9/site-packages/pysindy/optimizers/stlsq.py:191: UserWarning: Sparsity parameter is too big (0.1) and eliminated all coefficients
  warnings.warn(
/nas/longleaf/home/djpassey/.local/lib/python3.9/site-packages/pysindy/optimizers/stlsq.py:191: UserWarning: Sparsity parameter is too big (0.1) and eliminated all coefficients
  warnings.warn(
[I 2024-09-25 16:39:57,024] Trial 3 finished with values: [150.0, 173.11594143424534, 0.0, 50.0, 1.9658571505328128, 1.0, 50.0, 55.37003710145486, 0.0] and parameters: {'optimizer__threshold': 0.052680132980985665, 'optimizer__alpha': 2.3621068860035685e-05, 'discrete_time': False, 'feature_library': 1, 'differentiation_method': 4}. 
/nas/longleaf/home/djpassey/.local/lib/python3.9/site-packages/pysindy/optimizers/stlsq.py:191: UserWarning: Sparsity parameter is too big (0.1) and eliminated all coefficients
  warnings.warn(
/nas/longleaf/home/djpassey/.local/lib/python3.9/site-packages/pysindy/optimizers/stlsq.py:191: UserWarning: Sparsity parameter is too big (0.1) and eliminated all coefficients
  warnings.warn(
[I 2024-09-25 16:40:02,593] Trial 4 finished with values: [150.0, 173.11594143424534, 0.0, 50.0, 1.9658571505328128, 1.0, 50.0, 55.37003710145486, 0.0] and parameters: {'optimizer__threshold': 0.5299855370753046, 'optimizer__alpha': 3.827862097977191, 'discrete_time': False, 'feature_library': 1, 'differentiation_method': 6}. 
/nas/longleaf/home/djpassey/.local/lib/python3.9/site-packages/pysindy/optimizers/stlsq.py:191: UserWarning: Sparsity parameter is too big (0.1) and eliminated all coefficients
  warnings.warn(
/nas/longleaf/home/djpassey/.local/lib/python3.9/site-packages/pysindy/optimizers/stlsq.py:191: UserWarning: Sparsity parameter is too big (0.1) and eliminated all coefficients
  warnings.warn(
[I 2024-09-25 16:40:07,694] Trial 5 finished with values: [150.0, 173.11594143424534, 0.0, 50.0, 1.9658571505328128, 1.0, 50.0, 55.37003710145486, 0.0] and parameters: {'optimizer__threshold': 0.0030260694408579657, 'optimizer__alpha': 3.0752563573046615e-05, 'discrete_time': False, 'feature_library': 1, 'differentiation_method': 3}. 
/nas/longleaf/home/djpassey/.local/lib/python3.9/site-packages/pysindy/optimizers/stlsq.py:191: UserWarning: Sparsity parameter is too big (0.1) and eliminated all coefficients
  warnings.warn(
/nas/longleaf/home/djpassey/.local/lib/python3.9/site-packages/pysindy/optimizers/stlsq.py:191: UserWarning: Sparsity parameter is too big (0.1) and eliminated all coefficients
  warnings.warn(
[I 2024-09-25 16:40:13,019] Trial 6 finished with values: [150.0, 173.11594143424534, 0.0, 50.0, 1.9658571505328128, 1.0, 50.0, 55.37003710145486, 0.0] and parameters: {'optimizer__threshold': 0.00011013571470785845, 'optimizer__alpha': 1.3012681931310053, 'discrete_time': False, 'feature_library': 0, 'differentiation_method': 1}. 
/nas/longleaf/home/djpassey/.local/lib/python3.9/site-packages/pysindy/optimizers/stlsq.py:201: UserWarning: Sparsity parameter is too big (0.1) and eliminated all coefficients
  warnings.warn(
/nas/longleaf/home/djpassey/.local/lib/python3.9/site-packages/pysindy/optimizers/stlsq.py:201: UserWarning: Sparsity parameter is too big (0.1) and eliminated all coefficients
  warnings.warn(
/nas/longleaf/home/djpassey/.local/lib/python3.9/site-packages/pysindy/optimizers/stlsq.py:201: UserWarning: Sparsity parameter is too big (0.1) and eliminated all coefficients
  warnings.warn(
/nas/longleaf/home/djpassey/.local/lib/python3.9/site-packages/pysindy/optimizers/stlsq.py:201: UserWarning: Sparsity parameter is too big (0.1) and eliminated all coefficients
  warnings.warn(
/nas/longleaf/home/djpassey/.local/lib/python3.9/site-packages/pysindy/optimizers/stlsq.py:201: UserWarning: Sparsity parameter is too big (0.1) and eliminated all coefficients
  warnings.warn(
/nas/longleaf/home/djpassey/.local/lib/python3.9/site-packages/pysindy/optimizers/stlsq.py:201: UserWarning: Sparsity parameter is too big (0.1) and eliminated all coefficients
  warnings.warn(
/nas/longleaf/home/djpassey/.local/lib/python3.9/site-packages/pysindy/optimizers/stlsq.py:201: UserWarning: Sparsity parameter is too big (0.1) and eliminated all coefficients
  warnings.warn(
/nas/longleaf/home/djpassey/.local/lib/python3.9/site-packages/pysindy/optimizers/stlsq.py:201: UserWarning: Sparsity parameter is too big (0.1) and eliminated all coefficients
  warnings.warn(
/nas/longleaf/home/djpassey/.local/lib/python3.9/site-packages/pysindy/optimizers/stlsq.py:201: UserWarning: Sparsity parameter is too big (0.1) and eliminated all coefficients
  warnings.warn(
slurmstepd: error: *** JOB 49491719 ON c1139 CANCELLED AT 2024-09-26T11:27:54 DUE TO TIME LIMIT ***
