[I 2024-09-25 06:52:43,467] Trial 24 finished with values: [1.0, 0.8418774205625205, 1.0, 50.0, 0.6053047542291452, 1.0, 50.0, 0.5740120186406674, 1.0] and parameters: {'seq_len': 2, 'lr': 0.0674553159276231, 'pred_len': 25, 'num_epochs': 100}. 
SLURM auto-requeueing enabled. Setting signal handlers.
SLURM auto-requeueing enabled. Setting signal handlers.
SLURM auto-requeueing enabled. Setting signal handlers.
SLURM auto-requeueing enabled. Setting signal handlers.
SLURM auto-requeueing enabled. Setting signal handlers.
SLURM auto-requeueing enabled. Setting signal handlers.
SLURM auto-requeueing enabled. Setting signal handlers.
SLURM auto-requeueing enabled. Setting signal handlers.
SLURM auto-requeueing enabled. Setting signal handlers.
SLURM auto-requeueing enabled. Setting signal handlers.
SLURM auto-requeueing enabled. Setting signal handlers.
SLURM auto-requeueing enabled. Setting signal handlers.
SLURM auto-requeueing enabled. Setting signal handlers.
SLURM auto-requeueing enabled. Setting signal handlers.
SLURM auto-requeueing enabled. Setting signal handlers.
SLURM auto-requeueing enabled. Setting signal handlers.
SLURM auto-requeueing enabled. Setting signal handlers.
SLURM auto-requeueing enabled. Setting signal handlers.
SLURM auto-requeueing enabled. Setting signal handlers.
SLURM auto-requeueing enabled. Setting signal handlers.
SLURM auto-requeueing enabled. Setting signal handlers.
SLURM auto-requeueing enabled. Setting signal handlers.
SLURM auto-requeueing enabled. Setting signal handlers.
SLURM auto-requeueing enabled. Setting signal handlers.
SLURM auto-requeueing enabled. Setting signal handlers.
SLURM auto-requeueing enabled. Setting signal handlers.
SLURM auto-requeueing enabled. Setting signal handlers.
SLURM auto-requeueing enabled. Setting signal handlers.
SLURM auto-requeueing enabled. Setting signal handlers.
SLURM auto-requeueing enabled. Setting signal handlers.
SLURM auto-requeueing enabled. Setting signal handlers.
SLURM auto-requeueing enabled. Setting signal handlers.
SLURM auto-requeueing enabled. Setting signal handlers.
SLURM auto-requeueing enabled. Setting signal handlers.
SLURM auto-requeueing enabled. Setting signal handlers.
SLURM auto-requeueing enabled. Setting signal handlers.
SLURM auto-requeueing enabled. Setting signal handlers.
SLURM auto-requeueing enabled. Setting signal handlers.
SLURM auto-requeueing enabled. Setting signal handlers.
SLURM auto-requeueing enabled. Setting signal handlers.
SLURM auto-requeueing enabled. Setting signal handlers.
SLURM auto-requeueing enabled. Setting signal handlers.
SLURM auto-requeueing enabled. Setting signal handlers.
SLURM auto-requeueing enabled. Setting signal handlers.
SLURM auto-requeueing enabled. Setting signal handlers.
SLURM auto-requeueing enabled. Setting signal handlers.
SLURM auto-requeueing enabled. Setting signal handlers.
SLURM auto-requeueing enabled. Setting signal handlers.
SLURM auto-requeueing enabled. Setting signal handlers.
SLURM auto-requeueing enabled. Setting signal handlers.
SLURM auto-requeueing enabled. Setting signal handlers.
SLURM auto-requeueing enabled. Setting signal handlers.
SLURM auto-requeueing enabled. Setting signal handlers.
SLURM auto-requeueing enabled. Setting signal handlers.
SLURM auto-requeueing enabled. Setting signal handlers.
SLURM auto-requeueing enabled. Setting signal handlers.
SLURM auto-requeueing enabled. Setting signal handlers.
SLURM auto-requeueing enabled. Setting signal handlers.
SLURM auto-requeueing enabled. Setting signal handlers.
SLURM auto-requeueing enabled. Setting signal handlers.
SLURM auto-requeueing enabled. Setting signal handlers.
SLURM auto-requeueing enabled. Setting signal handlers.
SLURM auto-requeueing enabled. Setting signal handlers.
SLURM auto-requeueing enabled. Setting signal handlers.
SLURM auto-requeueing enabled. Setting signal handlers.
SLURM auto-requeueing enabled. Setting signal handlers.
SLURM auto-requeueing enabled. Setting signal handlers.
SLURM auto-requeueing enabled. Setting signal handlers.
SLURM auto-requeueing enabled. Setting signal handlers.
SLURM auto-requeueing enabled. Setting signal handlers.
SLURM auto-requeueing enabled. Setting signal handlers.
SLURM auto-requeueing enabled. Setting signal handlers.
SLURM auto-requeueing enabled. Setting signal handlers.
SLURM auto-requeueing enabled. Setting signal handlers.
SLURM auto-requeueing enabled. Setting signal handlers.
SLURM auto-requeueing enabled. Setting signal handlers.
SLURM auto-requeueing enabled. Setting signal handlers.
SLURM auto-requeueing enabled. Setting signal handlers.
SLURM auto-requeueing enabled. Setting signal handlers.
SLURM auto-requeueing enabled. Setting signal handlers.
SLURM auto-requeueing enabled. Setting signal handlers.
SLURM auto-requeueing enabled. Setting signal handlers.
SLURM auto-requeueing enabled. Setting signal handlers.
SLURM auto-requeueing enabled. Setting signal handlers.
SLURM auto-requeueing enabled. Setting signal handlers.
SLURM auto-requeueing enabled. Setting signal handlers.
SLURM auto-requeueing enabled. Setting signal handlers.
SLURM auto-requeueing enabled. Setting signal handlers.
SLURM auto-requeueing enabled. Setting signal handlers.
SLURM auto-requeueing enabled. Setting signal handlers.
SLURM auto-requeueing enabled. Setting signal handlers.
SLURM auto-requeueing enabled. Setting signal handlers.
SLURM auto-requeueing enabled. Setting signal handlers.
SLURM auto-requeueing enabled. Setting signal handlers.
SLURM auto-requeueing enabled. Setting signal handlers.
SLURM auto-requeueing enabled. Setting signal handlers.
SLURM auto-requeueing enabled. Setting signal handlers.
SLURM auto-requeueing enabled. Setting signal handlers.
SLURM auto-requeueing enabled. Setting signal handlers.
SLURM auto-requeueing enabled. Setting signal handlers.
SLURM auto-requeueing enabled. Setting signal handlers.
SLURM auto-requeueing enabled. Setting signal handlers.
SLURM auto-requeueing enabled. Setting signal handlers.
SLURM auto-requeueing enabled. Setting signal handlers.
SLURM auto-requeueing enabled. Setting signal handlers.
SLURM auto-requeueing enabled. Setting signal handlers.
SLURM auto-requeueing enabled. Setting signal handlers.
SLURM auto-requeueing enabled. Setting signal handlers.
SLURM auto-requeueing enabled. Setting signal handlers.
SLURM auto-requeueing enabled. Setting signal handlers.
SLURM auto-requeueing enabled. Setting signal handlers.
SLURM auto-requeueing enabled. Setting signal handlers.
SLURM auto-requeueing enabled. Setting signal handlers.
SLURM auto-requeueing enabled. Setting signal handlers.
SLURM auto-requeueing enabled. Setting signal handlers.
SLURM auto-requeueing enabled. Setting signal handlers.
SLURM auto-requeueing enabled. Setting signal handlers.
SLURM auto-requeueing enabled. Setting signal handlers.
SLURM auto-requeueing enabled. Setting signal handlers.
SLURM auto-requeueing enabled. Setting signal handlers.
SLURM auto-requeueing enabled. Setting signal handlers.
SLURM auto-requeueing enabled. Setting signal handlers.
SLURM auto-requeueing enabled. Setting signal handlers.
SLURM auto-requeueing enabled. Setting signal handlers.
SLURM auto-requeueing enabled. Setting signal handlers.
SLURM auto-requeueing enabled. Setting signal handlers.
SLURM auto-requeueing enabled. Setting signal handlers.
SLURM auto-requeueing enabled. Setting signal handlers.
SLURM auto-requeueing enabled. Setting signal handlers.
SLURM auto-requeueing enabled. Setting signal handlers.
SLURM auto-requeueing enabled. Setting signal handlers.
SLURM auto-requeueing enabled. Setting signal handlers.
SLURM auto-requeueing enabled. Setting signal handlers.
SLURM auto-requeueing enabled. Setting signal handlers.
SLURM auto-requeueing enabled. Setting signal handlers.
SLURM auto-requeueing enabled. Setting signal handlers.
SLURM auto-requeueing enabled. Setting signal handlers.
SLURM auto-requeueing enabled. Setting signal handlers.
SLURM auto-requeueing enabled. Setting signal handlers.
SLURM auto-requeueing enabled. Setting signal handlers.
SLURM auto-requeueing enabled. Setting signal handlers.
SLURM auto-requeueing enabled. Setting signal handlers.
SLURM auto-requeueing enabled. Setting signal handlers.
SLURM auto-requeueing enabled. Setting signal handlers.
SLURM auto-requeueing enabled. Setting signal handlers.
SLURM auto-requeueing enabled. Setting signal handlers.
SLURM auto-requeueing enabled. Setting signal handlers.
SLURM auto-requeueing enabled. Setting signal handlers.
SLURM auto-requeueing enabled. Setting signal handlers.
SLURM auto-requeueing enabled. Setting signal handlers.
SLURM auto-requeueing enabled. Setting signal handlers.
SLURM auto-requeueing enabled. Setting signal handlers.
SLURM auto-requeueing enabled. Setting signal handlers.
SLURM auto-requeueing enabled. Setting signal handlers.
SLURM auto-requeueing enabled. Setting signal handlers.
SLURM auto-requeueing enabled. Setting signal handlers.
SLURM auto-requeueing enabled. Setting signal handlers.
SLURM auto-requeueing enabled. Setting signal handlers.
SLURM auto-requeueing enabled. Setting signal handlers.
SLURM auto-requeueing enabled. Setting signal handlers.
SLURM auto-requeueing enabled. Setting signal handlers.
SLURM auto-requeueing enabled. Setting signal handlers.
SLURM auto-requeueing enabled. Setting signal handlers.
SLURM auto-requeueing enabled. Setting signal handlers.
SLURM auto-requeueing enabled. Setting signal handlers.
SLURM auto-requeueing enabled. Setting signal handlers.
SLURM auto-requeueing enabled. Setting signal handlers.
SLURM auto-requeueing enabled. Setting signal handlers.
SLURM auto-requeueing enabled. Setting signal handlers.
SLURM auto-requeueing enabled. Setting signal handlers.
SLURM auto-requeueing enabled. Setting signal handlers.
SLURM auto-requeueing enabled. Setting signal handlers.
SLURM auto-requeueing enabled. Setting signal handlers.
SLURM auto-requeueing enabled. Setting signal handlers.
SLURM auto-requeueing enabled. Setting signal handlers.
SLURM auto-requeueing enabled. Setting signal handlers.
SLURM auto-requeueing enabled. Setting signal handlers.
SLURM auto-requeueing enabled. Setting signal handlers.
SLURM auto-requeueing enabled. Setting signal handlers.
SLURM auto-requeueing enabled. Setting signal handlers.
SLURM auto-requeueing enabled. Setting signal handlers.
SLURM auto-requeueing enabled. Setting signal handlers.
SLURM auto-requeueing enabled. Setting signal handlers.
SLURM auto-requeueing enabled. Setting signal handlers.
SLURM auto-requeueing enabled. Setting signal handlers.
SLURM auto-requeueing enabled. Setting signal handlers.
SLURM auto-requeueing enabled. Setting signal handlers.
SLURM auto-requeueing enabled. Setting signal handlers.
SLURM auto-requeueing enabled. Setting signal handlers.
SLURM auto-requeueing enabled. Setting signal handlers.
SLURM auto-requeueing enabled. Setting signal handlers.
SLURM auto-requeueing enabled. Setting signal handlers.
SLURM auto-requeueing enabled. Setting signal handlers.
SLURM auto-requeueing enabled. Setting signal handlers.
SLURM auto-requeueing enabled. Setting signal handlers.
SLURM auto-requeueing enabled. Setting signal handlers.
SLURM auto-requeueing enabled. Setting signal handlers.
SLURM auto-requeueing enabled. Setting signal handlers.
SLURM auto-requeueing enabled. Setting signal handlers.
SLURM auto-requeueing enabled. Setting signal handlers.
SLURM auto-requeueing enabled. Setting signal handlers.
SLURM auto-requeueing enabled. Setting signal handlers.
SLURM auto-requeueing enabled. Setting signal handlers.
SLURM auto-requeueing enabled. Setting signal handlers.
SLURM auto-requeueing enabled. Setting signal handlers.
SLURM auto-requeueing enabled. Setting signal handlers.
SLURM auto-requeueing enabled. Setting signal handlers.
SLURM auto-requeueing enabled. Setting signal handlers.
SLURM auto-requeueing enabled. Setting signal handlers.
SLURM auto-requeueing enabled. Setting signal handlers.
SLURM auto-requeueing enabled. Setting signal handlers.
SLURM auto-requeueing enabled. Setting signal handlers.
SLURM auto-requeueing enabled. Setting signal handlers.
SLURM auto-requeueing enabled. Setting signal handlers.
SLURM auto-requeueing enabled. Setting signal handlers.
SLURM auto-requeueing enabled. Setting signal handlers.
SLURM auto-requeueing enabled. Setting signal handlers.
SLURM auto-requeueing enabled. Setting signal handlers.
SLURM auto-requeueing enabled. Setting signal handlers.
SLURM auto-requeueing enabled. Setting signal handlers.
SLURM auto-requeueing enabled. Setting signal handlers.
SLURM auto-requeueing enabled. Setting signal handlers.
SLURM auto-requeueing enabled. Setting signal handlers.
SLURM auto-requeueing enabled. Setting signal handlers.
SLURM auto-requeueing enabled. Setting signal handlers.
SLURM auto-requeueing enabled. Setting signal handlers.
SLURM auto-requeueing enabled. Setting signal handlers.
SLURM auto-requeueing enabled. Setting signal handlers.
SLURM auto-requeueing enabled. Setting signal handlers.
SLURM auto-requeueing enabled. Setting signal handlers.
SLURM auto-requeueing enabled. Setting signal handlers.
SLURM auto-requeueing enabled. Setting signal handlers.
SLURM auto-requeueing enabled. Setting signal handlers.
SLURM auto-requeueing enabled. Setting signal handlers.
SLURM auto-requeueing enabled. Setting signal handlers.
SLURM auto-requeueing enabled. Setting signal handlers.
SLURM auto-requeueing enabled. Setting signal handlers.
SLURM auto-requeueing enabled. Setting signal handlers.
SLURM auto-requeueing enabled. Setting signal handlers.
SLURM auto-requeueing enabled. Setting signal handlers.
SLURM auto-requeueing enabled. Setting signal handlers.
SLURM auto-requeueing enabled. Setting signal handlers.
SLURM auto-requeueing enabled. Setting signal handlers.
SLURM auto-requeueing enabled. Setting signal handlers.
SLURM auto-requeueing enabled. Setting signal handlers.
SLURM auto-requeueing enabled. Setting signal handlers.
SLURM auto-requeueing enabled. Setting signal handlers.
[I 2024-09-25 06:54:40,243] A new study created in memory with name: VAR predicting GenForecast[cml, NHITS]
[I 2024-09-25 06:54:45,805] Trial 0 finished with values: [1.0, 3.2870457927170493, 1.0, 50.0, 0.0005132389738850161, 1.0, 2.0, 1.5640813674144025, 0.5555555555555556] and parameters: {'ic': 'aic', 'maxlags': 3, 'trend': 'ctt'}. 
[I 2024-09-25 06:54:51,190] Trial 1 finished with values: [1.0, 5.866288700825703, 0.8, 50.0, 0.0002637716850811587, 1.0, 1.0, 150662208.50316933, 1.0] and parameters: {'ic': 'fpe', 'maxlags': 4, 'trend': 'n'}. 
[I 2024-09-25 06:54:56,564] Trial 2 finished with values: [1.0, 10.751271720726383, 1.0, 50.0, 0.0001530432925307513, 1.0, 1.0, 3739958775.1907816, 0.0] and parameters: {'ic': 'fpe', 'maxlags': 5, 'trend': 'c'}. 
[I 2024-09-25 06:55:02,389] Trial 3 finished with values: [1.0, 7.495779191224463, 0.6, 50.0, 0.00019906059756943866, 1.0, 1.0, 3384981555.700632, 0.0] and parameters: {'ic': 'aic', 'maxlags': 5, 'trend': 'n'}. 
[I 2024-09-25 06:55:07,895] Trial 4 finished with values: [1.0, 11.83861393028627, 1.0, 50.0, 0.0002554891951407516, 1.0, 2.0, 1171623016.5779574, 1.0] and parameters: {'ic': 'fpe', 'maxlags': 4, 'trend': 'ct'}. 
[I 2024-09-25 06:55:13,164] Trial 5 finished with values: [1.0, 12.878886132449882, 1.0, 50.0, 0.00014797579234932548, 1.0, 1.0, 3659471295.9585977, 0.0] and parameters: {'ic': 'fpe', 'maxlags': 5, 'trend': 'ctt'}. 
[I 2024-09-25 06:55:18,292] Trial 6 finished with values: [1.0, 11.83861393028627, 1.0, 50.0, 0.0002554891951407516, 1.0, 2.0, 1171623016.5779574, 1.0] and parameters: {'ic': 'aic', 'maxlags': 4, 'trend': 'ct'}. 
[I 2024-09-25 06:55:23,501] Trial 7 finished with values: [1.0, 11.83861393028627, 1.0, 50.0, 0.0002554891951407516, 1.0, 2.0, 1171623016.5779574, 1.0] and parameters: {'ic': 'aic', 'maxlags': 4, 'trend': 'ct'}. 
[I 2024-09-25 06:55:28,552] Trial 8 finished with values: [1.0, 2.774520806331992, 1.0, 50.0, 0.0007332302128930606, 1.0, 2.0, 1.458988570192612, 0.4444444444444444] and parameters: {'ic': 'aic', 'maxlags': 3, 'trend': 'c'}. 
[I 2024-09-25 06:55:34,093] Trial 9 finished with values: [1.0, 0.9673563832600324, 1.0, 50.0, 0.0031150849688781775, 1.0, 1.0, 3.1681029899403645, 0.2222222222222222] and parameters: {'ic': 'aic', 'maxlags': 2, 'trend': 'c'}. 
[I 2024-09-25 06:55:39,190] Trial 10 finished with values: [1.0, 10.751271720726383, 1.0, 50.0, 0.0001530432925307513, 1.0, 1.0, 3739958775.1907816, 0.0] and parameters: {'ic': 'fpe', 'maxlags': 5, 'trend': 'c'}. 
[I 2024-09-25 06:55:44,296] Trial 11 finished with values: [1.0, 11.83861393028627, 1.0, 50.0, 0.0002554891951407516, 1.0, 2.0, 1171623016.5779574, 1.0] and parameters: {'ic': 'fpe', 'maxlags': 4, 'trend': 'ct'}. 
[I 2024-09-25 06:55:49,492] Trial 12 finished with values: [150.0, 0.08154477878290442, 1.0, 50.0, 0.025328267852015026, 1.0, 2.0, 8488.777930968045, 1.0] and parameters: {'ic': 'aic', 'maxlags': 1, 'trend': 'ct'}. 
[I 2024-09-25 06:55:54,610] Trial 13 finished with values: [1.0, 12.878886132449882, 1.0, 50.0, 0.00014797579234932548, 1.0, 1.0, 3659471295.9585977, 0.0] and parameters: {'ic': 'fpe', 'maxlags': 5, 'trend': 'ctt'}. 
[I 2024-09-25 06:55:59,781] Trial 14 finished with values: [1.0, 12.878886132449882, 1.0, 50.0, 0.00014797579234932548, 1.0, 1.0, 3659471295.9585977, 0.0] and parameters: {'ic': 'aic', 'maxlags': 5, 'trend': 'ctt'}. 
[I 2024-09-25 06:56:04,954] Trial 15 finished with values: [1.0, 3.274379742024924, 1.0, 50.0, 0.0005214729463559932, 1.0, 2.0, 1.4965598993582305, 0.5555555555555556] and parameters: {'ic': 'fpe', 'maxlags': 3, 'trend': 'ct'}. 
[I 2024-09-25 06:56:10,353] Trial 16 finished with values: [150.0, 0.1002374601599584, 1.0, 50.0, 0.027715771826242765, 1.0, 2.0, 165472.28374114673, 0.0] and parameters: {'ic': 'fpe', 'maxlags': 1, 'trend': 'n'}. 
[I 2024-09-25 06:56:15,747] Trial 17 finished with values: [1.0, 0.9263303979144001, 0.0, 50.0, 0.0034685813175554473, 1.0, 1.0, 2.5553413647612886, 0.0] and parameters: {'ic': 'aic', 'maxlags': 2, 'trend': 'n'}. 
[I 2024-09-25 06:56:20,834] Trial 18 finished with values: [1.0, 12.878886132449882, 1.0, 50.0, 0.00014797579234932548, 1.0, 1.0, 3659471295.9585977, 0.0] and parameters: {'ic': 'fpe', 'maxlags': 5, 'trend': 'ctt'}. 
[I 2024-09-25 06:56:25,923] Trial 19 finished with values: [1.0, 5.866288700825703, 0.8, 50.0, 0.0002637716850811587, 1.0, 1.0, 150662208.50316933, 1.0] and parameters: {'ic': 'aic', 'maxlags': 4, 'trend': 'n'}. 
[I 2024-09-25 06:56:30,994] Trial 20 finished with values: [1.0, 12.413114648546772, 1.0, 50.0, 0.0002568982816200548, 1.0, 2.0, 1156194639.057262, 1.0] and parameters: {'ic': 'fpe', 'maxlags': 4, 'trend': 'c'}. 
[I 2024-09-25 06:56:36,406] Trial 21 finished with values: [1.0, 1.5328911919727448, 0.9, 50.0, 0.0008450477423241786, 1.0, 2.0, 2.2110227457813414, 0.0] and parameters: {'ic': 'aic', 'maxlags': 3, 'trend': 'n'}. 
[I 2024-09-25 06:56:41,914] Trial 22 finished with values: [1.0, 0.9789601554761387, 1.0, 50.0, 0.003346987874041305, 1.0, 1.0, 3.0138096169481967, 0.2222222222222222] and parameters: {'ic': 'aic', 'maxlags': 2, 'trend': 'ct'}. 
[I 2024-09-25 06:56:47,055] Trial 23 finished with values: [1.0, 0.9789601554761387, 1.0, 50.0, 0.003346987874041305, 1.0, 1.0, 3.0138096169481967, 0.2222222222222222] and parameters: {'ic': 'aic', 'maxlags': 2, 'trend': 'ct'}. 
