[I 2024-09-25 12:40:09,944] Trial 24 finished with values: [1.0, 1.1391439508779515, 1.0, 50.0, 0.3315316029379733, 1.0, 50.0, 0.5322509151855506, 0.8888888888888888] and parameters: {'h': 12, 'n_pool_kernel_size': [4, 4, 4], 'n_freq_downsample': [60, 8, 1], 'learning_rate': 0.00030475973076303926, 'scaler_type': None, 'max_steps': 1300.0, 'batch_size': 64, 'windows_batch_size': 256, 'random_seed': 18}. 
SLURM auto-requeueing enabled. Setting signal handlers.
SLURM auto-requeueing enabled. Setting signal handlers.
SLURM auto-requeueing enabled. Setting signal handlers.
SLURM auto-requeueing enabled. Setting signal handlers.
SLURM auto-requeueing enabled. Setting signal handlers.
SLURM auto-requeueing enabled. Setting signal handlers.
SLURM auto-requeueing enabled. Setting signal handlers.
SLURM auto-requeueing enabled. Setting signal handlers.
SLURM auto-requeueing enabled. Setting signal handlers.
SLURM auto-requeueing enabled. Setting signal handlers.
SLURM auto-requeueing enabled. Setting signal handlers.
SLURM auto-requeueing enabled. Setting signal handlers.
SLURM auto-requeueing enabled. Setting signal handlers.
SLURM auto-requeueing enabled. Setting signal handlers.
SLURM auto-requeueing enabled. Setting signal handlers.
SLURM auto-requeueing enabled. Setting signal handlers.
SLURM auto-requeueing enabled. Setting signal handlers.
SLURM auto-requeueing enabled. Setting signal handlers.
SLURM auto-requeueing enabled. Setting signal handlers.
SLURM auto-requeueing enabled. Setting signal handlers.
SLURM auto-requeueing enabled. Setting signal handlers.
SLURM auto-requeueing enabled. Setting signal handlers.
SLURM auto-requeueing enabled. Setting signal handlers.
SLURM auto-requeueing enabled. Setting signal handlers.
SLURM auto-requeueing enabled. Setting signal handlers.
SLURM auto-requeueing enabled. Setting signal handlers.
SLURM auto-requeueing enabled. Setting signal handlers.
SLURM auto-requeueing enabled. Setting signal handlers.
SLURM auto-requeueing enabled. Setting signal handlers.
SLURM auto-requeueing enabled. Setting signal handlers.
SLURM auto-requeueing enabled. Setting signal handlers.
SLURM auto-requeueing enabled. Setting signal handlers.
SLURM auto-requeueing enabled. Setting signal handlers.
SLURM auto-requeueing enabled. Setting signal handlers.
SLURM auto-requeueing enabled. Setting signal handlers.
SLURM auto-requeueing enabled. Setting signal handlers.
SLURM auto-requeueing enabled. Setting signal handlers.
SLURM auto-requeueing enabled. Setting signal handlers.
SLURM auto-requeueing enabled. Setting signal handlers.
SLURM auto-requeueing enabled. Setting signal handlers.
SLURM auto-requeueing enabled. Setting signal handlers.
SLURM auto-requeueing enabled. Setting signal handlers.
SLURM auto-requeueing enabled. Setting signal handlers.
SLURM auto-requeueing enabled. Setting signal handlers.
SLURM auto-requeueing enabled. Setting signal handlers.
SLURM auto-requeueing enabled. Setting signal handlers.
SLURM auto-requeueing enabled. Setting signal handlers.
SLURM auto-requeueing enabled. Setting signal handlers.
SLURM auto-requeueing enabled. Setting signal handlers.
SLURM auto-requeueing enabled. Setting signal handlers.
SLURM auto-requeueing enabled. Setting signal handlers.
SLURM auto-requeueing enabled. Setting signal handlers.
SLURM auto-requeueing enabled. Setting signal handlers.
SLURM auto-requeueing enabled. Setting signal handlers.
SLURM auto-requeueing enabled. Setting signal handlers.
SLURM auto-requeueing enabled. Setting signal handlers.
SLURM auto-requeueing enabled. Setting signal handlers.
SLURM auto-requeueing enabled. Setting signal handlers.
SLURM auto-requeueing enabled. Setting signal handlers.
SLURM auto-requeueing enabled. Setting signal handlers.
SLURM auto-requeueing enabled. Setting signal handlers.
SLURM auto-requeueing enabled. Setting signal handlers.
SLURM auto-requeueing enabled. Setting signal handlers.
SLURM auto-requeueing enabled. Setting signal handlers.
SLURM auto-requeueing enabled. Setting signal handlers.
SLURM auto-requeueing enabled. Setting signal handlers.
SLURM auto-requeueing enabled. Setting signal handlers.
SLURM auto-requeueing enabled. Setting signal handlers.
SLURM auto-requeueing enabled. Setting signal handlers.
SLURM auto-requeueing enabled. Setting signal handlers.
SLURM auto-requeueing enabled. Setting signal handlers.
SLURM auto-requeueing enabled. Setting signal handlers.
SLURM auto-requeueing enabled. Setting signal handlers.
SLURM auto-requeueing enabled. Setting signal handlers.
SLURM auto-requeueing enabled. Setting signal handlers.
SLURM auto-requeueing enabled. Setting signal handlers.
SLURM auto-requeueing enabled. Setting signal handlers.
SLURM auto-requeueing enabled. Setting signal handlers.
SLURM auto-requeueing enabled. Setting signal handlers.
SLURM auto-requeueing enabled. Setting signal handlers.
SLURM auto-requeueing enabled. Setting signal handlers.
SLURM auto-requeueing enabled. Setting signal handlers.
SLURM auto-requeueing enabled. Setting signal handlers.
SLURM auto-requeueing enabled. Setting signal handlers.
SLURM auto-requeueing enabled. Setting signal handlers.
SLURM auto-requeueing enabled. Setting signal handlers.
SLURM auto-requeueing enabled. Setting signal handlers.
SLURM auto-requeueing enabled. Setting signal handlers.
SLURM auto-requeueing enabled. Setting signal handlers.
SLURM auto-requeueing enabled. Setting signal handlers.
SLURM auto-requeueing enabled. Setting signal handlers.
SLURM auto-requeueing enabled. Setting signal handlers.
SLURM auto-requeueing enabled. Setting signal handlers.
SLURM auto-requeueing enabled. Setting signal handlers.
SLURM auto-requeueing enabled. Setting signal handlers.
SLURM auto-requeueing enabled. Setting signal handlers.
SLURM auto-requeueing enabled. Setting signal handlers.
SLURM auto-requeueing enabled. Setting signal handlers.
SLURM auto-requeueing enabled. Setting signal handlers.
SLURM auto-requeueing enabled. Setting signal handlers.
SLURM auto-requeueing enabled. Setting signal handlers.
SLURM auto-requeueing enabled. Setting signal handlers.
SLURM auto-requeueing enabled. Setting signal handlers.
SLURM auto-requeueing enabled. Setting signal handlers.
SLURM auto-requeueing enabled. Setting signal handlers.
SLURM auto-requeueing enabled. Setting signal handlers.
SLURM auto-requeueing enabled. Setting signal handlers.
SLURM auto-requeueing enabled. Setting signal handlers.
SLURM auto-requeueing enabled. Setting signal handlers.
SLURM auto-requeueing enabled. Setting signal handlers.
SLURM auto-requeueing enabled. Setting signal handlers.
SLURM auto-requeueing enabled. Setting signal handlers.
SLURM auto-requeueing enabled. Setting signal handlers.
SLURM auto-requeueing enabled. Setting signal handlers.
SLURM auto-requeueing enabled. Setting signal handlers.
SLURM auto-requeueing enabled. Setting signal handlers.
SLURM auto-requeueing enabled. Setting signal handlers.
SLURM auto-requeueing enabled. Setting signal handlers.
SLURM auto-requeueing enabled. Setting signal handlers.
SLURM auto-requeueing enabled. Setting signal handlers.
SLURM auto-requeueing enabled. Setting signal handlers.
SLURM auto-requeueing enabled. Setting signal handlers.
SLURM auto-requeueing enabled. Setting signal handlers.
SLURM auto-requeueing enabled. Setting signal handlers.
SLURM auto-requeueing enabled. Setting signal handlers.
SLURM auto-requeueing enabled. Setting signal handlers.
SLURM auto-requeueing enabled. Setting signal handlers.
SLURM auto-requeueing enabled. Setting signal handlers.
SLURM auto-requeueing enabled. Setting signal handlers.
SLURM auto-requeueing enabled. Setting signal handlers.
SLURM auto-requeueing enabled. Setting signal handlers.
SLURM auto-requeueing enabled. Setting signal handlers.
SLURM auto-requeueing enabled. Setting signal handlers.
SLURM auto-requeueing enabled. Setting signal handlers.
SLURM auto-requeueing enabled. Setting signal handlers.
SLURM auto-requeueing enabled. Setting signal handlers.
SLURM auto-requeueing enabled. Setting signal handlers.
SLURM auto-requeueing enabled. Setting signal handlers.
SLURM auto-requeueing enabled. Setting signal handlers.
SLURM auto-requeueing enabled. Setting signal handlers.
SLURM auto-requeueing enabled. Setting signal handlers.
SLURM auto-requeueing enabled. Setting signal handlers.
SLURM auto-requeueing enabled. Setting signal handlers.
SLURM auto-requeueing enabled. Setting signal handlers.
SLURM auto-requeueing enabled. Setting signal handlers.
SLURM auto-requeueing enabled. Setting signal handlers.
SLURM auto-requeueing enabled. Setting signal handlers.
SLURM auto-requeueing enabled. Setting signal handlers.
SLURM auto-requeueing enabled. Setting signal handlers.
SLURM auto-requeueing enabled. Setting signal handlers.
SLURM auto-requeueing enabled. Setting signal handlers.
SLURM auto-requeueing enabled. Setting signal handlers.
SLURM auto-requeueing enabled. Setting signal handlers.
SLURM auto-requeueing enabled. Setting signal handlers.
SLURM auto-requeueing enabled. Setting signal handlers.
SLURM auto-requeueing enabled. Setting signal handlers.
SLURM auto-requeueing enabled. Setting signal handlers.
SLURM auto-requeueing enabled. Setting signal handlers.
SLURM auto-requeueing enabled. Setting signal handlers.
SLURM auto-requeueing enabled. Setting signal handlers.
SLURM auto-requeueing enabled. Setting signal handlers.
SLURM auto-requeueing enabled. Setting signal handlers.
SLURM auto-requeueing enabled. Setting signal handlers.
SLURM auto-requeueing enabled. Setting signal handlers.
SLURM auto-requeueing enabled. Setting signal handlers.
SLURM auto-requeueing enabled. Setting signal handlers.
SLURM auto-requeueing enabled. Setting signal handlers.
SLURM auto-requeueing enabled. Setting signal handlers.
SLURM auto-requeueing enabled. Setting signal handlers.
SLURM auto-requeueing enabled. Setting signal handlers.
SLURM auto-requeueing enabled. Setting signal handlers.
SLURM auto-requeueing enabled. Setting signal handlers.
SLURM auto-requeueing enabled. Setting signal handlers.
SLURM auto-requeueing enabled. Setting signal handlers.
SLURM auto-requeueing enabled. Setting signal handlers.
SLURM auto-requeueing enabled. Setting signal handlers.
SLURM auto-requeueing enabled. Setting signal handlers.
SLURM auto-requeueing enabled. Setting signal handlers.
SLURM auto-requeueing enabled. Setting signal handlers.
SLURM auto-requeueing enabled. Setting signal handlers.
SLURM auto-requeueing enabled. Setting signal handlers.
SLURM auto-requeueing enabled. Setting signal handlers.
SLURM auto-requeueing enabled. Setting signal handlers.
SLURM auto-requeueing enabled. Setting signal handlers.
SLURM auto-requeueing enabled. Setting signal handlers.
SLURM auto-requeueing enabled. Setting signal handlers.
SLURM auto-requeueing enabled. Setting signal handlers.
SLURM auto-requeueing enabled. Setting signal handlers.
SLURM auto-requeueing enabled. Setting signal handlers.
SLURM auto-requeueing enabled. Setting signal handlers.
SLURM auto-requeueing enabled. Setting signal handlers.
SLURM auto-requeueing enabled. Setting signal handlers.
SLURM auto-requeueing enabled. Setting signal handlers.
SLURM auto-requeueing enabled. Setting signal handlers.
SLURM auto-requeueing enabled. Setting signal handlers.
SLURM auto-requeueing enabled. Setting signal handlers.
SLURM auto-requeueing enabled. Setting signal handlers.
SLURM auto-requeueing enabled. Setting signal handlers.
SLURM auto-requeueing enabled. Setting signal handlers.
SLURM auto-requeueing enabled. Setting signal handlers.
SLURM auto-requeueing enabled. Setting signal handlers.
SLURM auto-requeueing enabled. Setting signal handlers.
SLURM auto-requeueing enabled. Setting signal handlers.
SLURM auto-requeueing enabled. Setting signal handlers.
SLURM auto-requeueing enabled. Setting signal handlers.
SLURM auto-requeueing enabled. Setting signal handlers.
SLURM auto-requeueing enabled. Setting signal handlers.
SLURM auto-requeueing enabled. Setting signal handlers.
SLURM auto-requeueing enabled. Setting signal handlers.
SLURM auto-requeueing enabled. Setting signal handlers.
SLURM auto-requeueing enabled. Setting signal handlers.
SLURM auto-requeueing enabled. Setting signal handlers.
SLURM auto-requeueing enabled. Setting signal handlers.
SLURM auto-requeueing enabled. Setting signal handlers.
SLURM auto-requeueing enabled. Setting signal handlers.
SLURM auto-requeueing enabled. Setting signal handlers.
SLURM auto-requeueing enabled. Setting signal handlers.
SLURM auto-requeueing enabled. Setting signal handlers.
SLURM auto-requeueing enabled. Setting signal handlers.
SLURM auto-requeueing enabled. Setting signal handlers.
SLURM auto-requeueing enabled. Setting signal handlers.
SLURM auto-requeueing enabled. Setting signal handlers.
SLURM auto-requeueing enabled. Setting signal handlers.
SLURM auto-requeueing enabled. Setting signal handlers.
SLURM auto-requeueing enabled. Setting signal handlers.
SLURM auto-requeueing enabled. Setting signal handlers.
SLURM auto-requeueing enabled. Setting signal handlers.
SLURM auto-requeueing enabled. Setting signal handlers.
SLURM auto-requeueing enabled. Setting signal handlers.
SLURM auto-requeueing enabled. Setting signal handlers.
SLURM auto-requeueing enabled. Setting signal handlers.
SLURM auto-requeueing enabled. Setting signal handlers.
SLURM auto-requeueing enabled. Setting signal handlers.
SLURM auto-requeueing enabled. Setting signal handlers.
SLURM auto-requeueing enabled. Setting signal handlers.
SLURM auto-requeueing enabled. Setting signal handlers.
SLURM auto-requeueing enabled. Setting signal handlers.
SLURM auto-requeueing enabled. Setting signal handlers.
SLURM auto-requeueing enabled. Setting signal handlers.
SLURM auto-requeueing enabled. Setting signal handlers.
SLURM auto-requeueing enabled. Setting signal handlers.
SLURM auto-requeueing enabled. Setting signal handlers.
SLURM auto-requeueing enabled. Setting signal handlers.
SLURM auto-requeueing enabled. Setting signal handlers.
SLURM auto-requeueing enabled. Setting signal handlers.
SLURM auto-requeueing enabled. Setting signal handlers.
SLURM auto-requeueing enabled. Setting signal handlers.
[I 2024-09-25 12:40:46,893] A new study created in memory with name: ResComp predicting GenForecast[cml, NHITS]
[I 2024-09-25 12:41:00,972] Trial 0 finished with values: [150.0, 1.2024039375998898, 0.0, 50.0, 1.2052861949168048, 0.0, 50.0, 1.2715259484602477, 0.0] and parameters: {'gamma': 141.7640071620978, 'sigma': 92.43298548653284, 'delta': 89.72528871252615, 'mean_degree': 2.001160854931483, 'res_sz': 32, 'window': 0.9964597144447079, 'spect_rad': 0.0013316326679500227, 'ridge_alpha': 9.199581949608387e-10}. 
[I 2024-09-25 12:41:14,457] Trial 1 finished with values: [1.0, 3.1736568124551265, 0.0, 1.0, 3.153305681216513, 0.0, 1.0, 1.7671660225138448, 0.1111111111111111] and parameters: {'gamma': 10.936487889716297, 'sigma': 45.77893021312867, 'delta': 63.24802436176043, 'mean_degree': 4.094739067160411, 'res_sz': 88, 'window': 0.0507488287385689, 'spect_rad': 48.207539331936985, 'ridge_alpha': 2.598722418311847e-05}. 
[I 2024-09-25 12:41:26,097] Trial 2 finished with values: [150.0, 1.0765723327942673, 0.4, 50.0, 1.1230827710907083, 0.0, 50.0, 0.9025612745150304, 0.6666666666666666] and parameters: {'gamma': 219.08810515384224, 'sigma': 41.033131253006744, 'delta': 37.75008537231461, 'mean_degree': 4.88271048973143, 'res_sz': 92, 'window': 0.00108068787496858, 'spect_rad': 8.45974720166237, 'ridge_alpha': 93.05596721399135}. 
[I 2024-09-25 12:41:39,511] Trial 3 finished with values: [1.0, 557.0019632226168, 1.0, 2.0, 1464921564.1464777, 1.0, 50.0, 1.199682610380248, 0.0] and parameters: {'gamma': 116.08174763120344, 'sigma': 75.44669989134036, 'delta': 84.30310960228734, 'mean_degree': 0.9304681771658959, 'res_sz': 51, 'window': 0.04666980557631535, 'spect_rad': 11.387737674246882, 'ridge_alpha': 1.129237913098526e-07}. 
[I 2024-09-25 12:41:53,179] Trial 4 finished with values: [1.0, 1.1628650420439643, 0.4, 1.0, 8.249112331151522, 0.0, 1.0, 3.3198302270838043, 0.0] and parameters: {'gamma': 42.89319201560503, 'sigma': 35.250684950336726, 'delta': 32.66726069182305, 'mean_degree': 1.1162310564977946, 'res_sz': 36, 'window': 8.334704188903808, 'spect_rad': 0.0659037160338059, 'ridge_alpha': 2.1166863068057353e-05}. 
[I 2024-09-25 12:42:07,158] Trial 5 finished with values: [1.0, 1.4625703182800467, 0.1, 50.0, 1.2064924061996092, 0.0, 0.0, 1.9089721649245008, 0.0] and parameters: {'gamma': 88.48875895675624, 'sigma': 39.46936119359499, 'delta': 87.78546817351994, 'mean_degree': 4.717238663782788, 'res_sz': 32, 'window': 79.2975586274879, 'spect_rad': 3.209474960956107, 'ridge_alpha': 0.002007127281853473}. 
[I 2024-09-25 12:42:20,566] Trial 6 finished with values: [1.0, 1.40546950079359, 0.2, 50.0, 1.007809823552823, 0.1, 0.0, 61.30076284531136, 0.0] and parameters: {'gamma': 393.1620968175212, 'sigma': 60.22991587578087, 'delta': 38.66560514800396, 'mean_degree': 1.635655252452503, 'res_sz': 29, 'window': 1.6412347354664556, 'spect_rad': 0.10320452952075307, 'ridge_alpha': 0.00016199992855714366}. 
[I 2024-09-25 12:42:32,541] Trial 7 finished with values: [1.0, 1.3078357756553165, 0.1, 50.0, 1.2649931822717404, 0.0, 50.0, 1.0038734307510604, 0.0] and parameters: {'gamma': 202.0196958634356, 'sigma': 65.20349915781502, 'delta': 31.89128566481597, 'mean_degree': 3.3625310089151177, 'res_sz': 11, 'window': 0.001969344265872062, 'spect_rad': 26.424214059020173, 'ridge_alpha': 8.258645333562084e-08}. 
[I 2024-09-25 12:42:46,126] Trial 8 finished with values: [1.0, 1.4015954964285433, 0.3, 1.0, 123.45098984755057, 0.1, 1.0, 1.3289189181410712, 0.1111111111111111] and parameters: {'gamma': 286.91094140066747, 'sigma': 98.25943369728428, 'delta': 93.93748910394218, 'mean_degree': 2.561222523661381, 'res_sz': 48, 'window': 0.0010804183100876555, 'spect_rad': 0.0018568873586137292, 'ridge_alpha': 2.2619167894162782e-10}. 
[I 2024-09-25 12:42:57,808] Trial 9 finished with values: [150.0, 1.2071494352726135, 0.0, 50.0, 1.207422375516605, 0.0, 0.0, 1.2979541519187896, 0.0] and parameters: {'gamma': 56.36462307529358, 'sigma': 36.49564128469659, 'delta': 71.27956011155639, 'mean_degree': 3.4478866678311197, 'res_sz': 34, 'window': 0.05616478654916251, 'spect_rad': 0.0034449357557074936, 'ridge_alpha': 0.004509352226207078}. 
[I 2024-09-25 12:43:08,825] Trial 10 finished with values: [2.0, 3.1704363660626376, 0.0, 2.0, 262027707.6202313, 1.0, 50.0, 1.188072105032936, 0.0] and parameters: {'gamma': 346.8399415192925, 'sigma': 10.232302787075511, 'delta': 74.4268217208288, 'mean_degree': 3.409465041391495, 'res_sz': 93, 'window': 0.03451672178832978, 'spect_rad': 0.045406806160274, 'ridge_alpha': 0.37331538571098005}. 
[I 2024-09-25 12:43:17,507] Trial 11 finished with values: [1.0, 1.3652315801820745, 0.0, 50.0, 1.2056335069951976, 0.0, 50.0, 1.1687254934036213, 0.0] and parameters: {'gamma': 317.25832252916604, 'sigma': 29.644183962555015, 'delta': 43.952800060303574, 'mean_degree': 4.929291704284603, 'res_sz': 12, 'window': 6.157441294281536, 'spect_rad': 0.3874782859088321, 'ridge_alpha': 0.9438201862751893}. 
[I 2024-09-25 12:43:29,154] Trial 12 finished with values: [1.0, 10109096.671051718, 1.0, 1.0, 3.5453529520553624, 0.0, 0.0, 154.96658839208908, 0.3333333333333333] and parameters: {'gamma': 148.00612664753234, 'sigma': 3.4646003894593833, 'delta': 76.90173861648954, 'mean_degree': 1.8680414181612752, 'res_sz': 63, 'window': 0.0035374722711687023, 'spect_rad': 0.027428902000076427, 'ridge_alpha': 8.896648523049035e-07}. 
[I 2024-09-25 12:43:40,576] Trial 13 finished with values: [150.0, 1.1825322971821675, 0.0, 50.0, 1.2052129860512988, 0.0, 50.0, 1.2046387296050973, 0.0] and parameters: {'gamma': 328.78065568639806, 'sigma': 62.117642239697666, 'delta': 3.558379715618684, 'mean_degree': 4.1916323091777645, 'res_sz': 78, 'window': 0.56185307451942, 'spect_rad': 0.02192866585564839, 'ridge_alpha': 0.08644284846320957}. 
[I 2024-09-25 12:43:46,487] Trial 14 finished with values: [0.0, 4614914868.91555, 0.0, 0.0, 4632488736.156722, 0.0, 0.0, 4620483375.650233, 0.0] and parameters: {'gamma': 230.56641064754112, 'sigma': 42.9441155113754, 'delta': 83.0062570167505, 'mean_degree': 1.094453887069251, 'res_sz': 80, 'window': 16.71260043416895, 'spect_rad': 3.031473174997299, 'ridge_alpha': 8.975221159298394e-08}. 
[I 2024-09-25 12:43:58,057] Trial 15 finished with values: [1.0, 48.254000255644804, 0.9, 50.0, 1.152840011926194, 0.0, 1.0, 4.91135117817785, 0.0] and parameters: {'gamma': 100.38385774082016, 'sigma': 17.726537857384233, 'delta': 89.16435975539828, 'mean_degree': 1.7173369284858673, 'res_sz': 15, 'window': 23.67804538205729, 'spect_rad': 0.636369656581266, 'ridge_alpha': 0.00035534656311047083}. 
[I 2024-09-25 12:44:09,583] Trial 16 finished with values: [1.0, 1.4075144404668578, 0.2, 50.0, 1.1992839592639202, 0.0, 1.0, 1.5686677683207704, 0.0] and parameters: {'gamma': 36.16325401767923, 'sigma': 22.459060625962344, 'delta': 6.923582745624568, 'mean_degree': 2.708457740897776, 'res_sz': 31, 'window': 13.784050965565447, 'spect_rad': 0.0016839221968030249, 'ridge_alpha': 3.449444712413495e-06}. 
[I 2024-09-25 12:44:20,635] Trial 17 finished with values: [2.0, 4568532637.774117, 0.0, 1.0, 4.191373869872003, 0.0, 1.0, 41.47735833764551, 1.0] and parameters: {'gamma': 417.25936600682104, 'sigma': 6.235812032021779, 'delta': 85.22698445627466, 'mean_degree': 2.136758225990632, 'res_sz': 86, 'window': 0.0013210027700964481, 'spect_rad': 0.812855528111833, 'ridge_alpha': 1.4277984464831365e-05}. 
