[I 2024-09-24 11:39:20,453] Trial 0 finished with values: [1.0, 1379.3165840427212, 0.0, 28.0, 9.741035129037483, 1.0, 50.0, 1.964849976039338, 1.0] and parameters: {'seq_len': 5, 'lr': 0.0007211257919341814, 'pred_len': 2, 'num_epochs': 50}. 
[I 2024-09-24 11:39:37,533] Trial 1 finished with values: [150.0, 0.668290100551078, 0.0, 50.0, 1.222426087006896, 0.2, 50.0, 1.9867227869449875, 1.0] and parameters: {'seq_len': 20, 'lr': 0.08024483120223418, 'pred_len': 8, 'num_epochs': 300}. 
[I 2024-09-24 11:39:53,468] Trial 2 finished with values: [150.0, 0.8986409168883963, 0.9, 50.0, 0.7617933749112953, 1.0, 50.0, 1.7023746833199211, 0.0] and parameters: {'seq_len': 23, 'lr': 1.8623317227788317e-05, 'pred_len': 22, 'num_epochs': 300}. 
[I 2024-09-24 11:40:03,576] Trial 3 finished with values: [150.0, 0.7373541786554411, 0.5, 50.0, 0.43793886036383595, 1.0, 50.0, 0.7739316568796972, 1.0] and parameters: {'seq_len': 22, 'lr': 0.0010327763048518072, 'pred_len': 6, 'num_epochs': 100}. 
[I 2024-09-24 11:40:13,436] Trial 4 finished with values: [150.0, 0.4563332943999678, 1.0, 50.0, 0.06628636858198692, 1.0, 50.0, 0.13650654121539366, 1.0] and parameters: {'seq_len': 24, 'lr': 0.002788601957238377, 'pred_len': 22, 'num_epochs': 100}. 
[I 2024-09-24 11:40:30,127] Trial 5 finished with values: [1.0, 1.1414391166090858, 0.9, 50.0, 1.327150743188943, 0.5, 50.0, 2.0108863654887545, 1.0] and parameters: {'seq_len': 10, 'lr': 3.578173242253614e-05, 'pred_len': 22, 'num_epochs': 300}. 
[I 2024-09-24 11:40:38,604] Trial 6 finished with values: [150.0, 1.6414649534204762, 0.0, 50.0, 3.5986484073508946, 0.0, 11.0, 5.232423369584749, 0.0] and parameters: {'seq_len': 3, 'lr': 3.6365977740830785e-05, 'pred_len': 10, 'num_epochs': 50}. 
[I 2024-09-24 11:40:55,825] Trial 7 finished with values: [5.0, 1.6677347980396702, 0.0, 50.0, 3.1592596891356517, 0.0, 50.0, 1.367133209134502, 1.0] and parameters: {'seq_len': 21, 'lr': 1.3671787931146095e-05, 'pred_len': 4, 'num_epochs': 300}. 
[I 2024-09-24 11:41:05,923] Trial 8 finished with values: [1.0, 0.790883677900806, 0.5, 50.0, 0.42222310328606816, 1.0, 50.0, 0.7922336434704116, 1.0] and parameters: {'seq_len': 15, 'lr': 0.004756845324814372, 'pred_len': 17, 'num_epochs': 100}. 
[I 2024-09-24 11:41:21,953] Trial 9 finished with values: [150.0, 0.4951988881430075, 1.0, 50.0, 0.06324580943111696, 1.0, 50.0, 0.08624623378044714, 1.0] and parameters: {'seq_len': 17, 'lr': 0.0012129394369194818, 'pred_len': 23, 'num_epochs': 300}. 
[I 2024-09-24 11:41:37,328] Trial 10 finished with values: [150.0, 0.8241872669240842, 1.0, 50.0, 0.5699475168968864, 1.0, 50.0, 0.7429052628556584, 1.0] and parameters: {'seq_len': 25, 'lr': 0.00015213757868090725, 'pred_len': 24, 'num_epochs': 300}. 
[I 2024-09-24 11:41:47,667] Trial 11 finished with values: [1.0, 1.1813147127640302, 0.9, 50.0, 1.4994628006072899, 0.2, 1.0, 7.903760191607129, 0.0] and parameters: {'seq_len': 4, 'lr': 7.505830819959138e-05, 'pred_len': 18, 'num_epochs': 100}. 
[I 2024-09-24 11:41:55,955] Trial 12 finished with values: [150.0, 0.6079047325829591, 0.3, 50.0, 0.07867694492059224, 1.0, 50.0, 0.20888275009231613, 1.0] and parameters: {'seq_len': 23, 'lr': 0.002504571938619604, 'pred_len': 17, 'num_epochs': 50}. 
[I 2024-09-24 11:42:04,225] Trial 13 finished with values: [21.0, 2.092933482979094, 0.0, 50.0, 4.077755209170222, 0.0, 1.0, 10.595220647052075, 0.0] and parameters: {'seq_len': 17, 'lr': 4.335081844332559e-05, 'pred_len': 23, 'num_epochs': 50}. 
[I 2024-09-24 11:42:13,160] Trial 14 finished with values: [1.0, 1.247641214679501, 0.0, 50.0, 2.054705879043249, 0.0, 50.0, 1.1558232884219077, 1.0] and parameters: {'seq_len': 10, 'lr': 9.681666427659817e-05, 'pred_len': 7, 'num_epochs': 50}. 
[I 2024-09-24 11:42:29,874] Trial 15 finished with values: [1.0, 1.1015007501925207, 0.5, 50.0, 0.9327839268190583, 1.0, 50.0, 0.8871824624446799, 1.0] and parameters: {'seq_len': 10, 'lr': 6.44936969533306e-05, 'pred_len': 23, 'num_epochs': 300}. 
[I 2024-09-24 11:42:40,236] Trial 16 finished with values: [150.0, 0.3269688895092595, 1.0, 50.0, 0.01919006689023644, 1.0, 50.0, 0.18544716775670128, 1.0] and parameters: {'seq_len': 20, 'lr': 0.008897894339796172, 'pred_len': 10, 'num_epochs': 100}. 
[I 2024-09-24 11:42:56,631] Trial 17 finished with values: [5.0, 1.0229770747573363, 0.7, 50.0, 0.5408521879408666, 1.0, 50.0, 0.8709273361028209, 1.0] and parameters: {'seq_len': 21, 'lr': 9.858720758019042e-05, 'pred_len': 22, 'num_epochs': 300}. 
[I 2024-09-24 11:43:05,490] Trial 18 finished with values: [150.0, 0.7395105097496406, 0.4, 50.0, 0.10671920958521643, 1.0, 50.0, 0.14128366436118386, 1.0] and parameters: {'seq_len': 20, 'lr': 0.009609233699324425, 'pred_len': 25, 'num_epochs': 50}. 
[I 2024-09-24 11:43:14,013] Trial 19 finished with values: [1.0, 1.7685553427002016, 0.0, 50.0, 1.153700523165862, 1.0, 50.0, 0.2543976666066572, 1.0] and parameters: {'seq_len': 13, 'lr': 0.058731302588332944, 'pred_len': 10, 'num_epochs': 50}. 
[I 2024-09-24 11:43:23,006] Trial 20 finished with values: [1.0, 4.869589889005068, 0.0, 1.0, 9.686227257956743, 0.0, 50.0, 2.818196587314462, 0.0] and parameters: {'seq_len': 1, 'lr': 1.9987971752603176e-05, 'pred_len': 5, 'num_epochs': 50}. 
[I 2024-09-24 11:43:34,219] Trial 21 finished with values: [1.0, 1.173315175283852, 0.6, 50.0, 1.2387997717161476, 0.7, 50.0, 1.0259459965628182, 1.0] and parameters: {'seq_len': 6, 'lr': 0.0025996522692965807, 'pred_len': 23, 'num_epochs': 100}. 
[I 2024-09-24 11:43:51,560] Trial 22 finished with values: [1.0, 1.1680337054473806, 1.0, 50.0, 1.6359835623016277, 0.0, 50.0, 1.5896663114883607, 0.1111111111111111] and parameters: {'seq_len': 2, 'lr': 0.005835986587847165, 'pred_len': 22, 'num_epochs': 300}. 
[I 2024-09-24 11:44:00,137] Trial 23 finished with values: [150.0, 0.4787665448215109, 1.0, 50.0, 0.053621662683431895, 1.0, 50.0, 0.117484231900378, 1.0] and parameters: {'seq_len': 23, 'lr': 0.07022841260503083, 'pred_len': 22, 'num_epochs': 50}. 
[I 2024-09-24 11:44:17,491] Trial 24 finished with values: [1.0, 1.1693163332922951, 1.0, 50.0, 1.6942120947282482, 0.0, 50.0, 1.6119066090097671, 0.0] and parameters: {'seq_len': 2, 'lr': 0.0006009578095129053, 'pred_len': 18, 'num_epochs': 300}. 
[I 2024-09-24 11:44:21,279] A new study created in memory with name: VAR predicting GenForecast[cml, LTSFLinearForecaster]
[I 2024-09-24 11:44:26,678] Trial 0 finished with values: [150.0, 1.8839418495154767, 0.0, 50.0, 1.0533728218150475, 1.0, 2.0, 54.99340953954261, 0.0] and parameters: {'ic': 'aic', 'maxlags': 1, 'trend': 'n'}. 
[I 2024-09-24 11:44:31,963] Trial 1 finished with values: [1.0, 1.3721874741399975, 1.0, 50.0, 0.208602849930175, 1.0, 1.0, 10388082536.852388, 1.0] and parameters: {'ic': 'fpe', 'maxlags': 5, 'trend': 'ctt'}. 
[I 2024-09-24 11:44:37,203] Trial 2 finished with values: [150.0, 0.5950521987464419, 1.0, 50.0, 0.10412876888240585, 1.0, 1.0, 10388080376.75233, 1.0] and parameters: {'ic': 'fpe', 'maxlags': 2, 'trend': 'c'}. 
[I 2024-09-24 11:44:42,529] Trial 3 finished with values: [150.0, 1.708510385784626, 0.0, 50.0, 0.2743145168164681, 1.0, 1.0, 10388113275.827795, 1.0] and parameters: {'ic': 'fpe', 'maxlags': 4, 'trend': 'n'}. 
[I 2024-09-24 11:44:47,690] Trial 4 finished with values: [5.0, 1.3203405299707793, 1.0, 50.0, 0.09455416419946436, 1.0, 1.0, 10388082592.646542, 1.0] and parameters: {'ic': 'fpe', 'maxlags': 5, 'trend': 'ct'}. 
[I 2024-09-24 11:44:52,730] Trial 5 finished with values: [5.0, 2.3099330415457753, 0.0, 50.0, 0.15083735803229348, 1.0, 1.0, 10388099500.64024, 1.0] and parameters: {'ic': 'fpe', 'maxlags': 5, 'trend': 'n'}. 
[I 2024-09-24 11:44:57,859] Trial 6 finished with values: [5.0, 1.3203405299707793, 1.0, 50.0, 0.09455416419946436, 1.0, 1.0, 10388082592.646542, 1.0] and parameters: {'ic': 'aic', 'maxlags': 5, 'trend': 'ct'}. 
[I 2024-09-24 11:45:03,015] Trial 7 finished with values: [5.0, 1.3074678041149839, 1.0, 50.0, 0.08502893577948675, 1.0, 1.0, 10388082222.249865, 1.0] and parameters: {'ic': 'aic', 'maxlags': 5, 'trend': 'c'}. 
[I 2024-09-24 11:45:08,468] Trial 8 finished with values: [150.0, 1.708510385784626, 0.0, 50.0, 0.2743145168164681, 1.0, 1.0, 10388113275.827795, 1.0] and parameters: {'ic': 'aic', 'maxlags': 4, 'trend': 'n'}. 
[I 2024-09-24 11:45:13,408] Trial 9 finished with values: [2.0, 3.140291311995956, 0.0, 50.0, 1.2031543799505136, 0.2, 1.0, 10388083112.078394, 1.0] and parameters: {'ic': 'fpe', 'maxlags': 2, 'trend': 'ctt'}. 
[I 2024-09-24 11:45:18,656] Trial 10 finished with values: [150.0, 0.6978038491812762, 1.0, 50.0, 0.10401563724436722, 1.0, 1.0, 10388079429.925556, 1.0] and parameters: {'ic': 'aic', 'maxlags': 2, 'trend': 'n'}. 
[I 2024-09-24 11:45:23,873] Trial 11 finished with values: [11.0, 3.095693862160133, 0.0, 50.0, 0.6518806763130517, 1.0, 1.0, 10388097032.81009, 1.0] and parameters: {'ic': 'fpe', 'maxlags': 3, 'trend': 'n'}. 
[I 2024-09-24 11:45:28,973] Trial 12 finished with values: [5.0, 1.3074678041149839, 1.0, 50.0, 0.08502893577948675, 1.0, 1.0, 10388082222.249865, 1.0] and parameters: {'ic': 'fpe', 'maxlags': 5, 'trend': 'c'}. 
[I 2024-09-24 11:45:34,178] Trial 13 finished with values: [150.0, 0.7578531693159796, 1.0, 50.0, 0.07921699977133652, 1.0, 1.0, 10388111068.789236, 1.0] and parameters: {'ic': 'aic', 'maxlags': 4, 'trend': 'ct'}. 
[I 2024-09-24 11:45:39,401] Trial 14 finished with values: [5.0, 1.3203405299707793, 1.0, 50.0, 0.09455416419946436, 1.0, 1.0, 10388082592.646542, 1.0] and parameters: {'ic': 'fpe', 'maxlags': 5, 'trend': 'ct'}. 
[I 2024-09-24 11:45:44,578] Trial 15 finished with values: [1.0, 1.3721874741399975, 1.0, 50.0, 0.208602849930175, 1.0, 1.0, 10388082536.852388, 1.0] and parameters: {'ic': 'fpe', 'maxlags': 5, 'trend': 'ctt'}. 
[I 2024-09-24 11:45:49,504] Trial 16 finished with values: [5.0, 1.3074678041149839, 1.0, 50.0, 0.08502893577948675, 1.0, 1.0, 10388082222.249865, 1.0] and parameters: {'ic': 'fpe', 'maxlags': 5, 'trend': 'c'}. 
[I 2024-09-24 11:45:54,806] Trial 17 finished with values: [150.0, 0.7578531693159796, 1.0, 50.0, 0.07921699977133652, 1.0, 1.0, 10388111068.789236, 1.0] and parameters: {'ic': 'fpe', 'maxlags': 4, 'trend': 'ct'}. 
[I 2024-09-24 11:46:00,021] Trial 18 finished with values: [150.0, 1.8839418495154767, 0.0, 50.0, 1.0533728218150475, 1.0, 2.0, 54.99340953954261, 0.0] and parameters: {'ic': 'fpe', 'maxlags': 1, 'trend': 'n'}. 
[I 2024-09-24 11:46:05,237] Trial 19 finished with values: [150.0, 0.5950521987464419, 1.0, 50.0, 0.10412876888240585, 1.0, 1.0, 10388080376.75233, 1.0] and parameters: {'ic': 'fpe', 'maxlags': 2, 'trend': 'c'}. 
[I 2024-09-24 11:46:10,472] Trial 20 finished with values: [150.0, 1.708510385784626, 0.0, 50.0, 0.2743145168164681, 1.0, 1.0, 10388113275.827795, 1.0] and parameters: {'ic': 'aic', 'maxlags': 4, 'trend': 'n'}. 
[I 2024-09-24 11:46:15,729] Trial 21 finished with values: [1.0, 1.3721874741399975, 1.0, 50.0, 0.208602849930175, 1.0, 1.0, 10388082536.852388, 1.0] and parameters: {'ic': 'aic', 'maxlags': 5, 'trend': 'ctt'}. 
[I 2024-09-24 11:46:20,938] Trial 22 finished with values: [143.0, 1.6098466136827028, 0.0, 50.0, 0.5999032769229322, 1.0, 1.0, 10388095070.211868, 1.0] and parameters: {'ic': 'aic', 'maxlags': 3, 'trend': 'ctt'}. 
[I 2024-09-24 11:46:26,191] Trial 23 finished with values: [150.0, 0.8687946330763658, 1.0, 50.0, 0.11491945121315544, 1.0, 1.0, 10388094886.674267, 1.0] and parameters: {'ic': 'fpe', 'maxlags': 3, 'trend': 'c'}. 
[I 2024-09-24 11:46:31,310] Trial 24 finished with values: [2.0, 3.140291311995956, 0.0, 50.0, 1.2031543799505136, 0.2, 1.0, 10388083112.078394, 1.0] and parameters: {'ic': 'fpe', 'maxlags': 2, 'trend': 'ctt'}. 
[I 2024-09-24 11:46:35,778] A new study created in memory with name: LSTM predicting GenForecast[cml, LTSFLinearForecaster]
SLURM auto-requeueing enabled. Setting signal handlers.
SLURM auto-requeueing enabled. Setting signal handlers.
SLURM auto-requeueing enabled. Setting signal handlers.
SLURM auto-requeueing enabled. Setting signal handlers.
SLURM auto-requeueing enabled. Setting signal handlers.
SLURM auto-requeueing enabled. Setting signal handlers.
SLURM auto-requeueing enabled. Setting signal handlers.
SLURM auto-requeueing enabled. Setting signal handlers.
SLURM auto-requeueing enabled. Setting signal handlers.
SLURM auto-requeueing enabled. Setting signal handlers.
SLURM auto-requeueing enabled. Setting signal handlers.
SLURM auto-requeueing enabled. Setting signal handlers.
SLURM auto-requeueing enabled. Setting signal handlers.
SLURM auto-requeueing enabled. Setting signal handlers.
SLURM auto-requeueing enabled. Setting signal handlers.
SLURM auto-requeueing enabled. Setting signal handlers.
SLURM auto-requeueing enabled. Setting signal handlers.
SLURM auto-requeueing enabled. Setting signal handlers.
SLURM auto-requeueing enabled. Setting signal handlers.
SLURM auto-requeueing enabled. Setting signal handlers.
SLURM auto-requeueing enabled. Setting signal handlers.
SLURM auto-requeueing enabled. Setting signal handlers.
SLURM auto-requeueing enabled. Setting signal handlers.
SLURM auto-requeueing enabled. Setting signal handlers.
SLURM auto-requeueing enabled. Setting signal handlers.
SLURM auto-requeueing enabled. Setting signal handlers.
[I 2024-09-24 11:50:40,764] Trial 0 finished with values: [1.0, 3.412970395277893, 0.0, 50.0, 0.1821740208276359, 1.0, 50.0, 1.5215687130144702, 0.1111111111111111] and parameters: {'h': 11, 'encoder_hidden_size': 100, 'encoder_n_layers': 2, 'context_size': 10, 'decoder_hidden_size': 512, 'learning_rate': 0.007328107828895694, 'max_steps': 1000, 'batch_size': 16, 'random_seed': 8}. 
SLURM auto-requeueing enabled. Setting signal handlers.
SLURM auto-requeueing enabled. Setting signal handlers.
SLURM auto-requeueing enabled. Setting signal handlers.
SLURM auto-requeueing enabled. Setting signal handlers.
SLURM auto-requeueing enabled. Setting signal handlers.
SLURM auto-requeueing enabled. Setting signal handlers.
SLURM auto-requeueing enabled. Setting signal handlers.
SLURM auto-requeueing enabled. Setting signal handlers.
SLURM auto-requeueing enabled. Setting signal handlers.
SLURM auto-requeueing enabled. Setting signal handlers.
SLURM auto-requeueing enabled. Setting signal handlers.
SLURM auto-requeueing enabled. Setting signal handlers.
SLURM auto-requeueing enabled. Setting signal handlers.
SLURM auto-requeueing enabled. Setting signal handlers.
SLURM auto-requeueing enabled. Setting signal handlers.
SLURM auto-requeueing enabled. Setting signal handlers.
SLURM auto-requeueing enabled. Setting signal handlers.
SLURM auto-requeueing enabled. Setting signal handlers.
SLURM auto-requeueing enabled. Setting signal handlers.
SLURM auto-requeueing enabled. Setting signal handlers.
SLURM auto-requeueing enabled. Setting signal handlers.
SLURM auto-requeueing enabled. Setting signal handlers.
SLURM auto-requeueing enabled. Setting signal handlers.
SLURM auto-requeueing enabled. Setting signal handlers.
SLURM auto-requeueing enabled. Setting signal handlers.
SLURM auto-requeueing enabled. Setting signal handlers.
SLURM auto-requeueing enabled. Setting signal handlers.
SLURM auto-requeueing enabled. Setting signal handlers.
SLURM auto-requeueing enabled. Setting signal handlers.
SLURM auto-requeueing enabled. Setting signal handlers.
SLURM auto-requeueing enabled. Setting signal handlers.
SLURM auto-requeueing enabled. Setting signal handlers.
SLURM auto-requeueing enabled. Setting signal handlers.
SLURM auto-requeueing enabled. Setting signal handlers.
SLURM auto-requeueing enabled. Setting signal handlers.
SLURM auto-requeueing enabled. Setting signal handlers.
SLURM auto-requeueing enabled. Setting signal handlers.
SLURM auto-requeueing enabled. Setting signal handlers.
SLURM auto-requeueing enabled. Setting signal handlers.
SLURM auto-requeueing enabled. Setting signal handlers.
SLURM auto-requeueing enabled. Setting signal handlers.
SLURM auto-requeueing enabled. Setting signal handlers.
SLURM auto-requeueing enabled. Setting signal handlers.
SLURM auto-requeueing enabled. Setting signal handlers.
SLURM auto-requeueing enabled. Setting signal handlers.
SLURM auto-requeueing enabled. Setting signal handlers.
SLURM auto-requeueing enabled. Setting signal handlers.
SLURM auto-requeueing enabled. Setting signal handlers.
SLURM auto-requeueing enabled. Setting signal handlers.
SLURM auto-requeueing enabled. Setting signal handlers.
SLURM auto-requeueing enabled. Setting signal handlers.
SLURM auto-requeueing enabled. Setting signal handlers.
SLURM auto-requeueing enabled. Setting signal handlers.
SLURM auto-requeueing enabled. Setting signal handlers.
SLURM auto-requeueing enabled. Setting signal handlers.
SLURM auto-requeueing enabled. Setting signal handlers.
SLURM auto-requeueing enabled. Setting signal handlers.
SLURM auto-requeueing enabled. Setting signal handlers.
SLURM auto-requeueing enabled. Setting signal handlers.
SLURM auto-requeueing enabled. Setting signal handlers.
SLURM auto-requeueing enabled. Setting signal handlers.
SLURM auto-requeueing enabled. Setting signal handlers.
SLURM auto-requeueing enabled. Setting signal handlers.
SLURM auto-requeueing enabled. Setting signal handlers.
SLURM auto-requeueing enabled. Setting signal handlers.
SLURM auto-requeueing enabled. Setting signal handlers.
SLURM auto-requeueing enabled. Setting signal handlers.
SLURM auto-requeueing enabled. Setting signal handlers.
SLURM auto-requeueing enabled. Setting signal handlers.
SLURM auto-requeueing enabled. Setting signal handlers.
SLURM auto-requeueing enabled. Setting signal handlers.
SLURM auto-requeueing enabled. Setting signal handlers.
SLURM auto-requeueing enabled. Setting signal handlers.
SLURM auto-requeueing enabled. Setting signal handlers.
SLURM auto-requeueing enabled. Setting signal handlers.
SLURM auto-requeueing enabled. Setting signal handlers.
SLURM auto-requeueing enabled. Setting signal handlers.
SLURM auto-requeueing enabled. Setting signal handlers.
SLURM auto-requeueing enabled. Setting signal handlers.
SLURM auto-requeueing enabled. Setting signal handlers.
SLURM auto-requeueing enabled. Setting signal handlers.
SLURM auto-requeueing enabled. Setting signal handlers.
SLURM auto-requeueing enabled. Setting signal handlers.
SLURM auto-requeueing enabled. Setting signal handlers.
SLURM auto-requeueing enabled. Setting signal handlers.
SLURM auto-requeueing enabled. Setting signal handlers.
[I 2024-09-24 11:52:04,944] Trial 1 finished with values: [1.0, 1.7418790169451093, 0.2, 50.0, 0.5211875788054539, 1.0, 1.0, 8.534285613822487, 1.0] and parameters: {'h': 3, 'encoder_hidden_size': 50, 'encoder_n_layers': 2, 'context_size': 5, 'decoder_hidden_size': 128, 'learning_rate': 0.08194036675174682, 'max_steps': 1000, 'batch_size': 32, 'random_seed': 11}. 
SLURM auto-requeueing enabled. Setting signal handlers.
SLURM auto-requeueing enabled. Setting signal handlers.
SLURM auto-requeueing enabled. Setting signal handlers.
SLURM auto-requeueing enabled. Setting signal handlers.
SLURM auto-requeueing enabled. Setting signal handlers.
SLURM auto-requeueing enabled. Setting signal handlers.
SLURM auto-requeueing enabled. Setting signal handlers.
SLURM auto-requeueing enabled. Setting signal handlers.
SLURM auto-requeueing enabled. Setting signal handlers.
SLURM auto-requeueing enabled. Setting signal handlers.
SLURM auto-requeueing enabled. Setting signal handlers.
SLURM auto-requeueing enabled. Setting signal handlers.
SLURM auto-requeueing enabled. Setting signal handlers.
SLURM auto-requeueing enabled. Setting signal handlers.
SLURM auto-requeueing enabled. Setting signal handlers.
SLURM auto-requeueing enabled. Setting signal handlers.
SLURM auto-requeueing enabled. Setting signal handlers.
SLURM auto-requeueing enabled. Setting signal handlers.
SLURM auto-requeueing enabled. Setting signal handlers.
SLURM auto-requeueing enabled. Setting signal handlers.
SLURM auto-requeueing enabled. Setting signal handlers.
SLURM auto-requeueing enabled. Setting signal handlers.
SLURM auto-requeueing enabled. Setting signal handlers.
SLURM auto-requeueing enabled. Setting signal handlers.
SLURM auto-requeueing enabled. Setting signal handlers.
SLURM auto-requeueing enabled. Setting signal handlers.
SLURM auto-requeueing enabled. Setting signal handlers.
SLURM auto-requeueing enabled. Setting signal handlers.
SLURM auto-requeueing enabled. Setting signal handlers.
SLURM auto-requeueing enabled. Setting signal handlers.
SLURM auto-requeueing enabled. Setting signal handlers.
SLURM auto-requeueing enabled. Setting signal handlers.
SLURM auto-requeueing enabled. Setting signal handlers.
SLURM auto-requeueing enabled. Setting signal handlers.
SLURM auto-requeueing enabled. Setting signal handlers.
SLURM auto-requeueing enabled. Setting signal handlers.
SLURM auto-requeueing enabled. Setting signal handlers.
SLURM auto-requeueing enabled. Setting signal handlers.
SLURM auto-requeueing enabled. Setting signal handlers.
SLURM auto-requeueing enabled. Setting signal handlers.
SLURM auto-requeueing enabled. Setting signal handlers.
SLURM auto-requeueing enabled. Setting signal handlers.
SLURM auto-requeueing enabled. Setting signal handlers.
SLURM auto-requeueing enabled. Setting signal handlers.
SLURM auto-requeueing enabled. Setting signal handlers.
SLURM auto-requeueing enabled. Setting signal handlers.
SLURM auto-requeueing enabled. Setting signal handlers.
SLURM auto-requeueing enabled. Setting signal handlers.
SLURM auto-requeueing enabled. Setting signal handlers.
SLURM auto-requeueing enabled. Setting signal handlers.
SLURM auto-requeueing enabled. Setting signal handlers.
SLURM auto-requeueing enabled. Setting signal handlers.
