[I 2024-09-25 16:12:25,142] Trial 18 finished with values: [150.0, 172.78082979580222, 0.0, 50.0, 29621625374694.125, 1.0, 50.0, 55.42519434230871, 0.0] and parameters: {'h': 13, 'n_pool_kernel_size': [2, 2, 1], 'n_freq_downsample': [24, 12, 1], 'learning_rate': 0.0031143216187739598, 'scaler_type': 'robust', 'max_steps': 1000.0, 'batch_size': 32, 'windows_batch_size': 512, 'random_seed': 2}. 
SLURM auto-requeueing enabled. Setting signal handlers.
SLURM auto-requeueing enabled. Setting signal handlers.
SLURM auto-requeueing enabled. Setting signal handlers.
SLURM auto-requeueing enabled. Setting signal handlers.
SLURM auto-requeueing enabled. Setting signal handlers.
SLURM auto-requeueing enabled. Setting signal handlers.
SLURM auto-requeueing enabled. Setting signal handlers.
SLURM auto-requeueing enabled. Setting signal handlers.
SLURM auto-requeueing enabled. Setting signal handlers.
SLURM auto-requeueing enabled. Setting signal handlers.
SLURM auto-requeueing enabled. Setting signal handlers.
SLURM auto-requeueing enabled. Setting signal handlers.
SLURM auto-requeueing enabled. Setting signal handlers.
SLURM auto-requeueing enabled. Setting signal handlers.
SLURM auto-requeueing enabled. Setting signal handlers.
SLURM auto-requeueing enabled. Setting signal handlers.
SLURM auto-requeueing enabled. Setting signal handlers.
SLURM auto-requeueing enabled. Setting signal handlers.
SLURM auto-requeueing enabled. Setting signal handlers.
SLURM auto-requeueing enabled. Setting signal handlers.
SLURM auto-requeueing enabled. Setting signal handlers.
SLURM auto-requeueing enabled. Setting signal handlers.
SLURM auto-requeueing enabled. Setting signal handlers.
SLURM auto-requeueing enabled. Setting signal handlers.
SLURM auto-requeueing enabled. Setting signal handlers.
SLURM auto-requeueing enabled. Setting signal handlers.
SLURM auto-requeueing enabled. Setting signal handlers.
[I 2024-09-25 16:14:10,456] Trial 19 finished with values: [150.0, 173.2077127840084, 0.0, 50.0, 12416836182051.812, 1.0, 50.0, 55.091744562810895, 0.0] and parameters: {'h': 10, 'n_pool_kernel_size': [4, 4, 4], 'n_freq_downsample': [24, 12, 1], 'learning_rate': 0.0013303193135193827, 'scaler_type': 'robust', 'max_steps': 800.0, 'batch_size': 64, 'windows_batch_size': 128, 'random_seed': 11}. 
SLURM auto-requeueing enabled. Setting signal handlers.
SLURM auto-requeueing enabled. Setting signal handlers.
SLURM auto-requeueing enabled. Setting signal handlers.
SLURM auto-requeueing enabled. Setting signal handlers.
SLURM auto-requeueing enabled. Setting signal handlers.
SLURM auto-requeueing enabled. Setting signal handlers.
SLURM auto-requeueing enabled. Setting signal handlers.
SLURM auto-requeueing enabled. Setting signal handlers.
SLURM auto-requeueing enabled. Setting signal handlers.
SLURM auto-requeueing enabled. Setting signal handlers.
SLURM auto-requeueing enabled. Setting signal handlers.
SLURM auto-requeueing enabled. Setting signal handlers.
SLURM auto-requeueing enabled. Setting signal handlers.
SLURM auto-requeueing enabled. Setting signal handlers.
SLURM auto-requeueing enabled. Setting signal handlers.
SLURM auto-requeueing enabled. Setting signal handlers.
SLURM auto-requeueing enabled. Setting signal handlers.
SLURM auto-requeueing enabled. Setting signal handlers.
SLURM auto-requeueing enabled. Setting signal handlers.
SLURM auto-requeueing enabled. Setting signal handlers.
SLURM auto-requeueing enabled. Setting signal handlers.
SLURM auto-requeueing enabled. Setting signal handlers.
SLURM auto-requeueing enabled. Setting signal handlers.
SLURM auto-requeueing enabled. Setting signal handlers.
SLURM auto-requeueing enabled. Setting signal handlers.
SLURM auto-requeueing enabled. Setting signal handlers.
SLURM auto-requeueing enabled. Setting signal handlers.
[I 2024-09-25 16:15:39,107] Trial 20 finished with values: [150.0, 146.68977915074805, 0.0, 50.0, 154849804653284.97, 0.4, 1.0, 8033.41450865495, 0.0] and parameters: {'h': 10, 'n_pool_kernel_size': [1, 1, 1], 'n_freq_downsample': [24, 12, 1], 'learning_rate': 0.00595365113103414, 'scaler_type': None, 'max_steps': 700.0, 'batch_size': 256, 'windows_batch_size': 128, 'random_seed': 6}. 
SLURM auto-requeueing enabled. Setting signal handlers.
SLURM auto-requeueing enabled. Setting signal handlers.
SLURM auto-requeueing enabled. Setting signal handlers.
SLURM auto-requeueing enabled. Setting signal handlers.
SLURM auto-requeueing enabled. Setting signal handlers.
SLURM auto-requeueing enabled. Setting signal handlers.
SLURM auto-requeueing enabled. Setting signal handlers.
SLURM auto-requeueing enabled. Setting signal handlers.
SLURM auto-requeueing enabled. Setting signal handlers.
SLURM auto-requeueing enabled. Setting signal handlers.
SLURM auto-requeueing enabled. Setting signal handlers.
SLURM auto-requeueing enabled. Setting signal handlers.
SLURM auto-requeueing enabled. Setting signal handlers.
SLURM auto-requeueing enabled. Setting signal handlers.
SLURM auto-requeueing enabled. Setting signal handlers.
SLURM auto-requeueing enabled. Setting signal handlers.
SLURM auto-requeueing enabled. Setting signal handlers.
SLURM auto-requeueing enabled. Setting signal handlers.
SLURM auto-requeueing enabled. Setting signal handlers.
SLURM auto-requeueing enabled. Setting signal handlers.
SLURM auto-requeueing enabled. Setting signal handlers.
SLURM auto-requeueing enabled. Setting signal handlers.
SLURM auto-requeueing enabled. Setting signal handlers.
SLURM auto-requeueing enabled. Setting signal handlers.
SLURM auto-requeueing enabled. Setting signal handlers.
SLURM auto-requeueing enabled. Setting signal handlers.
SLURM auto-requeueing enabled. Setting signal handlers.
SLURM auto-requeueing enabled. Setting signal handlers.
SLURM auto-requeueing enabled. Setting signal handlers.
SLURM auto-requeueing enabled. Setting signal handlers.
SLURM auto-requeueing enabled. Setting signal handlers.
SLURM auto-requeueing enabled. Setting signal handlers.
SLURM auto-requeueing enabled. Setting signal handlers.
SLURM auto-requeueing enabled. Setting signal handlers.
SLURM auto-requeueing enabled. Setting signal handlers.
[I 2024-09-25 16:19:17,229] Trial 21 finished with values: [1.0, 2139.3790815320517, 0.0, 33.0, 1.7075024848892948e+16, 0.0, 1.0, 5051.685035236284, 0.7777777777777778] and parameters: {'h': 8, 'n_pool_kernel_size': [1, 1, 1], 'n_freq_downsample': [40, 20, 1], 'learning_rate': 0.029690839326132697, 'scaler_type': 'standard', 'max_steps': 1500.0, 'batch_size': 128, 'windows_batch_size': 128, 'random_seed': 8}. 
SLURM auto-requeueing enabled. Setting signal handlers.
SLURM auto-requeueing enabled. Setting signal handlers.
SLURM auto-requeueing enabled. Setting signal handlers.
SLURM auto-requeueing enabled. Setting signal handlers.
SLURM auto-requeueing enabled. Setting signal handlers.
SLURM auto-requeueing enabled. Setting signal handlers.
SLURM auto-requeueing enabled. Setting signal handlers.
SLURM auto-requeueing enabled. Setting signal handlers.
SLURM auto-requeueing enabled. Setting signal handlers.
SLURM auto-requeueing enabled. Setting signal handlers.
SLURM auto-requeueing enabled. Setting signal handlers.
SLURM auto-requeueing enabled. Setting signal handlers.
SLURM auto-requeueing enabled. Setting signal handlers.
SLURM auto-requeueing enabled. Setting signal handlers.
SLURM auto-requeueing enabled. Setting signal handlers.
SLURM auto-requeueing enabled. Setting signal handlers.
SLURM auto-requeueing enabled. Setting signal handlers.
SLURM auto-requeueing enabled. Setting signal handlers.
SLURM auto-requeueing enabled. Setting signal handlers.
SLURM auto-requeueing enabled. Setting signal handlers.
SLURM auto-requeueing enabled. Setting signal handlers.
SLURM auto-requeueing enabled. Setting signal handlers.
SLURM auto-requeueing enabled. Setting signal handlers.
SLURM auto-requeueing enabled. Setting signal handlers.
SLURM auto-requeueing enabled. Setting signal handlers.
SLURM auto-requeueing enabled. Setting signal handlers.
SLURM auto-requeueing enabled. Setting signal handlers.
SLURM auto-requeueing enabled. Setting signal handlers.
SLURM auto-requeueing enabled. Setting signal handlers.
SLURM auto-requeueing enabled. Setting signal handlers.
SLURM auto-requeueing enabled. Setting signal handlers.
[I 2024-09-25 16:20:47,209] Trial 22 finished with values: [150.0, 173.23918613637062, 0.0, 50.0, 12552407522571.355, 1.0, 50.0, 55.874266681824494, 0.1111111111111111] and parameters: {'h': 9, 'n_pool_kernel_size': [4, 4, 4], 'n_freq_downsample': [60, 8, 1], 'learning_rate': 0.001038195285560735, 'scaler_type': 'robust', 'max_steps': 500.0, 'batch_size': 64, 'windows_batch_size': 256, 'random_seed': 11}. 
SLURM auto-requeueing enabled. Setting signal handlers.
SLURM auto-requeueing enabled. Setting signal handlers.
SLURM auto-requeueing enabled. Setting signal handlers.
SLURM auto-requeueing enabled. Setting signal handlers.
SLURM auto-requeueing enabled. Setting signal handlers.
SLURM auto-requeueing enabled. Setting signal handlers.
SLURM auto-requeueing enabled. Setting signal handlers.
SLURM auto-requeueing enabled. Setting signal handlers.
SLURM auto-requeueing enabled. Setting signal handlers.
SLURM auto-requeueing enabled. Setting signal handlers.
SLURM auto-requeueing enabled. Setting signal handlers.
SLURM auto-requeueing enabled. Setting signal handlers.
SLURM auto-requeueing enabled. Setting signal handlers.
SLURM auto-requeueing enabled. Setting signal handlers.
SLURM auto-requeueing enabled. Setting signal handlers.
SLURM auto-requeueing enabled. Setting signal handlers.
SLURM auto-requeueing enabled. Setting signal handlers.
SLURM auto-requeueing enabled. Setting signal handlers.
SLURM auto-requeueing enabled. Setting signal handlers.
SLURM auto-requeueing enabled. Setting signal handlers.
SLURM auto-requeueing enabled. Setting signal handlers.
SLURM auto-requeueing enabled. Setting signal handlers.
SLURM auto-requeueing enabled. Setting signal handlers.
SLURM auto-requeueing enabled. Setting signal handlers.
SLURM auto-requeueing enabled. Setting signal handlers.
SLURM auto-requeueing enabled. Setting signal handlers.
SLURM auto-requeueing enabled. Setting signal handlers.
SLURM auto-requeueing enabled. Setting signal handlers.
SLURM auto-requeueing enabled. Setting signal handlers.
SLURM auto-requeueing enabled. Setting signal handlers.
SLURM auto-requeueing enabled. Setting signal handlers.
SLURM auto-requeueing enabled. Setting signal handlers.
SLURM auto-requeueing enabled. Setting signal handlers.
SLURM auto-requeueing enabled. Setting signal handlers.
SLURM auto-requeueing enabled. Setting signal handlers.
[I 2024-09-25 16:22:37,146] Trial 23 finished with values: [150.0, 173.1238489983861, 0.0, 50.0, 11915802982840.635, 1.0, 50.0, 55.431866526851884, 0.0] and parameters: {'h': 8, 'n_pool_kernel_size': [16, 8, 1], 'n_freq_downsample': [60, 8, 1], 'learning_rate': 0.0017415989895916363, 'scaler_type': 'robust', 'max_steps': 800.0, 'batch_size': 128, 'windows_batch_size': 128, 'random_seed': 10}. 
SLURM auto-requeueing enabled. Setting signal handlers.
SLURM auto-requeueing enabled. Setting signal handlers.
SLURM auto-requeueing enabled. Setting signal handlers.
SLURM auto-requeueing enabled. Setting signal handlers.
SLURM auto-requeueing enabled. Setting signal handlers.
SLURM auto-requeueing enabled. Setting signal handlers.
SLURM auto-requeueing enabled. Setting signal handlers.
SLURM auto-requeueing enabled. Setting signal handlers.
SLURM auto-requeueing enabled. Setting signal handlers.
SLURM auto-requeueing enabled. Setting signal handlers.
SLURM auto-requeueing enabled. Setting signal handlers.
SLURM auto-requeueing enabled. Setting signal handlers.
SLURM auto-requeueing enabled. Setting signal handlers.
SLURM auto-requeueing enabled. Setting signal handlers.
SLURM auto-requeueing enabled. Setting signal handlers.
SLURM auto-requeueing enabled. Setting signal handlers.
SLURM auto-requeueing enabled. Setting signal handlers.
SLURM auto-requeueing enabled. Setting signal handlers.
SLURM auto-requeueing enabled. Setting signal handlers.
SLURM auto-requeueing enabled. Setting signal handlers.
[I 2024-09-25 16:28:40,483] Trial 24 finished with values: [150.0, 168.3772111495339, 0.0, 50.0, 662176281170300.4, 0.0, 50.0, 48.05326530271995, 0.7777777777777778] and parameters: {'h': 15, 'n_pool_kernel_size': [16, 8, 1], 'n_freq_downsample': [40, 20, 1], 'learning_rate': 0.01095074455539568, 'scaler_type': 'standard', 'max_steps': 1200.0, 'batch_size': 128, 'windows_batch_size': 512, 'random_seed': 5}. 
[I 2024-09-25 16:29:05,365] A new study created in memory with name: ResComp predicting GenForecast[cml, ResComp]
[I 2024-09-25 16:29:17,180] Trial 0 finished with values: [150.0, 0.0005054643985549946, 1.0, 50.0, 1050047481.2701025, 1.0, 2.0, 242.68320324922394, 0.2222222222222222] and parameters: {'gamma': 48.02539791087113, 'sigma': 98.73998111205952, 'delta': 84.44455587110782, 'mean_degree': 2.3558087041760802, 'res_sz': 79, 'window': 0.15568422052543185, 'spect_rad': 81.33937756975983, 'ridge_alpha': 0.0004965984779241306}. 
[I 2024-09-25 16:29:22,369] Trial 1 finished with values: [0.0, 741820098460.1407, 0.0, 0.0, 4.645818560535986e+25, 0.0, 1.0, 318.48743228742154, 0.2222222222222222] and parameters: {'gamma': 52.25250299873938, 'sigma': 31.566054627993843, 'delta': 80.94163661348779, 'mean_degree': 2.923600469723436, 'res_sz': 36, 'window': 72.05929452250042, 'spect_rad': 37.254846851023125, 'ridge_alpha': 1.9815022648421366e-09}. 
[I 2024-09-25 16:29:28,973] Trial 2 finished with values: [150.0, 173.11724915545852, 0.0, 50.0, 19013351349.92795, 1.0, 1.0, 187.4877418912025, 0.2222222222222222] and parameters: {'gamma': 37.020125350029424, 'sigma': 57.45576034469709, 'delta': 59.508307546575686, 'mean_degree': 2.9608700946066433, 'res_sz': 78, 'window': 0.08425475862639512, 'spect_rad': 0.0010569069105974647, 'ridge_alpha': 6.383542845833329e-07}. 
[I 2024-09-25 16:29:35,713] Trial 3 finished with values: [150.0, 173.01994457527627, 0.0, 50.0, 2016618887577.6797, 1.0, 2.0, 91.68116800629824, 0.6666666666666666] and parameters: {'gamma': 34.373453912746236, 'sigma': 73.51583796991234, 'delta': 30.22840490802951, 'mean_degree': 2.5928877070314114, 'res_sz': 86, 'window': 0.03924566538794844, 'spect_rad': 0.04029453866617116, 'ridge_alpha': 0.011675110348456039}. 
[I 2024-09-25 16:29:43,812] Trial 4 finished with values: [150.0, 173.11395874959612, 0.0, 50.0, 3209429253662.9536, 1.0, 50.0, 52.15995490906912, 0.6666666666666666] and parameters: {'gamma': 469.832093194959, 'sigma': 23.576491107146083, 'delta': 8.031701351631387, 'mean_degree': 3.9281095495349865, 'res_sz': 77, 'window': 1.0556116865769989, 'spect_rad': 0.003934169316442564, 'ridge_alpha': 0.00023637237425255047}. 
[I 2024-09-25 16:29:48,788] Trial 5 finished with values: [0.0, 741820098460.1407, 0.0, 0.0, 4.645818560535986e+25, 0.0, 50.0, 55.08337129543765, 0.0] and parameters: {'gamma': 236.4070762321077, 'sigma': 92.292324513474, 'delta': 47.61641634527517, 'mean_degree': 0.38149034112349234, 'res_sz': 12, 'window': 23.641021676244947, 'spect_rad': 1.5223779409162683, 'ridge_alpha': 0.1765855025001159}. 
[I 2024-09-25 16:29:54,886] Trial 6 finished with values: [150.0, 173.0486657020202, 0.0, 50.0, 6465685111.7414255, 1.0, 50.0, 81.601496138183, 0.3333333333333333] and parameters: {'gamma': 196.2556687162884, 'sigma': 44.954012406776435, 'delta': 72.99180817544763, 'mean_degree': 4.834897881462505, 'res_sz': 33, 'window': 3.029029071349149, 'spect_rad': 19.136956191815205, 'ridge_alpha': 4.7184316950501584e-07}. 
[I 2024-09-25 16:30:01,974] Trial 7 finished with values: [150.0, 173.18915946714495, 0.0, 50.0, 5109560031518.895, 1.0, 50.0, 120.1728684099075, 0.6666666666666666] and parameters: {'gamma': 285.9725481557521, 'sigma': 13.420264597785932, 'delta': 28.6168351892544, 'mean_degree': 3.0763728072722007, 'res_sz': 100, 'window': 4.998012199976467, 'spect_rad': 0.021840070501626594, 'ridge_alpha': 9.176621291764797e-10}. 
[I 2024-09-25 16:30:10,375] Trial 8 finished with values: [150.0, 9.860302579490653e-05, 1.0, 50.0, 675390552.4314083, 1.0, 50.0, 82.2589392010288, 0.3333333333333333] and parameters: {'gamma': 265.14268936283236, 'sigma': 24.61499930020472, 'delta': 39.355302097522326, 'mean_degree': 2.4512891326440913, 'res_sz': 20, 'window': 0.32337290900491683, 'spect_rad': 34.16379877760991, 'ridge_alpha': 3.308339014249941e-05}. 
[I 2024-09-25 16:30:18,179] Trial 9 finished with values: [150.0, 163.93062568668583, 0.0, 50.0, 18053459747889.945, 1.0, 50.0, 55.35891245392204, 0.0] and parameters: {'gamma': 10.061387825077718, 'sigma': 66.2703174290649, 'delta': 0.06920399532957518, 'mean_degree': 1.0127553296222638, 'res_sz': 31, 'window': 0.6502196435970168, 'spect_rad': 37.70741035744632, 'ridge_alpha': 1.0425856861246078e-10}. 
[I 2024-09-25 16:30:25,366] Trial 10 finished with values: [150.0, 52.65002160320182, 0.0, 50.0, 3274602005223547.5, 0.0, 50.0, 78.98026301898474, 0.3333333333333333] and parameters: {'gamma': 192.87568911972943, 'sigma': 1.254192346067917, 'delta': 97.0799106087885, 'mean_degree': 0.7134046785780885, 'res_sz': 47, 'window': 0.002414842154776019, 'spect_rad': 0.6073573459343516, 'ridge_alpha': 0.05368401551456471}. 
[I 2024-09-25 16:30:30,552] Trial 11 finished with values: [150.0, 177.42606019483242, 0.0, 50.0, 3510840965.215919, 1.0, 1.0, 68.90105934150998, 0.0] and parameters: {'gamma': 380.1352713448134, 'sigma': 41.4379186810193, 'delta': 32.35289600462272, 'mean_degree': 3.5086672658263005, 'res_sz': 87, 'window': 35.82310621038742, 'spect_rad': 0.10733818155709275, 'ridge_alpha': 3.0417014539911417e-05}. 
[I 2024-09-25 16:30:38,323] Trial 12 finished with values: [150.0, 173.13486848867146, 0.0, 50.0, 726355005.3714294, 1.0, 50.0, 51.47749694049776, 0.6666666666666666] and parameters: {'gamma': 257.77743332288213, 'sigma': 56.08410406663668, 'delta': 34.43882633752636, 'mean_degree': 2.109237274103127, 'res_sz': 98, 'window': 0.029566505230159548, 'spect_rad': 0.06377635369280532, 'ridge_alpha': 7.363697372802276e-05}. 
[I 2024-09-25 16:30:43,571] Trial 13 finished with values: [150.0, 71.11824129600511, 0.0, 50.0, 4423949804375637.5, 0.0, 0.0, 1535.5326285809858, 0.3333333333333333] and parameters: {'gamma': 259.09865589769356, 'sigma': 27.56839277416594, 'delta': 31.928185331643427, 'mean_degree': 0.7530935956458105, 'res_sz': 11, 'window': 6.831604784533847, 'spect_rad': 0.40802386828505505, 'ridge_alpha': 1.0872400209498644e-08}. 
[I 2024-09-25 16:30:50,400] Trial 14 finished with values: [150.0, 173.11478476555973, 0.0, 50.0, 29833758807.686474, 1.0, 50.0, 56.332608397103215, 0.4444444444444444] and parameters: {'gamma': 315.41445749358337, 'sigma': 35.55720209846618, 'delta': 9.320333295402651, 'mean_degree': 3.472218018720285, 'res_sz': 72, 'window': 0.03209196397908338, 'spect_rad': 0.001673019465515823, 'ridge_alpha': 2.094913256995275e-06}. 
[I 2024-09-25 16:30:55,559] Trial 15 finished with values: [150.0, 11.888999879696298, 1.0, 50.0, 42382482813161.46, 1.0, 50.0, 117.01004118872197, 0.2222222222222222] and parameters: {'gamma': 0.25707582370857457, 'sigma': 88.3647952434477, 'delta': 98.25764219975208, 'mean_degree': 2.0097255124813413, 'res_sz': 12, 'window': 0.5666919398233674, 'spect_rad': 0.13443784621474691, 'ridge_alpha': 4.550098121133661}. 
[I 2024-09-25 16:31:01,593] Trial 16 finished with values: [150.0, 172.37720437613294, 0.0, 1.0, 2.720683012331816e+17, 0.7, 1.0, 233.00492230108478, 0.2222222222222222] and parameters: {'gamma': 332.79606562133, 'sigma': 39.96389191120451, 'delta': 58.8591450361868, 'mean_degree': 1.8273060769877303, 'res_sz': 16, 'window': 0.020987065820071375, 'spect_rad': 0.002134231844431304, 'ridge_alpha': 7.447144853786356e-09}. 
[I 2024-09-25 16:31:08,733] Trial 17 finished with values: [150.0, 172.2076964516031, 0.0, 50.0, 2018893277874.8894, 1.0, 50.0, 112.75876207050696, 0.2222222222222222] and parameters: {'gamma': 378.82533317618805, 'sigma': 18.498027805290132, 'delta': 49.140486823872, 'mean_degree': 1.4950989384057822, 'res_sz': 69, 'window': 0.5675507227648835, 'spect_rad': 0.002021676524646629, 'ridge_alpha': 0.09471575368582902}. 
[I 2024-09-25 16:31:14,538] Trial 18 finished with values: [150.0, 172.36419075467637, 0.0, 50.0, 506396154646.7726, 1.0, 50.0, 138.9295434767097, 0.2222222222222222] and parameters: {'gamma': 101.51560445581529, 'sigma': 70.65027310768798, 'delta': 34.5188999224232, 'mean_degree': 3.749403119367083, 'res_sz': 42, 'window': 8.6396938483003, 'spect_rad': 0.10951428593124735, 'ridge_alpha': 0.06050882910725138}. 
[I 2024-09-25 16:31:21,429] Trial 19 finished with values: [0.0, 741820098460.1407, 0.0, 0.0, 4.645818560535986e+25, 0.0, 50.0, 60.92364469329632, 0.2222222222222222] and parameters: {'gamma': 172.53860138237363, 'sigma': 3.6021202768432645, 'delta': 93.21326902007003, 'mean_degree': 2.1483835339522104, 'res_sz': 56, 'window': 5.102282057609201, 'spect_rad': 8.488877279646921, 'ridge_alpha': 65.05298452376793}. 
[I 2024-09-25 16:31:27,507] Trial 20 finished with values: [150.0, 14.18354134858648, 0.7, 50.0, 105062801545684.5, 0.7, 50.0, 99.24285756360035, 0.2222222222222222] and parameters: {'gamma': 494.1248613722135, 'sigma': 43.65280935682132, 'delta': 56.514092007582526, 'mean_degree': 0.5298944405904544, 'res_sz': 19, 'window': 0.6304532659170865, 'spect_rad': 0.06210060622768949, 'ridge_alpha': 6.211477127611358}. 
[I 2024-09-25 16:31:34,244] Trial 21 finished with values: [150.0, 0.9492820146301449, 1.0, 50.0, 22134452628993.324, 1.0, 50.0, 59.37114966043859, 0.3333333333333333] and parameters: {'gamma': 361.88041914254586, 'sigma': 4.203416476621407, 'delta': 88.73735891064439, 'mean_degree': 2.4923249696278322, 'res_sz': 30, 'window': 0.001099884030269953, 'spect_rad': 1.637398596598287, 'ridge_alpha': 0.1818389552448436}. 
