[I 2024-09-25 06:45:58,317] Trial 24 finished with values: [150.0, 0.9688857625476606, 0.9, 50.0, 0.9176724968223033, 0.7, 1.0, 44.86759315052156, 0.1111111111111111] and parameters: {'optimizer__threshold': 0.0006346954043774775, 'optimizer__alpha': 1.7281485517763603e-05, 'discrete_time': True, 'feature_library': 1, 'differentiation_method': 6}. 
SLURM auto-requeueing enabled. Setting signal handlers.
SLURM auto-requeueing enabled. Setting signal handlers.
SLURM auto-requeueing enabled. Setting signal handlers.
SLURM auto-requeueing enabled. Setting signal handlers.
SLURM auto-requeueing enabled. Setting signal handlers.
SLURM auto-requeueing enabled. Setting signal handlers.
SLURM auto-requeueing enabled. Setting signal handlers.
SLURM auto-requeueing enabled. Setting signal handlers.
SLURM auto-requeueing enabled. Setting signal handlers.
SLURM auto-requeueing enabled. Setting signal handlers.
SLURM auto-requeueing enabled. Setting signal handlers.
SLURM auto-requeueing enabled. Setting signal handlers.
SLURM auto-requeueing enabled. Setting signal handlers.
SLURM auto-requeueing enabled. Setting signal handlers.
SLURM auto-requeueing enabled. Setting signal handlers.
SLURM auto-requeueing enabled. Setting signal handlers.
SLURM auto-requeueing enabled. Setting signal handlers.
SLURM auto-requeueing enabled. Setting signal handlers.
SLURM auto-requeueing enabled. Setting signal handlers.
SLURM auto-requeueing enabled. Setting signal handlers.
SLURM auto-requeueing enabled. Setting signal handlers.
SLURM auto-requeueing enabled. Setting signal handlers.
SLURM auto-requeueing enabled. Setting signal handlers.
SLURM auto-requeueing enabled. Setting signal handlers.
SLURM auto-requeueing enabled. Setting signal handlers.
SLURM auto-requeueing enabled. Setting signal handlers.
SLURM auto-requeueing enabled. Setting signal handlers.
SLURM auto-requeueing enabled. Setting signal handlers.
SLURM auto-requeueing enabled. Setting signal handlers.
SLURM auto-requeueing enabled. Setting signal handlers.
SLURM auto-requeueing enabled. Setting signal handlers.
SLURM auto-requeueing enabled. Setting signal handlers.
SLURM auto-requeueing enabled. Setting signal handlers.
SLURM auto-requeueing enabled. Setting signal handlers.
SLURM auto-requeueing enabled. Setting signal handlers.
SLURM auto-requeueing enabled. Setting signal handlers.
SLURM auto-requeueing enabled. Setting signal handlers.
SLURM auto-requeueing enabled. Setting signal handlers.
SLURM auto-requeueing enabled. Setting signal handlers.
SLURM auto-requeueing enabled. Setting signal handlers.
SLURM auto-requeueing enabled. Setting signal handlers.
SLURM auto-requeueing enabled. Setting signal handlers.
SLURM auto-requeueing enabled. Setting signal handlers.
SLURM auto-requeueing enabled. Setting signal handlers.
SLURM auto-requeueing enabled. Setting signal handlers.
SLURM auto-requeueing enabled. Setting signal handlers.
SLURM auto-requeueing enabled. Setting signal handlers.
SLURM auto-requeueing enabled. Setting signal handlers.
SLURM auto-requeueing enabled. Setting signal handlers.
SLURM auto-requeueing enabled. Setting signal handlers.
SLURM auto-requeueing enabled. Setting signal handlers.
SLURM auto-requeueing enabled. Setting signal handlers.
SLURM auto-requeueing enabled. Setting signal handlers.
SLURM auto-requeueing enabled. Setting signal handlers.
SLURM auto-requeueing enabled. Setting signal handlers.
SLURM auto-requeueing enabled. Setting signal handlers.
SLURM auto-requeueing enabled. Setting signal handlers.
SLURM auto-requeueing enabled. Setting signal handlers.
SLURM auto-requeueing enabled. Setting signal handlers.
SLURM auto-requeueing enabled. Setting signal handlers.
SLURM auto-requeueing enabled. Setting signal handlers.
SLURM auto-requeueing enabled. Setting signal handlers.
SLURM auto-requeueing enabled. Setting signal handlers.
SLURM auto-requeueing enabled. Setting signal handlers.
SLURM auto-requeueing enabled. Setting signal handlers.
SLURM auto-requeueing enabled. Setting signal handlers.
SLURM auto-requeueing enabled. Setting signal handlers.
SLURM auto-requeueing enabled. Setting signal handlers.
SLURM auto-requeueing enabled. Setting signal handlers.
SLURM auto-requeueing enabled. Setting signal handlers.
SLURM auto-requeueing enabled. Setting signal handlers.
SLURM auto-requeueing enabled. Setting signal handlers.
SLURM auto-requeueing enabled. Setting signal handlers.
SLURM auto-requeueing enabled. Setting signal handlers.
SLURM auto-requeueing enabled. Setting signal handlers.
SLURM auto-requeueing enabled. Setting signal handlers.
SLURM auto-requeueing enabled. Setting signal handlers.
SLURM auto-requeueing enabled. Setting signal handlers.
SLURM auto-requeueing enabled. Setting signal handlers.
SLURM auto-requeueing enabled. Setting signal handlers.
SLURM auto-requeueing enabled. Setting signal handlers.
SLURM auto-requeueing enabled. Setting signal handlers.
SLURM auto-requeueing enabled. Setting signal handlers.
SLURM auto-requeueing enabled. Setting signal handlers.
SLURM auto-requeueing enabled. Setting signal handlers.
SLURM auto-requeueing enabled. Setting signal handlers.
SLURM auto-requeueing enabled. Setting signal handlers.
SLURM auto-requeueing enabled. Setting signal handlers.
SLURM auto-requeueing enabled. Setting signal handlers.
SLURM auto-requeueing enabled. Setting signal handlers.
SLURM auto-requeueing enabled. Setting signal handlers.
SLURM auto-requeueing enabled. Setting signal handlers.
SLURM auto-requeueing enabled. Setting signal handlers.
SLURM auto-requeueing enabled. Setting signal handlers.
SLURM auto-requeueing enabled. Setting signal handlers.
SLURM auto-requeueing enabled. Setting signal handlers.
SLURM auto-requeueing enabled. Setting signal handlers.
SLURM auto-requeueing enabled. Setting signal handlers.
SLURM auto-requeueing enabled. Setting signal handlers.
SLURM auto-requeueing enabled. Setting signal handlers.
SLURM auto-requeueing enabled. Setting signal handlers.
SLURM auto-requeueing enabled. Setting signal handlers.
SLURM auto-requeueing enabled. Setting signal handlers.
SLURM auto-requeueing enabled. Setting signal handlers.
SLURM auto-requeueing enabled. Setting signal handlers.
SLURM auto-requeueing enabled. Setting signal handlers.
SLURM auto-requeueing enabled. Setting signal handlers.
SLURM auto-requeueing enabled. Setting signal handlers.
SLURM auto-requeueing enabled. Setting signal handlers.
SLURM auto-requeueing enabled. Setting signal handlers.
SLURM auto-requeueing enabled. Setting signal handlers.
SLURM auto-requeueing enabled. Setting signal handlers.
SLURM auto-requeueing enabled. Setting signal handlers.
SLURM auto-requeueing enabled. Setting signal handlers.
SLURM auto-requeueing enabled. Setting signal handlers.
SLURM auto-requeueing enabled. Setting signal handlers.
SLURM auto-requeueing enabled. Setting signal handlers.
SLURM auto-requeueing enabled. Setting signal handlers.
SLURM auto-requeueing enabled. Setting signal handlers.
SLURM auto-requeueing enabled. Setting signal handlers.
SLURM auto-requeueing enabled. Setting signal handlers.
SLURM auto-requeueing enabled. Setting signal handlers.
SLURM auto-requeueing enabled. Setting signal handlers.
SLURM auto-requeueing enabled. Setting signal handlers.
SLURM auto-requeueing enabled. Setting signal handlers.
SLURM auto-requeueing enabled. Setting signal handlers.
SLURM auto-requeueing enabled. Setting signal handlers.
SLURM auto-requeueing enabled. Setting signal handlers.
SLURM auto-requeueing enabled. Setting signal handlers.
SLURM auto-requeueing enabled. Setting signal handlers.
SLURM auto-requeueing enabled. Setting signal handlers.
SLURM auto-requeueing enabled. Setting signal handlers.
SLURM auto-requeueing enabled. Setting signal handlers.
SLURM auto-requeueing enabled. Setting signal handlers.
SLURM auto-requeueing enabled. Setting signal handlers.
SLURM auto-requeueing enabled. Setting signal handlers.
SLURM auto-requeueing enabled. Setting signal handlers.
SLURM auto-requeueing enabled. Setting signal handlers.
SLURM auto-requeueing enabled. Setting signal handlers.
SLURM auto-requeueing enabled. Setting signal handlers.
SLURM auto-requeueing enabled. Setting signal handlers.
SLURM auto-requeueing enabled. Setting signal handlers.
SLURM auto-requeueing enabled. Setting signal handlers.
SLURM auto-requeueing enabled. Setting signal handlers.
SLURM auto-requeueing enabled. Setting signal handlers.
SLURM auto-requeueing enabled. Setting signal handlers.
SLURM auto-requeueing enabled. Setting signal handlers.
SLURM auto-requeueing enabled. Setting signal handlers.
SLURM auto-requeueing enabled. Setting signal handlers.
SLURM auto-requeueing enabled. Setting signal handlers.
SLURM auto-requeueing enabled. Setting signal handlers.
SLURM auto-requeueing enabled. Setting signal handlers.
SLURM auto-requeueing enabled. Setting signal handlers.
SLURM auto-requeueing enabled. Setting signal handlers.
SLURM auto-requeueing enabled. Setting signal handlers.
SLURM auto-requeueing enabled. Setting signal handlers.
SLURM auto-requeueing enabled. Setting signal handlers.
SLURM auto-requeueing enabled. Setting signal handlers.
SLURM auto-requeueing enabled. Setting signal handlers.
SLURM auto-requeueing enabled. Setting signal handlers.
SLURM auto-requeueing enabled. Setting signal handlers.
SLURM auto-requeueing enabled. Setting signal handlers.
SLURM auto-requeueing enabled. Setting signal handlers.
SLURM auto-requeueing enabled. Setting signal handlers.
SLURM auto-requeueing enabled. Setting signal handlers.
SLURM auto-requeueing enabled. Setting signal handlers.
SLURM auto-requeueing enabled. Setting signal handlers.
SLURM auto-requeueing enabled. Setting signal handlers.
SLURM auto-requeueing enabled. Setting signal handlers.
SLURM auto-requeueing enabled. Setting signal handlers.
SLURM auto-requeueing enabled. Setting signal handlers.
SLURM auto-requeueing enabled. Setting signal handlers.
SLURM auto-requeueing enabled. Setting signal handlers.
SLURM auto-requeueing enabled. Setting signal handlers.
SLURM auto-requeueing enabled. Setting signal handlers.
SLURM auto-requeueing enabled. Setting signal handlers.
SLURM auto-requeueing enabled. Setting signal handlers.
SLURM auto-requeueing enabled. Setting signal handlers.
SLURM auto-requeueing enabled. Setting signal handlers.
SLURM auto-requeueing enabled. Setting signal handlers.
SLURM auto-requeueing enabled. Setting signal handlers.
SLURM auto-requeueing enabled. Setting signal handlers.
SLURM auto-requeueing enabled. Setting signal handlers.
SLURM auto-requeueing enabled. Setting signal handlers.
SLURM auto-requeueing enabled. Setting signal handlers.
SLURM auto-requeueing enabled. Setting signal handlers.
SLURM auto-requeueing enabled. Setting signal handlers.
SLURM auto-requeueing enabled. Setting signal handlers.
SLURM auto-requeueing enabled. Setting signal handlers.
SLURM auto-requeueing enabled. Setting signal handlers.
SLURM auto-requeueing enabled. Setting signal handlers.
SLURM auto-requeueing enabled. Setting signal handlers.
SLURM auto-requeueing enabled. Setting signal handlers.
SLURM auto-requeueing enabled. Setting signal handlers.
SLURM auto-requeueing enabled. Setting signal handlers.
SLURM auto-requeueing enabled. Setting signal handlers.
SLURM auto-requeueing enabled. Setting signal handlers.
SLURM auto-requeueing enabled. Setting signal handlers.
SLURM auto-requeueing enabled. Setting signal handlers.
SLURM auto-requeueing enabled. Setting signal handlers.
SLURM auto-requeueing enabled. Setting signal handlers.
SLURM auto-requeueing enabled. Setting signal handlers.
SLURM auto-requeueing enabled. Setting signal handlers.
SLURM auto-requeueing enabled. Setting signal handlers.
SLURM auto-requeueing enabled. Setting signal handlers.
SLURM auto-requeueing enabled. Setting signal handlers.
SLURM auto-requeueing enabled. Setting signal handlers.
SLURM auto-requeueing enabled. Setting signal handlers.
SLURM auto-requeueing enabled. Setting signal handlers.
SLURM auto-requeueing enabled. Setting signal handlers.
SLURM auto-requeueing enabled. Setting signal handlers.
SLURM auto-requeueing enabled. Setting signal handlers.
SLURM auto-requeueing enabled. Setting signal handlers.
SLURM auto-requeueing enabled. Setting signal handlers.
SLURM auto-requeueing enabled. Setting signal handlers.
SLURM auto-requeueing enabled. Setting signal handlers.
SLURM auto-requeueing enabled. Setting signal handlers.
SLURM auto-requeueing enabled. Setting signal handlers.
SLURM auto-requeueing enabled. Setting signal handlers.
SLURM auto-requeueing enabled. Setting signal handlers.
SLURM auto-requeueing enabled. Setting signal handlers.
SLURM auto-requeueing enabled. Setting signal handlers.
SLURM auto-requeueing enabled. Setting signal handlers.
SLURM auto-requeueing enabled. Setting signal handlers.
SLURM auto-requeueing enabled. Setting signal handlers.
SLURM auto-requeueing enabled. Setting signal handlers.
SLURM auto-requeueing enabled. Setting signal handlers.
SLURM auto-requeueing enabled. Setting signal handlers.
SLURM auto-requeueing enabled. Setting signal handlers.
SLURM auto-requeueing enabled. Setting signal handlers.
SLURM auto-requeueing enabled. Setting signal handlers.
SLURM auto-requeueing enabled. Setting signal handlers.
SLURM auto-requeueing enabled. Setting signal handlers.
SLURM auto-requeueing enabled. Setting signal handlers.
SLURM auto-requeueing enabled. Setting signal handlers.
SLURM auto-requeueing enabled. Setting signal handlers.
SLURM auto-requeueing enabled. Setting signal handlers.
SLURM auto-requeueing enabled. Setting signal handlers.
SLURM auto-requeueing enabled. Setting signal handlers.
SLURM auto-requeueing enabled. Setting signal handlers.
SLURM auto-requeueing enabled. Setting signal handlers.
SLURM auto-requeueing enabled. Setting signal handlers.
SLURM auto-requeueing enabled. Setting signal handlers.
SLURM auto-requeueing enabled. Setting signal handlers.
SLURM auto-requeueing enabled. Setting signal handlers.
SLURM auto-requeueing enabled. Setting signal handlers.
SLURM auto-requeueing enabled. Setting signal handlers.
[I 2024-09-25 06:47:22,380] A new study created in memory with name: LTSFLinearForecaster predicting GenForecast[cml, NHITS]
[I 2024-09-25 06:47:40,363] Trial 0 finished with values: [1.0, 1.1563518774527035, 0.5, 50.0, 0.012687746255477894, 1.0, 50.0, 0.01558894398648099, 1.0] and parameters: {'seq_len': 24, 'lr': 0.002051418877189077, 'pred_len': 13, 'num_epochs': 300}. 
[I 2024-09-25 06:47:51,155] Trial 1 finished with values: [1.0, 1.481247207598127, 0.0, 2.0, 1.4687983641836952, 0.0, 1.0, 2.8588843382899403, 0.0] and parameters: {'seq_len': 16, 'lr': 3.3870608833116124e-05, 'pred_len': 7, 'num_epochs': 100}. 
[I 2024-09-25 06:48:00,221] Trial 2 finished with values: [1.0, 4.0322471782635505, 0.0, 9.0, 2.356859725322573, 0.0, 50.0, 0.7059869779269812, 1.0] and parameters: {'seq_len': 2, 'lr': 0.0017146044351313235, 'pred_len': 4, 'num_epochs': 50}. 
[I 2024-09-25 06:48:17,174] Trial 3 finished with values: [1.0, 1.9769193244693926, 0.0, 50.0, 0.01901590470458047, 1.0, 50.0, 0.10371053227723051, 1.0] and parameters: {'seq_len': 19, 'lr': 0.0008936895697130584, 'pred_len': 20, 'num_epochs': 300}. 
[I 2024-09-25 06:48:25,998] Trial 4 finished with values: [1.0, 0.9064565466748125, 0.2, 50.0, 0.8739677246138121, 1.0, 50.0, 0.8724597390289751, 0.5555555555555556] and parameters: {'seq_len': 7, 'lr': 0.0009428412343656882, 'pred_len': 14, 'num_epochs': 50}. 
[I 2024-09-25 06:48:44,535] Trial 5 finished with values: [1.0, 1.3946327836034358, 0.0, 50.0, 0.2541522782415373, 1.0, 50.0, 0.09995150911287895, 1.0] and parameters: {'seq_len': 15, 'lr': 0.07601390795476928, 'pred_len': 13, 'num_epochs': 300}. 
[I 2024-09-25 06:48:54,141] Trial 6 finished with values: [1.0, 1.276308697698853, 0.0, 50.0, 0.7005732884581712, 1.0, 50.0, 0.9561391251175826, 1.0] and parameters: {'seq_len': 22, 'lr': 0.0002432783241145544, 'pred_len': 13, 'num_epochs': 50}. 
[I 2024-09-25 06:49:04,832] Trial 7 finished with values: [2.0, 1.174724065227371, 1.0, 50.0, 0.03449184182862146, 1.0, 50.0, 0.09263327139204834, 1.0] and parameters: {'seq_len': 9, 'lr': 0.0077399366280320805, 'pred_len': 14, 'num_epochs': 100}. 
[I 2024-09-25 06:49:15,464] Trial 8 finished with values: [1.0, 2.7572301866451365, 0.0, 1.0, 2.770969615026458, 0.0, 1.0, 4.776678245785151, 0.0] and parameters: {'seq_len': 2, 'lr': 0.00012451717044942255, 'pred_len': 25, 'num_epochs': 100}. 
[I 2024-09-25 06:49:24,532] Trial 9 finished with values: [1.0, 19.70811628956289, 0.0, 37.0, 1.194835987769405, 0.4, 50.0, 0.8373638493079533, 1.0] and parameters: {'seq_len': 10, 'lr': 0.00047501845233715933, 'pred_len': 18, 'num_epochs': 50}. 
[I 2024-09-25 06:49:43,242] Trial 10 finished with values: [1.0, 0.8426874280932178, 1.0, 50.0, 0.619332834304118, 1.0, 50.0, 0.6121696178221377, 1.0] and parameters: {'seq_len': 2, 'lr': 0.0030422248720432614, 'pred_len': 18, 'num_epochs': 300}. 
[I 2024-09-25 06:50:01,948] Trial 11 finished with values: [1.0, 1.404497004088687, 0.0, 1.0, 1.3994018372215054, 0.0, 50.0, 0.8537429360520267, 1.0] and parameters: {'seq_len': 1, 'lr': 6.603502088947883e-05, 'pred_len': 16, 'num_epochs': 300}. 
[I 2024-09-25 06:50:21,719] Trial 12 finished with values: [150.0, 0.8584590835497182, 1.0, 50.0, 0.8562828640466189, 1.0, 50.0, 0.8539713793095296, 1.0] and parameters: {'seq_len': 1, 'lr': 0.026368429112774042, 'pred_len': 4, 'num_epochs': 300}. 
[I 2024-09-25 06:50:32,030] Trial 13 finished with values: [1.0, 4.585725470806769, 0.0, 1.0, 2.6842410453663854, 0.0, 50.0, 0.8155840118973382, 1.0] and parameters: {'seq_len': 22, 'lr': 4.493644413078392e-05, 'pred_len': 10, 'num_epochs': 100}. 
[I 2024-09-25 06:50:40,639] Trial 14 finished with values: [1.0, 1.5045650232019112, 0.0, 50.0, 0.013963361239931223, 1.0, 50.0, 0.012683867100106062, 1.0] and parameters: {'seq_len': 16, 'lr': 0.0034510041427107357, 'pred_len': 23, 'num_epochs': 50}. 
[I 2024-09-25 06:50:49,223] Trial 15 finished with values: [1.0, 2.4130127921034186, 0.0, 1.0, 2.393447662038065, 0.0, 1.0, 2.315907185914086, 0.0] and parameters: {'seq_len': 11, 'lr': 1.130956073640275e-05, 'pred_len': 20, 'num_epochs': 50}. 
[I 2024-09-25 06:50:59,496] Trial 16 finished with values: [1.0, 11.33944142424516, 0.0, 50.0, 0.2118032273967032, 1.0, 50.0, 0.145226151820018, 1.0] and parameters: {'seq_len': 8, 'lr': 0.0017919944237229965, 'pred_len': 15, 'num_epochs': 100}. 
[I 2024-09-25 06:51:16,186] Trial 17 finished with values: [1.0, 12.082748759135669, 0.0, 50.0, 0.014588311190389804, 1.0, 50.0, 0.014497806168027937, 1.0] and parameters: {'seq_len': 20, 'lr': 0.002127069014313647, 'pred_len': 18, 'num_epochs': 300}. 
[I 2024-09-25 06:51:34,477] Trial 18 finished with values: [1.0, 4.300907068072399, 0.0, 1.0, 4.224255473251565, 0.0, 1.0, 41.3094395392466, 0.0] and parameters: {'seq_len': 2, 'lr': 8.095862434756286e-05, 'pred_len': 2, 'num_epochs': 300}. 
[I 2024-09-25 06:51:43,561] Trial 19 finished with values: [1.0, 1.0277211714391972, 0.0, 50.0, 0.529838485284876, 1.0, 50.0, 0.7523935193893437, 1.0] and parameters: {'seq_len': 18, 'lr': 0.0001969293261844256, 'pred_len': 8, 'num_epochs': 50}. 
[I 2024-09-25 06:51:52,415] Trial 20 finished with values: [1.0, 1.1239102700996164, 0.1, 50.0, 0.6874300293804825, 1.0, 49.0, 1.224306638509006, 0.0] and parameters: {'seq_len': 18, 'lr': 9.895212866456781e-05, 'pred_len': 10, 'num_epochs': 50}. 
[I 2024-09-25 06:52:10,411] Trial 21 finished with values: [1.0, 1.5693454233543935, 0.0, 50.0, 0.03517890517353705, 1.0, 50.0, 0.03336646636640434, 1.0] and parameters: {'seq_len': 24, 'lr': 0.00048370404581432944, 'pred_len': 14, 'num_epochs': 300}. 
[I 2024-09-25 06:52:21,879] Trial 22 finished with values: [1.0, 2.0114469321369155, 1.0, 50.0, 0.15696529293028424, 1.0, 50.0, 0.2232061697820688, 1.0] and parameters: {'seq_len': 3, 'lr': 0.04348284089102492, 'pred_len': 17, 'num_epochs': 100}. 
[I 2024-09-25 06:52:32,463] Trial 23 finished with values: [1.0, 1.1628473283660705, 0.0, 50.0, 0.8516770506822746, 1.0, 1.0, 3.3397777557650485, 0.0] and parameters: {'seq_len': 17, 'lr': 4.095246007295692e-05, 'pred_len': 13, 'num_epochs': 100}. 
