[I 2024-09-24 17:49:29,637] Trial 2 finished with values: [1.0, 8139878999.188969, 0.0, 50.0, 1.2245918913198601, 0.9, 0.0, 71.26450532928003, 0.4444444444444444] and parameters: {'gamma': 56.10789545821491, 'sigma': 86.04129045692655, 'delta': 94.0984113734543, 'mean_degree': 1.2676277205687088, 'res_sz': 83, 'window': 0.0695241959541576, 'spect_rad': 4.828140724187196, 'ridge_alpha': 5.8046479637782656e-05}. 
[I 2024-09-24 17:49:43,827] Trial 3 finished with values: [1.0, 302.4896417956488, 1.0, 50.0, 1.6710118847098945, 0.6, 0.0, 8.973702648184755, 0.0] and parameters: {'gamma': 166.175970033625, 'sigma': 21.777317918029432, 'delta': 58.695356238322255, 'mean_degree': 4.15950734037775, 'res_sz': 43, 'window': 0.0010487491008102368, 'spect_rad': 8.155588197728173, 'ridge_alpha': 0.10862228522183999}. 
[I 2024-09-24 17:49:50,623] Trial 4 finished with values: [0.0, 8580185838.572677, 0.0, 0.0, 14976145952.937912, 1.0, 0.0, 14511523727.709276, 1.0] and parameters: {'gamma': 289.3597461424379, 'sigma': 43.32361248802679, 'delta': 9.21262710672393, 'mean_degree': 3.72757679220937, 'res_sz': 100, 'window': 12.78160857299032, 'spect_rad': 45.32302142329485, 'ridge_alpha': 1.2156980837603376e-08}. 
[I 2024-09-24 17:50:02,568] Trial 5 finished with values: [1.0, 8522792647.005073, 0.0, 1.0, 13888306409.98387, 1.0, 0.0, 13457433483.838938, 1.0] and parameters: {'gamma': 397.67505331552553, 'sigma': 12.844418126434856, 'delta': 50.344715774075105, 'mean_degree': 4.231869048871661, 'res_sz': 65, 'window': 0.007732533475365011, 'spect_rad': 47.42149138843036, 'ridge_alpha': 1.0575914016096887e-06}. 
[I 2024-09-24 17:50:13,629] Trial 6 finished with values: [1.0, 1.7037592481239876, 0.0, 50.0, 2.057741412087068, 0.3, 50.0, 1.6469685149733313, 0.2222222222222222] and parameters: {'gamma': 149.34508035521623, 'sigma': 40.253765955615776, 'delta': 14.817840947048046, 'mean_degree': 2.299222214512533, 'res_sz': 10, 'window': 0.0050943263863855994, 'spect_rad': 0.044594949305953945, 'ridge_alpha': 0.0012325179236121367}. 
[I 2024-09-24 17:50:19,059] Trial 7 finished with values: [0.0, 8580185838.572677, 0.0, 0.0, 14976145952.937912, 1.0, 0.0, 14511523727.709276, 1.0] and parameters: {'gamma': 470.62626271900143, 'sigma': 27.530793912609102, 'delta': 59.68316057137674, 'mean_degree': 1.7916913070054796, 'res_sz': 69, 'window': 39.963159846985604, 'spect_rad': 5.14279935584529, 'ridge_alpha': 9.26659306614892e-10}. 
[I 2024-09-24 17:50:30,173] Trial 8 finished with values: [1.0, 1.4871600587648257, 0.2, 50.0, 0.8793473613470341, 1.0, 1.0, 6159916805.794472, 1.0] and parameters: {'gamma': 493.5617416187835, 'sigma': 22.139037805505517, 'delta': 70.19407303667411, 'mean_degree': 1.493103780300801, 'res_sz': 36, 'window': 0.03347782302104737, 'spect_rad': 0.09150857999230527, 'ridge_alpha': 0.00017101554122625443}. 
[I 2024-09-24 17:50:38,468] Trial 9 finished with values: [1.0, 9.603755307513817, 0.0, 1.0, 594.0454302750984, 0.0, 0.0, 154769.83293030056, 0.0] and parameters: {'gamma': 52.672089590056316, 'sigma': 9.029438411110554, 'delta': 14.33834492738634, 'mean_degree': 3.7081392189720903, 'res_sz': 49, 'window': 1.5056660900926393, 'spect_rad': 0.1585374900168742, 'ridge_alpha': 3.839507044077304e-09}. 
[I 2024-09-24 17:50:48,999] Trial 10 finished with values: [1.0, 1.3350325095118412, 0.4, 50.0, 1.3014375824278497, 0.6, 1.0, 5.313469208230647, 0.0] and parameters: {'gamma': 213.97004442814801, 'sigma': 6.625343885420956, 'delta': 38.08541799005858, 'mean_degree': 1.4960269661946146, 'res_sz': 36, 'window': 4.483657017463994, 'spect_rad': 7.094372024214788, 'ridge_alpha': 0.004672957033667696}. 
[I 2024-09-24 17:51:02,295] Trial 11 finished with values: [0.0, 1.321151718019131, 0.1, 50.0, 1.4647807265565786, 0.4, 2.0, 5.550526957491833, 0.0] and parameters: {'gamma': 105.74936267540996, 'sigma': 74.53650874999838, 'delta': 62.34436757119856, 'mean_degree': 0.46232176066177677, 'res_sz': 62, 'window': 0.10880085092493728, 'spect_rad': 0.06371234952550171, 'ridge_alpha': 99.71413277591915}. 
[I 2024-09-24 17:51:15,182] Trial 12 finished with values: [1.0, 1.5993233592737517, 0.2, 50.0, 1.4814836797805824, 0.4, 50.0, 1.5088481666718319, 0.4444444444444444] and parameters: {'gamma': 390.7297338335027, 'sigma': 59.37245758550812, 'delta': 48.906523186806524, 'mean_degree': 3.4369194950498163, 'res_sz': 34, 'window': 0.029316175882927016, 'spect_rad': 3.2425446151821515, 'ridge_alpha': 0.003272538683656033}. 
[I 2024-09-24 17:51:26,615] Trial 13 finished with values: [1.0, 1.273660883998608, 0.1, 50.0, 1.1163614600495575, 0.9, 50.0, 3.2379034009485075, 0.0] and parameters: {'gamma': 166.47742268410283, 'sigma': 55.67224095564453, 'delta': 40.24071907364026, 'mean_degree': 0.34198160228944124, 'res_sz': 27, 'window': 1.1355191476799802, 'spect_rad': 0.5324907296518886, 'ridge_alpha': 7.120607918905203e-05}. 
[I 2024-09-24 17:51:38,174] Trial 14 finished with values: [1.0, 52.835132717983434, 0.0, 50.0, 1.839084008252634, 0.4, 50.0, 2.2600949455506067, 0.5555555555555556] and parameters: {'gamma': 430.3903455600743, 'sigma': 38.54422281070363, 'delta': 12.467614023600223, 'mean_degree': 3.190531597567614, 'res_sz': 50, 'window': 0.0010301841781505394, 'spect_rad': 0.05478715853528429, 'ridge_alpha': 1.392114662088388e-06}. 
[I 2024-09-24 17:51:49,523] Trial 15 finished with values: [1.0, 17.838278102436455, 0.0, 50.0, 1.5113728509582438, 0.8, 1.0, 16.609612031509208, 0.0] and parameters: {'gamma': 415.49181361612074, 'sigma': 57.27908246267039, 'delta': 52.234399128625455, 'mean_degree': 1.82509871008828, 'res_sz': 83, 'window': 0.08624009619381069, 'spect_rad': 0.003996871616303771, 'ridge_alpha': 0.007013681733502334}. 
[I 2024-09-24 17:52:00,733] Trial 16 finished with values: [1.0, 1.5724840901980421, 0.2, 50.0, 1.6458536514977935, 0.3, 50.0, 1.3308142550922937, 0.5555555555555556] and parameters: {'gamma': 490.2720578156643, 'sigma': 79.41910194323401, 'delta': 12.80944653491835, 'mean_degree': 1.982408222436421, 'res_sz': 11, 'window': 0.24111310939256747, 'spect_rad': 0.6766836609637955, 'ridge_alpha': 0.5568154117072761}. 
[I 2024-09-24 17:52:13,363] Trial 17 finished with values: [6.0, 1.2568493256919973, 0.2, 50.0, 2.109935421649328, 0.2, 50.0, 3.8484135534614903, 0.0] and parameters: {'gamma': 375.1548779931515, 'sigma': 17.90717912808529, 'delta': 89.6514733372018, 'mean_degree': 4.104769237414011, 'res_sz': 35, 'window': 0.2772515561232719, 'spect_rad': 10.106095363098227, 'ridge_alpha': 4.090243957781377}. 
[I 2024-09-24 17:52:26,580] Trial 18 finished with values: [1.0, 2.4167036333811525, 0.0, 2.0, 4235893743.726869, 0.0, 50.0, 2.92632394906659, 0.0] and parameters: {'gamma': 168.11758831119403, 'sigma': 43.03595135613161, 'delta': 37.1044515940178, 'mean_degree': 0.24174152079604083, 'res_sz': 46, 'window': 0.04510269234926431, 'spect_rad': 27.176386588031004, 'ridge_alpha': 2.9223590212012945e-06}. 
[I 2024-09-24 17:52:39,830] Trial 19 finished with values: [1.0, 2.4868954028093015, 0.2, 50.0, 1.325152078748823, 0.8, 50.0, 3.086532343377256, 0.4444444444444444] and parameters: {'gamma': 276.19034747399814, 'sigma': 72.8318879159131, 'delta': 26.111149745764223, 'mean_degree': 3.2253307460907275, 'res_sz': 58, 'window': 0.0053654478707559974, 'spect_rad': 0.09247580795777112, 'ridge_alpha': 0.2197287039271633}. 
[I 2024-09-24 17:52:54,873] Trial 20 finished with values: [1.0, 2.661029806248099, 0.0, 50.0, 1.0239428394156866, 0.9, 50.0, 1.0594189567091514, 0.8888888888888888] and parameters: {'gamma': 190.04452315339785, 'sigma': 78.52207491896328, 'delta': 16.99845488444138, 'mean_degree': 4.168843425884307, 'res_sz': 63, 'window': 0.07935374229821357, 'spect_rad': 0.039399671795081796, 'ridge_alpha': 3.6751659732472754e-07}. 
[I 2024-09-24 17:53:06,836] Trial 21 finished with values: [1.0, 2.410042524790687, 0.1, 50.0, 1.36223395039159, 0.5, 1.0, 19.523417140573354, 0.0] and parameters: {'gamma': 290.87783888276687, 'sigma': 34.99128428708336, 'delta': 51.5360611138767, 'mean_degree': 4.563718445059141, 'res_sz': 72, 'window': 0.004727015702494326, 'spect_rad': 0.026090153960826975, 'ridge_alpha': 0.0013370805198835607}. 
[I 2024-09-24 17:53:20,102] Trial 22 finished with values: [3.0, 1.408472713114782, 0.0, 50.0, 1.2815467756990955, 0.7, 50.0, 2.568415887496135, 0.4444444444444444] and parameters: {'gamma': 241.78350961299225, 'sigma': 86.45559994764575, 'delta': 49.32564595155854, 'mean_degree': 0.6442677153336706, 'res_sz': 31, 'window': 0.0019902090142315102, 'spect_rad': 0.0017276918665142874, 'ridge_alpha': 3.309899090749572e-10}. 
[I 2024-09-24 17:53:31,103] Trial 23 finished with values: [1.0, 1.4215142387668083, 0.1, 50.0, 1.319515504101531, 0.8, 1.0, 7.120636986406989, 0.0] and parameters: {'gamma': 380.32532963145616, 'sigma': 10.747854077483805, 'delta': 27.415851356116633, 'mean_degree': 4.185662695481347, 'res_sz': 64, 'window': 0.16772573641361413, 'spect_rad': 0.013334290715599387, 'ridge_alpha': 24.58661708982433}. 
[I 2024-09-24 17:53:42,663] Trial 24 finished with values: [1.0, 10800.221427179862, 1.0, 50.0, 1.5715071322126657, 0.5, 2.0, 9.282399254197331, 0.0] and parameters: {'gamma': 324.40240783609215, 'sigma': 37.989576171615944, 'delta': 47.04102909255588, 'mean_degree': 2.3976584438803323, 'res_sz': 79, 'window': 0.11158063510712206, 'spect_rad': 0.08331596822388955, 'ridge_alpha': 0.00021312170861800898}. 
[I 2024-09-24 17:53:49,736] A new study created in memory with name: SINDY predicting GenForecast[cml, LTSFLinearForecaster]
[I 2024-09-24 17:53:55,227] Trial 0 finished with values: [7.0, 23.695989337782805, 0.6, 8.0, 36.87302118024712, 0.0, 2.0, 39.59476103449145, 0.1111111111111111] and parameters: {'optimizer__threshold': 2.45815694699529e-05, 'optimizer__alpha': 1.9829595110322438, 'discrete_time': True, 'feature_library': 1, 'differentiation_method': 7}. 
[I 2024-09-24 17:54:00,685] Trial 1 finished with values: [7.0, 23.695989337782805, 0.6, 8.0, 36.87302118024712, 0.0, 2.0, 39.59476103449145, 0.1111111111111111] and parameters: {'optimizer__threshold': 0.009918054905137558, 'optimizer__alpha': 1.319202720421684, 'discrete_time': True, 'feature_library': 1, 'differentiation_method': 4}. 
[I 2024-09-24 17:54:13,483] Trial 2 finished with values: [2.0, 577.1034374704485, 0.0, 4.0, 369.5327477197319, 0.6, 3.0, 585.5713213586085, 0.4444444444444444] and parameters: {'optimizer__threshold': 0.7630660740622145, 'optimizer__alpha': 0.0516311484441616, 'discrete_time': False, 'feature_library': 1, 'differentiation_method': 3}. 
[I 2024-09-24 17:54:24,643] Trial 3 finished with values: [3.0, 1464.298355866427, 0.0, 32.0, 253.3518527664305, 0.3, 2.0, 778.9557976052679, 0.4444444444444444] and parameters: {'optimizer__threshold': 0.00026233302843202096, 'optimizer__alpha': 0.004953290807207985, 'discrete_time': False, 'feature_library': 1, 'differentiation_method': 2}. 
[I 2024-09-24 17:54:30,062] Trial 4 finished with values: [7.0, 23.695989337782805, 0.6, 8.0, 36.87302118024712, 0.0, 2.0, 39.59476103449145, 0.1111111111111111] and parameters: {'optimizer__threshold': 0.7358625885014861, 'optimizer__alpha': 3.316143912256656, 'discrete_time': True, 'feature_library': 1, 'differentiation_method': 3}. 
[I 2024-09-24 17:54:36,919] Trial 5 finished with values: [1.0, 2.4106522441540084, 0.1, 2.0, 4.2513539337000195, 0.3, 50.0, 1.1071325095931879, 0.8888888888888888] and parameters: {'optimizer__threshold': 0.020221312038818606, 'optimizer__alpha': 0.043026211174548946, 'discrete_time': False, 'feature_library': 0, 'differentiation_method': 3}. 
[I 2024-09-24 17:54:42,467] Trial 6 finished with values: [7.0, 23.695989337782805, 0.6, 8.0, 36.87302118024712, 0.0, 2.0, 39.59476103449145, 0.1111111111111111] and parameters: {'optimizer__threshold': 1.399756909758654, 'optimizer__alpha': 0.007542402857638508, 'discrete_time': True, 'feature_library': 1, 'differentiation_method': 0}. 
[I 2024-09-24 17:54:47,484] Trial 7 finished with values: [3.0, 979149348.7678843, 0.0, 4.0, 133110.52671766383, 0.3, 2.0, 3721997.9001476252, 0.5555555555555556] and parameters: {'optimizer__threshold': 0.05406790101638691, 'optimizer__alpha': 1.5593211392378694, 'discrete_time': True, 'feature_library': 0, 'differentiation_method': 1}. 
[I 2024-09-24 17:54:58,869] Trial 8 finished with values: [3.0, 1464.298355866427, 0.0, 32.0, 253.3518527664305, 0.3, 2.0, 778.9557976052679, 0.4444444444444444] and parameters: {'optimizer__threshold': 0.002003538329888781, 'optimizer__alpha': 0.02751627644621676, 'discrete_time': False, 'feature_library': 1, 'differentiation_method': 2}. 
/nas/longleaf/home/djpassey/.local/lib/python3.9/site-packages/pysindy/optimizers/stlsq.py:201: UserWarning: Sparsity parameter is too big (0.1) and eliminated all coefficients
  warnings.warn(
/nas/longleaf/home/djpassey/.local/lib/python3.9/site-packages/pysindy/optimizers/stlsq.py:201: UserWarning: Sparsity parameter is too big (0.1) and eliminated all coefficients
  warnings.warn(
/nas/longleaf/home/djpassey/.local/lib/python3.9/site-packages/pysindy/optimizers/stlsq.py:201: UserWarning: Sparsity parameter is too big (0.1) and eliminated all coefficients
  warnings.warn(
/nas/longleaf/home/djpassey/.local/lib/python3.9/site-packages/pysindy/optimizers/stlsq.py:201: UserWarning: Sparsity parameter is too big (0.1) and eliminated all coefficients
  warnings.warn(
/nas/longleaf/home/djpassey/.local/lib/python3.9/site-packages/pysindy/optimizers/stlsq.py:201: UserWarning: Sparsity parameter is too big (0.1) and eliminated all coefficients
  warnings.warn(
/nas/longleaf/home/djpassey/.local/lib/python3.9/site-packages/pysindy/optimizers/stlsq.py:201: UserWarning: Sparsity parameter is too big (0.1) and eliminated all coefficients
  warnings.warn(
/nas/longleaf/home/djpassey/.local/lib/python3.9/site-packages/pysindy/optimizers/stlsq.py:201: UserWarning: Sparsity parameter is too big (0.1) and eliminated all coefficients
  warnings.warn(
/nas/longleaf/home/djpassey/.local/lib/python3.9/site-packages/pysindy/optimizers/stlsq.py:201: UserWarning: Sparsity parameter is too big (0.1) and eliminated all coefficients
  warnings.warn(
/nas/longleaf/home/djpassey/.local/lib/python3.9/site-packages/pysindy/optimizers/stlsq.py:201: UserWarning: Sparsity parameter is too big (0.1) and eliminated all coefficients
  warnings.warn(
/nas/longleaf/home/djpassey/.local/lib/python3.9/site-packages/pysindy/optimizers/stlsq.py:201: UserWarning: Sparsity parameter is too big (0.1) and eliminated all coefficients
  warnings.warn(
/nas/longleaf/home/djpassey/.local/lib/python3.9/site-packages/pysindy/optimizers/stlsq.py:201: UserWarning: Sparsity parameter is too big (0.1) and eliminated all coefficients
  warnings.warn(
/nas/longleaf/home/djpassey/.local/lib/python3.9/site-packages/pysindy/optimizers/stlsq.py:201: UserWarning: Sparsity parameter is too big (0.1) and eliminated all coefficients
  warnings.warn(
[I 2024-09-24 17:55:04,669] Trial 9 finished with values: [1.0, 2.688174528870211, 0.1, 50.0, 1.142267031753447, 0.9, 30.0, 2.1011583654815005, 0.8888888888888888] and parameters: {'optimizer__threshold': 3.2967389651028842, 'optimizer__alpha': 3.614683334821398, 'discrete_time': False, 'feature_library': 0, 'differentiation_method': 5}. 
[I 2024-09-24 17:55:11,491] Trial 10 finished with values: [1.0, 2.4106522441540084, 0.1, 2.0, 4.2513539337000195, 0.3, 50.0, 1.1071325095931879, 0.8888888888888888] and parameters: {'optimizer__threshold': 3.2429418778158314e-05, 'optimizer__alpha': 0.0019916384638649087, 'discrete_time': False, 'feature_library': 0, 'differentiation_method': 3}. 
/nas/longleaf/home/djpassey/.local/lib/python3.9/site-packages/pysindy/optimizers/stlsq.py:201: UserWarning: Sparsity parameter is too big (0.1) and eliminated all coefficients
  warnings.warn(
/nas/longleaf/home/djpassey/.local/lib/python3.9/site-packages/pysindy/optimizers/stlsq.py:201: UserWarning: Sparsity parameter is too big (0.1) and eliminated all coefficients
  warnings.warn(
/nas/longleaf/home/djpassey/.local/lib/python3.9/site-packages/pysindy/optimizers/stlsq.py:201: UserWarning: Sparsity parameter is too big (0.1) and eliminated all coefficients
  warnings.warn(
/nas/longleaf/home/djpassey/.local/lib/python3.9/site-packages/pysindy/optimizers/stlsq.py:201: UserWarning: Sparsity parameter is too big (0.1) and eliminated all coefficients
  warnings.warn(
/nas/longleaf/home/djpassey/.local/lib/python3.9/site-packages/pysindy/optimizers/stlsq.py:201: UserWarning: Sparsity parameter is too big (0.1) and eliminated all coefficients
  warnings.warn(
/nas/longleaf/home/djpassey/.local/lib/python3.9/site-packages/pysindy/optimizers/stlsq.py:201: UserWarning: Sparsity parameter is too big (0.1) and eliminated all coefficients
  warnings.warn(
/nas/longleaf/home/djpassey/.local/lib/python3.9/site-packages/pysindy/optimizers/stlsq.py:201: UserWarning: Sparsity parameter is too big (0.1) and eliminated all coefficients
  warnings.warn(
/nas/longleaf/home/djpassey/.local/lib/python3.9/site-packages/pysindy/optimizers/stlsq.py:201: UserWarning: Sparsity parameter is too big (0.1) and eliminated all coefficients
  warnings.warn(
/nas/longleaf/home/djpassey/.local/lib/python3.9/site-packages/pysindy/optimizers/stlsq.py:201: UserWarning: Sparsity parameter is too big (0.1) and eliminated all coefficients
  warnings.warn(
/nas/longleaf/home/djpassey/.local/lib/python3.9/site-packages/pysindy/optimizers/stlsq.py:201: UserWarning: Sparsity parameter is too big (0.1) and eliminated all coefficients
  warnings.warn(
/nas/longleaf/home/djpassey/.local/lib/python3.9/site-packages/pysindy/optimizers/stlsq.py:201: UserWarning: Sparsity parameter is too big (0.1) and eliminated all coefficients
  warnings.warn(
/nas/longleaf/home/djpassey/.local/lib/python3.9/site-packages/pysindy/optimizers/stlsq.py:201: UserWarning: Sparsity parameter is too big (0.1) and eliminated all coefficients
  warnings.warn(
/nas/longleaf/home/djpassey/.local/lib/python3.9/site-packages/pysindy/optimizers/stlsq.py:201: UserWarning: Sparsity parameter is too big (0.1) and eliminated all coefficients
  warnings.warn(
/nas/longleaf/home/djpassey/.local/lib/python3.9/site-packages/pysindy/optimizers/stlsq.py:201: UserWarning: Sparsity parameter is too big (0.1) and eliminated all coefficients
  warnings.warn(
/nas/longleaf/home/djpassey/.local/lib/python3.9/site-packages/pysindy/optimizers/stlsq.py:201: UserWarning: Sparsity parameter is too big (0.1) and eliminated all coefficients
  warnings.warn(
/nas/longleaf/home/djpassey/.local/lib/python3.9/site-packages/pysindy/optimizers/stlsq.py:201: UserWarning: Sparsity parameter is too big (0.1) and eliminated all coefficients
  warnings.warn(
/nas/longleaf/home/djpassey/.local/lib/python3.9/site-packages/pysindy/optimizers/stlsq.py:201: UserWarning: Sparsity parameter is too big (0.1) and eliminated all coefficients
  warnings.warn(
/nas/longleaf/home/djpassey/.local/lib/python3.9/site-packages/pysindy/optimizers/stlsq.py:201: UserWarning: Sparsity parameter is too big (0.1) and eliminated all coefficients
  warnings.warn(
/nas/longleaf/home/djpassey/.local/lib/python3.9/site-packages/pysindy/optimizers/stlsq.py:201: UserWarning: Sparsity parameter is too big (0.1) and eliminated all coefficients
  warnings.warn(
[I 2024-09-24 17:55:17,760] Trial 11 finished with values: [1.0, 103.62949014485258, 0.1, 16.0, 6.378739326441169, 0.9, 16.0, 6.506046450187265, 0.8888888888888888] and parameters: {'optimizer__threshold': 0.0007914867348994895, 'optimizer__alpha': 3.260159456035518, 'discrete_time': False, 'feature_library': 1, 'differentiation_method': 5}. 
[I 2024-09-24 17:55:22,723] Trial 12 finished with values: [3.0, 979149348.7678843, 0.0, 4.0, 133110.52671766383, 0.3, 2.0, 3721997.9001476252, 0.5555555555555556] and parameters: {'optimizer__threshold': 0.1486027679982442, 'optimizer__alpha': 0.2882875457936794, 'discrete_time': True, 'feature_library': 0, 'differentiation_method': 4}. 
[I 2024-09-24 17:55:28,183] Trial 13 finished with values: [7.0, 23.695989337782805, 0.6, 8.0, 36.87302118024712, 0.0, 2.0, 39.59476103449145, 0.1111111111111111] and parameters: {'optimizer__threshold': 0.18272297400917323, 'optimizer__alpha': 6.39130980493629e-05, 'discrete_time': True, 'feature_library': 1, 'differentiation_method': 2}. 
[I 2024-09-24 17:55:35,295] Trial 14 finished with values: [1.0, 2.4106522441540084, 0.1, 50.0, 3.538880852571194, 0.6, 50.0, 1.1071325095931879, 0.8888888888888888] and parameters: {'optimizer__threshold': 0.00016039443462636797, 'optimizer__alpha': 2.4089664356970376e-05, 'discrete_time': False, 'feature_library': 0, 'differentiation_method': 4}. 
/nas/longleaf/home/djpassey/.local/lib/python3.9/site-packages/pysindy/optimizers/stlsq.py:201: UserWarning: Sparsity parameter is too big (0.1) and eliminated all coefficients
  warnings.warn(
/nas/longleaf/home/djpassey/.local/lib/python3.9/site-packages/pysindy/optimizers/stlsq.py:201: UserWarning: Sparsity parameter is too big (0.1) and eliminated all coefficients
  warnings.warn(
[I 2024-09-24 17:55:43,671] Trial 15 finished with values: [1.0, 117.4109017705423, 0.0, 5.0, 10.07051196353572, 0.6, 2.0, 6.960018913619916, 0.5555555555555556] and parameters: {'optimizer__threshold': 0.009381656107275437, 'optimizer__alpha': 0.006290128847329438, 'discrete_time': False, 'feature_library': 0, 'differentiation_method': 7}. 
[I 2024-09-24 17:55:48,685] Trial 16 finished with values: [3.0, 979149348.7678843, 0.0, 4.0, 133110.52671766383, 0.3, 2.0, 3721997.9001476252, 0.5555555555555556] and parameters: {'optimizer__threshold': 1.2143344205909979e-05, 'optimizer__alpha': 0.0003416130721146362, 'discrete_time': True, 'feature_library': 0, 'differentiation_method': 6}. 
