[I 2024-09-25 12:44:31,755] Trial 18 finished with values: [1.0, 532884468.35207546, 1.0, 50.0, 1.2196555723234825, 0.0, 50.0, 1.178565166327212, 0.2222222222222222] and parameters: {'gamma': 363.20929342074476, 'sigma': 97.59230978073342, 'delta': 96.08569029151023, 'mean_degree': 3.9599139534025674, 'res_sz': 68, 'window': 0.012658527749774608, 'spect_rad': 0.05846080081838649, 'ridge_alpha': 2.6295877912464922e-09}. 
[I 2024-09-25 12:44:42,029] Trial 19 finished with values: [150.0, 0.9054055848438771, 0.3, 50.0, 0.9069720313224192, 0.3, 50.0, 0.9747748387913012, 0.5555555555555556] and parameters: {'gamma': 323.81392084022644, 'sigma': 80.82866139029765, 'delta': 47.18202396806342, 'mean_degree': 1.422738918426917, 'res_sz': 11, 'window': 0.0021471816703191775, 'spect_rad': 0.41843933734753647, 'ridge_alpha': 9.517741221286723e-05}. 
[I 2024-09-25 12:44:53,401] Trial 20 finished with values: [1.0, 1.0994979768962299, 0.3, 50.0, 1.2017932382062546, 0.0, 50.0, 1.2350200886116518, 0.0] and parameters: {'gamma': 303.2279902186777, 'sigma': 70.82733764794759, 'delta': 76.66883398892763, 'mean_degree': 0.5631099617928017, 'res_sz': 74, 'window': 0.30102092736715547, 'spect_rad': 0.06703606608976606, 'ridge_alpha': 0.012114180540656532}. 
[I 2024-09-25 12:45:04,724] Trial 21 finished with values: [150.0, 1.0903805159118796, 0.4, 2.0, 2.8331318682602804, 0.0, 50.0, 1.1106271079602896, 0.0] and parameters: {'gamma': 484.13706299177323, 'sigma': 79.53463754347352, 'delta': 54.39241273962095, 'mean_degree': 0.17543226380006105, 'res_sz': 78, 'window': 0.24364474757631124, 'spect_rad': 0.1083374219650087, 'ridge_alpha': 56.4091673887092}. 
[I 2024-09-25 12:45:16,126] Trial 22 finished with values: [1.0, 3.1745381536944945, 0.0, 2.0, 10.759297256582794, 0.0, 1.0, 8.612754302010687, 0.0] and parameters: {'gamma': 160.6325482334457, 'sigma': 62.67277588992314, 'delta': 71.48971826638562, 'mean_degree': 4.234442705390723, 'res_sz': 64, 'window': 0.07094064730765057, 'spect_rad': 64.45728211231715, 'ridge_alpha': 1.3009891581036205e-05}. 
[I 2024-09-25 12:45:28,084] Trial 23 finished with values: [2.0, 10.69378511091351, 0.0, 50.0, 1.0603055257251817, 0.3, 2.0, 3.363528259988297, 0.0] and parameters: {'gamma': 430.40167351019437, 'sigma': 80.89756687030675, 'delta': 49.035200997163116, 'mean_degree': 4.290725687668607, 'res_sz': 82, 'window': 0.023010355479183984, 'spect_rad': 0.001405209311410813, 'ridge_alpha': 33.395144432579634}. 
[I 2024-09-25 12:45:39,898] Trial 24 finished with values: [1.0, 1603.0158964967002, 1.0, 50.0, 1.2053873948097973, 0.0, 2.0, 3.7219353042095986, 0.0] and parameters: {'gamma': 186.91800985284115, 'sigma': 71.29847786834289, 'delta': 12.533818704113235, 'mean_degree': 3.3741924190716563, 'res_sz': 99, 'window': 0.38317648476878907, 'spect_rad': 0.003917569393813474, 'ridge_alpha': 6.312519563027138e-05}. 
SLURM auto-requeueing enabled. Setting signal handlers.
SLURM auto-requeueing enabled. Setting signal handlers.
SLURM auto-requeueing enabled. Setting signal handlers.
SLURM auto-requeueing enabled. Setting signal handlers.
SLURM auto-requeueing enabled. Setting signal handlers.
SLURM auto-requeueing enabled. Setting signal handlers.
SLURM auto-requeueing enabled. Setting signal handlers.
SLURM auto-requeueing enabled. Setting signal handlers.
SLURM auto-requeueing enabled. Setting signal handlers.
SLURM auto-requeueing enabled. Setting signal handlers.
SLURM auto-requeueing enabled. Setting signal handlers.
SLURM auto-requeueing enabled. Setting signal handlers.
SLURM auto-requeueing enabled. Setting signal handlers.
SLURM auto-requeueing enabled. Setting signal handlers.
SLURM auto-requeueing enabled. Setting signal handlers.
SLURM auto-requeueing enabled. Setting signal handlers.
SLURM auto-requeueing enabled. Setting signal handlers.
SLURM auto-requeueing enabled. Setting signal handlers.
SLURM auto-requeueing enabled. Setting signal handlers.
SLURM auto-requeueing enabled. Setting signal handlers.
SLURM auto-requeueing enabled. Setting signal handlers.
SLURM auto-requeueing enabled. Setting signal handlers.
SLURM auto-requeueing enabled. Setting signal handlers.
SLURM auto-requeueing enabled. Setting signal handlers.
SLURM auto-requeueing enabled. Setting signal handlers.
SLURM auto-requeueing enabled. Setting signal handlers.
SLURM auto-requeueing enabled. Setting signal handlers.
SLURM auto-requeueing enabled. Setting signal handlers.
SLURM auto-requeueing enabled. Setting signal handlers.
SLURM auto-requeueing enabled. Setting signal handlers.
SLURM auto-requeueing enabled. Setting signal handlers.
SLURM auto-requeueing enabled. Setting signal handlers.
SLURM auto-requeueing enabled. Setting signal handlers.
SLURM auto-requeueing enabled. Setting signal handlers.
SLURM auto-requeueing enabled. Setting signal handlers.
SLURM auto-requeueing enabled. Setting signal handlers.
SLURM auto-requeueing enabled. Setting signal handlers.
SLURM auto-requeueing enabled. Setting signal handlers.
SLURM auto-requeueing enabled. Setting signal handlers.
SLURM auto-requeueing enabled. Setting signal handlers.
SLURM auto-requeueing enabled. Setting signal handlers.
SLURM auto-requeueing enabled. Setting signal handlers.
SLURM auto-requeueing enabled. Setting signal handlers.
SLURM auto-requeueing enabled. Setting signal handlers.
SLURM auto-requeueing enabled. Setting signal handlers.
SLURM auto-requeueing enabled. Setting signal handlers.
SLURM auto-requeueing enabled. Setting signal handlers.
SLURM auto-requeueing enabled. Setting signal handlers.
SLURM auto-requeueing enabled. Setting signal handlers.
SLURM auto-requeueing enabled. Setting signal handlers.
SLURM auto-requeueing enabled. Setting signal handlers.
SLURM auto-requeueing enabled. Setting signal handlers.
SLURM auto-requeueing enabled. Setting signal handlers.
SLURM auto-requeueing enabled. Setting signal handlers.
SLURM auto-requeueing enabled. Setting signal handlers.
SLURM auto-requeueing enabled. Setting signal handlers.
SLURM auto-requeueing enabled. Setting signal handlers.
SLURM auto-requeueing enabled. Setting signal handlers.
SLURM auto-requeueing enabled. Setting signal handlers.
SLURM auto-requeueing enabled. Setting signal handlers.
SLURM auto-requeueing enabled. Setting signal handlers.
SLURM auto-requeueing enabled. Setting signal handlers.
SLURM auto-requeueing enabled. Setting signal handlers.
SLURM auto-requeueing enabled. Setting signal handlers.
SLURM auto-requeueing enabled. Setting signal handlers.
SLURM auto-requeueing enabled. Setting signal handlers.
SLURM auto-requeueing enabled. Setting signal handlers.
SLURM auto-requeueing enabled. Setting signal handlers.
SLURM auto-requeueing enabled. Setting signal handlers.
SLURM auto-requeueing enabled. Setting signal handlers.
SLURM auto-requeueing enabled. Setting signal handlers.
SLURM auto-requeueing enabled. Setting signal handlers.
SLURM auto-requeueing enabled. Setting signal handlers.
SLURM auto-requeueing enabled. Setting signal handlers.
SLURM auto-requeueing enabled. Setting signal handlers.
SLURM auto-requeueing enabled. Setting signal handlers.
SLURM auto-requeueing enabled. Setting signal handlers.
SLURM auto-requeueing enabled. Setting signal handlers.
SLURM auto-requeueing enabled. Setting signal handlers.
SLURM auto-requeueing enabled. Setting signal handlers.
SLURM auto-requeueing enabled. Setting signal handlers.
SLURM auto-requeueing enabled. Setting signal handlers.
SLURM auto-requeueing enabled. Setting signal handlers.
SLURM auto-requeueing enabled. Setting signal handlers.
SLURM auto-requeueing enabled. Setting signal handlers.
SLURM auto-requeueing enabled. Setting signal handlers.
SLURM auto-requeueing enabled. Setting signal handlers.
SLURM auto-requeueing enabled. Setting signal handlers.
SLURM auto-requeueing enabled. Setting signal handlers.
SLURM auto-requeueing enabled. Setting signal handlers.
SLURM auto-requeueing enabled. Setting signal handlers.
SLURM auto-requeueing enabled. Setting signal handlers.
SLURM auto-requeueing enabled. Setting signal handlers.
SLURM auto-requeueing enabled. Setting signal handlers.
SLURM auto-requeueing enabled. Setting signal handlers.
SLURM auto-requeueing enabled. Setting signal handlers.
SLURM auto-requeueing enabled. Setting signal handlers.
SLURM auto-requeueing enabled. Setting signal handlers.
SLURM auto-requeueing enabled. Setting signal handlers.
SLURM auto-requeueing enabled. Setting signal handlers.
SLURM auto-requeueing enabled. Setting signal handlers.
SLURM auto-requeueing enabled. Setting signal handlers.
SLURM auto-requeueing enabled. Setting signal handlers.
SLURM auto-requeueing enabled. Setting signal handlers.
SLURM auto-requeueing enabled. Setting signal handlers.
SLURM auto-requeueing enabled. Setting signal handlers.
SLURM auto-requeueing enabled. Setting signal handlers.
SLURM auto-requeueing enabled. Setting signal handlers.
SLURM auto-requeueing enabled. Setting signal handlers.
SLURM auto-requeueing enabled. Setting signal handlers.
SLURM auto-requeueing enabled. Setting signal handlers.
SLURM auto-requeueing enabled. Setting signal handlers.
SLURM auto-requeueing enabled. Setting signal handlers.
SLURM auto-requeueing enabled. Setting signal handlers.
SLURM auto-requeueing enabled. Setting signal handlers.
SLURM auto-requeueing enabled. Setting signal handlers.
SLURM auto-requeueing enabled. Setting signal handlers.
SLURM auto-requeueing enabled. Setting signal handlers.
SLURM auto-requeueing enabled. Setting signal handlers.
SLURM auto-requeueing enabled. Setting signal handlers.
SLURM auto-requeueing enabled. Setting signal handlers.
SLURM auto-requeueing enabled. Setting signal handlers.
SLURM auto-requeueing enabled. Setting signal handlers.
SLURM auto-requeueing enabled. Setting signal handlers.
SLURM auto-requeueing enabled. Setting signal handlers.
SLURM auto-requeueing enabled. Setting signal handlers.
SLURM auto-requeueing enabled. Setting signal handlers.
SLURM auto-requeueing enabled. Setting signal handlers.
SLURM auto-requeueing enabled. Setting signal handlers.
SLURM auto-requeueing enabled. Setting signal handlers.
SLURM auto-requeueing enabled. Setting signal handlers.
SLURM auto-requeueing enabled. Setting signal handlers.
SLURM auto-requeueing enabled. Setting signal handlers.
SLURM auto-requeueing enabled. Setting signal handlers.
SLURM auto-requeueing enabled. Setting signal handlers.
SLURM auto-requeueing enabled. Setting signal handlers.
SLURM auto-requeueing enabled. Setting signal handlers.
SLURM auto-requeueing enabled. Setting signal handlers.
SLURM auto-requeueing enabled. Setting signal handlers.
SLURM auto-requeueing enabled. Setting signal handlers.
SLURM auto-requeueing enabled. Setting signal handlers.
SLURM auto-requeueing enabled. Setting signal handlers.
SLURM auto-requeueing enabled. Setting signal handlers.
SLURM auto-requeueing enabled. Setting signal handlers.
SLURM auto-requeueing enabled. Setting signal handlers.
SLURM auto-requeueing enabled. Setting signal handlers.
SLURM auto-requeueing enabled. Setting signal handlers.
SLURM auto-requeueing enabled. Setting signal handlers.
SLURM auto-requeueing enabled. Setting signal handlers.
SLURM auto-requeueing enabled. Setting signal handlers.
SLURM auto-requeueing enabled. Setting signal handlers.
SLURM auto-requeueing enabled. Setting signal handlers.
SLURM auto-requeueing enabled. Setting signal handlers.
SLURM auto-requeueing enabled. Setting signal handlers.
SLURM auto-requeueing enabled. Setting signal handlers.
SLURM auto-requeueing enabled. Setting signal handlers.
SLURM auto-requeueing enabled. Setting signal handlers.
SLURM auto-requeueing enabled. Setting signal handlers.
SLURM auto-requeueing enabled. Setting signal handlers.
SLURM auto-requeueing enabled. Setting signal handlers.
SLURM auto-requeueing enabled. Setting signal handlers.
SLURM auto-requeueing enabled. Setting signal handlers.
SLURM auto-requeueing enabled. Setting signal handlers.
SLURM auto-requeueing enabled. Setting signal handlers.
SLURM auto-requeueing enabled. Setting signal handlers.
SLURM auto-requeueing enabled. Setting signal handlers.
SLURM auto-requeueing enabled. Setting signal handlers.
SLURM auto-requeueing enabled. Setting signal handlers.
SLURM auto-requeueing enabled. Setting signal handlers.
SLURM auto-requeueing enabled. Setting signal handlers.
SLURM auto-requeueing enabled. Setting signal handlers.
SLURM auto-requeueing enabled. Setting signal handlers.
SLURM auto-requeueing enabled. Setting signal handlers.
SLURM auto-requeueing enabled. Setting signal handlers.
SLURM auto-requeueing enabled. Setting signal handlers.
SLURM auto-requeueing enabled. Setting signal handlers.
SLURM auto-requeueing enabled. Setting signal handlers.
SLURM auto-requeueing enabled. Setting signal handlers.
SLURM auto-requeueing enabled. Setting signal handlers.
SLURM auto-requeueing enabled. Setting signal handlers.
SLURM auto-requeueing enabled. Setting signal handlers.
SLURM auto-requeueing enabled. Setting signal handlers.
SLURM auto-requeueing enabled. Setting signal handlers.
SLURM auto-requeueing enabled. Setting signal handlers.
SLURM auto-requeueing enabled. Setting signal handlers.
SLURM auto-requeueing enabled. Setting signal handlers.
SLURM auto-requeueing enabled. Setting signal handlers.
SLURM auto-requeueing enabled. Setting signal handlers.
SLURM auto-requeueing enabled. Setting signal handlers.
SLURM auto-requeueing enabled. Setting signal handlers.
SLURM auto-requeueing enabled. Setting signal handlers.
SLURM auto-requeueing enabled. Setting signal handlers.
SLURM auto-requeueing enabled. Setting signal handlers.
SLURM auto-requeueing enabled. Setting signal handlers.
SLURM auto-requeueing enabled. Setting signal handlers.
SLURM auto-requeueing enabled. Setting signal handlers.
SLURM auto-requeueing enabled. Setting signal handlers.
SLURM auto-requeueing enabled. Setting signal handlers.
SLURM auto-requeueing enabled. Setting signal handlers.
SLURM auto-requeueing enabled. Setting signal handlers.
SLURM auto-requeueing enabled. Setting signal handlers.
SLURM auto-requeueing enabled. Setting signal handlers.
SLURM auto-requeueing enabled. Setting signal handlers.
SLURM auto-requeueing enabled. Setting signal handlers.
SLURM auto-requeueing enabled. Setting signal handlers.
SLURM auto-requeueing enabled. Setting signal handlers.
SLURM auto-requeueing enabled. Setting signal handlers.
SLURM auto-requeueing enabled. Setting signal handlers.
SLURM auto-requeueing enabled. Setting signal handlers.
SLURM auto-requeueing enabled. Setting signal handlers.
SLURM auto-requeueing enabled. Setting signal handlers.
SLURM auto-requeueing enabled. Setting signal handlers.
SLURM auto-requeueing enabled. Setting signal handlers.
SLURM auto-requeueing enabled. Setting signal handlers.
SLURM auto-requeueing enabled. Setting signal handlers.
SLURM auto-requeueing enabled. Setting signal handlers.
SLURM auto-requeueing enabled. Setting signal handlers.
SLURM auto-requeueing enabled. Setting signal handlers.
SLURM auto-requeueing enabled. Setting signal handlers.
SLURM auto-requeueing enabled. Setting signal handlers.
SLURM auto-requeueing enabled. Setting signal handlers.
SLURM auto-requeueing enabled. Setting signal handlers.
SLURM auto-requeueing enabled. Setting signal handlers.
SLURM auto-requeueing enabled. Setting signal handlers.
SLURM auto-requeueing enabled. Setting signal handlers.
SLURM auto-requeueing enabled. Setting signal handlers.
SLURM auto-requeueing enabled. Setting signal handlers.
SLURM auto-requeueing enabled. Setting signal handlers.
SLURM auto-requeueing enabled. Setting signal handlers.
SLURM auto-requeueing enabled. Setting signal handlers.
SLURM auto-requeueing enabled. Setting signal handlers.
SLURM auto-requeueing enabled. Setting signal handlers.
SLURM auto-requeueing enabled. Setting signal handlers.
SLURM auto-requeueing enabled. Setting signal handlers.
SLURM auto-requeueing enabled. Setting signal handlers.
SLURM auto-requeueing enabled. Setting signal handlers.
SLURM auto-requeueing enabled. Setting signal handlers.
SLURM auto-requeueing enabled. Setting signal handlers.
SLURM auto-requeueing enabled. Setting signal handlers.
SLURM auto-requeueing enabled. Setting signal handlers.
SLURM auto-requeueing enabled. Setting signal handlers.
SLURM auto-requeueing enabled. Setting signal handlers.
SLURM auto-requeueing enabled. Setting signal handlers.
SLURM auto-requeueing enabled. Setting signal handlers.
SLURM auto-requeueing enabled. Setting signal handlers.
SLURM auto-requeueing enabled. Setting signal handlers.
SLURM auto-requeueing enabled. Setting signal handlers.
[I 2024-09-25 12:46:22,910] A new study created in memory with name: SINDY predicting GenForecast[cml, NHITS]
[I 2024-09-25 12:46:28,254] Trial 0 finished with values: [12.0, 2.9063851957967564, 0.0, 50.0, 0.42197417090615275, 1.0, 3.0, 62925.94156669015, 0.0] and parameters: {'optimizer__threshold': 7.186730920497789e-05, 'optimizer__alpha': 3.8987328825824967, 'discrete_time': True, 'feature_library': 0, 'differentiation_method': 8}. 
[I 2024-09-25 12:47:03,770] Trial 1 finished with values: [1.0, 4612.910736648993, 0.0, 1.0, 1443.3672436880381, 0.0, 1.0, 2528.11064797924, 0.0] and parameters: {'optimizer__threshold': 0.9257125074259432, 'optimizer__alpha': 1.960428354467937e-05, 'discrete_time': False, 'feature_library': 1, 'differentiation_method': 5}. 
[I 2024-09-25 12:47:22,042] Trial 2 finished with values: [1.0, 9220.144586049271, 0.1, 2.0, 2191.317888085608, 0.1, 1.0, 664.1805132020983, 0.1111111111111111] and parameters: {'optimizer__threshold': 0.09945238071312124, 'optimizer__alpha': 1.978620164944828e-05, 'discrete_time': False, 'feature_library': 1, 'differentiation_method': 2}. 
[I 2024-09-25 12:47:27,348] Trial 3 finished with values: [5.0, 23.376011232926075, 0.1, 8.0, 23.489503617844175, 0.3, 2.0, 22.926280325898365, 0.3333333333333333] and parameters: {'optimizer__threshold': 0.2942654862225812, 'optimizer__alpha': 0.8263857593330728, 'discrete_time': True, 'feature_library': 1, 'differentiation_method': 5}. 
[I 2024-09-25 12:47:32,565] Trial 4 finished with values: [5.0, 23.376011232926075, 0.1, 8.0, 23.489503617844175, 0.3, 2.0, 22.926280325898365, 0.3333333333333333] and parameters: {'optimizer__threshold': 0.0003871285738858155, 'optimizer__alpha': 0.0017205631875506363, 'discrete_time': True, 'feature_library': 1, 'differentiation_method': 5}. 
[I 2024-09-25 12:47:38,062] Trial 5 finished with values: [12.0, 2.9063851957967564, 0.0, 50.0, 0.42197417090615275, 1.0, 3.0, 62925.94156669015, 0.0] and parameters: {'optimizer__threshold': 0.13262238716035218, 'optimizer__alpha': 0.013062598275502156, 'discrete_time': True, 'feature_library': 0, 'differentiation_method': 0}. 
[I 2024-09-25 12:47:43,508] Trial 6 finished with values: [12.0, 2.9063851957967564, 0.0, 50.0, 0.42197417090615275, 1.0, 3.0, 62925.94156669015, 0.0] and parameters: {'optimizer__threshold': 4.20455734965624, 'optimizer__alpha': 0.06534565802735404, 'discrete_time': True, 'feature_library': 0, 'differentiation_method': 3}. 
[I 2024-09-25 12:47:48,735] Trial 7 finished with values: [5.0, 23.376011232926075, 0.1, 8.0, 23.489503617844175, 0.3, 2.0, 22.926280325898365, 0.3333333333333333] and parameters: {'optimizer__threshold': 0.0017262777495063884, 'optimizer__alpha': 0.0009143755872171812, 'discrete_time': True, 'feature_library': 1, 'differentiation_method': 3}. 
[I 2024-09-25 12:47:54,184] Trial 8 finished with values: [12.0, 2.9063851957967564, 0.0, 50.0, 0.42197417090615275, 1.0, 3.0, 62925.94156669015, 0.0] and parameters: {'optimizer__threshold': 2.740450146116259e-05, 'optimizer__alpha': 0.0007677370716675646, 'discrete_time': True, 'feature_library': 0, 'differentiation_method': 8}. 
[I 2024-09-25 12:47:59,105] Trial 9 finished with values: [5.0, 23.376011232926075, 0.1, 8.0, 23.489503617844175, 0.3, 2.0, 22.926280325898365, 0.3333333333333333] and parameters: {'optimizer__threshold': 0.00016175574525832377, 'optimizer__alpha': 2.6983973367510307e-05, 'discrete_time': True, 'feature_library': 1, 'differentiation_method': 4}. 
/nas/longleaf/home/djpassey/.local/lib/python3.9/site-packages/pysindy/optimizers/stlsq.py:201: UserWarning: Sparsity parameter is too big (0.1) and eliminated all coefficients
  warnings.warn(
/nas/longleaf/home/djpassey/.local/lib/python3.9/site-packages/pysindy/optimizers/stlsq.py:201: UserWarning: Sparsity parameter is too big (0.1) and eliminated all coefficients
  warnings.warn(
/nas/longleaf/home/djpassey/.local/lib/python3.9/site-packages/pysindy/optimizers/stlsq.py:201: UserWarning: Sparsity parameter is too big (0.1) and eliminated all coefficients
  warnings.warn(
/nas/longleaf/home/djpassey/.local/lib/python3.9/site-packages/pysindy/optimizers/stlsq.py:201: UserWarning: Sparsity parameter is too big (0.1) and eliminated all coefficients
  warnings.warn(
[I 2024-09-25 12:48:06,712] Trial 10 finished with values: [1.0, 1.405476013417643, 0.2, 50.0, 1.2079871734223189, 0.0, 50.0, 1.2061088317543296, 0.0] and parameters: {'optimizer__threshold': 0.15743425871199937, 'optimizer__alpha': 0.0009361473945260596, 'discrete_time': False, 'feature_library': 0, 'differentiation_method': 8}. 
[I 2024-09-25 12:48:12,128] Trial 11 finished with values: [12.0, 2.9063851957967564, 0.0, 50.0, 0.42197417090615275, 1.0, 3.0, 62925.94156669015, 0.0] and parameters: {'optimizer__threshold': 0.0008161196045498245, 'optimizer__alpha': 0.003624227072385711, 'discrete_time': True, 'feature_library': 0, 'differentiation_method': 8}. 
[I 2024-09-25 12:48:45,023] Trial 12 finished with values: [1.0, 4754.700882973665, 0.0, 1.0, 1253.2411570484558, 0.0, 1.0, 1121.0965016033401, 0.0] and parameters: {'optimizer__threshold': 0.027413085537569243, 'optimizer__alpha': 0.007159970886819011, 'discrete_time': False, 'feature_library': 1, 'differentiation_method': 3}. 
