[I 2024-09-24 23:56:03,516] Trial 17 finished with values: [9.0, 22.700877511901954, 0.4, 14.0, 31.109323321984856, 0.8, 3.0, 59.3338518362489, 0.5555555555555556] and parameters: {'optimizer__threshold': 1.0252932702319886e-05, 'optimizer__alpha': 0.09984729772876225, 'discrete_time': True, 'feature_library': 1, 'differentiation_method': 5}. 
/nas/longleaf/home/djpassey/.local/lib/python3.9/site-packages/pysindy/optimizers/stlsq.py:201: UserWarning: Sparsity parameter is too big (0.1) and eliminated all coefficients
  warnings.warn(
/nas/longleaf/home/djpassey/.local/lib/python3.9/site-packages/pysindy/optimizers/stlsq.py:201: UserWarning: Sparsity parameter is too big (0.1) and eliminated all coefficients
  warnings.warn(
/nas/longleaf/home/djpassey/.local/lib/python3.9/site-packages/pysindy/optimizers/stlsq.py:201: UserWarning: Sparsity parameter is too big (0.1) and eliminated all coefficients
  warnings.warn(
/nas/longleaf/home/djpassey/.local/lib/python3.9/site-packages/pysindy/optimizers/stlsq.py:201: UserWarning: Sparsity parameter is too big (0.1) and eliminated all coefficients
  warnings.warn(
/nas/longleaf/home/djpassey/.local/lib/python3.9/site-packages/pysindy/optimizers/stlsq.py:201: UserWarning: Sparsity parameter is too big (0.1) and eliminated all coefficients
  warnings.warn(
/nas/longleaf/home/djpassey/.local/lib/python3.9/site-packages/pysindy/optimizers/stlsq.py:201: UserWarning: Sparsity parameter is too big (0.1) and eliminated all coefficients
  warnings.warn(
/nas/longleaf/home/djpassey/.local/lib/python3.9/site-packages/pysindy/optimizers/stlsq.py:201: UserWarning: Sparsity parameter is too big (0.1) and eliminated all coefficients
  warnings.warn(
/nas/longleaf/home/djpassey/.local/lib/python3.9/site-packages/pysindy/optimizers/stlsq.py:201: UserWarning: Sparsity parameter is too big (0.1) and eliminated all coefficients
  warnings.warn(
[I 2024-09-24 23:56:11,170] Trial 18 finished with values: [2.0, 3.278180639777441, 0.0, 50.0, 2.3800422361551394, 0.2, 50.0, 3.5533491905672308, 0.3333333333333333] and parameters: {'optimizer__threshold': 0.03667688432637065, 'optimizer__alpha': 1.6805410253788084e-05, 'discrete_time': False, 'feature_library': 0, 'differentiation_method': 7}. 
[I 2024-09-24 23:56:16,623] Trial 19 finished with values: [9.0, 22.700877511901954, 0.4, 14.0, 31.109323321984856, 0.8, 3.0, 59.3338518362489, 0.5555555555555556] and parameters: {'optimizer__threshold': 0.6613920825906505, 'optimizer__alpha': 0.024977401037944325, 'discrete_time': True, 'feature_library': 1, 'differentiation_method': 8}. 
[I 2024-09-24 23:56:21,963] Trial 20 finished with values: [4.0, 403385.8916533743, 0.0, 16.0, 52103.71159341639, 0.0, 1.0, 540304.7645372198, 0.4444444444444444] and parameters: {'optimizer__threshold': 0.000174028449312749, 'optimizer__alpha': 0.000557566940519541, 'discrete_time': True, 'feature_library': 0, 'differentiation_method': 3}. 
[I 2024-09-24 23:56:27,536] Trial 21 finished with values: [9.0, 22.700877511901954, 0.4, 14.0, 31.109323321984856, 0.8, 3.0, 59.3338518362489, 0.5555555555555556] and parameters: {'optimizer__threshold': 0.011883841638249943, 'optimizer__alpha': 2.497796556795352e-05, 'discrete_time': True, 'feature_library': 1, 'differentiation_method': 1}. 
[I 2024-09-24 23:56:32,748] Trial 22 finished with values: [4.0, 403385.8916533743, 0.0, 16.0, 52103.71159341639, 0.0, 1.0, 540304.7645372198, 0.4444444444444444] and parameters: {'optimizer__threshold': 0.3413287768098735, 'optimizer__alpha': 0.107944354080226, 'discrete_time': True, 'feature_library': 0, 'differentiation_method': 6}. 
[I 2024-09-24 23:56:44,914] Trial 23 finished with values: [2.0, 301.1549858869012, 0.2, 3.0, 255.87338520652108, 0.1, 2.0, 921.0343949789838, 0.2222222222222222] and parameters: {'optimizer__threshold': 0.0032688390471414556, 'optimizer__alpha': 0.6239982590029689, 'discrete_time': False, 'feature_library': 1, 'differentiation_method': 1}. 
[I 2024-09-24 23:56:54,944] Trial 24 finished with values: [2.0, 798.0958129802111, 0.0, 42.0, 5.760887557171462, 0.9, 1.0, 1675.9350374428866, 0.3333333333333333] and parameters: {'optimizer__threshold': 0.15317222767495078, 'optimizer__alpha': 0.00044645095087825286, 'discrete_time': False, 'feature_library': 1, 'differentiation_method': 0}. 
SLURM auto-requeueing enabled. Setting signal handlers.
SLURM auto-requeueing enabled. Setting signal handlers.
SLURM auto-requeueing enabled. Setting signal handlers.
SLURM auto-requeueing enabled. Setting signal handlers.
SLURM auto-requeueing enabled. Setting signal handlers.
SLURM auto-requeueing enabled. Setting signal handlers.
SLURM auto-requeueing enabled. Setting signal handlers.
SLURM auto-requeueing enabled. Setting signal handlers.
SLURM auto-requeueing enabled. Setting signal handlers.
SLURM auto-requeueing enabled. Setting signal handlers.
SLURM auto-requeueing enabled. Setting signal handlers.
SLURM auto-requeueing enabled. Setting signal handlers.
SLURM auto-requeueing enabled. Setting signal handlers.
SLURM auto-requeueing enabled. Setting signal handlers.
SLURM auto-requeueing enabled. Setting signal handlers.
SLURM auto-requeueing enabled. Setting signal handlers.
SLURM auto-requeueing enabled. Setting signal handlers.
SLURM auto-requeueing enabled. Setting signal handlers.
SLURM auto-requeueing enabled. Setting signal handlers.
SLURM auto-requeueing enabled. Setting signal handlers.
SLURM auto-requeueing enabled. Setting signal handlers.
SLURM auto-requeueing enabled. Setting signal handlers.
SLURM auto-requeueing enabled. Setting signal handlers.
SLURM auto-requeueing enabled. Setting signal handlers.
SLURM auto-requeueing enabled. Setting signal handlers.
SLURM auto-requeueing enabled. Setting signal handlers.
SLURM auto-requeueing enabled. Setting signal handlers.
SLURM auto-requeueing enabled. Setting signal handlers.
SLURM auto-requeueing enabled. Setting signal handlers.
SLURM auto-requeueing enabled. Setting signal handlers.
SLURM auto-requeueing enabled. Setting signal handlers.
SLURM auto-requeueing enabled. Setting signal handlers.
SLURM auto-requeueing enabled. Setting signal handlers.
SLURM auto-requeueing enabled. Setting signal handlers.
SLURM auto-requeueing enabled. Setting signal handlers.
SLURM auto-requeueing enabled. Setting signal handlers.
SLURM auto-requeueing enabled. Setting signal handlers.
SLURM auto-requeueing enabled. Setting signal handlers.
SLURM auto-requeueing enabled. Setting signal handlers.
SLURM auto-requeueing enabled. Setting signal handlers.
SLURM auto-requeueing enabled. Setting signal handlers.
SLURM auto-requeueing enabled. Setting signal handlers.
SLURM auto-requeueing enabled. Setting signal handlers.
SLURM auto-requeueing enabled. Setting signal handlers.
SLURM auto-requeueing enabled. Setting signal handlers.
SLURM auto-requeueing enabled. Setting signal handlers.
SLURM auto-requeueing enabled. Setting signal handlers.
SLURM auto-requeueing enabled. Setting signal handlers.
SLURM auto-requeueing enabled. Setting signal handlers.
SLURM auto-requeueing enabled. Setting signal handlers.
SLURM auto-requeueing enabled. Setting signal handlers.
SLURM auto-requeueing enabled. Setting signal handlers.
SLURM auto-requeueing enabled. Setting signal handlers.
SLURM auto-requeueing enabled. Setting signal handlers.
SLURM auto-requeueing enabled. Setting signal handlers.
SLURM auto-requeueing enabled. Setting signal handlers.
SLURM auto-requeueing enabled. Setting signal handlers.
SLURM auto-requeueing enabled. Setting signal handlers.
SLURM auto-requeueing enabled. Setting signal handlers.
SLURM auto-requeueing enabled. Setting signal handlers.
SLURM auto-requeueing enabled. Setting signal handlers.
SLURM auto-requeueing enabled. Setting signal handlers.
SLURM auto-requeueing enabled. Setting signal handlers.
SLURM auto-requeueing enabled. Setting signal handlers.
SLURM auto-requeueing enabled. Setting signal handlers.
SLURM auto-requeueing enabled. Setting signal handlers.
SLURM auto-requeueing enabled. Setting signal handlers.
SLURM auto-requeueing enabled. Setting signal handlers.
SLURM auto-requeueing enabled. Setting signal handlers.
SLURM auto-requeueing enabled. Setting signal handlers.
SLURM auto-requeueing enabled. Setting signal handlers.
SLURM auto-requeueing enabled. Setting signal handlers.
SLURM auto-requeueing enabled. Setting signal handlers.
SLURM auto-requeueing enabled. Setting signal handlers.
SLURM auto-requeueing enabled. Setting signal handlers.
SLURM auto-requeueing enabled. Setting signal handlers.
SLURM auto-requeueing enabled. Setting signal handlers.
SLURM auto-requeueing enabled. Setting signal handlers.
SLURM auto-requeueing enabled. Setting signal handlers.
SLURM auto-requeueing enabled. Setting signal handlers.
SLURM auto-requeueing enabled. Setting signal handlers.
SLURM auto-requeueing enabled. Setting signal handlers.
SLURM auto-requeueing enabled. Setting signal handlers.
SLURM auto-requeueing enabled. Setting signal handlers.
SLURM auto-requeueing enabled. Setting signal handlers.
SLURM auto-requeueing enabled. Setting signal handlers.
SLURM auto-requeueing enabled. Setting signal handlers.
SLURM auto-requeueing enabled. Setting signal handlers.
SLURM auto-requeueing enabled. Setting signal handlers.
SLURM auto-requeueing enabled. Setting signal handlers.
SLURM auto-requeueing enabled. Setting signal handlers.
SLURM auto-requeueing enabled. Setting signal handlers.
SLURM auto-requeueing enabled. Setting signal handlers.
SLURM auto-requeueing enabled. Setting signal handlers.
SLURM auto-requeueing enabled. Setting signal handlers.
SLURM auto-requeueing enabled. Setting signal handlers.
SLURM auto-requeueing enabled. Setting signal handlers.
SLURM auto-requeueing enabled. Setting signal handlers.
SLURM auto-requeueing enabled. Setting signal handlers.
SLURM auto-requeueing enabled. Setting signal handlers.
SLURM auto-requeueing enabled. Setting signal handlers.
SLURM auto-requeueing enabled. Setting signal handlers.
SLURM auto-requeueing enabled. Setting signal handlers.
SLURM auto-requeueing enabled. Setting signal handlers.
SLURM auto-requeueing enabled. Setting signal handlers.
SLURM auto-requeueing enabled. Setting signal handlers.
SLURM auto-requeueing enabled. Setting signal handlers.
SLURM auto-requeueing enabled. Setting signal handlers.
SLURM auto-requeueing enabled. Setting signal handlers.
SLURM auto-requeueing enabled. Setting signal handlers.
SLURM auto-requeueing enabled. Setting signal handlers.
SLURM auto-requeueing enabled. Setting signal handlers.
SLURM auto-requeueing enabled. Setting signal handlers.
SLURM auto-requeueing enabled. Setting signal handlers.
SLURM auto-requeueing enabled. Setting signal handlers.
SLURM auto-requeueing enabled. Setting signal handlers.
SLURM auto-requeueing enabled. Setting signal handlers.
SLURM auto-requeueing enabled. Setting signal handlers.
SLURM auto-requeueing enabled. Setting signal handlers.
SLURM auto-requeueing enabled. Setting signal handlers.
SLURM auto-requeueing enabled. Setting signal handlers.
SLURM auto-requeueing enabled. Setting signal handlers.
SLURM auto-requeueing enabled. Setting signal handlers.
SLURM auto-requeueing enabled. Setting signal handlers.
SLURM auto-requeueing enabled. Setting signal handlers.
SLURM auto-requeueing enabled. Setting signal handlers.
SLURM auto-requeueing enabled. Setting signal handlers.
SLURM auto-requeueing enabled. Setting signal handlers.
SLURM auto-requeueing enabled. Setting signal handlers.
SLURM auto-requeueing enabled. Setting signal handlers.
SLURM auto-requeueing enabled. Setting signal handlers.
SLURM auto-requeueing enabled. Setting signal handlers.
SLURM auto-requeueing enabled. Setting signal handlers.
SLURM auto-requeueing enabled. Setting signal handlers.
SLURM auto-requeueing enabled. Setting signal handlers.
SLURM auto-requeueing enabled. Setting signal handlers.
SLURM auto-requeueing enabled. Setting signal handlers.
SLURM auto-requeueing enabled. Setting signal handlers.
SLURM auto-requeueing enabled. Setting signal handlers.
SLURM auto-requeueing enabled. Setting signal handlers.
SLURM auto-requeueing enabled. Setting signal handlers.
SLURM auto-requeueing enabled. Setting signal handlers.
SLURM auto-requeueing enabled. Setting signal handlers.
SLURM auto-requeueing enabled. Setting signal handlers.
SLURM auto-requeueing enabled. Setting signal handlers.
SLURM auto-requeueing enabled. Setting signal handlers.
SLURM auto-requeueing enabled. Setting signal handlers.
SLURM auto-requeueing enabled. Setting signal handlers.
SLURM auto-requeueing enabled. Setting signal handlers.
SLURM auto-requeueing enabled. Setting signal handlers.
SLURM auto-requeueing enabled. Setting signal handlers.
SLURM auto-requeueing enabled. Setting signal handlers.
SLURM auto-requeueing enabled. Setting signal handlers.
SLURM auto-requeueing enabled. Setting signal handlers.
SLURM auto-requeueing enabled. Setting signal handlers.
SLURM auto-requeueing enabled. Setting signal handlers.
SLURM auto-requeueing enabled. Setting signal handlers.
SLURM auto-requeueing enabled. Setting signal handlers.
SLURM auto-requeueing enabled. Setting signal handlers.
SLURM auto-requeueing enabled. Setting signal handlers.
SLURM auto-requeueing enabled. Setting signal handlers.
SLURM auto-requeueing enabled. Setting signal handlers.
SLURM auto-requeueing enabled. Setting signal handlers.
SLURM auto-requeueing enabled. Setting signal handlers.
SLURM auto-requeueing enabled. Setting signal handlers.
SLURM auto-requeueing enabled. Setting signal handlers.
SLURM auto-requeueing enabled. Setting signal handlers.
SLURM auto-requeueing enabled. Setting signal handlers.
SLURM auto-requeueing enabled. Setting signal handlers.
SLURM auto-requeueing enabled. Setting signal handlers.
SLURM auto-requeueing enabled. Setting signal handlers.
SLURM auto-requeueing enabled. Setting signal handlers.
SLURM auto-requeueing enabled. Setting signal handlers.
SLURM auto-requeueing enabled. Setting signal handlers.
SLURM auto-requeueing enabled. Setting signal handlers.
SLURM auto-requeueing enabled. Setting signal handlers.
SLURM auto-requeueing enabled. Setting signal handlers.
SLURM auto-requeueing enabled. Setting signal handlers.
SLURM auto-requeueing enabled. Setting signal handlers.
SLURM auto-requeueing enabled. Setting signal handlers.
SLURM auto-requeueing enabled. Setting signal handlers.
SLURM auto-requeueing enabled. Setting signal handlers.
SLURM auto-requeueing enabled. Setting signal handlers.
SLURM auto-requeueing enabled. Setting signal handlers.
SLURM auto-requeueing enabled. Setting signal handlers.
SLURM auto-requeueing enabled. Setting signal handlers.
SLURM auto-requeueing enabled. Setting signal handlers.
SLURM auto-requeueing enabled. Setting signal handlers.
SLURM auto-requeueing enabled. Setting signal handlers.
SLURM auto-requeueing enabled. Setting signal handlers.
SLURM auto-requeueing enabled. Setting signal handlers.
SLURM auto-requeueing enabled. Setting signal handlers.
SLURM auto-requeueing enabled. Setting signal handlers.
SLURM auto-requeueing enabled. Setting signal handlers.
SLURM auto-requeueing enabled. Setting signal handlers.
SLURM auto-requeueing enabled. Setting signal handlers.
SLURM auto-requeueing enabled. Setting signal handlers.
SLURM auto-requeueing enabled. Setting signal handlers.
SLURM auto-requeueing enabled. Setting signal handlers.
SLURM auto-requeueing enabled. Setting signal handlers.
SLURM auto-requeueing enabled. Setting signal handlers.
SLURM auto-requeueing enabled. Setting signal handlers.
SLURM auto-requeueing enabled. Setting signal handlers.
SLURM auto-requeueing enabled. Setting signal handlers.
SLURM auto-requeueing enabled. Setting signal handlers.
SLURM auto-requeueing enabled. Setting signal handlers.
SLURM auto-requeueing enabled. Setting signal handlers.
SLURM auto-requeueing enabled. Setting signal handlers.
SLURM auto-requeueing enabled. Setting signal handlers.
SLURM auto-requeueing enabled. Setting signal handlers.
SLURM auto-requeueing enabled. Setting signal handlers.
SLURM auto-requeueing enabled. Setting signal handlers.
SLURM auto-requeueing enabled. Setting signal handlers.
SLURM auto-requeueing enabled. Setting signal handlers.
SLURM auto-requeueing enabled. Setting signal handlers.
SLURM auto-requeueing enabled. Setting signal handlers.
SLURM auto-requeueing enabled. Setting signal handlers.
SLURM auto-requeueing enabled. Setting signal handlers.
SLURM auto-requeueing enabled. Setting signal handlers.
SLURM auto-requeueing enabled. Setting signal handlers.
SLURM auto-requeueing enabled. Setting signal handlers.
SLURM auto-requeueing enabled. Setting signal handlers.
SLURM auto-requeueing enabled. Setting signal handlers.
SLURM auto-requeueing enabled. Setting signal handlers.
SLURM auto-requeueing enabled. Setting signal handlers.
SLURM auto-requeueing enabled. Setting signal handlers.
SLURM auto-requeueing enabled. Setting signal handlers.
SLURM auto-requeueing enabled. Setting signal handlers.
SLURM auto-requeueing enabled. Setting signal handlers.
SLURM auto-requeueing enabled. Setting signal handlers.
SLURM auto-requeueing enabled. Setting signal handlers.
SLURM auto-requeueing enabled. Setting signal handlers.
SLURM auto-requeueing enabled. Setting signal handlers.
SLURM auto-requeueing enabled. Setting signal handlers.
SLURM auto-requeueing enabled. Setting signal handlers.
SLURM auto-requeueing enabled. Setting signal handlers.
SLURM auto-requeueing enabled. Setting signal handlers.
SLURM auto-requeueing enabled. Setting signal handlers.
SLURM auto-requeueing enabled. Setting signal handlers.
SLURM auto-requeueing enabled. Setting signal handlers.
SLURM auto-requeueing enabled. Setting signal handlers.
SLURM auto-requeueing enabled. Setting signal handlers.
SLURM auto-requeueing enabled. Setting signal handlers.
SLURM auto-requeueing enabled. Setting signal handlers.
SLURM auto-requeueing enabled. Setting signal handlers.
SLURM auto-requeueing enabled. Setting signal handlers.
SLURM auto-requeueing enabled. Setting signal handlers.
[I 2024-09-24 23:58:11,220] A new study created in memory with name: LTSFLinearForecaster predicting GenForecast[cml, LSTM]
[I 2024-09-24 23:58:19,568] Trial 0 finished with values: [1.0, 3.862596411820247, 0.0, 1.0, 5.980295457148746, 0.0, 1.0, 6.870718481015572, 0.0] and parameters: {'seq_len': 18, 'lr': 1.355477982443456e-05, 'pred_len': 22, 'num_epochs': 50}. 
[I 2024-09-24 23:58:29,369] Trial 1 finished with values: [1.0, 6.587240487509852, 0.0, 8.0, 6.627869277787692, 0.0, 4.0, 12.759373370661052, 0.0] and parameters: {'seq_len': 25, 'lr': 2.8729457213202102e-05, 'pred_len': 22, 'num_epochs': 100}. 
[I 2024-09-24 23:58:37,948] Trial 2 finished with values: [1.0, 1.9070554136215063, 0.0, 50.0, 0.9571831214309406, 0.6, 43.0, 3.233697263191468, 0.0] and parameters: {'seq_len': 10, 'lr': 0.0006053073322265564, 'pred_len': 18, 'num_epochs': 50}. 
[I 2024-09-24 23:58:53,925] Trial 3 finished with values: [1.0, 34.24044413016512, 0.0, 47.0, 2.996367732316166, 0.0, 50.0, 0.8695917304000074, 0.5555555555555556] and parameters: {'seq_len': 12, 'lr': 0.00010903998173099097, 'pred_len': 19, 'num_epochs': 300}. 
[I 2024-09-24 23:59:11,477] Trial 4 finished with values: [1.0, 16796926.989613306, 0.0, 9.0, 238.36832727972208, 0.0, 2.0, 4.685195567752893, 0.0] and parameters: {'seq_len': 3, 'lr': 6.42622169985235e-05, 'pred_len': 16, 'num_epochs': 300}. 
[I 2024-09-24 23:59:21,738] Trial 5 finished with values: [1.0, 1.5941036896782805, 0.1, 50.0, 0.8628418866000309, 0.6, 50.0, 0.8797174456756586, 0.8888888888888888] and parameters: {'seq_len': 19, 'lr': 0.0015129363990299765, 'pred_len': 6, 'num_epochs': 100}. 
[I 2024-09-24 23:59:38,093] Trial 6 finished with values: [1.0, 1.5587404591826752, 0.1, 50.0, 0.9370075331533191, 0.5, 50.0, 0.866741214426112, 0.4444444444444444] and parameters: {'seq_len': 19, 'lr': 0.0001267950960803482, 'pred_len': 20, 'num_epochs': 300}. 
[I 2024-09-24 23:59:46,913] Trial 7 finished with values: [6.0, 1.67368931158832, 0.1, 50.0, 1.4898739039490316, 0.3, 50.0, 1.6180507267917879, 0.3333333333333333] and parameters: {'seq_len': 13, 'lr': 0.00111039651815955, 'pred_len': 8, 'num_epochs': 50}. 
[I 2024-09-25 00:00:04,883] Trial 8 finished with values: [1.0, 1.7972513503388265, 0.1, 50.0, 1.0258603893483018, 0.4, 50.0, 1.0211535222039336, 0.5555555555555556] and parameters: {'seq_len': 5, 'lr': 0.01738996078536165, 'pred_len': 5, 'num_epochs': 300}. 
[I 2024-09-25 00:00:22,498] Trial 9 finished with values: [1.0, 1.6127854595031956, 0.1, 50.0, 0.8733614156470741, 0.5, 50.0, 0.8794218256323463, 0.5555555555555556] and parameters: {'seq_len': 12, 'lr': 0.0003393381213582997, 'pred_len': 7, 'num_epochs': 300}. 
[I 2024-09-25 00:00:38,400] Trial 10 finished with values: [1.0, 1.5755308610284129, 0.1, 50.0, 0.9264996651234785, 0.8, 50.0, 0.8936245484347785, 0.8888888888888888] and parameters: {'seq_len': 24, 'lr': 0.010820123501335517, 'pred_len': 18, 'num_epochs': 300}. 
[I 2024-09-25 00:00:54,667] Trial 11 finished with values: [1.0, 1.655571380116072, 0.1, 50.0, 0.8775476367148047, 0.5, 50.0, 0.8593637153675799, 0.5555555555555556] and parameters: {'seq_len': 12, 'lr': 0.0005972870097365129, 'pred_len': 20, 'num_epochs': 300}. 
[I 2024-09-25 00:01:12,340] Trial 12 finished with values: [2.0, 1.6123920573302926, 0.1, 50.0, 0.9207722651391766, 0.5, 50.0, 1.8207646679952307, 0.2222222222222222] and parameters: {'seq_len': 12, 'lr': 6.558757247621827e-05, 'pred_len': 1, 'num_epochs': 300}. 
[I 2024-09-25 00:01:28,731] Trial 13 finished with values: [1.0, 2.119709757929658, 0.3, 50.0, 1.5483886477104403, 0.0, 50.0, 1.4625500000737717, 0.1111111111111111] and parameters: {'seq_len': 17, 'lr': 0.02985424244966293, 'pred_len': 18, 'num_epochs': 300}. 
