[I 2024-09-25 00:01:39,063] Trial 14 finished with values: [2.0, 1.466851258003286, 0.1, 50.0, 0.9012219575085408, 0.9, 50.0, 0.8777274675117512, 0.6666666666666666] and parameters: {'seq_len': 15, 'lr': 0.0034395086680913305, 'pred_len': 5, 'num_epochs': 100}. 
[I 2024-09-25 00:01:47,481] Trial 15 finished with values: [1.0, 1.4555124224734772, 0.2, 50.0, 0.8634691823767809, 0.5, 50.0, 0.9103741086330209, 0.3333333333333333] and parameters: {'seq_len': 22, 'lr': 0.011415527753143811, 'pred_len': 2, 'num_epochs': 50}. 
[I 2024-09-25 00:01:55,592] Trial 16 finished with values: [1.0, 4.9474751851808865, 0.0, 1.0, 7.933538905207845, 0.0, 3.0, 6.310725021414424, 0.0] and parameters: {'seq_len': 24, 'lr': 1.8040460611121073e-05, 'pred_len': 14, 'num_epochs': 50}. 
[I 2024-09-25 00:02:12,450] Trial 17 finished with values: [1.0, 1.8363409758579, 0.1, 50.0, 2.312655228367056, 0.2, 50.0, 2.2967179790070404, 0.2222222222222222] and parameters: {'seq_len': 2, 'lr': 0.00905963195758489, 'pred_len': 15, 'num_epochs': 300}. 
[I 2024-09-25 00:02:22,844] Trial 18 finished with values: [1.0, 1.773512399882083, 0.1, 50.0, 1.5849008782534908, 0.3, 50.0, 1.0618767261204844, 0.5555555555555556] and parameters: {'seq_len': 11, 'lr': 0.0003367150717526719, 'pred_len': 9, 'num_epochs': 100}. 
[I 2024-09-25 00:02:33,012] Trial 19 finished with values: [2.0, 2.199692084263676, 0.0, 50.0, 1.3449791472595893, 0.2, 50.0, 1.6955021091372744, 0.3333333333333333] and parameters: {'seq_len': 16, 'lr': 0.00018099879237452627, 'pred_len': 1, 'num_epochs': 100}. 
[I 2024-09-25 00:02:42,923] Trial 20 finished with values: [150.0, 1.4708155775846092, 0.1, 50.0, 0.8864811886846216, 0.6, 50.0, 1.1784765214400923, 0.5555555555555556] and parameters: {'seq_len': 18, 'lr': 0.0006058120121926611, 'pred_len': 19, 'num_epochs': 100}. 
[I 2024-09-25 00:02:59,741] Trial 21 finished with values: [1.0, 1.9071756674382703, 0.0, 50.0, 0.9739265097876159, 0.3, 50.0, 1.1724497061665362, 0.2222222222222222] and parameters: {'seq_len': 13, 'lr': 0.09556487869801314, 'pred_len': 16, 'num_epochs': 300}. 
[I 2024-09-25 00:03:09,612] Trial 22 finished with values: [18.0, 1.5863309117753908, 0.1, 50.0, 1.0809146052545073, 0.5, 50.0, 0.8740938122848353, 0.6666666666666666] and parameters: {'seq_len': 15, 'lr': 0.0007689146399433158, 'pred_len': 25, 'num_epochs': 100}. 
[I 2024-09-25 00:03:25,266] Trial 23 finished with values: [1.0, 1.593934027389615, 0.0, 50.0, 0.9922014637124225, 0.8, 50.0, 0.9393278692347697, 0.7777777777777778] and parameters: {'seq_len': 22, 'lr': 0.00881696634895355, 'pred_len': 18, 'num_epochs': 300}. 
[I 2024-09-25 00:03:42,579] Trial 24 finished with values: [1.0, 1.7725530636552507, 0.2, 50.0, 0.9794979706342882, 0.5, 50.0, 0.9732411470066336, 0.5555555555555556] and parameters: {'seq_len': 6, 'lr': 0.0037138562652016824, 'pred_len': 9, 'num_epochs': 300}. 
SLURM auto-requeueing enabled. Setting signal handlers.
SLURM auto-requeueing enabled. Setting signal handlers.
SLURM auto-requeueing enabled. Setting signal handlers.
SLURM auto-requeueing enabled. Setting signal handlers.
SLURM auto-requeueing enabled. Setting signal handlers.
SLURM auto-requeueing enabled. Setting signal handlers.
SLURM auto-requeueing enabled. Setting signal handlers.
SLURM auto-requeueing enabled. Setting signal handlers.
SLURM auto-requeueing enabled. Setting signal handlers.
SLURM auto-requeueing enabled. Setting signal handlers.
SLURM auto-requeueing enabled. Setting signal handlers.
SLURM auto-requeueing enabled. Setting signal handlers.
SLURM auto-requeueing enabled. Setting signal handlers.
SLURM auto-requeueing enabled. Setting signal handlers.
SLURM auto-requeueing enabled. Setting signal handlers.
SLURM auto-requeueing enabled. Setting signal handlers.
SLURM auto-requeueing enabled. Setting signal handlers.
SLURM auto-requeueing enabled. Setting signal handlers.
SLURM auto-requeueing enabled. Setting signal handlers.
SLURM auto-requeueing enabled. Setting signal handlers.
SLURM auto-requeueing enabled. Setting signal handlers.
SLURM auto-requeueing enabled. Setting signal handlers.
SLURM auto-requeueing enabled. Setting signal handlers.
SLURM auto-requeueing enabled. Setting signal handlers.
SLURM auto-requeueing enabled. Setting signal handlers.
SLURM auto-requeueing enabled. Setting signal handlers.
SLURM auto-requeueing enabled. Setting signal handlers.
SLURM auto-requeueing enabled. Setting signal handlers.
SLURM auto-requeueing enabled. Setting signal handlers.
SLURM auto-requeueing enabled. Setting signal handlers.
SLURM auto-requeueing enabled. Setting signal handlers.
SLURM auto-requeueing enabled. Setting signal handlers.
SLURM auto-requeueing enabled. Setting signal handlers.
SLURM auto-requeueing enabled. Setting signal handlers.
SLURM auto-requeueing enabled. Setting signal handlers.
SLURM auto-requeueing enabled. Setting signal handlers.
SLURM auto-requeueing enabled. Setting signal handlers.
SLURM auto-requeueing enabled. Setting signal handlers.
SLURM auto-requeueing enabled. Setting signal handlers.
SLURM auto-requeueing enabled. Setting signal handlers.
SLURM auto-requeueing enabled. Setting signal handlers.
SLURM auto-requeueing enabled. Setting signal handlers.
SLURM auto-requeueing enabled. Setting signal handlers.
SLURM auto-requeueing enabled. Setting signal handlers.
SLURM auto-requeueing enabled. Setting signal handlers.
SLURM auto-requeueing enabled. Setting signal handlers.
SLURM auto-requeueing enabled. Setting signal handlers.
SLURM auto-requeueing enabled. Setting signal handlers.
SLURM auto-requeueing enabled. Setting signal handlers.
SLURM auto-requeueing enabled. Setting signal handlers.
SLURM auto-requeueing enabled. Setting signal handlers.
SLURM auto-requeueing enabled. Setting signal handlers.
SLURM auto-requeueing enabled. Setting signal handlers.
SLURM auto-requeueing enabled. Setting signal handlers.
SLURM auto-requeueing enabled. Setting signal handlers.
SLURM auto-requeueing enabled. Setting signal handlers.
SLURM auto-requeueing enabled. Setting signal handlers.
SLURM auto-requeueing enabled. Setting signal handlers.
SLURM auto-requeueing enabled. Setting signal handlers.
SLURM auto-requeueing enabled. Setting signal handlers.
SLURM auto-requeueing enabled. Setting signal handlers.
SLURM auto-requeueing enabled. Setting signal handlers.
SLURM auto-requeueing enabled. Setting signal handlers.
SLURM auto-requeueing enabled. Setting signal handlers.
SLURM auto-requeueing enabled. Setting signal handlers.
SLURM auto-requeueing enabled. Setting signal handlers.
SLURM auto-requeueing enabled. Setting signal handlers.
SLURM auto-requeueing enabled. Setting signal handlers.
SLURM auto-requeueing enabled. Setting signal handlers.
SLURM auto-requeueing enabled. Setting signal handlers.
SLURM auto-requeueing enabled. Setting signal handlers.
SLURM auto-requeueing enabled. Setting signal handlers.
SLURM auto-requeueing enabled. Setting signal handlers.
SLURM auto-requeueing enabled. Setting signal handlers.
SLURM auto-requeueing enabled. Setting signal handlers.
SLURM auto-requeueing enabled. Setting signal handlers.
SLURM auto-requeueing enabled. Setting signal handlers.
SLURM auto-requeueing enabled. Setting signal handlers.
SLURM auto-requeueing enabled. Setting signal handlers.
SLURM auto-requeueing enabled. Setting signal handlers.
SLURM auto-requeueing enabled. Setting signal handlers.
SLURM auto-requeueing enabled. Setting signal handlers.
SLURM auto-requeueing enabled. Setting signal handlers.
SLURM auto-requeueing enabled. Setting signal handlers.
SLURM auto-requeueing enabled. Setting signal handlers.
SLURM auto-requeueing enabled. Setting signal handlers.
SLURM auto-requeueing enabled. Setting signal handlers.
SLURM auto-requeueing enabled. Setting signal handlers.
SLURM auto-requeueing enabled. Setting signal handlers.
SLURM auto-requeueing enabled. Setting signal handlers.
SLURM auto-requeueing enabled. Setting signal handlers.
SLURM auto-requeueing enabled. Setting signal handlers.
SLURM auto-requeueing enabled. Setting signal handlers.
SLURM auto-requeueing enabled. Setting signal handlers.
SLURM auto-requeueing enabled. Setting signal handlers.
SLURM auto-requeueing enabled. Setting signal handlers.
SLURM auto-requeueing enabled. Setting signal handlers.
SLURM auto-requeueing enabled. Setting signal handlers.
SLURM auto-requeueing enabled. Setting signal handlers.
SLURM auto-requeueing enabled. Setting signal handlers.
SLURM auto-requeueing enabled. Setting signal handlers.
SLURM auto-requeueing enabled. Setting signal handlers.
SLURM auto-requeueing enabled. Setting signal handlers.
SLURM auto-requeueing enabled. Setting signal handlers.
SLURM auto-requeueing enabled. Setting signal handlers.
SLURM auto-requeueing enabled. Setting signal handlers.
SLURM auto-requeueing enabled. Setting signal handlers.
SLURM auto-requeueing enabled. Setting signal handlers.
SLURM auto-requeueing enabled. Setting signal handlers.
SLURM auto-requeueing enabled. Setting signal handlers.
SLURM auto-requeueing enabled. Setting signal handlers.
SLURM auto-requeueing enabled. Setting signal handlers.
SLURM auto-requeueing enabled. Setting signal handlers.
SLURM auto-requeueing enabled. Setting signal handlers.
SLURM auto-requeueing enabled. Setting signal handlers.
SLURM auto-requeueing enabled. Setting signal handlers.
SLURM auto-requeueing enabled. Setting signal handlers.
SLURM auto-requeueing enabled. Setting signal handlers.
SLURM auto-requeueing enabled. Setting signal handlers.
SLURM auto-requeueing enabled. Setting signal handlers.
SLURM auto-requeueing enabled. Setting signal handlers.
SLURM auto-requeueing enabled. Setting signal handlers.
SLURM auto-requeueing enabled. Setting signal handlers.
SLURM auto-requeueing enabled. Setting signal handlers.
SLURM auto-requeueing enabled. Setting signal handlers.
SLURM auto-requeueing enabled. Setting signal handlers.
SLURM auto-requeueing enabled. Setting signal handlers.
SLURM auto-requeueing enabled. Setting signal handlers.
SLURM auto-requeueing enabled. Setting signal handlers.
SLURM auto-requeueing enabled. Setting signal handlers.
SLURM auto-requeueing enabled. Setting signal handlers.
SLURM auto-requeueing enabled. Setting signal handlers.
SLURM auto-requeueing enabled. Setting signal handlers.
SLURM auto-requeueing enabled. Setting signal handlers.
SLURM auto-requeueing enabled. Setting signal handlers.
SLURM auto-requeueing enabled. Setting signal handlers.
SLURM auto-requeueing enabled. Setting signal handlers.
SLURM auto-requeueing enabled. Setting signal handlers.
SLURM auto-requeueing enabled. Setting signal handlers.
SLURM auto-requeueing enabled. Setting signal handlers.
SLURM auto-requeueing enabled. Setting signal handlers.
SLURM auto-requeueing enabled. Setting signal handlers.
SLURM auto-requeueing enabled. Setting signal handlers.
SLURM auto-requeueing enabled. Setting signal handlers.
SLURM auto-requeueing enabled. Setting signal handlers.
SLURM auto-requeueing enabled. Setting signal handlers.
SLURM auto-requeueing enabled. Setting signal handlers.
SLURM auto-requeueing enabled. Setting signal handlers.
SLURM auto-requeueing enabled. Setting signal handlers.
SLURM auto-requeueing enabled. Setting signal handlers.
SLURM auto-requeueing enabled. Setting signal handlers.
SLURM auto-requeueing enabled. Setting signal handlers.
SLURM auto-requeueing enabled. Setting signal handlers.
SLURM auto-requeueing enabled. Setting signal handlers.
SLURM auto-requeueing enabled. Setting signal handlers.
SLURM auto-requeueing enabled. Setting signal handlers.
SLURM auto-requeueing enabled. Setting signal handlers.
SLURM auto-requeueing enabled. Setting signal handlers.
SLURM auto-requeueing enabled. Setting signal handlers.
SLURM auto-requeueing enabled. Setting signal handlers.
SLURM auto-requeueing enabled. Setting signal handlers.
SLURM auto-requeueing enabled. Setting signal handlers.
SLURM auto-requeueing enabled. Setting signal handlers.
SLURM auto-requeueing enabled. Setting signal handlers.
SLURM auto-requeueing enabled. Setting signal handlers.
SLURM auto-requeueing enabled. Setting signal handlers.
SLURM auto-requeueing enabled. Setting signal handlers.
SLURM auto-requeueing enabled. Setting signal handlers.
SLURM auto-requeueing enabled. Setting signal handlers.
SLURM auto-requeueing enabled. Setting signal handlers.
SLURM auto-requeueing enabled. Setting signal handlers.
SLURM auto-requeueing enabled. Setting signal handlers.
SLURM auto-requeueing enabled. Setting signal handlers.
SLURM auto-requeueing enabled. Setting signal handlers.
SLURM auto-requeueing enabled. Setting signal handlers.
SLURM auto-requeueing enabled. Setting signal handlers.
SLURM auto-requeueing enabled. Setting signal handlers.
SLURM auto-requeueing enabled. Setting signal handlers.
SLURM auto-requeueing enabled. Setting signal handlers.
SLURM auto-requeueing enabled. Setting signal handlers.
SLURM auto-requeueing enabled. Setting signal handlers.
SLURM auto-requeueing enabled. Setting signal handlers.
SLURM auto-requeueing enabled. Setting signal handlers.
SLURM auto-requeueing enabled. Setting signal handlers.
SLURM auto-requeueing enabled. Setting signal handlers.
SLURM auto-requeueing enabled. Setting signal handlers.
SLURM auto-requeueing enabled. Setting signal handlers.
SLURM auto-requeueing enabled. Setting signal handlers.
SLURM auto-requeueing enabled. Setting signal handlers.
SLURM auto-requeueing enabled. Setting signal handlers.
SLURM auto-requeueing enabled. Setting signal handlers.
SLURM auto-requeueing enabled. Setting signal handlers.
SLURM auto-requeueing enabled. Setting signal handlers.
SLURM auto-requeueing enabled. Setting signal handlers.
SLURM auto-requeueing enabled. Setting signal handlers.
SLURM auto-requeueing enabled. Setting signal handlers.
SLURM auto-requeueing enabled. Setting signal handlers.
SLURM auto-requeueing enabled. Setting signal handlers.
SLURM auto-requeueing enabled. Setting signal handlers.
SLURM auto-requeueing enabled. Setting signal handlers.
SLURM auto-requeueing enabled. Setting signal handlers.
SLURM auto-requeueing enabled. Setting signal handlers.
SLURM auto-requeueing enabled. Setting signal handlers.
SLURM auto-requeueing enabled. Setting signal handlers.
SLURM auto-requeueing enabled. Setting signal handlers.
SLURM auto-requeueing enabled. Setting signal handlers.
SLURM auto-requeueing enabled. Setting signal handlers.
SLURM auto-requeueing enabled. Setting signal handlers.
SLURM auto-requeueing enabled. Setting signal handlers.
SLURM auto-requeueing enabled. Setting signal handlers.
SLURM auto-requeueing enabled. Setting signal handlers.
SLURM auto-requeueing enabled. Setting signal handlers.
SLURM auto-requeueing enabled. Setting signal handlers.
SLURM auto-requeueing enabled. Setting signal handlers.
SLURM auto-requeueing enabled. Setting signal handlers.
SLURM auto-requeueing enabled. Setting signal handlers.
SLURM auto-requeueing enabled. Setting signal handlers.
SLURM auto-requeueing enabled. Setting signal handlers.
SLURM auto-requeueing enabled. Setting signal handlers.
SLURM auto-requeueing enabled. Setting signal handlers.
SLURM auto-requeueing enabled. Setting signal handlers.
SLURM auto-requeueing enabled. Setting signal handlers.
SLURM auto-requeueing enabled. Setting signal handlers.
SLURM auto-requeueing enabled. Setting signal handlers.
SLURM auto-requeueing enabled. Setting signal handlers.
SLURM auto-requeueing enabled. Setting signal handlers.
SLURM auto-requeueing enabled. Setting signal handlers.
SLURM auto-requeueing enabled. Setting signal handlers.
SLURM auto-requeueing enabled. Setting signal handlers.
SLURM auto-requeueing enabled. Setting signal handlers.
SLURM auto-requeueing enabled. Setting signal handlers.
SLURM auto-requeueing enabled. Setting signal handlers.
SLURM auto-requeueing enabled. Setting signal handlers.
SLURM auto-requeueing enabled. Setting signal handlers.
SLURM auto-requeueing enabled. Setting signal handlers.
SLURM auto-requeueing enabled. Setting signal handlers.
SLURM auto-requeueing enabled. Setting signal handlers.
SLURM auto-requeueing enabled. Setting signal handlers.
SLURM auto-requeueing enabled. Setting signal handlers.
SLURM auto-requeueing enabled. Setting signal handlers.
SLURM auto-requeueing enabled. Setting signal handlers.
SLURM auto-requeueing enabled. Setting signal handlers.
SLURM auto-requeueing enabled. Setting signal handlers.
SLURM auto-requeueing enabled. Setting signal handlers.
SLURM auto-requeueing enabled. Setting signal handlers.
SLURM auto-requeueing enabled. Setting signal handlers.
SLURM auto-requeueing enabled. Setting signal handlers.
[I 2024-09-25 00:04:28,441] A new study created in memory with name: VAR predicting GenForecast[cml, LSTM]
[I 2024-09-25 00:04:33,842] Trial 0 finished with values: [1.0, 1.1212835394695566, 0.3, 50.0, 0.954830143207046, 0.6, 50.0, 1.9318233209234796, 0.2222222222222222] and parameters: {'ic': 'aic', 'maxlags': 5, 'trend': 'ct'}. 
[I 2024-09-25 00:04:39,276] Trial 1 finished with values: [1.0, 1.0379102396581883, 0.9, 50.0, 0.9715232465737157, 0.8, 50.0, 2.466899788098035, 0.3333333333333333] and parameters: {'ic': 'aic', 'maxlags': 5, 'trend': 'c'}. 
[I 2024-09-25 00:04:44,437] Trial 2 finished with values: [2.0, 1.492934572820334, 0.3, 50.0, 1.0602072733995154, 0.7, 50.0, 1.643359160214506, 0.1111111111111111] and parameters: {'ic': 'aic', 'maxlags': 4, 'trend': 'ctt'}. 
[I 2024-09-25 00:04:49,796] Trial 3 finished with values: [1.0, 1.0405387286610992, 1.0, 50.0, 0.9466813499784116, 0.8, 50.0, 2.088111722961226, 0.0] and parameters: {'ic': 'fpe', 'maxlags': 2, 'trend': 'c'}. 
[I 2024-09-25 00:04:54,970] Trial 4 finished with values: [150.0, 1.2941983669954742, 0.0, 50.0, 1.2831261625894852, 0.1, 1.0, 10.168019612303487, 0.2222222222222222] and parameters: {'ic': 'aic', 'maxlags': 1, 'trend': 'n'}. 
[I 2024-09-25 00:05:00,203] Trial 5 finished with values: [1.0, 1.1122549652789167, 0.9, 50.0, 0.9962522456925375, 0.6, 50.0, 2.543513696222362, 0.3333333333333333] and parameters: {'ic': 'fpe', 'maxlags': 5, 'trend': 'n'}. 
[I 2024-09-25 00:05:05,466] Trial 6 finished with values: [1.0, 1.1769003697910267, 0.0, 50.0, 0.9375455418277212, 0.8, 50.0, 1.8409716945015548, 0.2222222222222222] and parameters: {'ic': 'fpe', 'maxlags': 3, 'trend': 'n'}. 
[I 2024-09-25 00:05:10,744] Trial 7 finished with values: [18.0, 1.1885065295261628, 0.3, 50.0, 0.9237566221409323, 0.5, 50.0, 1.5040393323867987, 0.3333333333333333] and parameters: {'ic': 'fpe', 'maxlags': 2, 'trend': 'ct'}. 
[I 2024-09-25 00:05:15,923] Trial 8 finished with values: [150.0, 0.9628339829850238, 1.0, 50.0, 0.9841867672646785, 0.8, 1.0, 3.222439912196939, 0.0] and parameters: {'ic': 'fpe', 'maxlags': 1, 'trend': 'c'}. 
[I 2024-09-25 00:05:21,274] Trial 9 finished with values: [1.0, 1.1212835394695566, 0.3, 50.0, 0.954830143207046, 0.6, 50.0, 1.9318233209234796, 0.2222222222222222] and parameters: {'ic': 'aic', 'maxlags': 5, 'trend': 'ct'}. 
[I 2024-09-25 00:05:26,570] Trial 10 finished with values: [1.0, 1.1122549652789167, 0.9, 50.0, 0.9962522456925375, 0.6, 50.0, 2.543513696222362, 0.3333333333333333] and parameters: {'ic': 'fpe', 'maxlags': 5, 'trend': 'n'}. 
[I 2024-09-25 00:05:32,034] Trial 11 finished with values: [1.0, 1.0379102396581883, 0.9, 50.0, 0.9715232465737157, 0.8, 50.0, 2.466899788098035, 0.3333333333333333] and parameters: {'ic': 'aic', 'maxlags': 5, 'trend': 'c'}. 
[I 2024-09-25 00:05:37,288] Trial 12 finished with values: [1.0, 1.2044370175962957, 0.3, 50.0, 0.9179564252905604, 0.5, 50.0, 1.8302108253752034, 0.2222222222222222] and parameters: {'ic': 'aic', 'maxlags': 3, 'trend': 'ct'}. 
[I 2024-09-25 00:05:42,545] Trial 13 finished with values: [1.0, 1.2044370175962957, 0.3, 50.0, 0.9179564252905604, 0.5, 50.0, 1.8302108253752034, 0.2222222222222222] and parameters: {'ic': 'aic', 'maxlags': 3, 'trend': 'ct'}. 
[I 2024-09-25 00:05:47,826] Trial 14 finished with values: [1.0, 1.2044370175962957, 0.3, 50.0, 0.9179564252905604, 0.5, 50.0, 1.8302108253752034, 0.2222222222222222] and parameters: {'ic': 'aic', 'maxlags': 3, 'trend': 'ct'}. 
[I 2024-09-25 00:05:53,153] Trial 15 finished with values: [144.0, 1.541278148997155, 0.2, 50.0, 0.9895351309262038, 0.7, 50.0, 1.7133884221333673, 0.3333333333333333] and parameters: {'ic': 'aic', 'maxlags': 2, 'trend': 'ctt'}. 
[I 2024-09-25 00:05:58,516] Trial 16 finished with values: [1.0, 1.2044370175962957, 0.3, 50.0, 0.9179564252905604, 0.5, 50.0, 1.8302108253752034, 0.2222222222222222] and parameters: {'ic': 'aic', 'maxlags': 3, 'trend': 'ct'}. 
[I 2024-09-25 00:06:03,865] Trial 17 finished with values: [1.0, 1.2024236548376857, 0.3, 50.0, 1.0038298424503653, 0.6, 50.0, 1.8274867494552862, 0.2222222222222222] and parameters: {'ic': 'fpe', 'maxlags': 4, 'trend': 'ct'}. 
[I 2024-09-25 00:06:09,182] Trial 18 finished with values: [1.0, 1.0882277008518064, 0.4, 50.0, 1.0437485317467843, 0.7, 33.0, 3.00241901891025, 0.2222222222222222] and parameters: {'ic': 'fpe', 'maxlags': 2, 'trend': 'n'}. 
[I 2024-09-25 00:06:14,114] Trial 19 finished with values: [1.0, 1.1769003697910267, 0.0, 50.0, 0.9375455418277212, 0.8, 50.0, 1.8409716945015548, 0.2222222222222222] and parameters: {'ic': 'fpe', 'maxlags': 3, 'trend': 'n'}. 
[I 2024-09-25 00:06:19,376] Trial 20 finished with values: [150.0, 0.9628339829850238, 1.0, 50.0, 0.9841867672646785, 0.8, 1.0, 3.222439912196939, 0.0] and parameters: {'ic': 'fpe', 'maxlags': 1, 'trend': 'c'}. 
[I 2024-09-25 00:06:24,639] Trial 21 finished with values: [18.0, 1.1885065295261628, 0.3, 50.0, 0.9237566221409323, 0.5, 50.0, 1.5040393323867987, 0.3333333333333333] and parameters: {'ic': 'aic', 'maxlags': 2, 'trend': 'ct'}. 
[I 2024-09-25 00:06:29,921] Trial 22 finished with values: [1.0, 1.2044370175962957, 0.3, 50.0, 0.9179564252905604, 0.5, 50.0, 1.8302108253752034, 0.2222222222222222] and parameters: {'ic': 'fpe', 'maxlags': 3, 'trend': 'ct'}. 
