WARNING: Ignoring invalid distribution -latformdirs (/nas/longleaf/home/djpassey/.local/lib/python3.9/site-packages)
Found existing installation: interfere 0.0.1
Uninstalling interfere-0.0.1:
  Successfully uninstalled interfere-0.0.1
Defaulting to user installation because normal site-packages is not writeable
WARNING: Ignoring invalid distribution -latformdirs (/nas/longleaf/home/djpassey/.local/lib/python3.9/site-packages)
WARNING: Ignoring invalid distribution -latformdirs (/nas/longleaf/home/djpassey/.local/lib/python3.9/site-packages)
Collecting git+https://www.github.com/djpasseyjr/interfere.git@6b600cafefbbc5771efeecc817da5d50fe8e9ca9
  Cloning https://www.github.com/djpasseyjr/interfere.git (to revision 6b600cafefbbc5771efeecc817da5d50fe8e9ca9) to /tmp/pip-req-build-onky78b6
  Running command git clone --filter=blob:none --quiet https://www.github.com/djpasseyjr/interfere.git /tmp/pip-req-build-onky78b6
  warning: redirecting to https://github.com/djpasseyjr/interfere.git/
  Running command git rev-parse -q --verify 'sha^6b600cafefbbc5771efeecc817da5d50fe8e9ca9'
  Running command git fetch -q https://www.github.com/djpasseyjr/interfere.git 6b600cafefbbc5771efeecc817da5d50fe8e9ca9
  Resolved https://www.github.com/djpasseyjr/interfere.git to commit 6b600cafefbbc5771efeecc817da5d50fe8e9ca9
  Installing build dependencies: started
  Installing build dependencies: finished with status 'done'
  Getting requirements to build wheel: started
  Getting requirements to build wheel: finished with status 'done'
  Preparing metadata (pyproject.toml): started
  Preparing metadata (pyproject.toml): finished with status 'done'
Collecting pyclustering@ git+https://github.com/djpasseyjr/pyclustering (from interfere==0.0.1)
  Cloning https://github.com/djpasseyjr/pyclustering to /tmp/pip-install-hj63nquj/pyclustering_c38c666453c64abb9203dafb86841a8b
  Running command git clone --filter=blob:none --quiet https://github.com/djpasseyjr/pyclustering /tmp/pip-install-hj63nquj/pyclustering_c38c666453c64abb9203dafb86841a8b
  Resolved https://github.com/djpasseyjr/pyclustering to commit 6bb2311e318d3b6ae7ef88f88ed19ec25e959b7f
  Preparing metadata (setup.py): started
  Preparing metadata (setup.py): finished with status 'done'
Requirement already satisfied: neuralforecast in /nas/longleaf/home/djpassey/.local/lib/python3.9/site-packages (from interfere==0.0.1) (1.7.4)
Requirement already satisfied: numpy in /nas/longleaf/home/djpassey/.local/lib/python3.9/site-packages (from interfere==0.0.1) (1.26.3)
Requirement already satisfied: pandas in /nas/longleaf/home/djpassey/.local/lib/python3.9/site-packages (from interfere==0.0.1) (2.1.4)
Requirement already satisfied: pysindy in /nas/longleaf/home/djpassey/.local/lib/python3.9/site-packages (from interfere==0.0.1) (1.7.5)
Requirement already satisfied: scikit-learn in /nas/longleaf/home/djpassey/.local/lib/python3.9/site-packages (from interfere==0.0.1) (1.3.2)
Requirement already satisfied: sktime in /nas/longleaf/home/djpassey/.local/lib/python3.9/site-packages (from interfere==0.0.1) (0.25.0)
Requirement already satisfied: statsforecast in /nas/longleaf/home/djpassey/.local/lib/python3.9/site-packages (from interfere==0.0.1) (1.7.6)
Requirement already satisfied: statsmodels in /nas/longleaf/home/djpassey/.local/lib/python3.9/site-packages (from interfere==0.0.1) (0.14.1)
Requirement already satisfied: typing-extensions in /nas/longleaf/home/djpassey/.local/lib/python3.9/site-packages (from interfere==0.0.1) (4.9.0)
Requirement already satisfied: coreforecast>=0.0.6 in /nas/longleaf/home/djpassey/.local/lib/python3.9/site-packages (from neuralforecast->interfere==0.0.1) (0.0.12)
Requirement already satisfied: fsspec in /nas/longleaf/home/djpassey/.local/lib/python3.9/site-packages (from neuralforecast->interfere==0.0.1) (2023.12.2)
Requirement already satisfied: torch>=2.0.0 in /nas/longleaf/home/djpassey/.local/lib/python3.9/site-packages (from neuralforecast->interfere==0.0.1) (2.1.2)
Requirement already satisfied: pytorch-lightning>=2.0.0 in /nas/longleaf/home/djpassey/.local/lib/python3.9/site-packages (from neuralforecast->interfere==0.0.1) (2.3.3)
Requirement already satisfied: ray>=2.2.0 in /nas/longleaf/home/djpassey/.local/lib/python3.9/site-packages (from ray[tune]>=2.2.0->neuralforecast->interfere==0.0.1) (2.34.0)
Requirement already satisfied: optuna in /nas/longleaf/home/djpassey/.local/lib/python3.9/site-packages (from neuralforecast->interfere==0.0.1) (3.6.1)
Requirement already satisfied: utilsforecast>=0.0.25 in /nas/longleaf/home/djpassey/.local/lib/python3.9/site-packages (from neuralforecast->interfere==0.0.1) (0.2.2)
Requirement already satisfied: python-dateutil>=2.8.2 in /nas/longleaf/home/djpassey/.local/lib/python3.9/site-packages (from pandas->interfere==0.0.1) (2.8.2)
Requirement already satisfied: pytz>=2020.1 in /nas/longleaf/home/djpassey/.local/lib/python3.9/site-packages (from pandas->interfere==0.0.1) (2023.3.post1)
Requirement already satisfied: tzdata>=2022.1 in /nas/longleaf/home/djpassey/.local/lib/python3.9/site-packages (from pandas->interfere==0.0.1) (2023.4)
Requirement already satisfied: scipy>=1.1.0 in /nas/longleaf/home/djpassey/.local/lib/python3.9/site-packages (from pyclustering@ git+https://github.com/djpasseyjr/pyclustering->interfere==0.0.1) (1.11.4)
Requirement already satisfied: matplotlib>=3.0.0 in /nas/longleaf/home/djpassey/.local/lib/python3.9/site-packages (from pyclustering@ git+https://github.com/djpasseyjr/pyclustering->interfere==0.0.1) (3.8.2)
Requirement already satisfied: Pillow>=5.2.0 in /nas/longleaf/home/djpassey/.local/lib/python3.9/site-packages (from pyclustering@ git+https://github.com/djpasseyjr/pyclustering->interfere==0.0.1) (10.2.0)
Requirement already satisfied: derivative in /nas/longleaf/home/djpassey/.local/lib/python3.9/site-packages (from pysindy->interfere==0.0.1) (0.6.0)
Requirement already satisfied: cmake in /nas/longleaf/home/djpassey/.local/lib/python3.9/site-packages (from pysindy->interfere==0.0.1) (3.28.1)
Requirement already satisfied: scs!=2.1.4,>=2.1 in /nas/longleaf/home/djpassey/.local/lib/python3.9/site-packages (from pysindy->interfere==0.0.1) (3.2.4.post1)
Requirement already satisfied: joblib>=1.1.1 in /nas/longleaf/home/djpassey/.local/lib/python3.9/site-packages (from scikit-learn->interfere==0.0.1) (1.3.2)
Requirement already satisfied: threadpoolctl>=2.0.0 in /nas/longleaf/home/djpassey/.local/lib/python3.9/site-packages (from scikit-learn->interfere==0.0.1) (3.2.0)
Requirement already satisfied: packaging in /nas/longleaf/home/djpassey/.local/lib/python3.9/site-packages (from sktime->interfere==0.0.1) (23.2)
Requirement already satisfied: scikit-base<0.7.0 in /nas/longleaf/home/djpassey/.local/lib/python3.9/site-packages (from sktime->interfere==0.0.1) (0.6.2)
Requirement already satisfied: cloudpickle in /nas/longleaf/rhel8/apps/anaconda/2021.11/lib/python3.9/site-packages (from statsforecast->interfere==0.0.1) (2.0.0)
Requirement already satisfied: numba>=0.55.0 in /nas/longleaf/home/djpassey/.local/lib/python3.9/site-packages (from statsforecast->interfere==0.0.1) (0.60.0)
Requirement already satisfied: tqdm in /nas/longleaf/home/djpassey/.local/lib/python3.9/site-packages (from statsforecast->interfere==0.0.1) (4.66.2)
Requirement already satisfied: fugue>=0.8.1 in /nas/longleaf/home/djpassey/.local/lib/python3.9/site-packages (from statsforecast->interfere==0.0.1) (0.9.1)
Requirement already satisfied: patsy>=0.5.4 in /nas/longleaf/home/djpassey/.local/lib/python3.9/site-packages (from statsmodels->interfere==0.0.1) (0.5.6)
Requirement already satisfied: importlib_resources in /nas/longleaf/home/djpassey/.local/lib/python3.9/site-packages (from coreforecast>=0.0.6->neuralforecast->interfere==0.0.1) (6.1.1)
Requirement already satisfied: triad>=0.9.7 in /nas/longleaf/home/djpassey/.local/lib/python3.9/site-packages (from fugue>=0.8.1->statsforecast->interfere==0.0.1) (0.9.8)
Requirement already satisfied: adagio>=0.2.4 in /nas/longleaf/home/djpassey/.local/lib/python3.9/site-packages (from fugue>=0.8.1->statsforecast->interfere==0.0.1) (0.2.4)
Requirement already satisfied: contourpy>=1.0.1 in /nas/longleaf/home/djpassey/.local/lib/python3.9/site-packages (from matplotlib>=3.0.0->pyclustering@ git+https://github.com/djpasseyjr/pyclustering->interfere==0.0.1) (1.2.0)
Requirement already satisfied: cycler>=0.10 in /nas/longleaf/home/djpassey/.local/lib/python3.9/site-packages (from matplotlib>=3.0.0->pyclustering@ git+https://github.com/djpasseyjr/pyclustering->interfere==0.0.1) (0.12.1)
Requirement already satisfied: fonttools>=4.22.0 in /nas/longleaf/home/djpassey/.local/lib/python3.9/site-packages (from matplotlib>=3.0.0->pyclustering@ git+https://github.com/djpasseyjr/pyclustering->interfere==0.0.1) (4.47.2)
Requirement already satisfied: kiwisolver>=1.3.1 in /nas/longleaf/home/djpassey/.local/lib/python3.9/site-packages (from matplotlib>=3.0.0->pyclustering@ git+https://github.com/djpasseyjr/pyclustering->interfere==0.0.1) (1.4.5)
Requirement already satisfied: pyparsing>=2.3.1 in /nas/longleaf/home/djpassey/.local/lib/python3.9/site-packages (from matplotlib>=3.0.0->pyclustering@ git+https://github.com/djpasseyjr/pyclustering->interfere==0.0.1) (3.1.1)
Requirement already satisfied: llvmlite<0.44,>=0.43.0dev0 in /nas/longleaf/home/djpassey/.local/lib/python3.9/site-packages (from numba>=0.55.0->statsforecast->interfere==0.0.1) (0.43.0)
Requirement already satisfied: six in /nas/longleaf/home/djpassey/.local/lib/python3.9/site-packages (from patsy>=0.5.4->statsmodels->interfere==0.0.1) (1.16.0)
Requirement already satisfied: PyYAML>=5.4 in /nas/longleaf/rhel8/apps/anaconda/2021.11/lib/python3.9/site-packages (from pytorch-lightning>=2.0.0->neuralforecast->interfere==0.0.1) (6.0)
Requirement already satisfied: torchmetrics>=0.7.0 in /nas/longleaf/home/djpassey/.local/lib/python3.9/site-packages (from pytorch-lightning>=2.0.0->neuralforecast->interfere==0.0.1) (1.4.0.post0)
Requirement already satisfied: lightning-utilities>=0.10.0 in /nas/longleaf/home/djpassey/.local/lib/python3.9/site-packages (from pytorch-lightning>=2.0.0->neuralforecast->interfere==0.0.1) (0.11.6)
Requirement already satisfied: click>=7.0 in /nas/longleaf/home/djpassey/.local/lib/python3.9/site-packages (from ray>=2.2.0->ray[tune]>=2.2.0->neuralforecast->interfere==0.0.1) (8.1.7)
Requirement already satisfied: filelock in /nas/longleaf/home/djpassey/.local/lib/python3.9/site-packages (from ray>=2.2.0->ray[tune]>=2.2.0->neuralforecast->interfere==0.0.1) (3.13.1)
Requirement already satisfied: jsonschema in /nas/longleaf/rhel8/apps/anaconda/2021.11/lib/python3.9/site-packages (from ray>=2.2.0->ray[tune]>=2.2.0->neuralforecast->interfere==0.0.1) (3.2.0)
Requirement already satisfied: msgpack<2.0.0,>=1.0.0 in /nas/longleaf/rhel8/apps/anaconda/2021.11/lib/python3.9/site-packages (from ray>=2.2.0->ray[tune]>=2.2.0->neuralforecast->interfere==0.0.1) (1.0.2)
Requirement already satisfied: protobuf!=3.19.5,>=3.15.3 in /nas/longleaf/home/djpassey/.local/lib/python3.9/site-packages (from ray>=2.2.0->ray[tune]>=2.2.0->neuralforecast->interfere==0.0.1) (5.27.3)
Requirement already satisfied: aiosignal in /nas/longleaf/home/djpassey/.local/lib/python3.9/site-packages (from ray>=2.2.0->ray[tune]>=2.2.0->neuralforecast->interfere==0.0.1) (1.3.1)
Requirement already satisfied: frozenlist in /nas/longleaf/home/djpassey/.local/lib/python3.9/site-packages (from ray>=2.2.0->ray[tune]>=2.2.0->neuralforecast->interfere==0.0.1) (1.4.1)
Requirement already satisfied: requests in /nas/longleaf/rhel8/apps/anaconda/2021.11/lib/python3.9/site-packages (from ray>=2.2.0->ray[tune]>=2.2.0->neuralforecast->interfere==0.0.1) (2.26.0)
Requirement already satisfied: tensorboardX>=1.9 in /nas/longleaf/home/djpassey/.local/lib/python3.9/site-packages (from ray[tune]>=2.2.0->neuralforecast->interfere==0.0.1) (2.6.2.2)
Requirement already satisfied: pyarrow>=6.0.1 in /nas/longleaf/home/djpassey/.local/lib/python3.9/site-packages (from ray[tune]>=2.2.0->neuralforecast->interfere==0.0.1) (15.0.0)
Requirement already satisfied: sympy in /nas/longleaf/home/djpassey/.local/lib/python3.9/site-packages (from torch>=2.0.0->neuralforecast->interfere==0.0.1) (1.12)
Requirement already satisfied: networkx in /nas/longleaf/home/djpassey/.local/lib/python3.9/site-packages (from torch>=2.0.0->neuralforecast->interfere==0.0.1) (3.2.1)
Requirement already satisfied: jinja2 in /nas/longleaf/home/djpassey/.local/lib/python3.9/site-packages (from torch>=2.0.0->neuralforecast->interfere==0.0.1) (3.1.3)
Requirement already satisfied: nvidia-cuda-nvrtc-cu12==12.1.105 in /nas/longleaf/home/djpassey/.local/lib/python3.9/site-packages (from torch>=2.0.0->neuralforecast->interfere==0.0.1) (12.1.105)
Requirement already satisfied: nvidia-cuda-runtime-cu12==12.1.105 in /nas/longleaf/home/djpassey/.local/lib/python3.9/site-packages (from torch>=2.0.0->neuralforecast->interfere==0.0.1) (12.1.105)
Requirement already satisfied: nvidia-cuda-cupti-cu12==12.1.105 in /nas/longleaf/home/djpassey/.local/lib/python3.9/site-packages (from torch>=2.0.0->neuralforecast->interfere==0.0.1) (12.1.105)
Requirement already satisfied: nvidia-cudnn-cu12==8.9.2.26 in /nas/longleaf/home/djpassey/.local/lib/python3.9/site-packages (from torch>=2.0.0->neuralforecast->interfere==0.0.1) (8.9.2.26)
Requirement already satisfied: nvidia-cublas-cu12==12.1.3.1 in /nas/longleaf/home/djpassey/.local/lib/python3.9/site-packages (from torch>=2.0.0->neuralforecast->interfere==0.0.1) (12.1.3.1)
Requirement already satisfied: nvidia-cufft-cu12==11.0.2.54 in /nas/longleaf/home/djpassey/.local/lib/python3.9/site-packages (from torch>=2.0.0->neuralforecast->interfere==0.0.1) (11.0.2.54)
Requirement already satisfied: nvidia-curand-cu12==10.3.2.106 in /nas/longleaf/home/djpassey/.local/lib/python3.9/site-packages (from torch>=2.0.0->neuralforecast->interfere==0.0.1) (10.3.2.106)
Requirement already satisfied: nvidia-cusolver-cu12==11.4.5.107 in /nas/longleaf/home/djpassey/.local/lib/python3.9/site-packages (from torch>=2.0.0->neuralforecast->interfere==0.0.1) (11.4.5.107)
Requirement already satisfied: nvidia-cusparse-cu12==12.1.0.106 in /nas/longleaf/home/djpassey/.local/lib/python3.9/site-packages (from torch>=2.0.0->neuralforecast->interfere==0.0.1) (12.1.0.106)
Requirement already satisfied: nvidia-nccl-cu12==2.18.1 in /nas/longleaf/home/djpassey/.local/lib/python3.9/site-packages (from torch>=2.0.0->neuralforecast->interfere==0.0.1) (2.18.1)
Requirement already satisfied: nvidia-nvtx-cu12==12.1.105 in /nas/longleaf/home/djpassey/.local/lib/python3.9/site-packages (from torch>=2.0.0->neuralforecast->interfere==0.0.1) (12.1.105)
Requirement already satisfied: triton==2.1.0 in /nas/longleaf/home/djpassey/.local/lib/python3.9/site-packages (from torch>=2.0.0->neuralforecast->interfere==0.0.1) (2.1.0)
Requirement already satisfied: nvidia-nvjitlink-cu12 in /nas/longleaf/home/djpassey/.local/lib/python3.9/site-packages (from nvidia-cusolver-cu12==11.4.5.107->torch>=2.0.0->neuralforecast->interfere==0.0.1) (12.3.101)
Requirement already satisfied: alembic>=1.5.0 in /nas/longleaf/home/djpassey/.local/lib/python3.9/site-packages (from optuna->neuralforecast->interfere==0.0.1) (1.13.2)
Requirement already satisfied: colorlog in /nas/longleaf/home/djpassey/.local/lib/python3.9/site-packages (from optuna->neuralforecast->interfere==0.0.1) (6.8.2)
Requirement already satisfied: sqlalchemy>=1.3.0 in /nas/longleaf/rhel8/apps/anaconda/2021.11/lib/python3.9/site-packages (from optuna->neuralforecast->interfere==0.0.1) (1.4.22)
Requirement already satisfied: Mako in /nas/longleaf/home/djpassey/.local/lib/python3.9/site-packages (from alembic>=1.5.0->optuna->neuralforecast->interfere==0.0.1) (1.3.5)
Requirement already satisfied: aiohttp!=4.0.0a0,!=4.0.0a1 in /nas/longleaf/home/djpassey/.local/lib/python3.9/site-packages (from fsspec[http]>=2022.5.0->pytorch-lightning>=2.0.0->neuralforecast->interfere==0.0.1) (3.10.0)
Requirement already satisfied: zipp>=3.1.0 in /nas/longleaf/home/djpassey/.local/lib/python3.9/site-packages (from importlib_resources->coreforecast>=0.0.6->neuralforecast->interfere==0.0.1) (3.17.0)
Requirement already satisfied: setuptools in /nas/longleaf/rhel8/apps/anaconda/2021.11/lib/python3.9/site-packages (from lightning-utilities>=0.10.0->pytorch-lightning>=2.0.0->neuralforecast->interfere==0.0.1) (58.0.4)
Requirement already satisfied: greenlet!=0.4.17 in /nas/longleaf/rhel8/apps/anaconda/2021.11/lib/python3.9/site-packages (from sqlalchemy>=1.3.0->optuna->neuralforecast->interfere==0.0.1) (1.1.1)
Requirement already satisfied: fs in /nas/longleaf/home/djpassey/.local/lib/python3.9/site-packages (from triad>=0.9.7->fugue>=0.8.1->statsforecast->interfere==0.0.1) (2.4.16)
Requirement already satisfied: MarkupSafe>=2.0 in /nas/longleaf/home/djpassey/.local/lib/python3.9/site-packages (from jinja2->torch>=2.0.0->neuralforecast->interfere==0.0.1) (2.1.3)
Requirement already satisfied: attrs>=17.4.0 in /nas/longleaf/rhel8/apps/anaconda/2021.11/lib/python3.9/site-packages (from jsonschema->ray>=2.2.0->ray[tune]>=2.2.0->neuralforecast->interfere==0.0.1) (21.2.0)
Requirement already satisfied: pyrsistent>=0.14.0 in /nas/longleaf/rhel8/apps/anaconda/2021.11/lib/python3.9/site-packages (from jsonschema->ray>=2.2.0->ray[tune]>=2.2.0->neuralforecast->interfere==0.0.1) (0.18.0)
Requirement already satisfied: urllib3<1.27,>=1.21.1 in /nas/longleaf/rhel8/apps/anaconda/2021.11/lib/python3.9/site-packages (from requests->ray>=2.2.0->ray[tune]>=2.2.0->neuralforecast->interfere==0.0.1) (1.26.7)
Requirement already satisfied: certifi>=2017.4.17 in /nas/longleaf/rhel8/apps/anaconda/2021.11/lib/python3.9/site-packages (from requests->ray>=2.2.0->ray[tune]>=2.2.0->neuralforecast->interfere==0.0.1) (2021.10.8)
Requirement already satisfied: charset-normalizer~=2.0.0 in /nas/longleaf/rhel8/apps/anaconda/2021.11/lib/python3.9/site-packages (from requests->ray>=2.2.0->ray[tune]>=2.2.0->neuralforecast->interfere==0.0.1) (2.0.4)
Requirement already satisfied: idna<4,>=2.5 in /nas/longleaf/rhel8/apps/anaconda/2021.11/lib/python3.9/site-packages (from requests->ray>=2.2.0->ray[tune]>=2.2.0->neuralforecast->interfere==0.0.1) (3.2)
Requirement already satisfied: mpmath>=0.19 in /nas/longleaf/home/djpassey/.local/lib/python3.9/site-packages (from sympy->torch>=2.0.0->neuralforecast->interfere==0.0.1) (1.3.0)
Requirement already satisfied: aiohappyeyeballs>=2.3.0 in /nas/longleaf/home/djpassey/.local/lib/python3.9/site-packages (from aiohttp!=4.0.0a0,!=4.0.0a1->fsspec[http]>=2022.5.0->pytorch-lightning>=2.0.0->neuralforecast->interfere==0.0.1) (2.3.4)
Requirement already satisfied: multidict<7.0,>=4.5 in /nas/longleaf/home/djpassey/.local/lib/python3.9/site-packages (from aiohttp!=4.0.0a0,!=4.0.0a1->fsspec[http]>=2022.5.0->pytorch-lightning>=2.0.0->neuralforecast->interfere==0.0.1) (6.0.5)
Requirement already satisfied: yarl<2.0,>=1.0 in /nas/longleaf/home/djpassey/.local/lib/python3.9/site-packages (from aiohttp!=4.0.0a0,!=4.0.0a1->fsspec[http]>=2022.5.0->pytorch-lightning>=2.0.0->neuralforecast->interfere==0.0.1) (1.9.4)
Requirement already satisfied: async-timeout<5.0,>=4.0 in /nas/longleaf/home/djpassey/.local/lib/python3.9/site-packages (from aiohttp!=4.0.0a0,!=4.0.0a1->fsspec[http]>=2022.5.0->pytorch-lightning>=2.0.0->neuralforecast->interfere==0.0.1) (4.0.3)
Requirement already satisfied: appdirs~=1.4.3 in /nas/longleaf/rhel8/apps/anaconda/2021.11/lib/python3.9/site-packages (from fs->triad>=0.9.7->fugue>=0.8.1->statsforecast->interfere==0.0.1) (1.4.4)
Building wheels for collected packages: interfere
  Building wheel for interfere (pyproject.toml): started
  Building wheel for interfere (pyproject.toml): finished with status 'done'
  Created wheel for interfere: filename=interfere-0.0.1-py3-none-any.whl size=99891 sha256=cbed903fe0438e6b353f9a852567dc49392d13c62b40b75ed9550138267c442e
  Stored in directory: /nas/longleaf/home/djpassey/.cache/pip/wheels/dd/8f/6a/6a234017a78a225deb87b1063b62c7582de49273014e5082c3
Successfully built interfere
WARNING: Ignoring invalid distribution -latformdirs (/nas/longleaf/home/djpassey/.local/lib/python3.9/site-packages)
DEPRECATION: pyodbc 4.0.0-unsupported has a non-standard version number. pip 24.1 will enforce this behaviour change. A possible replacement is to upgrade to a newer version of pyodbc or contact the author to suggest that they release a version with a conforming version number. Discussion can be found at https://github.com/pypa/pip/issues/12063
Installing collected packages: interfere
Successfully installed interfere-0.0.1
WARNING: Ignoring invalid distribution -latformdirs (/nas/longleaf/home/djpassey/.local/lib/python3.9/site-packages)

[notice] A new release of pip is available: 24.0 -> 24.2
[notice] To update, run: pip install --upgrade pip
Defaulting to user installation because normal site-packages is not writeable
WARNING: Ignoring invalid distribution -latformdirs (/nas/longleaf/home/djpassey/.local/lib/python3.9/site-packages)
WARNING: Ignoring invalid distribution -latformdirs (/nas/longleaf/home/djpassey/.local/lib/python3.9/site-packages)
Collecting git+https://www.github.com/djpasseyjr/interfere_experiments.git
  Cloning https://www.github.com/djpasseyjr/interfere_experiments.git to /tmp/pip-req-build-t2t8caaj
  Running command git clone --filter=blob:none --quiet https://www.github.com/djpasseyjr/interfere_experiments.git /tmp/pip-req-build-t2t8caaj
  warning: redirecting to https://github.com/djpasseyjr/interfere_experiments.git/
  Resolved https://www.github.com/djpasseyjr/interfere_experiments.git to commit 82e38dfc5b233a3863c6930f072b9a2f18790813
  Installing build dependencies: started
  Installing build dependencies: finished with status 'done'
  Getting requirements to build wheel: started
  Getting requirements to build wheel: finished with status 'done'
  Preparing metadata (pyproject.toml): started
  Preparing me